"premium","picture","title","url"
"False","True","""J'ai cru que c'était un faux"": un corps de femme décapité et démembré découvert par des adolescents","https://www.bfmtv.com/police-justice/j-ai-cru-que-c-etait-un-faux-l-adolescent-qui-a-decouvert-un-corps-decapite-et-demembre-temoigne_AN-202209200342.html"
"False","True","EN DIRECT - Mise en cause de Bayou par Rousseau: EELV assure ""continuer son travail d'enquête""","https://www.bfmtv.com/politique/adrien-quatennens-mathilde-panot-va-s-exprimer-apres-sa-mise-en-cause-dans-des-violences-conjugales_LN-202209200216.html"
"False","True","Violences conjugales: Adrien Quatennens a-t-il toujours un avenir politique?","https://www.bfmtv.com/politique/violences-conjugales-adrien-quatennens-a-t-il-toujours-un-avenir-politique_AV-202209200180.html"
"False","True","Violences faites aux femmes: le patron d'EELV Julien Bayou mis en cause par Sandrine Rousseau","https://www.bfmtv.com/politique/europe-ecologie-les-verts/violences-faites-aux-femmes-le-patron-d-eelv-julien-bayou-mis-en-cause-par-sandrine-rousseau_AV-202209200077.html"
"False","True","""Ses mots, pas les miens"": Clémentine Autain prend ses distances avec Jean-Luc Mélenchon sur l'affaire Quatennens","https://www.bfmtv.com/politique/la-france-insoumise/ce-sont-ses-mots-pas-les-miens-clementine-autain-prend-ses-distances-avec-jean-luc-melenchon-sur-l-affaire-quatennens_AN-202209200111.html"
"False","True","Ukraine: référendums d'annexion par la Russie dans le Donbass du 23 au 27 septembre","https://www.bfmtv.com/international/asie/russie/ukraine-referendums-d-annexion-par-la-russie-dans-le-donbass-du-23-au-27-septembre_AD-202209200358.html"
"False","True","""C'est couillu mais dangereux"": la Macronie se divise sur la méthode pour la réforme des retraites","https://www.bfmtv.com/politique/c-est-couillu-mais-dangereux-la-macronie-se-divise-sur-la-methode-pour-la-reforme-des-retraites_AN-202209200433.html"
"False","True","Nord: un policier grièvement blessé après avoir été percuté lors d'un refus d'obtempérer à Anzin","https://www.bfmtv.com/grand-lille/nord-un-policier-dans-un-etat-critique-apres-avoir-ete-percute-lors-d-un-refus-d-obtemperer-a-anzin_AN-202209200080.html"
"False","True","Météo: vers un nouvel épisode méditerranéen ce week-end?","https://www.bfmtv.com/meteo/meteo-vers-un-nouvel-episode-mediterraneen-ce-week-end_AV-202209200089.html"
"False","True","Honor 70 5G : offre limitée à saisir chez SFR, le smartphone ne coûte que 1 euro !","https://www.bfmtv.com/tech/bons-plans/honor-70-5g-offre-limitee-a-saisir-chez-sfr-le-smartphone-ne-coute-que-1-euro_AB-202209160019.html"
"False","True","TOUT COMPRENDRE - Le conflit entre Kylian Mbappé et la FFF sur les sponsors et les droits à l'image","https://rmcsport.bfmtv.com/football/equipe-de-france/tout-comprendre-le-conflit-entre-kylian-mbappe-et-la-fff-sur-les-sponsors-en-equipe-de-france_AV-202209190471.html"
"False","False","Equipe de France: Mbappé fait plier la FFF sur les droits à l'image","https://rmcsport.bfmtv.com/football/equipe-de-france/equipe-de-france-mbappe-fait-plier-la-fff-sur-les-droits-a-l-image_AV-202209190632.html"
"False","True","""La sobriété, ce n'est pas 'arrêter de vivre'"". La ministre de la Transition énergétique Agnès Pannier-Runacher","https://www.bfmtv.com/economie/agnes-pannier-runacher-sur-l-extinction-de-la-tour-eiffel-la-sobriete-ce-n-est-pas-arreter-de-vivre_AV-202209160222.html"
"False","True","""24 heures sur un brancard, sans rien manger"": une résistante de 98 ans raconte son…","https://www.bfmtv.com/sante/24-heures-sur-un-brancard-sans-rien-manger-une-resistante-de-98-ans-raconte-son-calvaire-dans-un-hopital-parisien_AN-202209200313.html"
"False","True","""Je fais tout pour que Nestlé se retrouve face à moi"": le combat du père de Nathan, mort…","https://www.bfmtv.com/sante/je-fais-tout-pour-que-nestle-se-retrouve-face-a-moi-le-combat-du-pere-de-nathan-mort-a-cause-d-une-pizza-buitoni_AV-202209200121.html"
"False","True","Antibes: un homme suspecté du meurtre de sa compagne, un corps retrouvé dans un…","https://www.bfmtv.com/cote-d-azur/antibes-un-homme-suspecte-du-meurtre-de-sa-compagne-un-corps-retrouve-dans-un-refrigerateur_AN-202209200299.html"
"False","True","""Je revois bien la scène"": au procès du drame de Millas, la conductrice du car nie avoir…","https://www.bfmtv.com/police-justice/proces/je-revois-bien-la-scene-au-proces-du-drame-de-millas-la-conductrice-du-car-nie-avoir-force-le-passage-a-niveau_AV-202209200267.html"
"False","True","""C'est miraculeux"": le rorqual échoué dans le Finistère a retrouvé le large cette nuit","https://www.bfmtv.com/animaux/c-est-miraculeux-le-rorqual-echoue-dans-le-finistere-a-retrouve-le-large-cette-nuit_AV-202209200241.html"
"False","True","""Que les anges chantent votre repos"": la famille royale publie une ultime photo de la…","https://www.bfmtv.com/people/tetes-couronnees/que-les-anges-chantent-votre-repos-la-famille-royale-publie-une-ultime-photo-de-la-reine-elizabeth-ii_AV-202209200033.html"
"False","True","Funérailles d'Elizabeth II: pourquoi la famille royale refuse la rediffusion de certaines…","https://www.bfmtv.com/people/tetes-couronnees/funerailles-d-elizabeth-ii-pourquoi-la-famille-royale-refuse-la-rediffusion-de-certaines-images_AN-202209200286.html"
"False","True","Télésièges ralentis, forfaits plus chers: comment les stations de ski s'adaptent à la…","https://www.bfmtv.com/economie/telesieges-ralentis-forfaits-plus-chers-comment-les-stations-de-ski-s-adaptent-a-la-flambee-de-l-energie_AV-202209200022.html"
"False","True","Faut-il faire confiance aux applications de reconnaissance des champignons?","https://www.bfmtv.com/tech/faut-il-faire-confiance-aux-applications-de-reconnaissance-des-champignons_AV-202209180023.html"
"False","True","Café, confiture, céréales… Les produits phares du petit-déjeuner n'échappent pas à…","https://www.bfmtv.com/economie/consommation/cafe-confiture-cereales-les-produits-phares-du-petit-dejeuner-n-echappent-pas-a-l-inflation_AV-202209180088.html"
"False","True","Cela faisait presque 10 ans qu'il n'avait pas fait aussi froid un matin de septembre","https://www.bfmtv.com/meteo/cela-faisait-presque-10-ans-qu-il-n-avait-pas-fait-aussi-froid-un-matin-de-septembre_AN-202209180258.html"
"False","True","Camilla et Meghan, cibles de violentes attaques sur TikTok depuis la mort d'Elizabeth II","https://www.bfmtv.com/people/tetes-couronnees/camilla-et-meghan-cibles-de-violentes-attaques-sur-tik-tok-depuis-la-mort-d-elizabeth-ii_AV-202209180161.html"
"False","True","Pizzas Buitoni contaminées: un avocat de victimes réclame 250 millions d’euros à Nestlé","https://www.bfmtv.com/police-justice/pizzas-buitoni-contaminees-un-avocat-de-victimes-reclame-250-millions-d-euros-a-nestle_AV-202209180147.html"
"False","True","Magasins fermés, vols annulés... Comment le Royaume-Uni va s'arrêter pendant les funérailles d'Elizabeth II","https://www.bfmtv.com/economie/magasins-fermes-vols-annules-comment-le-royaume-uni-va-s-arreter-pendant-les-funerailles-d-elizabeth-ii_AV-202209190024.html"
"False","True","L'inflation en août finalement un peu plus forte que prévu","https://www.bfmtv.com/economie/economie-social/france/l-inflation-en-aout-finalement-un-peu-plus-forte-que-prevue_AV-202209150180.html"
"False","True","La hausse des frais bancaires plafonnée à 2% en 2023, annonce Bruno Le Maire","https://www.bfmtv.com/economie/la-hausse-des-frais-bancaires-plafonnee-a-2-en-2023-annonce-bruno-le-maire_AD-202209130381.html"
"False","True","Luc Rémont va être nommé à la tête d’EDF","https://www.bfmtv.com/economie/luc-remont-va-etre-nomme-a-la-tete-d-edf_AN-202209090450.html"
"False","True","Etats-Unis: fort ralentissement des créations d'emplois en août","https://www.bfmtv.com/economie/emploi/etats-unis-fort-ralentissement-des-creations-d-emplois-en-aout_AD-202209020431.html"
"False","True","Equipe de France: courtisé par la Belgique, famille de footballeurs... les choses à savoir sur Truffert, nouvel appelé avec…","https://rmcsport.bfmtv.com/football/equipe-de-france/equipe-de-france-courtise-par-la-belgique-famille-de-footballeurs-les-choses-a-savoir-sur-truffert-nouvel-appele-avec-les-bleus_AV-202209200264.html"
"False","True","Affaire Hamraoui-Diallo: la somme dérisoire reçue par l’un des agresseurs de Hamraoui pour l'agresser","https://rmcsport.bfmtv.com/football/feminin/affaire-hamraoui-diallo-la-somme-derisoire-recue-par-l-un-des-agresseurs-de-hamraoui-pour-l-agresser_AV-202209200220.html"
"False","True","Affaire Hamraoui-Diallo: l'auteur des coups à la barre de fer pourrait être lié au grand banditisme","https://rmcsport.bfmtv.com/football/feminin/affaire-hamraoui-diallo-l-auteur-des-coups-a-la-barre-de-fer-pourrait-etre-lie-au-grand-banditisme_AV-202209200124.html"
"False","True","Ligue 1: le ballet de l'Opéra de Paris se moque du PSG sur le char à voile","https://rmcsport.bfmtv.com/football/ligue-1-le-ballet-de-l-opera-de-paris-se-moque-du-psg-sur-le-char-a-voile_AV-202209200352.html"
"False","True","Judo: ""S'il faut que je monte sur les tapis en 2024 avec une jambe cassée, je le ferai"", lance Riner en vue des JO","https://rmcsport.bfmtv.com/judo/judo-s-il-faut-que-je-monte-sur-les-tapis-en-2024-avec-une-jambe-cassee-je-le-ferai-lance-riner-en-vue-des-jo_AV-202209200373.html"
"False","True","Ligne rouge - William et Harry, les frères ennemis","https://www.bfmtv.com/people/tetes-couronnees/ligne-rouge-william-et-harry-les-freres-ennemis_GN-202208290703.html"
"False","True","Carte. Incendies en Gironde : que représentent les 20.600 hectares déjà brûlés ?","https://www.bfmtv.com/meteo/canicule/carte-que-representent-les-15-200-hectares-brules-en-gironde-par-rapport-aux-grandes-villes-francaises_AN-202207180497.html"
"False","True","Avant/Après. Incendies en Gironde : l'étendue des dégâts vue par satellite","https://www.bfmtv.com/environnement/climat/avant-apres-incendies-en-gironde-l-etendue-des-degats-vue-par-satellite_GN-202207190372.html"
"False","True","Le Tour de France, une bonne affaire pour les villes-étapes","https://www.bfmtv.com/economie/entreprises/culture-loisirs/le-tour-de-france-une-bonne-affaire-pour-les-villes-etapes_GN-202207050023.html"
"False","True","""J'ai pleuré tous les soirs pendants un an"" : fausses couches, vraies souffrances","https://www.bfmtv.com/societe/j-ai-pleure-tous-les-soirs-pendant-un-an-fausse-couche-vraies-souffrances_AN-202206230011.html"
"False","True","Lascaux, Chauvet, Cosquer...Le nouvel eldorado touristique des grottes préhistoriques","https://www.bfmtv.com/economie/lascaux-chauvet-cosquer-le-nouvel-eldorado-touristique-des-grottes-prehistoriques_GN-202206040051.html"
"False","True","Elton John en concert vendredi à la Maison Blanche","https://www.bfmtv.com/people/musique/elton-john-en-concert-vendredi-a-la-maison-blanche_AD-202209200429.html"
"False","True","Lyon: Benjamin Biolay de retour aux Nuits de Fourvière en juillet prochain","https://www.bfmtv.com/lyon/lyon-benjamin-biolay-de-retour-aux-nuits-de-fourviere-en-juillet-prochain_AV-202209200427.html"
"False","True","Mort d'Elizabeth II: David, Victoria et Brooklyn Beckham rendent hommage à la reine","https://www.bfmtv.com/people/tetes-couronnees/mort-d-elizabeth-ii-david-victoria-et-brooklyn-beckham-rendent-hommage-a-la-reine_AN-202209200369.html"
"False","True","Une superstar russe contre poutine - 20/09","https://www.bfmtv.com/replay-emissions/le-dej-info/une-superstar-russe-contre-poutine-20-09_VN-202209200318.html"
"False","True","Funérailles d'Elizabeth II: pourquoi la famille royale refuse la rediffusion de certaines images","https://www.bfmtv.com/people/tetes-couronnees/funerailles-d-elizabeth-ii-pourquoi-la-famille-royale-refuse-la-rediffusion-de-certaines-images_AN-202209200286.html"
"False","True","Fizencia : accompagner les entreprises de la comptabilité à la stratégie","https://www.bfmtv.com/pratique/entreprises-d-avenir/fizencia-accompagner-les-entreprises-de-la-comptabilite-a-la-strategie_AB-202209200006.html"
"False","True","Wolf Group : We save energy !","https://www.bfmtv.com/economie/entreprises/wolf-group-we-save-energy_AO-202209190021.html"
"False","True","Hans coffrage - Le bois au service du béton","https://www.bfmtv.com/economie/entreprises/hans-coffrage-le-bois-au-service-du-beton_AO-202209190001.html"
