"premium","picture","title","url"
"False","True","EN DIRECT - Borne prévient que la France veut ""rendre le coût de la guerre insupportable pour la Russie""","https://www.bfmtv.com/politique/en-direct-les-deputes-font-leur-rentree-a-l-assemblee-nationale_LN-202210030116.html"
"False","True","Budget, assurance chômage, éoliennes... Les dossiers chauds de la rentrée des députés","https://www.bfmtv.com/politique/parlement/budget-assurance-chomage-eoliennes-les-dossiers-chauds-de-la-rentree-des-deputes_AN-202210020023.html"
"False","True","Affaire MSC: Alexis Kohler mis en examen pour prise illégale d'intérêts","https://www.bfmtv.com/police-justice/armateur-msc-alexis-kohler-mis-en-examen-pour-prise-illegale-d-interets_AN-202210030467.html"
"False","True","La gauche se divise après les huées contre Rousseau lors d'une manifestation en soutien aux Iraniennes","https://www.bfmtv.com/politique/la-gauche-se-divise-apres-les-huees-contre-rousseau-lors-d-une-manifestation-en-soutien-aux-iraniennes_AN-202210030458.html"
"False","True","Après Bruno Le Maire, Emmanuel Macron s'affiche aussi en col roulé","https://www.bfmtv.com/politique/elysee/apres-bruno-le-maire-emmanuel-macron-s-affiche-aussi-en-col-roule_AN-202210030338.html"
"False","True","Covid-19: qui est concerné par la campagne de rappel vaccinal qui débute ce lundi?","https://www.bfmtv.com/sante/covid-19-qui-est-concerne-par-la-campagne-de-rappel-vaccinal-qui-debute-ce-lundi_AV-202210030432.html"
"False","True","Covid, grippe... L'hiver sera-t-il synonyme de retour du masque?","https://www.bfmtv.com/sante/covid-grippe-l-hiver-sera-t-il-synonyme-de-retour-du-masque_AV-202210030245.html"
"False","True","Qui est Brigitte Autran, la présidente du Covars, le comité qui succède au Conseil scientifique?","https://www.bfmtv.com/sante/qui-est-brigitte-autran-la-presidente-du-covars-le-comite-qui-succede-au-conseil-scientifique_AV-202210030341.html"
"False","True","Prix des carburants: gazole et essence en hausse la semaine dernière","https://www.bfmtv.com/auto/prix-des-carburants-gazole-et-essence-en-hausse-la-semaine-derniere_AN-202210030437.html"
"False","True","Victimes du succès de la ristourne, plusieurs stations-essence TotalEnergies manquent de carburant","https://www.bfmtv.com/economie/entreprises/energie/victimes-du-succes-de-la-ristourne-plusieurs-stations-essence-total-energies-manquent-de-carburant_AN-202210030351.html"
"False","True","Céline Quatennens a déposé plainte contre Adrien Quatennens le 26 septembre","https://www.bfmtv.com/politique/celine-quatennens-a-depose-plainte-contre-adrien-quatennens-le-26-septembre_AN-202210030203.html"
"False","True","Une dissolution serait un échec collectif de tous ceux qui siègent à l'Assemblée nationale. Yaël Braun-Pivet","https://www.bfmtv.com/politique/parlement/pour-yael-braun-pivet-une-dissolution-de-l-assemblee-nationale-serait-un-echec-collectif_AV-202210030251.html"
"False","True","Lille, Bordeaux, Marseille… ces villes qui vont boycotter la Coupe du monde au Qatar","https://rmcsport.bfmtv.com/basket/championnats-du-monde/lille-bordeaux-marseille-ces-villes-qui-vont-boycotter-la-coupe-du-monde-au-qatar_AV-202210030311.html"
"False","True","Jugé pour avoir proposé sa fille mineure sur un site libertin, un magistrat voit sa peine…","https://www.bfmtv.com/police-justice/juge-pour-avoir-propose-sa-fille-mineure-sur-un-site-libertin-un-magistrat-voit-sa-peine-allegee-en-appel_AN-202210030473.html"
"False","True","""Si j'avais entendu..."": le fils de l'homme de 92 ans roué de coups par une toxicomane à…","https://www.bfmtv.com/paris/si-j-avais-entendu-le-fils-de-l-homme-de-92-ans-roue-de-coups-par-une-toxicomane-a-paris-s-en-veut-terriblement_AV-202210030281.html"
"False","True","Soupçons de ""prise illégale d'intérêts"": Dupond-Moretti renvoyé devant la Cour de justice…","https://www.bfmtv.com/police-justice/soupcons-de-prise-illegale-d-interets-dupond-moretti-renvoye-devant-la-cour-de-justice-de-la-republique_AN-202210030221.html"
"False","True","Russie: le président tchétchène Kadyrov dit envoyer ses trois fils adolescents sur le…","https://www.bfmtv.com/international/asie/russie/russie-le-president-tchetchene-kadyrov-dit-envoyer-trois-fils-adolescents-sur-le-front-en-ukraine_AD-202210030370.html"
"False","True","Jusqu'à 28°C au sud: le printemps fait son retour cette semaine","https://www.bfmtv.com/meteo/jusqu-a-28deg-c-au-sud-le-printemps-fait-son-retour-cette-semaine_AN-202210030171.html"
"False","True","Seine-Saint-Denis: le rappeur Vegedream agressé dans le hall d'un immeuble à Villetaneuse","https://www.bfmtv.com/paris/seine-saint-denis-le-rappeur-vegedream-agresse-dans-le-hall-d-un-immeuble-a-villetaneuse_AN-202210030401.html"
"False","True","TOUT COMPRENDRE - Des princes déchus de leur titre: pourquoi la famille royale danoise se…","https://www.bfmtv.com/people/tetes-couronnees/tout-comprendre-des-princes-dechus-de-leur-titre-pourquoi-la-famille-royale-danoise-se-dechire_AN-202210030402.html"
"False","True","Jusqu'à 28°C au sud: le printemps fait son retour cette semaine","https://www.bfmtv.com/meteo/jusqu-a-28deg-c-au-sud-le-printemps-fait-son-retour-cette-semaine_AN-202210030171.html"
"False","True","""Si j'avais entendu..."": le fils de l'homme de 92 ans roué de coups par une toxicomane à…","https://www.bfmtv.com/paris/si-j-avais-entendu-le-fils-de-l-homme-de-92-ans-roue-de-coups-par-une-toxicomane-a-paris-s-en-veut-terriblement_AV-202210030281.html"
"False","True","Lille, Bordeaux, Marseille… ces villes qui vont boycotter la Coupe du monde au Qatar","https://rmcsport.bfmtv.com/basket/championnats-du-monde/lille-bordeaux-marseille-ces-villes-qui-vont-boycotter-la-coupe-du-monde-au-qatar_AV-202210030311.html"
"False","True","Des médecins alertent sur les risques liés aux manipulations du cou par des ostéopathes","https://www.bfmtv.com/sante/c-est-dangereux-et-inutile-des-medecins-alertent-sur-les-risques-lies-aux-manipulations-du-cou_AN-202209300010.html"
"False","True","Fini le plastique transparent, les bonbons Quality Street bientôt emballés dans du papier…","https://www.bfmtv.com/economie/consommation/fini-le-plastique-transparent-les-bonbons-quality-street-bientot-emballes-dans-du-papier-recyclable_AN-202210030342.html"
"False","True","Haut-Rhin: les bus et autocars Kunegel passent au biocarburant","https://www.bfmtv.com/alsace/haut-rhin-les-bus-et-autocars-kunegel-passent-au-biocarburant_AV-202210030453.html"
"False","True","Assurance chômage: plus d'un quart des salariés éligibles ne demandent pas à être indemnisés","https://www.bfmtv.com/economie/emploi/assurance-chomage-plus-d-un-quart-des-demandeurs-d-emploi-ne-demandent-pas-a-etre-indemnises_AD-202210030441.html"
"False","True","Prix des carburants: gazole et essence en hausse la semaine dernière","https://www.bfmtv.com/auto/prix-des-carburants-gazole-et-essence-en-hausse-la-semaine-derniere_AN-202210030437.html"
"False","True","Semaine de quatre jours, droit à la déconnexion… la Belgique réforme le droit du travail","https://www.bfmtv.com/economie/emploi/semaine-de-quatre-jours-droit-a-la-deconnexion-la-belgique-reforme-le-droit-du-travail_AV-202210030416.html"
"False","True","Egalité des chances: les salariés français très préoccupés par l'égalité salariale","https://www.bfmtv.com/economie/emploi/egalite-des-chances-les-salaries-francais-tres-preoccupes-par-l-egalite-salariale_AD-202210030409.html"
"False","True","Equipe de France: Clauss, Benzema, Varane… le baromètre des Bleus avant le Mondial","https://rmcsport.bfmtv.com/football/equipe-de-france/equipe-de-france-clauss-benzema-varane-le-barometres-de-bleus-avant-le-mondial_AV-202210030325.html"
"False","True","Lille, Bordeaux, Marseille… ces villes qui vont boycotter la Coupe du monde au Qatar","https://rmcsport.bfmtv.com/basket/championnats-du-monde/lille-bordeaux-marseille-ces-villes-qui-vont-boycotter-la-coupe-du-monde-au-qatar_AV-202210030311.html"
"False","True","Lens-OL: Aulas dit stop au ""bashing"" après la quatrième défaite de suite des Lyonnais","https://rmcsport.bfmtv.com/football/ligue-1/lens-ol-aulas-dit-stop-au-bashing-apres-la-quatrieme-defaite-de-suite-des-lyonnais_AV-202210030062.html"
"False","True","Ligue des champions féminine: de belles affiches pour le PSG et l'OL en phase de groupes","https://rmcsport.bfmtv.com/football/feminin/ligue-des-champions/ligue-des-champions-feminine-de-belles-affiches-pour-le-psg-et-l-ol-en-phase-de-groupes_AP-202210030376.html"
"False","True","Drame dans un stade en Indonésie: des soldats impliqués dans les actes de violence","https://rmcsport.bfmtv.com/football/drame-dans-un-stade-en-indonesie-des-soldats-impliques-dans-les-actes-de-violence_AV-202210030216.html"
"False","True","Ligne rouge - William et Harry, les frères ennemis","https://www.bfmtv.com/people/tetes-couronnees/ligne-rouge-william-et-harry-les-freres-ennemis_GN-202208290703.html"
"False","True","Carte. Incendies en Gironde : que représentent les 20.600 hectares déjà brûlés ?","https://www.bfmtv.com/meteo/canicule/carte-que-representent-les-15-200-hectares-brules-en-gironde-par-rapport-aux-grandes-villes-francaises_AN-202207180497.html"
"False","True","Avant/Après. Incendies en Gironde : l'étendue des dégâts vue par satellite","https://www.bfmtv.com/environnement/climat/avant-apres-incendies-en-gironde-l-etendue-des-degats-vue-par-satellite_GN-202207190372.html"
"False","True","Le Tour de France, une bonne affaire pour les villes-étapes","https://www.bfmtv.com/economie/entreprises/culture-loisirs/le-tour-de-france-une-bonne-affaire-pour-les-villes-etapes_GN-202207050023.html"
"False","True","""J'ai pleuré tous les soirs pendants un an"" : fausses couches, vraies souffrances","https://www.bfmtv.com/societe/j-ai-pleure-tous-les-soirs-pendant-un-an-fausse-couche-vraies-souffrances_AN-202206230011.html"
"False","True","Lascaux, Chauvet, Cosquer...Le nouvel eldorado touristique des grottes préhistoriques","https://www.bfmtv.com/economie/lascaux-chauvet-cosquer-le-nouvel-eldorado-touristique-des-grottes-prehistoriques_GN-202206040051.html"
"False","True","Une vidéo des Beatles au Japon exhumée après des années de bataille judiciaire","https://www.bfmtv.com/people/musique/une-video-inedite-sur-les-beatles-exhumee-au-japon_AD-202210030434.html"
"False","True","TOUT COMPRENDRE - Des princes déchus de leur titre: pourquoi la famille royale danoise se déchire","https://www.bfmtv.com/people/tetes-couronnees/tout-comprendre-des-princes-dechus-de-leur-titre-pourquoi-la-famille-royale-danoise-se-dechire_AN-202210030402.html"
"False","True","Seine-Saint-Denis: le rappeur Vegedream agressé dans le hall d'un immeuble à Villetaneuse","https://www.bfmtv.com/paris/seine-saint-denis-le-rappeur-vegedream-agresse-dans-le-hall-d-un-immeuble-a-villetaneuse_AN-202210030401.html"
"False","True","Cédric Jimenez de retour avec ""Novembre"", sur les attentats de 2015: ""Nous avons attendu la fin du procès""","https://www.bfmtv.com/people/cinema/cedric-jimenez-de-retour-avec-novembre-sur-les-attentats-de-2015-nous-avons-attendu-la-fin-du-proces_AV-202210030378.html"
"False","True","Boycott du Mondial : un mouvement d'ampleur ? - 03/10","https://www.bfmtv.com/replay-emissions/le-dej-info/boycott-du-mondial-un-mouvement-d-ampleur-03-10_VN-202210030347.html"
"False","True","MEDADOM : des bornes de téléconsultation médicale disponibles partout en France","https://www.bfmtv.com/pratique/entreprises-d-avenir/medadom-des-bornes-de-teleconsultation-medicale-disponibles-partout-en-france_AB-202210030002.html"
"False","True","Rosaz Energies : Spécialiste des énergies renouvelables","https://www.bfmtv.com/economie/entreprises/rosaz-energies-specialiste-des-energies-renouvelables_AO-202209300002.html"
"False","True","Hans coffrage - Le bois au service du béton","https://www.bfmtv.com/economie/entreprises/hans-coffrage-le-bois-au-service-du-beton_AO-202209190001.html"
"False","True","Podcast – Découvrez Fanny, créatrice de lingerie écoresponsable en Bretagne qui a pu créer son site…","https://www.bfmtv.com/mediaplayer/audio/fanny-creatrice-de-lingerie-ecoresponsable-en-bretagne-798957.html"
