"premium","picture","title","url"
"False","True","DIRECT - Emmanuel Macron : un dernier Conseil des ministres avant le remaniement","https://www.lefigaro.fr/elections/legislatives/direct-emmanuel-macron-un-dernier-conseil-des-ministres-avant-le-remaniement-20220428"
"False","False","RÉCIT - Le bulletin de notes d’Emmanuel Macron avant le remaniement","https://www.lefigaro.fr/elections/presidentielles/macron-bulletin-de-notes-avant-evaluation-finale-20220427"
"False","False","Le député insoumis François Ruffin désigne Emmanuel Macron comme le «bâtard» de François Hollande","https://www.lefigaro.fr/elections/presidentielles/le-depute-insoumis-francois-ruffin-designe-emmanuel-macron-comme-le-batard-de-francois-hollande-20220428"
"False","False","Le Conseil constitutionnel proclame Emmanuel Macron élu président de la République","https://www.lefigaro.fr/elections/presidentielles/le-conseil-constitutionnel-proclame-emmanuel-macron-elu-president-de-la-republique-20220427"
"False","False","Emmanuel Macron nommera un premier ministre «attaché à la question sociale, environnementale et productive»","https://www.lefigaro.fr/politique/emmanuel-macron-nommera-un-premier-ministre-attache-a-la-question-sociale-environnementale-et-productive-20220427"
"True","True","L’Ukraine brise ses statues soviétiques: le récit de l’envoyé spécial du Figaro","https://www.lefigaro.fr/international/l-ukraine-brise-ses-statues-sovietiques-20220427"
"False","True","DIRECT - Guerre en Ukraine : «La guerre, une absurdité au 21e siècle», déclare le patron de l'ONU en visite près de Kiev","https://www.lefigaro.fr/international/direct-guerre-en-ukraine-kiev-s-attend-a-des-semaines-extremement-difficiles-20220428"
"False","False","LA VÉRIFICATION - L'économie russe est-elle en train de se «stabiliser», comme le dit Vladimir Poutine ?","https://www.lefigaro.fr/conjoncture/l-economie-russe-est-elle-en-train-de-se-stabiliser-comme-le-dit-vladimir-poutine-20220427"
"False","False","ANALYSE - Guerre en Ukraine: les Occidentaux face au risque de cobelligérance","https://www.lefigaro.fr/vox/monde/guerre-en-ukraine-les-occidentaux-face-au-risque-de-cobelligerance-20220427"
"False","False","INFOGRAPHIE - Guerre en Ukraine et bataille du Donbass : les trois cartes pour suivre la situation militaire en direct","https://www.lefigaro.fr/international/guerre-en-ukraine-la-carte-pour-suivre-la-situation-militaire-20220224"
"True","True","Horaires, salaires, concurrence... L'univers démesuré des jeunes banquiers d'affaires","https://www.lefigaro.fr/societes/horaires-salaires-concurrence-l-univers-demesure-des-jeunes-banquiers-d-affaires-20220428"
"False","False","Morts sur le Pont-Neuf : la mise en examen du policier «inadmissible» pour le syndicat Alliance","https://www.lefigaro.fr/flash-actu/morts-sur-le-pont-neuf-la-mise-en-examen-du-policier-inadmissible-pour-le-syndicat-alliance-20220427"
"True","True","Pierre Vermeren: «Les racines culturelles du malaise français»","https://www.lefigaro.fr/vox/societe/pierre-vermeren-les-racines-culturelles-du-malaise-francais-20220427"
"False","True","Législatives 2022 : Reconquête ! ne présentera pas de candidat face à Le Pen, Ciotti et Dupont-Aignan","https://www.lefigaro.fr/elections/legislatives/legislatives-2022-reconquete-ne-presentera-pas-de-candidat-face-a-le-pen-ciotti-et-dupont-aignan-20220427"
"False","False","ENTRETIEN - David Lisnard: «Nous devons définir la raison d’être de la droite»","https://www.lefigaro.fr/elections/presidentielles/david-lisnard-nous-devons-definir-la-raison-d-etre-de-la-droite-20220427"
"False","False","Législatives 2022 : Chevènement lance un nouveau parti pro-Macron, «Refondation républicaine»","https://www.lefigaro.fr/politique/legislatives-2022-chevenement-lance-un-nouveau-parti-pro-macron-refondation-republicaine-20220427"
"False","False","DÉCRYPTAGE - La gauche se recompose dans la douleur en vue des législatives","https://www.lefigaro.fr/elections/presidentielles/la-gauche-se-recompose-dans-la-douleur-en-vue-des-legislatives-20220427"
"False","False","ENTRETIEN - Olivier Faure: «Une coalition n’est pas une soumission»","https://www.lefigaro.fr/politique/olivier-faure-une-coalition-n-est-pas-une-soumission-20220427"
"True","True","La guerre en Ukraine pèse déjà sur l’emploi des cadres","https://www.lefigaro.fr/social/la-guerre-en-ukraine-pese-deja-sur-l-emploi-des-cadres-20220427"
"False","True","Incident sur un vol Air France à l'atterrissage : l'enquête pointe vers une responsabilité des pilotes","https://www.lefigaro.fr/societes/incident-sur-un-vol-air-france-a-l-atterrissage-l-enquete-pointe-vers-une-responsabilite-des-pilotes-20220428"
"False","False","Le crash du vol Paris-Le Caire d'Egyptair aurait été provoqué par la cigarette d'un des pilotes","https://www.lefigaro.fr/international/le-crash-du-vol-paris-le-caire-d-egyptair-aurait-ete-provoque-par-la-cigarette-d-un-des-pilotes-20220427"
"True","True","Pourquoi la Russie évoque-t-elle le spectre d'une Troisième Guerre mondiale ?","https://www.lefigaro.fr/international/pourquoi-la-russie-evoque-t-elle-le-spectre-d-une-troisieme-guerre-mondiale-20220426"
"False","False","Guerre en Ukraine : des victimes de Boutcha tuées par des «obus à fléchettes» ?","https://www.lefigaro.fr/international/guerre-en-ukraine-des-victimes-de-boutcha-tuees-par-des-obus-a-flechettes-20220427"
"True","True","Guerre en Ukraine : des oligarques russes meurent mystérieusement","https://www.lefigaro.fr/international/guerre-en-ukraine-des-oligarques-russes-meurent-mysterieusement-20220426"
"True","True","Guerre en Ukraine : la Russie est-elle le «meilleur fournisseur d'armes» de Kiev ?","https://www.lefigaro.fr/international/guerre-en-ukraine-la-russie-est-elle-le-meilleur-fournisseur-d-armes-de-kiev-20220427"
"False","False","Royaume-Uni : la réforme controversée du droit d'asile en passe d'entrer dans la loi","https://www.lefigaro.fr/flash-actu/royaume-uni-la-reforme-controversee-du-droit-d-asile-en-passe-d-entrer-dans-la-loi-20220428"
"False","False","Le Sri Lanka paralysé par une grève générale appelant au départ du président Rapajaksa","https://www.lefigaro.fr/flash-actu/le-sri-lanka-paralyse-par-une-greve-generale-appelant-au-depart-du-president-rapajaksa-20220428"
"False","False","Le député insoumis François Ruffin désigne Emmanuel Macron comme le «bâtard» de François Hollande","https://www.lefigaro.fr/elections/presidentielles/le-depute-insoumis-francois-ruffin-designe-emmanuel-macron-comme-le-batard-de-francois-hollande-20220428"
"False","False","Procès Brétigny : l'ex-patron de la SNCF Guillaume Pepy exprime sa «très profonde compassion» envers les victimes","https://www.lefigaro.fr/flash-actu/proces-bretigny-l-ex-patron-de-la-sncf-guillaume-pepy-exprime-sa-tres-profonde-compassion-envers-les-victimes-20220428"
"False","False","Human Rights Watch dénonce les «mauvais traitements» réservés aux anti-putsch au Soudan","https://www.lefigaro.fr/flash-actu/human-rights-watch-denonce-les-mauvais-traitements-reserves-aux-anti-putsch-au-soudan-20220428"
"False","False","Guerre en Ukraine : Antonio Guterres est arrivé à Borodianka, dans la banlieue de Kiev","https://www.lefigaro.fr/flash-actu/guerre-en-ukraine-antonio-guterres-est-arrive-a-borodianka-dans-la-banlieue-de-kiev-20220428"
"False","False","Le football brésilien tourne le dos aux entraîneurs noirs","https://www.lefigaro.fr/flash-actu/le-football-bresilien-tourne-le-dos-aux-entraineurs-noirs-20220428"
"False","False","Le groupe ADP recrute 4000 personnes dans ses aéroports","https://www.lefigaro.fr/conjoncture/le-groupe-adp-recrute-4000-personnes-dans-ses-aeroports-20220428"
"False","False","Les cinq lignes de bus transfrontalières entre la France et l'Espagne reconduites","https://www.lefigaro.fr/conjoncture/les-cinq-lignes-de-bus-transfrontalieres-entre-la-france-et-l-espagne-reconduites-20220428"
"False","False","Béziers : quatre nouvelles plaintes pour des piqûres sauvages en discothèques","https://www.lefigaro.fr/faits-divers/beziers-quatre-nouvelles-plaintes-pour-des-piqures-sauvages-en-discotheques-20220428"
"False","False","Incident sur un vol Air France à l'atterrissage : l'enquête pointe vers une responsabilité des pilotes","https://www.lefigaro.fr/societes/incident-sur-un-vol-air-france-a-l-atterrissage-l-enquete-pointe-vers-une-responsabilite-des-pilotes-20220428"
"False","False","En campagne en 2016, Trump avait peur de lancers d'«ananas» et de «tomates» susceptibles de «tuer»","https://www.lefigaro.fr/flash-actu/en-campagne-en-2016-trump-avait-peur-de-lancers-d-ananas-et-de-tomates-susceptibles-de-tuer-20220428"
"False","False","L'Indonésie suspend toutes ses exportations d'huile de palme","https://www.lefigaro.fr/flash-eco/l-indonesie-suspend-toutes-ses-exportations-d-huile-de-palme-20220428"
"False","False","Colombie: une juge ouvre la voie à des poursuites contre l'ex-président Uribe","https://www.lefigaro.fr/flash-actu/colombie-une-juge-ouvre-la-voie-a-des-poursuites-contre-l-ex-president-uribe-20220428"
"False","False","Colombie: un général reconnaît sa responsabilité dans des massacres de civils par l'armée","https://www.lefigaro.fr/flash-actu/colombie-un-general-reconnait-sa-responsabilite-dans-des-massacres-de-civils-par-l-armee-20220428"
"False","False","Elon Musk fait de nouveau scandale en critiquant publiquement des cadres de Twitter","https://www.lefigaro.fr/flash-eco/elon-musk-fait-de-nouveau-scandale-en-critiquant-publiquement-des-cadres-de-twitter-20220428"
"False","False","Biden se rendra en Corée du Sud et au Japon en mai","https://www.lefigaro.fr/flash-eco/biden-se-rendra-en-coree-du-sud-et-au-japon-en-mai-20220428"
"False","False","Maroc: saisie record de plus de 31 tonnes de cannabis","https://www.lefigaro.fr/flash-actu/maroc-saisie-record-de-plus-de-31-tonnes-de-cannabis-20220428"
"False","False","Royaume-Uni : la réforme controversée du droit d'asile en passe d'entrer dans la loi","https://www.lefigaro.fr/flash-actu/royaume-uni-la-reforme-controversee-du-droit-d-asile-en-passe-d-entrer-dans-la-loi-20220428"
"False","False","À l'approche du remaniement, Macron réunit ses ministres autour d'un buffet","https://www.lefigaro.fr/elections/presidentielles/a-l-approche-du-remaniement-macron-reunit-ses-ministres-autour-d-un-buffet-20220427"
"False","False","Erdogan réitère ses accusations contre Kavala après sa condamnation à la perpétuité","https://www.lefigaro.fr/flash-actu/erdogan-reitere-ses-accusations-contre-kavala-apres-sa-condamnation-a-la-perpetuite-20220427"
"False","False","Égypte : plus de 3000 détenus graciés, dont un journaliste","https://www.lefigaro.fr/flash-actu/egypte-plus-de-3000-detenus-gracies-dont-un-journaliste-20220427"
"False","False","Triple homicide à Amiens : le conjoint d'une des victimes placé en garde à vue","https://www.lefigaro.fr/flash-actu/triple-homicide-a-amiens-le-conjoint-d-une-des-victimes-place-en-garde-a-vue-20220427"
"False","False","Gaz russe : réunion extraordinaire des ministres de l'énergie lundi","https://www.lefigaro.fr/flash-eco/gaz-russe-reunion-extraordinaire-des-ministres-de-l-energie-lundi-20220427"
"False","False","Au procès de Brétigny, le cheminot se «sent responsable moralement» de la catastrophe","https://www.lefigaro.fr/faits-divers/au-proces-de-bretigny-le-cheminot-se-sent-responsable-moralement-de-la-catastrophe-20220427"
