"premium","picture","title","url"
"False","True","Appel au ""compromis"", huées... Ce qu'il faut retenir du discours de politique générale d'Élisabeth Borne","https://www.bfmtv.com/politique/gouvernement/appel-au-compromis-huees-ce-qu-il-faut-retenir-du-discours-de-politique-generale-d-elisabeth-borne_AN-202207060524.html"
"False","False","Huées, standing-ovation... L'agitation des députés quand Élisabeth Borne évoque les soignants","https://www.bfmtv.com/politique/huees-standing-ovation-l-agitation-des-deputes-quand-elisabeth-borne-evoque-les-soignants_VN-202207060474.html"
"False","True","EN DIRECT - Borne invite les Français à porter le masque mais exclut une ""mesure nationale d'obligation""","https://www.bfmtv.com/politique/en-direct-elisabeth-borne-a-l-epreuve-du-discours-de-politique-generale-suivez-l-actualite-politique-de-ce-mercredi_LN-202207060081.html"
"False","False","Discours de politique générale: Borne appelle les oppositions à ""bâtir ensemble"" des…","https://www.bfmtv.com/politique/gouvernement/discours-de-politique-generale-borne-appelle-les-oppositions-a-batir-ensemble-des-compromis_AV-202207060448.html"
"False","True","Discours d'Élisabeth Borne: pour Marine Le Pen, la situation du gouvernement est ""hors contrôle""","https://www.bfmtv.com/politique/front-national/discours-d-elisabeth-borne-pour-marine-le-pen-la-situation-du-gouvernement-est-hors-controle_AV-202207060602.html"
"False","True","Mathilde Panot dénonce le ""sauve qui peut"" d'Élisabeth Borne et des ""compromissions"" avec le RN","https://www.bfmtv.com/politique/la-france-insoumise/mathilde-panot-denonce-le-sauve-qui-peut-d-elisabeth-borne-et-des-compromissions-avec-le-rn_AD-202207060584.html"
"False","True","""Nous devrons travailler progressivement un peu plus longtemps"": Elisabeth Borne promet une réforme des retraites…","https://www.bfmtv.com/economie/economie-social/nous-devrons-travailler-progressivement-un-peu-plus-longtemps-elisabeth-borne-promet-une-reforme-des-retraites-dans-la-concertation_AV-202207060467.html"
"False","True","Double meurtre à Pouyastruc: le profil ""dangereux"" du suspect se précise","https://www.bfmtv.com/police-justice/double-meurtre-a-pouyastruc-le-profil-dangereux-du-suspect-se-precise_AV-202207060645.html"
"False","True","Lyssytchansk conquise, nouveau ""rideau de fer""... La situation après 19 semaines de guerre en Ukraine","https://www.bfmtv.com/international/lyssytchansk-conquise-nouveau-rideau-de-fer-la-situation-apres-19-semaines-de-guerre-en-ukraine_AD-202207060725.html"
"False","True","Vent, sécheresse et chaleur: très fort risque d’incendie dans le Sud-Est jusqu’à la fin de la semaine","https://www.bfmtv.com/marseille/vent-secheresse-et-chaleur-tres-fort-risque-d-incendie-dans-le-sud-est-jusqu-a-la-fin-de-la-semaine_AV-202207060364.html"
"False","True","Météo: la vague de chaleur se confirme pour le début de la semaine prochaine","https://www.bfmtv.com/meteo/meteo-la-vague-de-chaleur-se-confirme-pour-le-debut-de-la-semaine-prochaine_AN-202207060494.html"
"False","True","Covid-19: avec 200.000 nouveaux cas en 24h, les experts partagés sur l'idée d'un retour du masque obligatoire","https://www.bfmtv.com/sante/covid-19-avec-200-000-nouveaux-cas-en-24h-faut-il-imposer-le-retour-du-masque-dans-les-transports_AV-202207060337.html"
"False","True","Tour de France (5e étape): Clarke vainqueur sur les pavés après une folle journée, Pogacar solide, Roglic piégé","https://rmcsport.bfmtv.com/cyclisme/tour-de-france/tour-de-france-5e-etape-clarke-vainqueur-sur-les-paves-apres-une-folle-journee-pogacar-en-forme-roglic-perd-gros_AV-202207060576.html"
"False","True","""Nous respectons ce que demandent les femmes"". Mathilde Panot répond à Taha Bouhafs, qui accuse LFI de ne pas l'avoir laissé se défendre face aux accusations de violences sexuelles","https://www.bfmtv.com/politique/la-france-insoumise/nous-respectons-ce-que-demandent-les-femmes-mathilde-panot-repond-a-taha-bouhafs-accuse-de-violences-sexuelles_AP-202207060240.html"
"False","True","Qu'est-ce que l'affaire #BalanceTonInfluenceur, qui agite les réseaux sociaux?","https://www.bfmtv.com/tech/actualites/reseaux-sociaux/qu-est-ce-que-l-affaire-balance-ton-influenceur-qui-agite-les-reseaux-sociaux_AN-202207060442.html"
"False","True","TGV, TER, Ouigo, RER: le point sur la journée de grève à la SNCF","https://www.bfmtv.com/economie/entreprises/transports/tgv-ter-ouigo-rer-le-point-sur-la-journee-de-greve-a-la-sncf_AD-202207060038.html"
"False","True","Grève à la SNCF: vaut-il mieux se faire rembourser ou échanger son billet?","https://www.bfmtv.com/economie/entreprises/transports/greve-a-la-sncf-vaut-il-mieux-se-faire-rembourser-ou-echanger-son-billet_AV-202207060426.html"
"False","True","Variole du singe: les règles à suivre si vous êtes malade ou cas contact","https://www.bfmtv.com/sante/variole-du-singe-les-regles-a-suivre-si-vous-etes-malade-ou-cas-contact_AN-202207060104.html"
"False","True","""Elle doit avoir une deuxième chance"": la mère d'Emilie König ""soulagée"" du retour de sa…","https://www.bfmtv.com/international/moyen-orient/syrie/elle-doit-avoir-une-deuxieme-chance-la-mere-d-emilie-konig-soulagee-du-retour-de-sa-fille-en-france_AD-202207060248.html"
"False","True","Glacier effondré en Italie: le bilan passe à neuf morts, trois personnes toujours…","https://www.bfmtv.com/environnement/glacier-effondre-en-italie-le-bilan-passe-a-neuf-morts-trois-personnes-toujours-disparues_AD-202207060674.html"
"False","True","Mis sous pression par plusieurs ministres, Boris Johnson refuse de démissionner","https://www.bfmtv.com/international/europe/angleterre/mis-sous-pression-par-plusieurs-ministres-boris-johnson-refuse-de-demissionner_AD-202207060747.html"
"False","True","""Au début, ils avaient des formes un peu bizarres"": comment les Minions ont été créés","https://www.bfmtv.com/people/cinema/au-debut-ils-avaient-des-formes-un-peu-bizarres-comment-les-minions-ont-ete-crees_AN-202207060242.html"
"False","True","Grèves, vols annulés: les voyagistes ""craignent le pire"" cet été dans les aéroports","https://www.bfmtv.com/economie/economie-social/france/greves-vols-annules-les-voyagistes-craignent-le-pire-cet-ete-dans-les-aeroports_AD-202206300700.html"
"False","True","""Ce n'est plus raisonnable"": face à la sécheresse, les douches de plage sont-elles vouées…","https://www.bfmtv.com/environnement/ce-n-est-plus-raisonnable-face-a-la-secheresse-les-douches-de-plage-sont-elles-vouees-a-disparaitre_AV-202207010301.html"
"False","True","Covid-19: quand le pic de la 7e vague sera-t-il atteint?","https://www.bfmtv.com/sante/covid-19-quand-le-pic-de-la-7e-vague-sera-t-il-atteint_AN-202206300425.html"
"False","True","Jouets: La Foir'fouille critiqué pour un ""kit petite influenceuse"" à partir de trois ans","https://www.bfmtv.com/tech/jouets-la-foir-fouille-critique-pour-un-kit-petite-influenceuse-a-partir-de-trois-ans_AN-202207010309.html"
"False","True","""Le métier devient compliqué à exercer"": des gynécologues ""dépassés"" par la mise en cause…","https://www.bfmtv.com/sante/le-metier-devient-complique-a-exercer-des-gyneco-depasses-par-la-mise-en-cause-de-leurs-pratiques_AN-202206280682.html"
"False","True","A Lyon, 3 laboratoires s'allient pour créer des antibiotiques nouvelle génération","https://www.bfmtv.com/economie/entreprises/a-lyon-3-laboratoires-s-allient-pour-creer-des-antibiotiques-nouvelle-generation_AN-202207060746.html"
"False","True","Yvelines: la circulation du tram T13 bloquée par des manifestants lors de son inauguration","https://www.bfmtv.com/paris/yvelines-la-circulation-du-tram-t13-perturbee-par-des-manifestants-lors-de-son-inauguration_AD-202207060716.html"
"False","True","Surcoût du RER E: les élus franciliens accablent SNCF Réseau","https://www.bfmtv.com/economie/entreprises/transports/surcout-du-rer-e-les-elus-franciliens-accablent-sncf-reseau_AD-202207060706.html"
"False","True","Fixation des prix: les entreprises invitées à ""signaler"" les ""anomalies""","https://www.bfmtv.com/economie/entreprises/fixation-des-prix-les-entreprises-invitees-a-signaler-les-anomalies_AV-202207060521.html"
"False","True","Elisabeth Borne annonce la ""déconjugalisation"" de l'allocation adulte handicapé","https://www.bfmtv.com/economie/economie-social/france/elisabeth-borne-annonce-la-deconjugalisation-de-l-allocation-adulte-handicape_AV-202207060496.html"
"False","True","Angleterre-Autriche en direct: les Anglaises gèrent leur avance","https://rmcsport.bfmtv.com/football/feminin/euro/euro-2022-en-direct-suivez-le-premier-match-angleterre-autriche_LS-202207060699.html"
"False","True","Wimbledon: Nadal vient à bout de Fritz et retrouvera Kyrgios en demi-finale","https://rmcsport.bfmtv.com/tennis/wimbledon/wimbledon-nadal-vient-a-bout-de-fritz-et-retrouvera-kyrgios-en-demi-finale_AV-202207060733.html"
"False","True","Tour de France (5e étape): Clarke vainqueur sur les pavés après une folle journée, Pogacar solide, Roglic piégé","https://rmcsport.bfmtv.com/cyclisme/tour-de-france/tour-de-france-5e-etape-clarke-vainqueur-sur-les-paves-apres-une-folle-journee-pogacar-en-forme-roglic-perd-gros_AV-202207060576.html"
"False","True","Bordeaux: ""Dès le début, ça puait"", Dugarry en veut à ""tellement de monde"", dont Alain Juppé","https://rmcsport.bfmtv.com/football/ligue-1/bordeaux-des-le-debut-ca-puait-dugarry-en-veut-a-tellement-de-monde-dont-alain-juppe_AV-202207060397.html"
"False","True","Volley: l’équipe nationale de Chine bientôt intégrée au championnat de France, les coulisses d'un projet fou","https://rmcsport.bfmtv.com/volley/volley-l-equipe-de-chine-bientot-integree-au-championnat-de-france-les-coulisses-d-un-projet-fou_AN-202207060391.html"
"False","True","""J'ai pleuré tous les soirs pendants un an"" : fausses couches, vraies souffrances","https://www.bfmtv.com/societe/j-ai-pleure-tous-les-soirs-pendant-un-an-fausse-couche-vraies-souffrances_AN-202206230011.html"
"False","True","Carte. Résultats élections législatives 2022 : La France du vote RN au premier tour","https://www.bfmtv.com/politique/elections/legislatives/carte-resultats-elections-legislatives-2022-la-france-du-vote-rn-au-premier-tour_GN-202206130020.html"
"False","True","Lascaux, Chauvet, Cosquer...Le nouvel eldorado touristique des grottes préhistoriques","https://www.bfmtv.com/economie/lascaux-chauvet-cosquer-le-nouvel-eldorado-touristique-des-grottes-prehistoriques_GN-202206040051.html"
"False","True","Guerre en Ukraine : 100 jours de conflit racontés en images satellite","https://www.bfmtv.com/international/guerre-en-ukraine-100-jours-de-conflits-racontes-en-images-satellite_AN-202206030031.html"
"False","True","Entre l'Ukraine et la Russie, une histoire contrariée","https://www.bfmtv.com/international/entre-l-ukraine-et-la-russie-une-histoire-contrariee_GN-202205090013.html"
"False","True","PMA pour toutes : 9 mois après, l'attente se prolonge pour les femmes","https://www.bfmtv.com/societe/pma-pour-toutes-9-mois-apres-l-attente-se-prolonge-pour-les-femmes_GN-202205020004.html"
"False","True","Abou Touré (Onzic) : Onzic propose aux élèves de réviser le bac ou le brevet en rap - 06/07","https://www.bfmtv.com/economie/replay-emissions/tech-and-co/abou-toure-onzic-onzic-propose-aux-eleves-de-reviser-le-bac-ou-le-brevet-en-rap-06-07_VN-202207060730.html"
"False","True","Onzic : l'appli pour apprendre ses cours en rap","https://www.bfmtv.com/economie/replay-emissions/tech-and-co/onzic-l-appli-pour-apprendre-ses-cours-en-rap_VN-202207060720.html"
"False","True","Christian Bale, Margot Robbie et John David Washington réunis dans la bande-annonce d'""Amsterdam""","https://www.bfmtv.com/people/cinema/christian-bale-margot-robbie-et-john-david-washington-reunis-dans-la-bande-annonce-d-amsterdam_AN-202207060701.html"
"False","True","Travis Scott interrompt son concert à Brooklyn pour des raisons de sécurité","https://www.bfmtv.com/people/musique/travis-scott-interrompt-son-concert-a-brooklyn-pour-des-raisons-de-securite_AN-202207060672.html"
"False","True","""Vous n'aurez pas ma haine"": une bande-annonce poignante pour ce film sur l'après-Bataclan","https://www.bfmtv.com/people/cinema/vous-n-aurez-pas-haine-une-bande-annonce-poignante-pour-ce-film-sur-l-apres-bataclan_AN-202207060649.html"
"False","True","LADD : l’enseigne spécialisée pour vos projets de design et d’architecture d’Intérieur","https://www.bfmtv.com/pratique/entreprises-d-avenir/ladd-l-enseigne-specialisee-pour-vos-projets-de-design-et-d-architecture-d-interieur_AB-202207060005.html"
"False","True","AVISUN : le solaire à la portée de tous","https://www.bfmtv.com/economie/entreprises/avisun-le-solaire-a-la-portee-de-tous_AO-202207040002.html"
