"premium","picture","title","url"
"False","True","DIRECT. Nucléaire : Emmanuel Macron visite le site de Belfort","https://www.ouest-france.fr/environnement/nucleaire/direct-nucleaire-emmanuel-macron-en-deplacement-a-belfort-ce-jeudi-cd2efe20-8a58-11ec-b1a4-b42f8ae3c7af"
"False","True","Affaire Jubillar. Des traces de sang retrouvées dans la voiture d’un voisin de Cédric Jubillar","https://www.ouest-france.fr/faits-divers/affaire-jubillar/affaire-jubillar-des-traces-de-sang-retrouvees-dans-la-voiture-d-un-voisin-de-cedric-jubillar-99114f68-8a6b-11ec-b1a4-b42f8ae3c7af"
"False","True","DIRECT. Tour de la Provence : une surprise en tête du prologue, les favoris pas encore partis","https://www.ouest-france.fr/sport/cyclisme/tour-de-la-provence/direct-tour-de-la-provence-suivez-le-prologue-en-direct-live-0b3c01d2-897c-11ec-9ae6-d592858b40f6"
"False","True","CARTE. Covid-19 : désormais moins de 200 000 nouveaux cas en France, une première depuis janvier","https://www.ouest-france.fr/sante/virus/coronavirus/carte-covid-19-le-taux-d-incidence-continue-de-baisser-partout-l-hopital-amorce-un-recul-36bb17be-89ca-11ec-a193-c2f6a0cd3665"
"False","True","Protocole anti-Covid à l’école : Jean-Michel Blanquer prévoit des allègements à la rentrée","https://www.ouest-france.fr/sante/virus/coronavirus/protocole-anti-covid-a-l-ecole-jean-michel-blanquer-prevoit-des-allegements-a-la-rentree-fb9bdee0-8a6c-11ec-b1a4-b42f8ae3c7af"
"False","True","Procès de Nordahl Lelandais. L’accusé assure n’avoir « jamais utilisé d’objet coupant, tranchant »","https://www.ouest-france.fr/faits-divers/nordahl-lelandais/proces-de-nordahl-lelandais-l-accuse-assure-n-avoir-jamais-utilise-d-objet-coupant-tranchant-5be33f56-8a53-11ec-b1a4-b42f8ae3c7af"
"True","True","Écrire et se faire éditer : comment faire vivre un personnage pour écrire une bonne histoire ?","https://www.ouest-france.fr/culture/livres/lire-magazine/ecrire-et-se-faire-editer-comment-faire-vivre-un-personnage-pour-ecrire-une-bonne-histoire-be11e472-8993-11ec-acfe-cf8b6b6910d6"
"False","True","DIRECT. Procès du balcon effondré à Angers : « On ne construit pas pour tuer des gens »","https://www.ouest-france.fr/societe/faits-divers/balcon-effondre-angers/direct-proces-du-balcon-effondre-a-angers-le-tribunal-revient-sur-la-soiree-qui-a-vire-au-drame-ee9833c2-89ab-11ec-9ae6-d592858b40f6"
"False","False","Crash du Rio-Paris. Air France et Airbus seront jugés du 10 octobre au 8 décembre","https://www.ouest-france.fr/societe/faits-divers/crash/crash-du-rio-paris-air-france-et-airbus-seront-juges-du-10-octobre-au-8-decembre-67a4fe52-8a75-11ec-b1a4-b42f8ae3c7af"
"False","False","PODCAST. Assassinat du père Hamel : l’attentat raconté par ceux qui l’ont vécu de près","https://www.ouest-france.fr/societe/faits-divers/attentat/attentat-saint-etienne-du-rouvray/podcast-assassinat-du-pere-hamel-l-attentat-raconte-par-ceux-qui-l-ont-vecu-de-pres-72b875f0-882f-11ec-83fb-10f9670fd651"
"False","False","Passe vaccinal. 4 à 5 millions de Français vont le perdre au 15 février, êtes-vous concerné ?","https://www.ouest-france.fr/sante/virus/coronavirus/pass-vaccinal/passe-vaccinal-4-a-5-millions-de-francais-vont-le-perdre-au-15-fevrier-etes-vous-concerne-69d438b8-8a62-11ec-878d-eac97e3f97e3"
"False","False","Mort de prématurés à Nancy. Après le CHRU et quatre infirmières, une pédiatre également mise en examen","https://www.ouest-france.fr/grand-est/nancy-54000/mort-de-prematures-a-nancy-apres-le-chru-et-quatre-infirmieres-une-pediatre-egalement-mise-en-examen-7628367"
"False","False","Crise en Ukraine : la Russie lance des manœuvres militaires en Biélorussie","https://www.ouest-france.fr/europe/bielorussie/bielorussie-debut-de-manoeuvres-militaires-conjointes-avec-la-russie-18822ca0-8a39-11ec-b1a4-b42f8ae3c7af"
"False","False","« Mission Impossible ». Les deux prochains volets seront aussi les derniers avec Tom Cruise","https://www.ouest-france.fr/culture/cinema/mission-impossible-les-deux-prochains-volets-seront-aussi-les-derniers-avec-tom-cruise-7628380"
"False","True","JO snowboardcross. Alessandro Hämmerle sacré champion olympique, le Français Merlin Surget 5e","https://www.ouest-france.fr/jeux-olympiques/direct-jo-snowboard-cross-suivez-les-phases-finales-hommes-en-direct-live-a41560ac-8994-11ec-a193-c2f6a0cd3665"
"False","True","JO. L’incroyable photo-finish qui élimine le Français Léo le Blé Jaques au snowboardcross","https://www.ouest-france.fr/jeux-olympiques/jo-l-incroyable-photo-finish-qui-elimine-le-francais-leo-le-ble-jaques-au-snowboardcross-9b021f1c-8a40-11ec-878d-eac97e3f97e3"
"False","True","JO ski alpin . Déception pour Alexis Pinturault, Johannes Strolz champion olympique de combiné","https://www.ouest-france.fr/jeux-olympiques/direct-jo-ski-alpin-suivez-le-slalom-du-combine-avec-alexis-pinturault-en-direct-live-3250896e-898b-11ec-a193-c2f6a0cd3665"
"False","True","JO 2022. Ce que vous avez raté de la nuit à Pékin : Chen et Kim sacrés, Pinturault passe à côté…","https://www.ouest-france.fr/jeux-olympiques/jo-2022-ce-que-vous-avez-rate-de-la-nuit-a-pekin-chen-et-kim-sacres-pinturault-passe-a-cote-9c401b70-8a38-11ec-878d-eac97e3f97e3"
"False","True","Qui est Ester Ledecka, la jeune « skiboardeuse » tchèque, prête à devenir une légende aux JO ?","https://www.ouest-france.fr/leditiondusoir/2022-02-09/qui-est-ester-ledecka-la-jeune-skiboardeuse-tcheque-prete-a-devenir-une-legende-aux-jo-a4791d9a-e8be-4540-91fe-c7a77649eb48"
"False","True","POINT DE VUE. Activités lucratives sans but… social","https://www.ouest-france.fr/societe/point-de-vue-activites-lucratives-sans-but-social-5045f0a4-8985-11ec-9ae6-d592858b40f6"
"False","True","Le juge Éric Halphen raconte dans un nouveau livre la fascinante affaire des faux Millet","https://www.ouest-france.fr/leditiondusoir/2022-02-09/le-juge-eric-halphen-raconte-dans-un-nouveau-livre-la-fascinante-affaire-des-faux-millet-b638a74f-4d21-4eac-930f-3147d2e021e1"
"False","True","REPORTAGE. Hausse du carburant : « Je suis obligé d’emprunter pour conduire »","https://www.ouest-france.fr/bretagne/paimpol-22500/a-paimpol-hausse-du-carburant-je-suis-oblige-d-emprunter-pour-conduire-b2adad92-85cd-11ec-a885-b9d9d40d9db7"
"False","True","REPORTAGE. En formation chauffeuse poids lourd, elles prennent un nouveau virage","https://www.ouest-france.fr/bretagne/rennes-35000/reportage-en-formation-chauffeuse-poids-lourd-elles-prennent-un-nouveau-virage-84170302-8901-11ec-aea6-4ffbfd19eda9"
"True","True","Côtes-d’Armor. Malgré l’émission « Cauchemar en cuisine », le chef du restaurant va tourner la page","https://www.ouest-france.fr/bretagne/plougonver-22810/plougonver-le-chef-du-kerado-va-tourner-la-page-malgre-l-emission-cauchemar-en-cuisine-72747eea-89ba-11ec-b791-423d12ba7410"
"False","True","Super Ligue Ouest-France : la vidéo de candidature de La Vitréenne FC","https://www.ouest-france.fr/sport/football/foot-amateur/super-ligue-ouest-france-la-video-de-candidature-de-la-vitreenne-fc-165f74f0-88ef-11ec-9047-afce31b42485"
"True","True","Avec professeur Truck, elle propose du soutien scolaire dans un camping-car de Vire jusqu’à Flers","https://www.ouest-france.fr/normandie/calvados/avec-professeur-truck-elle-propose-du-soutien-scolaire-dans-un-camping-car-c77a4bb6-8444-11ec-af89-f91e4c8991b6"
"False","True","Super Ligue Ouest-France : la vidéo de candidature de l’US Andaine","https://www.ouest-france.fr/sport/football/foot-amateur/super-ligue-ouest-france-la-video-de-candidature-de-l-us-andaine-c46fd4b2-88eb-11ec-9047-afce31b42485"
"True","True","Un traitement anti-Covid américain a été confié à une entreprise normande","https://www.ouest-france.fr/sante/un-traitement-anti-covid-americain-a-ete-confie-a-une-entreprise-normande-bcae6b44-89bd-11ec-a193-c2f6a0cd3665"
"False","True","PODCAST. Assassinat du père Hamel : l’attentat raconté par ceux qui l’ont vécu de près","https://www.ouest-france.fr/societe/faits-divers/attentat/attentat-saint-etienne-du-rouvray/podcast-assassinat-du-pere-hamel-l-attentat-raconte-par-ceux-qui-l-ont-vecu-de-pres-72b875f0-882f-11ec-83fb-10f9670fd651"
"False","True","VIDÉO.Des malfrats éventrent un Mc Donald’s à la tractopelle à Nantes et emportent des coffres-forts","https://www.ouest-france.fr/pays-de-la-loire/nantes-44000/video-des-malfrats-eventrent-un-mc-donald-s-au-tractopelle-a-nantes-et-emportent-deux-coffres-forts-98e2dfac-8a43-11ec-878d-eac97e3f97e3"
"True","True","ENTRETIEN. Née en Ukraine, Liliana Malka se dit prête à y retourner « pour aider le peuple »","https://www.ouest-france.fr/pays-de-la-loire/cholet-49300/nee-en-ukraine-liliana-malka-se-dit-prete-a-y-retourner-pour-aider-le-peuple-b3777b62-89bb-11ec-a193-c2f6a0cd3665"
"False","True","VIDÉO. Un McDonald’s attaqué à la tractopelle à Nantes, le restaurant en partie éventré","https://www.ouest-france.fr/pays-de-la-loire/nantes-44000/nantes-un-restaurant-mcdonald-s-attaque-a-la-tractopelle-42b8a196-8a4a-11ec-b1a4-b42f8ae3c7af"
"False","True","Une femme de 27 ans tuée dans un accident entre Le Mans et Laval","https://www.ouest-france.fr/pays-de-la-loire/chassille-72540/sarthe-accident-mortel-entre-le-mans-et-laval-la-circulation-perturbee-3a44ebee-8a47-11ec-878d-eac97e3f97e3"
"False","True","DIRECT. Nucléaire : Emmanuel Macron visite le site de Belfort","https://www.ouest-france.fr/environnement/nucleaire/direct-nucleaire-emmanuel-macron-en-deplacement-a-belfort-ce-jeudi-cd2efe20-8a58-11ec-b1a4-b42f8ae3c7af"
"False","True","Présidentielle. Le directeur de campagne de Valérie Pécresse est un « loser » selon Rachida Dati","https://www.ouest-france.fr/elections/presidentielle/presidentielle-le-directeur-de-campagne-de-valerie-pecresse-est-un-loser-selon-rachida-dati-d3d744fc-8a4f-11ec-878d-eac97e3f97e3"
"False","True","Présidentielle 2022. Eric Zemmour est surexposé sur C8 selon le gendarme de l’audiovisuel","https://www.ouest-france.fr/elections/presidentielle/presidentielle-2022-eric-zemmour-est-surexpose-sur-c8-selon-le-gendarme-de-l-audiovisuel-7628293"
"False","True","Présidentielle. Éric Zemmour veut un « mur » aux « frontières européennes »","https://www.ouest-france.fr/elections/presidentielle/presidentielle-eric-zemmour-veut-un-mur-aux-frontieres-europeennes-c2b318ae-8a4f-11ec-878d-eac97e3f97e3"
"False","True","Présidentielle. Candidats en manque de parrainages : « Un très grand risque », selon François Bayrou","https://www.ouest-france.fr/elections/presidentielle/presidentielle-candidats-en-manque-de-parrainages-un-tres-grand-risque-selon-francois-bayrou-7d11b3ae-8a41-11ec-ae31-1f5ffe08b8d2"
"False","True","Affaire Jubillar. Des traces de sang retrouvées dans la voiture d’un voisin de Cédric Jubillar","https://www.ouest-france.fr/faits-divers/affaire-jubillar/affaire-jubillar-des-traces-de-sang-retrouvees-dans-la-voiture-d-un-voisin-de-cedric-jubillar-99114f68-8a6b-11ec-b1a4-b42f8ae3c7af"
"False","False","Perpignan. Un ancien livreur aurait gardé une clé pour accéder aux boîtes aux lettres et voler des colis","https://www.ouest-france.fr/region-occitanie/perpignan-66000/perpignan-un-ancien-livreur-aurait-garde-une-cle-pour-acceder-aux-boites-aux-lettres-et-voler-des-7628375"
"False","False","Ce patron renonce à plusieurs millions d’euros en refusant de vendre son camping des Pyrénées-Orientales","https://www.ouest-france.fr/economie/entreprises/ce-patron-renonce-a-plusieurs-millions-d-euros-en-refusant-de-vendre-son-camping-des-pyrenees-7627103"
"False","True","Alpes-Maritimes. La rade de Villefranche-sur-Mer se débarrasse des épaves et crée deux zones de mouillage","https://www.ouest-france.fr/provence-alpes-cote-dazur/villefranche-sur-mer-06230/alpes-maritimes-la-rade-de-villefranche-sur-mer-se-debarrasse-des-epaves-et-cree-deux-zones-de-7628430"
"False","False","Marseille. Tous les déchets accumulés pendant la grève des éboueurs ont été ramassés, annonce la ville","https://www.ouest-france.fr/provence-alpes-cote-dazur/marseille-13000/marseille-tous-les-dechets-accumules-pendant-la-greve-des-eboueurs-ont-ete-ramasses-annonce-la-ville-7628373"
"False","False","Quel temps est prévu à Toulon et ses environs le jeudi 10 février 2022 ?","https://www.ouest-france.fr/meteo/provence-alpes-cote-dazur/toulon-83000/la-meteo-du-jour-a-toulon-78db7999-6bc7-5f73-aab6-91f034b63c0d"
"False","True","Stade Rennais. Doku, Tait et Salin indisponibles pour affronter le PSG, Gomis de retour ce jeudi","https://www.ouest-france.fr/sport/football/stade-rennais/stade-rennais-doku-tait-et-salin-indisponibles-pour-affronter-le-psg-gomis-de-retour-ce-jeudi-1e945d46-8a5e-11ec-b1a4-b42f8ae3c7af"
"False","False","Le préfet de police veut empêcher les « convois de la liberté » de rallier Paris","https://www.ouest-france.fr/societe/les-convois-de-la-liberte-interdits-a-paris-annonce-la-prefecture-de-police-d8375454-8a42-11ec-b1a4-b42f8ae3c7af"
"False","False","Seine-Saint-Denis. Près de 7 000 paquets de cigarettes de contrebande saisis, trois hommes interpellés","https://www.ouest-france.fr/ile-de-france/la-courneuve-93120/seine-saint-denis-pres-de-7-000-paquets-de-cigarettes-de-contrebande-saisis-trois-hommes-interpelles-7628307"
"False","True","Tours. Un homme âgé de 44 ans tué à l’arme blanche en pleine rue","https://www.ouest-france.fr/centre-val-de-loire/tours-37000/tours-un-homme-age-de-44-ans-tue-a-l-arme-blanche-en-pleine-rue-00256612-89a4-11ec-9ae6-d592858b40f6"
"False","False","Dix-huit mois de prison avec sursis requis contre l’ancienne première adjointe de Tours","https://www.ouest-france.fr/centre-val-de-loire/tours-37000/dix-huit-mois-de-prison-avec-sursis-requis-contre-l-ancienne-premiere-adjointe-de-tours-351bbc7e-8911-11ec-9047-afce31b42485"
"False","False","Pays de la Loire. Des tables et des chefs distingués par Gault & Millau","https://www.ouest-france.fr/pays-de-la-loire/pays-de-la-loire-des-tables-et-des-chefs-distingues-par-gault-millau-57366af6-8903-11ec-aea6-4ffbfd19eda9"
