"premium","picture","title","url"
"False","True","EN DIRECT - Guerre en Ukraine : Vladimir Poutine décrète la «mobilisation partielle» en Russie","https://www.lefigaro.fr/international/en-direct-guerre-en-ukraine-les-medias-russes-annoncent-une-intervention-imminente-de-poutine-20220921"
"False","False","FOCUS - Guerre en Ukraine : qu'est-ce que la «mobilisation partielle» décrétée par Poutine ?","https://www.lefigaro.fr/international/guerre-en-ukraine-qu-est-ce-que-la-mobilisation-partielle-decretee-par-poutine-20220921"
"False","False","Ukraine : Emmanuel Macron qualifie de «parodie» les référendums annoncés par Moscou","https://www.lefigaro.fr/international/ukraine-emmanuel-macron-qualifie-de-parodie-les-referendums-annonces-par-moscou-dans-les-regions-separatistes-20220920"
"True","False","ENTRETIEN - Guerre en Ukraine : pourquoi la Russie veut annexer les territoires séparatistes","https://www.lefigaro.fr/international/guerre-en-ukraine-pourquoi-la-russie-veut-annexer-les-territoires-separatistes-20220920"
"True","True","Poutine mise sur l’escalade en précipitant l’annexion du Donbass par référendums","https://www.lefigaro.fr/international/poutine-mise-sur-l-escalade-en-precipitant-l-annexion-du-donbass-par-referendums-20220920"
"True","True","Les villes où l'insécurité augmente le plus dans les transports en commun","https://www.lefigaro.fr/actualite-france/le-classement-des-villes-ou-l-insecurite-augmente-le-plus-dans-les-transports-20220921"
"True","True","Notre palmarès 2022 des villes où il fait bon vivre près de Lille","https://www.lefigaro.fr/actualite-france/metropole-de-lille-notre-palmares-2022-des-villes-ou-il-fait-bon-vivre-20220919"
"True","True","Ils gagnent 100.000 euros par an à 30 ans... et décident malgré tout de changer de voie","https://www.lefigaro.fr/decideurs/emploi/ils-gagnent-100-000-euros-par-an-a-30-ans-et-decident-malgre-tout-de-changer-de-voie-20220920"
"True","True","«J'avais 13,9 de moyenne à Assas, et même ça, ça n'a pas suffi» : lassitude et inquiétude des étudiants sans master à la rentrée","https://www.lefigaro.fr/actualite-france/j-avais-13-9-de-moyenne-a-assas-et-meme-ca-ca-n-a-pas-suffi-lassitude-et-inquietude-des-etudiants-sans-master-a-la-rentree-20220920"
"False","True","Présidence des Républicains : disqualifiée par LR, Virginie Calmels fait condamner le parti","https://www.lefigaro.fr/politique/presidence-des-republicains-disqualifiee-par-lr-virginie-calmels-fait-condamner-le-parti-20220920"
"True","True","«Répartir les immigrés en zone rurale ne ferait que renforcer les difficultés de nos campagnes»","https://www.lefigaro.fr/vox/societe/repartir-les-immigres-en-zone-rurale-ne-ferait-que-renforcer-les-difficultes-de-nos-campagnes-20220920"
"True","True","Un œil vers 2032, Macron tente de lever l’hypothèque qui pèse sur son mandat","https://www.lefigaro.fr/politique/un-oeil-vers-2032-macron-tente-de-lever-l-hypotheque-qui-pese-sur-son-mandat-20220920"
"True","False","ANALYSE - L’après-Macron agite déjà les esprits dans la majorité","https://www.lefigaro.fr/politique/l-apres-macron-agite-deja-les-esprits-dans-la-majorite-20220920"
"False","True","Guerre en Ukraine, réchauffement climatique, sécurité alimentaire: ce qu'il faut retenir de l'allocution d'Emmanuel Macron à l'ONU","https://www.lefigaro.fr/international/guerre-en-ukraine-rechauffement-climatique-securite-alimentaire-ce-qu-il-faut-retenir-de-l-allocution-d-emmanuel-macron-a-l-onu-20220920"
"True","True","Les nouvelles mesures pour lutter contre l’inceste et les violences sexuelles faites aux enfants","https://www.lefigaro.fr/actualite-france/les-nouvelles-mesures-pour-lutter-contre-l-inceste-et-les-violences-sexuelles-faites-aux-enfants-20220921"
"True","False","DÉCRYPTAGE - Commission inceste: ce que disent les 16.000 témoignages de victimes qui brisent un tabou","https://www.lefigaro.fr/actualite-france/commission-inceste-ce-que-disent-les-16-000-temoignages-de-victimes-qui-brisent-un-tabou-20220921"
"False","False","Chantage politique à Saint-Étienne: le maire licencie son directeur de cabinet","https://www.lefigaro.fr/faits-divers/chantage-politique-a-saint-etienne-le-maire-licencie-son-directeur-de-cabinet-20220920"
"True","True","Stationnement payant des deux-roues à Paris : plongée au cœur d'un système ubuesque","https://www.lefigaro.fr/finances-perso/stationnement-payant-des-deux-roues-a-paris-plongee-au-coeur-d-un-systeme-ubuesque-20220921"
"False","True","Le crédit d’impôt mensualisé s’étend ce mardi à la garde des enfants de plus de 6 ans","https://www.lefigaro.fr/impots/le-credit-d-impot-mensualise-s-etend-a-la-garde-d-enfant-de-plus-de-6-ans-20220623"
"True","True","«Mon nouveau collègue est mieux payé que moi» : comment gérer les écarts de salaire au sein d'une même équipe","https://www.lefigaro.fr/decideurs/management/mon-nouveau-collegue-est-mieux-paye-que-moi-comment-gerer-les-ecarts-de-salaire-au-sein-d-une-meme-equipe-20220921"
"False","False","Nantes : une femme entre la vie et la mort après un refus d'obtempérer","https://www.lefigaro.fr/faits-divers/nantes-une-femme-entre-la-vie-et-la-mort-apres-un-refus-d-obtemperer-20220921"
"False","True","Réduire la consommation de gaz ne garantira pas un hiver sans encombre prévient Engie","https://www.lefigaro.fr/conso/reduire-la-consommation-de-gaz-ne-garantira-pas-un-hiver-sans-encombre-previent-engie-20220921"
"False","False","Crise énergétique : les universités devront-elles fermer cet hiver ?","https://etudiant.lefigaro.fr/article/crise-energetique-les-universites-devront-elles-fermer-cet-hiver_7928154e-38e2-11ed-9733-eb8453767bff/"
"False","False","Le discours de Poutine, un «aveu d'échec de son invasion», selon le ministre britannique de la Défense.","https://www.lefigaro.fr/flash-actu/le-discours-de-poutine-un-aveu-d-echec-de-son-invasion-selon-le-ministre-britannique-de-la-defense-20220921"
"False","False","Affaires Quatennens et Bayou : «C'est le naufrage moral de la gauche», estime Jordan Bardella","https://www.lefigaro.fr/politique/affaires-quatennens-et-bayou-c-est-le-naufrage-moral-de-la-gauche-estime-jordan-bardella-20220921"
"False","False","Réduire la consommation de gaz ne garantira pas un hiver sans encombre prévient Engie","https://www.lefigaro.fr/conso/reduire-la-consommation-de-gaz-ne-garantira-pas-un-hiver-sans-encombre-previent-engie-20220921"
"False","False","Nantes : une femme entre la vie et la mort après un refus d'obtempérer","https://www.lefigaro.fr/faits-divers/nantes-une-femme-entre-la-vie-et-la-mort-apres-un-refus-d-obtemperer-20220921"
"False","False","Schneider Electric va racheter la totalité du groupe anglais de logiciels Aveva","https://www.lefigaro.fr/flash-eco/schneider-electric-va-racheter-la-totalite-du-groupe-anglais-de-logiciels-aveva-20220921"
"False","False","L'Allemagne va nationaliser le géant gazier Uniper","https://www.lefigaro.fr/societes/l-allemagne-va-nationaliser-le-geant-gazier-uniper-20220921"
"False","False","Un Américain et deux Russes à destination de l'ISS en pleine offensive en Ukraine","https://www.lefigaro.fr/flash-actu/un-americain-et-deux-russes-a-destination-de-l-iss-en-pleine-offensive-en-ukraine-20220921"
"False","False","Décès d'une fillette dans une crèche à Lyon : l'établissement définitivement fermé","https://www.lefigaro.fr/faits-divers/deces-d-une-fillette-dans-une-creche-a-lyon-l-etablissement-definitivement-ferme-20220921"
"False","False","Le détroit de Taïwan traversé par des navires militaires américain et canadien","https://www.lefigaro.fr/flash-actu/le-detroit-de-taiwan-traverse-par-des-navires-militaires-americain-et-canadien-20220921"
"False","False","L'obésité croissante freinera les économies des pays en développement","https://www.lefigaro.fr/flash-eco/l-obesite-croissante-freinera-les-economies-des-pays-en-developpement-20220921"
"False","False","Les premiers groupes des Trans Musicales de Rennes 2022 dévoilés","https://www.lefigaro.fr/musique/les-premiers-groupes-des-trans-musicales-de-rennes-2022-devoiles-20220921"
"False","False","Australie: 14 cachalots retrouvés morts après s'être échoués","https://www.lefigaro.fr/flash-actu/australie-14-cachalots-retrouves-morts-apres-s-etre-echoues-20220921"
"False","False","Le premier ministre japonais se dit prêt à voir le dirigeant nord-coréen","https://www.lefigaro.fr/flash-actu/le-premier-ministre-japonais-se-dit-pret-a-voir-le-dirigeant-nord-coreen-20220921"
"False","False","Migrants déplacés en avion: plainte déposée contre le gouverneur de Floride","https://www.lefigaro.fr/flash-actu/migrants-deplaces-en-avion-plainte-deposee-contre-le-gouverneur-de-floride-20220921"
"False","False","Japon: un homme s'immole par le feu près du bureau du premier ministre","https://www.lefigaro.fr/flash-actu/japon-un-homme-s-immole-par-le-feu-pres-du-bureau-du-premier-ministre-20220921"
"False","False","Le FBI confronté à une «avalanche» de menaces encouragées par Trump, selon le Sénat américain","https://www.lefigaro.fr/flash-actu/le-fbi-confronte-a-une-avalanche-de-menaces-encouragees-par-trump-selon-le-senat-americain-20220921"
"False","False","Comment les industries profitent des réseaux sociaux pour se «verdir»","https://www.lefigaro.fr/flash-eco/comment-les-industries-profitent-des-reseaux-sociaux-pour-se-verdir-20220921"
"False","False","Plainte d'Iraniens aux États-Unis contre le président Raïssi","https://www.lefigaro.fr/flash-actu/plainte-d-iraniens-aux-etats-unis-contre-le-president-raissi-20220921"
"False","False","En France, il est difficile d'évoquer avec «nuance» les inégalités raciales, regrette Pap Ndiaye","https://www.lefigaro.fr/flash-actu/en-france-il-est-difficile-d-evoquer-avec-nuance-les-inegalites-raciales-regrette-pap-ndiaye-20220921"
"False","False","La Guinée équatoriale avance sa présidentielle de cinq mois","https://www.lefigaro.fr/flash-actu/la-guinee-equatoriale-avance-sa-presidentielle-de-cinq-mois-20220921"
"False","False","La majorité des décès liés à une grossesse aux États-Unis sont évitables","https://www.lefigaro.fr/flash-actu/la-majorite-des-deces-lies-a-une-grossesse-aux-etats-unis-sont-evitables-20220920"
"False","False","Niger : arrivée d'Algérie d'une nouvelle vague de plus de 600 migrants","https://www.lefigaro.fr/flash-actu/niger-arrivee-d-algerie-d-une-nouvelle-vague-de-plus-de-600-migrants-20220920"
"False","False","Guerre en Ukraine : Vladimir Poutine reporte son allocution télévisée","https://www.lefigaro.fr/international/guerre-en-ukraine-vladimir-poutine-reporte-son-allocution-televisee-20220920"
"False","False","Une femme de 84 ans tuée dans une attaque à Holon, dans le centre d'Israël","https://www.lefigaro.fr/international/une-femme-de-84-ans-tuee-dans-une-attaque-a-holon-dans-le-centre-d-israel-20220920"
"False","False","Joe Biden choisit Lynne Tracy comme ambassadrice à Moscou","https://www.lefigaro.fr/flash-actu/joe-biden-choisit-lynne-tracy-comme-ambassadrice-a-moscou-20220920"
"False","False","À l'ONU, le président du Kirghizstan se dit prêt à négocier avec le Tadjikistan","https://www.lefigaro.fr/flash-actu/a-l-onu-le-president-du-kirghizstan-se-dit-pret-a-negocier-avec-le-tadjikistan-20220920"
"False","False","Chantage politique à Saint-Étienne: le maire licencie son directeur de cabinet","https://www.lefigaro.fr/faits-divers/chantage-politique-a-saint-etienne-le-maire-licencie-son-directeur-de-cabinet-20220920"
