"premium","picture","title","url"
"False","True","Ukraine : des dirigeants séparatistes prorusses décrètent la « mobilisation générale »","https://www.lemonde.fr/international/article/2022/02/18/joe-biden-se-dit-convaincu-que-vladimir-poutine-a-decide-d-attaquer-l-ukraine_6114336_3210.html"
"False","False","Crise en Ukraine : des bombardements dans le Donbass ravivent les tensions","https://www.lemonde.fr/international/article/2022/02/18/crise-ukrainienne-nouvelles-tensions-dans-l-est-du-pays-soumis-a-des-bombardements_6114259_3210.html"
"True","False","« Cela fait huit ans que la guerre est notre quotidien » : dans le village ukrainien de Pavlopil, près de la ligne de front de Donetsk","https://www.lemonde.fr/international/article/2022/02/18/a-pavlopil-cela-fait-huit-ans-que-la-guerre-est-notre-quotidien_6114288_3210.html"
"True","True","Comment Orpea rationnait la nourriture de ses résidents âgés","https://www.lemonde.fr/societe/article/2022/02/19/comment-orpea-rationnait-la-nourriture-de-ses-residents-ages_6114353_3224.html"
"False","True","Présidentielle 2022 : visualisez les temps de parole de chaque candidat dans les médias","https://www.lemonde.fr/les-decodeurs/article/2022/02/18/presidentielle-2022-visualisez-les-temps-de-parole-de-chaque-candidat-dans-les-medias_6114292_4355770.html"
"True","True","Un magistrat jugé pour avoir proposé à des internautes, sur un site échangiste, de violer sa fille de 12 ans","https://www.lemonde.fr/societe/article/2022/02/19/un-magistrat-juge-pour-avoir-propose-a-des-internautes-sur-un-site-echangiste-de-violer-sa-fille-de-12-ans_6114337_3224.html"
"False","True","La tempête Eunice continue de balayer le nord de l’Europe, faisant au moins neuf morts","https://www.lemonde.fr/planete/article/2022/02/19/la-tempete-eunice-continue-de-balayer-le-nord-de-l-europe-faisant-au-moins-neuf-morts_6114361_3244.html"
"True","True","JO 2022 en direct : troisième médaille d’or pour Alexander Bolshunov en ski de fond","https://www.lemonde.fr/sport/live/2022/02/19/jo-2022-du-vent-un-report-un-raccourcissement-et-kevin-rolland-sixieme-du-halfpipe-suivez-la-journee-a-pekin-en-direct_6114345_3242.html"
"True","True","« L’As des as » contre « Une chambre en ville », le match qui mit fin à l’âge d’or de la critique française","https://www.lemonde.fr/m-le-mag/article/2022/02/19/l-as-des-as-contre-une-chambre-en-ville-le-match-qui-mit-fin-a-l-age-d-or-de-la-critique-francaise_6114343_4500055.html"
"False","True","JO 2022 : le malaise Valieva, les chercheurs d’or norvégiens… Retour sur les moments marquants de ces Jeux","https://www.lemonde.fr/sport/article/2022/02/19/jo-2022-le-malaise-valieva-les-chercheurs-d-or-norvegiens-retour-sur-les-moments-marquants-de-ces-jeux_6114360_3242.html"
"False","True","Au Cannet, Valérie Pécresse veut être « une femme libre et indomptable [qui] gardera le cap jusqu’à l’Elysée »","https://www.lemonde.fr/politique/article/2022/02/18/au-cannet-valerie-pecresse-veut-etre-une-femme-libre-et-indomptable-qui-gardera-le-cap-jusqu-a-l-elysee_6114334_823448.html"
"False","True","Bolivie : des manifestants empêchent l’hospitalisation de Jeanine Añez, en grève de la faim","https://www.lemonde.fr/international/article/2022/02/19/bolivie-des-manifestants-empechent-l-hospitalisation-de-l-ex-presidente-en-greve-de-la-faim_6114352_3210.html"
"False","True","« Partygate » : Boris Johnson a répondu au questionnaire de la police","https://www.lemonde.fr/international/article/2022/02/19/partygate-boris-johnson-a-repondu-au-questionnaire-de-la-police_6114338_3210.html"
"True","False","Face à Jean-Luc Mélenchon, les milieux économiques moins critiques qu’il y a cinq ans","https://www.lemonde.fr/election-presidentielle-2022/article/2022/02/18/face-a-jean-luc-melenchon-les-milieux-economiques-moins-critiques-qu-il-y-a-cinq-ans_6114218_6059010.html"
"False","False","Fin de l’opération « Barkhane » : au Mali, la junte au pouvoir demande à la France de retirer ses soldats « sans délai »","https://www.lemonde.fr/afrique/article/2022/02/18/au-mali-la-junte-au-pouvoir-demande-a-la-france-de-retirer-ses-soldats-sans-delai_6114277_3212.html"
"True","False","« Cela fait huit ans que la guerre est notre quotidien » : dans le village ukrainien de Pavlopil, près de la ligne de front de Donetsk","https://www.lemonde.fr/international/article/2022/02/18/a-pavlopil-cela-fait-huit-ans-que-la-guerre-est-notre-quotidien_6114288_3210.html"
"True","False","Les ventes de voitures de luxe, de yachts et de jets privés ont explosé durant la pandémie de Covid-19","https://www.lemonde.fr/economie/article/2022/02/18/les-ventes-de-voitures-de-luxe-de-yachts-et-de-jets-prives-ont-explose-durant-la-pandemie-de-covid-19_6114235_3234.html"
"True","False","« Je suis une femme libre et hyperloyale à la fois » : pour la présidentielle, Audrey Pulvar apporte son soutien à la neutralité","https://www.lemonde.fr/m-le-mag/article/2022/02/18/je-suis-une-femme-libre-et-hyperloyale-a-la-fois-pour-la-presidentielle-audrey-pulvar-apporte-son-soutien-a-la-neutralite_6114196_4500055.html"
"True","False","Au Sénat, les échanges tout en causticité de Xavier Niel et Martin Bouygues","https://www.lemonde.fr/economie/article/2022/02/18/au-senat-les-echanges-tout-en-causticite-de-xavier-niel-et-martin-bouygues_6114304_3234.html"
"False","False","Génocide au Rwanda : Hubert Védrine défend devant la justice son rôle et celui de François Mitterrand","https://www.lemonde.fr/afrique/article/2022/02/18/genocide-au-rwanda-hubert-vedrine-defend-devant-la-justice-son-role-et-celui-de-francois-mitterrand_6114335_3212.html"
"True","False","A Bahreïn, opposants comme loyalistes dans le viseur de Pegasus","https://www.lemonde.fr/pixels/article/2022/02/18/au-bahrein-opposants-comme-loyalistes-dans-le-viseur-de-pegasus_6114305_4408996.html"
"True","True","La vérité sur l’affaire Joël Dicker, l’écrivain-entrepreneur","https://www.lemonde.fr/m-le-mag/article/2022/02/18/la-verite-sur-l-affaire-joel-dicker-l-ecrivain-entrepreneur_6114171_4500055.html"
"True","True","Affaire Maëlys : Nordahl Lelandais condamné à la perpétuité","https://www.lemonde.fr/societe/article/2022/02/18/affaire-maelys-nordahl-lelandais-condamne-a-la-perpetuite_6114320_3224.html"
"True","True","Inceste : « Avant que mon père parte, je commençais à me faire à l’idée que je n’en parlerais jamais »","https://www.lemonde.fr/societe/article/2022/02/17/inceste-avant-que-mon-pere-parte-je-commencais-a-me-faire-a-l-idee-que-je-n-en-parlerais-jamais_6114008_3224.html"
"True","False","Stephen Marglin : « Le capitalisme ne promeut le bien commun que lorsque la main invisible est maîtrisée par la main très visible de l’Etat »","https://www.lemonde.fr/idees/article/2022/02/18/stephen-marglin-le-capitalisme-ne-promeut-le-bien-commun-que-lorsque-la-main-invisible-est-maitrisee-par-la-main-tres-visible-de-l-etat_6114187_3232.html"
"True","False","« Demain, l’offre culturelle numérique sera dominée par des expériences ludiques et lucratives où la culture sera un décor »","https://www.lemonde.fr/idees/article/2022/02/18/demain-l-offre-culturelle-numerique-sera-archi-dominee-par-des-experiences-ludiques-et-lucratives-ou-la-culture-aura-sa-place-pas-comme-sujet-mais-comme-decor_6114168_3232.html"
"False","False","La dette, angle mort de la campagne","https://www.lemonde.fr/idees/article/2022/02/18/election-presidentielle-2022-la-dette-angle-mort-de-la-campagne_6114243_3232.html"
"True","True","Comment Internet est devenu central dans la stratégie des candidats à l’élection présidentielle","https://www.lemonde.fr/pixels/article/2022/02/18/election-presidentielle-de-2007-a-2022-comment-internet-est-devenu-central-dans-la-strategie-des-candidats_6114213_4408996.html"
"True","False","Election présidentielle 2022 : candidate dans un milieu très masculin, tout un programme","https://www.lemonde.fr/election-presidentielle-2022/article/2022/02/19/election-presidentielle-2022-candidate-dans-un-milieu-tres-masculin-tout-un-programme_6114350_6059010.html"
"True","False","Face à Jean-Luc Mélenchon, les milieux économiques moins critiques qu’il y a cinq ans","https://www.lemonde.fr/election-presidentielle-2022/article/2022/02/18/face-a-jean-luc-melenchon-les-milieux-economiques-moins-critiques-qu-il-y-a-cinq-ans_6114218_6059010.html"
"False","False","Comparez les programmes des principaux candidats à l’élection présidentielle","https://www.lemonde.fr/les-decodeurs/article/2022/02/16/election-presidentielle-2022-comparez-les-programmes-des-principaux-candidats_6113964_4355770.html"
"True","False","Le plein-emploi, un objectif de campagne séduisant pour Emmanuel Macron","https://www.lemonde.fr/election-presidentielle-2022/article/2022/02/19/le-plein-emploi-un-objectif-de-campagne-seduisant-pour-emmanuel-macron_6114355_6059010.html"
"True","False","A 7,4 %, le chômage au plus bas depuis 2008","https://www.lemonde.fr/politique/article/2022/02/18/a-7-4-le-chomage-au-plus-bas-depuis-2008_6114234_823448.html"
"True","False","Election présidentielle 2022 : dans les coulisses du contrôle des parrainages au Conseil constitutionnel","https://www.lemonde.fr/election-presidentielle-2022/article/2022/02/19/election-presidentielle-2022-dans-les-coulisses-du-controle-des-parrainages-au-conseil-constitutionnel_6114349_6059010.html"
"False","True","« Je conserve les gestes barrière et j’attends le printemps » : ces vaccinés qui misent sur la fin du passe vaccinal","https://www.lemonde.fr/planete/article/2022/02/19/je-conserve-les-gestes-barriere-et-j-attends-le-printemps-ces-vaccines-qui-misent-sur-la-fin-du-passe-vaccinal_6114377_3244.html"
"True","False","« La pandémie m’a envoyé en pleine face qu’à 65 ans, on fait partie des vieux » : comment les baby-boomeurs ont soudain quitté l’éternelle jeunesse","https://www.lemonde.fr/m-le-mag/article/2022/02/19/la-pandemie-m-a-envoye-en-pleine-face-qu-a-65-ans-on-fait-partie-des-vieux-comment-les-baby-boomeurs-ont-soudain-quitte-l-eternelle-jeunesse_6114351_4500055.html"
"False","False","Dans le sillage d’Omicron, les singularités de BA.2","https://www.lemonde.fr/blog/realitesbiomedicales/2022/02/18/dans-le-sillage-domicron-les-singularites-de-ba-2/"
"True","False","« L’efficacité du “quoi qu’il en coûte” n’est pas claire »","https://www.lemonde.fr/idees/article/2022/02/18/l-efficacite-du-quoi-qu-il-en-coute-n-est-pas-claire_6114254_3232.html"
"True","False","Le Covid-19 a fait entre 3,2 et 3,7 millions de morts en Inde, loin des chiffres officiels","https://www.lemonde.fr/planete/article/2022/02/18/le-covid-19-a-fait-entre-3-2-et-3-7-millions-de-morts-en-inde-loin-des-chiffres-officiels_6114237_3244.html"
"True","False","Les ventes de voitures de luxe, de yachts et de jets privés ont explosé durant la pandémie de Covid-19","https://www.lemonde.fr/economie/article/2022/02/18/les-ventes-de-voitures-de-luxe-de-yachts-et-de-jets-prives-ont-explose-durant-la-pandemie-de-covid-19_6114235_3234.html"
"False","False","Appel à témoignages","https://www.lemonde.fr/planete/appel-temoignages/2022/02/18/passe-vaccinal-a-l-approche-de-la-fin-des-restrictions-vous-ne-souhaitez-pas-faire-votre-dose-de-rappel-pour-le-conserver-racontez-nous_6114216_3244.html"
"True","True","De la presse hongroise à « Mediapart », une vaste opération de déstabilisation en faveur de Viktor Orban","https://www.lemonde.fr/international/article/2022/02/18/de-la-presse-hongroise-a-mediapart-une-vaste-operation-de-destabilisation-en-faveur-de-viktor-orban_6114177_3210.html"
"True","False","« Barkhane », défaite d’une utopie politico-militaire","https://www.lemonde.fr/afrique/article/2022/02/18/barkhane-defaite-d-une-utopie-politico-militaire_6114184_3212.html"
"True","False","Célibat des prêtres, fin de vie : le pape François laisse place au débat","https://www.lemonde.fr/international/article/2022/02/17/celibat-des-pretres-fin-de-vie-le-pape-francois-laisse-place-au-debat_6114149_3210.html"
"True","False","« Cela fait huit ans que la guerre est notre quotidien » : dans le village ukrainien de Pavlopil, près de la ligne de front de Donetsk","https://www.lemonde.fr/international/article/2022/02/18/a-pavlopil-cela-fait-huit-ans-que-la-guerre-est-notre-quotidien_6114288_3210.html"
"True","False","Faute de retrait militaire russe, la fébrilité s’installe autour du sort de l’Ukraine","https://www.lemonde.fr/international/article/2022/02/18/faute-de-retrait-militaire-russe-la-febrilite-s-installe-autour-du-sort-de-l-ukraine_6114228_3210.html"
"True","False","Les ONG critiquent la stratégie de l’aide internationale en Afghanistan","https://www.lemonde.fr/international/article/2022/02/18/les-ong-critiquent-la-strategie-de-l-aide-internationale-en-afghanistan_6114271_3210.html"
"False","False","Au Mali, la peur d’un « vide sécuritaire » après l’annonce du départ de « Barkhane »","https://www.lemonde.fr/afrique/article/2022/02/18/au-mali-la-peur-d-un-vide-securitaire-apres-l-annonce-du-depart-de-barkhane_6114230_3212.html"
"False","True","JO 2022 : le malaise Valieva, les chercheurs d’or norvégiens… Retour sur les moments marquants de ces Jeux","https://www.lemonde.fr/sport/article/2022/02/19/jo-2022-le-malaise-valieva-les-chercheurs-d-or-norvegiens-retour-sur-les-moments-marquants-de-ces-jeux_6114360_3242.html"
"True","False","JO 2022 en direct : troisième médaille d’or pour Alexander Bolshunov en ski de fond","https://www.lemonde.fr/sport/live/2022/02/19/jo-2022-du-vent-un-report-un-raccourcissement-et-kevin-rolland-sixieme-du-halfpipe-suivez-la-journee-a-pekin-en-direct_6114345_3242.html"
