"premium","picture","title","url"
"False","True","DIRECT. Plan de sobriété énergétique : ""Le combat ne s'arrêtera pas à l'hiver 2022-2023"", assure Agnès Pannier-Runacher. Suivez les annonces du gouvernement","https://mobile.francetvinfo.fr/economie/energie/plan-de-sobriete/direct-crise-energetique-le-gouvernement-presente-son-plan-de-sobriete-suivez-les-annonces-d-elisabeth-borne-et-ses-ministres_5399497.html"
"False","True","Plan de sobriété énergétique : découvrez les principales mesures prises par le gouvernement","https://mobile.francetvinfo.fr/economie/energie/plan-de-sobriete/plan-de-sobriete-energetique-decouvrez-les-principales-mesures-prises-par-le-gouvernement_5399332.html"
"False","True","Plan de sobriété énergétique : l’incitation ""ne fonctionne pas, il faudra des obligations et des contrôles"", affirme l’association NégaWatt","https://mobile.francetvinfo.fr/economie/energie/plan-de-sobriete/plan-de-sobriete-energetique-lincitation-ne-fonctionne-pas-il-faudra-des-obligations-et-des-controles-affirme-lassociation-negawatt_5401330.html"
"False","True","Sobriété énergétique : des petits boîtiers pour couper les radiateurs électriques en cas de tension sur le réseau","https://mobile.francetvinfo.fr/economie/energie/sobriete-energetique-des-petits-boitiers-pour-couper-les-radiateurs-electriques-en-cas-de-tension-sur-le-reseau_5401105.html"
"False","True","Crise de l'énergie : ces mesures de la Convention citoyenne pour le climat qui auraient pu être utiles","https://mobile.francetvinfo.fr/monde/environnement/crise-climatique/crise-de-l-energie-ces-mesures-de-la-convention-citoyenne-pour-le-climat-qui-auraient-pu-etre-utiles_5398843.html"
"False","True","Le prix Nobel de littérature décerné à la Française Annie Ernaux, autrice d'une œuvre autobiographique, universelle et politique","https://mobile.francetvinfo.fr/culture/livres/roman/l-ecrivaine-francaise-annie-ernaux-recoit-le-prix-nobel-de-litterature_4798369.html"
"False","True","Emmanuel Macron sera l'invité de France 2 mercredi 12 octobre","https://mobile.francetvinfo.fr/politique/emmanuel-macron/emmanuel-macron-sera-l-invite-de-france-2-mercredi-12-octobre_5401354.html"
"False","True","Quatre questions sur la Communauté politique européenne, qui se réunit pour la première fois à Prague","https://mobile.francetvinfo.fr/monde/europe/union-europeenne/quatrequestions-sur-la-communaute-politique-europeenne-qui-se-reunit-pour-la-premierefois-a-prague_5400970.html"
"False","True","Iran : la diffusion d'""aveux"" d'espionnage de deux Français arrêtés par Téhéran est ""une mascarade"", dénonce le Quai d'Orsay","https://mobile.francetvinfo.fr/monde/iran/iran-la-diffusion-d-aveux-d-espionnage-de-deux-francais-arretes-par-teheran-est-une-mascarade-denonce-le-quai-d-orsay_5401264.html"
"False","True","DIRECT. Guerre en Ukraine : l'armée ukrainienne revendique la reprise de 400 kilomètres carrés dans la région de Kherson","https://mobile.francetvinfo.fr/monde/russie/vladimir-poutine/direct-guerre-en-ukraine-une-europe-elargie-se-rassemble-a-prague-face-a-vladimir-poutine_5400895.html"
"False","True","ENTRETIEN. Violences sexistes en politique : ""Il faut externaliser les procédures"" et fixer ""des règles connues de tous"", plaide Laurence Rossignol","https://mobile.francetvinfo.fr/societe/violences-faites-aux-femmes/entretien-violences-sexistes-en-politique-il-faut-externaliser-les-procedures-et-fixer-des-regles-connues-de-tous-plaide-laurence-rossignol_5401009.html"
"False","True","Assassinat de Samuel Paty : les investigations sur le meurtre du professeur sont terminées","https://mobile.francetvinfo.fr/faits-divers/terrorisme/enseignant-decapite-dans-les-yvelines/assassinat-de-samuel-paty-les-investigations-sur-le-meurtre-du-professeur-sont-terminees_5401342.html"
"False","True","""C'est entre six mois et un an d'attente"" : quand la pénurie de personnel en pédopsychiatrie met en péril le soin des enfants","https://mobile.francetvinfo.fr/replay-radio/le-choix-franceinfo/c-est-entre-six-mois-et-un-an-d-attente-quand-la-penurie-de-personnel-en-pedopsychiatrie-met-en-peril-le-soin-des-enfants_5374429.html"
"False","True","Emploi : il manque 53 000 personnes en CDI dans les métiers de la propreté","https://mobile.francetvinfo.fr/replay-radio/c-est-mon-boulot/emploi-il-manque-53000-personnes-en-cdi-dans-les-metiers-de-la-proprete_5374039.html"
"False","True","En guerre depuis 11 ans, la Syrie doit désormais aussi faire face à une terrible épidémie de choléra","https://mobile.francetvinfo.fr/replay-radio/en-direct-du-monde/en-guerre-depuis-11-ans-la-syrie-doit-desormais-aussi-faire-face-a-une-terrible-epidemie-de-cholera_5374075.html"
"False","True","Burkina Faso : Ibrahim Traoré, jeune putschiste à la tête du pays des hommes intègres","https://mobile.francetvinfo.fr/monde/afrique/burkina-faso/burkina-faso-ibrahim-traore-jeune-putschiste-a-la-tete-du-pays-des-hommes-integres_5400979.html"
"False","True","Santé : un état psychologique négatif fait vieillir plus rapidement l'organisme, selon une étude","https://mobile.francetvinfo.fr/replay-radio/le-billet-vert/sante-un-etat-psychologique-negatif-fait-vieillir-plus-rapidement-l-organisme-selon-une-etude_5374588.html"
"False","True","Pédopornographie : deux Français condamnés à 240 ans et 19 ans de prison en Espagne","https://mobile.francetvinfo.fr/monde/espagne/pedopornographie-deux-francais-condamnes-a-240-ans-et-19-ans-de-prison-en-espagne_5401336.html"
"False","True","Réforme de la police judiciaire : près de 200 policiers manifestent à Marseille","https://france3-regions.francetvinfo.fr/provence-alpes-cote-d-azur/bouches-du-rhone/marseille/la-police-judiciaire-de-marseille-montre-son-mecontentement-face-a-la-reforme-2629584.html"
"False","True","Supporter de Bastia éborgné à Reims en 2016 : Maxime Beux, la victime, s'exprime à la barre des assises de la Marne","https://france3-regions.francetvinfo.fr/grand-est/marne/reims/supporter-de-bastia-eborgne-a-reims-en-2016-maxime-beux-la-victime-s-exprime-a-la-barre-des-assises-de-la-marne-2629292.html"
"False","True","Cinéma : ""Sean Connery a arrêté James Bond car il trouvait qu’il était mal payé"", confie sa femme Micheline Connery","https://mobile.francetvinfo.fr/replay-radio/info-medias/micheline-connery-sean-connery-a-arrete-james-bond-car-il-trouvait-quil-etait-mal-paye_5374057.html"
"False","True","Thaïlande : une crèche attaquée par un assaillant, au moins 35 personnes tuées dont 22 enfants","https://mobile.francetvinfo.fr/monde/asie/thailande-une-creche-attaquee-par-un-assaillant-au-moins-32-personnes-tuees-dont-23-enfants_5401015.html"
"False","True","VIDEO. Rassemblement national : les députés ""ne nient pas du tout l'héritage politique"" du FN","https://mobile.francetvinfo.fr/politique/front-national/video-rassemblement-national-les-deputes-ne-nient-pas-du-tout-l-heritage-politique-du-fn_5401048.html"
"False","True","Fuites sur les gazoducs Nord Stream : les premières inspections suédoises ""renforcent les soupçons de sabotage""","https://mobile.francetvinfo.fr/monde/europe/manifestations-en-ukraine/fuites-sur-les-gazoducs-nord-stream-les-premieres-inspections-suedoises-renforcent-les-soupcons-de-sabotage_5401237.html"
"False","True","Notre-Dame de Paris : le chantier de reconstruction de la cathédrale progresse, la Cour des comptes pointe plusieurs enjeux à traiter d'ici la réouverture en 2024","https://mobile.francetvinfo.fr/culture/patrimoine/incendie-de-notre-dame-de-paris/notre-dame-de-paris-le-chantier-de-reconstruction-de-la-cathedrale-progresse-la-cour-des-comptes-pointe-plusieurs-enjeux-a-traiter-d-ici-la-reouverture-en-2024_5399602.html"
"False","True","Iran : la télévision d'Etat diffuse ce qu'elle présente comme des ""aveux"" de deux Français arrêtés et accusés d'""atteinte à la sûreté""","https://mobile.francetvinfo.fr/monde/iran/iran-la-television-d-etat-diffuse-ce-qu-elle-presente-comme-des-aveux-de-deux-francais-arretes_5401057.html"
"False","True","Grève dans les crèches : pourquoi les professionnels de la petite enfance se mobilisent dans tout le pays","https://mobile.francetvinfo.fr/economie/emploi/metiers/greve-dans-les-creches-pourquoi-les-professionnels-de-la-petite-enfance-se-mobilisent-dans-tout-le-pays_5400793.html"
"False","True","VIDEO. Gel hormonal destiné aux hommes, un nouvel espoir pour la contraception masculine","https://mobile.francetvinfo.fr/sante/contraception/video-gel-hormonal-destine-aux-hommes-un-nouvel-espoir-pour-la-contraception-masculine_5397526.html"
"False","True","Journée des aidants : ""Ils sont la colonne vertébrale invisible du système de santé"", estime une médecin spécialiste de santé publique","https://mobile.francetvinfo.fr/economie/emploi/carriere/vie-professionnelle/journee-des-aidants-ils-sont-la-colonne-vertebrale-invisible-du-systeme-de-sante-estime-une-medecin-specialiste-de-sante-publique_5401129.html"
"False","True","Coupe du monde de rugby 2022 : le statut d'outsider des Bleues est ""complètement assumé"", assure la demi de mêlée Alexandra Chambon","https://mobile.francetvinfo.fr/sports/rugby/coupe-du-monde/coupe-du-monde-de-rugby-2022-le-statut-d-outsider-des-bleues-est-completement-assume-assure-la-demi-de-melee-alexandra-chambon_5401039.html"
"False","True","""Il n'y a pas un euro des cotisations retraites qui servira à financer autre chose que les retraites"", assure Olivier Dussopt","https://mobile.francetvinfo.fr/economie/retraite/reforme-des-retraites/retraites-pas-un-euro-des-cotisations-ne-servira-a-financer-autre-chose-que-les-retraites-assure-olivier-dussopt_5400928.html"
"False","True","La Mammobile se déplace au plus près des femmes pour dépister le cancer du sein","https://mobile.francetvinfo.fr/sante/cancer/la-mammobile-se-deplace-au-plus-pres-des-femmes-pour-depister-le-cancer-du-sein_5398804.html"
"False","True","La Normandie lance le premier car transformé pour rouler à l’hydrogène","https://mobile.francetvinfo.fr/monde/environnement/crise-climatique/empreinte-carbone/transports/la-normandie-lance-le-premier-car-transforme-pour-rouler-a-lhydrogene_5398696.html"
"False","True","VRAI OU FAKE : des experts ont-ils affirmé que le vaccin anti-Covid est dangereux ?","https://mobile.francetvinfo.fr/sante/maladie/coronavirus/vaccin/vrai-ou-fake-des-experts-ont-ils-affirme-que-le-vaccin-anti-covid-est-dangereux_5399458.html"
"False","True","VRAI OU FAKE : comment des copies de sites d'actualité ont-elles été créées ?","https://mobile.francetvinfo.fr/monde/europe/manifestations-en-ukraine/vrai-ou-fake-comment-des-copies-de-sites-d-actualite-ont-elles-ete-creees_5399521.html"
"False","True","À Perpignan, un chef étoilé passe à la semaine de quatre jours et fait le plein de candidatures","https://mobile.francetvinfo.fr/economie/emploi/metiers/restauration-hotellerie-sports-loisirs/a-perpignan-un-chef-etoile-passe-a-la-semaine-de-quatre-jours-et-fait-le-plein-de-candidatures_5394952.html"
"False","True","A Marseille, des croisières à la voile pour aider les personnels soignants à décompresser","https://mobile.francetvinfo.fr/economie/emploi/carriere/vie-professionnelle/sante-au-travail/a-marseille-des-croisieres-a-la-voile-pour-aider-les-personnels-soignants-a-decompresser_5395447.html"
"False","True","Dans le Rhône, l'art contemporain s'invite chez les commerçants de Saint-Priest","https://mobile.francetvinfo.fr/culture/arts-expos/art-contemporain/dans-le-rhone-l-art-contemporain-s-invite-chez-les-commercants-de-saint-priest_5397190.html"
"False","True","Près de Reims, des vélos-bureaux pour aider les enfants à se concentrer","https://mobile.francetvinfo.fr/societe/enfance-et-adolescence/pres-de-reims-des-velos-bureaux-pour-aider-les-enfants-a-se-concentrer_5395171.html"
"False","True","À Castres, des activités sportives pour aider les personnes atteintes de cancer","https://mobile.francetvinfo.fr/sante/cancer/a-castres-des-activites-sportives-pour-aider-les-personnes-atteintes-de-cancer_5394859.html"
"False","True","En Haute-Marne, Saint-Dizier veut faire bouger ses habitants avec le design actif","https://mobile.francetvinfo.fr/france/ilsontlasolution/en-haute-marne-saint-dizier-veut-faire-bouger-ses-habitants-avec-le-design-actif_5397037.html"
"False","True","À Amiens, 5000 capuchons anti-GHB distribués dans des bars","https://mobile.francetvinfo.fr/france/ilsontlasolution/a-amiens-5000-capuchons-anti-ghb-distribues-dans-des-bars_5396824.html"
"False","True","""The Woman King"" : les Amazones du Dahomey se sont-elles opposées à la traite des esclaves comme le montre le film ?","https://mobile.francetvinfo.fr/culture/cinema/the-woman-king-les-amazones-du-dahomey-se-sont-elles-opposees-a-la-traite-des-esclaves-comme-le-montre-le-film_5391673.html"
"False","True","Vaisselle, tableaux, mobilier ancien... Visualisez la disparition de milliers d'œuvres d'art prêtées aux institutions françaises","https://mobile.francetvinfo.fr/culture/patrimoine/infographies-vaisselle-tableaux-mobilier-ancien-visualisez-la-disparition-de-milliers-d-oeuvres-d-art-pretees-aux-institutions-francaises_5388322.html"
"False","True","Crise de l'énergie : ces mesures de la Convention citoyenne pour le climat qui auraient pu être utiles","https://mobile.francetvinfo.fr/monde/environnement/crise-climatique/crise-de-l-energie-ces-mesures-de-la-convention-citoyenne-pour-le-climat-qui-auraient-pu-etre-utiles_5398843.html"
"False","True","Violences sexistes et sexuelles : on a passé deux jours avec des policiers en formation pour recueillir les plaintes de victimes","https://mobile.francetvinfo.fr/faits-divers/police/reportage-violences-sexistes-et-sexuelles-on-a-passe-deux-jours-avec-des-policiers-en-formation-pour-recueillir-les-plaintes-de-victimes_5362078.html"
"False","True","#MeToo : cinq ans après, des victimes d'Harvey Weinstein reviennent sur ce que le mouvement a changé","https://mobile.francetvinfo.fr/culture/cinema/affaire-harvey-weinstein/metoo-cinq-ans-apres-des-victimes-d-harvey-weinstein-reviennent-sur-ce-que-le-mouvement-a-change_5390032.html"
"False","True","Championnats européens 2022 : abandon de Mayer, sacre de Duplantis, razzia du cyclisme tricolore... Revivez les moments forts de la compétitionDu 11 au 21 août 2022, les Championnats européens de Munich ont offert un beau spectacle.","https://mobile.francetvinfo.fr/sports/cyclisme/piste/en-images-championnats-europeens-2022-abandon-de-mayer-sacre-de-duplantis-razzia-du-cyclisme-tricolore-revivez-les-moments-forts-de-la-competition_5317486.html"
"False","True","Retraite de Roger Federer : les adieux émouvants d'une légende du tennisRoger Federer a disputé le dernier match de sa carrière, vendredi, à Londres lors de la Laver Cup.","https://mobile.francetvinfo.fr/sports/tennis/roger-federer/en-images-retraite-de-roger-federer-les-adieux-emouvants-d-une-legende-du-tennis_5378851.html"
"False","True","Funérailles de la reine Elizabeth II : retour sur onze jours de commémorations historiquesDu château de Balmoral, où elle s'est éteinte le 8 septembre, à Westminster Hall, où les Britanniques se recueillent devant son cercueil, franceinfo revient sur une semaine de deuil et d'hommages a...","https://mobile.francetvinfo.fr/monde/royaume-uni/mort-delizabeth-ii/en-images-funerailles-de-la-reine-elizabeth-ii-une-semaine-de-commemorations-historiques_5364061.html"
