"premium","picture","title","url"
"False","True","L'inflation en France progresse encore en juillet et atteint 6,1% sur un an, selon l'Insee","https://mobile.francetvinfo.fr/economie/inflation/l-inflation-en-france-progresse-encore-en-juillet-et-atteint-6-1-sur-un-an-selon-l-insee_5283232.html"
"False","True","La croissance de l'économie française a atteint +0,5% au deuxième trimestre, deux fois plus qu'attendu, selon l'Insee","https://mobile.francetvinfo.fr/economie/croissance/la-croissance-de-l-economie-francaise-a-atteint-0-5-au-deuxieme-trimestre-deux-fois-plus-qu-attendu-selon-l-insee_5283190.html"
"False","True","Pouvoir d'achat : les sénateurs adoptent une vingtaine d'amendements au projet de budget rectificatif pour 2022","https://mobile.francetvinfo.fr/economie/pouvoir-achat/pouvoir-d-achat-les-senateurs-adoptent-une-vingtaine-d-amendements-au-projet-de-budget-rectificatif-pour-2022_5282527.html"
"False","True","Le groupe Engie va verser une remise complémentaire, de ""100 euros en moyenne"", pour ses clients qui bénéficient du chèque énergie","https://mobile.francetvinfo.fr/economie/energie/le-groupe-engie-va-verser-une-remise-complementaire-de-100-euros-en-moyenne-pour-ses-clients-qui-beneficient-du-cheque-energie_5282449.html"
"False","True","La hausse des prix est-elle ""largement due à la spéculation des grands groupes"", comme l'affirme le député LFI Adrien Quatennens ?","https://mobile.francetvinfo.fr/economie/inflation/vrai-ou-fake-la-hausse-des-prix-est-elle-largement-due-a-la-speculation-des-grands-groupes-comme-l-affirme-adrien-quatennens_5267845.html"
"False","True","Incendies dans l'Hérault : ce que l'on sait du pompier pyromane en quête d'""adrénaline"", qui a avoué être à l'origine de plusieurs feux","https://mobile.francetvinfo.fr/faits-divers/incendie/incendies-dans-l-herault-ce-que-l-on-sait-du-profil-du-pompier-pyromane-qui-a-avoue-etre-a-l-origine-de-plusieurs-feux_5283214.html"
"False","True","Emmanuel Macron : avant les vacances d'été, un dernier Conseil des ministres pour faire un premier bilan et ""positiver""","https://mobile.francetvinfo.fr/politique/emmanuel-macron/emmanuel-macron-avant-les-vacances-d-ete-un-dernier-conseil-des-ministres-pour-faire-un-premier-bilan-du-debut-du-quinquennat_5283235.html"
"False","True","Variole du singe : comment les associations et personnes à risque se mobilisent en France pour faire face à l'épidémie","https://mobile.francetvinfo.fr/sante/maladie/variole-du-singe/variole-du-singe-comment-les-associations-et-personnes-a-risque-se-mobilisent-en-france-pour-faire-face-a-l-epidemie_5280241.html"
"False","True","Ligue 2 : Bordeaux et Saint-Etienne en invités surprises, deux montées au programme... Tout ce qu'il faut savoir sur la nouvelle saison","https://mobile.francetvinfo.fr/sports/foot/ligue-2/ligue-2-bordeaux-et-saint-etienne-en-invites-surprises-deux-montees-au-programme-tout-ce-qu-il-faut-s-avoir-sur-la-nouvelle-saison_5280526.html"
"False","True","Chassé-croisé des vacances d'été : la SNCF prévoit un pic de fréquentation vendredi, Bison Futé annonce un samedi noir sur les routes","https://mobile.francetvinfo.fr/economie/transports/trafic/chasse-croise-en-vacances-la-sncf-prevoit-pic-de-frequentation-vendredi-bison-fute-annonce-un-samedi-noir-sur-les-routes_5280424.html"
"False","True","Enquête pour harcèlement et agression sexuels visant Eric Coquerel : ""Je n'ai rien à redire sur cette affaire"", répond le député","https://mobile.francetvinfo.fr/societe/violences-faites-aux-femmes/enquete-pour-harcelement-et-agression-sexuels-visant-eric-coquerel-je-n-ai-rien-a-redire-sur-cette-affaire-repond-le-depute_5283268.html"
"False","True","Prix des carburants : l'aide pour les pêcheurs est prolongée jusqu'au 30 septembre","https://mobile.francetvinfo.fr/economie/transports/prix-des-carburants/prix-des-carburants-l-aide-pour-les-pecheurs-est-prolongee-jusqu-au-30-septembre_5283265.html"
"False","True","Lyon : une école de management hôtelier soupçonnée d'escroquerie par des étudiants","https://mobile.francetvinfo.fr/economie/emploi/metiers/droit-et-justice/information-franceinfo-lyon-une-ecole-de-management-hotelier-soupconnee-d-escroquerie-par-des-etudiants_5282422.html"
"False","True","A l'Elysée, la longue poignée de mains entre Emmanuel Macron et Mohammed Ben Salmane, au cœur d'une rencontre controversée","https://mobile.francetvinfo.fr/politique/emmanuel-macron/a-l-elysee-la-longue-poignee-entre-emmanuel-macron-et-mohammed-ben-salmane-au-coeur-d-une-rencontre-controversee_5282851.html"
"False","True","Les Etats-Unis condamnent les propos racistes de Victor Orban, le Premier ministre hongrois défend un ""point de vue culturel""","https://mobile.francetvinfo.fr/monde/europe/union-europeenne/les-etats-unis-condamnent-les-propos-racistes-de-victor-orban-le-premier-ministre-hongrois-defend-un-point-de-vue-culturel_5283181.html"
"False","True","Off d'Avignon : le co-président du festival ""espère que, d'ici 2023, le niveau de fréquentation sera revenu à la normale""","https://mobile.francetvinfo.fr/culture/spectacles/theatre/off-d-avignon-le-co-president-du-festival-espere-que-d-ici-2023-le-niveau-de-frequentation-sera-revenu-a-la-normale_5283211.html"
"False","True","Tour de France femmes 2022 : ""On se sent pousser des ailes"", s'enthousiasment les coureuses, impressionnées par le public le long des routes","https://mobile.francetvinfo.fr/tour-de-france/tour-de-france-femmes-2022-on-se-sent-pousser-des-ailes-s-enthousiasment-les-coureuses-impressionnees-par-le-public-le-long-des-routes_5283133.html"
"False","True","Disparition de Tiphaine Véron : quatre ans après, sa famille lance une pétition pour dénoncer ""l'inertie de la justice""","https://mobile.francetvinfo.fr/monde/japon/disparition-de-tiphaine-veron-quatre-ans-apres-sa-famille-lance-une-petition-pour-denoncer-l-inertie-de-la-justice_5282842.html"
"False","True","Beyoncé : on a écouté son nouvel album ""Renaissance""","https://mobile.francetvinfo.fr/culture/musique/beyonce/beyonce-on-a-ecoute-son-nouvel-album-renaissance-et-queen-b-de-retour_5282287.html"
"False","True","Canada : en pleine ""perte de vitesse"" de la religion catholique au Québec, le pape célèbre une nouvelle messe pour les autochtones","https://mobile.francetvinfo.fr/monde/vatican/pape-francois/canada-en-pleine-perte-de-vitesse-de-la-religion-catholique-au-quebec-le-pape-celebre-une-nouvelle-messe-pour-les-autochtones_5282455.html"
"False","True","Incendies en Gironde : trois départements demandent des ""états généraux"" sur la gestion de la forêt des Landes de Gascogne","https://mobile.francetvinfo.fr/faits-divers/incendies-en-gironde/incendies-en-gironde-trois-departements-demandent-des-etats-generaux-sur-la-gestion-de-la-foret-des-landes_5283157.html"
"False","True","Assassinat d'Yvan Colonna : Matignon annonce des ""procédures disciplinaires"" contre deux agents de la prison d'Arles","https://mobile.francetvinfo.fr/politique/affaire/agression-d-yvan-colonna-en-prison/assassinat-d-yvan-colonna-matignon-annonce-des-procedures-disciplinaires-contre-deux-agents-de-la-prison-d-arles_5282398.html"
"False","True","TÉMOIGNAGES. ""Ça fait partie du métier, c'est comme ça"" : des footballeurs professionnels au chômage racontent leur stage d'intersaison pour retrouver un club","https://mobile.francetvinfo.fr/sports/foot/temoignages-ca-fait-partie-du-metier-c-est-comme-ca-des-footballeurs-professionnels-au-chomage-racontent-leur-stage-d-intersaison-pour-retrouver-un-club_5282209.html"
"False","True","La photographe Irina Ionesco, connue pour ses photos sulfureuses de sa fille enfant, est morte à l'âge de 91 ans","https://mobile.francetvinfo.fr/culture/arts-expos/photographie/la-photographe-controversee-irina-ionesco-connue-pour-les-photos-sulfureuses-de-sa-fille-enfant-est-morte-a-l-age-de-91-ans_5283262.html"
"False","True","Tour de France femmes 2022 : comment les équipementiers s'adaptent au peloton féminin","https://mobile.francetvinfo.fr/tour-de-france/tour-de-france-femmes-2022-comment-les-equipementiers-s-adaptent-au-peloton-feminin_5282227.html"
"False","True","Tour de France femmes 2022 : quatre cols classés, un parcours accidenté taillé pour les baroudeuses avant la haute montagne... La sixième étape en questions","https://mobile.francetvinfo.fr/tour-de-france/tour-de-france-femmes-2022-quatre-cols-classes-un-parcours-accidente-taille-pour-les-baroudeuses-avant-la-haute-montagne-la-sixieme-etape-en-questions_5282116.html"
"False","True","APPEL A TEMOIGNAGES. Ce ""coin de paradis"" qui vous est familier a changé sous l'effet de la sécheresse, de la canicule ou d'un autre phénomène météorologique ? Racontez-nous !","https://mobile.francetvinfo.fr/monde/environnement/crise-climatique/appel-a-temoignages-ce-coin-de-paradis-qui-vous-est-familier-a-change-sous-l-effet-du-rechauffement-climatique-racontez-nous_5282053.html"
"False","True","Santé : des soupçons de fraude ébranlent les recherches récentes sur la maladie d'Alzheimer","https://mobile.francetvinfo.fr/sante/maladie/sante-des-soupcons-de-fraude-ebranlent-les-recherches-recentes-sur-la-maladie-d-alzheimer_5282251.html"
"False","True","Pourquoi les gigantesques profits de Total font-ils grincer des dents ?","https://mobile.francetvinfo.fr/economie/transports/prix-des-carburants/pourquoi-les-gigantesques-profits-de-total-font-ils-grincer-des-dents_5281912.html"
"False","True","Pourquoi le gaz naturel liquéfié américain, appelé à la rescousse pour remplacer le gaz russe, plombe nos ambitions climatiques","https://mobile.francetvinfo.fr/monde/environnement/crise-climatique/pourquoi-le-gaz-naturel-liquefie-americain-appele-a-la-rescousse-pour-remplacer-le-gaz-russe-plombe-nos-ambitions-climatiques_5278540.html"
"False","True","Guerre en Ukraine : comment vont se dérouler les exportations de céréales qui doivent reprendre ""dès cette semaine"" ?","https://mobile.francetvinfo.fr/monde/europe/manifestations-en-ukraine/guerre-en-ukraine-comment-vont-se-derouler-les-exportations-de-cereales-qui-doivent-reprendre-des-cette-semaine_5281696.html"
"False","True","À Reims, la surprenante exposition ""Image 3.0"" questionne les visiteurs du Cellier","https://mobile.francetvinfo.fr/culture/arts-expos/art-contemporain/a-reims-la-surprenante-exposition-image-3-0-questionne-les-visiteurs-du-cellier_5277136.html"
"False","True","À Dunkerque, une rétrospective consacrée à Xavier Degans, artiste prolifique formé par Dali","https://mobile.francetvinfo.fr/culture/arts-expos/peinture/a-dunkerque-une-retrospective-consacree-a-xavier-degans-artiste-prolifique-forme-par-dali_5270017.html"
"False","True","Brad Pitt en jupe… la tendance fait un nouvel adepte","https://mobile.francetvinfo.fr/culture/cinema/video-brad-pitt-en-jupe-la-tendance-fait-un-nouvel-adepte_5272126.html"
"False","True","Pendant les vacances, des stages d’e-sport pour s’améliorer sur Fortnite et se fixer des règles","https://mobile.francetvinfo.fr/culture/jeux-video/reportage-pendant-les-vacances-des-stages-de-sport-pour-sameliorer-sur-fortnite-et-se-fixer-des-regles_5269930.html"
"False","True","À Paris, les trésors du Limousin à l'honneur du musée de Cluny","https://mobile.francetvinfo.fr/culture/patrimoine/histoire/aparis-les-tresors-du-limousin-a-l-honneur-du-musee-de-cluny_5263714.html"
"False","True","RéfleXion(s) : Strasbourg réinvente ses illuminations estivales","https://mobile.francetvinfo.fr/culture/en-regions/reflexion-s-strasbourg-reinvente-ses-illuminations-estivales_5250193.html"
"False","True","Christian Louboutin, le célèbre créateur des chaussures à semelle rouge, expose à Monaco","https://mobile.francetvinfo.fr/culture/mode/createurs/christian-louboutin-le-celebre-createur-des-chaussures-a-semelle-rouge-expose-a-monaco_5254426.html"
"False","True","Le musée Perrier pétille à nouveau avec une nouvelle exposition à Vergèze dans le Gard","https://mobile.francetvinfo.fr/culture/patrimoine/histoire/le-musee-perrier-petille-a-nouveau-avec-une-nouvelle-exposition-a-vergeze-dans-le-gard_5244877.html"
"False","True","En Isère, la montagne accessible en joëlette pour les personnes en situation de handicap","https://mobile.francetvinfo.fr/sante/sport-et-sante/en-isere-la-montagne-accessible-en-joelette-pour-les-personnes-en-situation-de-handicap_5251978.html"
"False","True","Les super-héros pop art de Greg Guillemin, alias ""Léon"", investissent le château de Val","https://mobile.francetvinfo.fr/culture/arts-expos/les-super-heros-pop-art-de-greg-guillemin-alias-leon-investissent-le-chateau-de-val-en-correze_5236855.html"
"False","True","Dans le Calvados, une brigade mobile de gendarmes à la rencontre des habitants","https://mobile.francetvinfo.fr/economie/emploi/metiers/armee-et-securite/dans-le-calvados-une-brigade-mobile-de-gendarmes-a-la-rencontre-des-habitants_5251696.html"
"False","True","À Ruoms en Ardèche, un distributeur automatique de viande ouvert 24h sur 24","https://mobile.francetvinfo.fr/france/ilsontlasolution/a-ruoms-en-ardeche-un-distributeur-automatique-de-viande-ouvert-24h-sur-24_5251573.html"
"False","True","Variole du singe : comment les associations et personnes à risque se mobilisent en France pour faire face à l'épidémie","https://mobile.francetvinfo.fr/sante/maladie/variole-du-singe/variole-du-singe-comment-les-associations-et-personnes-a-risque-se-mobilisent-en-france-pour-faire-face-a-l-epidemie_5280241.html"
"False","True","Pourquoi les gigantesques profits de Total font-ils grincer des dents ?","https://mobile.francetvinfo.fr/economie/transports/prix-des-carburants/pourquoi-les-gigantesques-profits-de-total-font-ils-grincer-des-dents_5281912.html"
"False","True","Pourquoi le gaz naturel liquéfié américain, appelé à la rescousse pour remplacer le gaz russe, plombe nos ambitions climatiques","https://mobile.francetvinfo.fr/monde/environnement/crise-climatique/pourquoi-le-gaz-naturel-liquefie-americain-appele-a-la-rescousse-pour-remplacer-le-gaz-russe-plombe-nos-ambitions-climatiques_5278540.html"
"False","True","Cinq questions sur le lien entre nitrates et nitrites dans la charcuterie et risques de cancer","https://mobile.francetvinfo.fr/sante/alimentation/cinq-questions-sur-le-lien-entre-nitrates-et-nitrites-dans-la-charcuterie-et-risques-de-cancer_5254009.html"
"False","True","Festival d’Avignon 2022 : ""La Nuit immersive"" met le cap sur le futur en mêlant art et nouvelles technologiesUn autre regard sur l'art imaginé par Tracks, le magazine d'Arte, et l'Adami (société de services aux artistes-interprètes) dans le cadre du Festival d'Avignon.","https://mobile.francetvinfo.fr/festival-avignon/festival-davignon-2022-la-nuit-immersive-met-le-cap-sur-le-futur-en-melant-art-et-nouvelles-technologies_5254321.html"
"False","True","Incendie géant en Californie : l'""Oak Fire"" déferle dans les collines boiséesL'incendie s'est déclaré près du célèbre parc national de Yosemite. Il est déjà devenu le plus gros feu de forêt californien de la saison, comme en attestent les photos impressionnantes prises...","https://mobile.francetvinfo.fr/monde/usa/incendies-en-californie/en-images-incendie-geant-en-californie-l-oak-fire-deferle-dans-les-collines-boisees_5278216.html"
"False","True","20 ans de Festival d'Avignon par son photographe Christophe Raynaud de LageRencontre avec Christophe Raynaud de Lage, photographe du Festival d'Avignon depuis 2005, à qui une exposition est consacré à la Maison Jean Vilar (""L'oeil présent"", jusqu'en mars 2023). Pour nous,...","https://mobile.francetvinfo.fr/culture/spectacles/theatre/en-images-20-ans-de-festival-d-avignon-resume-par-son-photographe-christophe-raynaud-de-lage_5257789.html"
