"premium","picture","title","url"
"True","True","Mort d’une Nigériane : un témoin accuse les gendarmes","https://www.mediapart.fr/journal/france/300522/mort-de-blessing-20-ans-la-frontiere-un-temoin-sort-de-l-ombre-pour-accuser-les-gendarmes"
"True","True","Usul. Législatives : pourquoi les candidats RN sont-ils si nuls ?","https://www.mediapart.fr/journal/france/300522/usul-legislatives-pourquoi-les-candidats-rn-sont-ils-si-nuls"
"True","False","Violences sexuelles à Havas : la fabrique du silence","https://www.mediapart.fr/journal/france/290522/violences-sexuelles-havas-la-fabrique-du-silence"
"True","False","Ligue des champions : la France gagne le trophée de l’incompétence","https://www.mediapart.fr/journal/france/290522/ligue-des-champions-la-france-gagne-le-trophee-de-l-incompetence"
"True","True","General Electric : 800 millions d’euros transférés de France vers des paradis fiscaux","https://www.mediapart.fr/journal/france/300522/general-electric-800-millions-d-euros-transferes-de-france-vers-des-paradis-fiscaux"
"True","True","En Seine-Maritime, Alma Dufour veut concilier « fin du monde et fin du mois »","https://www.mediapart.fr/journal/france/290522/legislatives-en-seine-maritime-l-activiste-alma-dufour-veut-concilier-fin-du-monde-et-fin-du-mois"
"True","False","À Paris, Caroline Mecary rêve de faire tomber une figure de la Macronie","https://www.mediapart.fr/journal/france/290522/legislatives-paris-l-avocate-caroline-mecary-reve-de-faire-tomber-une-figure-de-la-macronie"
"True","False","À Lyon, l’antifa Raphaël Arnault aspire à être député","https://www.mediapart.fr/journal/france/260522/raphael-arnault-l-antifa-qui-veut-etre-depute"
"True","True","En Italie, Aboubakar Soumahoro porte la voix des ouvriers agricoles et autres « invisibles »","https://www.mediapart.fr/journal/international/290522/en-italie-aboubakar-soumahoro-porte-la-voix-des-ouvriers-agricoles-et-autres-invisibles"
"True","False","Le pouvoir iranien en voie de talibanisation","https://www.mediapart.fr/journal/international/290522/le-pouvoir-iranien-en-voie-de-talibanisation"
"True","True","Le miroir déformant de la prétendue laïcité turque","https://www.mediapart.fr/journal/culture-idees/270522/le-miroir-deformant-de-la-pretendue-laicite-turque"
"True","True","Violences sexuelles et sexistes : que font les partis politiques ?","https://www.mediapart.fr/journal/france/250522/violences-sexuelles-et-sexistes-que-font-les-partis-politiques"
"True","True","Bifurqueurs : « Mettre ses compétences au service de ses valeurs »","https://www.mediapart.fr/journal/france/240522/bifurqueurs-mettre-ses-competences-au-service-de-ses-valeurs"
"True","True","« L’esprit critique » : autour des spectacles d’Alice Zeniter, Joël Pommerat, Milo Rau et Édouard Louis","https://www.mediapart.fr/journal/culture-idees/290522/l-esprit-critique-autour-des-spectacles-d-alice-zeniter-joel-pommerat-milo-rau-et-edouard-louis"
"True","True","Comment le CHU de Bordeaux a broyé ses urgentistes","https://www.mediapart.fr/journal/france/280522/comment-le-chu-de-bordeaux-broye-ses-urgentistes"
"True","False","« Travail dissimulé » : la lourde condamnation de Ryanair confirmée en appel","https://www.mediapart.fr/journal/economie/280522/travail-dissimule-la-lourde-condamnation-de-ryanair-confirmee-en-appel"
"True","False","En Alsace, les nouveaux droits des travailleurs détenus repoussent les entreprises","https://www.mediapart.fr/journal/economie/280522/en-alsace-les-nouveaux-droits-des-travailleurs-detenus-repoussent-les-entreprises"
"True","True","Force ouvrière : les dessous d’une succession bien ficelée","https://www.mediapart.fr/journal/economie/280522/force-ouvriere-les-dessous-d-une-succession-bien-ficelee"
"True","True","En Ukraine, des militantes viennent en aide aux « survivantes » de viols de guerre","https://www.mediapart.fr/journal/international/280522/en-ukraine-des-militantes-viennent-en-aide-aux-survivantes-de-viols-de-guerre"
"True","False","Ukraine : divisé, le monde occidental peine à dessiner une issue","https://www.mediapart.fr/journal/international/260522/guerre-en-ukraine-divise-le-monde-occidental-peine-dessiner-une-issue"
"True","False","La guerre a déplacé des milliers d’orphelins et d’enfants placés","https://www.mediapart.fr/journal/international/260522/en-ukraine-la-guerre-deplace-des-milliers-d-orphelins-et-d-enfants-places"
"True","False","Marioupol, ville martyre","https://www.mediapart.fr/journal/international/240522/marioupol-ville-martyre"
"True","True","« Lutte jeunesse » : puisqu’on est jeunes et corses","https://www.mediapart.fr/studio/documentaires/culture-idees/lutte-jeunesse-puisqu-est-jeunes-et-corses"
"True","True","Sur les réseaux sociaux, les jeunes chercheurs obligés de « se vendre »","https://www.mediapart.fr/journal/france/280522/sur-les-reseaux-sociaux-les-jeunes-chercheurs-obliges-de-se-vendre"
"True","False","Le malentendu Pap Ndiaye","https://www.mediapart.fr/journal/france/270522/le-malentendu-pap-ndiaye"
"True","False","Les publicitaires font main basse sur les données des élèves partout dans le monde","https://www.mediapart.fr/journal/international/250522/les-publicitaires-font-main-basse-sur-les-donnees-des-eleves-partout-dans-le-monde"
"True","False","Élèves traqués par les publicitaires du Net : le casse-tête des enseignants français","https://www.mediapart.fr/journal/france/250522/eleves-traques-par-les-publicitaires-du-net-le-casse-tete-des-enseignants-francais"
"True","True","Clinea, la psychiatrie très lucrative façon Orpea","https://www.mediapart.fr/journal/france/270522/clinea-la-psychiatrie-tres-lucrative-facon-orpea"
"True","False","Violences sexuelles : une star de la télé-réalité visée par deux plaintes","https://www.mediapart.fr/journal/france/270522/violences-sexuelles-une-star-de-la-tele-realite-visee-par-deux-plaintes"
"True","False","Éleveur tué par un gendarme : « Les juges ne veulent pas faire éclater la vérité »","https://www.mediapart.fr/journal/france/270522/eleveur-tue-par-un-gendarme-les-juges-ne-veulent-pas-faire-eclater-la-verite"
"True","False","Oksana Zaboujko : le sexe et l’Ukraine","https://www.mediapart.fr/journal/culture-idees/280522/oksana-zaboujko-le-sexe-et-l-ukraine"
"True","False","Un sociologue déconstruit les mythes de l’engagement autonome","https://www.mediapart.fr/journal/culture-idees/280522/un-sociologue-deconstruit-les-mythes-de-l-engagement-autonome"
"True","True","Comment le RN cible le rassemblement des gauches","https://www.mediapart.fr/journal/france/270522/legislatives-comment-le-rn-cible-le-rassemblement-des-gauches"
"True","False","Le travail sexuel, angle mort de la Nupes","https://www.mediapart.fr/journal/france/270522/le-travail-sexuel-angle-mort-de-la-nupes-pour-les-legislatives"
"True","False","L’amour toujours : pourquoi l’Italie fascine depuis longtemps l’extrême droite française","https://www.mediapart.fr/journal/france/260522/l-amour-toujours-pourquoi-l-italie-fascine-depuis-longtemps-l-extreme-droite-francaise"
"True","False","À gauche, le candidat Gérald Dahan sait aussi imiter les arnaqueurs","https://www.mediapart.fr/journal/france/250522/le-candidat-gerald-dahan-sait-aussi-imiter-les-arnaqueurs"
"True","False","Un droit de réponse de Claire Pitollat","https://www.mediapart.fr/journal/france/300522/un-droit-de-reponse-de-claire-pitollat"
"True","True","Parlement : ce que peut espérer la Nupes","https://www.mediapart.fr/journal/france/260522/parlement-ce-que-la-gauche-peut-esperer"
"True","False","Législatives : le retour du péril rouge","https://www.mediapart.fr/journal/france/260522/legislatives-le-retour-du-peril-rouge"
"True","False","Les économistes en gardiens du temple","https://www.mediapart.fr/journal/economie/260522/face-la-gauche-les-economistes-en-gardiens-du-temple"
"True","False","Législatives : des candidats de la majorité préfèrent s’afficher sans Macron","https://www.mediapart.fr/journal/france/260522/legislatives-des-candidats-de-la-majorite-preferent-s-afficher-sans-macron"
"True","True","Royaume-Uni : Johnson s’attaque à la vie chère pour sauver sa peau","https://www.mediapart.fr/journal/international/270522/royaume-uni-johnson-s-attaque-la-vie-chere-pour-sauver-sa-peau"
"True","False","La gauche colombienne se prépare à une victoire historique à la présidentielle","https://www.mediapart.fr/journal/international/270522/la-gauche-colombienne-se-prepare-une-victoire-historique-la-presidentielle"
"True","False","« Il est temps qu’elle s’en aille » : l’hostilité envers la France gagne aussi le Tchad","https://www.mediapart.fr/journal/international/260522/il-est-temps-qu-elle-s-en-aille-l-hostilite-envers-la-france-gagne-aussi-le-tchad"
"True","False","Fusillades dans les écoles : le cauchemar américain","https://www.mediapart.fr/journal/international/250522/fusillades-dans-les-ecoles-le-cauchemar-americain"
"True","True","Face à la sécheresse, organiser collectivement la solidarité","https://www.mediapart.fr/journal/international/270522/face-la-secheresse-organiser-collectivement-la-solidarite"
"True","False","Au Pakistan, la température frôle les 50 °C et accable les plus pauvres","https://www.mediapart.fr/journal/international/240522/au-pakistan-la-temperature-frole-les-50-c-et-accable-les-plus-pauvres"
"True","False","Total persiste et signe pour le chaos climatique","https://www.mediapart.fr/journal/france/250522/total-persiste-et-signe-pour-le-chaos-climatique"
"True","False","Gare d’Austerlitz : le futur complexe immobilier visé par une plainte","https://www.mediapart.fr/journal/france/250522/gare-d-austerlitz-le-futur-complexe-immobilier-vise-par-une-plainte"
"True","True","À LREM, des carences systématiques","https://www.mediapart.fr/journal/france/250522/violences-sexuelles-lrem-la-defaillance-systematique"
