"premium","picture","title","url"
"False","True","Argentine-France : les Bleus avec Varane, Upamecano, Giroud et Rabiot pour la finale","https://www.leparisien.fr/sports/football/coupe-du-monde/argentine-france-les-bleus-avec-varane-upamecano-giroud-et-rabiot-pour-la-finale-18-12-2022-IGMF54CZ4RFFJKK5AZHY2CNRDQ.php"
"True","True","Coupe du monde : de Marseille à Hénin-Beaumont, la France retient son souffle pour les Bleus","https://www.leparisien.fr/sports/football/coupe-du-monde/coupe-du-monde-de-marseille-a-henin-beaumont-la-france-retient-son-souffle-pour-les-bleus-18-12-2022-SONOUUT7DRBV7DWFWLHREQLPSY.php"
"False","True","DIRECT. Argentine-France : l'ambiance monte à Doha, H-1 avant la finale","https://www.leparisien.fr/sports/football/coupe-du-monde/direct-argentine-france-les-bleus-revent-dun-nouveau-titre-suivez-la-finale-de-la-coupe-du-monde-18-12-2022-BZI3TNOCAVHAHITYBGZMHVWCPI.php"
"False","True","Argentine-France : champions du monde ou vice... combien les Bleus vont-ils toucher en primes ?","https://www.leparisien.fr/sports/football/coupe-du-monde/argentine-france-champions-du-monde-ou-vice-combien-les-bleus-vont-ils-toucher-en-primes-18-12-2022-TQVG26MI3NFNRGBQDWPR2WV6MM.php"
"False","True","VIDÉO. «On a pris nos économies» : ces supporters qui font l’aller-retour au Qatar pour voir les Bleus en finale","https://www.leparisien.fr/video/video-on-a-pris-nos-economies-ces-supporters-qui-font-laller-retour-au-qatar-pour-voir-les-bleus-en-finale-18-12-2022-L4SOT2MYCJBXJGEHLM5UPPG7LA.php"
"True","True","Immobilier : comment Christelle, enseignante, est devenue propriétaire de 23 logements","https://www.leparisien.fr/immobilier/immobilier-comment-christelle-enseignante-est-devenue-proprietaire-de-23-logements-18-12-2022-O7BUSJNNLBBNNFC2ZUFIJK734Q.php"
"False","True","Qui est Indira Ampiot, la nouvelle Miss France venue de Guadeloupe ?","https://www.leparisien.fr/culture-loisirs/qui-est-indira-ampiot-la-nouvelle-miss-france-18-12-2022-X4FJW5KCJBEBZOZDLIE5ZG5ZNQ.php"
"False","True","+10 degrés en 24 heures : un redoux attendu sur toute la France dès ce lundi","https://www.leparisien.fr/meteo/10-degres-en-24-heures-un-redoux-attendu-sur-toute-la-france-des-ce-lundi-18-12-2022-RA53XXKSFZEXLBKZUTLAV4LP7Q.php"
"False","True","Covid-19 : hôpitaux sous tension, crématoriums débordés… la Chine face à une vague massive d’infections","https://www.leparisien.fr/societe/covid-19-hopitaux-sous-tension-crematoriums-debordes-la-chine-face-a-une-vague-massive-dinfections-18-12-2022-KUIMO6LITVH2LFXANLHJGAS7SY.php"
"True","True","Guerre en Ukraine : à Bakhmout, la vie de Ludmila, Victoria, Alexii et Volodymir sous le fracas des armes","https://www.leparisien.fr/faits-divers/guerre-en-ukraine-a-bakhmout-la-vie-de-ludmila-victoria-alexii-et-volodymir-sous-le-fracas-des-armes-18-12-2022-KOQQY4B3JBGHZAEES3PEKWW7TI.php"
"True","True","«Je pourrais faire dix rencontres par semaine» : dans le lit de Pascale, devenue libertine à 50 ans","https://www.leparisien.fr/intime/je-pourrais-faire-dix-rencontres-par-semaine-dans-le-lit-de-pascale-devenue-libertine-a-50-ans-18-12-2022-DJJHFPNEAVBEFDQQIJY3UZLJ54.php"
"True","True","Bien-être animal : pourquoi on arrache les yeux des crevettes ?","https://www.leparisien.fr/animaux/bien-etre-animal-pourquoi-on-arrache-les-yeux-des-crevettes-18-12-2022-WKBMW2F7X5D7XKPVA5USTYTFBQ.php"
"True","True","Deschamps raconté par ses proches : «Son obsession de la gagne ne serait rien sans ce feu qui brûle en lui»","https://www.leparisien.fr/sports/football/coupe-du-monde/deschamps-raconte-par-ses-proches-son-obsession-de-la-gagne-ne-serait-rien-sans-ce-feu-qui-brule-en-lui-18-12-2022-64J5XFEFQ5DDNJ7WGUHGM6SAIY.php"
"False","True","Argentine-France : «C’est l’heure… Allez les Bleus», Karim Benzema à fond derrière l’équipe de France","https://www.leparisien.fr/sports/football/coupe-du-monde/argentine-france-cest-lheure-allez-les-bleus-karim-benzema-a-fond-derriere-lequipe-de-france-18-12-2022-WCK4TQ7ZBRESNBXIH3Q22TFGI4.php"
"False","True","Argentine-France : survoltés, les fans argentins gagnent le match de l’ambiance devant le stade","https://www.leparisien.fr/sports/football/coupe-du-monde/argentine-france-survoltes-les-fans-argentins-gagnent-le-match-de-lambiance-devant-le-stade-18-12-2022-STYVPXO2QNGW3HKEL32IDFIQVA.php"
"True","True","Argentine-France : ces records que les Bleus peuvent faire tomber en cas de nouveau sacre mondial","https://www.leparisien.fr/sports/football/coupe-du-monde/argentine-france-ces-records-que-les-bleus-peuvent-faire-tomber-en-cas-de-nouveau-sacre-mondial-18-12-2022-B6HO2HVEL5EFDK6OQXHL5RDHTE.php"
"True","True","Coupe du monde 2022 : «On les aime depuis 98»… À Doha, à la rencontre des Indiens au sang Bleu","https://www.leparisien.fr/sports/football/coupe-du-monde/coupe-du-monde-2022-on-les-aime-depuis-98-a-doha-a-la-rencontre-des-indiens-au-sang-bleu-18-12-2022-HWA4I2W5BRFKDIRG3ZDKONQGRA.php"
"True","True","Paris : à Montmartre, les terrains de pétanque du Clap déchaînent les passions et suscitent les convoitises","https://www.leparisien.fr/paris-75/paris-a-montmartre-les-terrains-de-petanque-du-clap-dechainent-les-passions-et-suscitent-les-convoitises-18-12-2022-DNLN5QE4E5E6DKZESJHDVPQFSI.php"
"False","True","Yvelines : le faux employé de la Poste vidait les boîtes aux lettres... 700 000 euros de préjudice","https://www.leparisien.fr/yvelines-78/versailles-78000/yvelines-le-faux-employe-de-la-poste-vidait-les-boites-aux-lettres-700-000-euros-de-prejudice-18-12-2022-HGKT2PI5GFCEXB57PYR2C52ARA.php"
"True","True","Office HLM de Bobigny : le maire veut savoir «où sont passés les millions des travaux jamais réalisés»","https://www.leparisien.fr/seine-saint-denis-93/gestion-de-loffice-hlm-de-bobigny-le-maire-denonce-un-pillage-en-bande-organisee-17-12-2022-7KT6BPDCVJHFROI366PW3KWVIQ.php"
"True","True","Cuisinier, magicien… À Mantes-la-Jolie, ces bons Samaritains ont offert un Noël de rêve aux orphelins","https://www.leparisien.fr/yvelines-78/cuisinier-magicien-a-mantes-la-jolie-ces-bons-samaritains-ont-offert-un-noel-de-reve-aux-orphelins-18-12-2022-F5AD6ACSZZEG3EO64HXSTKX5ZM.php"
"False","True","VIDÉO. Jaurès-Stalingrad, le pire carrefour de Paris pour les cyclistes et les piétons ?","https://www.leparisien.fr/video/video-jaures-stalingrad-le-pire-carrefour-de-paris-pour-les-cyclistes-et-les-pietons-18-12-2022-ADDH6SNLHBDY3LTFPQGJRMYGYQ.php"
"False","True","Coupe du monde : la station «Argentine» du métro parisien rebaptisée «France» par la RATP","https://www.leparisien.fr/sports/football/coupe-du-monde/coupe-du-monde-la-station-argentine-du-metro-parisien-rebaptisee-france-par-la-ratp-18-12-2022-Y6V7EIWQ4VANVPESEWAUBXJMVY.php"
"False","True","VIDÉO. «On a pris nos économies» : ces supporters qui font l’aller-retour au Qatar pour voir les Bleus en finale","https://www.leparisien.fr/video/video-on-a-pris-nos-economies-ces-supporters-qui-font-laller-retour-au-qatar-pour-voir-les-bleus-en-finale-18-12-2022-L4SOT2MYCJBXJGEHLM5UPPG7LA.php"
"False","True","VIDÉO. Incendie à Vaulx-en-Velin : des centaines de personnes rassemblées en hommage aux victimes","https://www.leparisien.fr/video/video-incendie-a-vaulx-en-velin-des-centaines-de-personnes-rassemblees-en-hommage-aux-victimes-17-12-2022-DZ7RNHFEYFDMPLZRDRBCQQ56BI.php"
"True","True","Jack Lang encore et toujours là : «Il n’a jamais cessé d’interpeller les ministres»","https://www.leparisien.fr/politique/jack-lang-encore-et-toujours-la-il-na-jamais-cesse-dinterpeller-les-ministres-18-12-2022-ATQACGAFZZAAPBCCGGHROLASSI.php"
"True","True","France-Argentine : de Doha à l’Élysée, Emmanuel Macron a (presque) tout prévu pour les Bleus","https://www.leparisien.fr/politique/france-argentine-de-doha-a-lelysee-emmanuel-macron-a-presque-tout-prevu-pour-les-bleus-17-12-2022-NYAIAEISFFDSRCPIT4DXLRSI7U.php"
"False","True","L’Assemblée nationale rejette la motion de censure Nupes, le budget 2023 définitivement adopté","https://www.leparisien.fr/politique/lassemblee-nationale-rejette-la-motion-de-censure-nupes-le-budget-2023-definitivement-adopte-17-12-2022-7AKZVKOLRFBAJDESHJQ34EGNOU.php"
"True","True","«Il y a un vrai manque de démocratie à LFI» : la crise interne fait douter les militants","https://www.leparisien.fr/politique/il-y-a-un-vrai-manque-de-democratie-a-lfi-la-crise-interne-fait-douter-les-militants-17-12-2022-NNYQG4AXBZC3NCWTG2PKZIDTAU.php"
"False","False","Yvelines : le faux employé de la Poste vidait les boîtes aux lettres... 700 000 euros de préjudice","https://www.leparisien.fr/yvelines-78/versailles-78000/yvelines-le-faux-employe-de-la-poste-vidait-les-boites-aux-lettres-700-000-euros-de-prejudice-18-12-2022-HGKT2PI5GFCEXB57PYR2C52ARA.php"
"False","False","Montpellier : un accident de manège fait plusieurs blessés légers","https://www.leparisien.fr/faits-divers/montpellier-un-accident-de-manege-fait-plusieurs-blesses-legers-18-12-2022-LFN3NLZDZZEABIEX3U4IZ4GLEE.php"
"False","False","Besançon : un adolescent de 15 ans tué par balle","https://www.leparisien.fr/faits-divers/besancon-un-adolescent-de-15-ans-tue-par-balle-18-12-2022-V7AIMM6IMRAG5EQAO6N2QN2GLI.php"
"False","False","Covid-19 : hôpitaux sous tension, crématoriums débordés… la Chine face à une vague massive d’infections","https://www.leparisien.fr/societe/covid-19-hopitaux-sous-tension-crematoriums-debordes-la-chine-face-a-une-vague-massive-dinfections-18-12-2022-KUIMO6LITVH2LFXANLHJGAS7SY.php"
"False","False","«Plus petit que papa, mais bien plus gros» : comment les petits enfants voient le Père Noël","https://www.leparisien.fr/societe/plus-petit-que-papa-mais-bien-plus-gros-comment-les-petits-enfants-voient-le-pere-noel-18-12-2022-QZMTH73PSBBKJDK5NZCTCGIFJQ.php"
"True","False","Bien-être animal : pourquoi on arrache les yeux des crevettes ?","https://www.leparisien.fr/animaux/bien-etre-animal-pourquoi-on-arrache-les-yeux-des-crevettes-18-12-2022-WKBMW2F7X5D7XKPVA5USTYTFBQ.php"
"True","False","Face au coût de l’énergie, ce boulanger de l’Oise risque de fermer : «Mon calcul est fait, je suis foutu»","https://www.leparisien.fr/oise-60/face-au-cout-de-lenergie-ce-boulanger-de-loise-risque-de-fermer-mon-calcul-est-fait-je-suis-foutu-18-12-2022-4G2ELMZJGFCPNAKC74I2J24YAY.php"
"True","False","Mama Shelter : le bond de géant du Petit Poucet de l’hôtellerie","https://www.leparisien.fr/economie/business/mama-shelter-le-bond-de-geant-du-petit-poucet-de-lhotellerie-18-12-2022-24JUBBEUGZB4XMIKXDS6EZYVYA.php"
"True","False","Loïc de Gromard, l’homme qui a fait de Saverglass le leader mondial de la verrerie de luxe","https://www.leparisien.fr/oise-60/loic-de-gromard-lhomme-qui-a-fait-de-saverglass-le-leader-mondial-de-la-verrerie-de-luxe-18-12-2022-S3MMOENDGNGWZBL74TEOD3FLYQ.php"
"False","False","Soupçons de corruption : le Qatar met en garde contre «l’impact négatif» des mesures européennes","https://www.leparisien.fr/international/soupcons-de-corruption-le-qatar-met-en-garde-contre-limpact-negatif-des-mesures-europeennes-18-12-2022-AMOUGYTMQZH7HLHIGJKOJMJIHQ.php"
"True","False","Guerre en Ukraine : à Bakhmout, la vie de Ludmila, Victoria, Alexii et Volodymir sous le fracas des armes","https://www.leparisien.fr/faits-divers/guerre-en-ukraine-a-bakhmout-la-vie-de-ludmila-victoria-alexii-et-volodymir-sous-le-fracas-des-armes-18-12-2022-KOQQY4B3JBGHZAEES3PEKWW7TI.php"
"False","False","Israël a expulsé vers la France l’avocat franco-palestinien Salah Hamouri","https://www.leparisien.fr/international/israel-a-expulse-vers-la-france-le-franco-palestinien-salah-hamouri-18-12-2022-ARNN6JILCZGL7LRCYYEZEYPMLU.php"
"False","True","DIRECT. Guerre en Ukraine : un mort et 5 blessés dans des frappes ukrainiennes dans la région russe de Belgorod","https://www.leparisien.fr/international/direct-guerre-en-ukraine-apres-les-bombardement-russes-zelensky-deplore-de-gros-problemes-dalimentation-en-eau-18-12-2022-DTNCBDHQRBHXNPIY2BGPCRXGGE.php"
"True","True","Guerre en Ukraine : à Bakhmout, la vie de Ludmila, Victoria, Alexii et Volodymir sous le fracas des armes","https://www.leparisien.fr/faits-divers/guerre-en-ukraine-a-bakhmout-la-vie-de-ludmila-victoria-alexii-et-volodymir-sous-le-fracas-des-armes-18-12-2022-KOQQY4B3JBGHZAEES3PEKWW7TI.php"
"False","True","Guerre en Ukraine : l’électricité a été rétablie à Kharkiv, deuxième plus grande ville du pays","https://www.leparisien.fr/international/direct-guerre-en-ukraine-volodymyr-zelensky-pas-pret-a-negocier-avec-une-russie-nazie-17-12-2022-JIE3RKEEXRGWTJS7YEWADVQAX4.php"
"False","True","Guerre en Ukraine : la Russie affirme qu’elle n’utilisera pas d’armes biologiques","https://www.leparisien.fr/international/guerre-en-ukraine-la-russie-affirme-quelle-nutilisera-pas-darmes-biologiques-16-12-2022-ERD7LHS44ZEYHGRCCHNQGV4V5E.php"
"True","True","«On n’aurait jamais pu penser qu’il puisse être un violeur» : sidération à Courtry après l’arrestation du «prédateur des bois»","https://www.leparisien.fr/faits-divers/affaire-du-predateur-des-bois-la-sideration-a-courtry-apres-linterpellation-dun-homme-insoupconnable-16-12-2022-RGJZHMQK3ZG7PK4NOHQ3VFOPTM.php"
"False","True","FFR : «Ça ne trompe personne», Amélie Oudéa-Castéra attaque la ligne de défense de Bernard Laporte","https://www.leparisien.fr/sports/rugby/ffr-ca-ne-trompe-personne-amelie-oudea-castera-attaque-la-ligne-de-defense-de-bernard-laporte-18-12-2022-CWHFNLJLSZG43IAS5ASJC3DPAI.php"
"False","True","Wembanyama discret mais vainqueur, le PSG hand tombe de haut… C’était votre week-end de sport en Île de France","https://www.leparisien.fr/sports/wembanyama-discret-mais-vainqueur-le-psg-hand-tombe-de-haut-cetait-votre-week-end-de-sport-en-ile-de-france-18-12-2022-VK2X4IDVI5BETALHQUJB3C3ZWQ.php"
"True","True","À Saint-Étienne, les supporters de l’ASSE veulent devenir actionnaires","https://www.leparisien.fr/loire-42/a-saint-etienne-les-supporters-de-lasse-veulent-devenir-actionnaires-18-12-2022-MQNZBRP5UJCSXDDWO2HISSL2IM.php"
"True","True","Et à la fin, le foot gagne toujours","https://www.leparisien.fr/sports/et-a-la-fin-le-foot-gagne-toujours-18-12-2022-JF6NTTFJUVAKBDHYNEF4XNUJVA.php"
