"premium","picture","title","url"
"False","True","Accusé de fuir les débats, Emmanuel Macron défend sa campagne...","https://www.20minutes.fr/elections/3253519-20220316-presidentielle-2022-direct-accuse-fuir-debats-premier-tour-emmanuel-macron-defend-campagne-peu-particuliere"
"False","True","En plein couvre-feu, Kiev se réveille dans les explosions…","https://www.20minutes.fr/monde/3253515-20220316-guerre-ukraine-direct-zelensky-recoit-visite-premiers-ministres-polonais-tcheque-slovene"
"False","True","Darmanin en Corse, Marioupol évacuée et Manchester United éliminé","https://www.20minutes.fr/societe/3253523-20220316-heure-bim-darmanin-corse-evacuations-marioupol-manchester-united-elimine-c1"
"False","True","L’Atlético Madrid élimine Manchester United et file en quarts","https://www.20minutes.fr/sport/3253427-20220316-ligue-champions-atletico-madrid-elimine-manchester-united-file-quarts"
"False","True","Nous sommes «prêts à aller jusqu’à l’autonomie», assure Darmanin","https://www.20minutes.fr/societe/3253375-20220315-agression-yvan-colonna-prets-aller-jusqu-autonomie-assure-gerald-darmanin-corse-matin"
"False","True","A Rennes, un lieu pour aider les femmes victimes de violences","https://www.20minutes.fr/societe/3253203-20220316-rennes-bientot-nouveau-lieu-reparer-ecouter-femmes-victimes-violences"
"False","True","L’ouverture du don du sang aux hommes homosexuels « permet de lever une inégalité »","https://www.20minutes.fr/sante/3215495-20220112-don-sang-ouverture-hommes-homosexuels-permet-lever-inegalite-selon-inter-lgbt"
"False","True","A Gennevilliers, Upway donne une seconde vie aux vélos électriques","https://www.20minutes.fr/planete/3252479-20220316-velo-electrique-gennevilliers-upway-surfe-marche-seconde-main-arrive-point"
"False","True","«L’Histoire de ma femme» tire le meilleur de Léa Seydoux","https://www.20minutes.fr/arts-stars/cinema/3251367-20220316-histoire-femme-comment-ildiko-enyedi-tire-meilleur-lea-seydoux"
"False","True","Pourquoi les fans de Chelsea s'inquiètent de la vie sans Abramovitch","https://www.20minutes.fr/sport/3252735-20220316-losc-chelsea-fans-chelsea-inquietent-vie-abramovitch-vrai-fan-club"
"False","True","Darmanin en Corse, évacuations à Marioupol et ManU éliminé en C1","https://www.20minutes.fr/societe/3253523-20220316-heure-bim-darmanin-corse-evacuations-marioupol-manchester-united-elimine-c1"
"False","True","Guerre en Ukraine EN DIRECT : En plein couvre-feu, Kiev se réveille dans les explosions…","https://www.20minutes.fr/monde/3253515-20220316-guerre-ukraine-direct-zelensky-recoit-visite-premiers-ministres-polonais-tcheque-slovene"
"False","True","Les cours du pétrole redescendent sous les 100 dollars","https://www.20minutes.fr/economie/3253511-20220316-petrole-cours-redescendent-sous-100-dollars"
"False","True","Comment la « Pépite verte » Alexandre veut booster la transition écologique","https://www.20minutes.fr/planete/3252519-20220316-presidentielle-2022-alexandre-pepite-verte-veut-accelerer-transition-ecologique-education"
"False","True","« Notre-Dame brûle » et tient en haleine jusqu'à la fin","https://www.20minutes.fr/arts-stars/cinema/3251099-20220315-dame-brule-pourquoi-film-tient-haleine-si-connait-fin"
"False","True","La BBC évoque les origines (douteuses) de la fortune de Roman Abramovitch","https://www.20minutes.fr/sport/3253115-20220315-guerre-ukraine-pots-vin-chantage-kidnapping-bbc-revele-dessous-fortune-roman-abramovitch"
"False","True","24 heures","https://www.20minutes.fr/diaporama/diaporama-15290-images-desinformation-russie-guerre-ukraine-tournoi-six-nations"
"False","True","Sous les bombes","https://www.20minutes.fr/diaporama/diaporama-15289-guerre-ukraine-images-maternite-bombardee-marioupol"
"False","True","Zelensky a-t-il publié une vidéo truquée d'une visite à des soldats ? Non","https://www.20minutes.fr/monde/3252807-20220315-guerre-ukraine-zelensky-publie-video-truquee-visite-soldats-blesses-non"
"False","True","Macron a-t-il retourné sa veste sur le nucléaire ou les retraites ?","https://www.20minutes.fr/elections/presidentielle/3252815-20220315-presidentielle-2022-nucleaire-retraites-emmanuel-macron-retourne-veste-comme-affirme-valerie-pecresse"
"False","True","Le gazole est-il vraiment plus cher en France qu’ailleurs ?","https://www.20minutes.fr/societe/3252027-20220315-prix-essence-france-pays-o-gazole-plus-cher"
"False","True","Alexandre, la « Pépite verte » qui veut accélérer la transition écologique par l’éducation","https://www.20minutes.fr/planete/3252519-20220316-presidentielle-2022-alexandre-pepite-verte-veut-accelerer-transition-ecologique-education"
"False","True","A Nice, la plateforme MyClass aide à l’apprentissage du français grâce aux dessins animés","https://www.20minutes.fr/societe/3253283-20220316-nice-projetant-dessins-animes-ecole-plateforme-myclass-propose-aider-apprentissage-francais-eleves"
"False","True","A Gennevilliers, Upway surfe sur le boom des vélos électriques d’occasion","https://www.20minutes.fr/planete/3252479-20220316-velo-electrique-gennevilliers-upway-surfe-marche-seconde-main-arrive-point"
"False","True","Un nouveau ver plat bleu vert découvert à Mayotte","https://www.20minutes.fr/planete/3252099-20220316-biodiversite-mayotte-nouveau-ver-plat-couleurs-extraordinaires-viendrait-madagascar"
"False","True","Comment la « Pépite verte » Alexandre veut booster la transition écologique","https://www.20minutes.fr/planete/3252519-20220316-presidentielle-2022-alexandre-pepite-verte-veut-accelerer-transition-ecologique-education"
"False","True","Kyrie Irving claque à son tour 60 points, record de la saison égalé","https://www.20minutes.fr/sport/3253531-20220316-nba-kyrie-irving-claque-tour-60-points-record-saison-egale"
"False","True","«Tout ce qui semble faux est vrai», affirme Jean-Jacques Annaud","https://www.20minutes.fr/arts-stars/cinema/3251623-20220316-dame-brule-tout-semble-faux-vrai-affirme-jean-jacques-annaud"
"False","True","Les suspects multipliaient les vols de bennes et camions grue","https://www.20minutes.fr/faits_divers/3252723-20220316-loire-atlantique-vendee-suspects-multipliaient-vols-bennes-camions-grue"
"False","True","La défaite du FCN à Troyes et les supporteurs au menu de notre podcast","https://www.20minutes.fr/sport/3253231-20220315-controle-non-match-fc-nantes-troyes-blessures-point-supporteurs-menu-podcast"
"False","True","Comment l'endométriose peut être une maladie silencieuse","https://www.20minutes.fr/podcast/3250395-20220311-tout-sexplique-comment-endometriose-peut-etre-maladie-silencieuse"
"False","True","Katia Astafieff, une aventurière sur la piste de l’ours","https://www.20minutes.fr/podcast/3249863-20220310-minute-papillon-katia-astafieff-aventure-feminin-piste-ours"
"False","True","Guerre en Ukraine : Sommet extraordinaire de l'Otan le 24 mars avec Joe…","https://www.20minutes.fr/monde/3252707-20220315-guerre-ukraine-direct-fortes-explosions-centre-kiev"
"False","True","La Russie claque la porte du Conseil de l'Europe","https://www.20minutes.fr/monde/3253319-20220315-guerre-ukraine-russie-claque-porte-conseil-europe"
"False","True","Des poussières du Sahara sur une partie de la France","https://www.20minutes.fr/planete/3252803-20220315-ciel-jaune-poussieres-sable-phenomene-traverse-partie-france"
"False","True","Emmanuel Macron pourrait proposer de conditionner le RSA s’il est réélu","https://www.20minutes.fr/politique/3253303-20220315-presidentielle-2022-emmanuel-macron-pourrait-proposer-conditionner-rsa-reelu-selon-gabriel-attal"
"False","True","Le point sur ce 17e jour de conflit entre l'Ukraine et la Russie","https://www.20minutes.fr/monde/3253239-20220315-guerre-ukraine-intervention-heroique-television-russe-declaration-resignee-kiev-point-17e-jour-conflit"
"False","True","« Moi, je balance pas… » Les provocations d’Abdeslam électrisent l’audience","https://www.20minutes.fr/justice/3252751-20220315-proces-attentats-13-novembre-balance-provocateur-evasif-salah-abdeslam-precipite-fin-interrogatoire"
"False","True","Un neurone jamais observé auparavant découvert dans le cerveau humain","https://www.20minutes.fr/sciences/3253111-20220315-nouveau-type-neurones-jamais-observe-auparavant-decouvert-cerveau-humain"
"False","True","La Russie vole dans les pattes de Joe Biden","https://www.20minutes.fr/monde/3253295-20220315-guerre-ukraine-russie-sanctionne-joe-biden-plusieurs-hauts-responsables-americains"
"False","True","La vie suit normalement son cours dans l’ISS, malgré la guerre en Ukraine","https://www.20minutes.fr/sciences/3252699-20220315-guerre-ukraine-selon-nasa-vie-suit-normalement-cours-bord-iss"
"False","True","Pourquoi Auchan, Décathlon et Leroy Merlin restent-ils ouverts en Russie ?","https://www.20minutes.fr/monde/3253059-20220315-guerre-ukraine-pourquoi-auchan-decathlon-leroy-merlin-restent-ouverts-russie"
"False","True","Fabien Roussel veut 30.000 policiers de plus et doubler le budget de la Justice","https://www.20minutes.fr/elections/3253507-20220316-presidentielle-2022-fabien-roussel-veut-30000-policiers-plus-doubler-budget-justice"
"False","True","Le réseau social MYM lance ses lives payants, un « outil clé »","https://www.20minutes.fr/economie/3252591-20220316-lyon-reseau-social-mym-lance-live-payants-outil-cle-changer-dimension"
"False","True","Les cours du pétrole redescendent sous les 100 dollars","https://www.20minutes.fr/economie/3253511-20220316-petrole-cours-redescendent-sous-100-dollars"
"False","True","Emmanuel Macron pourrait proposer de conditionner le RSA s’il est réélu","https://www.20minutes.fr/politique/3253303-20220315-presidentielle-2022-emmanuel-macron-pourrait-proposer-conditionner-rsa-reelu-selon-gabriel-attal"
"False","True","« C’est le destin », réagit l'éliminé par tirage au sort","https://www.20minutes.fr/arts-stars/television/3253163-20220315-koh-lanta-destin-decide-ainsi-resout-benjamin-elimine-tirage-sort"
"False","True","Intervention héroïque à la télévision russe et déclaration résignée à Kiev","https://www.20minutes.fr/monde/3253239-20220315-guerre-ukraine-intervention-heroique-television-russe-declaration-resignee-kiev-point-17e-jour-conflit"
"False","True","« Moi, je balance pas… » Provocateur, Salah Abdeslam électrise l’audience","https://www.20minutes.fr/justice/3252751-20220315-proces-attentats-13-novembre-balance-provocateur-evasif-salah-abdeslam-precipite-fin-interrogatoire"
"False","True","Macron poursuit sa campagne à Pau vendredi","https://www.20minutes.fr/elections/3253371-20220315-presidentielle-2022-emmanuel-macron-poursuit-campagne-pau-vendredi"
