"premium","picture","title","url"
"False","True","DIRECT. Présidentielle : « Rien n’est joué », estime Emmanuel Macron","https://www.ouest-france.fr/elections/presidentielle/direct-resultats-presidentielle-2022-1er-tour-en-france-f433091a-b8e0-11ec-bd14-a849d20f46a4"
"False","True","Présidentielle. « J’assume toute ma part dans cette défaite »: au QG de Pécresse, grosse déception","https://www.ouest-france.fr/elections/presidentielle/presidentielle-j-assume-toute-ma-part-dans-cette-defaite-au-qg-de-pecresse-grosse-deception-44050206-b902-11ec-bd14-a849d20f46a4"
"False","True","Présidentielle. L’abstention fait mieux que Macron et Le Pen, comme en 2017","https://www.ouest-france.fr/elections/presidentielle/presidentielle-l-abstention-fait-mieux-que-macron-et-le-pen-comme-en-2017-4dffb320-b8f1-11ec-bd14-a849d20f46a4"
"False","True","Présidentielle. Jean Castex a emprunté un jet privé pour aller voter","https://www.ouest-france.fr/elections/presidentielle/presidentielle-jean-castex-est-alle-voter-en-jet-prive-5905dfdc-b901-11ec-bd14-a849d20f46a4"
"False","True","Présidentielle. Jean Lassalle triple son score entre 2022 et 2017 au premier tour","https://www.ouest-france.fr/elections/presidentielle/presidentielle-jean-lassalle-triple-son-score-entre-2022-et-2017-156c856c-b903-11ec-bd14-a849d20f46a4"
"False","True","VIDÉO. Présidentielle. Macron ou Le Pen ? L’appel à voter des autres candidats","https://www.ouest-france.fr/elections/presidentielle/video-presidentielle-macron-ou-le-pen-lappel-a-voter-des-autres-candidats-8c26ea6c-31ba-40a3-b26a-02dba35db0b9"
"False","True","Présidentielle. Macron et Le Pen qualifiés, LR et le PS s’effondrent… Sept enseignements du 1er tour","https://www.ouest-france.fr/elections/presidentielle/presidentielle-macron-le-pen-devant-lr-et-le-ps-s-effondrent-les-7-enseignements-du-premier-tour-42d71282-b8e1-11ec-bd14-a849d20f46a4"
"False","True","Présidentielle. Marine Le Pen, à nouveau challengeuse d’Emmanuel Macron","https://www.ouest-france.fr/elections/presidentielle/presidentielle-marine-le-pen-a-nouveau-challengeuse-d-emmanuel-macron-53bab7da-b8fe-11ec-bd14-a849d20f46a4"
"False","False","Présidentielle. Qui soutient Emmanuel Macron ou Marine Le Pen pour le second tour ?","https://www.ouest-france.fr/elections/presidentielle/presidentielle-qui-soutient-emmanuel-macron-ou-marine-le-pen-pour-le-second-tour-f38a89aa-b905-11ec-bd14-a849d20f46a4"
"False","False","Présidentielle. À Rennes, plus de 500 personnes manifestent en ville à l’annonce des résultats","https://www.ouest-france.fr/elections/presidentielle/presidentielle-a-rennes-plus-de-500-personnes-manifestent-en-ville-a-l-annonce-des-resultats-043378ba-b8fd-11ec-bd14-a849d20f46a4"
"True","False","Crash d’un avion de tourisme : ce que l’on sait du drame qui a fait trois morts près de Saint-Brieuc","https://www.ouest-france.fr/bretagne/tremuson-22440/crash-d-un-avion-de-tourisme-ce-que-l-on-sait-du-drame-qui-a-fait-trois-morts-pres-de-saint-brieuc-e33373ea-b8d9-11ec-bd14-a849d20f46a4"
"False","False","REPORTAGE. Guerre en Ukraine : à Boutcha, les vivants cohabitent avec les morts","https://www.ouest-france.fr/monde/guerre-en-ukraine/reportage-guerre-en-ukraine-a-boutcha-les-vivants-cohabitent-avec-les-morts-972972ac-b8b5-11ec-bd14-a849d20f46a4"
"False","False","DIRECT. OM – Montpellier : Les Marseillais cherchent à gérer leur avance","https://www.ouest-france.fr/sport/football/ligue-1/direct/direct-om-montpellier-suivez-le-match-de-la-31e-journee-de-ligue-1-en-direct-e4e607a2-b816-11ec-8218-82176f0101f6"
"False","False","Moto GP. Enea Bastianini s’impose lors du GP des Amériques devant Jack Miller et Alex Rins","https://www.ouest-france.fr/sport/moto/motogp/direct-moto-gp-suivez-la-course-du-grand-prix-des-ameriques-a-austin-en-live-5f134750-b845-11ec-8218-82176f0101f6"
"False","True","REPORTAGE. Guerre en Ukraine : à Boutcha, les vivants cohabitent avec les morts","https://www.ouest-france.fr/monde/guerre-en-ukraine/reportage-guerre-en-ukraine-a-boutcha-les-vivants-cohabitent-avec-les-morts-972972ac-b8b5-11ec-bd14-a849d20f46a4"
"False","True","Allemagne. Plusieurs manifestations pro russes ont défilé dans plusieurs villes du pays","https://www.ouest-france.fr/monde/guerre-en-ukraine/allemagne-plusieurs-manifestations-pro-russes-ont-defile-dans-plusieurs-villes-du-pays-e019b7fa-b8f2-11ec-bd14-a849d20f46a4"
"False","True","Guerre en Ukraine. Les autorités ukrainiennes ont recensé plus de 1 200 corps dans la région de Kiev","https://www.ouest-france.fr/monde/guerre-en-ukraine/guerre-en-ukraine-les-autorites-ukrainiennes-ont-recense-plus-de-1-200-corps-dans-la-region-de-kiev-890820e0-b8d5-11ec-bd14-a849d20f46a4"
"False","True","Guerre en Ukraine. L’aéroport de Dnipro, « complètement détruit » après de nouveaux bombardements","https://www.ouest-france.fr/monde/guerre-en-ukraine/guerre-en-ukraine-l-aeroport-de-dnipro-completement-detruit-apres-de-nouveaux-bombardements-e7077ada-b8c9-11ec-bd14-a849d20f46a4"
"False","True","Guerre en Ukraine. 5 600 enquêtes ouvertes pour crimes de guerre commis par la Russie","https://www.ouest-france.fr/monde/guerre-en-ukraine/guerre-en-ukraine-5-600-enquetes-ouvertes-pour-crimes-de-guerre-commis-par-la-russie-d086a5c2-b8c6-11ec-bd14-a849d20f46a4"
"False","True","ÉDITORIAL. La flamme de la démocratie","https://www.ouest-france.fr/reflexion/editorial/editorial-la-flamme-de-la-democratie-25f95dd0-b80c-11ec-8bf9-e6bf67abc951"
"False","True","Dans la maison, quels sont les pires nids à microbes ?","https://www.ouest-france.fr/leditiondusoir/2022-04-08/dans-la-maison-quels-sont-les-pires-nids-a-microbes-10ca335b-fe8b-456c-9436-fb622c6cc1c3"
"False","True","Un avion de tourisme s’écrase après son décollage près de Saint-Brieuc : trois morts","https://www.ouest-france.fr/bretagne/tremuson-22440/cotes-d-armor-trois-morts-dans-le-crash-d-un-aeronef-apres-son-decollage-pres-de-saint-brieuc-ce44ff8a-b8bb-11ec-bd14-a849d20f46a4"
"False","True","VIDÉO. Présidentielle : Florian Bachelier Deputé LREM d’Ille-et-Vilaine appelle à la mobilisation des électeurs","https://www.ouest-france.fr/elections/presidentielle/video-presidentielle-florian-bachelier-depute-lrem-dille-et-vilaine-appelle-a-la-mobilisation-des-electeurs-ef886a13-12a9-44b3-8e79-222f37238982"
"False","True","Conflit post-Brexit sur la pêche. La dispute est en voie d’être résolue, estime l’Union Européenne","https://www.ouest-france.fr/mer/peche/conflit-post-brexit-sur-la-peche-la-dispute-est-en-voie-d-etre-resolue-estime-l-union-europeenne-4e2d298e-b8fd-11ec-bd14-a849d20f46a4"
"True","True","Présidentielle. Enora, originaire du Finistère, vote pour la première fois au Canada","https://www.ouest-france.fr/elections/presidentielle/presidentielle-enora-originaire-de-pluguffan-vote-pour-la-premiere-fois-au-canada-836e0e00-b8db-11ec-bd14-a849d20f46a4"
"False","True","Coupe Gambardella. Le SM Caen sort le Stade Rennais aux tirs au but et affrontera Lyon en finale","https://www.ouest-france.fr/sport/football/coupe-gambardella/direct-sm-caen-stade-rennais-suivez-la-demi-finale-de-la-coupe-gambardella-en-live-ff35b8f0-b7f8-11ec-8218-82176f0101f6"
"False","True","Nucléaire. EDF ne confirme pas de fissure sur les circuits des réacteurs de Flamanville","https://www.ouest-france.fr/environnement/nucleaire/nucleaire-edf-ne-confirme-pas-de-fissure-sur-les-circuits-des-reacteurs-de-flamanville-10d7f320-b821-11ec-8218-82176f0101f6"
"False","True","Dans la Manche, une voiture sort de la route et chute de plusieurs mètres en contrebas","https://www.ouest-france.fr/normandie/le-vast-50630/le-vast-une-voiture-sort-de-la-route-et-chute-de-plusieurs-metres-en-contrebas-ef9648d0-b8af-11ec-bd14-a849d20f46a4"
"False","True","À Cherbourg, un jeune homme à scooter, accidenté, évacué vers le CHU de Caen","https://www.ouest-france.fr/normandie/cherbourg-en-cotentin-50100/cherbourg-un-conducteur-de-scooter-evacue-vers-le-chu-de-caen-f6f7ca68-b8b4-11ec-bd14-a849d20f46a4"
"False","True","VIDEO. Présidentielle : Simone, 100 ans, a voté à La Roche-sur-Yon","https://www.ouest-france.fr/pays-de-la-loire/la-roche-sur-yon-85000/video-presidentielle-2022-simone-100-ans-a-vote-a-la-roche-sur-yon-f6c1e0f6-2498-3984-9687-2d823ff465cd"
"True","True","RÉCIT. La complexe opération de sauvetage de trois plaisanciers en détresse à L’Île d’Yeu","https://www.ouest-france.fr/pays-de-la-loire/vendee/recit-la-complexe-operation-de-sauvetage-de-trois-plaisanciers-en-detresse-a-l-ile-d-yeu-f8cdb4c6-b8ad-11ec-9aa9-ad21738dafb6"
"False","True","Le corps d’un homme retrouvé en état de décomposition dans un appartement près de Nantes","https://www.ouest-france.fr/pays-de-la-loire/saint-sebastien-sur-loire-44230/le-corps-d-un-homme-retrouve-dans-un-appartement-a-saint-sebastien-sur-loire-eb38dda4-b7e5-11ec-8218-82176f0101f6"
"False","True","Un décès et un blessé grave sur un bateau frappé par une déferlante à L’Île-d’Yeu, en Vendée","https://www.ouest-france.fr/pays-de-la-loire/vendee/vendee-un-deces-et-un-blesse-grave-sur-un-bateau-frappe-par-une-deferlante-a-l-ile-d-yeu-07140cba-b822-11ec-8218-82176f0101f6"
"False","True","Présidentielle. Le Pen et Macron qualifiés : retrouvez tous les résultats du premier tour","https://www.ouest-france.fr/elections/presidentielle/emmanuel-macron-et-marine-le-pen-qualifies-pour-le-second-tour-de-la-presidentielle-411ab568-b8fd-11ec-bd14-a849d20f46a4"
"False","True","DIRECT. Présidentielle : « Rien n’est joué », estime Emmanuel Macron","https://www.ouest-france.fr/elections/presidentielle/direct-resultats-presidentielle-2022-1er-tour-en-france-f433091a-b8e0-11ec-bd14-a849d20f46a4"
"False","True","Présidentielle. Qui soutient Emmanuel Macron ou Marine Le Pen pour le second tour ?","https://www.ouest-france.fr/elections/presidentielle/presidentielle-qui-soutient-emmanuel-macron-ou-marine-le-pen-pour-le-second-tour-f38a89aa-b905-11ec-bd14-a849d20f46a4"
"False","True","Présidentielle. L’abstention fait mieux que Macron et Le Pen, comme en 2017","https://www.ouest-france.fr/elections/presidentielle/presidentielle-l-abstention-fait-mieux-que-macron-et-le-pen-comme-en-2017-4dffb320-b8f1-11ec-bd14-a849d20f46a4"
"False","True","Présidentielle. Macron et Le Pen qualifiés, LR et le PS s’effondrent… Sept enseignements du 1er tour","https://www.ouest-france.fr/elections/presidentielle/presidentielle-macron-le-pen-devant-lr-et-le-ps-s-effondrent-les-7-enseignements-du-premier-tour-42d71282-b8e1-11ec-bd14-a849d20f46a4"
"False","True","Présidentielle. Jean Castex a emprunté un jet privé pour aller voter","https://www.ouest-france.fr/elections/presidentielle/presidentielle-jean-castex-est-alle-voter-en-jet-prive-5905dfdc-b901-11ec-bd14-a849d20f46a4"
"False","False","Un homme tué d’un coup de couteau à Toulouse, trois suspects placés en garde à vue","https://www.ouest-france.fr/faits-divers/meurtres/un-homme-tue-d-un-coup-de-couteau-a-toulouse-trois-suspects-places-en-garde-a-vue-c6d61dde-b8ec-11ec-bd14-a849d20f46a4"
"False","False","Présidentielle. Glu dans la serrure, bulletins oubliés... Ces scènes insolites en marge du vote","https://www.ouest-france.fr/elections/presidentielle/presidentielle-glu-dans-la-serrure-bulletins-oublies-ces-scenes-insolites-autour-du-vote-cbd20b10-b8e0-11ec-bd14-a849d20f46a4"
"False","True","Quel temps est prévu à Toulon et ses environs le dimanche 10 avril 2022 ?","https://www.ouest-france.fr/meteo/provence-alpes-cote-dazur/toulon-83000/la-meteo-du-jour-a-toulon-7bb480d3-11b9-5d46-87f4-22e9626dc1ac"
"False","False","Var. Des voitures en feu dans un parking provoque l'évacuation d'un immeuble","https://www.ouest-france.fr/faits-divers/incendie/var-des-voitures-en-feu-dans-un-parking-provoque-l-evacuation-d-un-immeuble-0ee51a69-f786-4d2c-a0c0-1239b66320ec"
"False","False","Un feu de forêt décime 60 hectares de nature dans les Hautes-Alpes","https://www.ouest-france.fr/faits-divers/incendie/un-feu-de-foret-decime-60-hectares-de-nature-dans-les-hautes-alpes-f2537a58-b818-11ec-8218-82176f0101f6"
"False","True","Présidentielle. Joie et soulagement au QG d’Emmanuel Macron","https://www.ouest-france.fr/elections/presidentielle/presidentielle-joie-et-soulagement-au-qg-d-emmanuel-macron-c96b0b80-b8d9-11ec-bd14-a849d20f46a4"
"True","False","Préservons les océans. Nos vêtements polluent-ils les mers du globe ?","https://www.ouest-france.fr/mer/preservons-les-oceans-nos-vetements-polluent-ils-les-mers-du-globe-fa3d60d0-b8d6-11ec-bd14-a849d20f46a4"
"False","False","Le plus grand parking pour voitures électriques de France est opérationnel","https://www.ouest-france.fr/economie/transports/voiture/le-plus-grand-parking-pour-voitures-electriques-de-france-est-operationnel-1eb0ac92-b896-11ec-bd14-a849d20f46a4"
"False","True","Tempête Diego. 450 voyageurs bloqués plus de 5 heures dans un train Paris-Bordeaux","https://www.ouest-france.fr/meteo/tempete/tempete-diego-450-voyageurs-bloques-plus-de-5-heures-dans-un-train-paris-bordeaux-cc0d4b84-b819-11ec-8218-82176f0101f6"
"False","False","Des employés intoxiqués après avoir mangé un gâteau, leur collègue soupçonné d'y avoir mis du cannabis","https://www.ouest-france.fr/centre-val-de-loire/cher/cher-des-employes-intoxiques-apres-avoir-mange-un-gateau-leur-collegue-y-avait-mis-du-cannabis-7715656"
"False","False","Loiret. Condamnés pour avoir volé 500 litres de carburant dans les tracteurs d'un agriculteur","https://www.ouest-france.fr/centre-val-de-loire/montargis-45200/loiret-condamnes-pour-avoir-vole-500-litres-de-carburant-dans-les-tracteurs-d-un-agriculteur-7715620"
