"premium","picture","title","url"
"False","True","Mais pourquoi les Américains admiraient-ils autant la reine ?","https://www.20minutes.fr/monde/3348395-20220910-mort-reine-elisabeth-ii-pourquoi-americains-admiraient-autant-the-queen"
"False","True","Charles III proclamé roi dans la matinée à Buckingham Palace...","https://www.20minutes.fr/monde/3348375-20220910-mort-reine-elisabeth-ii-direct-charles-iii-proclame-roi-matinee-buckingham-palace"
"False","True","Y a-t-il vraiment un prof devant chaque classe en ce mois de septembre ?","https://www.20minutes.fr/societe/3348135-20220910-rentree-scolaire-2022-vraiment-prof-devant-chaque-classe-mois-septembre"
"False","True","Plus de 20 millions de tweets en une journée après la mort de la reine","https://www.20minutes.fr/high-tech/3348399-20220910-mort-reine-elisabeth-ii-plus-20-millions-tweets-publies-seule-journee"
"False","True","Non, Amazon n’a pas trahi Tolkien en intégrant des personnes de couleur aux « Anneaux de pouvoir »","https://www.20minutes.fr/culture/3348099-20220910-non-amazon-trahi-tolkien-integrant-personnes-couleur-casting-anneaux-pouvoir"
"False","True","Les cambriolages à l’acide, la nouvelle technique qui inquiète","https://www.20minutes.fr/faits_divers/3347391-20220910-paris-cambriolages-acide-nouvelle-technique-inquietent-enqueteurs"
"False","True","Tombeurs de Troyes, les Lensois montent (provisoirement) sur le trône de Ligue 1","https://www.20minutes.fr/sport/4000922-20220910-rc-lens-tombeurs-troyes-lensois-montent-provisoirement-trone-ligue-1"
"False","True","Alcaraz ou Ruud ? La finale inédite sacrera le futur n° 1 mondial","https://www.20minutes.fr/sport/4000921-20220910-us-open-alcaraz-ruud-finale-inedite-sacrera-futur-1-mondial"
"False","True","Mangera-t-on un jour de la viande de chevreau au resto ?","https://www.20minutes.fr/gastronomie/4000835-20220910-mangera-jour-viande-chevreau-resto"
"False","True","Plus de 20 millions de tweets publiés autour de la disparition de la reine","https://www.20minutes.fr/high-tech/3348399-20220910-mort-reine-elisabeth-ii-plus-20-millions-tweets-publies-seule-journee"
"False","True","Mort de la reine d'Elisabeth II EN DIRECT : Charles III proclamé roi dans la matinée à Buckingham Palace","https://www.20minutes.fr/monde/3348375-20220910-mort-reine-elisabeth-ii-direct-charles-iii-proclame-roi-matinee-buckingham-palace"
"False","True","Mais pourquoi les Américains admiraient-ils autant la reine Elisabeth II ?","https://www.20minutes.fr/monde/3348395-20220910-mort-reine-elisabeth-ii-pourquoi-americains-admiraient-autant-the-queen"
"False","True","De 7 à 77 ans, les Anglais font confiance à leur green king Charles III","https://www.20minutes.fr/monde/3348391-20220909-mort-reine-elisabeth-ii-homme-etat-precurseur-climat-7-77-ans-anglais-font-confiance-green-king-charles-iii"
"False","True","Leroy Merlin lance un radiateur connecté pour économiser l'énergie","https://www.20minutes.fr/high-tech/3348175-20220909-equation-enora-leroy-merlin-lance-radiateur-connecte-programmer-economies-energie"
"False","True","Quel souvenir vous évoque la musique du « Grand Bleu » ?","https://www.20minutes.fr/arts-stars/cinema/3347579-20220909-cineconcert-grand-bleu-souvenir-evoque-musique-film-luc-besson"
"False","True","Les quatre vraies nouveautés proposées sur les iPhone 14","https://www.20minutes.fr/high-tech/3347663-20220909-iphone-14-quatre-nouveautes-font-toute-difference-precedents-smartphones-apple"
"False","True","24 heures","https://www.20minutes.fr/diaporama/diaporama-15381-images-caroline-garcia-quarts-finale-us-open-rentree-parti-republicains-line-renaud-decoree"
"False","True","Une reine, un peuple","https://www.20minutes.fr/diaporama/diaporama-15388-mort-reine-elisabeth-ii-hommage-britanniques-images"
"False","True","Prévenir le suicide, en parlant de manière anonyme","https://www.20minutes.fr/podcast/3347583-20220908-minute-papillon-prevenir-suicide-parlant-maniere-anonyme"
"False","True","Comment vivre sa vie sexuelle quand on souffre du cancer ?","https://www.20minutes.fr/podcast/3344959-20220902-tout-sexplique-vie-sexuelle-cancer"
"False","True","En quoi le générique de la série « En Thérapie » est-il mémorable ?","https://www.20minutes.fr/podcast/3342227-20220828-collection-generiques-pourquoi-generique-serie-therapie-memorable"
"False","True","A un an de la Coupe du monde, le cécirugby transforme l'essai","https://www.20minutes.fr/sport/4000869-20220910-an-coupe-monde-france-cecirugby-transforme-essai"
"False","True","Pour aider l’agriculture, Macron appelle à « consommer français »","https://www.20minutes.fr/societe/3348407-20220910-aider-agriculture-president-emmanuel-macron-appelle-consommer-francais"
"False","True","La posture nucléaire nord-coréenne est une « menace », dit Paris","https://www.20minutes.fr/monde/3348403-20220910-coree-nord-paris-condamne-menace-paix-securite-apres-nouvelle-loi-frappes-nucleaires"
"False","True","Le geste pas écolo du McDo Vieux-Port fait bondir la mairie de Marseille","https://www.20minutes.fr/planete/3348071-20220909-marseille-video-virale-employe-mcdo-vieux-port-vidant-rue-bidon-liquides-fait-bondir-mairie"
"False","True","La « marche de l’empereur » en Antarctique entravée par la Chine","https://www.20minutes.fr/planete/3346391-20220909-biodiversite-comment-chine-entrave-marche-empereur-antarctique"
"False","True","Le Moyen-Orient se réchauffe deux fois plus vite que la moyenne","https://www.20minutes.fr/planete/3347963-20220908-changement-climatique-moyen-orient-rechauffe-deux-fois-plus-vite-moyenne"
"False","True","L'« incroyable » rencontre d’une entrepreneuse lyonnaise avec Elisabeth II","https://www.20minutes.fr/monde/4000917-20220910-mort-reine-elisabeth-ii-rencontre-incroyable-cheffe-entreprise-lyonnaise-majeste"
"False","True","Avec le Covid long, l’union des œnologues inquiète pour ses nez","https://www.20minutes.fr/societe/4000830-20220910-covid-19-union-nologues-inquiete-nez"
"False","True","Vincent Collet, treize ans avec les Bleus et toujours la même « flamme »","https://www.20minutes.fr/sport/4000907-20220909-eurobasket-vincent-collet-treize-ans-tete-bleus-toujours-flamme"
"False","True","Olympe, le tournoi FIFA réservé aux passionnés du Web3","https://www.20minutes.fr/20-mint/3335011-20220808-olympe-tournoi-fifa-reserve-passionnes-web-3-ouvert-lecteurs-20-minutes"
"False","True","Biarritz surfe aussi sur la vague des NFT","https://www.20minutes.fr/20-mint/3333887-20220804-avant-faire-surfer-amoureux-bitcoin-biarritz-accueille-grand-messe-nft"
"False","True","Amateurs de crypto-monnaies, dévoilez-vous!","https://www.20minutes.fr/20-mint/3331783-20220729-cryptocheck-besoin-amateurs-cryptomonnaies-consentants-tirer-portrait"
"False","True","Guerre en Ukraine : Le personnel ukrainien de la centrale de Zaporijjie…","https://www.20minutes.fr/monde/3348023-20220909-guerre-ukraine-kiev-affirme-avoir-repris-grande-ville-balaklia"
"False","True","Non, l’absence de Meghan Markle à Balmoral n’était pas liée à la sécurité","https://www.20minutes.fr/monde/3348103-20220909-mort-reine-elisabeth-ii-non-meghan-markle-absente-chevet-reine-souci-securite"
"False","True","Le geste pas écolo du McDo Vieux-Port fait bondir la mairie de Marseille","https://www.20minutes.fr/planete/3348071-20220909-marseille-video-virale-employe-mcdo-vieux-port-vidant-rue-bidon-liquides-fait-bondir-mairie"
"False","True","Mort d’Elisabeth II : Charles III sera officiellement proclamé roi ce…","https://www.20minutes.fr/monde/3348019-20220909-mort-elisabeth-ii-direct-monde-unanime-hommages-reine-elizabeth-ii"
"False","True","« Mon seul viewer, c’est mon retour ! », la solitude des petits streameurs","https://www.20minutes.fr/culture/4000786-20220909-z-event-seul-viewer-retour-video-solitude-petits-streameurs-twitch"
"False","True","Bilal Hassani veut « être un raz de marée sur la France » pour la rentrée","https://www.20minutes.fr/arts-stars/television/3347895-20220909-danse-stars-bilal-hassani-veut-etre-raz-maree-france-rentree"
"False","True","Enzo, 13 ans, a disparu depuis mercredi dans le Gers","https://www.20minutes.fr/faits_divers/4000865-20220909-gers-enzo-13-ans-disparu-depuis-mercredi"
"False","True","Oui, les nouveaux vaccins anti-Covid-19 ont bien été testés sur des humains","https://www.20minutes.fr/sante/3347523-20220909-covid-19-nouveaux-vaccins-anti-coronavirus-testes-humains-avant-mise-marche-faux"
"False","True","A Nantes, un enlèvement en pleine rue par des individus cagoulés","https://www.20minutes.fr/faits_divers/4000919-20220909-nantes-homme-enleve-pleine-rue-individus-cagoules"
"False","True","Le suspect d’une insoutenable agression à Toulouse interpellé","https://www.20minutes.fr/faits_divers/4000893-20220909-toulouse-suspect-interpelle-apres-insoutenable-agression-pont-saint-pierre"
"False","True","De 7 à 77 ans, les Anglais font confiance à leur « green king » Charles III","https://www.20minutes.fr/monde/3348391-20220909-mort-reine-elisabeth-ii-homme-etat-precurseur-climat-7-77-ans-anglais-font-confiance-green-king-charles-iii"
"False","True","Après des débuts canons, la saison « tristement drôle » de Ferrari","https://www.20minutes.fr/sport/4000664-20220910-formule-1-apres-debuts-canons-saison-tristement-drole-ferrari"
"False","True","Kiev dit avoir repris 30 localités près de Kharkiv, Moscou envoie des renforts","https://www.20minutes.fr/monde/3348263-20220909-guerre-ukraine-armee-russe-envoie-renforts-vers-kharkiv-apres-contre-offensive-kiev"
"False","True","Juré dans « Danse avec les stars », Bilal Hassani veut « être un raz-de-marée sur la France » pour la rentrée","https://www.20minutes.fr/arts-stars/television/3347895-20220909-danse-stars-bilal-hassani-veut-etre-raz-maree-france-rentree"
"False","True","Le policier auteur du tir à Nice placé sous contrôle judiciaire","https://www.20minutes.fr/faits_divers/4000898-20220909-refus-obtemperer-nice-policier-auteur-tir-vise-information-judiciaire-homicide-volontaire"
"False","True","Charles III sera-t-il le King écolo qu'il nous faut ?","https://www.20minutes.fr/monde/3348275-20220909-mort-reine-elisabeth-ii-charles-iii-king-ecolo-faut"
"False","True","Emotion contenue dans un village prisé des sujets de la reine","https://www.20minutes.fr/monde/4000900-20220909-mort-reine-elisabeth-ii-va-manquer-monde-entier-tristesse-flegme-so-british-perigord"
