"premium","picture","title","url"
"False","True","Attaque en Allemagne : plusieurs blessés dans une université, le tireur est décédé","https://www.ouest-france.fr/europe/allemagne/allemagne-un-homme-ouvre-le-feu-dans-une-universite-et-fait-plusieurs-blesses-1e694b9c-7d16-11ec-94d8-f8316f0f985f"
"False","True","Crise en Ukraine : l’Otan déploie des avions de chasse et navires face à la menace russe","https://www.ouest-france.fr/europe/ukraine/conflit-en-ukraine-l-otan-deploie-de-nouvelles-troupes-pour-renforcer-la-defense-en-europe-de-l-est-7e9a0658-7cff-11ec-94d8-f8316f0f985f"
"False","True","DIRECT. Présidentielle : « J’annoncerai ma décision en temps voulu », dit Emmanuel Macron","https://www.ouest-france.fr/elections/presidentielle/direct-presidentielle-467-000-inscrits-a-la-primaire-populaire-le-vote-sera-lance-jeudi-b770cd7e-7c85-11ec-b524-56ae6ebcd2a5"
"False","True","DIRECT. Covid-19 : la fin de « la phase aiguë de la pandémie » est possible cette année, selon l’OMS","https://www.ouest-france.fr/sante/virus/coronavirus/direct-covid-19-le-passe-vaccinal-entre-en-vigueur-ce-lundi-ebac7cc6-7c78-11ec-98c4-2194f60311ee"
"False","True","REPORTAGE. « Pour fuir, j’ai risqué ma vie tous les jours » : à Pontivy, ﻿Sadiqullah reprend espoir","https://www.ouest-france.fr/elections/presidentielle/reportage-pour-fuir-j-ai-risque-ma-vie-tous-les-jours-a-pontivy-sadiqullah-reprend-espoir-612f2fee-7985-11ec-9d21-e721da20c99f"
"False","True","Le passe vaccinal remplace le passe sanitaire à partir de ce lundi : voici ce que ça change","https://www.ouest-france.fr/sante/virus/coronavirus/pass-vaccinal/le-passe-vaccinal-remplace-le-passe-sanitaire-ce-lundi-24-janvier-voici-ce-que-ca-change-3a8df23a-71dd-4ef8-b6c6-44a027bf513d"
"False","True","EN IMAGES. La Grèce et la Turquie sous la neige, le trafic interrompu à l’aéroport d’Istanbul","https://www.ouest-france.fr/meteo/neige/en-images-la-grece-et-la-turquie-sous-la-neige-le-trafic-interrompu-a-l-aeroport-d-istanbul-276c7d8c-7d1a-11ec-94d8-f8316f0f985f"
"False","True","Après la fuite du « cannibale des Pyrénées », un autre meurtrier s’échappe de l’hôpital de Toulouse","https://www.ouest-france.fr/societe/faits-divers/apres-la-fuite-du-cannibale-des-pyrenees-un-autre-meurtrier-s-echappe-de-l-hopital-de-toulouse-7cfac58c-7d0c-11ec-94d8-f8316f0f985f"
"False","False","En pleine crise ukrainienne, le parti Podemos propose à l’Espagne de quitter l’Otan","https://www.ouest-france.fr/europe/espagne/en-pleine-crise-ukrainienne-le-parti-podemos-propose-a-l-espagne-de-quitter-l-otan-2693b1c2-7d1b-11ec-9a2b-9a26527fd882"
"False","False","Burkina Faso. La France appelle ses ressortissants « à la prudence et à éviter tout déplacement »","https://www.ouest-france.fr/monde/burkina-faso/burkina-faso-la-france-appelle-ses-ressortissants-a-la-prudence-et-a-eviter-tout-deplacement-b922143a-7d15-11ec-94d8-f8316f0f985f"
"False","False","La France conseille de reporter les voyages non essentiels vers l’Ukraine","https://www.ouest-france.fr/europe/ukraine/la-france-conseille-de-reporter-les-voyages-non-essentiels-vers-l-ukraine-b7eaf1da-7d11-11ec-94d8-f8316f0f985f"
"False","False","Après la manifestation contre les restrictions, onze personnes en garde à vue à Bruxelles","https://www.ouest-france.fr/sante/virus/coronavirus/apres-la-manifestation-contre-les-restrictions-onze-personnes-en-garde-a-vue-a-bruxelles-7e9fa926-7d1a-11ec-94d8-f8316f0f985f"
"False","False","« C’est tellement brutal » : en Bretagne, l’institutrice décède après un AVC en classe","https://www.ouest-france.fr/bretagne/treguier-22220/treguier-l-institutrice-sophie-barroux-decede-apres-un-avc-en-classe-dab3f884-7c61-11ec-8c83-efcc5d1018b8"
"False","False","Corrèze. Un jeune homme suspecté de viol sur une étudiante lors d'un covoiturage","https://www.ouest-france.fr/nouvelle-aquitaine/correze/correze-un-jeune-homme-suspecte-de-viol-sur-une-etudiante-lors-d-un-covoiturage-7603624"
"False","True","DIRECT. Covid-19 : la fin de « la phase aiguë de la pandémie » est possible cette année, selon l’OMS","https://www.ouest-france.fr/sante/virus/coronavirus/direct-covid-19-le-passe-vaccinal-entre-en-vigueur-ce-lundi-ebac7cc6-7c78-11ec-98c4-2194f60311ee"
"False","True","Après la manifestation contre les restrictions, onze personnes en garde à vue à Bruxelles","https://www.ouest-france.fr/sante/virus/coronavirus/apres-la-manifestation-contre-les-restrictions-onze-personnes-en-garde-a-vue-a-bruxelles-7e9fa926-7d1a-11ec-94d8-f8316f0f985f"
"False","True","Toulouse. Interpellée après avoir frappé et étranglé deux infirmières d’un centre de vaccination","https://www.ouest-france.fr/region-occitanie/toulouse-31000/toulouse-interpellee-apres-avoir-frappe-et-etrangle-deux-infirmieres-d-un-centre-de-vaccination-7603572"
"False","True","La fin du Covid-19 « en tant qu’urgence sanitaire mondiale » est possible cette année, estime l’OMS","https://www.ouest-france.fr/sante/virus/coronavirus/la-fin-du-covid-19-en-tant-qu-urgence-sanitaire-mondiale-est-possible-cette-annee-estime-l-oms-bf1520bc-7d06-11ec-94d8-f8316f0f985f"
"True","True","À Nantes, le télétravail plombe l’activité des hôtels","https://www.ouest-france.fr/pays-de-la-loire/nantes-44000/nantes-le-teletravail-plombe-l-activite-des-hotels-194a0a24-7916-11ec-9d21-e721da20c99f"
"False","True","POINT DE VUE. Ukraine : « Paix ou guerre en Europe ? »","https://www.ouest-france.fr/europe/ukraine/point-de-vue-ukraine-paix-ou-guerre-en-europe-225b635e-7c4c-11ec-b524-56ae6ebcd2a5"
"False","True","Quiz. Que vous reste-t-il de vos cours de maths ?","https://www.ouest-france.fr/leditiondusoir/2022-01-21/quiz-que-vous-reste-t-il-de-vos-cours-de-maths-78e2059e-cfe8-4c82-843e-9febc716d0dc"
"False","True","« C’est tellement brutal » : en Bretagne, l’institutrice décède après un AVC en classe","https://www.ouest-france.fr/bretagne/treguier-22220/treguier-l-institutrice-sophie-barroux-decede-apres-un-avc-en-classe-dab3f884-7c61-11ec-8c83-efcc5d1018b8"
"False","True","REPORTAGE. « Pour fuir, j’ai risqué ma vie tous les jours » : à Pontivy, ﻿Sadiqullah reprend espoir","https://www.ouest-france.fr/elections/presidentielle/reportage-pour-fuir-j-ai-risque-ma-vie-tous-les-jours-a-pontivy-sadiqullah-reprend-espoir-612f2fee-7985-11ec-9d21-e721da20c99f"
"True","True","EN IMAGES. « C’est une symphonie » : cette Finistérienne traque les tempêtes derrière son objectif","https://www.ouest-france.fr/bretagne/quimper-29000/en-images-c-est-une-symphonie-cette-finisterienne-traque-les-tempetes-derriere-son-objectif-c4454716-79d6-11ec-a728-edf56c711fc0"
"False","True","« Je ne m’attendais pas à une telle violence » : menacé à Pontanézen, un élu brestois porte plainte","https://www.ouest-france.fr/bretagne/brest-29200/brest-je-ne-m-attendais-pas-a-une-telle-violence-menace-a-pontanezen-un-elu-porte-plainte-96d62628-7d01-11ec-94d8-f8316f0f985f"
"True","True","Covid-19. Plus d’un an après son infection, la vie de cette Normande est toujours entre parenthèses","https://www.ouest-france.fr/normandie/argentan-61200/pres-d-argentan-plus-d-un-an-apres-avoir-contracte-le-covid-sa-vie-est-toujours-entre-parentheses-394d71e0-7a91-11ec-90d8-e0664ad7138e"
"False","True","Prix Empreintes d’Ouest-France. Quatre raisons d’envoyer son manuscrit","https://www.ouest-france.fr/culture/livres/prix-empreintes-d-ouest-france-quatre-raisons-d-envoyer-son-manuscrit-e65f5fb6-7a1d-11ec-a5c8-df22f6eb22a7"
"False","True","Corrèze. Un détenu s’évade, menottes aux poignets, à son arrivée à la prison de Tulle","https://www.ouest-france.fr/nouvelle-aquitaine/tulle-19000/correze-un-detenu-s-evade-menottes-aux-poignets-a-son-arrivee-a-la-prison-de-tulle-7603469"
"False","True","Qui est Alexandre Martin, brigadier de l’opération Barkhane tué au Mali lors d’une attaque ?","https://www.ouest-france.fr/politique/defense/qui-est-alexandre-martin-brigadier-de-l-operation-barkhane-tue-au-mali-lors-d-une-attaque-96680352-7c2d-11ec-b524-56ae6ebcd2a5"
"False","True","REPORTAGE. « Les 3x8, oui c’est dur… mais ça paye » : en immersion avec les « Michelin » de Cholet","https://www.ouest-france.fr/elections/presidentielle/reportage-les-3x8-oui-c-est-dur-mais-ca-paye-en-immersion-avec-les-michelin-de-cholet-67de6c56-7601-11ec-9e58-b836eaa253ea"
"True","True","Loire-Atlantique. Le litre de carburant à 2 €, c’est pour bientôt","https://www.ouest-france.fr/pays-de-la-loire/loire-atlantique/loire-atlantique-le-litre-de-carburant-a-2-c-est-pour-bientot-fc829a7c-7c2c-11ec-ade6-a18333bfde0e"
"True","True","En un an, le nombre de gîtes coquins a triplé en Vendée","https://www.ouest-france.fr/pays-de-la-loire/vendee/en-un-an-le-nombre-de-gites-coquins-a-triple-en-vendee-9b99fd8e-787d-11ec-9f9d-07aa71b0e4e2"
"True","True","Saint-Herblain. Deux jeunes gens se tuent dans une collision : une perte de contrôle inexpliquée","https://www.ouest-france.fr/pays-de-la-loire/nantes-44000/saint-herblain-deux-jeunes-gens-se-tuent-dans-une-collision-une-perte-de-controle-inexpliquee-e4a78c56-7ba9-11ec-94c1-45b869ad3da4"
"False","True","DIRECT. Présidentielle : « J’annoncerai ma décision en temps voulu », dit Emmanuel Macron","https://www.ouest-france.fr/elections/presidentielle/direct-presidentielle-467-000-inscrits-a-la-primaire-populaire-le-vote-sera-lance-jeudi-b770cd7e-7c85-11ec-b524-56ae6ebcd2a5"
"False","True","REPORTAGE. « Pour fuir, j’ai risqué ma vie tous les jours » : à Pontivy, ﻿Sadiqullah reprend espoir","https://www.ouest-france.fr/elections/presidentielle/reportage-pour-fuir-j-ai-risque-ma-vie-tous-les-jours-a-pontivy-sadiqullah-reprend-espoir-612f2fee-7985-11ec-9d21-e721da20c99f"
"False","True","Présidentielle. Macron candidat ? « Réponse au prochain épisode », répond-il dans la Creuse","https://www.ouest-france.fr/elections/presidentielle/presidentielle-macron-candidat-reponse-au-prochain-episode-repond-il-en-dans-la-creuse-6e377d8c-7d12-11ec-b03b-6adfce5755b3"
"False","True","Présidentielle. Les ralliements RN à Zemmour sont « une catastrophe » pour le RN, estime Ménard","https://www.ouest-france.fr/politique/robert-menard/presidentielle-les-ralliements-rn-a-zemmour-sont-une-catastrophe-pour-le-rn-estime-menard-8f786158-7cfb-11ec-b03b-6adfce5755b3"
"False","True","Avec 467 000 inscrits, la primaire populaire explose son compteur : nouvelle pièce sur l’échiquier ?","https://www.ouest-france.fr/elections/presidentielle/avec-467-000-inscrits-la-primaire-populaire-explose-son-compteur-nouvelle-piece-sur-l-echiquier-04d67880-7cfd-11ec-94d8-f8316f0f985f"
"False","True","Pyrénées-Orientales. Victime de crachats et d’insultes, un arbitre de rugby escorté par les gendarmes","https://www.ouest-france.fr/region-occitanie/millas-66170/pyrenees-orientales-victime-de-crachats-et-d-insultes-un-arbitre-de-rugby-escorte-par-les-gendarmes-7603638"
"False","False","Affaire Jubillar : les fouilles se poursuivent pour retrouver le corps de Delphine dans le Tarn","https://www.ouest-france.fr/faits-divers/affaire-jubillar/affaire-jubillar-les-fouilles-se-poursuivent-pour-retrouver-le-corps-de-delphine-dans-le-tarn-127d3b52-7d0e-11ec-94d8-f8316f0f985f"
"False","False","Après la fuite du « cannibale des Pyrénées », un autre meurtrier s’échappe de l’hôpital de Toulouse","https://www.ouest-france.fr/societe/faits-divers/apres-la-fuite-du-cannibale-des-pyrenees-un-autre-meurtrier-s-echappe-de-l-hopital-de-toulouse-7cfac58c-7d0c-11ec-94d8-f8316f0f985f"
"False","True","Bouches-du-Rhône. Un couple et ses deux enfants sautent du deuxième étage pour échapper aux flammes","https://www.ouest-france.fr/provence-alpes-cote-dazur/la-ciotat-13600/bouches-du-rhone-un-couple-et-ses-deux-enfants-sautent-du-deuxieme-etage-pour-echapper-aux-flammes-7603610"
"False","False","Vaucluse. Deux jeunes motards grièvement blessés dans une collision lors d’un rodéo urbain à Apt","https://www.ouest-france.fr/provence-alpes-cote-dazur/apt-84400/vaucluse-deux-jeunes-motards-grievement-blesses-dans-une-collision-lors-d-un-rodeo-urbain-a-apt-7603553"
"False","False","Quel temps fera-t-il à Toulon et ses environs le lundi 24 janvier 2022 ?","https://www.ouest-france.fr/meteo/provence-alpes-cote-dazur/toulon-83000/la-meteo-du-jour-a-toulon-e0e43564-de3d-5966-b1c3-408c44685874"
"False","True","Mort de Cédric Chouviat : une nouvelle expertise médicale confirme la responsabilité des policiers","https://www.ouest-france.fr/societe/faits-divers/mort-de-cedric-chouviat-une-nouvelle-expertise-medicale-confirme-la-responsabilite-des-policiers-cb3481fc-7d11-11ec-94d8-f8316f0f985f"
"False","False","Seine-Saint-Denis. Il se fait traîner, frapper et voler près de 56 000 €, ses agresseurs condamnés","https://www.ouest-france.fr/ile-de-france/pantin-93500/seine-saint-denis-il-se-fait-trainer-frapper-et-voler-pres-de-56-000-eu-ses-agresseurs-condamnes-7603578"
"False","False","Radio d’une rescapée du Bataclan aux enchères : la blessée se dit « extrêmement choquée »","https://www.ouest-france.fr/attentats-paris/radio-d-une-rescapee-du-bataclan-aux-encheres-la-blessee-se-dit-extremement-choquee-16a16002-7d07-11ec-94d8-f8316f0f985f"
"False","True","Le député Guillaume Peltier visé par une enquête préliminaire pour utilisation de fonds publics","https://www.ouest-france.fr/politique/affaires/le-depute-guillaume-peltier-vise-par-une-enquete-preliminaire-pour-utilisation-de-fonds-publics-de991f22-7d17-11ec-b03b-6adfce5755b3"
"False","False","Une commune d’Indre-et-Loire trouve enfin un médecin généraliste après six années de recherches","https://www.ouest-france.fr/centre-val-de-loire/indre-et-loire/une-commune-d-indre-et-loire-trouve-enfin-un-medecin-generaliste-apres-six-annees-de-recherches-7603474"
"False","False","Orléans. Il aurait agressé un homme dans le tram qui lui demandait de mettre son masque","https://www.ouest-france.fr/centre-val-de-loire/orleans-45000/orleans-il-aurait-agresse-un-homme-dans-le-tram-qui-lui-demandait-de-mettre-son-masque-7603458"
