"premium","picture","title","url"
"False","True","Odessa bombardée, le port touché par un missile…","https://www.20minutes.fr/monde/3276303-20220423-guerre-ukraine-direct-treve-paque-orthodoxe"
"False","True","« On se sent utile »... A Nice, des jeunes lancent le premier chantier d’insertion écocitoyen","https://www.20minutes.fr/societe/3275899-20220423-nice-montrer-possible-autour-yazir-20-ans-premiers-agents-ecocitoyens"
"False","True","Kiev tente aujourd'hui une nouvelle évacuation de civils depuis Marioupol","https://www.20minutes.fr/monde/3276359-20220423-guerre-ukraine-kiev-tente-nouvelle-evacuation-civils-depuis-marioupol"
"False","True","Dix disparus après un accident dans une mine en Pologne","https://www.20minutes.fr/monde/3276351-20220423-pologne-dix-disparus-apres-deuxieme-accident-mine"
"False","True","Forfait, Tadej Pogacar ne défendra pas son titre sur la Doyenne des classiques","https://www.20minutes.fr/sport/3276347-20220423-liege-bastogne-liege-forfait-tadej-pogacar-defendra-titre-doyenne-classiques"
"False","True","La Monnaie de Paris reçoit une dotation de 10 millions d’euros","https://www.20minutes.fr/societe/3276343-20220423-monnaie-paris-etat-accorde-dotation-10-millions-euros-diversifier-activites"
"False","True","Daniel Lévi opéré d’urgence, sa femme donne de ses nouvelles","https://www.20minutes.fr/arts-stars/people/3276339-20220423-femme-daniel-levi-donne-nouvelles-chanteur-apres-hospitalisation"
"False","True","La « suffisance » de Macron lors du débat peut-elle lui coûter des points ?","https://www.20minutes.fr/elections/presidentielle/3275251-20220421-presidentielle-2022-suffisance-emmanuel-macron-lors-debat-peut-couter-points"
"False","True","Est-il avantageux pour un Français d’aller faire ses courses en Belgique ?","https://www.20minutes.fr/economie/3276087-20220423-inflation-avantageux-francais-aller-faire-courses-belgique"
"False","True","Macron et Le Pen veulent des réseaux sociaux plus français… utopique ?","https://www.20minutes.fr/high-tech/3276135-20220422-presidentielle-2022-souverainete-numerique-demantelement-facebook-reseaux-sociaux-macron-pen-croient-magie"
"False","True","Gare à cette estimation douteuse qui donne Marine Le Pen gagnante","https://www.20minutes.fr/elections/3275911-20220422-presidentielle-2022-attention-estimation-douteuse-donne-marine-pen-gagnante"
"False","True","Non, l’ISF ne faisait pas fuir les riches, comme le dit Emmanuel Macron","https://www.20minutes.fr/politique/3276043-20220422-presidentielle-2022-selon-emmanuel-macron-isf-faisait-fuir-riches-jamais-prouve"
"False","True","Oui, les hausses des violences aux personnes et intrafamiliales sont liées","https://www.20minutes.fr/elections/3275635-20220422-presidentielle-2022-augmentation-violences-personnes-surtout-due-celle-violences-intrafamiliales-comme-dit-macron"
"False","True","Tous les résultats du premier tour de la présidentielle 2022","https://www.20minutes.fr/elections/resultats/"
"False","True","Rideau Michel !","https://www.20minutes.fr/diaporama/diaporama-15309-images-acteur-michel-bouquet-quitte"
"False","True","Il y a 20 ans, les manifs après le choc","https://www.20minutes.fr/diaporama/diaporama-15314-images-20-ans-jeunesse-manifestait-contre-extreme-droite-france"
"False","True","Le bouillon de nouilles préféré de Naruto se déguste au Ramen bar","https://www.20minutes.fr/gastronomie/3274551-20220423-pasta-cos-bouillon-nouilles-prefere-naruto-deguste-ramen-bar"
"False","True","Est-il avantageux pour un Français d’aller faire ses courses en Belgique ?","https://www.20minutes.fr/economie/3276087-20220423-inflation-avantageux-francais-aller-faire-courses-belgique"
"False","True","L'espoir dans l'affaire Maddie, après quinze ans de fausses pistes","https://www.20minutes.fr/societe/3275675-20220422-affaire-maddie-espoir-denouement-apres-quinze-ans-fausses-pistes-impasses"
"False","True","La jeunesse a-t-elle abdiqué face à Marine Le Pen ?","https://www.20minutes.fr/elections/presidentielle/3274647-20220421-presidentielle-2022-vingt-ans-apres-21-avril-2002-jeunesse-abdique-face-marine-pen"
"False","True","Kate et William dévoilent de nouvelles photos du Prince Louis pour son quatrième anniversaire","https://www.20minutes.fr/arts-stars/people/3276315-20220423-kate-william-devoilent-nouvelles-photos-prince-louis-quatrieme-anniversaire"
"False","True","TF1 condamnée pour diffamation à cause d'un sujet sur un « escroc »","https://www.20minutes.fr/arts-stars/television/3276323-20220423-tf1-condamnee-diffamation-cause-reportage-escroc"
"False","True","Gare à cette estimation douteuse qui donne Marine Le Pen gagnante","https://www.20minutes.fr/elections/3275911-20220422-presidentielle-2022-attention-estimation-douteuse-donne-marine-pen-gagnante"
"False","True","Non, l’ISF ne faisait pas fuir les riches, comme le dit Emmanuel Macron","https://www.20minutes.fr/politique/3276043-20220422-presidentielle-2022-selon-emmanuel-macron-isf-faisait-fuir-riches-jamais-prouve"
"False","True","Oui, les hausses des violences aux personnes et intrafamiliales sont liées","https://www.20minutes.fr/elections/3275635-20220422-presidentielle-2022-augmentation-violences-personnes-surtout-due-celle-violences-intrafamiliales-comme-dit-macron"
"False","True","Orelsan annonce Une nouvelle date de concert à Paris La Défense Arena","https://www.20minutes.fr/arts-stars/culture/3276331-20220423-orelsan-tour-2022-nouvelle-date-concert-paris-defense-arena-rappeur"
"False","True","A Lyon, la région baisse fortement ses subventions culturelles","https://www.20minutes.fr/lyon/3276167-20220423-lyon-mairie-metropole-voient-rouge-apres-baisse-drastique-subventions-culturelles-region"
"False","True","A Montpellier, Lexie troque son ordi contre une nageoire pour devenir sirène professionnelle","https://www.20minutes.fr/insolite/3276027-20220423-montpellier-rencontre-lexie-sirene-professionnelle"
"False","True","La virginité, c’est quoi ? Réponses en podcast","https://www.20minutes.fr/podcast/3275147-20220422-tout-sexplique-virginite-quoi-reponses-podcast"
"False","True","Les zones d’ombre de Gerard Piqué, footballeur et homme d’affaires","https://www.20minutes.fr/sport/3275543-20220422-zone-mixte-zones-ombre-gerard-pique-footballeur-hommes-affaires"
"False","True","Pourquoi l'expression « bien-être animal » est (hélas) trompeuse ?","https://www.20minutes.fr/planete/3273647-20220422-elevage-expression-bien-etre-animal-vise-minimiser-violences-faites-animaux"
"False","True","Après la polémique sur Marine Le Pen, Delphine Wespiser a fait un choix","https://www.20minutes.fr/arts-stars/people/3275999-20220422-apres-polemique-marine-pen-delphine-wespiser-prend-decision-definitive"
"False","True","Gare à cette estimation douteuse qui donne Marine Le Pen gagnante","https://www.20minutes.fr/elections/3275911-20220422-presidentielle-2022-attention-estimation-douteuse-donne-marine-pen-gagnante"
"False","True","Le salarié parisien qui avait déménagé en Bretagne sera bien licencié","https://www.20minutes.fr/societe/3276171-20220422-yvelines-salarie-parisien-demenage-bretagne-bien-licencie"
"False","True","Des paquets de pistaches rappelés à cause de pesticides","https://www.20minutes.fr/sante/3275603-20220422-paquets-pistaches-rappeles-toute-france-cause-pesticides"
"False","True","Guerre en Ukraine EN DIRECT : Odessa bombardée, le port touché par un…","https://www.20minutes.fr/monde/3276303-20220423-guerre-ukraine-direct-treve-paque-orthodoxe"
"False","True","Johnny Depp détaille sa consommation de drogue avec Marilyn Manson","https://www.20minutes.fr/arts-stars/people/3276067-20220422-quand-marilyn-manson-parle-trop-johnny-depp-donne-petite-pilule"
"False","True","TF1 condamnée pour diffamation à cause d’un reportage sur un « escroc »","https://www.20minutes.fr/arts-stars/television/3276323-20220423-tf1-condamnee-diffamation-cause-reportage-escroc"
"False","True","Paris accuse des mercenaires russes de mise en scène d'un charnier au Mali","https://www.20minutes.fr/monde/3276283-20220423-mali-armee-francaise-accuse-mercenaires-wagner-avoir-mis-scene-charnier-decouvert-gossi"
"False","True","Les Etats-Unis mettent en garde la Chine sur la situation des îles Salomon","https://www.20minutes.fr/monde/3276215-20220422-iles-salomon-etats-unis-mettent-garde-contre-toute-installation-militaire-chinoise"
"False","True","Guerre en Ukraine : Le chef de l’ONU se rendra en Russie puis en Ukraine…","https://www.20minutes.fr/monde/3275511-20220422-guerre-ukraine-direct-aucun-couloir-evacuation-civils-possible-vendredi-selon-kiev"
"False","True","Un homme blesse quatre personnes à Washington puis se suicide","https://www.20minutes.fr/faits_divers/3276335-20220423-etats-unis-homme-blesse-quatre-personnes-balle-dont-fillette-washington-puis-suicide"
"False","True","Les Girondins ont besoin d’un miracle, ça tombe bien Lopez connaît la recette","https://www.20minutes.fr/sport/3275731-20220423-bordeaux-fc-nantes-girondins-besoin-miracle-ca-tombe-bien-lopez-connait-recette"
"False","True","L’ancien ouvreur du XV de France Beauxis annonce sa retraite","https://www.20minutes.fr/sport/3276327-20220423-xv-france-ancien-demi-ouverture-international-lionel-beauxis-annonce-retraite"
"False","True","Mais qui se cache derrière la banane, le croco, le papillon et le cerf ?","https://www.20minutes.fr/arts-stars/television/3276311-20220423-mask-singer-decrypte-indices-trouver-banane-croco-papillon-cerf"
"False","True","Le bouillon de nouilles préféré de Naruto se déguste au Ramen bar","https://www.20minutes.fr/gastronomie/3274551-20220423-pasta-cos-bouillon-nouilles-prefere-naruto-deguste-ramen-bar"
"False","True","Après de nouveaux tirs de roquettes, les Palestiniens de Gaza interdits de venir travailler en Israël","https://www.20minutes.fr/monde/3276319-20220423-conflit-israelo-palestinien-palestiniens-gaza-interdits-venir-travailler-israel-apres-nouveaux-tirs-roquettes"
"False","True","Energie, Otan… Quelles sont les promesses de Macron et Le Pen ?","https://www.20minutes.fr/elections/3271759-20220420-presidentielle-2022-energie-logement-otan-compare-promesses-macron-pen-sujets-clivants"
"False","True","Julian Alaphilippe a-t-il trop de poids sur les épaules depuis qu'il porte le maillot arc-en-ciel ?","https://www.20minutes.fr/sport/3275655-20220423-liege-bastogne-liege-champion-monde-julian-alaphilippe-trop-pression-epaules"
"False","True","A 28 ans, Arnaud Wolff parcourt le monde pour filmer des pros du BMX","https://www.20minutes.fr/strasbourg/3274959-20220423-strasbourg-story-board-ca-joue-instinct-rencontre-arnaud-wolff-strasbourgeois-parcourt-monde-filmer-pros-bmx"
