"premium","picture","title","url"
"False","True","DIRECT. Guerre en Ukraine : Kiev appelle les habitants de l'est du pays à évacuer ""maintenant"" craignant une offensive majeure sur le Donbass","https://mobile.francetvinfo.fr/monde/crash-en-ukraine/direct-guerre-en-ukraine-les-etats-unis-vont-debloquer-100-millions-de-dollars-supplementaires-d-aide-securitaire-pour-soutenir-kiev_5064658.html"
"False","True","Guerre en Ukraine : crimes de guerre, crimes contre l'humanité, génocide... Quels termes utiliser ?","https://mobile.francetvinfo.fr/monde/europe/manifestations-en-ukraine/guerre-en-ukraine-crimes-de-guerre-crimes-contre-l-humanite-genocide-quels-termes-utiliser_5064841.html"
"False","True","Guerre en Ukraine : exclure la Russie du Conseil de sécurité de l'ONU est ""inimaginable"", selon le géopoliticien Frédéric Encel","https://mobile.francetvinfo.fr/monde/europe/manifestations-en-ukraine/guerre-en-ukraine-exclure-la-russie-du-conseil-de-securite-de-l-onu-est-inimaginable-selon-le-geopoliticien-frederic-encel_5064127.html"
"False","True","Le dirigeant hongrois Viktor Orban a proposé à Vladimir Poutine de déclarer un ""cessez-le-feu immédiat""","https://mobile.francetvinfo.fr/monde/russie/vladimir-poutine/le-dirigeant-hongrois-viktor-orban-a-propose-a-vladimir-poutine-de-declarer-un-cessez-le-feu-immediat_5065258.html"
"False","True","Guerre en Ukraine : les associations recueillent de plus en plus de témoignages accusant les Russes de viols","https://mobile.francetvinfo.fr/monde/europe/manifestations-en-ukraine/guerre-en-ukraine-les-associations-recueillent-de-plus-en-plus-de-temoignages-accusant-les-russes-de-viols_5065045.html"
"False","True","La famille d'Yvan Colonna attaque l'Etat en justice estimant que l'administration pénitentiaire est ""juridiquement responsable de son décès""","https://mobile.francetvinfo.fr/politique/affaire/agression-d-yvan-colonna-en-prison/la-famille-d-yvan-colonna-attaque-l-etat-en-justice-estimant-que-l-administration-penitentiaire-est-juridiquement-responsable-de-son-deces_5065285.html"
"False","True","Affaire McKinsey : le Parquet national financier a ouvert une enquête pour ""blanchiment aggravé de fraude fiscale""","https://mobile.francetvinfo.fr/elections/recours-de-l-etat-a-des-cabinets-de-conseil-le-parquet-national-financier-a-ouvert-une-enquete-pour-blanchiment-aggrave-de-fraude-fiscale_5064994.html"
"False","True","Assassinat de Samuel Paty : la famille de l'enseignant dépose plainte contre les ministères de l'Intérieur et de l'Éducation nationale","https://mobile.francetvinfo.fr/faits-divers/terrorisme/enseignant-decapite-dans-les-yvelines/assassinat-de-samuel-paty-la-famille-de-l-enseignant-depose-plainte-contre-les-ministeres-de-l-interieur-et-de-l-education-nationale_5065180.html"
"False","True","Contaminations à la bactérie E. coli : le préfet du Nord interdit la production de pizzas dans l'usine Buitoni de Caudry","https://mobile.francetvinfo.fr/sante/alimentation/contaminations-a-la-bacterie-e-coli-le-prefet-du-nord-interdit-la-production-de-pizzas-dans-l-usine-buitoni-de-caudry_5064925.html"
"False","True","VIDEOS. Les candidats à la présidentielle vous répondent : sont-ils prêts à légaliser l’euthanasie ?","https://www.francetvinfo.fr/elections/presidentielle/questions-francais/euthanasie-les-candidats-election-presidentielle-repondent-aux-francais-video.html"
"False","True","Espace : la Nasa propose au public de faire le tour de la Lune en inscrivant les noms des passagers sur un disque dur placé en orbite","https://mobile.francetvinfo.fr/sciences/espace/espace-la-nasa-propose-au-public-de-faire-le-tour-de-la-lune-en-inscrivant-les-noms-des-passagers-sur-un-disque-dur-place-en-orbite_5064865.html"
"False","True","Une enquête ouverte pour un ""incident grave"" sur un vol New York-Paris : ""L'avion a fait à peu près n'importe quoi""","https://mobile.francetvinfo.fr/economie/transports/greve-a-air-france/une-enquete-ouverte-pour-un-incident-grave-sur-un-vol-new-york-paris-l-avion-a-fait-n-importe-quoi_5065000.html"
"False","True","Ethiopie : deux ONG dénoncent un ""nettoyage ethnique"" et des ""crimes de guerre"" au Tigré","https://mobile.francetvinfo.fr/monde/afrique/ethiopie/ethiopie-deux-ong-denoncent-un-nettoyage-ethnique-et-des-crimes-de-guerre-au-tigre_5064805.html"
"False","True","""Batman Autopsie"" : Spotify lance le 3 mai une série audio basée sur l'univers du super-héros DC Comics","https://mobile.francetvinfo.fr/culture/bd/comics/batman-autopsie-spotify-lance-le-3-mai-une-serie-audio-basee-sur-l-univers-du-super-heros-dc-comics_5064949.html"
"False","True","Football : Marie-Antoinette Katoto en ""total désaccord"" avec le PSG alors qu'elle est en fin de contrat en juin","https://mobile.francetvinfo.fr/sports/foot/psg/football-marie-antoinette-katoto-en-total-desaccord-avec-le-psg-alors-qu-elle-est-en-fin-de-contrat-en-juin_5065072.html"
"False","True","Présidentielle 2022 : à quelques jours du premier tour, Jean-Luc Mélenchon et ses hologrammes tentent de convaincre ""la France qui se cherche""","https://mobile.francetvinfo.fr/elections/presidentielle/presidentielle-2022-a-quelques-jours-du-premier-tour-jean-luc-melenchon-et-ses-hologrammes-tentent-de-convaincre-la-france-qui-se-cherche_5063575.html"
"False","True","""Inexorable"" : Benoît Poelvoorde et Mélanie Doutey à contre-emploi dans un thriller familial fiévreux","https://mobile.francetvinfo.fr/culture/cinema/sorties-de-films/inexorable-benoit-poelvoorde-et-melanie-doutey-a-contre-emploi-dans-un-thriller-familial-fievreux_5064820.html"
"False","True","Mali : que s'est-il passé à Moura, où des centaines de personnes ont été tuées par l'armée malienne et des mercenaires russes ?","https://mobile.francetvinfo.fr/monde/afrique/mali/mali-que-s-est-il-passe-a-moura-ou-des-centaines-de-personnes-ont-ete-tuees-par-l-armee-malienne-et-des-mercenaires-russes_5063236.html"
"False","True","Chlordécone : ""La justice ne peut pas laisser sans réponse des faits aussi irresponsables"", s'indigne l'avocat Harry Durimel","https://mobile.francetvinfo.fr/monde/environnement/pesticides/chlordecone-la-justice-ne-peut-pas-laisser-sans-reponse-des-faits-aussi-irresponsables-s-indigne-l-avocat-harry-durimel_5064766.html"
"False","True","Election présidentielle : on a vérifié six affirmations des candidats invités dans l'émission ""Elysée 2022""","https://mobile.francetvinfo.fr/elections/presidentielle/candidats/presidentielle-on-a-verifie-six-affirmations-des-candidats-invites-dans-l-emission-elysee-2022_5064190.html"
"False","True","Six fromages vendus en grande surface, dont un brie et des coulommiers, sont rappelés pour risque de listériose","https://mobile.francetvinfo.fr/sante/alimentation/six-fromages-vendus-en-grandes-surfaces-dont-un-brie-et-des-coulommiers-sont-rappeles-pour-risque-de-listeriose_5064103.html"
"False","True","Rappels de chocolats Kinder : cinq questions sur les cas de salmonellose recensés en France","https://mobile.francetvinfo.fr/sante/alimentation/rappels-de-chocolats-kinder-cinq-questions-sur-les-cas-de-salmonellose-recenses-en-france_5063233.html"
"False","True","""En même temps"", de Kerven et Delépine, pamphlet politiquement incorrect, surréaliste et hilarant","https://mobile.francetvinfo.fr/culture/cinema/sorties-de-films/en-meme-temps-de-kerven-et-delepine-pamphlet-politiquement-incorrect-surrealiste-et-hilarant_5062057.html"
"False","True","Ce que l'on sait de la mort de Jeremie Cohen, percuté par un tramway à Bobigny après une agression","https://mobile.francetvinfo.fr/faits-divers/ce-que-l-on-sait-de-la-mort-de-jeremy-cohen-percute-par-un-tramway-a-bobigny-apres-une-agression_5063221.html"
"False","True","Lutte contre la propagande jihadiste : quel bilan tirer des fermetures de mosquées durant le quinquennat d'Emmanuel Macron ?","https://mobile.francetvinfo.fr/societe/religion/religion-laicite/lutte-contre-la-propagande-jihadiste-quel-bilan-tirer-des-fermetures-de-mosquees-durant-le-quinquennat-d-emmanuel-macron_5051338.html"
"False","True","Présidentielle : ""La seule union des droites possible, c'est autour de moi"", assure Valérie Pécresse","https://mobile.francetvinfo.fr/elections/presidentielle/candidats/presidentielle-la-seule-union-des-droites-possible-c-est-autour-de-moi-assure-valerie-pecresse_5064964.html"
"False","True","Suicide assisté, euthanasie, sédation profonde... Ce que proposent les candidats à l'élection présidentielle sur le thème de la fin de vie","https://mobile.francetvinfo.fr/elections/presidentielle/suicide-assiste-euthanasie-sedation-profonde-ce-que-proposent-les-candidats-a-l-election-presidentielle-sur-le-theme-de-la-fin-de-vie_5051137.html"
"False","True","DIRECT. Présidentielle 2022 : Gabriel Attal ""appelle les Français à se rendre aux urnes, quel que soit le candidat"" pour qui ils voteront","https://mobile.francetvinfo.fr/elections/presidentielle/direct-presidentielle-2022-a-quatre-jours-du-scrutin-les-candidats-enchainent-les-meetings-et-prises-de-parole-dans-les-medias_5063962.html"
"False","True","Episode de gel : Jean Castex annonce 20 millions d'euros d'aide d'urgence aux agriculteurs","https://mobile.francetvinfo.fr/meteo/pic-de-froid/episode-de-gel-jean-castex-annonce-20-millions-d-euros-d-aide-d-urgence-aux-agriculteurs_5064709.html"
"False","True","Près du Havre, le benzène de la zone industrielle pollue l'air des écoles","https://mobile.francetvinfo.fr/monde/environnement/crise-climatique/pollution-air/pres-du-havre-le-benzene-de-la-zone-industrielle-pollue-l-air-des-ecoles_5053060.html"
"False","True","Twitter va tester un bouton pour permettre à ses utilisateurs de corriger leurs tweets","https://mobile.francetvinfo.fr/internet/reseaux-sociaux/twitter/twitter-veut-tester-un-bouton-pour-corriger-ses-tweets_5064613.html"
"False","True","Les pierres tombales d'occasion, l'alternative économique d'un entrepreneur de Seine-Maritime","https://mobile.francetvinfo.fr/france/ilsontlasolution/les-pierres-tombales-d-occasion-l-alternative-economique-d-un-entrepreneur-de-seine-maritime_5065108.html"
"False","True","Dans les Alpes-Maritimes, une coiffeuse offre des coupes gratuites aux réfugiées ukrainiennes","https://mobile.francetvinfo.fr/monde/europe/manifestations-en-ukraine/dans-les-alpes-maritimes-une-coiffeuse-offre-des-coupes-gratuites-aux-refugiees-ukrainiennes_5064922.html"
"False","True","""Les présidents de Cabu"" en campagne à la Duduchothèque de Châlons-en-Champagne","https://mobile.francetvinfo.fr/culture/en-regions/les-presidents-de-cabu-en-campagne-a-la-duduchotheque-de-chalons-en-champagne_5063179.html"
"False","True","En Haute-Savoie, l’intégration réussie de deux enfants ukrainiens dans une classe de CE2","https://mobile.francetvinfo.fr/monde/europe/manifestations-en-ukraine/en-haute-savoie-lintegration-reussie-de-deux-enfants-ukrainiens-dans-une-classe-de-ce2_5063716.html"
"False","True","Maltraitance infantile : des boîtes à paroles installées dans les vestiaires du Stade Toulousain","https://mobile.francetvinfo.fr/societe/education/harcelement-a-l-ecole/maltraitance-infantile-des-boites-a-paroles-installees-dans-les-vestiaires-du-stade-toulousain_5063389.html"
"False","True","Dans le Calvados, la commune d’Épron expérimente l’éclairage public à la demande","https://mobile.francetvinfo.fr/economie/energie/dans-le-calvados-la-commune-depron-experimente-leclairage-public-a-la-demande_5063602.html"
"False","True","En Haute-Marne, une ex-enseignante apprend le français à des réfugiées ukrainiennes","https://mobile.francetvinfo.fr/monde/europe/manifestations-en-ukraine/en-haute-marne-une-ex-enseignante-apprend-le-francais-a-des-refugiees-ukrainiennes_5063449.html"
"False","True","Près de Valenciennes, le jeune réfugié ukrainien Illia nouvelle star du club de foot local","https://mobile.francetvinfo.fr/monde/europe/manifestations-en-ukraine/pres-de-valenciennes-le-jeune-refugie-ukrainien-illia-nouvelle-star-du-club-de-foot-local_5063332.html"
"False","True","A Toulon, des chefs d’entreprise enfilent les gants de boxe pour travailler sur le dépassement de soi","https://mobile.francetvinfo.fr/sante/prevention/a-toulon-des-chefs-dentreprise-enfilent-les-gants-de-boxe-pour-travailler-sur-le-depassement-de-soi_5062162.html"
"False","True","Dans l’Orne, le Médicobus plus que jamais indispensable face au manque de médecins généralistes","https://mobile.francetvinfo.fr/france/ilsontlasolution/dans-lorne-le-medicobus-plus-que-jamais-indispensable-face-au-manque-de-medecins-generalistes_5061892.html"
"False","True","Jeux vidéo : ""Lego Star Wars"", ""Switch Sports"", ""MotoGP 2022""... On joue à quoi en avril ?","https://mobile.francetvinfo.fr/culture/jeux-video/jeux-video-lego-star-wars-switch-sports-motogp-2022-on-joue-a-quoi-en-avril_5057314.html"
"False","True","Dans les Vosges, de l'hydrogène vert produit à partir de déchets de bois","https://mobile.francetvinfo.fr/france/ilsontlasolution/dans-les-vosges-de-l-hydrogene-vert-produit-a-partir-de-dechets-de-bois_5057503.html"
"False","True","Présidentielle 2022 : les propositions des candidats sur les courses alimentaires","https://mobile.francetvinfo.fr/elections/presidentielle/candidats/presidentielle-2022-les-propositions-des-candidats-sur-les-courses-alimentaires_5065300.html"
"False","False","DIRECT. Présidentielle 2022 : Gabriel Attal ""appelle les Français à se rendre aux urnes, quel que soit le candidat"" pour qui ils voteront","https://mobile.francetvinfo.fr/elections/presidentielle/direct-presidentielle-2022-a-quatre-jours-du-scrutin-les-candidats-enchainent-les-meetings-et-prises-de-parole-dans-les-medias_5063962.html"
"False","False","VIDEOS. Les candidats à la présidentielle vous répondent : sont-ils prêts à légaliser l’euthanasie ?","https://mobile.francetvinfo.fr/elections/presidentielle/questions-francais/euthanasie-les-candidats-election-presidentielle-repondent-aux-francais-video.html"
"False","False","Présidentielle 2022 : un scrutin plus serré que prévu ?","https://mobile.francetvinfo.fr/elections/presidentielle-2022-un-scrutin-plus-serre-que-prevu_5064958.html"
"False","False","Présidentielle 2022 : les propositions des candidats pour réformer la démocratie","https://mobile.francetvinfo.fr/elections/presidentielle/candidats/les-propositions-des-candidats-pour-reformer-la-democratie_5064817.html"
"False","True","Bien respirer pour ne plus stresser, la recette (miracle ?) de la cohérence cardiaque","https://mobile.francetvinfo.fr/sante/psycho-bien-etre/bien-respirer-pour-ne-plus-stresser-la-recette-miracle-de-la-coherence-cardiaque_4185325.html"
"False","True","L'hôpital public en crise : surmenage, perte de sens, mise en danger des patients... Ils racontent pourquoi ils ont rendu leur blouse","https://mobile.francetvinfo.fr/sante/hopital/temoignages-l-hopital-public-en-crise-surmenage-perte-de-sens-mise-en-danger-des-patients-ils-racontent-pourquoi-ils-ont-rendu-leur-blouse_4849467.html"
