"premium","picture","title","url"
"False","True","Incendie près de Landiras en Gironde: le feu ""fixé"", les habitants peuvent regagner leurs domiciles","https://www.bfmtv.com/police-justice/incendie-pres-de-landiras-en-gironde-le-feu-fixe-les-habitants-peuvent-regagner-leurs-domiciles_AD-202208140195.html"
"False","True","Une délégation du Congrès américain arrive à Taïwan, deux semaines après la visite de Nancy Pelosi","https://www.bfmtv.com/international/une-delegation-du-congres-americain-arrive-a-taiwan-deux-semaines-apres-la-visite-de-nancy-pelosi_AD-202208140184.html"
"False","True","Egypte: 41 morts dans l'incendie d'une église au Caire","https://www.bfmtv.com/international/afrique/egypte/egypte-au-moins-41-morts-dans-l-incendie-d-une-eglise-au-caire_AD-202208140151.html"
"False","True","Pour Roberto Saviano, Salman Rushdie ""sera toujours une cible""","https://www.bfmtv.com/culture/pour-roberto-saviano-salman-rushdie-sera-toujours-une-cible_AV-202208140144.html"
"False","False","Attaque contre Salman Rushdie: J. K. Rowling se dit menacée, la police enquête","https://www.bfmtv.com/culture/attaque-contre-salman-rushdie-j-k-rowling-se-dit-menacee-la-police-enquete_AD-202208140179.html"
"False","True","Salman Rushdie n'est plus sous respirateur artificiel et va mieux, selon son agent","https://www.bfmtv.com/international/amerique-nord/etats-unis/salman-rushdie-n-est-plus-sous-respirateur-artificiel-selon-son-agent_AN-202208140012.html"
"False","False","Salman Rushdie: pour Bernard-Henri Lévy, l'auteur britannique doit obtenir le Nobel de…","https://www.bfmtv.com/culture/salman-rushdie-doit-obtenir-le-nobel-de-litterature-selon-bernard-henri-levy_AD-202208140068.html"
"False","True","L'homme accusé d'avoir attaqué Salman Rushdie plaide ""non coupable"" de tentative de meurtre","https://www.bfmtv.com/international/amerique-nord/etats-unis/l-homme-accuse-d-avoir-attaque-salman-rushdie-plaide-non-coupable-de-tentative-de-meurtre_AD-202208140025.html"
"False","False","Agression de Salman Rushdie: ce que l'on sait de Hadi Matar, le suspect interpellé","https://www.bfmtv.com/international/amerique-nord/etats-unis/agression-de-salman-rushdie-ce-que-l-on-sait-de-hadi-matar-le-suspect-interpelle_AD-202208130147.html"
"False","False","Isabelle Adjani se remémore son soutien à Salman Rushdie: ""Un artiste est à défendre…","https://www.bfmtv.com/culture/isabelle-adjani-se-rememore-son-soutien-a-salman-rushdie-un-artiste-est-a-defendre-inlassablement_AN-202208140115.html"
"False","True","Isabelle Adjani se remémore son soutien à Salman Rushdie: ""Un artiste est à défendre inlassablement""","https://www.bfmtv.com/culture/isabelle-adjani-se-rememore-son-soutien-a-salman-rushdie-un-artiste-est-a-defendre-inlassablement_AN-202208140115.html"
"False","True","Incendie dans la forêt de Brocéliande: le feu est fixé, 180 pompiers mobilisés","https://www.bfmtv.com/meteo/incendie-dans-la-foret-de-broceliande-le-feu-est-fixe-180-pompiers-mobilises_AN-202208140097.html"
"False","True","Incendie en Aveyron: 500 hectares brûlés à Mostuéjouls, la pluie aide les pompiers dans leur lutte","https://www.bfmtv.com/environnement/incendies-en-aveyron-500-hectares-brules-a-mostuejouls-la-pluie-aide-les-pompiers-dans-leur-lutte_AN-202208140060.html"
"False","False","Incendie dans la Drôme: 378 hectares brûlés, le feu ""toujours pas fixé""","https://www.bfmtv.com/societe/incendie-dans-la-drome-378-hectares-brules-le-feu-toujours-pas-fixe_AD-202208130249.html"
"False","True","L'Ukraine affirme que les troupes russes sont menacées dans la région de Kherson","https://www.bfmtv.com/international/europe/l-ukraine-affirme-que-les-troupes-russes-sont-menacees-dans-la-region-de-kherson_AD-202208140149.html"
"False","True","Le succès sans fin du drone turc Bayraktar, dont l'usine tournera à plein régime pendant trois ans","https://www.bfmtv.com/economie/entreprises/defense/le-succes-sans-fin-du-drone-turc-bayraktar-dont-l-usine-tournera-a-plein-regime-pendant-trois-ans_AV-202208140162.html"
"False","True","Vous pouvez les mépriser, oublier les chasseurs de primes ou les fous que l'Histoire lâche à vos trousses, la meute, elle, ne vous oublie pas. Bernard-Henri Lévy","https://www.bfmtv.com/culture/salman-rushdie-doit-obtenir-le-nobel-de-litterature-selon-bernard-henri-levy_AD-202208140068.html"
"False","True","Mort de Breonna Taylor aux États-Unis: une ex-policière accusée va plaider coupable","https://www.bfmtv.com/international/amerique-nord/etats-unis/mort-de-breonna-taylor-aux-etats-unis-une-ex-policiere-accusee-va-plaider-coupable_AN-202208140172.html"
"False","True","Pompiers, agriculteurs, renforts... Macron veut réunir les acteurs de la lutte contre les…","https://www.bfmtv.com/politique/pompiers-agriculteurs-renforts-macron-veut-reunir-les-acteurs-de-la-lutte-contre-les-incendies_AN-202208140107.html"
"False","True","Sécheresse: les feux d'artifice du 15 août compromis et même déjà annulés dans certains…","https://www.bfmtv.com/environnement/climat/secheresse-les-feux-d-artifice-du-15-aout-compromis-et-meme-deja-annules-dans-certains-departements_AD-202208140056.html"
"False","True","Sept départements en vigilance orange orages dans le sud-est","https://www.bfmtv.com/meteo/neuf-departements-en-vigilance-orange-orages-dans-le-sud-est_AN-202208140015.html"
"False","True","Variole du singe: la France a acheté 1,5 million de doses de vaccin supplémentaires","https://www.bfmtv.com/economie/entreprises/industries/variole-du-singe-la-france-a-achete-1-5-million-de-doses-de-vaccin-supplementaires_AV-202208140082.html"
"False","True","En ville, ces animaux menacés de disparition par l'évolution urbaine","https://www.bfmtv.com/animaux/en-ville-ces-animaux-menaces-de-disparition-par-l-evolution-urbaine_AN-202208140004.html"
"False","True","EN DIRECT - Multiplex Ligue 1: les promus Toulouse et Auxerre mènent, Clermont reprend…","https://rmcsport.bfmtv.com/football/ligue-1/multiplex-ligue-1-en-direct-les-promus-ajaccio-et-auxerre-veulent-se-relancer-a-domicile-toulouse-tentera-de-confirmer_LS-202208140161.html"
"False","True","""Les Kaïra"": comment Franck Gastambide a conquis le cinéma français avec une comédie sur…","https://www.bfmtv.com/people/cinema/les-kaira-comment-franck-gastambide-a-conquis-le-cinema-francais-avec-une-comedie-sur-le-porno_AN-202208140011.html"
"False","True","Brûlage dirigé, pare-feu... Ces techniques utilisées par les pompiers pour contrôler les…","https://www.bfmtv.com/environnement/brulage-dirige-pare-feu-ces-techniques-utilisees-par-les-pompiers-pour-controler-les-incendies_AV-202208120092.html"
"False","True","Le Rhin et la Tamise à sec, incendies au Portugal: la sécheresse en Europe en 5 images…","https://www.bfmtv.com/environnement/climat/le-rhin-a-sec-incendies-au-portugal-les-images-de-l-europe-frappee-par-la-secheresse_AN-202208110341.html"
"False","True","L'allocation de rentrée scolaire sera versée en deux temps cette année","https://www.bfmtv.com/economie/economie-social/l-allocation-de-rentree-scolaire-sera-versee-en-deux-temps-cette-annee_AV-202208110334.html"
"False","True","Homme abattu par un tir de police à Roissy: les images du déroulé des faits","https://www.bfmtv.com/police-justice/homme-abattu-par-un-tir-de-police-a-roissy-les-images-du-deroule-des-faits_AN-202208110046.html"
"False","True","Le débat contre les calèches relancé à New York après le malaise d'un cheval en pleine rue","https://www.bfmtv.com/international/amerique-nord/etats-unis/le-debat-contre-les-caleches-relance-a-new-york-apres-le-malaise-d-un-cheval-en-pleine-rue_AN-202208120176.html"
"False","True","En difficulté, la compagnie scandinave SAS obtient un prêt de 700 millions de dollars","https://www.bfmtv.com/economie/entreprises/transports/en-difficulte-la-compagnie-scandinave-sas-obtient-un-pret-de-700-millions-de-dollars_AD-202208140187.html"
"False","True","Vendée: un camping controversé a finalement été fermé","https://www.bfmtv.com/economie/consommation/vendee-un-camping-controverse-a-finalement-ete-ferme_AN-202208140117.html"
"False","True","Variole du singe: la France a acheté 1,5 million de doses de vaccin supplémentaires","https://www.bfmtv.com/economie/entreprises/industries/variole-du-singe-la-france-a-achete-1-5-million-de-doses-de-vaccin-supplementaires_AV-202208140082.html"
"False","True","La Russie commence à livrer plus de gaz que prévu à la Hongrie","https://www.bfmtv.com/economie/entreprises/energie/la-russie-commence-a-livrer-plus-de-gaz-que-prevu-a-la-hongrie_AD-202208140059.html"
"False","True","Agression de Salman Rushdie: les ventes des ""Versets sataniques"" grimpent en flèche","https://www.bfmtv.com/economie/entreprises/industries/agression-de-salman-rushdie-les-ventes-des-versets-sataniques-grimpent-en-fleche_AV-202208130162.html"
"False","True","EN DIRECT - Multiplex Ligue 1: les promus Toulouse et Auxerre mènent, Clermont reprend espoir face à Reims","https://rmcsport.bfmtv.com/football/ligue-1/multiplex-ligue-1-en-direct-les-promus-ajaccio-et-auxerre-veulent-se-relancer-a-domicile-toulouse-tentera-de-confirmer_LS-202208140161.html"
"False","True","PSG: déjà de l'eau dans le gaz entre Neymar et Mbappé ?","https://rmcsport.bfmtv.com/football/ligue-1/psg-deja-de-l-eau-dans-le-gaz-entre-neymar-et-mbappe-a-cause-des-penaltys_AV-202208140058.html"
"False","True","Rugby: le sélectionneur des All Blacks en danger, à un an de la Coupe du monde en France","https://rmcsport.bfmtv.com/rugby/rugby-le-selectionneur-des-all-blacks-en-danger-a-un-an-de-la-coupe-du-monde-en-france_AV-202208140114.html"
"False","True","OM: Sanchez présent dans le groupe pour Brest, mais pas Dieng","https://rmcsport.bfmtv.com/football/ligue-1/om-sanchez-present-dans-le-groupe-pour-brest-mais-pas-dieng_AV-202208140096.html"
"False","True","Aviron: Tarantola et Bové vice-championnes d'Europe après leur argent olympique","https://rmcsport.bfmtv.com/sports-extremes/aviron-tarantola-et-bove-vice-championnes-d-europe-apres-leur-argent-olympique_AV-202208140164.html"
"False","True","""J'ai pleuré tous les soirs pendants un an"" : fausses couches, vraies souffrances","https://www.bfmtv.com/societe/j-ai-pleure-tous-les-soirs-pendant-un-an-fausse-couche-vraies-souffrances_AN-202206230011.html"
"False","True","Carte. Résultats élections législatives 2022 : La France du vote RN au premier tour","https://www.bfmtv.com/politique/elections/legislatives/carte-resultats-elections-legislatives-2022-la-france-du-vote-rn-au-premier-tour_GN-202206130020.html"
"False","True","Lascaux, Chauvet, Cosquer...Le nouvel eldorado touristique des grottes préhistoriques","https://www.bfmtv.com/economie/lascaux-chauvet-cosquer-le-nouvel-eldorado-touristique-des-grottes-prehistoriques_GN-202206040051.html"
"False","True","Guerre en Ukraine : 100 jours de conflit racontés en images satellite","https://www.bfmtv.com/international/guerre-en-ukraine-100-jours-de-conflits-racontes-en-images-satellite_AN-202206030031.html"
"False","True","Entre l'Ukraine et la Russie, une histoire contrariée","https://www.bfmtv.com/international/entre-l-ukraine-et-la-russie-une-histoire-contrariee_GN-202205090013.html"
"False","True","PMA pour toutes : 9 mois après, l'attente se prolonge pour les femmes","https://www.bfmtv.com/societe/pma-pour-toutes-9-mois-apres-l-attente-se-prolonge-pour-les-femmes_GN-202205020004.html"
"False","True","Isabelle Adjani se remémore son soutien à Salman Rushdie: ""Un artiste est à défendre inlassablement""","https://www.bfmtv.com/culture/isabelle-adjani-se-rememore-son-soutien-a-salman-rushdie-un-artiste-est-a-defendre-inlassablement_AN-202208140115.html"
"False","True","Les secrets des tubes: ""Wind of change"" de Scorpions","https://www.bfmtv.com/people/musique/les-secrets-des-tubes-wind-of-change-de-scorpions_AV-202208140057.html"
"False","True","""Les Kaïra"": comment Franck Gastambide a conquis le cinéma français avec une comédie sur le porno","https://www.bfmtv.com/people/cinema/les-kaira-comment-franck-gastambide-a-conquis-le-cinema-francais-avec-une-comedie-sur-le-porno_AN-202208140011.html"
"False","True","Secrets des tubes : ""Winds of change"", Scorpions - 14/08","https://www.bfmtv.com/replay-emissions/week-end-premiere/secrets-des-tubes-winds-of-change-scorpions-14-08_VN-202208140043.html"
