"premium","picture","title","url"
"False","True","Coup de vent dans l’Ouest, tempête Denise en Corse… Un début de semaine agité sur le plan météo","https://www.ouest-france.fr/meteo/tempete/coup-de-vent-dans-l-ouest-tempete-denise-en-corse-un-debut-de-semaine-agite-sur-le-plan-meteo-ecaeae8e-6965-11ed-bd29-7d31c7eef0da"
"False","True","DIRECT Route du Rhum. Thomas Ruyant vainqueur en Imoca à Pointe-à-Pitre","https://www.ouest-france.fr/route-du-rhum/direct-route-du-rhum-thomas-ruyant-devant-dalin-et-beyou-un-final-a-suspense-a-pointe-a-pitre-524eb980-690e-11ed-a603-4a3131a74a26"
"False","True","Assurance chômage : le gouvernement dévoile ce lundi les futures règles d’indemnisation","https://www.ouest-france.fr/economie/emploi/chomage/assurance-chomage-la-nouvelle-reforme-presentee-lundi-5e192594-68c7-11ed-a603-4a3131a74a26"
"False","True","L’inflation « va coûter très cher aux Français », selon Michel-Édouard Leclerc","https://www.ouest-france.fr/economie/inflation/l-inflation-va-couter-tres-cher-aux-francais-selon-michel-edouard-leclerc-4470f4a6-696b-11ed-bd29-7d31c7eef0da"
"False","True","ENQUÊTE. Élection du président des Républicains : mais où va la droite ?","https://www.ouest-france.fr/politique/les-republicains/enquete-election-du-president-des-republicains-mais-ou-va-la-droite-891c1e8c-64bb-11ed-921e-4ba615c3f69c"
"False","True","Guerre en Ukraine. Craintes à Kherson, la Moldavie impactée… Le point sur la nuit","https://www.ouest-france.fr/monde/guerre-en-ukraine/guerre-en-ukraine-craintes-a-kherson-la-moldavie-impactee-le-point-sur-la-nuit-1a098580-ec21-4cd7-87de-6ef813c60e67"
"True","True","Coupe du monde. Retenu au Qatar pendant quatre ans, Stéphane Morello raconte sa « prison dorée »","https://www.ouest-france.fr/sport/football/football-retenu-au-qatar-pendant-quatre-ans-le-saumurois-stephane-morello-raconte-sa-prison-doree-1d4d8aa2-68d4-11ed-a603-4a3131a74a26"
"False","True","QUIZ. Mail, Netflix, box internet… Connaissez-vous votre impact numérique sur l’environnement ?","https://www.ouest-france.fr/pays-de-la-loire/cholet-49300/quiz-mail-netflix-box-internet-connaissez-vous-votre-impact-numerique-sur-l-environnement-5f9a0c7e-68f1-11ed-a603-4a3131a74a26"
"False","False","Un séisme de magnitude 5,4 secoue l’Indonésie","https://www.ouest-france.fr/monde/catastrophes/seisme/un-seisme-de-magnitude-5-4-secoue-l-indonesie-4777af6a-696f-11ed-bd29-7d31c7eef0da"
"False","False","Élisabeth Borne préside ce lundi un Conseil des ministres des enfants","https://www.ouest-france.fr/politique/elisabeth-borne/elisabeth-borne-preside-ce-lundi-un-conseil-des-ministres-des-enfants-9b2174ec-696b-11ed-bd29-7d31c7eef0da"
"True","False","ENTRETIEN. Benzema, Coupe du monde au Qatar, secousses fédérales, avenir… Noël Le Graët se livre","https://www.ouest-france.fr/sport/football/equipe-de-france/entretien-benzema-qatar-secousses-federales-avenir-noel-le-graet-se-livre-92d2fb42-68b4-11ed-a603-4a3131a74a26"
"False","False","Présidence de LR : les trois candidats débattront sur LCI ce lundi soir","https://www.ouest-france.fr/politique/les-republicains/presidence-de-lr-les-trois-candidats-debattront-sur-lci-ce-lundi-soir-eabf132a-695b-11ed-bd29-7d31c7eef0da"
"True","False","Attentat déjoué du Thalys : le tireur El Khazzani rejugé en appel à partir d’aujourd’hui","https://www.ouest-france.fr/terrorisme/attentat-dejoue-du-thalys-le-tireur-el-khazzani-rejuge-en-appel-48127036-6677-11ed-9c6a-75ffb43b0cc7"
"False","False","Chômage. Quelles sont les conditions pour avoir droit aux allocations ? On vous répond","https://www.ouest-france.fr/economie/emploi/chomage/chomage-quelles-sont-les-conditions-pour-avoir-droit-aux-allocations-on-vous-repond-96d14476-6682-11ed-bd55-fe52b2b07d4b"
"False","True","DIRECT. Coupe du monde 2022 : suivez toute l’actualité du Mondial au Qatar de ce lundi 21 novembre","https://www.ouest-france.fr/sport/coupe-du-monde/direct/direct-coupe-du-monde-2022-suivez-toute-l-actualite-du-mondial-au-qatar-de-ce-lundi-21-novembre-cf6332d4-690e-11ed-a603-4a3131a74a26"
"False","True","HUMEUR. « Hugo, ne me ramène pas cette Coupe à la maison, garde-la pour toi ! »","https://www.ouest-france.fr/sport/coupe-du-monde/humeur-hugo-ne-me-ramene-pas-cette-coupe-a-la-maison-garde-la-pour-toi-e04e032e-6721-11ed-8d02-f374de6baa45"
"True","True","ENTRETIEN. Benzema, Coupe du monde au Qatar, secousses fédérales, avenir… Noël Le Graët se livre","https://www.ouest-france.fr/sport/football/equipe-de-france/entretien-benzema-qatar-secousses-federales-avenir-noel-le-graet-se-livre-92d2fb42-68b4-11ed-a603-4a3131a74a26"
"False","True","Coupe du monde. « Notre force, c’est le groupe », déclare l’Espagnol Sarabia","https://www.ouest-france.fr/sport/coupe-du-monde/coupe-du-monde-notre-force-c-est-le-groupe-declare-l-espagnol-sarabia-7c6a505c-696e-11ed-bd29-7d31c7eef0da"
"False","True","VIDÉO. Coupe du monde : un supporter équatorien s’embrouille avec un Qatari avant de fraterniser","https://www.ouest-france.fr/sport/coupe-du-monde/video-coupe-du-monde-un-supporter-equatorien-s-embrouille-avec-un-qatari-avant-de-fraterniser-553eebea-696a-11ed-8d4d-08b259fcf3f5"
"False","True","POINT DE VUE. Pour une croissance sélective","https://www.ouest-france.fr/economie/point-de-vue-pour-une-croissance-selective-28ef7eca-65ae-11ed-9023-3db2565e335c"
"False","True","En mer Égée, des pneus, des chaises, des téléphones extirpés des fonds marins","https://www.ouest-france.fr/leditiondusoir/2022-11-18/en-mer-egee-des-pneus-des-chaises-des-telephones-extirpes-des-fonds-marins-79af227f-db08-4eb5-8365-43713d64878e"
"True","True","Décédé dans un squat en Bretagne, Jef attendait un logement qu’il n’a jamais eu","https://www.ouest-france.fr/bretagne/auray-56400/auray-decede-dans-un-squat-jef-attendait-un-logement-qu-il-n-a-jamais-eu-c3b327f2-68e9-11ed-906c-e03ece684c73"
"True","True","« J’ai trouvé ma voie » : Rodrigue Pailhès chante depuis trente ans dans les rues de Rennes","https://www.ouest-france.fr/bretagne/rennes-35000/j-ai-trouve-ma-voie-rodrigue-pailhes-chante-depuis-trente-ans-dans-les-rues-de-rennes-07b7d892-690f-11ed-a4d1-f9f88799c732"
"True","True","REPORTAGE. En Bretagne, ces parents apprennent à communiquer avec leur bébé avec leurs mains","https://www.ouest-france.fr/actualites-enfants/reportage-a-plouegat-guerand-les-parents-apprennent-a-communiquer-avec-leur-bebe-avec-leurs-mains-971dd7a4-68c7-11ed-8d55-eae8f9b87768"
"True","True","Maître de la BD, François Bourgeon fait accoster ses « Passagers du vent » dans le Finistère","https://www.ouest-france.fr/bretagne/pont-labbe-29120/maitre-de-la-bd-francois-bourgeon-fait-accoster-ses-passagers-du-vent-dans-le-finistere-28cc536a-4c85-11ed-87bc-f04d1f7a1978"
"True","True","Terrain instable, « fissures » : pourquoi le sémaphore de Villerville doit être évacué ?","https://www.ouest-france.fr/normandie/trouville-sur-mer-14360/terrain-instable-fissures-pourquoi-le-semaphore-de-villerville-doit-etre-evacue-1474cb6c-6824-11ed-8d42-b9ab4d04aa80"
"False","True","Calvados. Le trotteur normand Galius est mort dans la nuit précédant le Prix de Bretagne","https://www.ouest-france.fr/normandie/hotot-en-auge-14430/le-trotteur-normand-galius-est-mort-dans-la-nuit-precedant-le-prix-de-bretagne-fae8e5c8-68b6-11ed-8d55-eae8f9b87768"
"False","True","Coup de vent dans l’Ouest, tempête Denise en Corse… Un début de semaine agité sur le plan météo","https://www.ouest-france.fr/meteo/tempete/coup-de-vent-dans-l-ouest-tempete-denise-en-corse-un-debut-de-semaine-agite-sur-le-plan-meteo-ecaeae8e-6965-11ed-bd29-7d31c7eef0da"
"False","True","Un ado de 14 ans en urgence absolue après un accident entre une voiture et une moto en Normandie","https://www.ouest-france.fr/normandie/etrepagny-27150/eure-un-adolescent-de-14-ans-en-urgence-absolue-apres-un-accident-entre-une-voiture-et-une-moto-b4fe2be2-68b9-11ed-8d55-eae8f9b87768"
"True","True","Un designer angevin crée des meubles en bois… sans couper d’arbres","https://www.ouest-france.fr/pays-de-la-loire/angers-49000/un-designer-angevin-cree-des-meubles-en-bois-sans-couper-d-arbres-470848d6-6353-11ed-822f-aa909ea5cf47"
"True","True","Coupure d’électricité. Comment Nantes métropole se prépare à être peut-être plongée dans le noir","https://www.ouest-france.fr/pays-de-la-loire/nantes-44000/coupure-d-electricite-comment-nantes-metropole-se-prepare-a-etre-peut-etre-plongee-dans-le-noir-ab855b00-6777-11ed-8d02-f374de6baa45"
"False","True","Coup de vent dans l’Ouest, tempête Denise en Corse… Un début de semaine agité sur le plan météo","https://www.ouest-france.fr/meteo/tempete/coup-de-vent-dans-l-ouest-tempete-denise-en-corse-un-debut-de-semaine-agite-sur-le-plan-meteo-ecaeae8e-6965-11ed-bd29-7d31c7eef0da"
"False","True","Loire-Atlantique. Un homme retrouvé mort dans un incendie à Sion-les-Mines","https://www.ouest-france.fr/pays-de-la-loire/chateaubriant-44110/loire-atlantique-un-homme-retrouve-mort-dans-un-incendie-a-sion-les-mines-6d091628-68c6-11ed-8d55-eae8f9b87768"
"False","True","DIRECT Route du Rhum. Thomas Ruyant vainqueur en Imoca à Pointe-à-Pitre","https://www.ouest-france.fr/route-du-rhum/direct-route-du-rhum-thomas-ruyant-devant-dalin-et-beyou-un-final-a-suspense-a-pointe-a-pitre-524eb980-690e-11ed-a603-4a3131a74a26"
"False","True","Route du Rhum. Le podium en Ocean Fifty, Le Cléac’h est arrivé… Revivez la journée du 20 novembre","https://www.ouest-france.fr/route-du-rhum/direct-route-du-rhum-suspense-incroyable-en-ocean-fifty-armel-le-cleac-h-proche-de-l-arrivee-dbb12e88-68a0-11ed-8d55-eae8f9b87768"
"True","True","Route du Rhum. Erwan Le Roux, ou la force tranquille du président","https://www.ouest-france.fr/route-du-rhum/route-du-rhum-erwan-le-roux-ou-la-force-tranquille-du-president-e2d4416c-690b-11ed-a4d1-f9f88799c732"
"False","True","CARTE - Route du Rhum. Arrivée en Guadeloupe, traversée de l'Atlantique, suivez tous les skippers","https://www.ouest-france.fr/route-du-rhum/classement/"
"False","True","VIDÉO Route du Rhum. Armel Le Cléac’h franchi la ligne d'arrivée à Pointe-à-Pitre","https://www.ouest-france.fr/route-du-rhum/videos-route-du-rhum/video-route-du-rhum-armel-le-cleach-franchi-la-ligne-d-arrivee-a-pointe-a-pitre-416b5360-efe0-4277-96ec-2c3d54260d61"
"False","True","Coupe de France. Tous les résultats des matches du 8e tour","https://www.ouest-france.fr/sport/football/coupe-de-france/coupe-de-france-tous-les-resultats-des-matches-du-8e-tour-deja-disputes-6f905fea-681d-11ed-8d42-b9ab4d04aa80"
"False","False","XV de France. Les Bleus dominent le Japon et terminent l’année 2022 invaincus","https://www.ouest-france.fr/sport/rugby/equipe-de-france/direct-xv-de-france-japon-suivez-le-dernier-match-de-la-tournee-de-novembre-des-bleus-en-live-e74acf48-683b-11ed-8d42-b9ab4d04aa80"
"False","False","Toulouse. Une femme de 96 ans violée chez elle, un homme interpellé","https://www.ouest-france.fr/societe/faits-divers/toulouse-une-femme-de-96-ans-violee-chez-elle-un-homme-interpelle-ddc8f4e6-6835-11ed-8d42-b9ab4d04aa80"
"True","True","Attentat déjoué du Thalys : le tireur El Khazzani rejugé en appel à partir d’aujourd’hui","https://www.ouest-france.fr/terrorisme/attentat-dejoue-du-thalys-le-tireur-el-khazzani-rejuge-en-appel-48127036-6677-11ed-9c6a-75ffb43b0cc7"
"False","False","Les prévisions météorologiques du lundi 21 novembre 2022 à Paris et ses environs","https://www.ouest-france.fr/meteo/ile-de-france/paris-75000/la-meteo-du-jour-a-paris-100ba5a9-d5b2-508c-a581-a0cd5061c667"
"False","False","VIDÉO. Pour sa première, l'Eleven All Stars sacre la France... Les temps forts de l'événement","https://www.ouest-france.fr/sport/video-pour-sa-premiere-l-eleven-all-stars-sacre-la-france-les-temps-forts-de-l-evenement-25c92ed0-0f5c-4f80-b8c9-79d61fb234cc"
"False","True","Les prévisions météorologiques du lundi 21 novembre 2022 à Toulon et ses environs","https://www.ouest-france.fr/meteo/provence-alpes-cote-dazur/toulon-83000/la-meteo-du-jour-a-toulon-9076f1b3-95b1-57c2-821c-2acc031acc7a"
"False","False","Quel temps est prévu à Toulon et ses environs le dimanche 20 novembre 2022 ?","https://www.ouest-france.fr/meteo/provence-alpes-cote-dazur/toulon-83000/la-meteo-du-jour-a-toulon-dfcefbb4-59b9-55c3-8451-e906a1f717d9"
"False","False","Quel temps fera-t-il à Toulon et ses environs le samedi 19 novembre 2022 ?","https://www.ouest-france.fr/meteo/provence-alpes-cote-dazur/toulon-83000/la-meteo-du-jour-a-toulon-2dfe25e9-f154-5074-9048-c0023d09710c"
"False","True","Coup de vent dans l’Ouest, tempête Denise en Corse… Un début de semaine agité sur le plan météo","https://www.ouest-france.fr/meteo/tempete/coup-de-vent-dans-l-ouest-tempete-denise-en-corse-un-debut-de-semaine-agite-sur-le-plan-meteo-ecaeae8e-6965-11ed-bd29-7d31c7eef0da"
"False","False","Adolescente tuée dans le Lot-et-Garonne. Le suspect mis en examen et placé en détention provisoire","https://www.ouest-france.fr/societe/faits-divers/adolescente-tuee-a-tonneins-le-suspect-avoue-avoir-viole-la-collegienne-ba3f7f74-68f1-11ed-a603-4a3131a74a26"
"False","False","La Région apporte son soutien à l’association OSE qui lutte contre les violences conjugales","https://www.ouest-france.fr/nouvelle-aquitaine/deux-sevres/deux-sevres-le-soutien-de-la-region-a-l-association-ose-qui-lutte-contre-les-violences-conjugales-c23fc922-682e-11ed-8d42-b9ab4d04aa80"
