"premium","picture","title","url"
"False","True","Les princes William et Harry marcheront ce soir ensemble derrière le cercueil d'Elizabeth II","https://www.bfmtv.com/people/tetes-couronnees/les-princes-william-et-harry-marcheront-ce-soir-ensemble-derriere-le-cercueil-d-elizabeth-ii_AN-202209140189.html"
"False","True","Bannière, sceptre, orbe... Quels sont les symboles qui accompagneront le cercueil d'Elizabeth II?","https://www.bfmtv.com/people/tetes-couronnees/banniere-sceptre-orbe-quels-sont-les-symboles-qui-accompagneront-le-cercueil-d-elizabeth-ii_AV-202209140049.html"
"False","True","Mort d'Elizabeth II: que va-t-il se passer ce mercredi à Londres?","https://www.bfmtv.com/people/tetes-couronnees/mort-d-elizabeth-ii-que-va-t-il-se-passer-ce-mercredi-a-londres_AD-202209140040.html"
"False","True","Longue attente, pas de photos: l'exposition de la dépouille d'Elizabeth II très encadrée","https://www.bfmtv.com/people/tetes-couronnees/longue-attente-pas-de-photos-l-exposition-de-la-depouille-d-elizabeth-ii-tres-encadree_AD-202209120390.html"
"False","True","Bains de foule, embrassades: le roi Charles III impose son style","https://www.bfmtv.com/international/bains-de-foule-embrassades-le-roi-charles-iii-impose-son-style_AV-202209130637.html"
"False","True","Mort d'Elizabeth II: Charles III va licencier des dizaines de personnes","https://www.bfmtv.com/people/tetes-couronnees/mort-d-elizabeth-ii-a-peine-roi-charles-iii-va-licencier-des-dizaines-de-personnes_AV-202209140178.html"
"False","True","Chefs d'Etat, têtes couronnées... qui est invité aux funérailles de la reine?","https://www.bfmtv.com/people/tetes-couronnees/chefs-d-etat-tetes-couronnees-qui-est-invite-aux-funerailles-de-la-reine_AN-202209140218.html"
"False","True","La veuve d’un terroriste du Bataclan a été rapatriée de Syrie en France","https://rmc.bfmtv.com/actualites/police-justice/la-veuve-d-un-terroriste-du-bataclan-a-ete-rapatriee-de-syrie-en-france_AN-202209140060.html"
"False","True","EN DIRECT - RTE: ""Pas de risque de black-out cet hiver""","https://www.bfmtv.com/economie/en-direct-crise-de-l-energie-suivez-les-annonces-en-direct_LN-202209140209.html"
"False","True","Bruno Le Maire revoit la croissance 2022 à la hausse à 2,7%","https://www.bfmtv.com/economie/economie-social/france/bruno-le-maire-revoit-la-croissance-2022-a-la-hausse-a-2-7_AD-202209140135.html"
"False","True","EN DIRECT - Conseil des ministres, conférence de presse de Borne: suivez l'actu politique de ce mercredi","https://www.bfmtv.com/politique/en-direct-conseil-des-ministres-conference-de-presse-de-borne-suivez-l-actu-politique-de-ce-mercredi_LN-202209140104.html"
"False","True","A ce niveau de querelle, il vaudrait mieux vivre séparé. François Hollande, sur la coalition à gauche","https://www.bfmtv.com/politique/gauche-du-travail-et-gauche-des-allocs-pour-francois-hollande-on-ne-peut-pas-les-opposer_AN-202209130253.html"
"False","True","Incendie en Gironde: le feu de Saumos gagne du terrain, plus de 3500 hectares maintenant…","https://www.bfmtv.com/societe/incendie-en-gironde-le-feu-de-saumos-gagne-du-terrain-plus-de-3500-hectares-maintenant-detruits_AV-202209140106.html"
"False","True","6 départements en vigilance orange pour des phénomènes orageux","https://www.bfmtv.com/meteo/6-departements-en-vigilance-orange-pour-des-phenomenes-orageux_AN-202209140083.html"
"False","True","Enseignement supérieur: les formations liées au développement durable séduisent de plus…","https://www.bfmtv.com/societe/enseignement-superieur-les-formations-liees-au-developpement-durable-seduisent-de-plus-en-plus_AN-202209140021.html"
"False","True","""Une victoire ukrainienne est possible"": en Occident, l'optimisme de retour après les…","https://www.bfmtv.com/international/europe/une-victoire-ukrainienne-est-possible-en-occident-l-optimisme-de-retour-apres-les-succes-militaires_AV-202209130484.html"
"False","True","Le nouveau directeur général d’Orpea promet qu'il ne laissera plus rien passer","https://www.bfmtv.com/economie/entreprises/le-nouveau-directeur-general-d-orpea-promet-qu-il-ne-laissera-plus-rien-passer_AV-202209140198.html"
"False","True","TOUT COMPRENDRE - Qu'est-ce que l'affaire du chantage à la sextape à la mairie de…","https://www.bfmtv.com/politique/tout-comprendre-qu-est-ce-que-l-affaire-du-chantage-a-la-sextape-a-la-mairie-de-saint-etienne_AN-202209130435.html"
"False","True","Main courante contre Adrien Quatennens : son épouse a dénoncé plusieurs épisodes de…","https://www.bfmtv.com/police-justice/main-courante-contre-adrien-quatennens-le-depute-accuse-d-acces-de-violence-par-son-epouse_AN-202209130682.html"
"False","True","""Il avait l'air plutôt calme"": stupeur à Caen après l'agression au couteau d'une…","https://www.bfmtv.com/police-justice/il-avait-l-air-plutot-calme-stupeur-a-caen-apres-l-agression-au-couteau-d-une-professeure-par-un-eleve_AV-202209140070.html"
"False","True","Bains de foule, embrassades: le roi Charles III impose son style","https://www.bfmtv.com/international/bains-de-foule-embrassades-le-roi-charles-iii-impose-son-style_AV-202209130637.html"
"False","True","Bannière, sceptre, orbe... Quels sont les symboles qui accompagneront le cercueil…","https://www.bfmtv.com/people/tetes-couronnees/banniere-sceptre-orbe-quels-sont-les-symboles-qui-accompagneront-le-cercueil-d-elizabeth-ii_AV-202209140049.html"
"False","True","Longue attente, pas de photos: l'exposition de la dépouille d'Elizabeth II très encadrée","https://www.bfmtv.com/people/tetes-couronnees/longue-attente-pas-de-photos-l-exposition-de-la-depouille-d-elizabeth-ii-tres-encadree_AD-202209120390.html"
"False","True","Chefs d'Etat, têtes couronnées... qui est invité aux funérailles de la reine?","https://www.bfmtv.com/people/tetes-couronnees/chefs-d-etat-tetes-couronnees-qui-est-invite-aux-funerailles-de-la-reine_AN-202209140218.html"
"False","True","Mort d'Elizabeth II: pourquoi le cercueil de la reine est-il doublé de plomb?","https://www.bfmtv.com/people/tetes-couronnees/mort-d-elizabeth-ii-pourquoi-le-cercueil-de-la-reine-est-il-double-de-plomb_AD-202209120451.html"
"False","True","La hausse des frais bancaires plafonnée à 2% en 2023, annonce Bruno Le Maire","https://www.bfmtv.com/economie/la-hausse-des-frais-bancaires-plafonnee-a-2-en-2023-annonce-bruno-le-maire_AD-202209130381.html"
"False","True","Luc Rémont va être nommé à la tête d’EDF","https://www.bfmtv.com/economie/luc-remont-va-etre-nomme-a-la-tete-d-edf_AN-202209090450.html"
"False","True","Etats-Unis: fort ralentissement des créations d'emplois en août","https://www.bfmtv.com/economie/emploi/etats-unis-fort-ralentissement-des-creations-d-emplois-en-aout_AD-202209020431.html"
"False","True","L'inflation ralentit au mois d'août, à 5,8% sur un an","https://www.bfmtv.com/economie/economie-social/france/france-l-inflation-ralentit-au-mois-d-aout-a-5-8-sur-un-an_AD-202208310177.html"
"False","True","Inflation: pour Borne, ""les entreprises qui font des super profits doivent rendre du pouvoir d'achat aux Français""","https://www.bfmtv.com/economie/entreprises/inflation-borne-affirme-que-les-entreprises-qui-font-des-super-profits-doivent-rendre-du-pouvoir-d-achat-aux-francais_AD-202208270293.html"
"False","True","OM-Francfort: le résumé vidéo de la défaite de Marseille, déjà mal embarqué dans le groupe D","https://rmcsport.bfmtv.com/football/ligue-des-champions/om-francfort-le-resume-video-de-la-defaite-de-marseille-deja-mal-embarque-dans-le-groupe-d_AV-202209130715.html"
"False","True","Ligue des champions: le Bayern plus fort que le Barça, l'OM et l’Atlético battus, le missile de Kudus... Les moments forts de la soirée en vidéo","https://rmcsport.bfmtv.com/football/ligue-des-champions/ligue-des-champions-le-bayern-plus-fort-que-le-barca-l-om-et-l-atletico-battus-le-missile-de-kudu-les-moments-forts-de-la-soiree-en-video_AV-202209130723.html"
"False","True","Ligue des champions: la banderole offensive des supporters du Bayern après le décès d'Elizabeth II et les reports","https://rmcsport.bfmtv.com/football/ligue-des-champions/ligue-des-champions-la-banderole-offensive-des-supporters-du-bayern-apres-le-deces-d-elizabeth-ii-et-les-reports_AV-202209130739.html"
"False","True","Procès Mendy: une des huit accusations de viol abandonnée contre le footballeur","https://rmcsport.bfmtv.com/football/proces-mendy-une-des-huit-accusations-de-viol-abandonnee-contre-le-footballeur_AV-202209130531.html"
"False","True","Coupe du monde 2022: un premier média français annonce un boycott de la compétition","https://rmcsport.bfmtv.com/football/coupe-du-monde/coupe-du-monde-2022-un-premier-media-francais-annonce-un-boycott-de-la-competition_AD-202209130597.html"
"False","True","Ligne rouge - William et Harry, les frères ennemis","https://www.bfmtv.com/people/tetes-couronnees/ligne-rouge-william-et-harry-les-freres-ennemis_GN-202208290703.html"
"False","True","Carte. Incendies en Gironde : que représentent les 20.600 hectares déjà brûlés ?","https://www.bfmtv.com/meteo/canicule/carte-que-representent-les-15-200-hectares-brules-en-gironde-par-rapport-aux-grandes-villes-francaises_AN-202207180497.html"
"False","True","Avant/Après. Incendies en Gironde : l'étendue des dégâts vue par satellite","https://www.bfmtv.com/environnement/climat/avant-apres-incendies-en-gironde-l-etendue-des-degats-vue-par-satellite_GN-202207190372.html"
"False","True","Le Tour de France, une bonne affaire pour les villes-étapes","https://www.bfmtv.com/economie/entreprises/culture-loisirs/le-tour-de-france-une-bonne-affaire-pour-les-villes-etapes_GN-202207050023.html"
"False","True","""J'ai pleuré tous les soirs pendants un an"" : fausses couches, vraies souffrances","https://www.bfmtv.com/societe/j-ai-pleure-tous-les-soirs-pendant-un-an-fausse-couche-vraies-souffrances_AN-202206230011.html"
"False","True","Lascaux, Chauvet, Cosquer...Le nouvel eldorado touristique des grottes préhistoriques","https://www.bfmtv.com/economie/lascaux-chauvet-cosquer-le-nouvel-eldorado-touristique-des-grottes-prehistoriques_GN-202206040051.html"
"False","True","Funérailles d'Elizabeth: pourquoi Harry et Andrew ne seront pas en uniforme militaire","https://www.bfmtv.com/people/tetes-couronnees/funerailles-d-elizabeth-pourquoi-harry-et-andrew-ne-seront-pas-en-uniforme-militaire_AN-202209140241.html"
"False","True","Chefs d'Etat, têtes couronnées... qui est invité aux funérailles de la reine?","https://www.bfmtv.com/people/tetes-couronnees/chefs-d-etat-tetes-couronnees-qui-est-invite-aux-funerailles-de-la-reine_AN-202209140218.html"
"False","True","Une étudiante française reçoit une lettre de la reine Elizabeth le lendemain de sa mort","https://www.bfmtv.com/people/tetes-couronnees/une-etudiante-francaise-recoit-une-lettre-de-la-reine-elizabeth-le-lendemain-de-sa-mort_AN-202209140204.html"
"False","True","Les princes William et Harry marcheront ce soir ensemble derrière le cercueil d'Elizabeth II","https://www.bfmtv.com/people/tetes-couronnees/les-princes-william-et-harry-marcheront-ce-soir-ensemble-derriere-le-cercueil-d-elizabeth-ii_AN-202209140189.html"
"False","True","Mort d'Elizabeth II: Charles III va licencier des dizaines de personnes","https://www.bfmtv.com/people/tetes-couronnees/mort-d-elizabeth-ii-a-peine-roi-charles-iii-va-licencier-des-dizaines-de-personnes_AV-202209140178.html"
"False","True","Sofatec : créativité et proximité au service des couvertures de piscines","https://www.bfmtv.com/pratique/entreprises-d-avenir/sofatec-creativite-et-proximite-au-service-des-couvertures-de-piscines_AB-202209120014.html"
"False","True","TEMPORIS ROUEN : Travail temporaire et bien davantage !","https://www.bfmtv.com/economie/entreprises/temporis-rouen-travail-temporaire-et-bien-davantage_AB-202209120010.html"
"False","True","Infraneo : Ingénierie des sols et des structures","https://www.bfmtv.com/economie/entreprises/infraneo-ingenierie-des-sols-et-des-structures_AO-202209120013.html"
"False","True","Black Friday 2020 : tout ce qu’il faut savoir","https://www.bfmtv.com/pratique/tech/black-friday-2020-tout-ce-qu-il-faut-savoir_AN-202009230270.html"
