"premium","picture","title","url"
"True","True","Live Article se déroulant en direct Angleterre-France en direct : les Three Lions égalisent sur un pénalty d’Harry Kane","https://www.lemonde.fr/coupe-du-monde-2022/live/2022/12/10/france-angleterre-en-direct-pas-de-surprise-dans-le-onze-de-didier-deschamps-suivez-le-quart-de-finale-de-la-coupe-du-monde-2022_6153865_6101826.html"
"True","False","Coupe du monde 2022 : face à la France, l’Angleterre ne fait pas la fière","https://www.lemonde.fr/football/article/2022/12/10/coupe-du-monde-2022-face-a-la-france-l-angleterre-ne-fait-pas-la-fiere_6153837_1616938.html"
"True","False","La Coupe du monde vue par deux femmes de la haute société qatarie : « C’est comme dans une fête »","https://www.lemonde.fr/football/article/2022/12/10/la-coupe-du-monde-vue-par-deux-femmes-de-la-haute-societe-qatarie-c-est-comme-dans-une-fete_6153863_1616938.html"
"False","False","Angleterre-France : les choses sérieuses commencent pour les Bleus","https://www.lemonde.fr/coupe-du-monde-2022/article/2022/12/10/angleterre-france-les-choses-serieuses-commencent-pour-les-bleus_6153853_6101826.html"
"False","True","Marine Tondelier élue secrétaire nationale d’Europe-Ecologie-Les Verts","https://www.lemonde.fr/politique/article/2022/12/10/eelv-en-congres-pour-elire-marine-tondelier-a-sa-tete_6153788_823448.html"
"True","True","Après la fin de « Barkhane », les « paras » du 8ᵉ RPIMa changent progressivement de guerre","https://www.lemonde.fr/international/article/2022/12/10/apres-la-fin-de-barkhane-les-paras-du-8-rpima-changent-progressivement-de-guerre_6153869_3210.html"
"True","True","Qualification historique du Maroc pour les demi-finales de la Coupe du monde","https://www.lemonde.fr/football/live/2022/12/10/maroc-portugal-en-direct-suivez-le-match-des-quarts-de-finale-de-la-coupe-du-monde-2022_6153839_1616938.html"
"True","True","L’anonymat sur les réseaux sociaux est-il un facteur de liberté ? La psychanalyste Claude Halmos répond","https://www.lemonde.fr/m-perso/article/2022/12/10/l-anonymat-sur-les-reseaux-sociaux-est-il-un-facteur-de-liberte-la-psychanalyste-claude-halmos-repond_6153783_4497916.html"
"True","True","Discours de la Prix Nobel de la paix : « La guerre en Ukraine n’est pas une guerre entre deux Etats, mais entre deux systèmes : l’autoritarisme et la démocratie »","https://www.lemonde.fr/international/article/2022/12/10/discours-du-prix-nobel-de-la-paix-la-guerre-en-ukraine-n-est-pas-une-guerre-entre-deux-etats-mais-entre-deux-systemes-l-autoritarisme-et-la-democratie_6153845_3210.html"
"True","True","Edouard Philippe et ses soutiens regardent le congrès LR avec distance","https://www.lemonde.fr/politique/article/2022/12/10/edouard-philippe-et-ses-soutiens-regardent-le-congres-lr-avec-distance_6153866_823448.html"
"False","True","La FIFA ouvre des procédures disciplinaires contre les Pays-Bas et l’Argentine après leur match tendu au Qatar","https://www.lemonde.fr/football/article/2022/12/10/le-match-pays-bas-argentine-marque-par-de-vives-tensions-la-fifa-ouvre-des-procedures-disciplinaires_6153857_1616938.html"
"False","True","Coupe du monde au Qatar : « Clairement, il n’y a pas d’effet boycott »","https://www.lemonde.fr/sport/article/2022/12/10/coupe-du-monde-2022-au-qatar-clairement-il-n-y-a-pas-d-effet-boycott_6153856_3242.html"
"True","True","Thomas Ngijol : « J’ai fait pleurer ma fille à cause d’une quiche lorraine »","https://www.lemonde.fr/m-perso/article/2022/12/10/thomas-ngijol-j-ai-fait-pleurer-ma-fille-a-cause-d-une-quiche-lorraine_6153870_4497916.html"
"True","True","Thomas Piketty : « L’Europe doit être au service du mieux-disant social »","https://www.lemonde.fr/idees/article/2022/12/10/thomas-piketty-l-europe-doit-etre-au-service-du-mieux-disant-social_6153786_3232.html"
"False","False","Le tableau de bord du réseau électrique en France en temps réel","https://www.lemonde.fr/les-decodeurs/article/2022/10/26/consommation-production-signal-ecowatt-le-tableau-de-bord-du-reseau-electrique-francais-en-temps-reel_6147324_4355770.html"
"True","False","« On dit que l’amour dure trois ans : en entreprise, c’est le temps qu’il faut désormais pour faire le tour d’un poste »","https://www.lemonde.fr/campus/article/2022/12/10/on-dit-que-l-amour-dure-trois-ans-en-entreprise-c-est-le-temps-qu-il-faut-desormais-pour-faire-le-tour-d-un-poste_6153796_4401467.html"
"True","False","Studios de tournage : mobilisation et foisonnement de projets pour rattraper le retard français","https://www.lemonde.fr/economie/article/2022/12/10/studios-de-tournage-mobilisation-et-foisonnement-de-projets-pour-rattraper-le-retard-francais_6153858_3234.html"
"True","False","Jean-Marie Tarascon, pionnier des batteries au lithium : « Chez Bell, on m’avait dit « fais ce que tu veux, mais be number one »","https://www.lemonde.fr/sciences/article/2022/12/10/jean-marie-tarascon-un-chimiste-accelerateur-d-energie_6153861_1650684.html"
"False","False","Un marché de Noël de luxe tout près des Champs-Elysées","https://www.lemonde.fr/m-styles/article/2022/12/10/un-marche-de-noel-de-luxe-tout-pres-des-champs-elysees_6153864_4497319.html"
"False","False","L’Italie accueille trois navires de secours aux migrants, mais nie toute « volte-face »","https://www.lemonde.fr/international/article/2022/12/10/l-italie-accueille-trois-navires-de-secours-aux-migrants-mais-nie-toute-volte-face_6153848_3210.html"
"True","False","Au Lido 2 Paris, un « Cabaret » intense et grave","https://www.lemonde.fr/culture/article/2022/12/10/au-lido-2-paris-un-cabaret-intense-et-grave_6153855_3246.html"
"True","False","A LFI, une assemblée représentative qui sème la colère au sein du mouvement","https://www.lemonde.fr/politique/article/2022/12/09/a-lfi-une-assemblee-representative-qui-seme-la-colere-au-sien-du-parti_6153732_823448.html"
"True","True","Le Parlement européen secoué par une enquête pour corruption au profit présumé du Qatar","https://www.lemonde.fr/international/article/2022/12/10/le-parlement-europeen-secoue-par-une-enquete-pour-corruption-au-profit-du-qatar_6153776_3210.html"
"True","True","Les deux sarcophages de Notre-Dame livrent une partie de leurs secrets","https://www.lemonde.fr/sciences/article/2022/12/10/les-deux-sarcophages-de-notre-dame-livrent-une-partie-de-leurs-secrets_6153766_1650684.html"
"True","True","Où partir en voyage en 2023 ? Le palmarès des 20 destinations du « Monde »","https://www.lemonde.fr/m-styles/visuel/2022/12/09/ou-partir-en-voyage-en-2023-le-palmares-des-20-destinations-du-monde_6153709_4497319.html"
"False","False","En Chine, la victoire du pragmatisme, et des citoyens","https://www.lemonde.fr/idees/article/2022/12/10/en-chine-la-victoire-du-pragmatisme-et-des-citoyens_6153817_3232.html"
"True","False","Vaincus d’hier, victimes d’aujourd’hui : la justice au temps de la réparation","https://www.lemonde.fr/idees/article/2022/12/09/vaincus-d-hier-victimes-d-aujourd-hui-la-justice-au-temps-de-la-reparation_6153610_3232.html"
"False","False","Annie Ernaux : « J’écrirai pour venger ma race », le discours de la Prix Nobel de littérature","https://www.lemonde.fr/idees/article/2022/12/07/annie-ernaux-j-ecrirai-pour-venger-ma-race-le-discours-de-la-prix-nobel-de-litterature_6153401_3232.html"
