"premium","picture","title","url"
"False","True","""Elle avait un peu perdu la boule"": un compagnon de la suspecte du meurtre de Lola décrit une jeune femme perturbée","https://www.bfmtv.com/police-justice/meurtre-de-lola-un-ancien-petit-ami-de-la-suspecte-decrit-une-jeune-femme-perturbee-recemment_AV-202210180794.html"
"False","True","Meurtre de Lola: ce que l'on sait des conditions de détention de la suspecte","https://www.bfmtv.com/police-justice/meurtre-de-lola-ce-que-l-on-sait-des-conditions-de-detention-de-la-suspecte_AN-202210190204.html"
"False","True","Meurtre de Lola: comment s'ordonne et s'applique une obligation de quitter le territoire français?","https://www.bfmtv.com/police-justice/meurtre-de-lola-comment-s-ordonne-et-s-applique-une-obligation-de-quitter-le-territoire-francais_AV-202210190152.html"
"False","True","L'extrême droite se saisit du meurtre de Lola, Darmanin dénonce l'""indécence"" de la récupération politique","https://www.bfmtv.com/politique/l-extreme-droite-se-saisit-du-meurtre-de-lola-darmanin-denonce-l-indecence-de-la-recuperation-politique_AN-202210180348.html"
"False","False","Interpellée par Marine Le Pen sur la mort de Lola, Elisabeth Borne l'appelle à ""un peu de…","https://www.bfmtv.com/politique/parlement/interpellee-par-marine-le-pen-sur-la-mort-de-lola-elisabeth-borne-l-appelle-a-un-peu-de-decence_AP-202210180509.html"
"False","True","EN DIRECT - Guerre en Ukraine: début des évacuations de civils à Kherson, par Moscou","https://www.bfmtv.com/international/asie/russie/en-direct-guerre-en-ukraine-kiev-contre-attaque-moscou-evacue-les-civils-de-kherson_LN-202210190212.html"
"False","True","Ukraine: pour Zelensky, les drones iraniens utilisés par Moscou sont un symbole de sa ""faillite militaire""","https://www.bfmtv.com/international/ukraine-pour-zelensky-les-drones-iraniens-utilises-par-moscou-sont-un-symbole-de-sa-faillite-militaire_AD-202210180800.html"
"False","True","Budget 2023: le gouvernement va utiliser le 49.3 ce mercredi","https://www.bfmtv.com/politique/budget-2023-le-gouvernement-va-utiliser-le-49-3-ce-mercredi_AV-202210190120.html"
"False","True","EN DIRECT - À quelques heures du 49.3 pour le budget 2023, Mathilde Panot dénonce la ""brutalisation des débats""","https://www.bfmtv.com/politique/en-direct-budget-2023-jour-de-49-3-ce-mercredi-a-l-assemblee_LN-202210190129.html"
"False","True","Jean Castex est pressenti pour prendre la tête de la RATP","https://www.bfmtv.com/economie/entreprises/transports/jean-castex-va-etre-nomme-a-la-tete-de-la-ratp_AN-202210190038.html"
"False","True","Menaces, tentative d'enlèvement... Plusieurs femmes accusent un même chauffeur Uber et Heetch","https://www.bfmtv.com/police-justice/menaces-tentative-d-enlevement-plusieurs-femmes-accusent-un-meme-chauffeur-uber-et-heetch_AN-202210190025.html"
"False","True","""Elle a sauté de la voiture en marche"": elle raconte la tentative d'enlèvement de sa proche par un VTC","https://www.bfmtv.com/police-justice/elle-a-saute-de-la-voiture-en-marche-elle-raconte-la-tentative-d-enlevement-de-sa-proche-par-un-vtc_AV-202210190245.html"
"False","True","Des réquisitions supplémentaires pourraient avoir lieu si les blocages ne sont pas levés. Aurore Bergé","https://www.bfmtv.com/politique/carburants-berge-previent-que-d-autres-requisitions-pourraient-avoir-lieu-si-les-blocages-ne-sont-pas-leves_AN-202210140253.html"
"False","True","Chaleur automnale: des records de températures battus cette semaine","https://www.bfmtv.com/meteo/chaleur-automnale-des-records-de-temperatures-battus-cette-semaine_AN-202210190266.html"
"False","True","Levothyrox: le laboratoire Merck annonce sa mise en examen pour ""tromperie aggravée""","https://www.bfmtv.com/economie/levothyrox-le-laboratoire-merck-annonce-sa-mise-en-examen-pour-tromperie-aggravee_AD-202210190139.html"
"False","True","Taxé de ""pédophilie"", Bolsonaro s'excuse après des propos sur de jeunes Vénézueliennes","https://www.bfmtv.com/international/amerique-latine/bresil/taxe-de-pedophilie-bolsonaro-s-excuse-apres-des-propos-sur-de-jeunes-venezueliennes_AD-202210190283.html"
"False","True","Pourquoi Liz Truss pourrait être la Première ministre la plus éphémère de l'histoire","https://www.bfmtv.com/international/royaume-uni-pourquoi-liz-truss-pourrait-etre-la-premiere-ministre-la-plus-ephemere-de-l-histoire_AN-202210180696.html"
"False","True","La radio britannique prépare des messages à diffuser en cas de black-out généralisé","https://www.bfmtv.com/international/europe/angleterre/la-radio-britannique-prepare-des-messages-a-diffuser-en-cas-de-black-out-generalise_AN-202210180783.html"
"False","True","Netflix compte mettre fin au partage de compte début 2023","https://www.bfmtv.com/tech/actualites/streaming/netflix-compte-mettre-fin-au-partage-de-compte-debut-2023_AV-202210190280.html"
"False","True","Un travailleur français sur deux dit souffrir du bruit sur son lieu de travail","https://www.bfmtv.com/sante/bien-etre-au-travail/un-travailleur-francais-sur-deux-dit-souffrir-du-bruit-sur-son-lieu-de-travail_AN-202210190232.html"
"False","True","Réchauffement climatique: une étude prévoit une hausse de 3,8°C en France d'ici 2100","https://www.bfmtv.com/environnement/rechauffement-climatique-une-etude-prevoit-une-hausse-de-3-8deg-c-en-france-d-ici-2100_AN-202210180536.html"
"False","True","Voisins, amis, camarades de classe... Quelle prise en charge psychologique pour les…","https://www.bfmtv.com/societe/voisins-amis-camarades-de-classe-quelle-prise-en-charge-psychologique-pour-les-enfants-qui-connaissaient-lola_AN-202210180360.html"
"False","True","Grippe: ce qu'il faut savoir sur la campagne de vaccination qui débute ce mardi","https://www.bfmtv.com/sante/grippe-ce-qu-il-faut-savoir-sur-la-campagne-de-vaccination-qui-debute-ce-mardi_AV-202210180226.html"
"False","True","Météo: comment expliquer le retour de la chaleur en plein mois d'octobre?","https://www.bfmtv.com/meteo/meteo-comment-expliquer-le-retour-de-la-chaleur-en-plein-mois-d-octobre_AN-202210170745.html"
"False","True","Comment l'ARN messager pourrait aider à soigner le cancer","https://www.bfmtv.com/sante/comment-l-arn-messager-pourrait-aider-a-soigner-le-cancer_AV-202210180383.html"
"False","True","""Gênance"", ""wokisme"", ""chiller"": les nouveaux mots du Petit Robert","https://www.bfmtv.com/societe/genance-nft-wokisme-chiller-les-nouveaux-mots-du-petit-robert_AV-202210170256.html"
"False","True","Autorité des marchés financiers: la nomination de Marie-Anne Barbat-Layani validée par le Parlement","https://www.bfmtv.com/economie/entreprises/assurance-banque/autorite-des-marches-financiers-la-nomination-de-marie-anne-barbat-layani-validee-par-le-parlement_AD-202210190285.html"
"False","True","Salaire du PDG de Totalenergies: Laurent Berger qualifie d'""hors-sol"" la déclaration de Patrick Pouyanné","https://www.bfmtv.com/economie/economie-social/france/salaire-du-pdg-de-totalenergies-laurent-berger-qualifie-d-hors-sol-la-declaration-de-patrick-pouyanne_AD-202210190271.html"
"False","True","Carburant: le dépôt TotalEnergies de Feyzin de nouveau réquisitionné ce mercredi","https://www.bfmtv.com/lyon/carburant-le-depot-total-energies-de-feyzin-de-nouveau-requisitionne-ce-mercredi_AN-202210190041.html"
"False","True","Un travailleur français sur deux dit souffrir du bruit sur son lieu de travail","https://www.bfmtv.com/sante/bien-etre-au-travail/un-travailleur-francais-sur-deux-dit-souffrir-du-bruit-sur-son-lieu-de-travail_AN-202210190232.html"
"False","True","Agnès Pannier-Runacher précise que ""22,8% des stations"" manquent d'au moins un carburant","https://www.bfmtv.com/economie/economie-social/france/agnes-pannier-runacher-precise-que-22-8-des-stations-manquent-d-au-moins-un-carburant_AN-202210190227.html"
"False","True","Ballon d'or: ""Il joue différemment, il est intelligent"", Michel Platini salue son héritier Karim Benzema","https://rmcsport.bfmtv.com/football/ballon-d-or-il-joue-differemment-il-est-intelligent-michel-platini-salue-son-heritier-karim-benzema_AV-202210180673.html"
"False","True","Juventus: les premières images du retour de Paul Pogba à l'entraînement, à un mois du Mondial","https://rmcsport.bfmtv.com/football/equipe-de-france/juventus-les-premieres-images-du-retour-de-paul-pogba-a-l-entrainement-a-un-mois-du-mondial_AP-202210180676.html"
"False","True","Equipe de France: c'est officiel, Kanté ne disputera pas la Coupe du monde et ne rejouera pas en 2022","https://rmcsport.bfmtv.com/football/equipe-de-france/equipe-de-france-c-est-officiel-kante-ne-disputera-pas-la-coupe-du-monde-et-ne-rejouera-pas-en-2022_AV-202210180741.html"
"False","True","""Ballon d'or du peuple"", Benzema explique son discours","https://rmcsport.bfmtv.com/football/ballon-d-or-du-peuple-benzema-explique-son-discours_AV-202210180224.html"
"False","True","Meurtre de Lola: la Fédération de gymnastique ""sous le choc"" après le décès de la championne de France d’Aérobic","https://rmcsport.bfmtv.com/societe/meurtre-de-lola-la-federation-de-gymnastique-sous-le-choc-apres-le-deces-de-la-championne-de-france-d-aerobic_AV-202210180441.html"
"False","True","Ligne rouge - William et Harry, les frères ennemis","https://www.bfmtv.com/people/tetes-couronnees/ligne-rouge-william-et-harry-les-freres-ennemis_GN-202208290703.html"
"False","True","Carte. Incendies en Gironde : que représentent les 20.600 hectares déjà brûlés ?","https://www.bfmtv.com/meteo/canicule/carte-que-representent-les-15-200-hectares-brules-en-gironde-par-rapport-aux-grandes-villes-francaises_AN-202207180497.html"
"False","True","Avant/Après. Incendies en Gironde : l'étendue des dégâts vue par satellite","https://www.bfmtv.com/environnement/climat/avant-apres-incendies-en-gironde-l-etendue-des-degats-vue-par-satellite_GN-202207190372.html"
"False","True","Le Tour de France, une bonne affaire pour les villes-étapes","https://www.bfmtv.com/economie/entreprises/culture-loisirs/le-tour-de-france-une-bonne-affaire-pour-les-villes-etapes_GN-202207050023.html"
"False","True","""J'ai pleuré tous les soirs pendants un an"" : fausses couches, vraies souffrances","https://www.bfmtv.com/societe/j-ai-pleure-tous-les-soirs-pendant-un-an-fausse-couche-vraies-souffrances_AN-202206230011.html"
"False","True","Lascaux, Chauvet, Cosquer...Le nouvel eldorado touristique des grottes préhistoriques","https://www.bfmtv.com/economie/lascaux-chauvet-cosquer-le-nouvel-eldorado-touristique-des-grottes-prehistoriques_GN-202206040051.html"
"False","True","""The Crown"": les acteurs et le créateur à la rescousse de la saison 5, accusée d'""exploiter"" la famille royale","https://www.bfmtv.com/people/series/the-crown-les-acteurs-et-le-createur-a-la-rescousse-de-la-saison-5-accusee-d-exploiter-la-famille-royale_AN-202210190286.html"
"False","True","Mylène Farmer: le titre, la pochette et la date de sortie de son nouvel album dévoilés","https://www.bfmtv.com/people/musique/mylene-farmer-le-titre-la-pochette-et-la-date-de-sortie-de-son-nouvel-album-devoiles_AN-202210190269.html"
"False","True","""Je signe ce que mon père me dit de signer"": au tribunal de Barcelone, Neymar nie toute corruption","https://www.bfmtv.com/people/je-signe-ce-que-mon-pere-me-dit-de-signer-au-tribunal-de-barcelone-neymar-nie-toute-corruption_VN-202210190262.html"
"False","True","""Novembre"", ""Simone"" : le succès en salle - 19/10","https://www.bfmtv.com/replay-emissions/culture-et-vous/novembre-simone-le-succes-en-salle-19-10_VN-202210190191.html"
"False","True","Le cinéma français reprend des couleurs avec les succès en salle des films ""Novembre"" et ""Simone""","https://www.bfmtv.com/culture/le-cinema-francais-reprend-des-couleurs-avec-les-succes-en-salle-des-films-novembre-et-simone_VN-202210190163.html"
"False","True","Aixplore immobilier : foncièrement proche de ses clients","https://www.bfmtv.com/pratique/entreprises-d-avenir/aixplore-immobilier-foncierement-proche-de-ses-clients_AB-202210190011.html"
"False","True","Dynveo, producteur écoresponsable de nutraceutique de pointe","https://www.bfmtv.com/economie/entreprises/dynveo-producteur-ecoresponsable-de-nutraceutique-de-pointe_AO-202210190018.html"
"False","True","Hans coffrage - Le bois au service du béton","https://www.bfmtv.com/economie/entreprises/hans-coffrage-le-bois-au-service-du-beton_AO-202209190001.html"
