"premium","picture","title","url"
"False","True","Grève des contrôleurs aériens: journée noire vendredi avec un millier de vols annulés en France","https://www.bfmtv.com/economie/entreprises/transports/greve-des-controleurs-aeriens-journee-noire-vendredi-avec-pres-d-un-millier-de-vols-annules-en-france_AD-202209150476.html"
"False","True","La reine Elizabeth II sera inhumée lundi à 20h30","https://www.bfmtv.com/people/tetes-couronnees/la-reine-elizabeth-ii-sera-inhumee-lundi-a-20h30_AD-202209150418.html"
"False","True","Charles III se recueillera vendredi soir devant le cercueil d'Elizabeth II avec ses frères et sœur","https://www.bfmtv.com/people/tetes-couronnees/charles-iii-se-recueillera-vendredi-soir-devant-le-cercueil-d-elizabeth-ii-avec-ses-freres-et-soeur_AD-202209150423.html"
"False","True","Tennis: Roger Federer annonce mettre un terme à sa carrière","https://rmcsport.bfmtv.com/tennis/tennis-roger-federer-annonce-mettre-un-terme-a-sa-carriere_AV-202209150477.html"
"False","True","""Des images apocalyptiques"": la cour d'assises a visionné les images de l'attentat de Nice","https://www.bfmtv.com/police-justice/terrorisme/des-images-apocalyptiques-la-cour-d-assises-a-visionne-les-images-de-l-attentat-de-nice_AN-202209150490.html"
"False","True","Macron sur la réforme des retraites: ""Est-ce qu'on saura mieux faire dans quelques mois? La réponse est non""","https://www.bfmtv.com/politique/macron-sur-la-reforme-des-retraites-est-ce-qu-on-saura-mieux-faire-dans-quelques-mois-la-reponse-est-non_AN-202209150447.html"
"False","True","Équipe de France: la mise au point de Deschamps sur le dossier Pogba","https://rmcsport.bfmtv.com/football/equipe-de-france/equipe-de-france-la-mise-au-point-de-deschamps-sur-le-dossier-pogba_AV-202209150459.html"
"False","True","Équipe de France: Kolo Muani, Giroud, pas de Benzema... La dernière liste des Bleus avant celle du Mondial","https://rmcsport.bfmtv.com/football/equipe-de-france/equipe-de-france-kolo-muani-giroud-pas-de-benzema-la-derniere-liste-des-bleus-avant-celle-du-mondial_AN-202209150417.html"
"False","True","Fillette oubliée dans un car scolaire: quelles obligations pour les chauffeurs et accompagnateurs?","https://www.bfmtv.com/societe/fillette-oubliee-dans-un-car-scolaire-quelles-obligations-pour-les-chauffeurs-et-accompagnateurs_AN-202209150411.html"
"False","True","Cette alternative au Dyson est excellente, moins chère et profite d’une double offre !","https://www.bfmtv.com/tech/bons-plans/cette-alternative-au-dyson-est-excellente-moins-chere-et-profite-d-une-double-offre_AB-202209100018.html"
"False","True","Affaire Omar Raddad: audience décisive pour obtenir un procès en révision","https://www.bfmtv.com/police-justice/affaire-omar-raddad-audience-decisive-pour-obtenir-un-proces-en-revision_AV-202209150500.html"
"False","True","""La valeur travail, c'est quand même une valeur de droite"". Sandrine Rousseau répond à Fabien Roussel et défend ""le droit à la paresse""","https://www.bfmtv.com/politique/la-valeur-travail-c-est-quand-meme-une-valeur-de-droite-rousseau-defend-le-droit-a-la-paresse_AN-202209150278.html"
"False","True","Risques de coupure: voici le pire scénario envisagé par RTE pour cet hiver en France","https://www.bfmtv.com/economie/entreprises/energie/risques-de-coupure-voici-le-pire-scenario-envisage-par-rte-pour-cet-hiver-en-france_AV-202209150215.html"
"False","True","""Chaque geste compte"": face à la crise énergétique, Élisabeth Borne s'inspire de la com…","https://www.bfmtv.com/politique/chaque-geste-compte-face-a-la-crise-energetique-elisabeth-borne-s-inspire-de-la-com-de-crise-covid-19_AN-202209150347.html"
"False","True","Pour qui, combien, comment? Tout ce qu'il faut savoir sur la prime exceptionnelle de…","https://www.bfmtv.com/economie/consommation/pour-qui-combien-comment-tout-ce-qu-il-faut-savoir-sur-la-prime-exceptionnelle-de-rentree-versee-a-partir-de-ce-jeudi_AV-202209150049.html"
"False","True","Pourquoi vos impôts vont baisser même si vos revenus ont augmenté","https://www.bfmtv.com/economie/patrimoine/impots-fiscalite/pourquoi-vos-impots-vont-baisser-meme-si-vos-revenus-ont-augmente_AV-202209150025.html"
"False","True","Qu'est-ce que la dengue, cette maladie dont les cas autochtones se multiplient en France?","https://www.bfmtv.com/sante/qu-est-ce-que-la-dengue-cette-maladie-dont-les-cas-autochtones-se-multiplient-en-france_AN-202209150292.html"
"False","True","Incendie à Saumos en Gironde: la situation est ""désormais favorable""","https://www.bfmtv.com/societe/incendie-a-saumos-en-gironde-la-situation-est-desormais-favorable_AD-202209150465.html"
"False","True","Jusqu'à 15 centimètres de grêle à Gap: comment s'est formé ce violent orage","https://www.bfmtv.com/bfm-dici/jusqu-a-15-centimetres-de-grele-a-gap-comment-s-est-forme-ce-violent-orage_AN-202209150453.html"
"False","True","Instagram, TikTok: comment éviter les arnaques de certains influenceurs sur les réseaux…","https://www.bfmtv.com/tech/actualites/reseaux-sociaux/affaire-magali-berdah-comment-reperer-et-eviter-les-arnaques-sur-les-reseaux-sociaux_AV-202209150068.html"
"False","True","Elizabeth II: William et Harry ont défilé derrière le cercueil de la reine à Londres","https://www.bfmtv.com/people/tetes-couronnees/elizabeth-ii-charles-iii-william-et-harry-ont-defile-derriere-le-cercueil-de-la-reine-a-londres_AV-202209140484.html"
"False","True","Pourquoi Harry et Meghan ont pu se tenir la main lors des hommages funéraires à Elizabeth…","https://www.bfmtv.com/people/tetes-couronnees/pourquoi-harry-et-meghan-ont-pu-se-tenir-la-main-lors-des-hommages-funeraires-a-elizabeth-ii_AN-202209150131.html"
"False","True","Bannière, sceptre, orbe... Quels sont les symboles qui accompagnent le cercueil…","https://www.bfmtv.com/people/tetes-couronnees/banniere-sceptre-orbe-quels-sont-les-symboles-qui-accompagneront-le-cercueil-d-elizabeth-ii_AV-202209140049.html"
"False","True","Ni photos ni fleurs: ces règles très strictes pour le public autour du cercueil…","https://www.bfmtv.com/people/tetes-couronnees/longue-attente-pas-de-photos-l-exposition-de-la-depouille-d-elizabeth-ii-tres-encadree_AD-202209120390.html"
"False","True","Lacets repassés, petit-déjeuner millimétré: les exigences très strictes de Charles III","https://www.bfmtv.com/international/lacets-repasses-petit-dejeuner-millimetre-les-exigences-tres-strictes-de-charles-iii_AN-202209140431.html"
"False","True","L'inflation en août finalement un peu plus forte que prévu","https://www.bfmtv.com/economie/economie-social/france/l-inflation-en-aout-finalement-un-peu-plus-forte-que-prevue_AV-202209150180.html"
"False","True","La hausse des frais bancaires plafonnée à 2% en 2023, annonce Bruno Le Maire","https://www.bfmtv.com/economie/la-hausse-des-frais-bancaires-plafonnee-a-2-en-2023-annonce-bruno-le-maire_AD-202209130381.html"
"False","True","Luc Rémont va être nommé à la tête d’EDF","https://www.bfmtv.com/economie/luc-remont-va-etre-nomme-a-la-tete-d-edf_AN-202209090450.html"
"False","True","Etats-Unis: fort ralentissement des créations d'emplois en août","https://www.bfmtv.com/economie/emploi/etats-unis-fort-ralentissement-des-creations-d-emplois-en-aout_AD-202209020431.html"
"False","True","L'inflation ralentit au mois d'août, à 5,8% sur un an","https://www.bfmtv.com/economie/economie-social/france/france-l-inflation-ralentit-au-mois-d-aout-a-5-8-sur-un-an_AD-202208310177.html"
"False","True","Tennis: Roger Federer annonce mettre un terme à sa carrière","https://rmcsport.bfmtv.com/tennis/tennis-roger-federer-annonce-mettre-un-terme-a-sa-carriere_AV-202209150477.html"
"False","True","EN DIRECT - Federer annonce sa retraite: il disputera son dernier tournoi la semaine prochaine","https://rmcsport.bfmtv.com/tennis/en-direct-federer-annonce-sa-retraite-il-disputera-son-dernier-tournoi-la-semaine-prochaine_LN-202209150478.html"
"False","True","Scandale à la FFF: la Fédération porte plainte contre So Foot après l'enquête du magazine","https://rmcsport.bfmtv.com/football/equipe-de-france/scandale-a-la-fff-la-federation-porte-plainte-contre-so-foot-apres-l-enquete-du-magazine_AP-202209150486.html"
"False","True","Équipe de France: Kolo Muani, Giroud, pas de Benzema... La dernière liste des Bleus avant celle du Mondial","https://rmcsport.bfmtv.com/football/equipe-de-france/equipe-de-france-kolo-muani-giroud-pas-de-benzema-la-derniere-liste-des-bleus-avant-celle-du-mondial_AN-202209150417.html"
"False","True","Équipe de France: ""Le maraboutage? Ça ne me pose pas de problème"", assure Deschamps","https://rmcsport.bfmtv.com/football/equipe-de-france/equipe-de-france-le-maraboutage-ca-ne-me-pose-pas-de-probleme-assure-deschamps_AV-202209150472.html"
"False","True","Ligne rouge - William et Harry, les frères ennemis","https://www.bfmtv.com/people/tetes-couronnees/ligne-rouge-william-et-harry-les-freres-ennemis_GN-202208290703.html"
"False","True","Carte. Incendies en Gironde : que représentent les 20.600 hectares déjà brûlés ?","https://www.bfmtv.com/meteo/canicule/carte-que-representent-les-15-200-hectares-brules-en-gironde-par-rapport-aux-grandes-villes-francaises_AN-202207180497.html"
"False","True","Avant/Après. Incendies en Gironde : l'étendue des dégâts vue par satellite","https://www.bfmtv.com/environnement/climat/avant-apres-incendies-en-gironde-l-etendue-des-degats-vue-par-satellite_GN-202207190372.html"
"False","True","Le Tour de France, une bonne affaire pour les villes-étapes","https://www.bfmtv.com/economie/entreprises/culture-loisirs/le-tour-de-france-une-bonne-affaire-pour-les-villes-etapes_GN-202207050023.html"
"False","True","""J'ai pleuré tous les soirs pendants un an"" : fausses couches, vraies souffrances","https://www.bfmtv.com/societe/j-ai-pleure-tous-les-soirs-pendant-un-an-fausse-couche-vraies-souffrances_AN-202206230011.html"
"False","True","Lascaux, Chauvet, Cosquer...Le nouvel eldorado touristique des grottes préhistoriques","https://www.bfmtv.com/economie/lascaux-chauvet-cosquer-le-nouvel-eldorado-touristique-des-grottes-prehistoriques_GN-202206040051.html"
"False","True","Mort d'Elizabeth II: un acteur hongkongais s'excuse d'avoir fait l'éloge de la reine","https://www.bfmtv.com/people/tetes-couronnees/mort-d-elizabeth-ii-un-acteur-hongkongais-s-excuse-d-avoir-fait-l-eloge-de-la-reine_AD-202209150467.html"
"False","True","Au Pays de Galles, le nouveau titre du prince William ravive des rancoeurs historiques","https://www.bfmtv.com/people/tetes-couronnees/au-pays-de-galles-le-nouveau-titre-du-prince-william-ravive-des-rancoeurs-historiques_AD-202209150440.html"
"False","True","Charles III se recueillera vendredi soir devant le cercueil d'Elizabeth II avec ses frères et sœur","https://www.bfmtv.com/people/tetes-couronnees/charles-iii-se-recueillera-vendredi-soir-devant-le-cercueil-d-elizabeth-ii-avec-ses-freres-et-soeur_AD-202209150423.html"
"False","True","La reine Elizabeth II sera inhumée lundi à 20h30","https://www.bfmtv.com/people/tetes-couronnees/la-reine-elizabeth-ii-sera-inhumee-lundi-a-20h30_AD-202209150418.html"
"False","True","""The Serpent Queen"", ""L'Impératrice"": après ""The Crown"", la royauté au féminin déferle en séries","https://www.bfmtv.com/people/series/the-serpent-queen-the-empress-apres-the-crown-la-royaute-au-feminin-deferle-en-series_AD-202209150375.html"
"False","True","Sofatec : créativité et proximité au service des couvertures de piscines","https://www.bfmtv.com/pratique/entreprises-d-avenir/sofatec-creativite-et-proximite-au-service-des-couvertures-de-piscines_AB-202209120014.html"
"False","True","IGIENAIR : Expert du traitement de l’air","https://www.bfmtv.com/economie/entreprises/igienair-expert-du-traitement-de-l-air_AO-202209150002.html"
"False","True","Infraneo : Ingénierie des sols et des structures","https://www.bfmtv.com/economie/entreprises/infraneo-ingenierie-des-sols-et-des-structures_AO-202209120013.html"
"False","True","Black Friday 2020 : tout ce qu’il faut savoir","https://www.bfmtv.com/pratique/tech/black-friday-2020-tout-ce-qu-il-faut-savoir_AN-202009230270.html"
