"premium","picture","title","url"
"False","True","DIRECT. Prix du gaz et de l'électricité : ""Nous allons limiter les hausses à 15%"" début 2023, annonce Elisabeth Borne","https://mobile.francetvinfo.fr/economie/energie/direct-crise-de-l-energie-elisabeth-borne-doit-annoncer-des-mesures-de-protection-pour-les-francais_5360464.html"
"False","True","Guerre en Ukraine, crise de l'énergie, super-profits... Ce qu'il faut retenir du ""discours sur l'état de l'Union"" d'Ursula von der Leyen","https://mobile.francetvinfo.fr/monde/europe/union-europeenne/guerre-en-ukraine-crise-de-l-energie-super-profits-ce-qu-il-faut-retenir-du-discours-sur-l-etat-de-l-union-d-ursula-von-der-leyen_5360209.html"
"False","True","Crise de l'énergie : la remise en service de l'ensemble des réacteurs nucléaires français cet hiver est-elle un objectif réaliste ?","https://mobile.francetvinfo.fr/societe/nucleaire/vrai-ou-fake-crise-de-l-energie-la-remise-en-service-de-l-ensemble-des-reacteurs-nucleaires-francais-cet-hiver-est-elle-un-objectif-realiste_5349610.html"
"False","True","Prix de l'énergie : les factures de gaz et d'électricité vont augmenter d'au moins 10% en 2023 en France","https://mobile.francetvinfo.fr/economie/energie/prix-de-l-energie-les-factures-de-gaz-et-d-electricite-vont-augmenter-d-au-moins-10-en-2023-en-france_5360098.html"
"False","True","Bouclier tarifaire : Familles rurales demande l'""élargissement"" du dispositif ""à l'ensemble des énergies""","https://mobile.francetvinfo.fr/economie/inflation/bouclier-tarifaire-familles-rurales-demande-l-elargissement-du-dispositif-a-l-ensemble-des-energies_5360344.html"
"False","True","DIRECT. Funérailles d'Elizabeth II : le cercueil de la reine est arrivé à Westminster Hall","https://mobile.francetvinfo.fr/monde/royaume-uni/mort-delizabeth-ii/direct-funerailles-d-elizabeth-ii-les-britanniques-vont-pouvoir-saluer-le-cercueil-de-la-reine-a-londres_5360290.html"
"False","True","TEMOIGNAGES. ""Ce que vous voyez, c'est la mort en direct"" : le patron des cyberenquêteurs de l'attentat de Nice raconte la collecte des images","https://mobile.francetvinfo.fr/faits-divers/terrorisme/attaque-au-camion-a-nice/proces-de-l-attentat-de-nice-du-14-juillet-2016/temoignage-ce-que-vous-voyez-c-est-la-mort-en-direct-le-patron-des-cyberenqueteurs-de-l-attentat-de-nice-raconte-la-minutieuse-collecte-des-images_5347294.html"
"False","True","Editis suspend la parution d'un livre dans lequel Guillaume Meurice ironise sur Vincent Bolloré","https://mobile.francetvinfo.fr/culture/livres/editis-suspend-la-parution-d-un-livre-dans-lequel-guillaume-meurice-ironise-sur-vincent-bollore_5360482.html"
"False","True","Grève des contrôleurs : Air France annule la moitié de ses vols vendredi","https://mobile.francetvinfo.fr/economie/transports/greve-a-air-france/greve-des-controleurs-air-france-annule-55-de-ses-court-et-moyen-courriers-vendredi_5360248.html"
"False","True","A la Fashion Week de New York, un défilé patriotique de la créatrice Svitlana Bevza pour l'Ukraine","https://mobile.francetvinfo.fr/culture/mode/fashion-week/a-la-fashion-week-de-new-york-un-defile-patriotique-de-la-creatrice-svitlana-bevza-pour-l-ukraine_5360137.html"
"False","True","La justice européenne condamne la France à réexaminer les demandes de rapatriement des familles de jihadistes en Syrie ""dans les plus brefs délais""","https://mobile.francetvinfo.fr/france/jihadistes-francais/la-justice-europeenne-condamne-la-france-a-reexaminer-les-demandes-de-rapatriement-des-familles-de-jihadistes-en-syrie-dans-les-plus-brefs-delais_5360329.html"
"False","True","Incendie en Gironde : un bilan de 3 500 hectares brûlés après ""une nuit agitée""","https://mobile.francetvinfo.fr/france/nouvelle-aquitaine/gironde/incendie-en-gironde-un-bilan-de-3-500-hectares-brules-apres-une-nuit-agitee_5360065.html"
"False","True","Cinquantenaire de la mort de Picasso : 42 expositions programmées dans le monde","https://mobile.francetvinfo.fr/culture/arts-expos/peinture/42-expositions-programmees-dans-le-monde-pour-les-50-ans-de-la-mort-de-picasso_5356945.html"
"False","True","Eurobasket 2022 : pourquoi les Bleus doivent se méfier du piège italien en quart de finale","https://mobile.francetvinfo.fr/sports/basket/euro/eurobasket-2022-pourquoi-les-bleus-doivent-se-mefier-du-piege-italien-en-quart-de-finale_5357344.html"
"False","True","La BnF Richelieu rouvre ses portes au public après de longs travaux de rénovation","https://mobile.francetvinfo.fr/culture/patrimoine/la-bnf-richelieu-rouvre-ses-portes-au-public-apres-de-longs-travaux-de-renovation_5358874.html"
"False","True","REPORTAGE. Guerre en Ukraine : sur la route M14 pour Mykolaïv, des récits de frappes, de ruines, de tortures et d'enlèvements","https://mobile.francetvinfo.fr/monde/europe/manifestations-en-ukraine/reportage-guerre-en-ukraine-sur-la-route-m14-pour-mykolaiv-des-recits-de-frappes-de-ruines-de-tortures-et-d-enlevements_5360611.html"
"False","True","Alimentation : que valent les jambons industriels ""sans nitrite"" ?","https://mobile.francetvinfo.fr/sante/alimentation/alimentation-que-valent-les-jambons-industriels-sans-nitrite_5360719.html"
"False","True","Affaire Jubillar : le placement de Cédric Jubillar sous bracelet électronique soumis à une enquête de faisabilité","https://mobile.francetvinfo.fr/faits-divers/disparition-de-delphine-jubillar/affaire-jubillar-le-placement-de-cedric-jubillar-sous-bracelet-electronique-soumis-a-une-enquete-de-faisabilite_5360533.html"
"False","True","Crash de la Yemenia Airways : treize ans après, la compagnie aérienne condamnée à 225 000 euros d'amende par la justice française","https://mobile.francetvinfo.fr/monde/afrique/comores/crash-de-la-yemenia-airways-la-compagnie-condamnee-a-l-amende-maximale_5360587.html"
"False","True","VIDEO. ""Cash Investigation"" : le drame des familles expulsées à cause des fissures qui menacent leur maison","https://mobile.francetvinfo.fr/meteo/secheresse/video-cash-investigation-le-drame-des-familles-expulsees-a-cause-des-fissures-qui-menacent-leur-maison_5353054.html"
"False","True","L'Union européenne propose de bannir les produits issus du travail forcé","https://mobile.francetvinfo.fr/monde/europe/union-europeenne/l-union-europeenne-propose-de-bannir-les-produits-issus-du-travail-force_5360539.html"
"False","True","TRIBUNE. ""A l'heure où le climat s'emballe"", des journalistes lancent une charte pour un traitement médiatique ""à la hauteur de l'urgence écologique""","https://mobile.francetvinfo.fr/monde/environnement/crise-climatique/tribune-a-l-heure-ou-le-climat-s-emballe-des-journalistes-lancent-une-charte-pour-un-traitement-mediatique-a-la-hauteur-de-l-urgence-ecologique_5337202.html"
"False","True","""Citoyen d'honneur"" : l'image fidèle et touchante d'une société algérienne fracturée dans une comédie dramatique","https://mobile.francetvinfo.fr/culture/cinema/sorties-de-films/citoyen-d-honneur-l-image-fidele-et-touchante-d-une-societe-algerienne-fracturee-dans-une-comedie-dramatique_5360218.html"
"False","True","DIRECT. France-Allemagne : Benjamin Bonzi égalise à un set partout face à Jan-Lennard Struff... Suivez la rencontre de Coupe Davis","https://mobile.francetvinfo.fr/sports/tennis/coupe-davis/direct-france-allemagne-du-costaud-d-entree-pour-les-bleus-suivez-la-rencontre-de-coupe-davis_5356909.html"
"False","True","Guerre en Ukraine : on vous résume la semaine où Kiev a repris l'initiative militaire face aux troupes russes","https://mobile.francetvinfo.fr/monde/europe/manifestations-en-ukraine/guerre-en-ukraine-on-vous-resume-la-semaine-ou-kiev-a-repris-l-initiative-militaire-face-aux-troupes-russes_5356720.html"
"False","True","Législatives en Suède : comment l'extrême droite s'est rapprochée du pouvoir après une percée historique dans les urnes","https://mobile.francetvinfo.fr/monde/europe/legislatives-en-suede-comment-l-extreme-droite-s-est-rapprochee-du-pouvoir-apres-une-percee-historique-dans-les-urnes_5358697.html"
"False","True","Crise énergétique : face aux risques de coupure d'électricité, RTE appelle à la sobriété et à la mobilisation générale","https://mobile.francetvinfo.fr/economie/energie/crise-energetique-face-aux-risques-de-coupure-de-courant-rte-appelle-a-la-sobriete-et-a-la-mobilisation-generale_5360200.html"
"False","True","Funérailles d'Elizabeth II : le trafic aérien sera limité à Londres pour permettre le recueillement","https://mobile.francetvinfo.fr/monde/royaume-uni/mort-delizabeth-ii/funerailles-d-elizabeth-ii-le-trafic-aerien-sera-limite-a-londres-pour-permettre-le-recueillement_5360527.html"
"False","True","Chantage à la vidéo intime à Saint-Étienne : ""Les preuves de la réalité de la machination et du chantage sont accablantes"", selon l'avocat de Gilles Artigues","https://mobile.francetvinfo.fr/faits-divers/chantage-a-la-video-intime-a-saint-etienne-les-preuves-de-la-realite-de-la-machination-et-du-chantage-sont-accablantes-selon-l-avocat-de-gilles-artigues_5360074.html"
"False","True","Orages : six départements placés en vigilance orange","https://mobile.francetvinfo.fr/meteo/orages/orages-six-departements-de-la-basse-vallee-du-rhone-places-en-vigilance-orange-par-meteo-france_5358772.html"
"False","True","Variole du singe : le ministre de la Santé va saisir la HAS sur l'intérêt ou non de la deuxième dose de vaccin","https://mobile.francetvinfo.fr/sante/maladie/variole-du-singe/info-franceinfo-variole-du-singe-le-ministre-de-la-sante-va-saisir-la-has-sur-l-interet-ou-non-de-la-deuxieme-dose-de-vaccin_5360110.html"
"False","True","Avec ""Gastronogeek Anime"", Thibaud Villanova vous apprend à préparer les ramen de Naruto à la maison","https://mobile.francetvinfo.fr/culture/bd/mangas/video-avec-gastronogeek-anime-thibaud-villanova-vous-apprend-a-preparer-les-ramen-de-naruto-a-la-maison_5358715.html"
"False","True","Zéphyr, un squelette de dinosaure vendu aux enchères à Paris en octobre","https://mobile.francetvinfo.fr/culture/patrimoine/archeologie/zephyr-un-squelette-de-dinosaure-vendu-aux-encheres-a-paris-en-octobre_5351989.html"
"False","True","À Limoges, la porcelaine revisitée par des esprits libres à la Fondation Bernardaud","https://mobile.francetvinfo.fr/culture/en-regions/a-limoges-la-porcelaine-revisitee-par-des-esprits-libres-a-la-fondation-bernardaud_5347537.html"
"False","True","En Dordogne, le château de Biron rend hommage au peintre Gaston Chaissac","https://mobile.francetvinfo.fr/culture/arts-expos/art-contemporain/en-dordogne-le-chateau-de-biron-rend-hommage-au-peintre-gaston-chaissac_5350120.html"
"False","True","Des compteurs connectés pour lutter contre les fuites d'eau","https://mobile.francetvinfo.fr/france/ilsontlasolution/des-compteurs-connectes-pour-lutter-contre-les-fuites-d-eau_5350057.html"
"False","True","À Castres, de vieux cyclomoteurs reprennent vie en passant à l'électrique","https://mobile.francetvinfo.fr/sports/auto-moto/a-castres-de-vieux-cyclomoteurs-reprennent-vie-en-passant-a-l-electrique_5349661.html"
"False","True","Handicap : Un fauteuil tout terrain pour gravir des montagnes","https://mobile.francetvinfo.fr/sante/handicap/handicap-un-fauteuil-tout-terrain-pour-gravir-des-montagnes_5349823.html"
"False","True","Le premier navire ""zéro particule "" présenté à Marseille","https://mobile.francetvinfo.fr/sante/environnement-et-sante/le-premier-navire-zero-particule-presente-a-marseille_5349631.html"
"False","True","En Haute-Garonne, des piscines municipales moins gourmandes en énergie","https://mobile.francetvinfo.fr/france/ilsontlasolution/en-haute-garonne-des-piscines-municipales-moins-gourmandes-en-energie_5345542.html"
"False","True","En Isère, des équipements sportifs d’occasion pour lutter contre le gaspillage","https://mobile.francetvinfo.fr/france/ilsontlasolution/en-isere-des-equipements-sportifs-doccasion-pour-lutter-contre-le-gaspillage_5343991.html"
"False","True","Dans les Deux-Sèvres, une entreprise innove pour diminuer sa consommation énergétique","https://mobile.francetvinfo.fr/france/ilsontlasolution/dans-les-deux-sevres-une-entreprise-innove-pour-diminuer-sa-consommation-energetique_5343775.html"
"False","True","Après les incendies de l'été, les chasseurs de Gironde surveillent le retour des animaux","https://mobile.francetvinfo.fr/france/ilsontlasolution/apres-les-incendies-de-l-ete-les-chasseurs-de-gironde-surveillent-le-retour-des-animaux_5343610.html"
"False","True","Elizabeth II, la réforme des retraites, le débat sur la fin de vie et l'hommage à Jean-Luc Godard... Les informés de franceinfo du mardi 13 septembre","https://mobile.francetvinfo.fr/replay-radio/les-informes-de-france-info/l-ultime-voyage-de-la-reine-elizabeth-ii-emmanuel-macron-accelere-sur-la-reforme-des-retraites-le-debat-sur-la-fin-de-vie-et-l-hommage-a-jean-luc-godard-les-informes-de-franceinfo-du-mardi-13-septembre_5332594.html"
"False","True","Cinéma : le réalisateur Jean-Luc Godard est décédé à l'âge de 91 ans","https://mobile.francetvinfo.fr/culture/cinema/jean-luc-godard/cinema-le-realisateur-jean-luc-godard-est-decede-a-l-age-de-91-ans_5360287.html"
"False","True","Jean-Luc Godard vu par des étudiants en cinéma : ""On peut faire une école de cinéma rien qu'en regardant ses films""","https://mobile.francetvinfo.fr/culture/cinema/jean-luc-godard/video-jean-luc-godard-vu-par-les-etudiants-en-cinema-on-peut-faire-une-ecole-de-cinema-rien-qu-en-regardant-ses-films_5359147.html"
"False","True","Mort de Jean-Luc Godard : qui est Rachel Khan, la touche-à-tout à qui il avait envoyé un dernier projet de film ?","https://mobile.francetvinfo.fr/replay-radio/l-intrus-de-l-actu/mort-de-jean-luc-godard-qui-est-rachel-khan-la-touche-a-tout-a-qui-il-avait-envoye-un-dernier-projet-de-film_5332567.html"
"False","True","Le jour où Jean-Luc Godard provoqua le baisser de rideau du festival de Cannes, pendant Mai 1968","https://mobile.francetvinfo.fr/culture/cinema/jean-luc-godard/le-jour-ou-jean-luc-godard-provoqua-le-baisser-de-rideau-du-festival-de-cannes-pendant-mai-1968_5358835.html"
"False","True","Le réalisateur franco-suisse Jean-Luc Godard, géant du cinéma, est mort","https://mobile.francetvinfo.fr/culture/cinema/jean-luc-godard/disparition-l-immense-realisateur-jean-luc-godard-est-decede_5358937.html"
"False","True","Le cinéaste Jean-Luc Godard, monument de la Nouvelle Vague, est mort à l'âge de 91 ans","https://mobile.francetvinfo.fr/culture/cinema/le-cineaste-jean-luc-godard-monument-de-la-nouvelle-vague-est-mort-a-l-age-de-91-ans_3303099.html"
