"premium","picture","title","url"
"False","True","Crise de l'énergie : pourquoi les coupures d'électricité sont un sujet explosif pour le gouvernement","https://mobile.francetvinfo.fr/economie/energie/crise-de-l-energie-pourquoi-les-coupures-d-electricite-sont-un-sujet-explosif-pour-le-gouvernement_5322196.html"
"False","True","REPORTAGE. ""Republic now !"" : à Edimbourg, la proclamation du roi Charles III perturbée par des républicains","https://mobile.francetvinfo.fr/monde/royaume-uni/mort-delizabeth-ii/reportage-republic-now-a-edimbourg-la-proclamation-du-roi-charles-iii-perturbee-par-des-republicains_5355001.html"
"False","True","DIRECT. Guerre en Ukraine : la reconquête d'Izioum, dans l'est du pays, est ""en cours"", affirme Kiev","https://mobile.francetvinfo.fr/monde/europe/manifestations-en-ukraine/guerre-en-ukraine-le-dernier-reacteur-en-activite-a-la-centrale-nucleaire-de-zaporijjia-est-arrete_5354710.html"
"False","True","""Vous représentez la nouvelle garde"" : Elisabeth Borne apporte son soutien à la Première ministre finlandaise, critiquée pour avoir fait la fête","https://mobile.francetvinfo.fr/monde/europe/vous-representez-la-nouvelle-garde-elisabeth-borne-apporte-son-soutien-a-la-premiere-ministre-finlandaise-critiquee-pour-avoir-fait-la-fete_5355058.html"
"False","True","Disney annonce une suite à ""Vice Versa"" et dévoile les premières images de ""La Petite Sirène"" en live action","https://mobile.francetvinfo.fr/culture/cinema/disney-annonce-une-suite-a-vice-versa-et-devoile-les-premieres-images-de-la-petite-sirene-en-live-action_5354923.html"
"False","True","DIRECT. F1 : voiture de sécurité à quatre tours de l'arrivée, Verstappen et Leclerc au coude à coude... Suivez le Grand Prix d'Italie","https://mobile.francetvinfo.fr/sports/auto-moto/formule-1/direct-f1-ferrari-de-retour-au-sommet-sur-ses-terres-suivez-le-grand-prix-d-italie_5351683.html"
"False","True","EN IMAGES. Le Pakistan victime d'inondations meurtrières, qualifiées de ""carnage climatique"" par l'ONU","https://mobile.francetvinfo.fr/meteo/climat/en-images-le-pakistan-victime-d-inondations-meurtrieres-qualifiees-de-carnage-climatique-par-l-onu_5353699.html"
"False","True","Funérailles de la reine Elizabeth II : le programme des prochains jours","https://mobile.francetvinfo.fr/monde/royaume-uni/mort-delizabeth-ii/funerailles-de-la-reine-elizabeth-ii-le-programme-des-prochains-jours_5354896.html"
"False","True","Crise énergétique : ""Il n'y aura pas moins de trains ou des trains qui roulent moins vite"", promet le ministre des Transports","https://mobile.francetvinfo.fr/monde/environnement/crise-energetique-il-n-y-aura-pas-moins-de-trains-ou-des-trains-qui-roulent-moins-vite-promet-le-ministre-des-transports_5354986.html"
"False","True","Mort d'Elizabeth II : mugs, tee-shirts, figurines... Les souvenirs à l'effigie de la reine déjà en rupture de stock","https://mobile.francetvinfo.fr/monde/royaume-uni/mort-delizabeth-ii/mort-d-elizabeth-ii-mugs-tee-shirts-figurines-les-souvenirs-a-l-effigie-de-la-reine-deja-en-rupture-de-stock_5354911.html"
"False","True","DIRECT. Mort d'Elizabeth II : le cercueil de la reine quitte le château de Balmoral en direction d'Edimbourg","https://mobile.francetvinfo.fr/monde/royaume-uni/mort-delizabeth-ii/direct-mort-d-elizabeth-ii-le-cercueil-de-la-reine-quitte-balmoral-pour-edimbourg_5354737.html"
"False","True","Journées du patrimoine : l'Elysée ouvre une billetterie en ligne ce dimanche après-midi pour visiter le palais","https://mobile.francetvinfo.fr/culture/patrimoine/info-franceinfo-journees-du-patrimoine-l-elysee-ouvre-une-billetterie-en-ligne-ce-dimanche-apres-midi-pour-visiter-le-palais_5354947.html"
"False","True","VIDEO. Quand la classe politique déroule le tapis rouge à Magali Berdah, ""patronne des influenceurs"" sur les réseaux sociaux","https://mobile.francetvinfo.fr/internet/reseaux-sociaux/video-quand-la-classe-politique-deroule-le-tapis-rouge-a-magali-berdah-patronne-des-influenceurs-sur-les-reseaux-sociaux_5347063.html"
"False","True","Océans : 180 scientifiques demandent aux 27 pays de l'UE ""l'interdiction de toutes les méthodes de pêche destructrices dans les aires marines protégées""","https://mobile.francetvinfo.fr/monde/environnement/oceans-180-scientifiques-demandent-aux-27-pays-de-l-ue-l-interdiction-de-toutes-les-methodes-de-peche-destructrices-dans-les-aires-marines-protegees_5354842.html"
"False","True","Mort d'Elizabeth II : un maire du Nord refuse de mettre les drapeaux en berne après la disparition de la reine","https://france3-regions.francetvinfo.fr/hauts-de-france/nord-0/lille/nord-un-maire-refuse-de-mettre-les-drapeaux-en-berne-apres-la-disparition-de-la-reine-elisabeth-ii-2611164.html"
"False","True","GRAND ENTRETIEN. Mort d'Elizabeth II : ""Il y avait un grand attachement à la reine, moins à la monarchie"", selon la chercheuse Isabelle Baudino","https://mobile.francetvinfo.fr/monde/royaume-uni/mort-delizabeth-ii/grand-entretien-mort-d-elizabeth-ii-il-y-avait-un-grand-attachement-a-la-reine-moins-a-la-monarchie-selon-la-chercheuse-isabelle-baudino_5351851.html"
"False","True","REPORTAGE. ""Sur la durée, Charles III va devoir faire ses preuves"" : dans les rues de Londres, les Britanniques partagés sur leur nouveau roi","https://mobile.francetvinfo.fr/monde/royaume-uni/mort-delizabeth-ii/reportage-sur-la-duree-charles-iii-va-devoir-faire-ses-preuves-dans-les-rues-de-londres-les-britanniques-partages-sur-leur-nouveau-roi_5353486.html"
"False","True","Z Event 2022 à Montpellier : le marathon caritatif des streamers et le rush final pour l'environnement","https://france3-regions.francetvinfo.fr/occitanie/herault/montpellier/z-event-2022-a-montpellier-le-marathon-caritatif-des-streamers-et-le-rush-final-pour-l-environnement-2611236.html"
"False","True","Mostra de Venise : la Française Alice Diop doublement récompensée pour son film ""Saint-Omer""","https://mobile.francetvinfo.fr/culture/cinema/mostra-de-venise-la-francaise-alice-diop-doublement-recompensee-pour-son-film-saint-omer_5354698.html"
"False","True","US Open 2022 : imperturbable, Iga Swiatek domine Ons Jabeur et décroche son troisième Grand Chelem","https://mobile.francetvinfo.fr/sports/tennis/us-open/us-open-2022-imperturbable-iga-swiatek-domine-ons-jabeur-et-decroche-son-troisieme-grand-chelem_5353966.html"
"False","True","Charles III : continuité, modernisation, rénovation... Quel sera le style du nouveau roi ?","https://mobile.francetvinfo.fr/monde/royaume-uni/mort-delizabeth-ii/charles-iii-continuite-modernisation-renovation-quel-sera-le-style-du-nouveau-roi_5353438.html"
"False","True","Santé : la façon dont la pollution atmosphérique déclenche le cancer du poumon trouve enfin une explication","https://mobile.francetvinfo.fr/sante/cancer/sante-la-facon-dont-la-pollution-atmospherique-declenche-le-cancer-du-poumon-trouve-enfin-une-explication_5353702.html"
"False","True","REPORTAGE. ""Le chien va peut-être passer à côté d'un gibier et il ne va rien trouver"" : l'ouverture de la saison de la chasse perturbée par la sécheresse de cet été","https://mobile.francetvinfo.fr/monde/environnement/biodiversite/reportage-le-chien-va-peut-etre-passer-a-cote-d-un-gibier-et-il-ne-va-rien-trouver-l-ouverture-de-la-saison-de-la-chasse-perturbee-par-la-secheresse-de-cet-ete_5353681.html"
"False","True","Guerre en Ukraine : Volodymyr Zelensky affirme que ses troupes ont repris ""2 000 km de territoire""","https://mobile.francetvinfo.fr/monde/europe/manifestations-en-ukraine/guerre-en-ukraine-volodymyr-zelensky-affirme-que-ses-troupes-ont-repris-2-000-km-de-territoire_5354695.html"
"False","True","Guerre en Ukraine : la Russie annonce un redéploiement de ses forces dans l'Est après des avancées revendiquées par Kiev","https://mobile.francetvinfo.fr/monde/europe/manifestations-en-ukraine/direct-guerre-en-ukraine-kiev-dit-avoir-progresse-de-plusieurs-dizaines-de-kilometres-sur-le-front-sud_5353531.html"
"False","True","""Ça fait partie du plan de Moscou"" : comment la Russie a dévasté l'économie ukrainienne","https://mobile.francetvinfo.fr/monde/europe/manifestations-en-ukraine/ca-fait-partie-du-plan-de-moscou-comment-la-russie-a-devaste-l-economie-ukrainienne_5335168.html"
"False","True","À Limoges, la porcelaine revisitée par des esprits libres à la Fondation Bernardaud","https://mobile.francetvinfo.fr/culture/en-regions/a-limoges-la-porcelaine-revisitee-par-des-esprits-libres-a-la-fondation-bernardaud_5347537.html"
"False","True","En Dordogne, le château de Biron rend hommage au peintre Gaston Chaissac","https://mobile.francetvinfo.fr/culture/arts-expos/art-contemporain/en-dordogne-le-chateau-de-biron-rend-hommage-au-peintre-gaston-chaissac_5350120.html"
"False","True","Des compteurs connectés pour lutter contre les fuites d'eau","https://mobile.francetvinfo.fr/france/ilsontlasolution/des-compteurs-connectes-pour-lutter-contre-les-fuites-d-eau_5350057.html"
"False","True","À Castres, de vieux cyclomoteurs reprennent vie en passant à l'électrique","https://mobile.francetvinfo.fr/sports/auto-moto/a-castres-de-vieux-cyclomoteurs-reprennent-vie-en-passant-a-l-electrique_5349661.html"
"False","True","Handicap : Un fauteuil tout terrain pour gravir des montagnes","https://mobile.francetvinfo.fr/sante/handicap/handicap-un-fauteuil-tout-terrain-pour-gravir-des-montagnes_5349823.html"
"False","True","Le premier navire ""zéro particule "" présenté à Marseille","https://mobile.francetvinfo.fr/sante/environnement-et-sante/le-premier-navire-zero-particule-presente-a-marseille_5349631.html"
"False","True","En Haute-Garonne, des piscines municipales moins gourmandes en énergie","https://mobile.francetvinfo.fr/france/ilsontlasolution/en-haute-garonne-des-piscines-municipales-moins-gourmandes-en-energie_5345542.html"
"False","True","En Isère, des équipements sportifs d’occasion pour lutter contre le gaspillage","https://mobile.francetvinfo.fr/france/ilsontlasolution/en-isere-des-equipements-sportifs-doccasion-pour-lutter-contre-le-gaspillage_5343991.html"
"False","True","Dans les Deux-Sèvres, une entreprise innove pour diminuer sa consommation énergétique","https://mobile.francetvinfo.fr/france/ilsontlasolution/dans-les-deux-sevres-une-entreprise-innove-pour-diminuer-sa-consommation-energetique_5343775.html"
"False","True","Après les incendies de l'été, les chasseurs de Gironde surveillent le retour des animaux","https://mobile.francetvinfo.fr/france/ilsontlasolution/apres-les-incendies-de-l-ete-les-chasseurs-de-gironde-surveillent-le-retour-des-animaux_5343610.html"
"False","True","VRAI OU FAKE : Doctolib abrite des professions non réglementées parmi les professionnels de santé inscrits","https://mobile.francetvinfo.fr/sante/professions-medicales/vrai-ou-fake-doctolib-abrite-des-professions-non-reglementees-parmi-les-professionnels-de-sante-inscrits_5337622.html"
"False","True","VRAI OU FAKE : comment les influenceurs embarquent des milliers de personnes dans un trading à très haut risque ?","https://mobile.francetvinfo.fr/internet/reseaux-sociaux/vrai-ou-fake-comment-les-influenceurs-embarquent-des-milliers-de-personnes-dans-un-trading-a-tres-haut-risque_5337610.html"
"False","True","Sarah Jollien-Fardel lauréate du Prix du roman Fnac avec ""Sa préférée"", un premier livre choc sur la maltraitance","https://mobile.francetvinfo.fr/culture/livres/roman/sarah-jollien-fardel-laureate-du-prix-du-roman-fnac-avec-sa-preferee-un-premier-livre-choc-sur-la-maltraitance_5347504.html"
"False","True","Rentrée littéraire : lumière sur trois histoires incontournables","https://mobile.francetvinfo.fr/culture/livres/la-rentree-litteraire/rentree-litteraire-lumiere-sur-trois-histoires-incontournables_5347780.html"
"False","True","""Cher connard"" : les vertus du dialogue, par Virginie Despentes","https://mobile.francetvinfo.fr/culture/livres/roman/cher-connard-les-vertus-du-dialogue-par-virginie-despentes_5345923.html"
"False","True","Quinze romans dans la première sélection du Goncourt, Despentes absente","https://mobile.francetvinfo.fr/culture/livres/roman/quinze-romans-dans-la-premiere-selection-du-goncourt-despentes-absente_5345524.html"
"False","True","""En salle"", premier roman réussi de Claire Baglin dans les coulisses d'un fastfood","https://mobile.francetvinfo.fr/culture/livres/roman/en-salle-premier-roman-reussi-de-claire-baglin-dans-les-coulisses-d-un-fastfood_5343706.html"
"False","True","""Le colonel ne dort pas"", la barbarie de la guerre dans un roman impressionniste d'Emilienne Malfatto","https://mobile.francetvinfo.fr/culture/livres/la-rentree-litteraire/le-colonel-ne-dort-pas-la-barbarie-de-la-guerre-dans-un-roman-impressionniste-d-emilienne-malfatto_5280310.html"
"False","True","""Le Rocher blanc"" d'Anna Hope : un incroyable voyage dans le temps autour de l'origine du monde","https://mobile.francetvinfo.fr/culture/livres/la-rentree-litteraire/le-rocher-blanc-d-anna-hope-un-incroyable-voyage-dans-le-temps-autour-de-l-origine-du-monde_5278603.html"
"False","True","La saison des prix littéraires démarre avec la première sélection du Goncourt et du Renaudot mercredi","https://mobile.francetvinfo.fr/culture/livres/roman/la-saison-des-prix-litteraires-demarre-avec-la-premiere-selection-du-goncourt-et-du-renaudot-mercredi_5343340.html"
"False","True","""Taormine"" : un nouveau polar décalé d'Yves Ravey sous le ciel de Sicile","https://mobile.francetvinfo.fr/culture/livres/la-rentree-litteraire/taormine-un-nouveau-polar-decale-d-yves-ravey-sous-le-ciel-de-sicile_5271991.html"
"False","True","""La ligne de nage"" de Julie Otsuka : des fissures au fond de la piscine et dans la tête d'une vieille dame","https://mobile.francetvinfo.fr/culture/livres/la-rentree-litteraire/la-ligne-de-nage-de-julie-otsuka-des-fissures-au-fond-de-la-piscine-et-dans-la-tete-d-une-vieille-dame_5281942.html"
"False","True","Mort d'Elizabeth II : ""Il y avait un grand attachement à la reine, moins à la monarchie"", selon la chercheuse Isabelle Baudino","https://mobile.francetvinfo.fr/monde/royaume-uni/mort-delizabeth-ii/grand-entretien-mort-d-elizabeth-ii-il-y-avait-un-grand-attachement-a-la-reine-moins-a-la-monarchie-selon-la-chercheuse-isabelle-baudino_5351851.html"
"False","True","""Sur la durée, Charles III va devoir faire ses preuves"" : dans les rues de Londres, les Britanniques partagés sur leur nouveau roi","https://mobile.francetvinfo.fr/monde/royaume-uni/mort-delizabeth-ii/reportage-sur-la-duree-charles-iii-va-devoir-faire-ses-preuves-dans-les-rues-de-londres-les-britanniques-partages-sur-leur-nouveau-roi_5353486.html"
