"premium","picture","title","url"
"False","True","DIRECT. Présidentielle 2022 : Mélenchon et Pécresse s’opposent par meetings interposés","https://www.ouest-france.fr/elections/presidentielle/direct-presidentielle-2022-suivez-les-meetings-a-forts-enjeux-de-pecresse-et-melenchon-4a3eaf5e-8cc1-11ec-bca3-08445a122d14"
"False","True","CARTES. Déserts médicaux : quelles sont les zones les plus défavorisées ?","https://www.ouest-france.fr/sante/cartes-deserts-medicaux-quelles-sont-les-zones-les-plus-defavorisees-795b9d62-8b07-11ec-88ed-2ead809b0816"
"False","True","Le Lab Présidentielle d’Ouest-France pour suivre l’élection dans tous les formats multimédias","https://www.ouest-france.fr/elections/presidentielle/le-lab-presidentielle-d-ouest-france-pour-suivre-l-election-dans-tous-les-formats-multimedias-ee14e1e8-8ccb-11ec-bca3-08445a122d14"
"False","True","En Inde, la bataille pour sauver des vestiges dans la cité historique du Vieux-Goa","https://www.ouest-france.fr/monde/inde/en-inde-la-bataille-pour-sauver-des-vestiges-dans-la-cite-historique-du-vieux-goa-fb3d3efc-8b67-11ec-88ed-2ead809b0816"
"False","True","JO biathlon. Médaillé d’or sur la poursuite, Fillon Maillet rentre dans l’histoire des Jeux","https://www.ouest-france.fr/jeux-olympiques/direct/direct-jo-biathlon-suivez-l-epreuve-de-poursuite-masculine-en-live-06c46d56-8c1f-11ec-8fd5-efbb8a3fecd3"
"False","True","Convoi de la liberté. Après un samedi sans blocage à Paris, 81 personnes placées en garde à vue","https://www.ouest-france.fr/sante/virus/coronavirus/pass-vaccinal/convoi-de-la-liberte-apres-un-samedi-sans-blocage-a-paris-97-interpellations-32423072-8ca0-11ec-86b5-4b5432fd5e2d"
"False","True","Covid-19. Pourquoi ne parle-t-on plus du nombre de morts ?","https://www.ouest-france.fr/sante/virus/coronavirus/covid-19-pourquoi-ne-parle-t-on-plus-du-nombre-de-morts-b0c5dd14-88f8-11ec-829c-db5b3f50af81"
"False","True","Ligue 1. Lorient ramène un bon point de Monaco à l’issue d’une rencontre fermée","https://www.ouest-france.fr/sport/football/ligue-1/direct/direct-monaco-fc-lorient-suivez-le-match-de-la-24e-journee-de-ligue-1-en-direct-live-f87f3eb0-8b56-11ec-88ed-2ead809b0816"
"False","False","ENTRETIEN. Une femme présidente de la République, est-ce que ça changerait vraiment quelque chose ?","https://www.ouest-france.fr/elections/presidentielle/entretien-une-femme-presidente-de-la-republique-est-ce-que-ca-changerait-vraiment-quelque-chose-2e30606c-880e-11ec-83fb-10f9670fd651"
"False","False","DIRECT. Ligue 1 : Angers mené face à Strasbourg après un superbe but de Gameiro","https://www.ouest-france.fr/sport/football/ligue-1/direct/direct-angers-sco-rc-strasbourg-suivez-le-match-de-la-24e-journee-en-direct-live-bd4b670a-8b61-11ec-88ed-2ead809b0816"
"False","False","Les Suisses votent pour l’interdiction des publicités pour le tabac, lors d’un référendum","https://www.ouest-france.fr/europe/suisse/les-suisses-votent-pour-l-interdiction-des-publicites-pour-le-tabac-lors-d-un-referendum-a45c051c-8cd1-11ec-bca3-08445a122d14"
"False","False","DIRECT. Ligue 1 : Grâce à Satriano, les Brestois sont déjà devant face à Troyes","https://www.ouest-france.fr/sport/football/ligue-1/direct/direct-stade-brestois-estac-troyes-suivez-le-match-de-la-24e-journee-de-ligue-1-en-direct-live-a63c4212-8b68-11ec-88ed-2ead809b0816"
"False","False","DIRECT. FC Nantes - Reims : les Canaris veulent enchaîner après la qualification en demi-finale","https://www.ouest-france.fr/sport/football/ligue-1/direct/direct-fc-nantes-reims-suivez-le-match-de-la-24e-journee-en-direct-live-2ad18070-8b6c-11ec-88ed-2ead809b0816"
"False","False","Migrants. SOS Méditerranée a secouru 228 personnes en moins de 24 heures","https://www.ouest-france.fr/monde/migrants/migrants-sos-mediterranee-a-secouru-228-personnes-en-moins-de-24-heures-8dcf2b82-8ccf-11ec-bca3-08445a122d14"
"False","True","JO biathlon. Médaillé d’or sur la poursuite, Fillon Maillet rentre dans l’histoire des Jeux","https://www.ouest-france.fr/jeux-olympiques/direct/direct-jo-biathlon-suivez-l-epreuve-de-poursuite-masculine-en-live-06c46d56-8c1f-11ec-8fd5-efbb8a3fecd3"
"False","True","JO ski de fond. Le relais masculin français médaillé de bronze comme en 2014 et 2018","https://www.ouest-france.fr/jeux-olympiques/direct/direct-jo-ski-de-fond-suivez-les-francais-dans-le-relais-masculin-a-pekin-a8b6b6d2-8c10-11ec-8fd5-efbb8a3fecd3"
"False","True","JO ski alpin. Mathieu Faivre décroche le bronze sur le géant et offre à la France une 8e médaille","https://www.ouest-france.fr/jeux-olympiques/direct/direct-jo-ski-alpin-suivez-le-deuxieme-run-de-l-epreuve-du-slalom-geant-masculin-2de948da-8c0f-11ec-8fd5-efbb8a3fecd3"
"False","True","Pourquoi les champions olympiques mordent-ils leurs médailles sur le podium ?","https://www.ouest-france.fr/leditiondusoir/2022-02-11/pourquoi-les-champions-olympiques-mordent-ils-leurs-medailles-sur-le-podium-7295a786-5da1-4741-bc7b-ea8608ebac2e"
"False","True","JO biathlon. Quentin Fillon Maillet remporte l’argent au sprint, sa troisième médaille à Pékin","https://www.ouest-france.fr/jeux-olympiques/direct-jo-biathlon-suivez-le-sprint-masculin-de-pekin-en-live-6fc7a8ac-8b36-11ec-88ed-2ead809b0816"
"False","True","ÉDITORIAL : Prisons, des conditions de détention indignes !","https://www.ouest-france.fr/reflexion/editorial/editorial-prisons-des-conditions-de-detention-indignes-77ee0690-8b25-11ec-a1f9-dd16676602bc"
"False","True","Voici comment évaluer le prix de vente de vos vieilles cartes Pokémon","https://www.ouest-france.fr/leditiondusoir/2022-02-11/voici-comment-evaluer-le-prix-de-vente-de-vos-vieilles-cartes-pokemon-9e5becb2-31be-427a-b37c-218bae91ab8e"
"False","True","Le Lab Présidentielle d’Ouest-France pour suivre l’élection dans tous les formats multimédias","https://www.ouest-france.fr/elections/presidentielle/le-lab-presidentielle-d-ouest-france-pour-suivre-l-election-dans-tous-les-formats-multimedias-ee14e1e8-8ccb-11ec-bca3-08445a122d14"
"False","True","Super Ligue Ouest-France : la vidéo de candidature de l’AS Saint-Jacques","https://www.ouest-france.fr/sport/football/foot-amateur/super-ligue-ouest-france-la-video-de-candidature-de-l-as-saint-jacques-cd113814-883b-11ec-83fb-10f9670fd651"
"True","True","Doux illuminé ou grand inventeur ? Qui était Jean Le Bris, ce Breton pionnier de l’aviation","https://www.ouest-france.fr/economie/transports/avion/doux-illumine-ou-grand-inventeur-qui-etait-jean-le-bris-ce-breton-pionnier-de-l-aviation-15192702-8b39-11ec-88ed-2ead809b0816"
"False","True","Super Ligue Ouest-France : la vidéo de candidature du Ploërmel FC","https://www.ouest-france.fr/sport/football/foot-amateur/super-ligue-ouest-france-la-video-de-candidature-du-ploermel-fc-28ebedc0-883f-11ec-83fb-10f9670fd651"
"False","True","Le Lab Présidentielle d’Ouest-France pour suivre l’élection dans tous les formats multimédias","https://www.ouest-france.fr/elections/presidentielle/le-lab-presidentielle-d-ouest-france-pour-suivre-l-election-dans-tous-les-formats-multimedias-ee14e1e8-8ccb-11ec-bca3-08445a122d14"
"False","True","Lab Présidentielle. Testez vos connaissances sur la campagne et les candidats avec nos quiz","https://lab-elections.ouest-france.fr/jeux/"
"False","True","ENTRETIEN. Service national universel : 3 000 jeunes partent en séjour de cohésion","https://www.ouest-france.fr/societe/service-national-universel/entretien-service-national-universel-3-000-jeunes-partent-en-sejour-de-cohesion-62e11c62-8b5a-11ec-88ed-2ead809b0816"
"False","True","L’avocat Christian Saint-Palais défend un terroriste et des victimes d’attentats dans deux procès","https://www.ouest-france.fr/attentats-paris/l-avocat-christian-saint-palais-defend-un-terroriste-et-des-victimes-d-attentats-dans-deux-proces-9cee6484-8b6c-11ec-88f4-4f7210dbcdc9"
"False","True","Lab Présidentielle. Testez vos connaissances sur la campagne et les candidats avec nos quiz","https://lab-elections.ouest-france.fr/jeux/"
"False","True","ENTRETIEN. Service national universel : 3 000 jeunes partent en séjour de cohésion","https://www.ouest-france.fr/societe/service-national-universel/entretien-service-national-universel-3-000-jeunes-partent-en-sejour-de-cohesion-62e11c62-8b5a-11ec-88ed-2ead809b0816"
"True","True","Basket-ball. N2F : Saumur est parti de trop loin et s’incline face à Nantes-Rezé","https://www.ouest-france.fr/sport/basket/basket-ball-n2f-saumur-est-parti-de-trop-loin-et-s-incline-face-a-nantes-reze-9743d54a-8c44-11ec-9448-96fe0c026f3e"
"True","True","Badminton. Top 12 : Plus dure est la chute pour Cholet face à Mulhouse","https://www.ouest-france.fr/sport/badminton/badminton-ba-cholet/badminton-top-12-plus-dure-est-la-chute-pour-cholet-face-a-mulhouse-961c9878-8c49-11ec-9448-96fe0c026f3e"
"False","True","Le Lab Présidentielle d’Ouest-France pour suivre l’élection dans tous les formats multimédias","https://www.ouest-france.fr/elections/presidentielle/le-lab-presidentielle-d-ouest-france-pour-suivre-l-election-dans-tous-les-formats-multimedias-ee14e1e8-8ccb-11ec-bca3-08445a122d14"
"False","True","DIRECT. Présidentielle 2022 : Mélenchon et Pécresse s’opposent par meetings interposés","https://www.ouest-france.fr/elections/presidentielle/direct-presidentielle-2022-suivez-les-meetings-a-forts-enjeux-de-pecresse-et-melenchon-4a3eaf5e-8cc1-11ec-bca3-08445a122d14"
"False","True","Lab Présidentielle. Testez vos connaissances sur la campagne et les candidats avec nos quiz","https://lab-elections.ouest-france.fr/jeux/"
"False","True","ENTRETIEN. Une femme présidente de la République, est-ce que ça changerait vraiment quelque chose ?","https://www.ouest-france.fr/elections/presidentielle/entretien-une-femme-presidente-de-la-republique-est-ce-que-ca-changerait-vraiment-quelque-chose-2e30606c-880e-11ec-83fb-10f9670fd651"
"True","True","« Peu importe qui gagne, notre situation ne bougera pas » : à la rencontre des électeurs, à Rennes","https://www.ouest-france.fr/bretagne/rennes-35000/peu-importe-qui-gagne-notre-situation-ne-bougera-pas-a-la-rencontre-des-electeurs-a-rennes-9b0ae490-89db-11ec-a193-c2f6a0cd3665"
"False","True","DIRECT. Challenger de Cherbourg 2022 : vivez la finale entre Bonzi et Lestienne avec nous","https://www.ouest-france.fr/sport/tennis/challenger-de-cherbourg/direct-challenger-de-cherbourg-2022-vivez-la-finale-entre-bonzi-et-lestienne-avec-nous-052685f8-8cb8-11ec-a7ee-6df4215e26ca"
"False","False","Un homme interpellé après avoir aspergé sa femme et son enfant d’essence en Tarn-et-Garonne","https://www.ouest-france.fr/faits-divers/violences/un-homme-interpelle-apres-avoir-asperge-sa-femme-et-son-enfant-d-essence-en-tarn-et-garonne-da30895c-8c30-11ec-8fd5-efbb8a3fecd3"
"False","False","Des affrontements et des dégradations lors d’une manifestation anti-passe à Montpellier","https://www.ouest-france.fr/sante/virus/coronavirus/pass-vaccinal/des-affrontements-et-des-degradations-lors-d-une-manifestation-anti-passe-a-montpellier-8f6cdfb2-8c29-11ec-b83e-779412dca362"
"False","True","Un père de 40 ans tué à l’arme blanche dans le centre de Marseille lors d’une rixe dans un immeuble","https://www.ouest-france.fr/societe/faits-divers/un-pere-de-40-ans-tue-a-l-arme-blanche-dans-le-centre-de-marseille-lors-d-une-rixe-dans-un-immeuble-3067399a-8cba-11ec-bca3-08445a122d14"
"False","False","Les prévisions météorologiques du dimanche 13 février 2022 à Toulon et ses environs","https://www.ouest-france.fr/meteo/provence-alpes-cote-dazur/toulon-83000/la-meteo-du-jour-a-toulon-9ed13527-33dd-5959-a965-b3a84d5e5a07"
"False","False","Hautes-Alpes : un homme tué par arme blanche, trois personnes interpellées","https://www.ouest-france.fr/faits-divers/meurtres/hautes-alpes-un-homme-tue-par-arme-blanche-trois-personnes-interpellees-b3f42260-8c0f-11ec-b83e-779412dca362"
"False","True","Le Lab Présidentielle d’Ouest-France pour suivre l’élection dans tous les formats multimédias","https://www.ouest-france.fr/elections/presidentielle/le-lab-presidentielle-d-ouest-france-pour-suivre-l-election-dans-tous-les-formats-multimedias-ee14e1e8-8ccb-11ec-bca3-08445a122d14"
"False","False","DIRECT. Présidentielle 2022 : Mélenchon et Pécresse s’opposent par meetings interposés","https://www.ouest-france.fr/elections/presidentielle/direct-presidentielle-2022-suivez-les-meetings-a-forts-enjeux-de-pecresse-et-melenchon-4a3eaf5e-8cc1-11ec-bca3-08445a122d14"
"False","False","Lab Présidentielle. Testez vos connaissances sur la campagne et les candidats avec nos quiz","https://lab-elections.ouest-france.fr/jeux/"
"False","True","En Normandie, coincé dans un arbre, un homme gravement blessé","https://www.ouest-france.fr/normandie/bellou-le-trichard-61130/en-normandie-coince-dans-un-arbre-un-homme-gravement-blesse-57749e4a-8b68-11ec-88ed-2ead809b0816"
"False","False","Loir-et-Cher. Une sexagénaire mordue par un chien en protégeant sa petite fille à Saint-Gervais-la-Forêt","https://www.ouest-france.fr/centre-val-de-loire/saint-gervais-la-foret-41350/loir-et-cher-une-sexagenaire-mordue-par-un-chien-en-protegeant-sa-petite-fille-a-saint-gervais-la-7629815"
"True","False","Indre. La mairie donne rendez-vous aux citoyens","https://www.ouest-france.fr/centre-val-de-loire/indre/indre-la-mairie-donne-rendez-vous-aux-citoyens-1486e0b2-8ab3-11ec-9e91-5bea42a6f3b8"
