"premium","picture","title","url"
"False","True","Guerre en Ukraine : comment la mémoire de l'Holodomor, cette famine provoquée par Staline, a façonné l'identité ukrainienne","https://mobile.francetvinfo.fr/monde/europe/manifestations-en-ukraine/guerre-en-ukraine-comment-la-memoire-de-l-holodomor-cette-famine-provoquee-par-staline-a-faconne-l-identite-ukrainienne_5492937.html"
"False","True","Guerre en Ukraine : le groupe Wagner s'acharne à prendre Bakhmout, en dépit de toute logique militaire","https://mobile.francetvinfo.fr/monde/europe/manifestations-en-ukraine/guerre-en-ukraine-le-groupe-wagner-s-acharne-a-prendre-bakhmout-en-depit-de-toute-logique-militaire_5491014.html"
"False","True","DIRECT. Guerre en Ukraine : 15 morts à Kherson, six millions de foyers affectés par les coupures d'électricité","https://mobile.francetvinfo.fr/monde/europe/manifestations-en-ukraine/direct-guerre-en-ukraine-15-morts-a-kherson-six-millions-de-foyers-affectes-par-les-coupures-d-electricite_5503314.html"
"False","True","Guerre en Ukraine : ce qu'il faut retenir de la journée du vendredi 25 novembre","https://mobile.francetvinfo.fr/monde/europe/manifestations-en-ukraine/guerre-en-ukraine-ce-qu-il-faut-retenir-de-la-journee-du-vendredi-25-novembre_5502150.html"
"False","True","Coupe du monde 2022 : comment le Danemark s'est impliqué pour la défense des droits de l'homme au Qatar","https://mobile.francetvinfo.fr/coupe-du-monde/les-aberrations-du-mondial-au-qatar/coupe-du-monde-2022-comment-le-danemark-s-est-implique-pour-la-defense-des-droits-de-l-homme-au-qatar_5498544.html"
"False","True","REPORTAGE. Violences faites aux femmes : code couleurs, psychologue, ""mise en confiance""... Comment la police recueille la parole des victimes","https://mobile.francetvinfo.fr/societe/violences-faites-aux-femmes/reportage-violences-faites-aux-femmes-code-couleurs-psychologue-mise-en-confiance-comment-la-police-recueille-la-parole-des-victimes_5502123.html"
"False","True","Comment l'application TikTok échoue à protéger ses jeunes utilisateurs de la désinformation","https://mobile.francetvinfo.fr/internet/reseaux-sociaux/comment-l-application-tiktok-echoue-a-proteger-ses-jeunes-utilisateurs-de-la-desinformation_5476152.html"
"False","True","Covid-19 : quatre questions sur la réintégration des soignants non vaccinés","https://mobile.francetvinfo.fr/sante/maladie/coronavirus/vaccin/covid-19-quatre-questions-sur-la-reintegration-des-soignants-non-vaccines_5501889.html"
"False","True","Budget de la Sécurité sociale : Elisabeth Borne utilise pour la sixième fois l'article 49.3","https://mobile.francetvinfo.fr/politique/parlement-francais/assemblee-nationale/budget-de-la-securite-sociale-elisabeth-borne-utilise-pour-la-sixieme-fois-l-article-49-3_5502708.html"
"False","True","Nice : un mort et plusieurs blessés dans un incendie, 200 habitants évacués","https://mobile.francetvinfo.fr/france/provence-alpes-cote-d-azur/nice-un-mort-et-trois-blesses-dans-un-incendie-200-habitants-evacues_5503230.html"
"False","True","Les Etats-Unis interdisent officiellement les équipements télécoms chinois","https://mobile.francetvinfo.fr/monde/usa/les-etats-unis-interdisent-officiellement-les-equipements-telecoms-chinois_5503242.html"
"False","True","Le rappeur Kanye West suggère qu'il sera candidat à la présidentielle américaine de 2024","https://mobile.francetvinfo.fr/culture/musique/kanye-west/le-rappeur-kanye-west-suggere-qu-il-sera-candidat-a-la-presidentielle-americaine-de-2024_5503227.html"
"False","True","Révélations, ""censure"" et vie privée... On vous raconte le bras de fer judiciaire entre Mediapart et le maire de Saint-Etienne, Gaël Perdriau","https://mobile.francetvinfo.fr/economie/medias/revelations-censure-et-vie-privee-on-vous-raconte-le-bras-de-fer-judiciaire-entre-mediapart-et-le-maire-de-saint-etienne-gael-perdriau_5500890.html"
"False","True","Éducation : les élèves de sixième ont un niveau légèrement inférieur aux élèves de 2021, légèrement supérieur pour les CP, selon les évaluations","https://mobile.francetvinfo.fr/societe/education/education-les-eleves-de-sixieme-ont-un-niveau-legerement-inferieur-aux-eleves-de-2021-selon-les-evaluations_5501784.html"
"False","True","""Ocean Viking"" : les ministres européens de l'Intérieur approuvent un plan d'urgence pour ne ""pas reproduire"" un tel scénario","https://mobile.francetvinfo.fr/monde/europe/migrants/ocean-viking-les-ministres-europeens-de-l-interieur-approuvent-un-plan-d-urgence-pour-ne-pas-reproduire-un-tel-scenario_5502105.html"
"False","True","Coupe du monde 2022 : qui sont les supporters indiens ""tombés amoureux"" de l'équipe de France ?","https://mobile.francetvinfo.fr/sports/foot/equipe-de-france/coupe-du-monde-2022-qui-sont-les-supporters-indiens-tombes-amoureux-de-l-equipe-de-france_5495943.html"
"False","True","Coupe du monde 2022 : machine offensive, talisman pour les Bleus, engagement politique... Trois choses à savoir sur le Danemark, adversaire de l'équipe de France","https://mobile.francetvinfo.fr/coupe-du-monde/coupe-du-monde-2022-machine-offensive-talisman-pour-les-bleus-engagement-politique-trois-choses-a-savoir-sur-le-danemark-adversaire-de-l-equipe-de-france_5501013.html"
"False","True","Coupe du monde : l'Angleterre échoue à battre les Etats-Unis (0-0), le Qatar déjà éliminé","https://mobile.francetvinfo.fr/coupe-du-monde/directs/direct-coupe-du-monde-le-pays-de-galles-de-gareth-bale-affronte-l-iran-le-choc-du-jour-oppose-l-angleterre-aux-etats-unis_5500668.html"
"False","True","Coupe du monde 2022 : le Danemark tiraillé entre contestation politique et ambitions sportives","https://mobile.francetvinfo.fr/coupe-du-monde/coupe-du-monde-2022-le-danemark-tiraille-entre-contestation-politique-et-ambitions-sportives_5498061.html"
"False","True","Meurtre de Vanesa : marche blanche et messe à Tonneins, une semaine après le drame","https://mobile.francetvinfo.fr/faits-divers/meurtres/meurtre-de-vanesa-marche-blanche-et-messe-a-tonneins-une-semaine-apres-le-drame_5501997.html"
"False","True","Au lendemain d'une journée houleuse dans l'hémicycle, la présidente de l'Assemblée nationale déplore ""l'obstruction"" parlementaire","https://mobile.francetvinfo.fr/politique/parlement-francais/assemblee-nationale/la-presidente-de-l-assemblee-nationale-deplore-l-obstruction-parlementaire-une-reunion-sur-le-sujet-prevue-mardi_5502072.html"
"False","True","Violences faites aux femmes : une trentaine d'élus locaux signent un manifeste pour protéger les victimes","https://mobile.francetvinfo.fr/societe/violences-faites-aux-femmes/violences-faites-aux-femmes-une-trentaine-d-elus-locaux-signent-un-manifeste-pour-proteger-les-victimes_5501931.html"
"False","True","Coupe du monde 2022 : les matchs des Bleus boostent les paris en ligne en France, légèrement plus élevés qu'en 2018","https://mobile.francetvinfo.fr/coupe-du-monde/coupe-du-monde-2022-les-matchs-des-bleus-boostent-les-paris-en-ligne-en-france-legerement-plus-eleves-qu-en2018_5501556.html"
"False","True","Affaire du chlordécone aux Antilles : le parquet de Paris demande un non-lieu","https://mobile.francetvinfo.fr/economie/emploi/metiers/agriculture/affaire-du-chlordecone-aux-antilles-le-parquet-de-paris-demande-un-non-lieu_5501493.html"
"False","True","Covid-19 : l'épidémie repart en France avec ""une reprise de la circulation du virus""","https://mobile.francetvinfo.fr/sante/maladie/coronavirus/covid-19-l-epidemie-repart-en-france-avec-une-reprise-de-la-circulation-du-virus_5501637.html"
"False","True","Protection des animaux : une décision ""historique"" en faveur des requins actée au sommet pour les espèces menacées","https://mobile.francetvinfo.fr/animaux/especes-menacees/protection-des-animaux-une-decision-historique-en-faveur-des-requins-actee-au-sommet-pour-les-especes-menacees_5501730.html"
"False","True","Guerre en Ukraine : plongé dans le noir et le froid, le pays entre dans une guerre psychologique","https://mobile.francetvinfo.fr/monde/europe/manifestations-en-ukraine/guerre-en-ukraine-plonge-dans-le-noir-etle-froid-le-pays-entre-dans-une-guerrepsychologique_5498790.html"
"False","True","L'ex-députée Martine Wonner, figure des antivax, a été suspendue un an par le conseil de l'ordre des médecins du Grand Est","https://mobile.francetvinfo.fr/sante/maladie/coronavirus/vaccin/bas-rhin-l-ex-deputee-martine-wonner-figure-des-antivax-a-ete-suspendue-un-an-par-le-conseil-de-l-ordre-des-medecins_5501598.html"
"False","True","Chili : le désert d'Acatama, une splendeur de la nature devenue la décharge du monde","https://mobile.francetvinfo.fr/monde/environnement/chili-le-desert-d-acatama-une-splendeur-de-la-nature-devenue-la-decharge-du-monde_5502000.html"
"False","True","VIDÉO. Violences envers les femmes : ""Plus on milite, plus on se rend compte de l'ampleur du problème"" selon une ""colleuse"" féministe","https://mobile.francetvinfo.fr/societe/violences-faites-aux-femmes/video-violences-envers-les-femmes-plus-on-milite-plus-on-se-rend-compte-de-l-ampleur-du-probleme-selon-une-colleuse-feministe_5501052.html"
"False","True","""Job dating inversé"" : des recruteurs sarthois se présentent à des demandeurs d'emploi pour les convaincre","https://mobile.francetvinfo.fr/economie/emploi/chomage/job-dating-inverse-des-recruteurs-sarthois-se-presentent-a-des-demandeurs-d-emploi-pour-les-convaincre_5501334.html"
"False","True","À Saint-Etienne, le rappeur Méca appelle au boycott de la Coupe du monde dans son dernier single","https://mobile.francetvinfo.fr/culture/musique/rap/a-saint-etienne-le-rappeur-meca-appelle-au-boycott-de-la-coupe-du-monde-dans-son-dernier-single_5493645.html"
"False","True","À Brest, l'opération ""Posons nos smartphones"" invite les élèves d'un collège à déconnecter une heure par jour","https://mobile.francetvinfo.fr/sante/maladie/sommeil/a-brest-l-operation-posons-nos-smartphones-invite-les-eleves-d-un-college-a-deconnecter-une-heure-par-jour_5501190.html"
"False","True","Dans la Nièvre, une application à l'échelle locale pour permettre l'entraide entre les habitants","https://mobile.francetvinfo.fr/france/ilsontlasolution/dans-la-nievre-une-application-a-l-echelle-locale-pour-permettre-l-entraide-entre-les-habitants_5496006.html"
"False","True","Deux enseignants grenoblois évoluent sur la plateforme Twitch pour vulgariser la recherche scientifique en montagne","https://mobile.francetvinfo.fr/france/ilsontlasolution/deux-enseignants-grenoblois-evoluent-sur-la-plateforme-twitch-pour-vulgariser-la-recherche-scientifique-en-montagne_5492880.html"
"False","True","À Strasbourg, des paniers bio sur ordonnance pour les femmes enceintes","https://mobile.francetvinfo.fr/monde/environnement/pesticides/a-strasbourg-des-paniers-bio-sur-ordonnance-pour-les-femmes-enceintes_5493177.html"
"False","True","Strasbourg Art Photography : une déambulation artistique dans la capitale européenne","https://mobile.francetvinfo.fr/culture/arts-expos/photographie/strasbourg-art-photography-une-deambulation-artistique-dans-la-capitale-europeenne_5482671.html"
"False","True","Au Havre, des filets de pêche biodégradables pour réduire les déchets en mer","https://mobile.francetvinfo.fr/monde/environnement/biodiversite/au-havre-des-filets-de-peche-biodegradables-pour-reduire-les-dechets-en-mer_5484942.html"
"False","True","L’hommage à Aretha Franklin du groupe toulousain Natural Woman Band","https://mobile.francetvinfo.fr/culture/musique/soul/lhommage-a-aretha-franklin-du-groupe-toulousain-natural-woman-band_5485083.html"
"False","True","En Haute-Savoie, l'équithérapie au chevet des femmes blessées par le cancer","https://mobile.francetvinfo.fr/france/ilsontlasolution/en-haute-savoie-l-equitherapie-au-chevet-des-femmes-blessees-par-le-cancer_5476338.html"
"False","True","À Rouen, des robes de mariée d'occasion pour faire face à l'inflation","https://mobile.francetvinfo.fr/economie/inflation/a-rouen-des-robes-de-mariee-d-occasion-pour-faire-face-a-l-inflation_5480250.html"
"False","True","Au Mans, un restaurant solidaire propose des repas à 3 euros aux plus démunis","https://mobile.francetvinfo.fr/france/ilsontlasolution/au-mans-un-restaurant-solidaire-propose-des-repas-a-3-euros-aux-plus-demunis_5480601.html"
"False","True","Coupe du monde 2022 : comment le Danemark s'est impliqué pour la défense des droits de l'homme au Qatar","https://mobile.francetvinfo.fr/coupe-du-monde/les-aberrations-du-mondial-au-qatar/coupe-du-monde-2022-comment-le-danemark-s-est-implique-pour-la-defense-des-droits-de-l-homme-au-qatar_5498544.html"
"False","True","Guerre en Ukraine : comment la mémoire de l'Holodomor, cette famine provoquée par Staline, a façonné l'identité ukrainienne","https://mobile.francetvinfo.fr/monde/europe/manifestations-en-ukraine/guerre-en-ukraine-comment-la-memoire-de-l-holodomor-cette-famine-provoquee-par-staline-a-faconne-l-identite-ukrainienne_5492937.html"
"False","True","Comment l'application TikTok échoue à protéger ses jeunes utilisateurs de la désinformation","https://mobile.francetvinfo.fr/internet/reseaux-sociaux/comment-l-application-tiktok-echoue-a-proteger-ses-jeunes-utilisateurs-de-la-desinformation_5476152.html"
"False","True","Coupe du monde 2022 : qui sont les supporters indiens ""tombés amoureux"" de l'équipe de France ?","https://mobile.francetvinfo.fr/sports/foot/equipe-de-france/coupe-du-monde-2022-qui-sont-les-supporters-indiens-tombes-amoureux-de-l-equipe-de-france_5495943.html"
"False","True","Retraite de Roger Federer : les adieux émouvants d'une légende du tennisRoger Federer a disputé le dernier match de sa carrière, vendredi, à Londres lors de la Laver Cup.","https://mobile.francetvinfo.fr/sports/tennis/roger-federer/en-images-retraite-de-roger-federer-les-adieux-emouvants-d-une-legende-du-tennis_5378851.html"
"False","True","Corée du Sud : des veillées aux chandelles organisées en hommage aux victimes de la bousculade mortelle de SéoulDes milliers de personnes se sont rassemblées dans la capitale pour rendre hommage aux 156 victimes du mouvement de foule.","https://mobile.francetvinfo.fr/monde/coree-du-sud/en-images-coree-du-sud-des-veillees-aux-chandelles-organisees-en-souvenir-des-victimes-de-la-bousculade-mortelle-de-seoul_5459878.html"
"False","True","Foire d'art contemporain africain AKAA : quand ils créent en recyclantDans les mains de ces artistes, les déchets deviennent une matière noble à qui leur processus créatif donne une seconde vie. A découvrir jusqu'au 23 octobre 2022 à AKAA, au Carreau du Temple à...","https://mobile.francetvinfo.fr/culture/arts-expos/foire-d-art-contemporain-africain-akaa-quand-ils-creent-en-recyclant_5431069.html"
"False","True","En Iran et dans le monde, un mois de contestation après la mort de Mahsa AminiDepuis la mort de la jeune étudiante le 16 septembre à Téhéran, quelques jours après son arrestation par la police des mœurs, les manifestations ne faiblissent pas en Iran malgré la répression. Le ...","https://mobile.francetvinfo.fr/monde/iran/manifestations/en-images-en-iran-et-dans-le-monde-un-mois-de-contestation-apres-la-mort-de-mahsa-amini_5424766.html"
