"premium","picture","title","url"
"False","True","DIRECT. Législatives : le Parti socialiste souscrit aux propositions de La France insoumise","https://www.ouest-france.fr/elections/legislatives/direct-legislatives-cinq-jours-apres-la-presidentielle-les-partis-s-organisent-f4e992b8-c770-11ec-b652-736b934e29e0"
"False","True","Législatives. Les écologistes et La France insoumise proches d’un accord, selon Julien Bayou","https://www.ouest-france.fr/elections/legislatives/legislatives-les-ecologistes-et-la-france-insoumise-proches-d-un-accord-selon-julien-bayou-d84d88a0-c787-11ec-b652-736b934e29e0"
"False","True","L’économie française à plat au premier trimestre, baisse de la consommation des ménages en mars","https://www.ouest-france.fr/economie/l-economie-francaise-a-plat-au-premier-trimestre-baisse-de-la-consommation-des-menages-en-mars-f103566c-c783-11ec-b652-736b934e29e0"
"False","True","Guerre en Ukraine. Pourquoi la baisse des stocks d’armes des Occidentaux est préoccupante","https://www.ouest-france.fr/monde/guerre-en-ukraine/guerre-en-ukraine-pourquoi-la-baisse-des-stocks-d-armes-des-occidentaux-est-preoccupante-d223cec6-c70a-11ec-ba53-c551b0a4cbb1"
"True","True","REPORTAGE. Avec la guerre, des Ukrainiens contraints de fuir en Russie","https://www.ouest-france.fr/monde/guerre-en-ukraine/reportage-avec-la-guerre-des-ukrainiens-contraints-de-fuir-en-russie-6a77c402-c6f7-11ec-85c7-ebe232218271"
"False","True","Guerre en Ukraine. Au moins un mort dans une frappe russe contre Kiev pendant la visite de Guterres","https://www.ouest-france.fr/monde/guerre-en-ukraine/guerre-en-ukraine-au-moins-un-mort-dans-une-frappe-russe-contre-kiev-pendant-la-visite-de-guterres-60a1d97a-c794-11ec-b486-9552f9f8b4a2"
"False","True","Smic, RSA, tabac, impôts… Ce qui change à partir du 1er mai et ce qu’il ne faut pas oublier","https://www.ouest-france.fr/economie/smic-rsa-tabac-impots-ce-qui-change-a-partir-du-1er-mai-et-ce-qu-il-ne-faut-pas-oublier-44b5864a-c6d0-11ec-85c7-ebe232218271"
"False","True","Le journal « Ouest-France » augmente son prix de vente, on vous explique pourquoi","https://www.ouest-france.fr/les-coulisses-de-l-info/le-journal-ouest-france-augmente-son-prix-de-vente-0835a986-c60b-11ec-9d59-fb23aa78f5fe"
"False","False","Arrestation aux États-Unis du Premier ministre des Iles Vierges britanniques pour trafic de drogue","https://www.ouest-france.fr/monde/etats-unis/le-premier-ministre-des-iles-vierges-britanniques-arrete-aux-etats-unis-pour-trafic-de-drogue-fadbe69e-c77a-11ec-b652-736b934e29e0"
"True","False","Avec le changement climatique, l’Europe pourrait se passer du soja américain","https://www.ouest-france.fr/economie/agriculture/avec-le-changement-climatique-l-europe-pourrait-se-passer-du-soja-americain-143fe3c2-c539-11ec-bf64-3c5ed6d40b76"
"True","False","Julien a créé et loue un kit en bois qui transforme votre voiture en van aménagé","https://www.ouest-france.fr/pays-de-la-loire/angers-49000/angers-il-cree-un-kit-pour-transformer-sa-voiture-en-van-amenage-145b2b26-c6f8-11ec-85c7-ebe232218271"
"True","False","TÉMOIGNAGE. « Dans le football, il y a des centres de formation et des centres de formatage »","https://www.ouest-france.fr/sport/football/temoignage-cecile-traverse-les-footballeurs-sont-depossedes-d-une-part-de-leur-identite-cc9480a8-c639-11ec-9d59-fb23aa78f5fe"
"False","False","Guerre en Ukraine. L’évacuation des civils du site Azovstal, à Marioupol, envisagée pour ce vendredi","https://www.ouest-france.fr/monde/guerre-en-ukraine/guerre-en-ukraine-l-evacuation-des-civils-du-site-azovstal-a-marioupol-envisagee-pour-ce-vendredi-025b0e18-c78f-11ec-b486-9552f9f8b4a2"
"False","True","Pourquoi le risque de noyades mortelles s'annonce plus élevé cet été ?","https://www.francelive.fr/article/france-live/risque-de-penurie-de-maitres-nageurs-crainte-de-200-noyades-mortelles-en-plus-des-cette-annee-7401540/"
"True","True","REPORTAGE. Avec la guerre, des Ukrainiens contraints de fuir en Russie","https://www.ouest-france.fr/monde/guerre-en-ukraine/reportage-avec-la-guerre-des-ukrainiens-contraints-de-fuir-en-russie-6a77c402-c6f7-11ec-85c7-ebe232218271"
"False","True","Guerre en Ukraine. Au moins un mort dans une frappe russe contre Kiev pendant la visite de Guterres","https://www.ouest-france.fr/monde/guerre-en-ukraine/guerre-en-ukraine-au-moins-un-mort-dans-une-frappe-russe-contre-kiev-pendant-la-visite-de-guterres-60a1d97a-c794-11ec-b486-9552f9f8b4a2"
"True","True","« Ce n’est pas de notre faute si on est ici » : réfugiées près d’Angers, des Ukrainiennes témoignent","https://www.ouest-france.fr/pays-de-la-loire/maine-et-loire/maine-et-loire-refugies-ukrainiens-ce-n-est-pas-de-notre-faute-si-on-est-ici-dff1e85e-c713-11ec-85c7-ebe232218271"
"False","True","Guerre en Ukraine. L’évacuation des civils du site Azovstal, à Marioupol, envisagée pour ce vendredi","https://www.ouest-france.fr/monde/guerre-en-ukraine/guerre-en-ukraine-l-evacuation-des-civils-du-site-azovstal-a-marioupol-envisagee-pour-ce-vendredi-025b0e18-c78f-11ec-b486-9552f9f8b4a2"
"False","True","Guerre en Ukraine. Pourquoi la baisse des stocks d’armes des Occidentaux est préoccupante","https://www.ouest-france.fr/monde/guerre-en-ukraine/guerre-en-ukraine-pourquoi-la-baisse-des-stocks-d-armes-des-occidentaux-est-preoccupante-d223cec6-c70a-11ec-ba53-c551b0a4cbb1"
"False","True","POINT DE VUE. La réélection d’Emmanuel Macron est un soulagement pour l’Europe","https://www.ouest-france.fr/reflexion/editorial/point-de-vue-la-reelection-d-emmanuel-macron-est-un-soulagement-pour-l-europe-30dd4782-c6fa-11ec-85c7-ebe232218271"
"False","True","Qui est Bhad Bhabie, la rappeuse qui a récolté 52 millions de dollars sur internet à 19 ans ?","https://www.ouest-france.fr/leditiondusoir/2022-04-28/qui-est-bhad-bhabie-la-rappeuse-qui-a-recolte-52-millions-de-dollars-sur-internet-a-19-ans-f4465289-6337-4b15-b8e2-2223e2f8481f"
"False","True","Dans ce parc transformé en Jardin des arts, près de Rennes, de nouvelles œuvres monumentales","https://www.ouest-france.fr/culture/arts/pres-de-rennes-dans-ce-parc-transforme-en-jardin-des-arts-de-nouvelles-oeuvres-monumentales-326a0394-c649-11ec-9d59-fb23aa78f5fe"
"True","True","En Bretagne, la galette de blé noir est menacée par la guerre en Ukraine","https://www.ouest-france.fr/bretagne/en-bretagne-la-galette-de-ble-noir-est-menacee-par-la-guerre-en-ukraine-3f14f1f0-c638-11ec-9d59-fb23aa78f5fe"
"False","True","Ligne B du métro de Rennes : « pas de garantie » de l’ouverture d’ici fin mai","https://www.ouest-france.fr/bretagne/rennes-35000/ligne-b-du-metro-de-rennes-pas-de-garantie-de-l-ouverture-d-ici-fin-mai-4757afb8-c707-11ec-85c7-ebe232218271"
"False","True","Ce Breton organise le premier championnat régional de l’œuf mayonnaise","https://www.ouest-france.fr/leditiondusoir/2022-04-28/ce-breton-organise-le-premier-championnat-regional-de-l-oeuf-mayonnaise-8447bdea-a9c8-4ecd-a07e-b3e05b6c001a"
"False","True","En hommage aux 1 038 Compagnons de la Libération, il va courir 1 038 km","https://www.ouest-france.fr/normandie/en-hommage-aux-1-038-compagnons-de-la-liberation-il-va-courir-1-038-km-07a175d2-c54c-11ec-bf64-3c5ed6d40b76"
"False","True","Le nombre de demandeurs d’emploi a nettement baissé en Normandie","https://www.ouest-france.fr/normandie/le-nombre-de-demandeurs-d-emploi-a-nettement-baisse-en-normandie-0a2ce810-c6f3-11ec-85c7-ebe232218271"
"False","True","Gérald Darmanin insulté lors d’un hommage au père Hamel : l’auteur des faits condamné en appel","https://www.ouest-france.fr/politique/gerald-darmanin/darmanin-insulte-lors-d-un-hommage-au-pere-hamel-l-auteur-des-faits-condamne-par-la-cour-d-appel-d86cd442-c6f3-11ec-85c7-ebe232218271"
"False","True","Un funambule de l’extrême va tenter de battre un record du monde au Mont-Saint-Michel","https://www.ouest-france.fr/normandie/un-funambule-de-l-extreme-va-tenter-de-battre-un-record-du-monde-au-mont-saint-michel-c9a72faa-c6d7-11ec-85c7-ebe232218271"
"True","True","En Vendée, elle accouche chez elle par accident en prenant une douche","https://www.ouest-france.fr/pays-de-la-loire/les-epesses-85590/en-vendee-elle-accouche-chez-elle-par-accident-en-prenant-une-douche-0cdc8bd4-c706-11ec-934f-b17d3cbc77dc"
"False","True","Interdiction du plomb : les artisans vitraillistes s’inquiètent","https://www.ouest-france.fr/economie/artisanat/interdiction-du-plomb-les-artisans-vitraillistes-s-inquietent-a551f3e0-c567-11ec-bf64-3c5ed6d40b76"
"False","True","Cet artiste passionné de nature a vécu sept jours isolé en haut d’un chêne à Nantes, il raconte","https://www.ouest-france.fr/leditiondusoir/2022-04-28/cet-artiste-passionne-de-nature-a-vecu-sept-jours-isole-en-haut-d-un-chene-a-nantes-il-raconte-b2bdb188-c4d3-4075-bb69-f3c556a2c874"
"True","True","Les premières images du porte-avions qui va succéder au Charles-de-Gaulle ont été dévoilées","https://www.ouest-france.fr/pays-de-la-loire/saint-nazaire-44600/defense-voici-les-premieres-images-video-du-futur-porte-avions-1438900c-c49b-11ec-9bac-e092504fc1fc"
"False","True","DIRECT. Législatives : le Parti socialiste souscrit aux propositions de La France insoumise","https://www.ouest-france.fr/elections/legislatives/direct-legislatives-cinq-jours-apres-la-presidentielle-les-partis-s-organisent-f4e992b8-c770-11ec-b652-736b934e29e0"
"False","True","Législatives. LFI a trouvé un accord avec Générations, les discussions continuent à gauche","https://www.ouest-france.fr/elections/presidentielle/direct-presidentielle-le-rn-et-le-pcf-lancent-leur-campagne-pour-les-legislatives-76250b24-c55e-11ec-bf64-3c5ed6d40b76"
"False","True","Emmanuel Macron s’est rendu auprès de soldats blessés dans un hôpital militaire","https://www.ouest-france.fr/politique/emmanuel-macron/emmanuel-macron-s-est-rendu-aupres-de-soldats-blesses-dans-un-hopital-militaire-ccac6298-c721-11ec-85c7-ebe232218271"
"False","True","Présidentielle. Jean Lassalle « demande pardon » après l’annulation des votes de sa commune","https://www.ouest-france.fr/elections/presidentielle/presidentielle-jean-lassalle-demande-pardon-apres-l-annulation-des-votes-de-sa-commune-ea5379d0-c6ea-11ec-85c7-ebe232218271"
"False","True","Législatives. Quels sont les territoires gagnables pour les éventuelles alliances ?","https://www.ouest-france.fr/elections/presidentielle/cartes-legislatives-quels-sont-les-territoires-gagnables-pour-les-eventuelles-alliances-6300fcfa-c54b-11ec-bf64-3c5ed6d40b76"
"False","True","Cette start-up française teste le congé menstruel pour les femmes qui ont des règles douloureuses","https://www.ouest-france.fr/region-occitanie/labege-31670/cette-start-up-francaise-teste-le-conge-menstruel-pour-les-femmes-qui-ont-des-regles-douloureuses-7745056"
"False","False","« Affaire conclue ». Un bus itinérant pour expertiser gratuitement vos objets en Haute-Garonne","https://www.ouest-france.fr/region-occitanie/toulouse-31000/affaire-conclue-un-bus-itinerant-pour-expertiser-gratuitement-vos-objets-en-haute-garonne-7744977"
"False","False","Le chant du coq dérange le voisin, la propriétaire convoquée devant le tribunal de Tarbes","https://www.ouest-france.fr/societe/justice/le-chant-du-coq-derange-le-voisin-la-proprietaire-convoquee-devant-le-tribunal-de-tarbes-4390706a-c6fb-11ec-a959-908096d3998a"
"False","True","Les prévisions météorologiques du vendredi 29 avril 2022 à Toulon et ses environs","https://www.ouest-france.fr/meteo/provence-alpes-cote-dazur/toulon-83000/la-meteo-du-jour-a-toulon-07571c5b-9c89-55bd-801c-0a553046a3c4"
"False","False","Présidentielle. Comment ce petit village des Alpes-Maritimes s’est distingué avec des votes insolites ?","https://www.ouest-france.fr/provence-alpes-cote-dazur/nice-06000/presidentielle-comment-ce-petit-village-des-alpes-maritimes-s-est-distingue-avec-des-votes-insolites-7744748"
"False","False","La princesse Caroline de Monaco retrouve sa chienne perdue à la SPA de Salon-de-Provence","https://www.ouest-france.fr/provence-alpes-cote-dazur/salon-de-provence-13300/la-princesse-caroline-de-monaco-retrouve-sa-chienne-perdue-a-la-spa-de-salon-de-provence-7744773"
"False","True","Strasbourg - PSG. Les compos probables du match de la 35e journée de Ligue 1","https://www.ouest-france.fr/sport/football/ligue-1/strasbourg-psg-les-compos-probables-du-match-de-la-35e-journee-de-ligue-1-8f7f1cd8-c714-11ec-85c7-ebe232218271"
"False","False","Ligue 1. Les enjeux de la 35e journée : dernier espoir pour Bordeaux, la course à l’Europe…","https://www.ouest-france.fr/sport/football/ligue-1/ligue-1-les-enjeux-de-la-35e-journee-dernier-espoir-pour-bordeaux-la-course-a-l-europe-37dce0e2-c6b9-11ec-85c7-ebe232218271"
"False","False","Quel temps est prévu à Paris et ses environs le vendredi 29 avril 2022 ?","https://www.ouest-france.fr/meteo/ile-de-france/paris-75000/la-meteo-du-jour-a-paris-6248448c-1951-5847-a0bc-a2583120e362"
"False","True","Indre-et-Loire. Un bébé gravement brûlé après un accident domestique, les parents condamnés","https://www.ouest-france.fr/centre-val-de-loire/tours-37000/indre-et-loire-un-bebe-gravement-brule-apres-un-accident-domestique-les-parents-condamnes-7744903"
"False","False","Indre-et-Loire. Un phénomène météorologique « exceptionnel » observé dans le ciel de Marigny-Marmande","https://www.ouest-france.fr/centre-val-de-loire/indre-et-loire/indre-et-loire-un-phenomene-meteorologique-exceptionnel-observe-dans-le-ciel-de-marigny-marmande-7743154"
"True","False","Candes-Saint-Martin. « Les oiseaux du Grand Nord » s’exposent à la galerie Atutak","https://www.ouest-france.fr/pays-de-la-loire/montsoreau-49730/candes-saint-martin-les-oiseaux-du-grand-nord-s-exposent-a-la-galerie-atutak-fa4516cc-c614-11ec-ae71-062b9fce3b1d"
