"premium","picture","title","url"
"False","True","Rachat de Twitter par Elon Musk : on vous raconte la saga en cinq actes","https://www.ouest-france.fr/high-tech/twitter/rachat-de-twitter-par-elon-musk-on-vous-raconte-la-saga-en-cinq-actes-682490da-d2b5-11ec-9ff0-2b6a13247547"
"False","True","Une frappe israélienne fait cinq mort en Syrie","https://www.ouest-france.fr/monde/syrie/une-frappe-israelienne-fait-cinq-mort-en-syrie-418328b0-d2f1-11ec-8fd0-9941437d80ae"
"False","True","CARTE. Guerre en Ukraine : aide militaire, adhésion de la Finlande à l’Otan… Le point au 79e jour","https://www.ouest-france.fr/monde/guerre-en-ukraine/carte-guerre-en-ukraine-aide-militaire-adhesion-de-la-finlande-a-l-otan-le-point-au-79e-jour-2aa13272-d2ce-11ec-8fd0-9941437d80ae"
"False","True","Une région séparatiste de Géorgie va organiser en juillet un référendum d’intégration à la Russie","https://www.ouest-france.fr/europe/georgie/une-region-separatiste-de-georgie-va-organiser-en-juillet-un-referendum-d-integration-a-la-russie-d4d38be4-d2e4-11ec-8fd0-9941437d80ae"
"False","True","Fusillade dans le métro de New York le 12 avril : l’accusé plaide non coupable","https://www.ouest-france.fr/monde/etats-unis/new-york/fusillade-dans-le-metro-de-new-york-le-12-avril-l-accuse-plaide-non-coupable-2e6a393a-d2f6-11ec-8fd0-9941437d80ae"
"True","True","Soirées Harry Potter en Bretagne : quand la Warner s’en mêle…","https://www.ouest-france.fr/culture/people/harry-potter/soirees-harry-potter-en-bretagne-quand-la-warner-s-en-mele-35c13974-d137-11ec-8683-fd3702e27bb5"
"False","True","Météo. Un dôme de chaleur annoncé sur la France la semaine prochaine : à quoi faut-il s’attendre ?","https://www.ouest-france.fr/meteo/meteo-un-dome-de-chaleur-devrait-s-installer-sur-la-france-la-semaine-prochaine-e604a384-d2c2-11ec-8fd0-9941437d80ae"
"False","True","Qu’est-ce que la maladie rare dont a souffert Marie-Sophie Lacarrau, la star du JT de 13 h de TF1 ?","https://www.ouest-france.fr/leditiondusoir/2022-05-13/qu-est-ce-que-la-maladie-rare-dont-a-souffert-marie-sophie-lacarrau-la-star-du-jt-de-13-h-de-tf1-80e3da94-2afe-4f61-aba5-d87d96f2eb37"
"False","False","La mezzo-soprano espagnole Teresa Berganza est morte","https://www.ouest-france.fr/culture/la-mezzo-soprano-espagnole-teresa-berganza-est-morte-aa28ec12-d2f4-11ec-8fd0-9941437d80ae"
"False","False","Kendrick Lamar est devenu le plus grand rappeur de sa génération, voici comment","https://www.ouest-france.fr/leditiondusoir/2022-05-13/kendrick-lamar-est-devenu-le-plus-grand-rappeur-de-sa-generation-voici-comment-ab62bb11-88c2-41ab-9f27-cf07290a0a26"
"False","False","Deux ex-légionnaires jugés à Aix-en-Provence pour la séquestration d’un militant LGBT","https://www.ouest-france.fr/faits-divers/violences/deux-ex-legionnaires-juges-a-aix-en-provence-pour-la-sequestration-d-un-militant-lgbt-f35a57b6-d2ec-11ec-8fd0-9941437d80ae"
"False","False","Un mystérieux trou découvert en Chine laisse apparaître une forêt primitive","https://www.ouest-france.fr/leditiondusoir/2022-05-13/un-mysterieux-trou-decouvert-en-chine-laisse-apparaitre-une-foret-primitive-91f9ff10-de47-4b55-8630-89bc115da2cd"
"True","False","REPORTAGE. En Vendée, la vie au village vacances tourne au cauchemar","https://www.ouest-france.fr/pays-de-la-loire/vendee/reportage-en-vendee-la-vie-au-village-vacances-tourne-au-cauchemar-5bf2ee3e-d2c3-11ec-8fd0-9941437d80ae"
"False","False","Haute-Garonne. 20 ans de prison pour avoir tué sa cousine nonagénaire qui menaçait de le déshériter","https://www.ouest-france.fr/societe/justice/haute-garonne-20-ans-de-prison-pour-avoir-tue-sa-cousine-nonagenaire-qui-menacait-de-le-desheriter-4bf7538c-d2ee-11ec-8fd0-9941437d80ae"
"False","True","Une région séparatiste de Géorgie va organiser en juillet un référendum d’intégration à la Russie","https://www.ouest-france.fr/europe/georgie/une-region-separatiste-de-georgie-va-organiser-en-juillet-un-referendum-d-integration-a-la-russie-d4d38be4-d2e4-11ec-8fd0-9941437d80ae"
"False","True","CARTE. Guerre en Ukraine : aide militaire, adhésion de la Finlande à l’Otan… Le point au 79e jour","https://www.ouest-france.fr/monde/guerre-en-ukraine/carte-guerre-en-ukraine-aide-militaire-adhesion-de-la-finlande-a-l-otan-le-point-au-79e-jour-2aa13272-d2ce-11ec-8fd0-9941437d80ae"
"False","True","Guerre en Ukraine. Les centaines de soldats bloqués dans l’usine Azovstal seront-ils sacrifiés ?","https://www.ouest-france.fr/monde/guerre-en-ukraine/ukraine-le-dernier-carre-d-azovstal-sacrifie-adf75338-d2b8-11ec-8fd0-9941437d80ae"
"False","True","Guerre en Ukraine. La Turquie menace de bloquer l’adhésion de la Suède et de la Finlande à l’Otan","https://www.ouest-france.fr/monde/turquie/guerre-en-ukraine-la-turquie-menace-de-bloquer-l-adhesion-de-la-suede-et-de-la-finlande-a-l-otan-cda0221e-d2c2-11ec-8fd0-9941437d80ae"
"False","True","Football. Quatre clubs russes déposent un recours contre le TAS après leur exclusion par l’UEFA","https://www.ouest-france.fr/sport/football/football-quatre-clubs-russes-deposent-un-recours-contre-le-tas-apres-leur-exclusion-par-l-uefa-fddc42a2-d2b6-11ec-9ff0-2b6a13247547"
"False","True","POINT DE VUE. Quand le paysage politique se renouvelle par la gauche","https://www.ouest-france.fr/elections/legislatives/point-de-vue-quand-le-paysage-politique-se-renouvelle-par-la-gauche-943644a8-d1c4-11ec-950d-d0981e947358"
"False","True","Kendrick Lamar est devenu le plus grand rappeur de sa génération, voici comment","https://www.ouest-france.fr/leditiondusoir/2022-05-13/kendrick-lamar-est-devenu-le-plus-grand-rappeur-de-sa-generation-voici-comment-ab62bb11-88c2-41ab-9f27-cf07290a0a26"
"True","True","Soirées Harry Potter en Bretagne : quand la Warner s’en mêle…","https://www.ouest-france.fr/culture/people/harry-potter/soirees-harry-potter-en-bretagne-quand-la-warner-s-en-mele-35c13974-d137-11ec-8683-fd3702e27bb5"
"False","True","D’abord estimé entre 30 et 50 €, le violoncelle retrouvé dans une maison bretonne se vend 79 000 €","https://www.ouest-france.fr/leditiondusoir/2022-05-13/d-abord-estime-entre-30-et-50-euro-le-violoncelle-retrouve-dans-une-maison-bretonne-se-vend-79-000-euro-cace44ca-9362-4cb1-b5c0-af212d8114de"
"False","True","Dans le Morbihan, ils construisent leur maison en carton avec zéro béton","https://www.ouest-france.fr/leditiondusoir/2022-05-13/dans-le-morbihan-ils-construisent-leur-maison-en-carton-avec-zero-beton-9e93cd66-37a1-4743-a0f0-74421a96517e"
"False","True","VIDÉO. Alvan & Alhez, un groupe de Bretons en finale de l'Eurovision 2022","https://www.ouest-france.fr/medias/eurovision/video-alvan-alhez-un-groupe-de-bretons-en-finale-de-l-eurovision-2022-f03a9d31-2af4-4a25-86f0-c4291c846e43"
"True","True","Dans la Manche, les chèvres des fossés « nettoient » la falaise","https://www.ouest-france.fr/economie/agriculture/les-chevres-des-fosses-nettoient-la-falaise-8e48e042-d1c3-11ec-950d-d0981e947358"
"False","True","Près de Caen, le D-Day Wings Museum assemble un avion américain de la Seconde Guerre mondiale","https://www.ouest-france.fr/normandie/pres-de-caen-le-d-day-wings-museum-assemble-un-avion-americain-de-la-seconde-guerre-mondiale-5b02f46a-d2a5-11ec-8fd0-9941437d80ae"
"False","True","Près de Dieppe, un homme de 47 ans meurt écrasé par un arbre","https://www.ouest-france.fr/normandie/dieppe-76200/pres-de-dieppe-un-homme-de-47-ans-meurt-ecrase-par-un-arbre-4fd4e640-d2b7-11ec-9ff0-2b6a13247547"
"False","True","Chute mortelle à Étretat. La victime habitait à Courtillers dans la Sarthe","https://www.ouest-france.fr/pays-de-la-loire/courtillers-72300/chute-mortelle-a-etretat-la-victime-habitait-courtillers-dans-la-sarthe-e8257fa4-d2b2-11ec-9ff0-2b6a13247547"
"True","True","« On est complètement démunis » : l’émotion après un suicide au lycée Bellevue du Mans","https://www.ouest-france.fr/pays-de-la-loire/le-mans-72000/on-est-completement-demunis-l-emotion-apres-le-suicide-d-une-eleve-au-lycee-bellevue-du-mans-b4fd0e50-d2b5-11ec-8fd0-9941437d80ae"
"False","True","Chant insultant la mémoire de Sala : le capo de Nice interdit de stade","https://www.ouest-france.fr/sport/football/fc-nantes/chant-insultant-la-memoire-de-sala-le-capo-de-nice-interdit-de-stade-5987ccdc-d2d7-11ec-9ff0-2b6a13247547"
"True","True","Le Mans. Suicide au lycée Bellevue : l’élève « était quelqu’un d’incroyable et d’extraverti »","https://www.ouest-france.fr/pays-de-la-loire/le-mans-72000/le-mans-suicide-au-lycee-bellevue-l-eleve-etait-quelqu-un-d-incroyable-et-d-extraverti-32c63868-d2b4-11ec-8fd0-9941437d80ae"
"True","True","REPORTAGE. En Vendée, la vie au village vacances tourne au cauchemar","https://www.ouest-france.fr/pays-de-la-loire/vendee/reportage-en-vendee-la-vie-au-village-vacances-tourne-au-cauchemar-5bf2ee3e-d2c3-11ec-8fd0-9941437d80ae"
"False","True","Présidentielle. Marine Le Pen affirme qu’elle ne se représentera pas, «sauf événement exceptionnel»","https://www.ouest-france.fr/elections/presidentielle/presidentielle-marine-le-pen-affirme-qu-elle-ne-se-representera-pas-sauf-evenement-exceptionnel-9ed11b52-d2de-11ec-9ff0-2b6a13247547"
"False","True","Législatives. Cinq choses à savoir sur Manuel Bompard, candidat dans les pas de Jean-Luc Mélenchon","https://www.ouest-france.fr/elections/legislatives/legislatives-cinq-choses-a-savoir-sur-manuel-bompard-candidat-dans-les-pas-de-jean-luc-melenchon-f7858504-d28d-11ec-8fd0-9941437d80ae"
"False","True","« Le baccalauréat n’est pas galvaudé », défend Jean-Michel Blanquer","https://www.ouest-france.fr/politique/jean-michel-blanquer/le-baccalaureat-n-est-pas-galvaude-defend-jean-michel-blanquer-84df6350-d286-11ec-8fd0-9941437d80ae"
"False","True","Législatives. LREM ne présentera pas de candidat face au LR Damien Abad dans l’Ain","https://www.ouest-france.fr/elections/legislatives/legislatives-lrem-ne-presentera-pas-de-candidat-face-au-lr-damien-abad-46ac1984-d290-11ec-8fd0-9941437d80ae"
"False","True","Jean Castex a organisé son dernier dîner des ministres à Matignon","https://www.ouest-france.fr/politique/jean-castex/jean-castex-a-organise-son-dernier-diner-des-ministres-a-matignon-fdf9ea06-d27e-11ec-8fd0-9941437d80ae"
"False","True","Haute-Garonne. 20 ans de prison pour avoir tué sa cousine nonagénaire qui menaçait de le déshériter","https://www.ouest-france.fr/societe/justice/haute-garonne-20-ans-de-prison-pour-avoir-tue-sa-cousine-nonagenaire-qui-menacait-de-le-desheriter-4bf7538c-d2ee-11ec-8fd0-9941437d80ae"
"False","False","Hérault. Intoxication collective au chlore dans une piscine, 16 collégiens hospitalisés","https://www.ouest-france.fr/region-occitanie/lunel-34400/herault-intoxication-collective-au-chlore-dans-une-piscine-16-collegiens-hospitalises-7768204"
"False","False","Toulouse. Visé par des tirs, le vigile d’un centre commercial entre la vie et la mort","https://www.ouest-france.fr/region-occitanie/toulouse-31000/toulouse-le-vigile-d-un-centre-commercial-entre-la-vie-et-la-mort-apres-une-fusillade-7768032"
"False","True","Deux ex-légionnaires jugés à Aix-en-Provence pour la séquestration d’un militant LGBT","https://www.ouest-france.fr/faits-divers/violences/deux-ex-legionnaires-juges-a-aix-en-provence-pour-la-sequestration-d-un-militant-lgbt-f35a57b6-d2ec-11ec-8fd0-9941437d80ae"
"False","False","PORTRAIT. Les « clients » de cette avocate s’appellent Iboo ou Rosa, ce sont tous des animaux martyrisés","https://www.ouest-france.fr/societe/maltraitance-animale/portrait-les-clients-de-cette-avocate-s-appellent-iboo-ou-rosa-ce-sont-tous-des-animaux-martyrises-7768392"
"False","False","Législatives. Cinq choses à savoir sur Manuel Bompard, candidat dans les pas de Jean-Luc Mélenchon","https://www.ouest-france.fr/elections/legislatives/legislatives-cinq-choses-a-savoir-sur-manuel-bompard-candidat-dans-les-pas-de-jean-luc-melenchon-f7858504-d28d-11ec-8fd0-9941437d80ae"
"False","True","Propagande djihadiste : à Paris, dix ans de prison requis au procès d’un ancien détenu de Guantanamo","https://www.ouest-france.fr/terrorisme/propagande-djihadiste-a-paris-dix-ans-de-prison-requis-au-proces-d-un-ancien-detenu-de-guantanamo-16170422-d2e1-11ec-8fd0-9941437d80ae"
"False","False","Pourquoi l’œuvre de Banksy peinte sur le Bataclan est-elle au cœur d’un bras de fer juridique ?","https://www.ouest-france.fr/societe/justice/pourquoi-l-oeuvre-de-banksy-peinte-sur-le-bataclan-est-elle-au-coeur-d-un-bras-de-fer-juridique-530c4bac-d2d3-11ec-9ff0-2b6a13247547"
"False","False","VIDÉO. Avant la Gymnasiade, de jeunes sportifs ukrainiens accueillis à l'Insep","https://www.ouest-france.fr/sport/video-avant-la-gymnasiade-de-jeunes-sportifs-ukrainiens-accueillis-a-l-insep-b7a76f51-cf1f-3c6b-9c44-877b83d38a28"
"False","True","« Le baccalauréat n’est pas galvaudé », défend Jean-Michel Blanquer","https://www.ouest-france.fr/politique/jean-michel-blanquer/le-baccalaureat-n-est-pas-galvaude-defend-jean-michel-blanquer-84df6350-d286-11ec-8fd0-9941437d80ae"
"False","False","Un projet immobilier à 100 millions d'euros : Dreux va métamorphoser son ancien sanatorium","https://www.ouest-france.fr/centre-val-de-loire/dreux-28100/un-projet-immobilier-a-100-millions-d-euros-dreux-va-metamorphoser-son-ancien-sanatorium-7766723"
"False","False","Orléans. Alcoolisé, il aurait tenté de subtiliser une ambulance sous les yeux des sapeurs-pompiers","https://www.ouest-france.fr/centre-val-de-loire/orleans-45000/orleans-alcoolise-il-aurait-tente-de-subtiliser-une-ambulance-sous-les-yeux-des-sapeurs-pompiers-7766463"
