"premium","picture","title","url"
"False","True","Retraites : Macron n'exclut pas une dissolution en cas de censure à l'Assemblée, selon Dussopt","https://www.lefigaro.fr/flash-eco/retraites-macron-n-exclut-pas-une-dissolution-en-cas-de-censure-a-l-assemblee-selon-dussopt-20220929"
"False","False","Réforme des retraites : Macron temporise, sans renoncer à son objectif d'un texte pour l'été 2023","https://www.lefigaro.fr/politique/macron-temporise-sur-la-reforme-des-retraites-20220929"
"True","False","DÉCRYPTAGE - Comment la France va payer le coût du vieillissement","https://www.lefigaro.fr/social/comment-la-france-va-payer-le-cout-du-vieillissement-20220802"
"True","False","ANALYSE - Pourquoi chaque gouvernement depuis Mitterrand fait sa réforme des retraites","https://www.lefigaro.fr/politique/pourquoi-chaque-gouvernement-depuis-mitterrand-fait-sa-reforme-des-retraites-20220921"
"False","True","Transports, écoles, services publics : le point sur les perturbations en ce jour de grève","https://www.lefigaro.fr/social/greve-du-29-septembre-a-quelles-perturbations-faut-il-s-attendre-20220928"
"False","False","La rentrée sociale de la CGT s’annonce peu suivie","https://www.lefigaro.fr/social/la-rentree-sociale-de-la-cgt-s-annonce-peu-suivie-20220928"
"False","True","Nord Stream : une quatrième fuite identifiée dans un gazoduc en mer Baltique","https://www.lefigaro.fr/international/nord-stream-une-quatrieme-fuite-identifiee-dans-un-gazoduc-en-mer-baltique-20220929"
"True","False","Qui a saboté les gazoducs Nord Stream en mer Baltique?","https://www.lefigaro.fr/international/qui-a-sabote-les-gazoducs-nord-stream-en-mer-baltique-20220928"
"False","False","Nord Stream : quel sera l'impact environnemental des fuites de gaz?","https://www.lefigaro.fr/sciences/nord-stream-quel-sera-l-impact-environnemental-des-fuites-de-gaz-20220928"
"True","True","Guerre en Ukraine : pourquoi la Russie n'a aucun intérêt à faire usage de l'arme nucléaire","https://www.lefigaro.fr/international/guerre-en-ukraine-pourquoi-la-russie-n-a-aucun-interet-a-faire-usage-de-l-arme-nucleaire-20220928"
"False","False","Ukraine : les dirigeants prorusses de Lougansk, Zaporijjia et Kherson demandent à Poutine l'annexion","https://www.lefigaro.fr/flash-actu/votes-d-annexion-russe-l-ukraine-reclame-une-hausse-significative-de-l-aide-militaire-occidentale-20220928"
"True","False","Ukraine : «À travers ces référendums fantoches, la Russie vient de signifier qu'elle ira jusqu'au bout»","https://www.lefigaro.fr/international/ukraine-a-travers-ces-referendums-fantoches-la-russie-vient-de-signifier-qu-elle-ira-jusqu-au-bout-20220928"
"True","True","Comment l'Iran a fait du voile l'étendard de l'islamisme et comment l'Occident ne comprend rien depuis quarante ans","https://www.lefigaro.fr/vox/monde/comment-l-iran-a-fait-du-voile-l-etendard-de-l-islamisme-et-comment-l-occident-ne-comprend-rien-depuis-quarante-ans-20220928"
"True","True","À Saint-Étienne, le destin politique de Gaël Perdriau englué dans le scandale de la «sextape»","https://www.lefigaro.fr/politique/a-saint-etienne-le-destin-politique-de-gael-perdriau-embourbe-dans-le-scandale-de-la-sextape-20220928"
"False","True","Floride : l'ouragan Ian touche terre, un million de foyers privés d'électricité et des «inondations catastrophiques»","https://www.lefigaro.fr/international/la-floride-se-prepare-a-l-impact-imminent-de-l-ouragan-historique-ian-20220928"
"True","True","Pornographie: la chute du sordide empire «French Bukkake»","https://www.lefigaro.fr/actualite-france/pornographie-la-chute-du-sordide-empire-french-bukkake-20220928"
"True","False","Pornographie en ligne : comment protéger vos enfants ?","https://www.lefigaro.fr/secteur/high-tech/pornographie-en-ligne-comment-proteger-vos-enfants-20220928"
"True","False","DÉCRYPTAGE - Les ravages d'une génération «biberonnée au porno»","https://www.lefigaro.fr/actualite-france/porno-l-enfer-du-decor-le-puissant-cri-d-alarme-des-senatrices-sur-une-industrie-qui-erige-la-violence-en-norme-20220927"
"True","True","La mosquée salafiste d'Obernai dans le viseur de Beauvau","https://www.lefigaro.fr/actualite-france/la-mosquee-salafiste-d-obernai-dans-le-viseur-de-beauvau-20220928"
"True","True","Les autorités s'attaquent au business lucratif des influenceurs financiers","https://www.lefigaro.fr/medias/les-autorites-s-attaquent-au-business-lucratif-des-influenceurs-financiers-20220929"
"False","True","Entre vents extrêmement puissants et pluies torrentielles, l'ouragan Ian laisse une Amérique dévastée","https://www.lefigaro.fr/international/entre-vents-extremement-puissants-et-pluies-torrentielles-l-ouragan-ian-laisse-une-amerique-devastee-20220929"
"True","True","Eugénie Bastié: «Comment l’antiracisme a réinventé le racisme»","https://www.lefigaro.fr/vox/societe/eugenie-bastie-comment-l-antiracisme-a-reinvente-le-racisme-20220928"
"True","True","Loyers impayés : ces aberrations qui rendent fous les propriétaires","https://www.lefigaro.fr/conjoncture/loyers-impayes-ces-aberrations-qui-rendent-fous-les-proprietaires-20220928"
"False","True","Coolio, le rappeur auteur de Gangsta's Paradise, est mort à 59 ans","https://www.lefigaro.fr/flash-actu/le-rappeur-americain-coolio-est-mort-a-59-ans-20220929"
"False","False","Reprise des soins à l'hôpital de Brest après une panne informatique","https://www.lefigaro.fr/flash-actu/reprise-des-soins-a-l-hopital-de-brest-apres-une-panne-informatique-20220929"
"False","False","Le maire de Metz hospitalisé après un «petit AVC»","https://www.lefigaro.fr/flash-actu/le-maire-de-metz-hospitalise-apres-un-petit-avc-20220929"
"False","False","Kaaris, accusé de violences conjugales, libéré de garde à vue","https://www.lefigaro.fr/culture/kaaris-accuse-de-violences-conjugales-libere-de-garde-a-vue-20220929"
"False","False","Paris condamne les frappes «indiscriminées» au Kurdistan d'Irak","https://www.lefigaro.fr/flash-actu/paris-condamne-les-frappes-indiscriminees-au-kurdistan-d-irak-20220929"
"False","False","Porsche entre en Bourse au cours de 84 euros à Francfort","https://www.lefigaro.fr/societes/porsche-entre-en-bourse-au-cours-de-84-euros-a-francfort-20220929"
"False","False","Australie: le plus grand émetteur de carbone va abandonner le charbon d'ici 2035","https://www.lefigaro.fr/societes/australie-le-plus-grand-emetteur-de-carbone-va-abandonner-le-charbon-d-ici-2035-20220929"
"False","False","Bardella annonce qu'il poursuivra en diffamation «ceux qui insinuent» que le RN entretient des liens avec la Russie","https://www.lefigaro.fr/politique/bardella-annonce-qu-il-poursuivra-en-diffamation-ceux-qui-insinuent-que-le-rn-entretient-des-liens-avec-la-russie-20220929"
"False","False","Retraites : Macron n'exclut pas une dissolution en cas de censure à l'Assemblée, selon Dussopt","https://www.lefigaro.fr/flash-eco/retraites-macron-n-exclut-pas-une-dissolution-en-cas-de-censure-a-l-assemblee-selon-dussopt-20220929"
"False","False","Foot : les troublantes révélations de Libération sur Nasser al-Khelaïfi, président du PSG","https://www.lefigaro.fr/sports/football/foot-les-troublantes-revelations-de-liberation-sur-nasser-al-khelaifi-president-du-psg-20220929"
"False","False","Deux Somaliennes et une Ukrainienne parmi les lauréats du prix Right Livelihood","https://www.lefigaro.fr/flash-actu/deux-somaliennes-et-une-ukrainienne-parmi-les-laureats-du-prix-right-livelihood-20220929"
"False","False","Afghanistan : des talibans tirent en l'air pour disperser une manifestation de soutien aux femmes iraniennes","https://www.lefigaro.fr/flash-actu/afghanistan-des-talibans-tirent-en-l-air-pour-disperser-une-manifestation-de-soutien-aux-femmes-iraniennes-20220929"
"False","False","Nord Stream : une quatrième fuite identifiée dans un gazoduc en mer Baltique","https://www.lefigaro.fr/international/nord-stream-une-quatrieme-fuite-identifiee-dans-un-gazoduc-en-mer-baltique-20220929"
"False","False","Brésil: enquête sur un document dénonçant des failles supposées dans le système de vote","https://www.lefigaro.fr/flash-actu/bresil-enquete-sur-un-document-denoncant-des-failles-supposees-dans-le-systeme-de-vote-20220929"
"False","False","Birmanie : Aung San Suu Kyi condamnée à trois ans de prison pour violation de secrets d'État","https://www.lefigaro.fr/international/birmanie-aung-san-suu-kyi-condamnee-a-3-ans-de-prison-supplementaires-20220929"
"False","False","Trois morts et 14 blessés après l'effondrement d'un pont au Brésil","https://www.lefigaro.fr/flash-actu/trois-morts-et-14-blesses-apres-l-effondrement-d-un-pont-au-bresil-20220929"
"False","False","Génocide au Rwanda: le procès de Félicien Kabuga s'ouvre à La Haye","https://www.lefigaro.fr/flash-actu/genocide-au-rwanda-le-proces-de-felicien-kabuga-s-ouvre-a-la-haye-20220929"
"False","False","Nicaragua : Daniel Ortega qualifie l'Eglise catholique de «dictature»","https://www.lefigaro.fr/flash-actu/nicaragua-daniel-ortega-qualifie-l-eglise-catholique-de-dictature-20220929"
"False","False","La Bosnie aux urnes en pleine crise existentielle","https://www.lefigaro.fr/flash-actu/la-bosnie-aux-urnes-en-pleine-crise-existentielle-20220929"
"False","False","États-Unis vs Russie: bataille pour la direction de l'agence des télécoms de l'ONU","https://www.lefigaro.fr/flash-eco/etats-unis-vs-russie-bataille-pour-la-direction-de-l-agence-des-telecoms-de-l-onu-20220929"
"False","False","Coolio, le rappeur auteur de Gangsta's Paradise, est mort à 59 ans","https://www.lefigaro.fr/flash-actu/le-rappeur-americain-coolio-est-mort-a-59-ans-20220929"
"False","False","La vice-présidente américaine Kamala Harris arrive en Corée du Sud","https://www.lefigaro.fr/flash-actu/la-vice-presidente-americaine-kamala-harris-arrive-en-coree-du-sud-20220929"
"False","False","Amnesty: en Birmanie, Facebook «doit des réparations» aux Rohingyas","https://www.lefigaro.fr/flash-actu/birmanie-facebook-doit-des-reparations-aux-rohingyas-pour-avoir-laisse-se-propager-la-haine-20220929"
"False","False","Création de 200 brigades de gendarmerie: Darmanin lance la consultation","https://www.lefigaro.fr/flash-actu/creation-de-200-brigades-de-gendarmerie-darmanin-lance-la-consultation-jeudi-20220929"
"False","False","Le bilan des inondations au Venezuela passe à 10 morts et 3 disparus","https://www.lefigaro.fr/flash-actu/le-bilan-des-inondations-au-venezuela-passe-a-10-morts-et-3-disparus-20220929"
"False","False","Alcool frelaté: 19 morts dans le nord du Maroc","https://www.lefigaro.fr/flash-actu/alcool-frelate-19-morts-dans-le-nord-du-maroc-20220929"
"False","False","Ebola en Ouganda : pas de confinement nécessaire, annonce le président Museveni","https://www.lefigaro.fr/flash-actu/ebola-en-ouganda-pas-de-confinement-necessaire-annonce-le-president-museveni-20220928"
