"premium","picture","title","url"
"False","True","""Bien-sûr"": Éric Zemmour envisage des meetings communs avec Marine Le Pen entre les deux tours","https://www.bfmtv.com/politique/bien-sur-eric-zemmour-envisage-des-meetings-communs-avec-marine-le-pen-entre-les-deux-tours_AV-202203300200.html"
"False","True","EN DIRECT - Présidentielle J-11: Grand oral des candidats sur l'agriculture, dernière ligne droite avant le…","https://www.bfmtv.com/politique/elections/presidentielle/en-direct-presidentielle-j-11-grand-oral-des-candidats-sur-l-agriculture-derniere-ligne-droite-avant-le-premier-tour_LN-202203300066.html"
"False","True","Présidentielle J-11: tout ce qu'il faut savoir pour voter par procuration","https://www.bfmtv.com/politique/elections/presidentielle/presidentielle-j-11-tout-ce-qu-il-faut-savoir-pour-voter-par-procuration_AN-202203300007.html"
"False","True","Guerre en Ukraine: entre avancées notables et scepticisme, où en sont les négociations?","https://www.bfmtv.com/international/europe/guerre-en-ukraine-entre-avancees-notables-et-scepticisme-ou-en-sont-les-negociations_AV-202203300198.html"
"False","True","EN DIRECT - Tcherniguiv bombardée ""toute la nuit"", malgré les promesses russes, selon le gouverneur","https://www.bfmtv.com/international/en-direct-guerre-en-ukraine-zelensky-evoque-des-signaux-positifs-lors-des-pourparlers-russo-ukrainiens-suivez-le-conflit_LN-202203300014.html"
"False","True","Guerre en Ukraine: ce que se sont dit Macron et Poutine lors de leur entretien téléphonique ce mardi","https://www.bfmtv.com/international/europe/guerre-en-ukraine-ce-que-se-sont-dit-macron-et-poutine-lors-de-leur-entretien-telephonique-ce-mardi_AN-202203290561.html"
"False","True","Guerre en Ukraine: Washington évoque un ""repositionnement"" des russes près de Kiev, pas un ""retrait""","https://www.bfmtv.com/international/europe/guerre-en-ukraine-washington-evoque-un-repositionnement-des-russes-pres-de-kiev-pas-un-retrait_AD-202203290625.html"
"False","True","Donald Trump appelle Vladimir Poutine à publier des informations sur le fils de Joe Biden","https://www.bfmtv.com/international/amerique-nord/etats-unis/trump-veut-que-poutine-publie-des-informations-sur-le-fils-de-biden_AN-202203300018.html"
"False","True","""Les Russes étaient partout"": à Irpin, les Ukrainiens racontent l'occupation","https://www.bfmtv.com/international/les-russes-etaient-partout-a-irpin-les-ukrainiens-racontent-l-occupation_AN-202203300045.html"
"False","False","Irpin, une victoire plus symbolique que stratégique pour l'armée ukrainienne","https://www.bfmtv.com/international/irpin-une-victoire-plus-symbolique-que-strategique-pour-l-armee-ukrainienne_AV-202203290283.html"
"False","True","En covoiturage, à vélo ou à cheval: ces Français s'organisent face à la hausse du prix de l'essence","https://www.bfmtv.com/auto/en-covoiturage-a-velo-ou-a-cheval-ces-francais-s-organisent-face-a-la-hausse-du-prix-de-l-essence_AN-202203300003.html"
"False","True","Les premiers chèques énergie sont envoyés dès ce mercredi: êtes-vous concernés?","https://www.bfmtv.com/economie/entreprises/energie/les-premiers-cheques-energie-sont-envoyes-des-ce-mercredi-etes-vous-concernes_AV-202203300022.html"
"False","True","Les travailleurs ne demandent pas la charité, ils ne veulent pas l'aumône. Ils veulent vivre dignement de leur travail. Nathalie Arthaud, candidate Lutte ouvrière à la présidentielle","https://www.bfmtv.com/politique/elections/presidentielle/pouvoir-d-achat-nathalie-arthaud-refuse-l-aumone-d-emmanuel-macron_AV-202203290249.html"
"False","True","EN DIRECT - Assassinat d'Yvan Colonna: le directeur de la prison d'Arles auditionné ce…","https://www.bfmtv.com/police-justice/en-direct-assassinat-d-yvan-colonna-le-directeur-de-la-prison-d-arles-auditionne-ce-mercredi_LN-202203300174.html"
"False","True","Où va-t-il neiger en cette fin de semaine?","https://www.bfmtv.com/meteo/ou-va-t-il-neiger-en-cette-fin-de-semaine_AV-202203300051.html"
"False","True","Israël: ce que l'on sait de l'attaque terroriste près de Tel Aviv qui a fait 5 morts","https://www.bfmtv.com/international/israel-ce-que-l-on-sait-de-l-attaque-terroriste-pres-de-tel-aviv-qui-a-fait-5-morts_AV-202203300183.html"
"False","True","Covid-19: les contaminations toujours en hausse, tout comme les hospitalisations","https://www.bfmtv.com/sante/covid-19-les-contaminations-toujours-en-hausse-tout-comme-les-hospitalisations_AD-202203290591.html"
"False","True","""Sur le coup, je n'ai pas mesuré l'importance de ce moment"": un photographe qui a saisi…","https://www.bfmtv.com/people/sur-le-coup-je-n-ai-pas-mesure-l-importance-de-ce-moment-un-photographe-qui-a-saisi-la-gifle-de-will-smith-raconte_AN-202203300199.html"
"False","True","France-Afrique du Sud: les Bleus s'offrent un festival, Mbappé et Giroud brillent","https://rmcsport.bfmtv.com/football/equipe-de-france/france-afrique-du-sud-les-bleus-s-offrent-un-festival-mbappe-et-giroud-brillent_AV-202203290639.html"
"False","True","""Je savais que je n'allais pas me faire exploser"": interrogé sur le 13-Novembre, Mohamed…","https://www.bfmtv.com/police-justice/je-savais-que-je-n-allais-pas-me-faire-exploser-interroge-sur-le-13-novembre-mohamed-abrini-peine-a-convaincre_AN-202203290596.html"
"False","True","Perpignan: un professeur victime d'insultes et d'actes homophobes dénonce l'inaction de…","https://www.bfmtv.com/police-justice/perpignan-un-professeur-victime-d-insultes-et-d-actes-homophobes-denonce-l-inaction-de-l-education-nationale_AN-202203290567.html"
"False","True","TOUT COMPRENDRE - L'affaire des cabinets de conseil qui parasite la campagne d'Emmanuel…","https://www.bfmtv.com/economie/economie-social/france/tout-comprendre-l-affaire-des-cabinets-de-conseils-qui-parasite-la-campagne-d-emmanuel-macron_AV-202203280447.html"
"False","True","Où va-t-il neiger en cette fin de semaine?","https://www.bfmtv.com/meteo/ou-va-t-il-neiger-en-cette-fin-de-semaine_AV-202203300051.html"
"False","True","Famille française défenestrée en Suisse: la police locale privilégie la piste du suicide…","https://www.bfmtv.com/police-justice/famille-francaise-defenestree-en-suisse-la-police-locale-privilegie-la-piste-du-suicide-collectif_AN-202203290268.html"
"False","True","Pourquoi les boulangers vont être contraints d'augmenter le prix de la baguette","https://www.bfmtv.com/economie/consommation/pourquoi-les-boulangers-vont-etre-contraints-d-augmenter-le-prix-de-la-baguette_AV-202203290330.html"
"False","True","Arnaque à l'Assurance maladie: attention à ce SMS alertant sur l'expiration de votre…","https://www.bfmtv.com/tech/arnaque-a-l-assurance-maladie-attention-a-ce-sms-alertant-sur-l-expiration-de-votre-carte-vitale_AN-202203290293.html"
"False","True","Les fabricants de produits laitiers frais réclament aux distributeurs des hausses de prix de 14 à 16%","https://www.bfmtv.com/economie/entreprises/industries/les-fabricants-de-produits-laitiers-frais-reclament-aux-distributeurs-des-hausses-de-prix-de-14-a-16_AV-202203300195.html"
"False","True","Guerre en Ukraine: Free et SFR offrent un forfait mobile aux Ukrainiens résidant en France","https://www.bfmtv.com/tech/guerre-en-ukraine-free-et-sfr-offrent-un-forfait-mobile-aux-ukrainiens-residant-en-france_AN-202203300190.html"
"False","True","Tournesol: le groupe agroalimentaire Avril s'inquiète pour le prix de ses approvisionnements","https://www.bfmtv.com/economie/tournesol-le-groupe-agroalimentaire-avril-s-inquiete-pour-le-prix-de-ses-approvisionnements_AV-202203300179.html"
"False","True","En Espagne, l'inflation atteint son plus haut niveau depuis 37 ans","https://www.bfmtv.com/economie/economie-social/union-europeenne/en-espagne-l-inflation-atteint-son-plus-haut-niveau-depuis-37-ans_AD-202203300150.html"
"False","True","Inflation: le patron des Mousquetaires dénonce certains industriels ""profiteurs"" de la crise","https://www.bfmtv.com/economie/entreprises/industries/inflation-le-patron-des-mousquetaires-denonce-certains-industriels-profiteurs-de-la-crise_AV-202203300145.html"
"False","False","Candidats","https://www.bfmtv.com/politique/elections/presidentielle/election-presidentielle-2022-qui-sont-les-candidats-declares_GN-202201100009.html"
"False","False","Sondages","https://www.bfmtv.com/politique/elections/presidentielle/tous-les-sondages-de-l-election-presidentielle-2022_GN-202110220314.html"
"False","True","""Bien-sûr"": Éric Zemmour envisage des meetings communs avec Marine Le Pen entre les deux tours","https://www.bfmtv.com/politique/bien-sur-eric-zemmour-envisage-des-meetings-communs-avec-marine-le-pen-entre-les-deux-tours_AV-202203300200.html"
"False","True","Questions de confiance : Pourquoi la curiosité suscitée par Éric Zemmour est-elle retombée ? - 30/03","https://www.bfmtv.com/replay-emissions/bourdin-direct/questions-de-confiance-pourquoi-la-curiosite-suscitee-par-eric-zemmour-est-elle-retombee-30-03_VN-202203300155.html"
"False","True","Élection présidentielle 2022: qui sont les 12 candidats?","https://www.bfmtv.com/politique/elections/presidentielle/election-presidentielle-2022-qui-sont-les-candidats-declares_GN-202201100009.html"
"False","True","EN DIRECT - Présidentielle J-11: Grand oral des candidats sur l'agriculture, dernière ligne droite avant le premier tour","https://www.bfmtv.com/politique/elections/presidentielle/en-direct-presidentielle-j-11-grand-oral-des-candidats-sur-l-agriculture-derniere-ligne-droite-avant-le-premier-tour_LN-202203300066.html"
"False","True","Présidentielle J-11: tout ce qu'il faut savoir pour voter par procuration","https://www.bfmtv.com/politique/elections/presidentielle/presidentielle-j-11-tout-ce-qu-il-faut-savoir-pour-voter-par-procuration_AN-202203300007.html"
"False","True","Coupe du monde 2022: on connaît les têtes de série pour le tirage au sort","https://rmcsport.bfmtv.com/football/coupe-du-monde/coupe-du-monde-2022-on-connait-les-tetes-de-serie-pour-le-tirage-au-sort_AV-202203300010.html"
"False","True","Coupe du monde: Ibrahimovic, Mahrez, Salah, Osimhen... ces stars qui vont manquer le Mondial","https://rmcsport.bfmtv.com/football/coupe-du-monde/coupe-du-monde-ibrahimovic-mahrez-salah-osimhen-ces-stars-qui-vont-manquer-le-mondial_AV-202203300144.html"
"False","True","Equipe de France: Deschamps garde la porte ouverte pour Giroud","https://rmcsport.bfmtv.com/football/equipe-de-france/equipe-de-france-deschamps-garde-la-porte-ouverte-pour-giroud_AV-202203300034.html"
"False","True","Algérie-Cameroun: ""Ils ne nous respectent pas"", Belmadi charge les arbitres après l’élimination","https://rmcsport.bfmtv.com/football/coupe-du-monde/algerie-cameroun-ils-ne-nous-respectent-pas-belmadi-charge-les-arbitres-apres-l-elimination_AN-202203300080.html"
"False","True","PSG: Messi décroche un gros contrat avec une société de cryptomonnaie","https://rmcsport.bfmtv.com/football/ligue-1/psg-messi-decroche-un-gros-contrat-avec-une-societe-de-cryptomonnaie_AV-202203300008.html"
"False","True","Guerre en Ukraine : la peur fait émerger un marché des bunkers pour les particuliers en France","https://www.bfmtv.com/immobilier/guerre-en-ukraine-la-peur-fait-emerger-un-marche-des-bunkers-pour-les-particuliers-en-france_AV-202203110281.html"
"False","True","Grâce à des tests ADN en kit, ils ont découvert le secret de leurs origines","https://www.bfmtv.com/societe/il-parait-qu-on-se-ressemble-ils-ont-decouvert-le-secret-de-leurs-origines-grace-a-des-tests-adn-en-kit_GN-202202090006.html"
"False","True","""Comme une fumeuse, je ressens très vite le manque"" : ils sont accros au sport","https://www.bfmtv.com/societe/comme-une-fumeuse-je-ressens-tres-vite-le-manque-ils-sont-accros-au-sport_GN-202202040014.html"
"False","True","Transition énergétique : la France avance en terrain minier","https://www.bfmtv.com/economie/entreprises/industries/transition-energetique-la-france-avance-en-terrain-minier_GN-202112020044.html"
"False","True","""Ça permet de s'évader"" : sur Tiktok, ces détenus racontent leur quotidien en prison","https://www.bfmtv.com/police-justice/ca-permet-de-s-evader-sur-tiktok-ces-detenus-racontent-leur-quotidien-en-prison_GN-202112080019.html"
"False","True","""J'ai juste ouvert ma porte"" : le 13 Novembre, ils ont accueilli chez eux des victimes des attenats","https://www.bfmtv.com/police-justice/terrorisme/j-ai-juste-ouvert-ma-porte-le-13-novembre-ils-ont-accueilli-chez-eux-des-victimes-des-attentats_GN-202110060005.html"
"False","True","""Moon Knight"", nouvelle série de Marvel avec un super-héros atypique","https://www.bfmtv.com/people/series/moon-knight-nouvelle-serie-de-marvel-avec-un-super-heros-atypique_AV-202203300204.html"
