"premium","picture","title","url"
"False","True","DIRECT - Tournée d'automne : carton rouge pour les Sud-Africains menés 6-0","https://www.lefigaro.fr/sports/rugby/live/test-match/2023/931629/france-afrique-du-sud"
"False","False","Rugby : où voir France-Afrique du Sud et cinq choses à savoir sur le choc contre les champions du monde","https://www.lefigaro.fr/sports/rugby/xv-de-france/rugby-ou-voir-france-afrique-du-sud-et-cinq-choses-a-savoir-sur-le-choc-contre-les-champions-du-monde-20221111"
"True","False","Rugby: France-Afrique du Sud, il y a du KO dans l’air","https://www.lefigaro.fr/sports/rugby/xv-de-france/france-afrique-du-sud-il-y-a-du-ko-dans-l-air-20221111"
"True","False","XV de France: les Springboks, une usine à produire des monstres en 2e ligne","https://www.lefigaro.fr/sports/rugby/xv-de-france/xv-de-france-les-springboks-une-usine-a-produire-des-monstres-en-2e-ligne-20221111"
"False","True","Deux immeubles se sont effondrés en plein centre de Lille, une personne portée disparue","https://www.lefigaro.fr/actualite-france/deux-immeubles-se-sont-effondres-en-plein-centre-de-lille-20221112"
"True","True","Cryptomonnaies : la chute de Sam Bankman-Fried, l'ex-milliardaire de FTX, désormais ruiné","https://www.lefigaro.fr/secteur/high-tech/cryptomonnaies-la-chute-de-sam-bankman-fried-l-ex-milliardaire-de-ftx-desormais-ruine-20221112"
"False","False","La plateforme de cryptomonnaies FTX en faillite aux États-Unis, son patron démissionne","https://www.lefigaro.fr/secteur/high-tech/la-plateforme-de-cryptomonnaies-ftx-en-faillite-aux-etats-unis-son-patron-demissionne-20221111"
"True","True","La grande flemme : comment la France perd le goût de l’effort","https://www.lefigaro.fr/actualite-france/la-grande-flemme-comment-la-france-perd-le-gout-de-l-effort-20221111"
"False","True","Var : une jeune fille avec une trottinette décède percutée par un train TGV","https://www.lefigaro.fr/faits-divers/var-une-jeune-fille-avec-une-trottinette-decede-percutee-par-un-train-tgv-20221112"
"True","True","Les secrets des couples qui se renouvellent : «Il y a trois ingrédients essentiels à mettre entre deux conjoints»","https://madame.lefigaro.fr/bien-etre/psycho/les-secrets-des-couples-qui-se-renouvellent-il-y-a-trois-ingredients-essentiels-a-mettre-entre-deux-conjoints-20221110"
"False","True","Nord : des migrants caillassent des policiers qui tentent d'empêcher une traversée de la Manche","https://www.lefigaro.fr/actualite-france/nord-des-migrants-caillassent-des-policiers-qui-tentent-d-empecher-une-traversee-de-la-manche-20221112"
"True","True","L'exode des ultra-riches : ils quittent New York pour les paradis fiscaux de la Floride et de Porto Rico","https://www.lefigaro.fr/international/l-exode-des-ultra-riches-ils-quittent-new-york-pour-les-paradis-fiscaux-de-la-floride-et-de-porto-rico-20211105"
"False","True","DIRECT – Ligue 1 : suivez Rennes-Toulouse","https://www.lefigaro.fr/sports/football/live/ligue-1/2022/2295591/rennes-toulouse"
"False","False","Tops/Flops Lens - Clermont : le grand 8 pour les Sang et Or face à des Auvergnats inoffensifs","https://www.lefigaro.fr/sports/football/ligue-1/tops-flops-lens-clermont-les-sangs-et-or-pour-le-grand-8-face-a-des-auvergnats-inoffensifs-20221112"
"True","True","Ce que cache la multiplication des restaurants aux façades fleuries","https://www.lefigaro.fr/conjoncture/ce-que-cache-la-multiplication-des-restaurants-aux-facades-fleuries-20221110"
"False","False","Seine-Saint-Denis: un adolescent entre la vie et la mort après une agression","https://www.lefigaro.fr/faits-divers/seine-saint-denis-un-adolescent-entre-la-vie-et-la-mort-apres-une-agression-20221112"
"True","True","Jean Staune: «Matrix et la physique quantique nous aident à comprendre qui est vraiment Jésus»","https://www.lefigaro.fr/vox/religion/jean-staune-matrix-et-la-physique-quantique-nous-aident-a-comprendre-qui-est-vraiment-jesus-20221111"
"True","True","Sept Français détenus en Iran","https://www.lefigaro.fr/international/sept-francais-detenus-en-iran-20221111"
"False","False","Iran : au moins 326 manifestants tués, selon un nouveau bilan d'IHR","https://www.lefigaro.fr/international/iran-au-moins-326-manifestants-tues-selon-un-nouveau-bilan-d-ihr-20221112"
"True","True","Édouard Baer: «Je rêve d'être à l'aise partout, comme un prince ou un gitan»","https://www.lefigaro.fr/theatre/edouard-baer-je-reve-d-etre-a-l-aise-partout-comme-un-prince-ou-un-gitan-20221111"
"False","False","Poutine évoque avec Raïssi une «intensification» de la coopération Russie-Iran","https://www.lefigaro.fr/flash-actu/poutine-evoque-avec-raissi-une-intensification-de-la-cooperation-russie-iran-20221112"
"False","False","Arménie-Azerbaïdjan: Macron et Aliev veulent «maintenir une étroite coordination»","https://www.lefigaro.fr/flash-actu/armenie-azerbaidjan-macron-et-aliev-veulent-maintenir-une-etroite-coordination-20221112"
"False","False","L'État malien honore un juge islamique ayant officié pour les jihadistes à Tombouctou","https://www.lefigaro.fr/flash-actu/l-etat-malien-honore-un-juge-islamique-ayant-officie-pour-les-jihadistes-a-tombouctou-20221112"
"False","False","Quinze ans de prison requis contre la fondatrice de Theranos","https://www.lefigaro.fr/secteur/high-tech/quinze-ans-de-prison-requis-contre-la-fondatrice-de-theranos-20221112"
"False","False","Manifestation à Berlin pour une taxation des riches et l'encadrement des prix","https://www.lefigaro.fr/flash-eco/manifestation-a-berlin-pour-une-taxation-des-riches-et-l-encadrement-des-prix-20221112"
"False","False","Martinique: un préfet en renfort pour lutter contre les violences armées","https://www.lefigaro.fr/flash-actu/martinique-un-prefet-en-renfort-pour-lutter-contre-les-violences-armees-20221112"
"False","False","Route du rhum : Caudrelier plus que jamais sous la pression de Gabart","https://www.lefigaro.fr/sports/voile/route-du-rhum/route-du-rhum-caudrelier-plus-que-jamais-sous-pression-par-gabart-20221112"
"False","False","Stations de ski : la saison s'annonce prometteuse, malgré une hausse du prix des forfaits","https://www.lefigaro.fr/conjoncture/stations-de-ski-la-saison-s-annonce-prometteuse-malgre-une-hausse-du-prix-des-forfaits-20221112"
"False","False","Un orage paralyse l'aéroport de Valence en Espagne","https://www.lefigaro.fr/flash-eco/un-orage-paralyse-l-aeroport-de-valence-en-espagne-20221112"
"False","False","Seine-Saint-Denis: un adolescent entre la vie et la mort après une agression","https://www.lefigaro.fr/faits-divers/seine-saint-denis-un-adolescent-entre-la-vie-et-la-mort-apres-une-agression-20221112"
"False","False","Var : une jeune fille avec une trottinette décède percutée par un train TGV","https://www.lefigaro.fr/faits-divers/var-une-jeune-fille-avec-une-trottinette-decede-percutee-par-un-train-tgv-20221112"
"False","False","Iran : au moins 326 manifestants tués, selon un nouveau bilan d'IHR","https://www.lefigaro.fr/international/iran-au-moins-326-manifestants-tues-selon-un-nouveau-bilan-d-ihr-20221112"
"False","False","Retraites : le Sénat vote une réforme et met la pression sur le gouvernement","https://www.lefigaro.fr/conjoncture/retraites-le-senat-vote-une-reforme-et-met-la-pression-sur-le-gouvernement-20221112"
"False","False","Égypte: au moins 19 morts dans un accident de minibus","https://www.lefigaro.fr/flash-actu/egypte-au-moins-19-morts-dans-un-accident-de-minibus-20221112"
"False","False","Nouveau lapsus de Joe Biden qui confond le Cambodge et la Colombie","https://www.lefigaro.fr/international/nouveau-lapsus-de-joe-biden-qui-confond-le-cambodge-et-la-colombie-20221112"
"False","False","Policier tué à Bruxelles: l'hôpital assure n'avoir «jamais été informé» de la dangerosité du suspect","https://www.lefigaro.fr/international/policier-tue-a-bruxelles-l-hopital-assure-n-avoir-jamais-ete-informe-de-la-dangerosite-du-suspect-20221112"
"False","False","L'Ocean Viking a quitté Toulon, le débarquement des migrants étant terminé","https://www.lefigaro.fr/actualite-france/l-ocean-viking-a-quitte-toulon-le-debarquement-des-migrants-etant-termine-20221112"
"False","False","La Turquie nomme un ambassadeur en Israël après quatre ans de vacance","https://www.lefigaro.fr/flash-actu/la-turquie-nomme-un-ambassadeur-en-israel-apres-quatre-ans-de-vacance-20221112"
"False","False","Londres se réjouit du «nouvel échec stratégique» russe en Ukraine","https://www.lefigaro.fr/international/londres-se-rejouit-du-nouvel-echec-strategique-russe-en-ukraine-20221112"
"False","False","Basket : faute de sécurité, l'Australie n'ira pas en Iran","https://www.lefigaro.fr/sports/basket/basket-faute-de-securite-l-australie-n-ira-pas-en-iran-20221112"
"False","False","Rappel de sachets de haricots verts au mauvais goût, contenant des traces d'hydrocarbures","https://www.lefigaro.fr/conso/rappel-de-sachets-de-haricots-verts-au-mauvais-gout-contenant-des-traces-d-hydrocarbures-20221112"
"False","False","RD Congo : les troupes kényanes arrivent dans l'est du pays","https://www.lefigaro.fr/flash-actu/rd-congo-les-troupes-kenyanes-arrivent-dans-l-est-du-pays-20221112"
"False","False","Strasbourg: fin des investigations sur l'attentat du marché de Noël de 2018","https://www.lefigaro.fr/flash-actu/strasbourg-fin-des-investigations-sur-l-attentat-du-marche-de-noel-de-2018-20221112"
"False","False","Route du rhum : vache, belle-mère et avion sur le pont, Roland Jourdain raconte les hallucinations","https://www.lefigaro.fr/sports/voile/route-du-rhum/route-du-rhum-vache-belle-mere-et-avion-sur-le-pont-roland-jourdain-raconte-les-hallucinations-20221112"
"False","False","Route du rhum : Armel le Cléac'h a pu quitter Lorient à la mi-journée","https://www.lefigaro.fr/sports/voile/route-du-rhum/route-du-rhum-armel-le-cleac-h-va-reprendre-la-mer-a-mi-journee-20221112"
"False","False","Iran : 11 manifestants inculpés après le meurtre d'un milicien lié aux Gardiens de la Révolution","https://www.lefigaro.fr/flash-actu/iran-11-manifestants-inculpes-apres-le-meurtre-d-un-milicien-lie-aux-gardiens-de-la-revolution-20221112"
"False","False","Mondial féminin de rugby : en vidéo, l'écrasante victoire des Bleues face aux Canadiennes","https://www.lefigaro.fr/sports/rugby/mondial-de-rugby-en-video-l-ecrasante-victoire-des-bleues-face-aux-canadiennes-20221112"
"False","False","Face aux comptes usurpés, Twitter revoit, encore, son système d'authentification","https://www.lefigaro.fr/secteur/high-tech/face-aux-comptes-usurpes-twitter-revoit-encore-son-systeme-d-authentification-20221112"
"False","False","Consultation chez le médecin : François Braun n'est «pas contre» une augmentation du tarif conventionné","https://www.lefigaro.fr/sciences/consultation-chez-le-medecin-francois-braun-n-est-pas-contre-une-augmentation-du-tarif-conventionne-20221112"
"False","False","Mondial féminin de rugby : la France sauve son tournoi en décrochant le bronze","https://www.lefigaro.fr/sports/rugby/mondial-feminin-de-rugby-la-france-sauve-son-tournoi-en-decrochant-le-bronze-20221112"
