"premium","picture","title","url"
"False","True","« On attend beaucoup de moi », regrette Salah Abdeslam à son procès","https://www.20minutes.fr/justice/3253699-20220316-proces-13-novembre-attend-beaucoup-peux-donner-informations-lance-salah-abdeslam"
"False","True","Lille débute bien mais Chelsea ne tremble pas...","https://www.20minutes.fr/sport/3253971-20220316-losc-chelsea-ligue-champions-direct-lille-face-plus-grand-exploit-histoiresuivez-match-live-partir-20h30"
"False","True","Que Biden qualifie Poutine de « criminel de guerre » est « inacceptable et impardonnable », selon Moscou…","https://www.20minutes.fr/monde/3253515-20220316-guerre-ukraine-direct-zelensky-recoit-visite-premiers-ministres-polonais-tcheque-slovene"
"False","True","L’inflation pourrait dépasser les 4 % en mars, alerte l’Insee","https://www.20minutes.fr/economie/3254155-20220316-guerre-ukraine-inflation-pourrait-depasser-4-mars-alerte-insee"
"False","True","Est-ce que c’est grave, docteur, de « banaliser » l’épidémie ?","https://www.20minutes.fr/monde/3253811-20220316-covid-19-grave-docteur-banaliser-epidemie"
"False","True","Gérald Darmanin réfute l’idée d'un « crime d’Etat »","https://www.20minutes.fr/societe/3254159-20220316-agression-yvan-colonna-gerald-darmanin-evoque-acte-manifestement-terroriste-refuse-idee-crime-etat"
"False","True","Hidalgo dénonce la « violence sociale » du projet de retraite à 65 ans","https://www.20minutes.fr/elections/3254127-20220316-presidentielle-2022-anne-hidalgo-denonce-violence-sociale-projet-depart-retraite-65-ans"
"False","True","Une histoire vraie derrière la série aux accents cannibales","https://www.20minutes.fr/arts-stars/culture/3253863-20220316-yellowjackets-vraie-histoire-inspire-serie-accents-cannibales"
"False","True","Joe Biden annonce l’envoi de drones et de systèmes de défense anti-aérienne","https://www.20minutes.fr/monde/3254151-20220316-guerre-ukraine-joe-biden-annonce-envoi-drones-systemes-defense-anti-aerienne"
"False","True","L’inflation pourrait dépasser les 4 % en mars, alerte l’Insee","https://www.20minutes.fr/economie/3254155-20220316-guerre-ukraine-inflation-pourrait-depasser-4-mars-alerte-insee"
"False","True","Washington envoie des drones et des missiles anti-aériens à l'Ukraine","https://www.20minutes.fr/monde/3254151-20220316-guerre-ukraine-joe-biden-annonce-envoi-drones-systemes-defense-anti-aerienne"
"False","True","Zelensky évoque le 11-Septembre, Poutine se vante d’un « succès »","https://www.20minutes.fr/monde/3254143-20220316-guerre-ukraine-zelensky-convoque-11-septembre-devant-congres-americain-poutine-vante-succes"
"False","True","Plus de 300 Ukrainiens sont arrivés à Lille depuis le début de la guerre","https://www.20minutes.fr/lille/3254087-20220316-guerre-ukraine-plus-300-ukrainiens-arrives-lille-depuis-debut-conflit"
"False","True","Le dépôt de carburant de Rennes débloqué par les forces de l'ordre","https://www.20minutes.fr/societe/3253575-20220316-prix-essence-depot-carburant-vern-bloque-professionnels-btp-pres-rennes"
"False","True","La militante Auriane Dupuy invite les jeunes à « participer politiquement »","https://www.20minutes.fr/elections/3252559-20220316-presidentielle-2022-auriane-dupuy-militante-jeunes-generation-invite-jeunesse-participer-politiquement"
"False","True","Cinq constructions à l’architecture insolite à Montpellier","https://www.20minutes.fr/montpellier/3249471-20220316-cinq-constructions-architecture-insolite-montpellier"
"False","True","24 heures","https://www.20minutes.fr/diaporama/diaporama-15290-images-desinformation-russie-guerre-ukraine-tournoi-six-nations"
"False","True","Sous les bombes","https://www.20minutes.fr/diaporama/diaporama-15289-guerre-ukraine-images-maternite-bombardee-marioupol"
"False","True","Une entreprise peut-elle toujours imposer le port du masque ?","https://www.20minutes.fr/sante/3253687-20220316-covid-19-entreprise-peut-toujours-imposer-port-masque"
"False","True","Le droit du sol peut-il être supprimé à Mayotte comme le propose Ciotti ?","https://www.20minutes.fr/elections/3252883-20220316-presidentielle-2022-droit-sol-peut-etre-supprime-mayotte-comme-propose-eric-ciotti"
"False","True","Zelensky a-t-il publié une vidéo truquée d'une visite à des soldats ? Non","https://www.20minutes.fr/monde/3252807-20220315-guerre-ukraine-zelensky-publie-video-truquee-visite-soldats-blesses-non"
"False","True","Une entreprise peut-elle encore imposer le port du masque ?","https://www.20minutes.fr/sante/3253687-20220316-covid-19-entreprise-peut-toujours-imposer-port-masque"
"False","True","Des homosexuels « émus » d’être donneurs « pour la première fois de leur vie »","https://www.20minutes.fr/sante/3254095-20220316-don-sang-nice-hommes-homosexuels-emus-etre-donneurs-premiere-fois-vie"
"False","True","Le chef de la pénitentiaire s'explique face aux députés","https://www.20minutes.fr/societe/3254055-20220316-agression-yvan-colonna-cameras-porte-ouverte-remontee-devant-deputes-directeur-administration-penitentiaire-marche-ufs"
"False","True","La population des rapaces en baisse à cause du plomb utilisé pour la chasse","https://www.20minutes.fr/planete/3253999-20220316-chasse-population-rapaces-forte-baisse-cause-empoisonnements-plomb"
"False","True","Lancement d’un plan contre les espèces exotiques envahissantes en France","https://www.20minutes.fr/planete/3253995-20220316-biodiversite-plan-national-lutte-contre-especes-exotiques-envahissantes-lance-france"
"False","True","A Gennevilliers, Upway surfe sur le boom des vélos électriques d’occasion","https://www.20minutes.fr/planete/3252479-20220316-velo-electrique-gennevilliers-upway-surfe-marche-seconde-main-arrive-point"
"False","True","Pourquoi Didier Deschamps doit sélectionner Alban Lafont","https://www.20minutes.fr/sport/3253539-20220316-equipe-france-pourquoi-didier-deschamps-doit-selectionner-alban-lafont-liste-bleus"
"False","True","Que risque-t-on en remplaçant son diesel par du GNR ?","https://www.20minutes.fr/economie/3254075-20220316-energie-rouler-gnr-place-diesel-juste-strictement-interdit-explique-professionnel-secteur"
"False","True","Trahie par la vie, l’héroïne de la série « Kamikaze » teste toutes les limites","https://www.20minutes.fr/arts-stars/serie/3253379-20220316-kamikaze-pop-creative-serie-danoise-suicidaire-avere-etre-lecon-vie"
"False","True","Pourquoi les sondages politiques se trompent-ils tout le temps ?","https://www.20minutes.fr/podcast/3252535-20220316-minute-presidentielle-pourquoi-sondages-trompent-tout-temps"
"False","True","Qu’est-ce qu’un nécrophone ?","https://www.20minutes.fr/magazine/3253551-20220316-necrophone-invention-surprenante-thomas-edison"
"False","True","La défaite du FCN à Troyes et les supporteurs au menu de notre podcast","https://www.20minutes.fr/sport/3253231-20220315-controle-non-match-fc-nantes-troyes-blessures-point-supporteurs-menu-podcast"
"False","True","Guerre en Ukraine EN DIRECT : Biden qui qualifie Poutine de « criminel de…","https://www.20minutes.fr/monde/3253515-20220316-guerre-ukraine-direct-zelensky-recoit-visite-premiers-ministres-polonais-tcheque-slovene"
"False","True","Guerre en Ukraine : Sommet extraordinaire de l'Otan le 24 mars avec Joe…","https://www.20minutes.fr/monde/3252707-20220315-guerre-ukraine-direct-fortes-explosions-centre-kiev"
"False","True","Emmanuel Macron pourrait proposer de conditionner le RSA s’il est réélu","https://www.20minutes.fr/politique/3253303-20220315-presidentielle-2022-emmanuel-macron-pourrait-proposer-conditionner-rsa-reelu-selon-gabriel-attal"
"False","True","La Russie claque la porte du Conseil de l'Europe","https://www.20minutes.fr/monde/3253319-20220315-guerre-ukraine-russie-claque-porte-conseil-europe"
"False","True","Pourquoi Auchan, Décathlon et Leroy Merlin restent-ils ouverts en Russie ?","https://www.20minutes.fr/monde/3253059-20220315-guerre-ukraine-pourquoi-auchan-decathlon-leroy-merlin-restent-ouverts-russie"
"False","True","Des poussières du Sahara sur une partie de la France","https://www.20minutes.fr/planete/3252803-20220315-ciel-jaune-poussieres-sable-phenomene-traverse-partie-france"
"False","True","Un neurone jamais observé auparavant découvert dans le cerveau humain","https://www.20minutes.fr/sciences/3253111-20220315-nouveau-type-neurones-jamais-observe-auparavant-decouvert-cerveau-humain"
"False","True","La fratrie Nur « casse les codes » dans sa pâtisserie nantaise","https://www.20minutes.fr/nantes/3249643-20220316-nantes-25-ans-efe-nur-ur-cassent-codes-patisserie-traditionnelle"
"False","True","Le point sur ce 19e jour de conflit entre l'Ukraine et la Russie","https://www.20minutes.fr/monde/3253239-20220315-guerre-ukraine-intervention-heroique-television-russe-declaration-resignee-kiev-point-17e-jour-conflit"
"False","True","La Russie vole dans les pattes de Joe Biden","https://www.20minutes.fr/monde/3253295-20220315-guerre-ukraine-russie-sanctionne-joe-biden-plusieurs-hauts-responsables-americains"
"False","True","Poignardé, un policier sauvé par son gilet pare-balles","https://www.20minutes.fr/faits_divers/3253987-20220316-angers-poignarde-thorax-policier-sauve-gilet-pare-balles"
"False","True","« On travaille à perte »… Des pros du BTP bloquent des dépôts pétroliers","https://www.20minutes.fr/societe/3254123-20220316-prix-carburants-travaille-perte-devant-depots-petroliers-pros-btp-depites"
"False","True","Devant le Congrès, Zelensky évoque le 11-Septembre","https://www.20minutes.fr/monde/3254143-20220316-guerre-ukraine-zelensky-convoque-11-septembre-devant-congres-americain-poutine-vante-succes"
"False","True","Sur l’appli « 20 Minutes », trouvez le candidat qui vous correspond","https://www.20minutes.fr/elections/3253791-20220316-presidentielle-2022-testez-application-20-minutes-trouver-candidat-correspond"
"False","True","A quoi « l’autonomie » de la Corse pourrait-elle ressembler ?","https://www.20minutes.fr/societe/3253607-20220316-agression-yvan-colonna-quoi-autonomie-corse-evoquee-darmanin-pourrait-ressembler"
"False","True","Attention, le « véritable » Guignol arrive en ville","https://www.20minutes.fr/lyon/3254139-20220316-lyon-veritable-theatre-guignol-va-installer-hotel-dieu"
"False","True","Que reste-t-il aux Russes pour s’informer ?","https://www.20minutes.fr/arts-stars/medias/3254011-20220316-guerre-ukraine-reste-russes-informer"
