"premium","picture","title","url"
"False","True","Le récit de l'attaque de la centrale nucléaire de Zaporojie, la plus grande d’Europe","https://www.20minutes.fr/monde/3246175-20220304-guerre-ukraine-russie-attaque-plus-grande-centrale-nucleaire-europe"
"False","True","Pas de fuite radioactive détectée à la centrale nucléaire de Zaporojjia, touchée par un missile…","https://www.20minutes.fr/monde/3246171-20220304-guerre-ukraine-direct-russie-attaque-centrale-nucleaire-niveau-normal-radiations-apres-incendie"
"False","True","« Compte tenu de la guerre en Ukraine, la déclaration de candidature d’Emmanuel Macron est un non-événement »","https://www.20minutes.fr/elections/presidentielle/3245803-20220304-presidentielle-2022-compte-tenu-guerre-ukraine-declaration-candidature-emmanuel-macron-non-evenement"
"False","True","Que sait-on de la hausse de la radioactivité à Tchernobyl ?","https://www.20minutes.fr/monde/3244483-20220302-guerre-ukraine-sait-hausse-radioactivite-tchernobyl-apres-prise-site-russie"
"False","True","« Un faible pourcentage de l’arsenal nucléaire aux mains de Poutine suffirait à changer la vie sur Terre »","https://www.20minutes.fr/monde/3243095-20220227-guerre-ukraine-faible-pourcentage-arsenal-nucleaire-mains-poutine-suffirait-changer-vie-terre"
"False","True","Avec Tchernobyl, le risque d’une catastrophe nucléaire","https://www.20minutes.fr/planete/3244143-20220302-guerre-ukraine-pourquoi-risque-catastrophe-nucleaire-ecarter"
"False","True","En France, ils se préparent à accueillir des Ukrainiens","https://www.20minutes.fr/monde/3246095-20220304-guerre-ukraine-place-envie-aider-france-nombreuses-familles-preparent-accueillir-refugies"
"False","True","Faut-il s’inquiéter des représailles russes dans le domaine spatial ?","https://www.20minutes.fr/planete/3245327-20220304-guerre-ukraine-faut-inquieter-represailles-russes-domaine-spatial"
"False","True","Une centrale nucléaire attaquée, un sénateur appelle à assassiner Poutine, Rousseau exclue","https://www.20minutes.fr/monde/3246183-20220304-heure-bim-russie-attaque-centrale-nucleaire-senateur-americain-appelle-assassiner-poutine-rousseau-exclue-campagne-jadot"
"False","True","Faut-il s’inquiéter des représailles russes dans le domaine spatial ?","https://www.20minutes.fr/planete/3245327-20220304-guerre-ukraine-faut-inquieter-represailles-russes-domaine-spatial"
"False","True","Un plan de 32 milliards de dollars contre la guerre en Ukraine et le Covid","https://www.20minutes.fr/monde/3246187-20220304-etats-unis-joe-biden-veut-debloquer-32-milliards-dollars-aider-ukraine-guerre-lutter-contre-covid-19"
"False","True","Une petite commune du Rhône accueille plus de 40 jeunes danseurs ukrainiens","https://www.20minutes.fr/monde/ukraine/3246115-20220304-guerre-ukraine-comment-petite-commune-rhone-demenee-accueillir-plus-40-jeunes-danseurs-lviv"
"False","True","Quand Roman Abramovitch faisait son business en Ligue 1","https://www.20minutes.fr/sport/3246111-20220304-guerre-ukraine-quand-roman-abramovitch-faisait-business-ligue-1-type-sympa-faisait-semblant-parler-anglais"
"False","True","« Avec l’humour politique, j'essaie d'inverser le rapport de domination »","https://www.20minutes.fr/politique/3245919-20220304-humour-politique-essaie-inverser-rapport-domination-explique-charline-vanhoenacker"
"False","True","Les LinkBuds de Sony veulent faire leur trou dans le monde des écouteurs","https://www.20minutes.fr/high-tech/3245487-20220303-linkbuds-sony-veut-faire-trou-ecouteurs-peut-porter-toute-journee"
"False","True","Bientôt un traité mondial contre la pollution plastique","https://www.20minutes.fr/planete/3245475-20220303-pollution-onu-jette-bases-traite-mondial-contre-pollution-plastique-decision-historique"
"False","True","Sous les bombes","https://www.20minutes.fr/diaporama/diaporama-15278-guerre-ukraine-images-conflit-invasion-russe"
"False","True","Jean-Pierre Pernaut, héraut des régions","https://www.20minutes.fr/diaporama/diaporama-15284-images-vie-jean-pierre-pernaut"
"False","True","Que sait-on de la radioactivité à Tchernobyl après la prise du site ?","https://www.20minutes.fr/monde/3244483-20220302-guerre-ukraine-sait-hausse-radioactivite-tchernobyl-apres-prise-site-russie"
"False","True","Une artère de Kiev rebaptisée au nom d’un responsable nazi ? Prudence…","https://www.20minutes.fr/monde/3244155-20220301-guerre-ukraine-artere-kiev-rebaptisee-nom-responsable-nazi-prudence"
"False","True","Twitter va avertir sur les tweets reprenant des médias proches du Kremlin","https://www.20minutes.fr/high-tech/3243923-20220301-twitter-label-specifique-tweets-reprenant-medias-proches-kremlin"
"False","True","Une commune du Rhône accueille 40 jeunes danseurs ukrainiens","https://www.20minutes.fr/monde/ukraine/3246115-20220304-guerre-ukraine-comment-petite-commune-rhone-demenee-accueillir-plus-40-jeunes-danseurs-lviv"
"False","True","« Avec l’humour, j'essaie d'inverser le rapport de domination »","https://www.20minutes.fr/politique/3245919-20220304-humour-politique-essaie-inverser-rapport-domination-explique-charline-vanhoenacker"
"False","True","Un plan de 32 milliards de dollars contre la guerre en Ukraine et le Covid","https://www.20minutes.fr/monde/3246187-20220304-etats-unis-joe-biden-veut-debloquer-32-milliards-dollars-aider-ukraine-guerre-lutter-contre-covid-19"
"False","True","Faut-il s’inquiéter des représailles russes dans le domaine spatial ?","https://www.20minutes.fr/planete/3245327-20220304-guerre-ukraine-faut-inquieter-represailles-russes-domaine-spatial"
"False","True","Une ville canadienne va chauffer certains de ses bâtiments grâce au Bitcoin","https://www.20minutes.fr/planete/3245699-20220303-canada-ville-va-chauffer-partie-batiments-grace-bitcoin"
"False","True","Bientôt un traité mondial contre la pollution plastique","https://www.20minutes.fr/planete/3245475-20220303-pollution-onu-jette-bases-traite-mondial-contre-pollution-plastique-decision-historique"
"False","True","« Je suis candidat », annonce Macron dans sa « Lettre »","https://www.20minutes.fr/elections/presidentielle/3246059-20220303-presidentielle-2022-candidat-annonce-emmanuel-macron-lettre-francais"
"False","True","En larmes, les premiers réfugiés ukrainiens arrivent à Marseille","https://www.20minutes.fr/marseille/3246023-20220303-guerre-ukraine-larmes-tristesse-soulagement-premiers-refugies-ukrainiens-marseille"
"False","True","Vos questions à Marine Le Pen pour le « Live Présidentiel »","https://www.20minutes.fr/elections/presidentielle/3244007-20220303-presidentielle-2022-posez-questions-marine-pen-vue-live-presidentiel-tf1-20-minutes"
"False","True","Des marqueurs luminescents anti-contrefaçon (et pro-recyclage)","https://www.20minutes.fr/sciences/3244419-20220304-marqueurs-luminescents-dejouer-contrefacon-mieux-recycler-materiaux"
"False","True","Six chantiers prioritaires pour l’avenir de l’agriculture française","https://www.20minutes.fr/planete/3243767-20220303-agriculture-six-chantiers-prioritaires-avenir-filiere-francaise"
"False","True","L'argent des campagnes présidentielles est-il sale ?","https://www.20minutes.fr/podcast/3244707-20220302-minute-presidentielle-quoi-financement-presidentielle-pose-probleme"
"False","True","Guerre en Ukraine EN DIRECT : Pas de fuite radioactive détectée à la…","https://www.20minutes.fr/monde/3246171-20220304-guerre-ukraine-direct-russie-attaque-centrale-nucleaire-niveau-normal-radiations-apres-incendie"
"False","True","Pour Ron DeSantis, les Français n’auraient pas résisté aux Russes","https://www.20minutes.fr/monde/3245779-20220303-guerre-ukraine-polemique-apres-propos-gouverneur-floride-estimant-france-resiste-russie"
"False","True","Guerre en Ukraine: La sécurité nucléaire «garantie» dans la centrale…","https://www.20minutes.fr/monde/3245407-20220303-guerre-ukraine-direct-ville-kherson-capturee-russie-million-refugies-quitte-pays"
"False","True","Poutine déterminé à poursuivre l’offensive, Zelensky jure de le faire payer","https://www.20minutes.fr/monde/ukraine/3246071-20220303-guerre-ukraine-poutine-poursuivra-compromis-offensive-zelensky-promet-faire-payer"
"False","True","En Ukraine, la Russie attaque la plus grande centrale nucléaire d’Europe","https://www.20minutes.fr/monde/3246175-20220304-guerre-ukraine-russie-attaque-plus-grande-centrale-nucleaire-europe"
"False","True","L'inquiétant profil du suspect de l'agression d'Yvan Colonna","https://www.20minutes.fr/faits_divers/3246075-20220303-agression-yvan-colonna-radicalise-impulsif-virulent-inquietant-profil-suspect"
"False","True","L’OTAN va montrer ses muscles à la Russie lors d’un exercice en Norvège","https://www.20minutes.fr/monde/3245535-20220303-guerre-ukraine-otan-va-montrer-muscles-russie-lors-exercice-norvege"
"False","True","Sandrine Rousseau exclue de l’équipe de campagne de Yannick Jadot","https://www.20minutes.fr/elections/3246107-20220303-presidentielle-2022-sandrine-rousseau-exclue-equipe-campagne-yannick-jadot"
"False","True","Emmanuel Macron officialise sa candidature dans une « Lettre aux Français »","https://www.20minutes.fr/elections/presidentielle/3246059-20220303-presidentielle-2022-candidat-annonce-emmanuel-macron-lettre-francais"
"False","True","Sondages Présidentielle 2022 : Macron en forte hausse, Pécresse chute ?","https://www.20minutes.fr/elections/sondage-election/3244915-20220302-sondages-presidentielle-2022-emmanuel-macron-forte-hausse-valerie-pecresse-chute-libre"
"False","True","Comment la Russie a-t-elle étendu son influence en Afrique ?","https://www.20minutes.fr/monde/3246003-20220303-guerre-ukraine-comment-russie-etendu-influence-afrique"
"False","True","Vous vivez en Russie, comment envisagez-vous la suite ?","https://www.20minutes.fr/monde/3245499-20220303-guerre-ukraine-francais-vivez-russie-comment-envisagez-suite"
"False","True","« Les ados qui se cherchent vont trouver un sens dans l’enrôlement »","https://www.20minutes.fr/monde/3245767-20220303-guerre-ukraine-ados-cherchent-vont-trouver-certain-sens-enrolement"
"False","True","Le sénateur américain Graham appelle à assassiner Poutine","https://www.20minutes.fr/monde/3246179-20220304-guerre-ukraine-senateur-americain-appelle-assassiner-poutine"
"False","True","Quelles sont les forces et les faiblesses d’Emmanuel Macron pour la campagne ?","https://www.20minutes.fr/elections/presidentielle/3228123-20220303-presidentielle-2022-forces-faiblesses-emmanuel-macron-heure-entrer-campagne"
"False","True","« Fresh », la comédie qui fait rimer romantisme et cannibalisme","https://www.20minutes.fr/arts-stars/cinema/3246091-20220304-fresh-comedie-delicieusement-feroce-fait-rimer-romantisme-cannibalisme"
"False","True","L’inquiétant profil du suspect dans l'agression d'Yvan Colonna","https://www.20minutes.fr/faits_divers/3246075-20220303-agression-yvan-colonna-radicalise-impulsif-virulent-inquietant-profil-suspect"
