"premium","picture","title","url"
"False","True","Agression de Salman Rushdie: ce que l'on sait de Hadi Matar, le suspect interpellé","https://www.bfmtv.com/international/amerique-nord/etats-unis/agression-de-salman-rushdie-ce-que-l-on-sait-de-hadi-matar-le-suspect-interpelle_AD-202208130147.html"
"False","False","Attaque contre Salman Rushdie: le suspect est un jeune homme de 24 ans","https://www.bfmtv.com/international/amerique-nord/etats-unis/attaque-contre-salman-rushdie-le-suspect-est-un-homme-de-24-ans_AV-202208120565.html"
"False","False","Iran: l'assaillant de Salman Rushdie félicité par la presse conservatrice","https://www.bfmtv.com/international/moyen-orient/iran/iran-l-assaillant-de-salman-rushdie-felicite-par-la-presse-conservatrice_AD-202208130049.html"
"False","True","L'écrivain Salman Rushdie placé sous respirateur artificiel après avoir été poignardé","https://www.bfmtv.com/international/amerique-nord/etats-unis/l-ecrivain-salman-rushdie-place-sous-respirateur-artificiel-apres-avoir-ete-poignarde_AD-202208130020.html"
"False","False","Salman Rushdie: 33 ans de menaces depuis la fatwa du 14 février 1989 lancée par…","https://www.bfmtv.com/international/moyen-orient/iran/salman-rushdie-33-ans-de-menaces-depuis-la-fatwa-du-14-fevrier-1989-lancee-par-l-ayatollah-khomeiny_AD-202208120514.html"
"False","True","Salman Rushdie: qu'est-ce que ""Les Versets sataniques"", le roman qui lui a valu une fatwa iranienne?","https://www.bfmtv.com/international/salman-rushdie-qu-est-ce-que-les-versets-sataniques-le-roman-qui-lui-a-valu-une-fatwa-iranienne_AN-202208130138.html"
"False","True","Agression de Salman Rushdie: les ventes des ""Versets sataniques"" grimpent en flèche","https://www.bfmtv.com/economie/entreprises/industries/agression-de-salman-rushdie-les-ventes-des-versets-sataniques-grimpent-en-fleche_AV-202208130162.html"
"False","True","Salman Rushdie poignardé: ""rien ne justifie une fatwa"", s'indigne Charlie Hebdo","https://www.bfmtv.com/culture/salman-rushdie-poignarde-rien-ne-justifie-une-fatwa-s-indigne-charlie-hebdo_AD-202208130091.html"
"False","False","""Cette affaire nous concerne tous"": Roselyne Bachelot réagit à l'attaque contre Salman…","https://www.bfmtv.com/international/amerique-nord/etats-unis/attaque-au-couteau-contre-salman-rushdie-pour-roselyne-bachelot-cette-affaire-nous-concerne-tous_AN-202208130057.html"
"False","True","Ardèche, Gironde, Morbihan... Début d'accalmie sur le front des incendies","https://www.bfmtv.com/environnement/ardeche-gironde-morbihan-debut-d-accalmie-sur-le-front-des-incendies_AD-202208130042.html"
"False","True","Incendies: comment s'organise l'aide européenne sur le terrain?","https://www.bfmtv.com/environnement/incendies-comment-s-organise-l-aide-europeenne-sur-le-terrain_AV-202208120284.html"
"False","True","Ces fois où Donald Trump s'est montré imprudent avec des documents classifiés","https://www.bfmtv.com/international/amerique-nord/etats-unis/ces-fois-ou-donald-trump-s-est-montre-imprudent-avec-des-documents-classifies_AD-202208130081.html"
"False","True","Perquisition chez Trump: saisie de documents ""top secrets"" en possible violation de la loi sur l'espionnage","https://www.bfmtv.com/international/amerique-nord/etats-unis/perquisition-chez-trump-saisie-de-documents-top-secret-en-possible-violation-de-la-loi-sur-l-espionnage_AD-202208120549.html"
"False","True","États-Unis: victoire pour Joe Biden avec l'adoption de son plan pour le climat et la santé au Congrès","https://www.bfmtv.com/international/amerique-nord/etats-unis/etats-unis-victoire-pour-joe-biden-avec-l-adoption-de-son-plan-pour-le-climat-et-la-sante-au-congres_AD-202208130043.html"
"False","True","Ce que contient le grand plan social et climatique de Biden, définitivement adopté","https://www.bfmtv.com/international/amerique-nord/etats-unis/ce-que-contient-le-grand-plan-social-et-climatique-de-biden_AD-202208130115.html"
"False","True","Nous avons considéré cette affaire comme une simple affaire de fatwa contre Salman Rushdie, une histoire entre musulmans, alors qu'elle nous concernait tous. L'ancienne ministre de la Culture, Roselyne Bachelot","https://www.bfmtv.com/international/amerique-nord/etats-unis/attaque-au-couteau-contre-salman-rushdie-pour-roselyne-bachelot-cette-affaire-nous-concerne-tous_AN-202208130057.html"
"False","True","Afghanistan: des talibans tirent en l'air à Kaboul pour disperser une manifestation de…","https://www.bfmtv.com/international/moyen-orient/afghanistan/afghanistan-des-talibans-tirent-en-l-air-a-kaboul-pour-disperser-une-manifestation-de-femmes_AD-202208130075.html"
"False","True","Guerre en Ukraine: amputé d'un bras, un soldat ukrainien raconte son quotidien au front","https://www.bfmtv.com/international/asie/russie/guerre-en-ukraine-ampute-d-un-bras-un-soldat-ukrainien-raconte-son-quotidien-au-front_AV-202208130060.html"
"False","True","Un samedi encore très chaud, seize départements placés en vigilance orange canicule","https://www.bfmtv.com/meteo/le-temps-samedi-encore-tres-chaud-avec-arrivee-d-orages-par-le-sud-ouest_AD-202208130018.html"
"False","True","Bison Futé classe ce samedi rouge dans tout l’hexagone, noir autour de la Méditerranée","https://www.bfmtv.com/auto/bison-fute-classe-ce-samedi-rouge-dans-tout-l-hexagone-noir-autour-de-la-mediterranee_AN-202208130001.html"
"False","True","Mbappé dévoile son top 3 pour le prochain Ballon d'or","https://rmcsport.bfmtv.com/football/mbappe-devoile-son-top-3-pour-le-prochain-ballon-d-or_AV-202208130092.html"
"False","True","Coupe du monde 2022: budget, logement... Comment les supporters français préparent leur…","https://rmcsport.bfmtv.com/football/coupe-du-monde/coupe-du-monde-2022-budget-logement-comment-les-supporters-francais-preparent-leur-voyage-au-qatar_AV-202208130102.html"
"False","True","Local, artisanal, AOP, IGP... que veulent dire ces signes de qualité?","https://www.bfmtv.com/economie/consommation/local-artisanal-aop-igp-que-veulent-dire-ces-signes-de-qualite_AN-202208130051.html"
"False","True","QUIZ - Connaissez-vous bien les tubes de l'été?","https://www.bfmtv.com/people/musique/quiz-connaissez-vous-bien-les-tubes-de-l-ete_AN-202208130120.html"
"False","True","Brûlage dirigé, pare-feu... Ces techniques utilisées par les pompiers pour contrôler les…","https://www.bfmtv.com/environnement/brulage-dirige-pare-feu-ces-techniques-utilisees-par-les-pompiers-pour-controler-les-incendies_AV-202208120092.html"
"False","True","Le Rhin et la Tamise à sec, incendies au Portugal: la sécheresse en Europe en 5 images…","https://www.bfmtv.com/environnement/climat/le-rhin-a-sec-incendies-au-portugal-les-images-de-l-europe-frappee-par-la-secheresse_AN-202208110341.html"
"False","True","L'allocation de rentrée scolaire sera versée en deux temps cette année","https://www.bfmtv.com/economie/economie-social/l-allocation-de-rentree-scolaire-sera-versee-en-deux-temps-cette-annee_AV-202208110334.html"
"False","True","Homme abattu par un tir de police à Roissy: les images du déroulé des faits","https://www.bfmtv.com/police-justice/homme-abattu-par-un-tir-de-police-a-roissy-les-images-du-deroule-des-faits_AN-202208110046.html"
"False","True","Le débat contre les calèches relancé à New York après le malaise d'un cheval en pleine rue","https://www.bfmtv.com/international/amerique-nord/etats-unis/le-debat-contre-les-caleches-relance-a-new-york-apres-le-malaise-d-un-cheval-en-pleine-rue_AN-202208120176.html"
"False","True","Agression de Salman Rushdie: les ventes des ""Versets sataniques"" grimpent en flèche","https://www.bfmtv.com/economie/entreprises/industries/agression-de-salman-rushdie-les-ventes-des-versets-sataniques-grimpent-en-fleche_AV-202208130162.html"
"False","True","Après des années de scandales, Johnson & Johnson va arrêter de vendre son talc pour bébé","https://www.bfmtv.com/economie/entreprises/industries/apres-des-annees-de-scandales-johnson-johnson-va-arreter-de-vendre-son-talc-pour-bebe_AN-202208130112.html"
"False","True","Local, artisanal, AOP, IGP... que veulent dire ces signes de qualité?","https://www.bfmtv.com/economie/consommation/local-artisanal-aop-igp-que-veulent-dire-ces-signes-de-qualite_AN-202208130051.html"
"False","True","Sécheresse: le niveau du Rhin baisse sous un niveau crucial, le transport menacé","https://www.bfmtv.com/environnement/secheresse-le-niveau-du-rhin-baisse-sous-un-niveau-crucial-le-transport-menace_AD-202208120558.html"
"False","True","Le Château de Versailles retrouve ses touristes, la barre du million d'entrées déjà franchie","https://www.bfmtv.com/paris/le-chateau-de-versailles-retrouve-ses-touristes-la-barre-du-million-d-entrees-deja-franchie_AV-202208120542.html"
"False","True","Ballon d'or: ""Ils ont insulté le football"", la presse argentine outrée par l'absence de Messi dans les 30 nommés","https://rmcsport.bfmtv.com/football/ballon-d-or-ils-ont-insulte-le-football-la-presse-argentine-outree-par-l-absence-de-messi-dans-les-30-nommes_AV-202208130168.html"
"False","True","Ballon d'or: Mbappé s'amuse de ""l'hypocrisie totale"" autour du trophée","https://rmcsport.bfmtv.com/football/ballon-d-or-mbappe-s-amuse-de-l-hypocrisie-totale-autour-du-trophee_AV-202208130048.html"
"False","True","Mbappé dévoile son top 3 pour le prochain Ballon d'or","https://rmcsport.bfmtv.com/football/mbappe-devoile-son-top-3-pour-le-prochain-ballon-d-or_AV-202208130092.html"
"False","True","Nantes: Lafont doit-il être appelé en équipe de France ?","https://rmcsport.bfmtv.com/football/ligue-1/nantes-lafont-doit-il-etre-appele-en-equipe-de-france_AV-202208130180.html"
"False","True","Mercato: Willian résilie au Corinthians à cause... de menaces de mort","https://rmcsport.bfmtv.com/football/transferts/mercato-willian-resilie-au-corinthians-a-cause-de-menaces-de-mort_AV-202208130086.html"
"False","True","""J'ai pleuré tous les soirs pendants un an"" : fausses couches, vraies souffrances","https://www.bfmtv.com/societe/j-ai-pleure-tous-les-soirs-pendant-un-an-fausse-couche-vraies-souffrances_AN-202206230011.html"
"False","True","Carte. Résultats élections législatives 2022 : La France du vote RN au premier tour","https://www.bfmtv.com/politique/elections/legislatives/carte-resultats-elections-legislatives-2022-la-france-du-vote-rn-au-premier-tour_GN-202206130020.html"
"False","True","Lascaux, Chauvet, Cosquer...Le nouvel eldorado touristique des grottes préhistoriques","https://www.bfmtv.com/economie/lascaux-chauvet-cosquer-le-nouvel-eldorado-touristique-des-grottes-prehistoriques_GN-202206040051.html"
"False","True","Guerre en Ukraine : 100 jours de conflit racontés en images satellite","https://www.bfmtv.com/international/guerre-en-ukraine-100-jours-de-conflits-racontes-en-images-satellite_AN-202206030031.html"
"False","True","Entre l'Ukraine et la Russie, une histoire contrariée","https://www.bfmtv.com/international/entre-l-ukraine-et-la-russie-une-histoire-contrariee_GN-202205090013.html"
"False","True","PMA pour toutes : 9 mois après, l'attente se prolonge pour les femmes","https://www.bfmtv.com/societe/pma-pour-toutes-9-mois-apres-l-attente-se-prolonge-pour-les-femmes_GN-202205020004.html"
"False","True","Incendies en Gironde: Pascal Obispo et Renaud réunis pour soutenir les pompiers","https://www.bfmtv.com/people/musique/incendies-en-gironde-pascal-obispo-et-renaud-reunis-pour-soutenir-les-pompiers_AN-202208130177.html"
"False","True","Paris: les obsèques de Sempé auront lieu vendredi à l'église Saint-Germain-des-Prés","https://www.bfmtv.com/people/bandes-dessinees/paris-les-obseques-de-sempe-auront-lieu-vendredi-a-l-eglise-saint-germain-des-pres_AD-202208130149.html"
"False","True","Les secrets des tubes: ""Balance ton quoi"" d'Angèle","https://www.bfmtv.com/people/musique/les-secrets-des-tubes-balance-ton-quoi-d-angele_VN-202208130137.html"
"False","True","QUIZ - Connaissez-vous bien les tubes de l'été?","https://www.bfmtv.com/people/musique/quiz-connaissez-vous-bien-les-tubes-de-l-ete_AN-202208130120.html"
"False","True","Les secrets des tubes: ""Balance ton quoi"" d'Angèle","https://www.bfmtv.com/people/musique/les-secrets-des-tubes-balance-ton-quoi-d-angele_AV-202208130063.html"
