"premium","picture","title","url"
"False","True","DIRECT. Incendies dans le Sud-Ouest : près de 10 000 hectares partis en fumée depuis mardi","https://mobile.francetvinfo.fr/meteo/canicule/direct-incendies-dans-le-sud-ouest-environ-8-000-hectares-partis-en-fumee-depuis-mardi_5259670.html"
"False","True","Incendie à La Teste-de-Buch : ""La situation est préoccupante mais on a beaucoup d'espoir"", explique le maire de la ville","https://mobile.francetvinfo.fr/faits-divers/incendies-en-gironde/incendie-a-la-teste-de-buch-la-situation-est-preoccupante-mais-on-a-beaucoup-d-espoir-explique-le-maire-de-la-ville_5259637.html"
"False","True","Incendies en Gironde : on vous explique pourquoi ces feux sont si difficiles à éteindre","https://mobile.francetvinfo.fr/faits-divers/incendies-en-gironde/incendies-en-gironde-on-vous-explique-pourquoi-ces-feux-sont-si-difficiles-a-eteindre_5257774.html"
"False","True","Crise énergétique : quatre questions sur le ""plan de sobriété"" annoncé par Emmanuel Macron","https://mobile.francetvinfo.fr/economie/energie/crise-energetique-quatre-questions-sur-le-plan-de-sobriete-annonce-par-emmanuel-macron_5257786.html"
"False","True","TEMOIGNAGES. Onze Français nous racontent leur attachement au Tour de France depuis le bord de la route : ""C'est Noël en plein été""","https://mobile.francetvinfo.fr/tour-de-france/temoignages-onze-francais-nous-racontent-leur-attachement-au-tour-de-france-depuis-le-bord-de-la-route-c-est-noel-en-plein-ete_5254198.html"
"False","True","""Les derniers témoins disparaissent"" : le réalisateur de ""La Rafle du Vel d'Hiv, les larmes et la honte"" pointe l'importance du travail de mémoire","https://mobile.francetvinfo.fr/culture/patrimoine/histoire/les-derniers-temoins-disparaissent-le-realisateur-de-la-rafle-du-vel-d-hiv-les-larmes-et-la-honte-pointe-l-importance-du-travail-de-memoire_5242873.html"
"False","True","TEMOIGNAGES. Variole du singe : ""Si j'avais eu l'info sur la prévention, je me serais fait dépister plus tôt"", témoigne un malade","https://mobile.francetvinfo.fr/sante/maladie/variole-du-singe/temoignages-variole-du-singe-si-j-avais-eu-l-info-sur-la-prevention-je-me-serais-fait-depister-plus-tot-temoigne-un-malade_5256820.html"
"False","True","Guerre en Ukraine : la Russie accusée de tirer des missiles depuis la centrale nucléaire de Zaporijjia","https://mobile.francetvinfo.fr/monde/europe/manifestations-en-ukraine/guerre-en-ukraine-la-russie-accusee-de-tirer-des-missiles-depuis-la-centrale-nucleaire-de-zaporijjia_5259709.html"
"False","True","Mondiaux d'athlétisme 2022 : Kerley en 9""79 sur 100 m, Felix finit en beauté, les Français débutent bien... Ce que vous avez peut-être raté cette nuit","https://mobile.francetvinfo.fr/sports/athletisme/championnats-du-monde/mondiaux-d-athletisme-2022-fred-kerley-en-9-79-sur-100-m-allyson-felix-finit-en-beaute-les-francais-debutent-bien-ce-que-vous-avez-peut-etre-rate-cette-nuit_5259649.html"
"False","True","En Ukraine, des réfugiés veulent revenir en zone de guerre : ""Si j'ai envie de rentrer chez moi, c'est mon choix""","https://mobile.francetvinfo.fr/monde/europe/manifestations-en-ukraine/en-ukraine-des-refugies-veulent-revenir-en-zone-de-guerre-si-j-ai-envie-de-rentrer-chez-moi-c-est-mon-choix_5258617.html"
"False","True","Angers : un adolescent et deux adultes tués par arme blanche, un suspect interpellé","https://mobile.francetvinfo.fr/faits-divers/angers-un-adolescent-et-deux-adultes-tues-par-arme-blanche-un-suspect-interpelle_5259691.html"
"False","True","Vague de chaleur : 16 départements en vigilance orange canicule","https://mobile.francetvinfo.fr/meteo/vague-de-chaleur-16-departements-en-vigilance-orange-canicule_5258314.html"
"False","True","Nouvelle-Calédonie : des associations réclament un plan d'urgence après un féminicide","https://mobile.francetvinfo.fr/societe/violences-faites-aux-femmes/nouvelle-caledonie-des-associations-reclament-un-plan-d-urgence-apres-un-feminicide_5259586.html"
"False","True","Israël : l'armée mène des frappes sur Gaza après des tirs de roquettes","https://mobile.francetvinfo.fr/monde/palestine/gaza/israel-l-armee-mene-des-frappes-sur-gaza-apres-des-tirs-de-roquettes_5259598.html"
"False","True","Maroc : un mort et des centaines de familles déplacées en raison de feux de forêt","https://mobile.francetvinfo.fr/monde/afrique/maroc/maroc-un-mort-et-des-centaines-de-familles-deplacees-en-raison-de-feux-de-foret_5259646.html"
"False","True","Entre canicule, Covid-19 et manque de personnel, ""c'est l'été de tous les dangers"" pour les soignants de l'hôpital public","https://mobile.francetvinfo.fr/meteo/canicule/entre-canicule-septieme-vague-de-covid-19-et-manque-de-personnel-c-est-l-ete-de-tous-les-dangers-pour-les-soignants-de-l-hopital-public_5251900.html"
"False","True","Etats-Unis : Joe Biden a sur les mains ""le sang"" des victimes du régime saoudien, dénonce la fiancée de Jamal Khashoggi","https://mobile.francetvinfo.fr/monde/proche-orient/disparition-d-un-journaliste-saoudien/etats-unis-joe-biden-a-sur-les-mains-le-sang-des-victimes-du-regime-saoudien-denonce-la-fiancee-de-jamal-khashoggi_5258584.html"
"False","True","Incendies au Portugal : un bombardier d'eau s'écrase, causant la mort du pilote","https://mobile.francetvinfo.fr/faits-divers/incendie/incendies-au-portugal-un-bombardier-d-eau-s-ecrase-causant-la-mort-du-pilote_5258674.html"
"False","True","Canicule : des records de températures pour un mois de juillet enregistrés notamment à Nîmes et Béziers avec plus de 40 degrés","https://mobile.francetvinfo.fr/meteo/canicule/canicule-des-records-de-temperatures-pour-un-mois-de-juillet-enregistres-notamment-a-nimes-et-beziers-avec-plus-de-40-degres_5258440.html"
"False","True","VIDEO. Tour de France 2022 : le festival Pedersen à Saint-Etienne, Vingegaard toujours en jaune... Le résumé de la treizième étape","https://mobile.francetvinfo.fr/tour-de-france/video-tour-de-france-2022-le-festival-pedersen-a-saint-etienne-vingegaard-toujours-en-jaune-le-resume-de-la-treizieme-etape_5258347.html"
"False","True","Colombie : l'armée a tué le principal chef de la dissidence des FARC, annonce le gouvernement","https://mobile.francetvinfo.fr/monde/ameriques/colombie-l-armee-a-tue-le-principal-chef-de-la-dissidence-des-farc-annonce-le-gouvernement_5258494.html"
"False","True","Euro 2022 : ""La déception et une certaine forme de rage sévissent en moi"", réagit Marie-Antoinette Katoto après l'annonce de son forfait","https://mobile.francetvinfo.fr/euro/euro-2022-la-deception-et-une-certaine-forme-de-rage-sevissent-en-moi-reagit-marie-antoinette-katoto-apres-l-annonce-de-son-forfait_5258668.html"
"False","True","VIDEO. Mondiaux d'athlétisme 2022 : le Français Quentin Bigot qualifié pour la finale du lancer de marteau","https://mobile.francetvinfo.fr/sports/athletisme/championnats-du-monde/mondiaux-d-athletisme-2022-le-francais-quentin-bigot-qualifie-pour-la-finale-du-lancer-de-marteau_5258551.html"
"False","True","Variole du singe : l'épidémie se rapproche d'une infection sexuellement transmissible, selon l'infectiologue Benjamin Davido","https://mobile.francetvinfo.fr/sante/maladie/variole-du-singe/variole-du-singe-l-epidemie-se-rapproche-d-une-infection-sexuellement-transmissible-selon-l-infectiologue-benjamin-davido_5258482.html"
"False","True","Euro 2022 : la Norvège éliminée après sa défaite face à l'Autriche, l'Angleterre termine sur une large victoire","https://mobile.francetvinfo.fr/euro/euro-2022-la-norvege-eliminee-apres-sa-defaite-face-a-l-autriche-l-angleterre-termine-sur-une-large-victoire_5258542.html"
"False","True","Feu d'artifice du 14-Juillet à Cholet : la distance de sécurité au cœur de l'enquête sur l'accident mortel","https://mobile.francetvinfo.fr/france/14-juillet/feu-d-artifice-du-14-juillet-a-cholet-la-distance-de-securite-au-coeur-de-l-enquete-sur-l-accident-mortel_5258380.html"
"False","True","Marie-José Pérec, marraine de ""Demain le sport"" : ""Lorsque je pense sport, je pense à la santé des gens, au bien vivre, à l'inclusion""","https://mobile.francetvinfo.fr/les-jeux-olympiques/jo-2024/marie-jose-perec-marraine-de-demain-le-sport-lorsque-je-pense-sport-je-pense-a-la-sante-des-gens-au-bien-vivre-a-l-inclusion_5258563.html"
"False","True","Sécheresse : ""Chaque jour qui passe, on voit les cultures dépérir"", alerte Christiane Lambert, la présidente de la FNSEA","https://mobile.francetvinfo.fr/economie/emploi/metiers/agriculture/secheresse-chaque-jour-qui-passe-on-voit-les-cultures-deperir-alerte-christiane-lambert-la-presidente-de-la-fnsea_5258509.html"
"False","True","Financement de l'audiovisuel public : des élus PS déposent une proposition de loi pour une contribution ""universelle et progressive""","https://mobile.francetvinfo.fr/economie/medias/france-televisions/financement-de-l-audiovisuel-public-des-elus-ps-deposent-une-proposition-de-loi-pour-une-contribution-universelle-et-progressive_5258569.html"
"False","True","Disneyland Paris inaugure son ""Avengers Campus"" : ""La plus grande transformation du parc depuis son ouverture""","https://mobile.francetvinfo.fr/economie/tourisme/disneyland-paris-inaugure-son-avengers-campus-la-plus-grande-transformation-du-parc-depuis-son-ouverture_5256592.html"
"False","True","Le musée Perrier pétille à nouveau avec une nouvelle exposition à Vergèze dans le Gard","https://mobile.francetvinfo.fr/culture/patrimoine/histoire/le-musee-perrier-petille-a-nouveau-avec-une-nouvelle-exposition-a-vergeze-dans-le-gard_5244877.html"
"False","True","En Isère, la montagne accessible en joëlette pour les personnes en situation de handicap","https://mobile.francetvinfo.fr/sante/sport-et-sante/en-isere-la-montagne-accessible-en-joelette-pour-les-personnes-en-situation-de-handicap_5251978.html"
"False","True","Les super-héros pop art de Greg Guillemin, alias ""Léon"", investissent le château de Val","https://mobile.francetvinfo.fr/culture/arts-expos/les-super-heros-pop-art-de-greg-guillemin-alias-leon-investissent-le-chateau-de-val-en-correze_5236855.html"
"False","True","Dans le Calvados, une brigade mobile de gendarmes à la rencontre des habitants","https://mobile.francetvinfo.fr/economie/emploi/metiers/armee-et-securite/dans-le-calvados-une-brigade-mobile-de-gendarmes-a-la-rencontre-des-habitants_5251696.html"
"False","True","À Ruoms en Ardèche, un distributeur automatique de viande ouvert 24h sur 24","https://mobile.francetvinfo.fr/france/ilsontlasolution/a-ruoms-en-ardeche-un-distributeur-automatique-de-viande-ouvert-24h-sur-24_5251573.html"
"False","True","""Xenoblade Chronicles 3"", ""F1 22"", ""TMNT Shredder’s Revenge"", ""Sonic Origins"" : on joue à quoi cet été ?","https://mobile.francetvinfo.fr/culture/jeux-video/xenoblade-chronicles-3-f1-22-tmnt-shredders-revenge-on-joue-a-quoi-cet-ete_5231227.html"
"False","True","À Pontoise, les balcons d’un immeuble investis par les musiciens de l’Orchestre national","https://mobile.francetvinfo.fr/france/ilsontlasolution/a-pontoise-les-balcons-dun-immeuble-investis-par-les-musiciens-de-lorchestre-national_5250418.html"
"False","True","Dans le Tarn-et-Garonne, les facteurs filment l’état des routes pendant les tournées","https://mobile.francetvinfo.fr/france/ilsontlasolution/dans-le-tarn-et-garonne-les-facteurs-filment-letat-des-routes-pendant-les-tournees_5250244.html"
"False","True","Ukraine : dans les Hauts-de-France, des logements indépendants pour les réfugiés","https://mobile.francetvinfo.fr/monde/europe/manifestations-en-ukraine/ukraine-dans-les-hauts-de-france-des-logements-independants-pour-les-refugies_5250073.html"
"False","True","À Rennes, la fête bat son plein tout l'été à Exporama, grand rendez-vous de l’art contemporain","https://mobile.francetvinfo.fr/culture/arts-expos/art-contemporain/a-rennes-la-fete-bat-son-plein-a-exporama-grand-rendez-vous-de-lart-contemporain_5243359.html"
"False","True","Star Wars : ils se confrontent au sabre laser pour devenir le meilleur Jedi, que la Force soit avec eux !","https://mobile.francetvinfo.fr/culture/cinema/star-wars/reportages-star-wars-ils-se-confrontent-au-sabre-laser-pour-devenir-le-meilleur-jedi-que-la-force-soit-avec-eux_5243266.html"
"False","True","Une bourse d'échange de tuiles pour aider les sinistrés en Côte-d'Or","https://mobile.francetvinfo.fr/france/ilsontlasolution/une-bourse-d-echange-de-tuiles-pour-aider-les-sinistres-en-cote-d-or_5243002.html"
"False","True","Éducation : en Seine-Saint-Denis, la méthode Fontanieu a payé pour les jeunes de Drancy","https://mobile.francetvinfo.fr/bac/education-en-seine-saint-denis-la-methode-fontanieu-a-paye-pour-les-jeunes-de-drancy_5250751.html"
"False","True","Bac 2022 : un taux de réussite à 91,1%, en baisse de 2,8 points par rapport à 2021","https://mobile.francetvinfo.fr/bac/bac-2022-taux-de-reussite-a-91-1-en-baisse-de-2-8-points-par-rapport-a-2021_5247049.html"
"False","True","Bac 2022 : un taux de réussite de 86% avant le rattrapage, en baisse de 4,7 points par rapport à l'an dernier","https://mobile.francetvinfo.fr/bac/bac-2022-le-taux-de-reussite-est-de-86-avant-le-rattrapage-en-baisse-de-4-7-points-par-rapport-a-l-an-dernier_5239867.html"
"False","True","Bac 2022 : retrouvez tous les résultats du baccalauréat dans notre moteur de recherche","https://www.francetvinfo.fr/bac/"
"False","True","Bac 2022 : le taux de réussite avant le rattrapage atteint 86%, en baisse de 4,7 points par rapport à l'an passé","https://mobile.francetvinfo.fr/bac/direct-resultats-du-bac-2022-les-candidats-des-differentes-academies-vont-decouvrir-s-ils-ont-decroche-leur-diplome_5237518.html"
"False","True","Crise énergétique : quatre questions sur le ""plan de sobriété"" annoncé par Emmanuel Macron","https://mobile.francetvinfo.fr/economie/energie/crise-energetique-quatre-questions-sur-le-plan-de-sobriete-annonce-par-emmanuel-macron_5257786.html"
"False","True","Onze Français nous racontent leur attachement au Tour de France depuis le bord de la route : ""C'est Noël en plein été""","https://mobile.francetvinfo.fr/tour-de-france/temoignages-onze-francais-nous-racontent-leur-attachement-au-tour-de-france-depuis-le-bord-de-la-route-c-est-noel-en-plein-ete_5254198.html"
"False","True","Entre canicule, Covid-19 et manque de personnel, ""c'est l'été de tous les dangers"" pour les soignants de l'hôpital public","https://mobile.francetvinfo.fr/meteo/canicule/entre-canicule-septieme-vague-de-covid-19-et-manque-de-personnel-c-est-l-ete-de-tous-les-dangers-pour-les-soignants-de-l-hopital-public_5251900.html"
