"premium","picture","title","url"
"True","True","Live Article se déroulant en direct Suivez en direct le second tour de la présidentielle : « Le Pen et ses idées sont encore un grand danger pour notre démocratie, il n’y a pas à hésiter », estiment des électeurs toulousains","https://www.lemonde.fr/politique/live/2022/04/24/election-presidentielle-2022-en-direct-une-journee-de-vote-entre-perte-de-reperes-et-ressentiment-envers-le-gouvernement_6123433_823448.html"
"False","True","La participation était de 26,41 % à midi, en hausse de près d’un point par rapport au premier tour","https://www.lemonde.fr/politique/article/2022/04/24/presidentielle-2022-26-41-de-participation-a-midi-en-hausse-de-pres-d-un-point-par-rapport-au-premier-tour_6123461_823448.html"
"True","True","A Marseille : « Je suis venu voter pour celui que je déteste le moins »","https://www.lemonde.fr/politique/article/2022/04/24/au-second-tour-de-l-election-presidentielle-a-marseille-je-suis-venu-voter-pour-celui-que-je-deteste-le-moins_6123463_823448.html"
"True","True","A Paris : « Entre Macron et Le Pen, j’ai failli ne pas voter »","https://www.lemonde.fr/politique/article/2022/04/24/au-second-tour-de-l-election-presidentielle-a-paris-entre-macron-et-le-pen-j-ai-failli-ne-pas-voter_6123464_823448.html"
"False","False","Emmanuel Macron : ses « chantiers prioritaires» s’il est réélu","https://www.lemonde.fr/election-presidentielle-2022/article/2022/04/24/reforme-des-retraites-ecole-sante-les-chantiers-prioritaires-d-emmanuel-macron-s-il-est-reelu_6123441_6059010.html"
"False","False","Marine Le Pen : ses premiers chantiers si elle est élue","https://www.lemonde.fr/election-presidentielle-2022/article/2022/04/24/priorite-nationale-immigration-pouvoir-d-achat-reforme-des-retraites-les-premiers-chantiers-de-marine-le-pen-si-elle-est-elue-dimanche_6123440_6059010.html"
"False","False","A quoi sert le vote blanc ? Quelle différence avec le vote nul ou l’abstention ?","https://www.lemonde.fr/les-decodeurs/article/2022/04/04/election-presidentielle-2022-a-quoi-sert-le-vote-blanc-quelle-difference-avec-le-nul-ou-l-abstention_6120537_4355770.html"
"False","True","La participation était de 26,41 % à midi, en hausse de près d’un point par rapport au premier tour","https://www.lemonde.fr/politique/article/2022/04/24/presidentielle-2022-26-41-de-participation-a-midi-en-hausse-de-pres-d-un-point-par-rapport-au-premier-tour_6123461_823448.html"
"True","True","A Marseille : « Je suis venu voter pour celui que je déteste le moins »","https://www.lemonde.fr/politique/article/2022/04/24/au-second-tour-de-l-election-presidentielle-a-marseille-je-suis-venu-voter-pour-celui-que-je-deteste-le-moins_6123463_823448.html"
"True","True","A Paris : « Entre Macron et Le Pen, j’ai failli ne pas voter »","https://www.lemonde.fr/politique/article/2022/04/24/au-second-tour-de-l-election-presidentielle-a-paris-entre-macron-et-le-pen-j-ai-failli-ne-pas-voter_6123464_823448.html"
"False","False","Emmanuel Macron : ses « chantiers prioritaires» s’il est réélu","https://www.lemonde.fr/election-presidentielle-2022/article/2022/04/24/reforme-des-retraites-ecole-sante-les-chantiers-prioritaires-d-emmanuel-macron-s-il-est-reelu_6123441_6059010.html"
"False","False","Marine Le Pen : ses premiers chantiers si elle est élue","https://www.lemonde.fr/election-presidentielle-2022/article/2022/04/24/priorite-nationale-immigration-pouvoir-d-achat-reforme-des-retraites-les-premiers-chantiers-de-marine-le-pen-si-elle-est-elue-dimanche_6123440_6059010.html"
"False","False","A quoi sert le vote blanc ? Quelle différence avec le vote nul ou l’abstention ?","https://www.lemonde.fr/les-decodeurs/article/2022/04/04/election-presidentielle-2022-a-quoi-sert-le-vote-blanc-quelle-difference-avec-le-nul-ou-l-abstention_6120537_4355770.html"
"True","True","Covid-19 : les points de fragilité de la couverture vaccinale en France","https://www.lemonde.fr/planete/article/2022/04/24/couverture-vaccinale-contre-le-covid-19-les-faiblesses-francaises_6123416_3244.html"
"True","True","Liège-Bastogne-Liège 2022 : Julian Alaphilippe abandonne, Remco Evenepoel passe à l’attaque","https://www.lemonde.fr/sport/live/2022/04/24/liege-bastogne-liege-2022-suivez-la-course-en-direct_6123458_3242.html"
"True","True","Des mères porteuses ukrainiennes prises au piège de la guerre","https://www.lemonde.fr/m-le-mag/article/2022/04/24/des-meres-porteuses-ukrainiennes-prises-au-piege-de-la-guerre_6123417_4500055.html"
"False","True","« Radio Londres » : d’où viennent les résultats diffusés dans la journée par des médias étrangers ?","https://www.lemonde.fr/les-decodeurs/article/2022/04/24/radio-londres-d-ou-viennent-les-resultats-diffuses-dans-la-journee-par-des-medias-etrangers_6123418_4355771.html"
"True","True","Guerre en Ukraine, en direct : l’ONU demande l’évacuation des civils de Marioupol, le pape François appelle à une trêve dans tout le pays","https://www.lemonde.fr/international/live/2022/04/24/guerre-en-ukraine-l-onu-appelle-a-une-treve-immediate-a-marioupol-pour-evacuer-les-civils_6123429_3210.html"
"True","True","« C’est parfois invisible, mais rien n’est comme avant » : la ville ukrainienne de Tchernivtsi fête Pâques sans joie","https://www.lemonde.fr/international/article/2022/04/24/guerre-en-ukraine-loin-du-front-tchernivtsi-fete-paques-sans-joie_6123462_3210.html"
"True","True","« Derrière la plupart des produits, il n’y a aucune recherche, c’est de la fast beauty » : Tata Harper, la fermière de la cosmétique","https://www.lemonde.fr/m-le-mag/article/2022/04/23/derriere-la-plupart-des-produits-il-n-y-a-aucune-recherche-c-est-de-la-fast-beauty-tata-harper-la-fermiere-de-la-cosmetique_6123400_4500055.html"
"True","True","Un apéro avec Gauz : « Il fallait faire du Zola, du Hugo, c’est ce que j’ai fait »","https://www.lemonde.fr/afrique/article/2022/04/24/un-apero-avec-gauz-il-fallait-faire-du-zola-du-hugo-c-est-ce-que-j-ai-fait_6123410_3212.html"
"False","False","Naufrage d’un bateau de migrants au large du Liban : quarante-huit personnes secourues, six morts","https://www.lemonde.fr/international/article/2022/04/24/au-moins-un-enfant-mort-dans-le-naufrage-d-un-bateau-de-migrants-au-large-du-liban_6123412_3210.html"
"False","False","MotoGP : Fabio Quartararo l’emporte devant Johann Zarco au Grand Prix du Portugal","https://www.lemonde.fr/sport/article/2022/04/24/motogp-fabio-quartararo-l-emporte-devant-johann-zarco-au-grand-prix-du-portugal_6123465_3242.html"
"False","False","Nice : un prêtre blessé au couteau dans une attaque sans « caractère terroriste a priori » ; l’assaillant a été arrêté","https://www.lemonde.fr/societe/article/2022/04/24/nice-un-pretre-blesse-au-couteau-dans-une-attaque-sans-caractere-terroriste-a-priori-l-assaillant-a-ete-arrete_6123459_3224.html"
"True","False","« Rien que le noir », de William McIlvanney et Ian Rankin : le salut de Ian Rankin à son mentor","https://www.lemonde.fr/livres/article/2022/04/23/rien-que-le-noir-de-william-mcilvanney-et-ian-rankin-le-salut-de-ian-rankin-a-son-mentor_6123403_3260.html"
"False","False","Nigeria : au moins quatre-vingts morts lors d’une explosion dans une raffinerie illégale","https://www.lemonde.fr/afrique/article/2022/04/24/nigeria-au-moins-quatre-vingts-morts-lors-d-une-explosion-dans-une-raffinerie-illegale_6123453_3212.html"
"True","False","« Certains jeunes ne savent pas que le cannabis est un produit interdit »","https://www.lemonde.fr/m-le-mag/article/2022/04/23/certains-jeunes-ne-savent-pas-que-le-cannabis-est-un-produit-interdit_6123385_4500055.html"
"True","False","A la Cité de l’architecture, plongée dans l’esprit et les trésors du Pérou","https://www.lemonde.fr/culture/article/2022/04/24/a-la-cite-de-l-architecture-plongee-dans-l-esprit-et-les-tresors-du-perou_6123454_3246.html"
"False","False","Formule 1 : « La Ferrari se comporte telle qu’on l’a pensée, dessinée et développée »","https://www.lemonde.fr/sport/article/2022/04/24/formule-1-la-ferrari-se-comporte-telle-qu-on-l-a-pensee-dessinee-et-developpee_6123445_3242.html"
"True","True","Pâtissier, fromager, apiculteur, ébéniste… Se reconvertir dans un métier manuel, du fantasme à la réalité","https://www.lemonde.fr/campus/article/2022/04/24/patissier-fromager-apiculteur-ebeniste-se-reconvertir-dans-un-metier-manuel-du-fantasme-a-la-realite_6123413_4401467.html"
"True","True","Dans l’intimité de quatre fumeurs de cannabis : « Ce système à la Uber, ça a changé ma vie. En tant que meuf, tu n’as pas peur de faire une mauvaise rencontre »","https://www.lemonde.fr/m-le-mag/article/2022/04/23/dans-le-quotidien-de-quatre-fumeurs-de-cannabis-je-range-l-herbe-dans-des-pots-de-nescafe-c-est-un-peu-mes-conserves_6123339_4500055.html"
"True","True","Covid-19 : à Shanghaï, la censure renforce la colère des habitants","https://www.lemonde.fr/international/article/2022/04/23/a-shanghai-la-censure-renforce-la-colere-des-habitants_6123398_3210.html"
"False","False","L’éditorial du « Monde » : empêcher le pays de se défaire","https://www.lemonde.fr/idees/article/2022/04/22/empecher-le-pays-de-se-defaire_6123258_3232.html"
"True","True","Israéliens et Palestiniens au miroir de l’Ukraine","https://www.lemonde.fr/un-si-proche-orient/article/2022/04/24/israeliens-et-palestiniens-au-miroir-de-l-ukraine_6123430_6116995.html"
"True","True","« Les scénarios de l’élection de Trump et du Brexit présentent de troublantes similitudes avec le duel Macron-Le Pen »","https://www.lemonde.fr/election-presidentielle-2022/article/2022/04/22/les-scenarios-de-l-election-de-trump-et-du-brexit-presentent-de-troublantes-similitudes-avec-le-duel-macron-le-pen_6123324_6059010.html"
