"premium","picture","title","url"
"True","True","Agression de Kheira Hamraoui : Aminata Diallo présentée à un juge, de nouveaux éléments incriminants","https://www.leparisien.fr/faits-divers/agression-de-kheira-hamraoui-son-ex-coequipiere-aminata-diallo-va-etre-presentee-a-un-juge-16-09-2022-BIS6ZFBHYJFA5ITLME46TCNMAU.php"
"True","True","Résistance, bombardements : et si l’emprise russe en Crimée se fissurait aussi ?","https://www.leparisien.fr/international/resistance-bombardements-et-si-lemprise-russe-en-crimee-se-fissurait-aussi-16-09-2022-35BYGPIB4BBKJHT5VKUXVKMYQ4.php"
"False","True","Fillettes défenestrées dans la Loire : la plus jeune est décédée, le père en garde à vue","https://www.leparisien.fr/faits-divers/il-aurait-jete-ses-deux-fillettes-par-la-fenetre-un-pere-en-garde-a-vue-dans-la-loire-16-09-2022-6X6WV22J2JEQTNMJHLFFB6ZMNE.php"
"True","True","TV, lave-linge et smartphones… pourquoi les prix de vente de l’électronique et de l’électroménager s’envolent","https://www.leparisien.fr/high-tech/tv-lave-linge-et-smartphones-pourquoi-les-prix-de-vente-de-lelectronique-et-de-lelectromenager-senvolent-16-09-2022-KBUYJ57CGBFLVGRX6PMZL7WKVI.php"
"False","True","Fosse commune, tombes numérotées... que sait-on des corps découverts à Izioum ?","https://www.leparisien.fr/international/guerre-en-ukraine-que-sait-on-des-corps-decouverts-a-izioum-16-09-2022-AONDLXHVHJGA7LRSWBGYIUVE6U.php"
"True","True","Paul Pogba : le rôle très actif de son frère, Mathias, parmi les maîtres chanteurs","https://www.leparisien.fr/faits-divers/affaire-paul-pogba-le-role-tres-actif-de-son-frere-mathias-parmi-les-maitres-chanteurs-15-09-2022-2HZEII3HAJGN3LCYPZCECI7KBY.php"
"False","True","Equipe de France : Boubacar Kamara remplace Adrien Rabiot","https://www.leparisien.fr/sports/football/equipe-de-france-boubacar-kamara-remplace-adrien-rabiot-16-09-2022-FD6T5UVC5JFA5HYRMP2IDKNRRM.php"
"False","True","TF1 : «Danse avec les stars» dévoilera ce vendredi soir le visage d’une candidate de la future «Star Academy»","https://www.leparisien.fr/culture-loisirs/tv/tf1-danse-avec-les-stars-devoilera-ce-vendredi-soir-le-visage-dune-candidate-de-la-future-star-academy-16-09-2022-XS6MVQG2GVEXHANPOKNQM5DJKQ.php"
"True","True","Journées du patrimoine : nos dix coups de cœur, en Île-de-France et en régions","https://www.leparisien.fr/culture-loisirs/journees-du-patrimoine-nos-10-coups-de-coeur-en-ile-de-france-et-en-regions-14-09-2022-P26POIGCTJDAZCAWEDH3TPGU2U.php"
"True","True","Au Cap-d’Agde, les enjeux de la rentrée parlementaire du RN","https://www.leparisien.fr/politique/au-cap-dagde-les-enjeux-de-la-rentree-parlementaire-du-rn-16-09-2022-ZKBCF7HFD5GJJMQD4STHASGCCE.php"
"True","True","Laura Smet débute au théâtre : «C’est pour mon fils que je le fais»","https://www.leparisien.fr/culture-loisirs/laura-smet-debute-au-theatre-cest-pour-mon-fils-que-je-le-fais-16-09-2022-NWSCFCVKJRBF3JC5ZSVBH7PQRU.php"
"True","True","Salaires : êtes-vous bien payé pour le métier que vous exercez ? Notre simulateur en ligne","https://www.leparisien.fr/economie/emploi/salaires-etes-vous-bien-paye-pour-le-metier-que-vous-exercez-notre-simulateur-en-ligne-15-09-2022-ZCKVY62INNEG7JSK3CN2QWCOHA.php"
"False","True","14 heures d’attente et 8 kilomètres de queue pour voir le cercueil, la file suspendue","https://www.leparisien.fr/international/mort-delizabeth-ii-14-heures-dattente-et-8-kilometres-de-queue-pour-voir-le-cercueil-de-la-souveraine-la-file-suspendue-16-09-2022-7RZMQL5L55E2JCC5MNVHWPM6IA.php"
"False","True","Avant les funérailles, Charles III boucle sa tournée de nouveau roi","https://www.leparisien.fr/international/mort-delizabeth-ii-avant-les-funerailles-charles-iii-boucle-sa-tournee-de-nouveau-roi-16-09-2022-KSUP2O4I7RF4FI4YSBZSXZAHQU.php"
"False","True","Le pape François ne se rendra pas aux funérailles d'Elizabeth II","https://www.leparisien.fr/societe/mort-delizabeth-ii-le-pape-francois-ne-se-rendra-pas-aux-funerailles-16-09-2022-UNZAR7XAKRDQVBJZ3HRLHZ4JYY.php"
"False","True","Le récit de l’ultime procession royale de Buckingham Palace au palais de Westminster","https://www.leparisien.fr/international/mort-delizabeth-ii-le-recit-de-lultime-procession-royale-vers-le-palais-de-westminster-14-09-2022-74XHZEPBKVDITDVDJQPBNWDNVA.php"
"False","True","Un garde royal s’effondre pendant la veillée à Westminster","https://www.leparisien.fr/international/mort-delizabeth-ii-un-garde-royal-seffondre-pendant-la-veillee-a-westminster-15-09-2022-7EAAY73YINHCJFG6REGNEGWZXY.php"
"False","True","Val-de-Marne : le tunnel de Champigny fermé dans les deux sens sur l’autoroute A4","https://www.leparisien.fr/info-paris-ile-de-france-oise/transports/val-de-marne-le-tunnel-de-champigny-ferme-dans-les-deux-sens-sur-lautoroute-a4-16-09-2022-43ZK7MT7YFBDNJW7NYA2XRUJAA.php"
"True","True","Féminicide dans les Yvelines : un agent SNCF soupçonné d’avoir étranglé son ex-compagne","https://www.leparisien.fr/yvelines-78/feminicide-dans-les-yvelines-un-agent-sncf-soupconne-davoir-etrangle-son-ex-compagne-16-09-2022-YPMMH2JKUFHDBAXBJ5NVCRVC3Y.php"
"True","True","«En danger dans son pays» : à Paris, l’expulsion probable d’un sans-papiers séropositif en question","https://www.leparisien.fr/paris-75/en-danger-dans-son-pays-a-paris-lexpulsion-probable-dun-sans-papiers-atteint-du-sida-en-question-16-09-2022-KF3W45TSPFDSPL2AS6HTV6DQNA.php"
"True","True","Dix ans après, «l’immeuble maudit» de Montrouge n’a pas oublié l’effondrement des cinq balcons","https://www.leparisien.fr/hauts-de-seine-92/dix-ans-apres-limmeuble-maudit-montrouge-na-pas-oublie-leffondrement-des-cinq-balcons-16-09-2022-S66JAWQPUBBMPKAKA5CL4E4MGQ.php"
"False","True","VIDÉO. «Vendus !» : à Izioum en Ukraine, des habitants accusés d’avoir collaboré avec les Russes","https://www.leparisien.fr/video/video-vendus-a-izioum-en-ukraine-des-habitants-accuses-davoir-collabore-avec-les-russes-16-09-2022-VDRPUWJX6RGQHDG6SH6FS6Y4UI.php"
"False","True","VIDÉO. Chez Starbucks, faut-il boire la boisson préférée de Léna Situations, le refresha citron vert ?","https://www.leparisien.fr/video/video-chez-starbucks-faut-il-boire-la-boisson-preferee-de-lena-situations-le-refresha-citron-vert-16-09-2022-DU6JH5H3VNDI7INM3VJXLQ3SQA.php"
"False","True","VIDÉO. En Chine, les images impressionnantes d’un gratte-ciel ravagé par un violent incendie","https://www.leparisien.fr/faits-divers/en-chine-les-images-impressionnantes-dun-gratte-ciel-ravage-par-un-violent-incendie-16-09-2022-UFPFGQZU4BEIJFVSG5Y5HYJZYI.php"
"False","True","VIDÉO. États-Unis : le gouverneur du Texas envoie deux bus de migrants chez Kamala Harris, pour dénoncer sa politique migratoire","https://www.leparisien.fr/video/video-etats-unis-le-gouverneur-du-texas-envoie-deux-bus-de-migrants-chez-kamala-harris-pour-denoncer-sa-politique-migratoire-16-09-2022-Y2BS5MUWYRFXPD6TJZOJWGV2OI.php"
"True","True","Au Cap-d’Agde, les enjeux de la rentrée parlementaire du RN","https://www.leparisien.fr/politique/au-cap-dagde-les-enjeux-de-la-rentree-parlementaire-du-rn-16-09-2022-ZKBCF7HFD5GJJMQD4STHASGCCE.php"
"True","True","Le cumul des mandats de retour ? Le débat relancé dans la majorité... et dans l’opposition","https://www.leparisien.fr/politique/le-cumul-des-mandats-de-retour-le-debat-relance-dans-la-majorite-et-dans-lopposition-16-09-2022-NIC55RHD7FDHBIPKZBWLHGGKZY.php"
"False","True","L’ancien maire de Lyon Gérard Collomb annonce être atteint d’un cancer","https://www.leparisien.fr/politique/gerard-collomb-annonce-etre-atteint-dun-cancer-16-09-2022-XVOXPMPJIFHPRC57GMRVYJCMG4.php"
"True","True","Élisabeth Borne et Édouard Philippe, le surprenant couple de la rentrée","https://www.leparisien.fr/politique/elisabeth-borne-et-edouard-philippe-le-surprenant-couple-de-la-rentree-16-09-2022-4UMRTIMRHFCDZOE3MP7M36M3DM.php"
"False","True","Aucune sanction pour un ex-juge d’instruction de Monaco, revers pour Dupond-Moretti","https://www.leparisien.fr"
"False","False","Paris - Neuilly-sur-Seine : deux Cubains spécialistes du «vol à la tache» arrêtés en flagrant délit","https://www.leparisien.fr/faits-divers/paris-neuilly-sur-seine-deux-cubains-specialistes-du-vol-a-la-tache-arretes-en-flagrant-delit-16-09-2022-7KLG4VBBBRC75KPPRSUE2RZQGA.php"
"True","False","Féminicide dans les Yvelines : un agent SNCF soupçonné d’avoir étranglé son ex-compagne","https://www.leparisien.fr/yvelines-78/feminicide-dans-les-yvelines-un-agent-sncf-soupconne-davoir-etrangle-son-ex-compagne-16-09-2022-YPMMH2JKUFHDBAXBJ5NVCRVC3Y.php"
"False","False","Universitaire franco-guinéen battu à mort près de Rouen : l’auteur condamné à neuf ans de prison","https://www.leparisien.fr/faits-divers/universitaire-franco-guineen-battu-a-mort-pres-de-rouen-lauteur-condamne-a-neuf-ans-de-prison-16-09-2022-Z4ZOPSZKYZGR7CCQGPXBRCRZAU.php"
"False","False","Sauvée des nazis, la Torah de Schirmeck de retour en Alsace 77 ans plus tard","https://www.leparisien.fr/bas-rhin-67/sauvee-des-nazis-la-torah-de-schirmeck-de-retour-en-alsace-77-ans-plus-tard-16-09-2022-RNYKVH3AYJE4DB4BBH3N6MCQ7U.php"
"False","False","Salmonelles dans des Kinder : l’usine belge de Ferrero peut reprendre une production normale","https://www.leparisien.fr/societe/sante/salmonelles-dans-des-kinder-lusine-belge-de-ferrero-peut-reprendre-une-production-normale-16-09-2022-TSOOCHXNFNCZ7JLJPK7W4Y2224.php"
"False","False","Sables-d’Olonne : la justice confirme l’enlèvement de la statue de Saint-Michel","https://www.leparisien.fr/vendee-85/sables-dolonne-la-justice-confirme-lenlevement-de-la-statue-de-saint-michel-16-09-2022-RX5VTYSIKJFF3HRTZQI23BUJOY.php"
"True","False","TV, lave-linge et smartphones… pourquoi les prix de vente de l’électronique et de l’électroménager s’envolent","https://www.leparisien.fr/high-tech/tv-lave-linge-et-smartphones-pourquoi-les-prix-de-vente-de-lelectronique-et-de-lelectromenager-senvolent-16-09-2022-KBUYJ57CGBFLVGRX6PMZL7WKVI.php"
"True","False","Ces salariés sont revenus chez leur ancien employeur : «Dès le lendemain de mon départ, j’ai su que je faisais une erreur»","https://www.leparisien.fr/vie-de-bureau/ces-salaries-sont-revenus-chez-leur-ancien-employeur-des-le-lendemain-de-mon-depart-jai-su-que-je-faisais-une-erreur-20-09-2022-B7EZ5DFLMNFUHKCU2LOBNYP7WQ.php"
"False","False","Le roi du kebab Hakim Benotmane rêve d’une nouvelle success-story","https://www.leparisien.fr/bien-manger/le-roi-du-kebab-hakim-benotmane-reve-dune-nouvelle-success-story-16-09-2022-36MU5S7B5ZEE3PVHB2Z3JF2VME.php"
"True","False","Résistance, bombardements : et si l’emprise russe en Crimée se fissurait aussi ?","https://www.leparisien.fr/international/resistance-bombardements-et-si-lemprise-russe-en-crimee-se-fissurait-aussi-16-09-2022-35BYGPIB4BBKJHT5VKUXVKMYQ4.php"
"False","False","VIDÉO. «Vendus !» : à Izioum en Ukraine, des habitants accusés d’avoir collaboré avec les Russes","https://www.leparisien.fr/video/video-vendus-a-izioum-en-ukraine-des-habitants-accuses-davoir-collabore-avec-les-russes-16-09-2022-VDRPUWJX6RGQHDG6SH6FS6Y4UI.php"
"False","False","Liban : cinq braquages de banques en une journée pour retirer ses économies","https://www.leparisien.fr/international/liban-cinq-braquages-de-banques-en-une-journee-pour-retirer-ses-economies-16-09-2022-IAEESZ2WWREKFJD6LZKEHJFYKE.php"
"True","True","Faux papiers, travail dissimulé… le trafic de cartes de chauffeurs VTC aurait coûté plus de 3 millions d’euros à l’État","https://www.leparisien.fr/hauts-de-seine-92/faux-papiers-travail-dissimule-le-trafic-de-cartes-de-chauffeurs-vtc-aurait-coute-plus-de-3-millions-deuros-a-letat-15-09-2022-D5YNWMTQURDLHFQW2QMJNA4QRE.php"
"False","True","PSG féminin : Sarah Bouhaddi est Parisienne","https://www.leparisien.fr/sports/football/psg/psg-feminin-sarah-bouhaddi-est-parisienne-16-09-2022-QOE56IMWC5EZ3CEAI46RVQ2R5M.php"
"True","True","Carton jaune lors de Haifa-PSG : les arbitres manquent-ils de respect envers Neymar ?","https://www.leparisien.fr/sports/football/psg/carton-jaune-lors-de-maccabi-haifa-psg-les-arbitres-manquent-ils-de-respect-envers-neymar-15-09-2022-RYJNWF5SOVFXXFQC7TUW6N6W34.php"
"False","True","Handball : le PSG chute d’entrée à Veszprém (36-34)","https://www.leparisien.fr/sports/football/psg/handball-le-psg-chute-dentree-a-veszprem-36-34-15-09-2022-GF4JJ7EUEJEUHI3CF2HOIZIKYI.php"
"False","True","Agression de la joueuse du PSG Kheira Hamraoui : les confessions en pointillés des suspects","https://www.leparisien.fr/faits-divers/agression-de-la-joueuse-du-psg-kheira-hamraoui-les-confessions-en-pointilles-des-suspects-15-09-2022-METAWSOQ3JF7XPWHJFTBSJ2UZA.php"
"True","True","Roger Federer, fin de parcours d’une légende : pourquoi le monde du tennis perd son roi","https://www.leparisien.fr/sports/tennis/roger-federer-fin-de-parcours-dune-legende-pourquoi-le-monde-du-tennis-perd-son-roi-15-09-2022-LQDFEFBXXJFNJG2P7JMOKFIF44.php"
"False","True","De la magie, des coups improbables : les plus beaux points de la carrière de Federer","https://www.leparisien.fr/sports/tennis/de-la-magie-des-coups-improbables-retrouvez-les-plus-beaux-points-de-la-carriere-de-federer-16-09-2022-3GV7BBGMF5G6PO4CW45ADFVNOM.php"
"False","True","Serena Williams souhaite à Roger Federer la «bienvenue au club des retraités»","https://www.leparisien.fr/sports/tennis/serena-williams-souhaite-a-roger-federer-la-bienvenue-au-club-des-retraites-16-09-2022-P7ET34SV3RBELEK635BMEAM7B4.php"
