"premium","picture","title","url"
"False","True","Variole du singe: François Braun annonce l'ouverture d'un grand centre de vaccination en Île-de-France","https://www.bfmtv.com/sante/variole-du-singe-francois-braun-annonce-l-ouverture-d-un-grand-centre-de-vaccination-en-ile-de-france_AD-202207250507.html"
"False","True","""On attend d'être débordés"": la France prend-elle suffisamment la mesure de l'épidémie de variole du singe?","https://www.bfmtv.com/sante/on-attend-d-etre-debordes-la-france-prend-elle-suffisamment-la-mesure-de-l-epidemie-de-variole-du-singe_AN-202207250389.html"
"False","True","Variole du singe: la mairie de Paris réclame plus de doses de vaccin et plus de personnel","https://www.bfmtv.com/paris/variole-du-singe-la-mairie-de-paris-reclame-plus-de-doses-de-vaccin-et-plus-de-personnel_AD-202207250489.html"
"False","True","Covid-19: l'Assemblée adopte le projet de loi amendé par le Sénat","https://www.bfmtv.com/politique/parlement/covid-19-l-assemblee-adopte-le-projet-de-loi-amende-par-le-senat_AN-202207250399.html"
"False","True","Covid-19: ce que contient le texte adopté par l'Assemblée nationale","https://www.bfmtv.com/politique/parlement/covid-19-ce-que-contient-le-texte-qui-revient-a-l-assemblee-nationale_AN-202207250323.html"
"False","True","JO 2024: date d’ouverture, tarifs… Toutes les infos sur la billetterie des Jeux olympiques à Paris","https://rmcsport.bfmtv.com/jeux-olympiques/jo-2024-date-d-ouverture-tarifs-toutes-les-infos-sur-la-billetterie-des-jeux-olympiques-a-paris_AV-202207250436.html"
"False","False","Paris 2024: Emmanuel Macron veut des JO ""inoubliables, surprenants et uniques""","https://rmcsport.bfmtv.com/jeux-olympiques/paris-2024-emmanuel-macron-veut-des-jo-inoubliables-surprenants-et-uniques_AV-202207250324.html"
"False","True","JO 2024: on connait le slogan des Jeux olympiques à Paris","https://rmcsport.bfmtv.com/jeux-olympiques/jo-2024-on-connait-le-slogan-des-jeux-olympiques-a-paris_AV-202207250429.html"
"False","True","Policiers agressés à Lyon: un homme de 25 ans interpellé","https://www.bfmtv.com/lyon/policiers-agresses-a-lyon-un-homme-de-26-ans-interpelle_AN-202207250285.html"
"False","False","Policiers blessés à Lyon: mis ""hors de cause"", le suspect évoqué par Darmanin sera quand…","https://www.bfmtv.com/lyon/policiers-agresses-a-lyon-darmanin-annonce-qu-un-delinquant-etranger-va-etre-expulse_AN-202207240141.html"
"False","True","L'Eurovision 2023 aura lieu au Royaume-Uni, malgré la victoire de l'Ukraine en 2022","https://www.bfmtv.com/people/musique/l-eurovision-2023-aura-lieu-au-royaume-uni-malgre-la-victoire-de-l-ukraine-en-2022_AD-202207250274.html"
"False","True","Ce nouveau type de radar que vous risquez de croiser sur la route des vacances","https://www.bfmtv.com/auto/ce-nouveau-type-de-radar-que-vous-risquez-de-croiser-sur-la-route-des-vacances_AV-202207250234.html"
"False","True","Carburant: ces enseignes qui mettent en place des ""ristournes"" supplémentaires à la pompe","https://www.bfmtv.com/economie/entreprises/transports/carburant-ces-enseignes-qui-mettent-en-place-des-ristournes-supplementaires-a-la-pompe_AV-202207250240.html"
"False","True","Je sais ce que c'est la gauche pastèque, c'est à dire vert dehors et rouge dedans.. Olivier Véran","https://www.bfmtv.com/politique/olivier-veran-critique-une-gauche-pasteque-vert-dehors-et-rouge-dedans_AN-202207250026.html"
"False","True","Incendies: va-t-il falloir s'habituer à une multiplication des feux chaque été?","https://www.bfmtv.com/meteo/canicule/incendies-va-t-il-falloir-s-habituer-a-une-multiplication-des-feux-chaque-ete_AV-202207250197.html"
"False","True","EN DIRECT - Gironde: l'incendie de Landiras est désormais ""fixé""","https://www.bfmtv.com/societe/en-direct-gironde-l-incendie-de-landiras-est-desormais-fixe_LN-202207250178.html"
"False","True","Mantes-la-Jolie: le calvaire des habitants d'une tour de 17 étages, régulièrement privés…","https://www.bfmtv.com/paris/mantes-la-jolie-le-calvaire-des-habitants-d-une-tour-de-17-etages-regulierement-prives-d-ascenseur_AV-202207250085.html"
"False","True","Restaurant parisien accusé de racisme: l'ex-vigile se défend et évoque des ""consignes de…","https://www.bfmtv.com/police-justice/accusations-de-racisme-au-restaurant-manko-l-ex-vigile-se-defend-et-evoque-des-consignes-de-managers_AV-202207250107.html"
"False","True","Ricard, Cristaline, Nutella... Les produits les plus vendus en grandes surfaces depuis le…","https://www.bfmtv.com/economie/consommation/ricard-cristaline-nutella-les-produits-les-plus-vendus-en-grandes-surfaces-depuis-le-debut-de-l-annee_AV-202207250277.html"
"False","True","Pénuries dans les aéroports: un géant des services conseille de ne prendre que des…","https://www.bfmtv.com/economie/entreprises/transports/penuries-dans-les-aeroports-un-geant-des-services-conseille-de-ne-prendre-que-des-bagages-a-main_AV-202207250036.html"
"False","True","Pourquoi les coups de soleil ont des effets dangereux à long terme sur votre peau","https://www.bfmtv.com/sante/pourquoi-les-coups-de-soleil-ont-des-effets-dangereux-a-long-terme-sur-votre-peau_AN-202207250305.html"
"False","True","""Le Boulet"": l'histoire secrète de la comédie culte avec Gérard Lanvin et Benoît…","https://www.bfmtv.com/people/cinema/le-boulet-l-histoire-secrete-de-la-comedie-culte-avec-gerard-lanvin-et-benoit-poelvoorde_AN-202207250213.html"
"False","True","Brûlés, intoxiqués ou affamés... la détresse des animaux victimes des incendies en Gironde","https://www.bfmtv.com/animaux/brules-intoxiques-ou-affames-la-detresse-des-animaux-victimes-des-incendies-en-gironde_AV-202207220585.html"
"False","True","Pénurie de moutarde: quand reviendra-t-elle dans les rayons?","https://www.bfmtv.com/economie/consommation/penurie-de-moutarde-quand-reviendra-t-elle-dans-les-rayons_AV-202207210441.html"
"False","True","Mantes-la-Jolie: le calvaire des habitants d'une tour de 17 étages, régulièrement privés…","https://www.bfmtv.com/paris/mantes-la-jolie-le-calvaire-des-habitants-d-une-tour-de-17-etages-regulierement-prives-d-ascenseur_AV-202207250085.html"
"False","True","Hérault: un périmètre de sécurité mis en place sur une plage pour protéger la ponte d'une…","https://www.bfmtv.com/animaux/herault-un-perimetre-de-securite-mis-en-place-sur-une-plage-pour-proteger-la-ponte-d-une-tortue_AV-202207250233.html"
"False","True","""Le Boulet"": l'histoire secrète de la comédie culte avec Gérard Lanvin et Benoît…","https://www.bfmtv.com/people/cinema/le-boulet-l-histoire-secrete-de-la-comedie-culte-avec-gerard-lanvin-et-benoit-poelvoorde_AN-202207250213.html"
"False","True","Le parquet financier ouvre une enquête sur les biens d'oligarques russes en France","https://www.bfmtv.com/international/le-parquet-financier-ouvre-une-enquete-sur-les-biens-d-oligarques-russes-en-france_AD-202207250423.html"
"False","True","Remise à la pompe de TotalEnergies: les autres stations-service craignent une ""évasion de clientèle""","https://www.bfmtv.com/economie/entreprises/energie/remise-a-la-pompe-de-total-energies-les-autres-stations-service-craignent-une-evasion-de-clientele_AD-202207250411.html"
"False","True","Ikea, Fnac Darty, Decathlon… Les grandes enseignes accélèrent sur les économies d'énergie","https://www.bfmtv.com/economie/entreprises/energie/ikea-fnac-darty-decathlon-les-grandes-enseignes-accelerent-sur-les-economies-d-energie_AV-202207250376.html"
"False","True","Remplacée par une remise de 30 centimes, l’aide carburants ""gros rouleurs"" définitivement enterrée?","https://www.bfmtv.com/economie/economie-social/france/remplacee-par-une-remise-de-30-centimes-l-aide-carburants-gros-rouleurs-definitivement-enterree_AV-202207250362.html"
"False","True","Guerre en Ukraine: le parquet financier ouvre une enquête sur les biens d'oligarques russes en France","https://www.bfmtv.com/economie/guerre-en-ukraine-le-parquet-financier-ouvre-une-enquete-sur-les-biens-d-oligarques-russes-en-france_AD-202207250356.html"
"False","True","JO 2024: on connait le slogan des Jeux olympiques à Paris","https://rmcsport.bfmtv.com/jeux-olympiques/jo-2024-on-connait-le-slogan-des-jeux-olympiques-a-paris_AV-202207250429.html"
"False","True","JO 2024: date d’ouverture, tarifs… Toutes les infos sur la billetterie des Jeux olympiques à Paris","https://rmcsport.bfmtv.com/jeux-olympiques/jo-2024-date-d-ouverture-tarifs-toutes-les-infos-sur-la-billetterie-des-jeux-olympiques-a-paris_AV-202207250436.html"
"False","True","Tour de France femmes: Marianne Vos remporte la 2e étape et s'empare du maillot jaune","https://rmcsport.bfmtv.com/cyclisme/tour-de-france/tour-de-france-femmes-marianne-vos-remporte-la-2e-etape-et-s-empare-du-maillot-jaune_AD-202207250396.html"
"False","True","Bordeaux: le CNOSF donne un avis favorable pour le maintien des Girondins en Ligue 2","https://rmcsport.bfmtv.com/football/ligue-2/bordeaux-le-cnosf-donne-un-avis-favorable-pour-le-maintien-des-girondins-en-ligue-2_AN-202207250262.html"
"False","True","Mercato: Mukiele va s'engager pour cinq ans avec le PSG","https://rmcsport.bfmtv.com/football/transferts/mercato-mukiele-va-s-engager-pour-cinq-ans-avec-le-psg_AV-202207250293.html"
"False","True","""J'ai pleuré tous les soirs pendants un an"" : fausses couches, vraies souffrances","https://www.bfmtv.com/societe/j-ai-pleure-tous-les-soirs-pendant-un-an-fausse-couche-vraies-souffrances_AN-202206230011.html"
"False","True","Carte. Résultats élections législatives 2022 : La France du vote RN au premier tour","https://www.bfmtv.com/politique/elections/legislatives/carte-resultats-elections-legislatives-2022-la-france-du-vote-rn-au-premier-tour_GN-202206130020.html"
"False","True","Lascaux, Chauvet, Cosquer...Le nouvel eldorado touristique des grottes préhistoriques","https://www.bfmtv.com/economie/lascaux-chauvet-cosquer-le-nouvel-eldorado-touristique-des-grottes-prehistoriques_GN-202206040051.html"
"False","True","Guerre en Ukraine : 100 jours de conflit racontés en images satellite","https://www.bfmtv.com/international/guerre-en-ukraine-100-jours-de-conflits-racontes-en-images-satellite_AN-202206030031.html"
"False","True","Entre l'Ukraine et la Russie, une histoire contrariée","https://www.bfmtv.com/international/entre-l-ukraine-et-la-russie-une-histoire-contrariee_GN-202205090013.html"
"False","True","PMA pour toutes : 9 mois après, l'attente se prolonge pour les femmes","https://www.bfmtv.com/societe/pma-pour-toutes-9-mois-apres-l-attente-se-prolonge-pour-les-femmes_GN-202205020004.html"
"False","True","En septembre, la Fête de l'Humanité pose ses valises en Essonne","https://www.bfmtv.com/paris/en-septembre-la-fete-de-l-humanite-pose-ses-valises-en-essonne_AD-202207250494.html"
"False","True","""C'était la bonne décision"": Adele reprogramme sa résidence à Las Vegas","https://www.bfmtv.com/people/musique/c-etait-la-bonne-decision-adele-reprogramme-sa-residence-a-las-vegas_AN-202207250464.html"
"False","True","Eurovision 2023 au Royaume-Uni: l'Ukraine finalement satisfaite","https://www.bfmtv.com/people/musique/eurovision-2023-au-royaume-uni-l-ukraine-finalement-satisfaite_AD-202207250408.html"
"False","True","Mort de David Warner, acteur de ""Titanic""","https://www.bfmtv.com/people/cinema/mort-de-david-warner-acteur-de-titanic_AN-202207250312.html"
"False","True","Le rappeur Mister You arrêté à Orly et incarcéré","https://www.bfmtv.com/people/musique/le-rappeur-mister-you-arrete-a-orly-et-incarcere_AD-202207250281.html"
"False","True","Citédia, pour le développement et l’attractivité du territoire","https://www.bfmtv.com/pratique/entreprises-d-avenir/citedia-pour-le-developpement-et-l-attractivite-du-territoire_AB-202207220026.html"
"False","True","SAS NEPTUNE : Rénovation énergétique des bâtiments","https://www.bfmtv.com/economie/entreprises/sas-neptune-renovation-energetique-des-batiments_AO-202207130001.html"
