"premium","picture","title","url"
"False","True","DIRECT - Guerre en Ukraine : les défenseurs de Marioupol «combattront jusqu'au bout», déclare le premier ministre","https://www.lefigaro.fr/international/direct-guerre-en-ukraine-l-etau-se-resserre-a-marioupol-autour-des-derniers-combattants-ukrainiens-20220417"
"False","False","Guerre en Ukraine: Zelensky dit avoir invité Macron à venir constater l'existence d'un «génocide»","https://www.lefigaro.fr/international/guerre-en-ukraine-zelensky-dit-avoir-invite-macron-a-venir-constater-l-existence-d-un-genocide-20220417"
"False","False","Ces semaines de martyre imposées par les Russes aux villages du Sud: le récit de l’envoyé spécial du Figaro","https://www.lefigaro.fr/international/ces-semaines-de-martyre-imposees-par-les-russes-aux-villages-du-sud-le-recit-de-l-envoye-special-du-figaro-20220415"
"False","False","La Russie diffuse une vidéo présentée comme montrant des rescapés du croiseur Moskva","https://www.lefigaro.fr/international/la-russie-diffuse-une-video-presentee-comme-montrant-des-rescapes-du-croiseur-moskva-20220416"
"True","True","La France va-t-elle faire face à un «mur d'inflation dans les semaines qui viennent ?»","https://www.lefigaro.fr/societes/la-france-va-t-elle-faire-face-a-un-mur-d-inflation-dans-les-semaines-qui-viennent-20220416"
"False","False","Du fait de l'inflation, le Smic augmentera de 2,65% le 1er mai","https://www.lefigaro.fr/conjoncture/inflation-le-smic-augmentera-automatiquement-de-2-65-le-1er-mai-20220415"
"False","False","LA VÉRIFICATION - Le pouvoir d'achat a-t-il vraiment baissé sous le quinquennat d'Emmanuel Macron ?","https://www.lefigaro.fr/conso/le-pouvoir-d-achat-a-t-il-vraiment-baisse-sous-le-quinquennat-d-emmanuel-macron-20220415"
"False","False","LA VÉRIFICATION - Pouvoir d'achat : serait-il efficace d'appliquer une TVA à 0% sur les produits de base ?","https://www.lefigaro.fr/conso/pouvoir-d-achat-serait-il-efficace-d-appliquer-une-tva-a-0-sur-les-produits-de-base-20220415"
"False","True","DIRECT - Présidentielle 2022 : l'interdiction du voile n'est plus la priorité de Marine Le Pen, selon ses lieutenants","https://www.lefigaro.fr/elections/presidentielles/direct-presidentielle-2022-julien-bayou-ne-croit-pas-en-un-emmanuel-macron-ecolo-20220417"
"False","False","REPORTAGE - «Diriger le pays en mère de famille» : en Eure-et-Loir, Marine Le Pen veut rassurer","https://www.lefigaro.fr/elections/presidentielles/presidentielle-2022-en-eure-et-loir-marine-le-pen-rassure-autant-qu-elle-se-rassure-20220416"
"False","False","Accusations de détournement d'argent public européen : le camp Le Pen dénonce un «montage grossier»","https://www.lefigaro.fr/elections/presidentielles/accusations-de-detournement-d-argent-public-europeen-le-camp-le-pen-denonce-un-montage-grossier-20220417"
"False","True","Présidentielle 2022 : Blanquer met en garde contre «l'arrivée de l'extrême droite», Aliot récuse le terme","https://www.lefigaro.fr/elections/presidentielles/presidentielle-2022-blanquer-met-en-garde-contre-l-arrivee-de-l-extreme-droite-aliot-recuse-le-terme-20220417"
"True","True","Cancer de la prostate : les signes qui doivent alerter","https://www.lefigaro.fr/sciences/cancer-de-la-prostate-les-signes-qui-doivent-alerter-20220414"
"False","True","Présidentielle : les soutiens de Mélenchon se prononcent massivement pour le vote blanc ou l'abstention","https://www.lefigaro.fr/elections/presidentielles/presidentielle-2022-les-soutiens-de-jean-luc-melenchon-se-prononcent-massivement-pour-le-vote-blanc-ou-l-abstention-20220417"
"False","False","Génération climat, vote musulman, décroissants... Radiographie de l’électorat Mélenchon","https://www.lefigaro.fr/elections/presidentielles/generation-climat-vote-musulman-decroissants-radiographie-de-l-electorat-melenchon-20220415"
"False","False","Législatives : Faure tend la main à Mélenchon pour des négociations, refus de LFI","https://www.lefigaro.fr/elections/legislatives/legislatives-faure-tend-la-main-a-melenchon-pour-des-negociations-refus-de-lfi-20220417"
"True","True","La vallée de la Qadisha au Liban, bastion de la foi","https://www.lefigaro.fr/international/la-vallee-de-la-qadisha-au-liban-bastion-de-la-foi-20220415"
"False","True","Guerre en Ukraine : les Français se précipitent sur l'huile et la farine","https://www.lefigaro.fr/conso/guerre-en-ukraine-les-francais-se-precipitent-sur-l-huile-et-la-farine-20220417"
"True","True","Pâques : le vibrant plaidoyer du pape pour la paix","https://www.lefigaro.fr/actualite-france/paques-le-vibrant-plaidoyer-du-pape-pour-la-paix-20220417"
"False","False","RÉCIT - Pâques: le chemin de croix du pape François irrite l’Ukraine","https://www.lefigaro.fr/actualite-france/paques-le-chemin-de-croix-du-pape-francois-irrite-l-ukraine-20220415"
"True","True","«L'application a pris le dessus sur ma vie personnelle» : quand les plateformes de coaching contrôlent notre quotidien","https://www.lefigaro.fr/secteur/high-tech/l-application-a-pris-le-dessus-sur-ma-vie-personnelle-quand-les-plateformes-de-coaching-controlent-notre-quotidien-20220415"
"False","True","DIRECT - Paris-Roubaix : un échappé en tête, les favoris mènent la poursuite","https://www.lefigaro.fr/sports/cyclisme/direct-paris-roubaix-suivez-la-119e-edition-20220417"
"False","False","Van der Poel, Madouas, train d'enfer : 5 raisons de suivre Paris-Roubaix","https://www.lefigaro.fr/sports/cyclisme/van-der-poel-madouas-train-d-enfer-5-raisons-de-suivre-paris-roubaix-20220417"
"False","False","Paris-Roubaix: Mathieu Van der Poel face à son album de famille","https://www.lefigaro.fr/sports/cyclisme/paris-roubaix-mathieu-van-der-poel-face-a-son-album-de-famille-20220415"
"False","False","Cyclisme : l'Italienne Longo Borghini gagne Paris-Roubaix Femmes","https://www.lefigaro.fr/sports/cyclisme/cyclisme-l-italienne-longo-borghini-gagne-paris-roubaix-femmes-20220416"
"False","True","Le fils de l'écrivain Paul Auster inculpé après la mort de son bébé par overdose","https://www.lefigaro.fr/livres/le-fils-de-l-ecrivain-paul-auster-inculpe-apres-la-mort-de-son-bebe-par-overdose-20220417"
"True","True","Comment Poutine russifie les zones conquises en Ukraine: le reportage de l’envoyé spécial du Figaro","https://www.lefigaro.fr/international/la-novorussia-sur-les-ruines-du-donbass-le-reportage-de-l-envoye-special-du-figaro-20220415"
"False","False","Guerre en Ukraine : Zelensky appelle le monde à «se préparer» à une possible attaque nucléaire russe","https://www.lefigaro.fr/international/zelensky-appelle-le-monde-a-se-preparer-a-une-possible-attaque-nucleaire-russe-20220416"
"True","True","Vie de couple : quand céder, quand ne rien lâcher ?","https://madame.lefigaro.fr/bien-etre/psycho/vie-de-couple-quand-ceder-quand-ne-rien-lacher-20220413"
"False","True","Disparition de Delphine Jubillar : l'activité de son téléphone la nuit de la disparition relance le mystère","https://www.lefigaro.fr/faits-divers/disparition-de-delphine-jubillar-l-activite-de-son-telephone-la-nuit-de-la-disparition-relance-le-mystere-20220417"
"True","True","Présidentielle 2022 : à Marseille, Macron place «l'écologie au cœur du nouveau paradigme politique»","https://www.lefigaro.fr/elections/presidentielles/presidentielle-2022-a-marseille-macron-place-l-ecologie-au-coeur-du-nouveau-paradigme-politique-20220416"
"False","False","ENQUÊTE - Présidentielle 2022: le plan d'Emmanuel Macron pour gagner","https://www.lefigaro.fr/elections/presidentielles/presidentielle-2022-le-plan-d-emmanuel-macron-pour-gagner-20220415"
"False","True","Présidentielle 2022 : le «chèque alimentation» mis en place «dès après l'élection» si Macron est réélu, selon Denormandie","https://www.lefigaro.fr/conjoncture/presidentielle-2022-le-cheque-alimentation-mis-en-place-des-apres-l-election-si-macron-est-reelu-selon-denormandie-20220417"
"True","True","Acheter un logement moins cher avec travaux, la fausse bonne idée ?","https://www.lefigaro.fr/argent/acheter-un-logement-moins-cher-avec-travaux-la-fausse-bonne-idee-20220412"
"False","False","Guerre en Ukraine: Zelensky dit avoir invité Macron à venir constater l'existence d'un «génocide»","https://www.lefigaro.fr/international/guerre-en-ukraine-zelensky-dit-avoir-invite-macron-a-venir-constater-l-existence-d-un-genocide-20220417"
"False","False","Guerre en Ukraine : les défenseurs de Marioupol «combattront jusqu'au bout», affirme le premier ministre ukrainien","https://www.lefigaro.fr/international/guerre-en-ukraine-les-defenseurs-de-marioupol-combattront-jusqu-au-bout-affirme-le-premier-ministre-ukrainien-20220417"
"False","False","Le fils de l'écrivain Paul Auster inculpé après la mort de son bébé par overdose","https://www.lefigaro.fr/livres/le-fils-de-l-ecrivain-paul-auster-inculpe-apres-la-mort-de-son-bebe-par-overdose-20220417"
"False","False","Présidentielle 2022 : Blanquer met en garde contre «l'arrivée de l'extrême droite», Aliot récuse le terme","https://www.lefigaro.fr/elections/presidentielles/presidentielle-2022-blanquer-met-en-garde-contre-l-arrivee-de-l-extreme-droite-aliot-recuse-le-terme-20220417"
"False","False","Yvelines : un retraité sera jugé pour avoir tué puis démembré sa compagne","https://www.lefigaro.fr/faits-divers/yvelines-un-retraite-sera-juge-pour-avoir-tue-puis-demembre-sa-compagne-20220417"
"False","False","Présidentielle 2022 : le «chèque alimentation» mis en place «dès après l'élection» si Macron est réélu, selon Denormandie","https://www.lefigaro.fr/conjoncture/presidentielle-2022-le-cheque-alimentation-mis-en-place-des-apres-l-election-si-macron-est-reelu-selon-denormandie-20220417"
"False","False","Colmar : Schmoutzi, le lapin géant vedette du marché de Pâques de Colmar, a été volé","https://www.lefigaro.fr/faits-divers/colmar-schmoutzi-le-lapin-geant-vedette-du-marche-de-paques-de-colmar-a-ete-vole-20220417"
"False","False","Disparition de Delphine Jubillar : l'activité de son téléphone la nuit de la disparition relance le mystère","https://www.lefigaro.fr/faits-divers/disparition-de-delphine-jubillar-l-activite-de-son-telephone-la-nuit-de-la-disparition-relance-le-mystere-20220417"
"False","False","Tunisie: des plongeurs inspectent le pétrolier naufragé devant Gabès","https://www.lefigaro.fr/flash-eco/tunisie-des-plongeurs-inspectent-le-petrolier-naufrage-devant-gabes-20220417"
"False","False","L'archevêque de Canterbury dénonce le projet d'envoyer les migrants au Rwanda","https://www.lefigaro.fr/flash-actu/l-archeveque-de-canterbury-denonce-le-projet-d-envoyer-les-migrants-au-rwanda-20220417"
"False","False","Faute d'accord avec les Russes, aucun couloir humanitaire dimanche, selon Kiev","https://www.lefigaro.fr/flash-actu/faute-d-accord-avec-les-russes-aucun-couloir-humanitaire-dimanche-selon-kiev-20220417"
"False","False","Pâques : le vibrant plaidoyer du pape pour la paix","https://www.lefigaro.fr/actualite-france/paques-le-vibrant-plaidoyer-du-pape-pour-la-paix-20220417"
"False","False","Le Pakistan appelle à une action contre les militants sur le sol afghan","https://www.lefigaro.fr/flash-actu/le-pakistan-appelle-a-une-action-contre-les-militants-sur-le-sol-afghan-20220417"
"False","False","Guerre en Ukraine : les Français se précipitent sur l'huile et la farine","https://www.lefigaro.fr/conso/guerre-en-ukraine-les-francais-se-precipitent-sur-l-huile-et-la-farine-20220417"
"False","False","Ukraine: la Russie affirme avoir «détruit» une usine militaire près de Kiev","https://www.lefigaro.fr/flash-actu/ukraine-la-russie-affirme-avoir-detruit-une-usine-militaire-pres-de-kiev-20220417"
"False","False","Nouvelles violences en Suède après une manifestation d'extrême droite","https://www.lefigaro.fr/flash-actu/nouvelles-violences-en-suede-apres-une-manifestation-d-extreme-droite-20220417"
