"premium","picture","title","url"
"False","True","Guerre en Ukraine: dans le nord-est du pays, 20 civils retrouvés tués par balles dans leurs voitures","https://www.bfmtv.com/international/guerre-en-ukraine-dans-le-nord-est-du-pays-20-civils-retrouves-tues-par-balles-dans-leurs-voitures_AP-202210010196.html"
"False","True","EN DIRECT - L'armée russe dit ""s'être retirée"" de Lyman dans l'est de l'Ukraine","https://www.bfmtv.com/international/en-direct-guerre-en-ukraine-le-directeur-de-la-centrale-de-zaporijia-arrete-par-les-russes_LN-202210010075.html"
"False","True","La Russie isolée et sous pression après l'annexion de nouveaux territoires en Ukraine","https://www.bfmtv.com/international/asie/russie/la-russie-isolee-et-sous-pression-apres-l-annexion-de-nouveaux-territoires-en-ukraine_AD-202210010125.html"
"False","True","Le directeur de la centrale de Zaporijia arrêté par les Russes selon l'agence nucléaire ukrainienne","https://www.bfmtv.com/international/ukraine-le-directeur-de-la-centrale-nucleaire-de-zaporijia-arrete-par-les-soldats-russes_AP-202210010103.html"
"False","True","Guerre en Ukraine: Zelensky se félicite des ""résultats significatifs"" de la contre-offensive dans l'est","https://www.bfmtv.com/international/europe/guerre-en-ukraine-zelensky-se-felicite-des-resultats-significatifs-de-la-contre-offensive-dans-l-est_AD-202209300688.html"
"False","True","Affaire Quatennens: le député a été auditionné par la police lilloise","https://www.bfmtv.com/grand-lille/affaire-quatennens-le-depute-a-ete-auditionne-par-la-police-lilloise_AD-202210010221.html"
"False","True","Bayou ""mis sous surveillance""? Des écologistes dénoncent une forme d'""inquisition""","https://www.bfmtv.com/politique/bayou-mis-sous-surveillance-des-ecologistes-denoncent-une-forme-d-inquisition_AV-202210010157.html"
"False","True","Affaire Bayou: EELV ""réaffirme sa confiance"" dans la cellule interne","https://www.bfmtv.com/politique/europe-ecologie-les-verts/affaire-bayou-eelv-reaffirme-sa-confiance-dans-la-cellule-interne_AD-202210010239.html"
"False","True","Titres restaurants, taux d'usure, vaccination... Tout ce qui change au 1er octobre","https://www.bfmtv.com/economie/consommation/titres-restaurants-taux-d-usure-vaccination-tout-ce-qui-change-au-1er-octobre_AV-202210010067.html"
"False","True","Des files d'attente devant les magasins Camaïeu avant leur fermeture définitive","https://www.bfmtv.com/economie/consommation/des-files-d-attentes-devant-les-magasins-camaieu-avant-leur-fermeture-definitive_AV-202210010131.html"
"False","True","Fashion Week de Paris: l'incroyable robe peinte sur Bella Hadid qui se transforme en tissu","https://www.bfmtv.com/people/mode/fashion-week-de-paris-l-incroyable-robe-peinte-sur-bella-hadid-qui-se-transforme-en-tissu_AN-202210010142.html"
"False","True","""Cette sanction n'est pas normale"". Yannick Jadot estime que Julien Bayou n'aurait pas dû démissionner de son poste de secrétaire général d'EELV","https://www.bfmtv.com/politique/europe-ecologie-les-verts/cette-sanction-n-est-pas-normale-yannick-jadot-estime-que-julien-bayou-n-aurait-pas-du-demissionner_AV-202209300246.html"
"False","True","""Transformer la civilisation"": Elon Musk présente son premier robot humanoïde","https://www.bfmtv.com/tech/transformer-la-civilisation-elon-musk-presente-son-premier-robot-humanoide_AD-202210010076.html"
"False","True","Arrestation d'Hassan Iquioussen: Gérald Darmanin ""se réjouit de l'interpellation"" de…","https://www.bfmtv.com/police-justice/arrestation-d-hassan-iquioussen-gerald-darmanin-se-rejouit-de-l-interpellation-de-l-imam_AN-202210010040.html"
"False","True","Arrestation d'Hassan Iquioussen: comment l'imam a été retrouvé par la justice?","https://www.bfmtv.com/police-justice/arrestation-d-hassan-iquioussen-comment-l-imam-a-ete-retrouve-par-la-justice_AN-202209300678.html"
"False","True","Interpellé en Belgique, l'imam Hassan Iquioussen va-t-il être rapatrié en France?","https://www.bfmtv.com/police-justice/interpelle-en-belgique-l-imam-hassan-iquioussen-va-t-il-etre-rapatrie-en-france_AN-202209300643.html"
"False","True","Ouragan Ian: la Caroline du Sud en proie à de fortes inondations, au moins 23 morts en…","https://www.bfmtv.com/international/amerique-nord/etats-unis/ouragan-ian-la-caroline-du-sud-en-proie-a-de-fortes-inondations-au-moins-23-morts-en-floride_AV-202210010085.html"
"False","True","La Russie bloque une résolution du Conseil de sécurité condamnant ses annexions en Ukraine","https://www.bfmtv.com/international/la-russie-bloque-une-resolution-du-conseil-de-securite-condamnant-ses-annexions-en-ukraine_AD-202209300706.html"
"False","True","Ukraine: Macron ""condamne fermement l'annexion illégale"" de quatre régions par la Russie","https://www.bfmtv.com/international/europe/ukraine-macron-condamne-fermement-l-annexion-illegale-de-quatre-regions-par-la-russie_AD-202209300607.html"
"False","True","Guerre en Ukraine: Vladimir Poutine appelle Kiev à ""cesser immédiatement les hostilités""","https://www.bfmtv.com/international/asie/russie/guerre-en-ukraine-vladimir-poutine-appelle-kiev-a-cesser-immediatement-les-hostilites_AV-202209300422.html"
"False","True","Plafond, courses… ce que vous pourrez faire avec vos titres-restaurants à partir du 1er…","https://www.bfmtv.com/economie/consommation/plafond-courses-ce-que-vous-pourrez-faire-avec-vos-titres-restaurants-a-partir-du-1er-octobre_AV-202209290450.html"
"False","True","Des médecins alertent sur les risques liés aux manipulations du cou par des ostéopathes","https://www.bfmtv.com/sante/c-est-dangereux-et-inutile-des-medecins-alertent-sur-les-risques-lies-aux-manipulations-du-cou_AN-202209300010.html"
"False","True","""C'est une honte pour la France"": la colère des Marocains privés de visa pour l'Hexagone","https://www.bfmtv.com/international/afrique/maroc/c-est-une-honte-pour-la-france-la-colere-des-marocains-prives-de-visa-pour-l-hexagone_AN-202209290007.html"
"False","True","Boire 2 à 3 tasses de café par jour apporte d'importants bénéfices pour la santé, selon…","https://www.bfmtv.com/sante/boire-2-a-3-tasses-de-cafe-par-jour-apporte-d-importants-benefices-pour-la-sante-selon-une-etude_AN-202209290694.html"
"False","True","INFOGRAPHIES. 9,7 milliards d'habitants: à quoi pourrait ressembler le monde en 2050?","https://www.bfmtv.com/societe/infographies-9-7-milliards-d-habitants-a-quoi-pourrait-ressembler-le-monde-en-2050_AV-202209290499.html"
"False","True","Gazprom suspend ses livraisons à l'Italien Eni à cause d'un ""problème"" en Autriche","https://www.bfmtv.com/economie/entreprises/energie/gazprom-suspend-ses-livraisons-a-l-italien-eni-a-cause-d-un-probleme-en-autriche_AD-202210010225.html"
"False","True","Sabotage des gazoducs: les deux pipelines Nord Stream irréparables?","https://www.bfmtv.com/economie/international/sabotage-des-gazoducs-les-deux-pipelines-nord-stream-irreparables_AN-202209290586.html"
"False","True","Faut-il s'attendre à des coupures des réseaux de téléphonie mobile cet hiver?","https://www.bfmtv.com/tech/actualites/telecoms/faut-il-s-attendre-a-des-coupures-des-reseaux-de-telephonie-mobile-cet-hiver_AN-202210010199.html"
"False","True","Le gazoduc gréco-bulgare entre en exploitation, une ""nouvelle ère"" s'ouvre, estime Ursula von der Leyen","https://www.bfmtv.com/economie/entreprises/energie/le-gazoduc-greco-bulgare-entre-en-exploitation-une-nouvelle-ere-s-ouvre-estime-ursula-von-der-leyen_AD-202210010165.html"
"False","True","Des files d'attente devant les magasins Camaïeu avant leur fermeture définitive","https://www.bfmtv.com/economie/consommation/des-files-d-attentes-devant-les-magasins-camaieu-avant-leur-fermeture-definitive_AV-202210010131.html"
"False","True","Tennis: ""Il m'avait déjà cherché la semaine dernière"", Moutet explique son altercation avec Andreev à Orléans","https://rmcsport.bfmtv.com/tennis/tennis-il-m-avait-deja-cherche-la-semaine-derniere-moutet-explique-son-altercation-avec-andreev-a-orleans_AV-202210010119.html"
"False","True","F1: tension à Singapour, Wolff et Binotto s'allient face à Red Bull dans l'affaire du plafond budgétaire","https://rmcsport.bfmtv.com/auto-moto/f1/f1-tension-a-singapour-wolff-et-binotto-s-allient-face-a-red-bull-dans-l-affaire-du-plafond-budgetaire_AV-202210010164.html"
"False","True","Brésil: le soutien de Neymar à Bolsonaro ? ""Il y a un côté opportuniste"", juge un spécialiste en géopolitique","https://rmcsport.bfmtv.com/football/bresil-le-soutien-de-neymar-a-bolsonaro-il-y-a-un-cote-opportuniste-juge-un-specialiste-en-geopolitique_AV-202210010185.html"
"False","True","Iran: le beau geste de l'entraîneur de Naples en hommage à Mahsa Amini et Hadis Najafi","https://rmcsport.bfmtv.com/football/serie-a/iran-le-beau-geste-de-l-entraineur-de-naples-en-hommage-a-mahsa-amini-et-hadis-najafi_AV-202210010106.html"
"False","True","Equipe de France: Boubacar Kamara officiellement forfait pour la Coupe du monde, premier absent chez les Bleus","https://rmcsport.bfmtv.com/football/equipe-de-france/equipe-de-france-boubacar-kamara-officiellement-forfait-pour-la-coupe-du-monde-premier-absent-chez-les-bleus_AV-202209300492.html"
"False","True","Ligne rouge - William et Harry, les frères ennemis","https://www.bfmtv.com/people/tetes-couronnees/ligne-rouge-william-et-harry-les-freres-ennemis_GN-202208290703.html"
"False","True","Carte. Incendies en Gironde : que représentent les 20.600 hectares déjà brûlés ?","https://www.bfmtv.com/meteo/canicule/carte-que-representent-les-15-200-hectares-brules-en-gironde-par-rapport-aux-grandes-villes-francaises_AN-202207180497.html"
"False","True","Avant/Après. Incendies en Gironde : l'étendue des dégâts vue par satellite","https://www.bfmtv.com/environnement/climat/avant-apres-incendies-en-gironde-l-etendue-des-degats-vue-par-satellite_GN-202207190372.html"
"False","True","Le Tour de France, une bonne affaire pour les villes-étapes","https://www.bfmtv.com/economie/entreprises/culture-loisirs/le-tour-de-france-une-bonne-affaire-pour-les-villes-etapes_GN-202207050023.html"
"False","True","""J'ai pleuré tous les soirs pendants un an"" : fausses couches, vraies souffrances","https://www.bfmtv.com/societe/j-ai-pleure-tous-les-soirs-pendant-un-an-fausse-couche-vraies-souffrances_AN-202206230011.html"
"False","True","Lascaux, Chauvet, Cosquer...Le nouvel eldorado touristique des grottes préhistoriques","https://www.bfmtv.com/economie/lascaux-chauvet-cosquer-le-nouvel-eldorado-touristique-des-grottes-prehistoriques_GN-202206040051.html"
"False","True","Le guitariste d'Oasis, Paul Arthurs, annonce être guéri de son cancer","https://www.bfmtv.com/people/musique/le-guitariste-d-oasis-paul-arthurs-annonce-etre-gueri-de-son-cancer_AN-202210010227.html"
"False","True","Rentrée littéraire: les quinze BD et mangas à découvrir","https://www.bfmtv.com/people/bandes-dessinees/rentree-litteraire-les-quinze-bd-et-mangas-a-decouvrir_AN-202210010211.html"
"False","True","Hebdo Com : Production de flux télévisés, quelles évolutions ? - 01/10","https://www.bfmtv.com/economie/replay-emissions/hebdo-com/hebdo-com-production-de-flux-televises-quelles-evolutions-01-10_VN-202210010212.html"
"False","True","Focus Retail : Le ""body positive"" fait-il vendre ? - 01/10","https://www.bfmtv.com/economie/replay-emissions/focus-retail/focus-retail-le-body-positive-fait-il-vendre-01-10_VN-202210010206.html"
"False","True","Karl Lagerfeld sera mis à l'honneur lors du Met Gala 2023","https://www.bfmtv.com/people/mode/karl-lagerfeld-sera-mis-a-l-honneur-lors-du-met-gala-2023_AD-202210010191.html"
"False","True","Creatym France : une entreprise spécialisée dans les services d’ingénierie","https://www.bfmtv.com/pratique/entreprises-d-avenir/creatym-france-une-entreprise-specialisee-dans-les-services-d-ingenierie_AB-202209300009.html"
"False","True","Rosaz Energies : Spécialiste des énergies renouvelables","https://www.bfmtv.com/economie/entreprises/rosaz-energies-specialiste-des-energies-renouvelables_AO-202209300002.html"
"False","True","Hans coffrage - Le bois au service du béton","https://www.bfmtv.com/economie/entreprises/hans-coffrage-le-bois-au-service-du-beton_AO-202209190001.html"
"False","True","Brooks Running : le spécialiste des chaussures de running","https://www.bfmtv.com/pratique/entreprises-d-avenir/brooks-running-le-specialiste-des-chaussures-de-running_AB-202209290008.html"
