"premium","picture","title","url"
"False","True","Les Lillois poussent pour revenir, Lafont et sa transversale font de la résistance…","https://www.20minutes.fr/sport/3336607-20220812-fc-nantes-losc-direct-nantais-doivent-lancer-saison-face-lillois-bien-partis-suivez-match"
"False","True","Donald Trump visé par une enquête pour violation potentielle de « l’Espionnage Act »","https://www.20minutes.fr/monde/3337043-20220812-perquisition-chez-trump-ex-president-americain-vise-enquete-violation-potentielle-espionnage-act"
"False","True","L'auteur britannique Salman Rushdie poignardé sur scène pendant une conférence aux Etats-Unis","https://www.20minutes.fr/monde/4000431-20220812-salman-rushdie-poignarde-scene-pendant-conference-etats-unis"
"False","True","L'actrice Anne Heche est morte, une semaine après son accident","https://www.20minutes.fr/arts-stars/culture/3337023-20220812-actrice-anne-heche-morte-semaine-apres-accident-voiture"
"False","True","Lionel Messi absent de la liste des 30 nommés au Ballon d'Or","https://www.20minutes.fr/sport/3337015-20220812-ballon-or-2022-lionel-messi-absent-liste-30-nommes-favori-karim-benzema-bien"
"False","True","Des associations pressent le gouvernement d'accélérer la vaccination contre la variole du singe","https://www.20minutes.fr/sante/3337047-20220812-variole-singe-associations-pressent-gouvernement-accelerer-vaccination"
"False","True","Le groupe Orpea doit rembourser 55,8 millions d’euros à l’Etat","https://www.20minutes.fr/societe/3337035-20220812-affaire-orpea-groupe-va-devoir-rembourser-etat-558-millions-euros-fond-detournes"
"False","True","Washington renforce ses relations avec Taïwan et continue d'envoyer des navires et des avions","https://www.20minutes.fr/monde/3337027-20220812-tensions-taiwan-washington-renforce-relations-ile-continue-envoyer-navires"
"False","True","Vigilance renforcée autour des feux d'artifice du 15 août","https://www.20minutes.fr/societe/3337039-20220812-secheresse-vigilance-renforcee-autour-feux-artifice-15-aout"
"False","True","Un premier navire de l'ONU vendredi en Ukraine pour récupérer des céréales","https://www.20minutes.fr/monde/3337007-20220812-guerre-ukraine-premier-navire-onu-doit-accoster-vendredi-ukraine-recuperer-cereales"
"False","True","La journaliste russe Marina Ovsiannikova assignée à domicile","https://www.20minutes.fr/monde/3336927-20220812-guerre-ukraine-boutcha-enterre-morts-inconnus-journaliste-marina-ovsiannikova-assignee-domicile"
"False","True","L’Allemagne va baisser le chauffage cet hiver pour économiser l’énergie","https://www.20minutes.fr/economie/3336931-20220812-allemagne-batiments-publics-vont-baisser-chauffage-19-degres-hiver"
"False","True","La journaliste d’opposition Marina Ovsiannikova assignée à résidence","https://www.20minutes.fr/monde/3336899-20220812-russie-journaliste-opposition-marina-ovsiannikova-assignee-residence"
"False","True","Le vaccin contre le Covid-19 pendant la grossesse, c’est « sans danger »","https://www.20minutes.fr/sante/3336759-20220812-covid-19-vaccins-arn-messager-danger-pendant-grossesse-selon-etude-canadienne"
"False","True","Comment écouter sa playlist au casque ou avec des écouteurs en nageant ?","https://www.20minutes.fr/high-tech/3327667-20220811-ecouteurs-casque-eau-danger-ecouter-musique-nageant"
"False","True","Pourquoi les feux de forêts en Gironde ont-ils repris si violemment ?","https://www.20minutes.fr/planete/3336123-20220810-gironde-feux-reprennent-si-violemment-car-foret-devenue-veritable-champ-allumettes"
"False","True","24 heures","https://www.20minutes.fr/diaporama/diaporama-15366-images-jonas-vingegaard-remporte-tour-france-incendies-fixes-gironde-kevin-mayer-nouveau-champion-monde-decathlon"
"False","True","Mouillez le maillot","https://www.20minutes.fr/diaporama/diaporama-15365-images-maillots-clubs-ligue-1-saison-2022-2023"
"False","True","Qui sont les chats libres de Paris ?","https://www.20minutes.fr/podcast/3332467-20220810-animal-chats-libres-paris"
"False","True","Rat brun, rat d'égout, « Ratatouille », qui es-tu ?","https://www.20minutes.fr/podcast/3332719-20220807-animal-rat-brun-rat-egout-ratatouille"
"False","True","Comment le moustique tigre s’est-il installé en France ?","https://www.20minutes.fr/podcast/3332531-20220804-animal-comment-moustique-tigre-installe-france"
"False","True","Des informations sur le « président de la France » parmi les documents saisis chez Donald Trump","https://www.20minutes.fr/monde/3337031-20220812-perquisition-chez-trump-informations-president-france-parmi-documents-saisis"
"False","True","Deux morts dans une frappe russe sur Kramatorsk","https://www.20minutes.fr/monde/3336703-20220812-guerre-ukraine-direct-volodymyr-zelensky-appelle-monde-reagir-immediatement-chasser-russes-zaporojie"
"False","True","Cinq groupes chinois se retirent de la Bourse de New York","https://www.20minutes.fr/economie/3337011-20220812-vises-autorite-americaine-marches-cinq-groupes-chinois-retirent-bourse-new-york"
"False","True","Non, les Etats-Unis ne se « mettent pas à taxer les superprofits »","https://www.20minutes.fr/monde/3336747-20220812-etats-unis-non-comme-indique-manon-aubry-joe-biden-met-taxer-superprofits"
"False","True","Non, le bicarbonate de soude ne fait pas maigrir","https://www.20minutes.fr/sante/3336439-20220811-sante-non-bicarbonate-soude-fait-maigrir"
"False","True","Un pin’s comme signe d’appartenance à une secte pour Macron ? C’est faux","https://www.20minutes.fr/monde/3336379-20220811-great-reset-non-pin-porte-grands-dirigeants-mondiaux-symbole-ralliement-nouvel-ordre-mondial"
"False","True","Les fast-foods patinent-ils depuis la crise sanitaire ?","https://www.20minutes.fr/economie/3336983-20220812-covid-19-fast-foods-patinent-depuis-crise-sanitaire"
"False","True","Le Conseil constitutionnel valide la loi sur le pouvoir d'achat malgré des réserves « inédites »","https://www.20minutes.fr/societe/3337019-20220812-pouvoir-achat-conseil-constitutionnel-valide-loi-malgre-reserves-inedites"
"False","True","Tariq Ramadan demande la suspension de l’instruction","https://www.20minutes.fr/justice/3337003-20220812-affaire-tariq-ramadan-menace-proces-assises-viols-demande-suspension-instruction"
"False","True","Le clan De Jong dénonce les mensonges et menaces du FC Barcelone","https://www.20minutes.fr/sport/3335483-20220809-mercato-clan-jong-denonce-mensonges-menaces-fc-barcelone"
"False","True","Olympe, le tournoi FIFA réservé aux passionnés du Web3","https://www.20minutes.fr/20-mint/3335011-20220808-olympe-tournoi-fifa-reserve-passionnes-web-3-ouvert-lecteurs-20-minutes"
"False","True","Biarritz surfe aussi sur la vague des NFT","https://www.20minutes.fr/20-mint/3333887-20220804-avant-faire-surfer-amoureux-bitcoin-biarritz-accueille-grand-messe-nft"
"False","True","Trente et un blessés dans un accident de montagnes russes en Allemagne","https://www.20minutes.fr/monde/3336631-20220811-allemagne-accident-parc-attraction-fait-31-blesses-dont-grievement"
"False","True","Des vacances en Crimée, une bien mauvaise idée","https://www.20minutes.fr/high-tech/3336415-20220811-guerre-ukraine-kiev-moque-touristes-russes-crimee"
"False","True","Anne Heche « ne devrait pas survivre » à son accident de voiture","https://www.20minutes.fr/arts-stars/people/3336763-20220812-actrice-americaine-anne-heche-devrait-survivre-accident-voiture"
"False","True","«Publiez les documents» liés au mandat de perquisition, répond Donald Trump","https://www.20minutes.fr/monde/3336639-20220811-perquisition-chez-donald-trump-ministre-justice-donne-feu-vert-demande-mandat-rendu-public"
"False","True","Guerre en Ukraine : Deux morts dans une frappe russe sur Kramatorsk, dans…","https://www.20minutes.fr/monde/3336703-20220812-guerre-ukraine-direct-volodymyr-zelensky-appelle-monde-reagir-immediatement-chasser-russes-zaporojie"
"False","True","Les vacances sont-elles un tue l'amour ? Racontez-nous","https://www.20minutes.fr/societe/3336395-20220811-decide-quitter-conjoint-avant-pendant-apres-vacances-enfer-racontez"
"False","True","La guerre de l’eau aura-t-elle lieu ?","https://www.20minutes.fr/planete/3336039-20220811-secheresse-vols-desobeissance-jacuzzis-eventres-arrive-guerre-eau"
"False","True","En Bretagne, la forêt de Merlin l’enchanteur est en train de brûler","https://www.20minutes.fr/planete/3336827-20220812-incendie-bretagne-mythique-foret-broceliande-victime-feu-deja-230-hectares-partis-fumee"
"False","True","Zaporojie de nouveau bombardée au 169e jour de guerre en Ukraine","https://www.20minutes.fr/monde/3336515-20220811-guerre-ukraine-zaporojie-sous-bombes-lettonie-mache-mots"
"False","True","L’homme qui a attaqué le FBI après la perquisition chez Trump a été abattu","https://www.20minutes.fr/monde/3336687-20220812-etats-unis-homme-tue-apres-avoir-tente-attaquer-fbi-denonce-perquisition-chez-donald-trump"
"False","True","Un navire de l'ONU va récupérer des céréales aujourd'hui en Ukraine","https://www.20minutes.fr/monde/3337007-20220812-guerre-ukraine-premier-navire-onu-doit-accoster-vendredi-ukraine-recuperer-cereales"
"False","True","Les Français médaillés d’or en poursuite par équipes","https://www.20minutes.fr/sport/3336999-20220812-jeux-europeens-francais-medailles-or-poursuite-equipes"
"False","True","Boutcha enterre ses morts, la journaliste Marina Ovsiannikova assignée à domicile","https://www.20minutes.fr/monde/3336927-20220812-guerre-ukraine-boutcha-enterre-morts-inconnus-journaliste-marina-ovsiannikova-assignee-domicile"
"False","True","Non, Joe Biden ne se « met pas à taxer les superprofits »","https://www.20minutes.fr/monde/3336747-20220812-etats-unis-non-comme-indique-manon-aubry-joe-biden-met-taxer-superprofits"
"False","True","Lorient-Lyon reporté en raison de l'état de la pelouse","https://www.20minutes.fr/sport/football/3336995-20220812-ligue-1-lfp-annonce-report-lorient-lyon-raison-etat-catastrophique-pelouse"
"False","True","La Corse en vigilance orange en raison de violents orages attendus","https://www.20minutes.fr/planete/3336959-20220812-corse-violents-orages-attendus-nuit-ile-toute-entiere-passe-vigilance-orange"
"False","True","Colère après l’évocation d’une C1 « achetée » par l'OM","https://www.20minutes.fr/sport/3336979-20220812-om-colere-marseille-apres-evocation-ligue-champions-achetee"
