"premium","picture","title","url"
"False","True","Double meurtre à Pouyastruc: un appel à témoins diffusé pour retrouver le suspect","https://www.bfmtv.com/police-justice/double-meurtre-a-pouyastruc-un-appel-a-temoins-diffuse-pour-retrouver-le-suspect_AV-202207080424.html"
"False","False","Double meurtre à Pouyastruc: comment s'organisent les recherches pour retrouver le fugitif","https://www.bfmtv.com/police-justice/double-meurtre-a-pouyastruc-comment-s-organisent-les-recherches-pour-retrouver-le-fugitif_AV-202207070413.html"
"False","True","Variole du singe: la HAS recommande la vaccination pour les ""groupes les plus exposés au virus""","https://www.bfmtv.com/sante/variole-du-singe-la-has-recommande-la-vaccination-pour-les-groupes-les-plus-exposes-au-virus_AN-202207080392.html"
"False","False","Variole du singe: quels sont les symptômes qui doivent alerter?","https://www.bfmtv.com/sante/variole-du-singe-quels-sont-les-symptomes-qui-doivent-alerter_AD-202207050737.html"
"False","True","""Ça se rapproche et rien n'est fait"": la communauté gay inquiète face à la diffusion de la variole du singe","https://www.bfmtv.com/sante/ca-se-rapproche-et-rien-n-est-fait-la-communaute-gay-inquiete-face-a-la-diffusion-de-la-variole-du-singe_AN-202207080278.html"
"False","False","""Je n'avais jamais eu une douleur comme ça"": des malades infectés par la variole du singe…","https://www.bfmtv.com/sante/je-n-avais-jamais-eu-une-douleur-comme-ca-des-malades-infectes-par-la-variole-du-singe-temoignent_AV-202207050025.html"
"False","True","EN DIRECT - Incendies dans le Gard: selon le chef du poste de commandant de Bessèges, le feu est ""fixé""","https://www.bfmtv.com/societe/en-direct-le-sud-de-la-france-touche-par-de-nombreux-incendies-mega-feu-dans-le-gard_LN-202207080038.html"
"False","True","Incendies: peut-on parler d'un ""méga-feu"" dans le Gard?","https://www.bfmtv.com/meteo/incendies-peut-on-parler-d-un-mega-feu-dans-le-gard_AD-202207080264.html"
"False","True","Les images du ""méga feu"" dans le Gard, qui a déjà ravagé 600 hectares","https://www.bfmtv.com/societe/les-images-du-mega-feu-dans-le-gard-qui-a-deja-ravage-600-hectares_VN-202207080047.html"
"False","True","Attaque contre Shinzo Abe: l'ancien Premier ministre japonais est mort","https://www.bfmtv.com/international/asie/japon/attaque-contre-shinzo-abe-l-ancien-premier-ministre-japonais-est-mort_AD-202207080260.html"
"False","False","Les images de l'attaque visant Shinzo Abe en pleine rue au Japon","https://www.bfmtv.com/international/asie/japon/shinzo-abe-victime-d-une-attaque-par-balle-en-pleine-rue-au-japon_VN-202207080164.html"
"False","True","Des tubes et du scotch: Shinzo Abe a été abattu avec une arme artisanale","https://www.bfmtv.com/international/asie/japon/des-tubes-et-du-scotch-shinzo-abe-a-ete-abattu-par-une-arme-artisanale_AN-202207080329.html"
"False","True","EN DIRECT - Tour de France (7e étape): cinq hommes à l'avant, les coéquipiers de Pogacar contrôlent","https://rmcsport.bfmtv.com/cyclisme/tour-de-france/tour-de-france-en-direct-les-leaders-ont-rendez-vous-avec-la-super-planche-des-belles-filles_LN-202207080191.html"
"False","False","Tour de France: la Super Planche des Belles Filles, le rendez-vous tant attendu par Pinot","https://rmcsport.bfmtv.com/cyclisme/tour-de-france/tour-de-france-la-super-planche-des-belles-filles-le-rendez-vous-tant-attendu-par-pinot_AV-202207080140.html"
"False","True","Brevet des collèges 2022: comment consulter les résultats, académie par académie","https://www.bfmtv.com/societe/education/brevet-des-colleges-2022-comment-consulter-les-resultats-academie-par-academie_AN-202207080406.html"
"False","True","Face aux canicules, faut-il modifier les vacances scolaires? La maire d'Aix interpelle le gouvernement","https://www.bfmtv.com/marseille/canicule-la-maire-d-aix-en-provence-demande-l-amenagement-du-temps-scolaire-au-gouvernement_AN-202207080385.html"
"False","True","Christian Estrosi s'érige en épidémiologiste, en médecin. Eric Ciotti","https://www.bfmtv.com/cote-d-azur/retour-du-masque-a-nice-eric-ciotti-tacle-christian-estrosi-qui-s-erige-en-epidemiologiste_AV-202207070242.html"
"False","True","La SNCF s'attend à un été record, 1,3 million de voyageurs dans les gares ce week-end","https://www.bfmtv.com/economie/entreprises/transports/la-sncf-s-attend-a-un-ete-record-1-3-million-de-voyageurs-dans-les-gares-ce-week-end_AV-202207080353.html"
"False","True","Aéroports parisiens: les salariés votent la fin de la grève","https://www.bfmtv.com/economie/entreprises/transports/aeroports-parisiens-les-salaries-votent-la-fin-de-la-greve_AD-202207080235.html"
"False","True","Bison futé: trafic très chargé sur les routes pour le premier week-end des vacances d'été","https://www.bfmtv.com/auto/bison-fute-trafic-tres-charge-sur-les-routes-pour-le-premier-week-end-des-vacances-d-ete_AN-202207070047.html"
"False","True","EN DIRECT - Guerre en Ukraine: Lavrov quitte la réunion du G20 lors du discours de la…","https://www.bfmtv.com/international/en-direct-guerre-en-ukraine-poutine-defie-l-otan-son-armee-pilonne-les-villes-du-donbass_LN-202207080037.html"
"False","True","Affaire Jacques Bouthier: deux hommes, dont un policier, mis en examen","https://www.bfmtv.com/police-justice/affaire-jacques-bouthier-deux-hommes-dont-un-policier-mis-en-examen_AN-202207080372.html"
"False","True","""La recommandation ne suffit plus"": pourquoi des médecins réclament l'obligation du masque","https://www.bfmtv.com/sante/la-recommandation-ne-suffit-plus-pourquoi-des-medecins-reclament-l-obligation-du-masque_AV-202207080274.html"
"False","True","Rats à Paris: une élue animaliste préfère parler de ""surmulots"" pour éviter un mot…","https://www.bfmtv.com/paris/rats-a-paris-une-elue-animaliste-prefere-parler-de-surmulots-pour-eviter-un-mot-connote-negativement_AV-202207080328.html"
"False","True","EN DIRECT - Clément Beaune n'""envisage"" pas de briguer la présidence de Renaissance","https://www.bfmtv.com/politique/en-direct-politique-les-francais-un-peu-moins-mecontents-de-leur-gouvernement-selon-un-sondage_LN-202207080091.html"
"False","True","Grèves, vols annulés: les voyagistes ""craignent le pire"" cet été dans les aéroports","https://www.bfmtv.com/economie/economie-social/france/greves-vols-annules-les-voyagistes-craignent-le-pire-cet-ete-dans-les-aeroports_AD-202206300700.html"
"False","True","""Ce n'est plus raisonnable"": face à la sécheresse, les douches de plage sont-elles vouées…","https://www.bfmtv.com/environnement/ce-n-est-plus-raisonnable-face-a-la-secheresse-les-douches-de-plage-sont-elles-vouees-a-disparaitre_AV-202207010301.html"
"False","True","Covid-19: quand le pic de la 7e vague sera-t-il atteint?","https://www.bfmtv.com/sante/covid-19-quand-le-pic-de-la-7e-vague-sera-t-il-atteint_AN-202206300425.html"
"False","True","Jouets: La Foir'fouille critiqué pour un ""kit petite influenceuse"" à partir de trois ans","https://www.bfmtv.com/tech/jouets-la-foir-fouille-critique-pour-un-kit-petite-influenceuse-a-partir-de-trois-ans_AN-202207010309.html"
"False","True","""Le métier devient compliqué à exercer"": des gynécologues ""dépassés"" par la mise en cause…","https://www.bfmtv.com/sante/le-metier-devient-complique-a-exercer-des-gyneco-depasses-par-la-mise-en-cause-de-leurs-pratiques_AN-202206280682.html"
"False","True","Le transit de gaz russe par l'Ukraine atteint son plus bas historique","https://www.bfmtv.com/economie/entreprises/energie/le-transit-de-gaz-russe-par-l-ukraine-atteint-son-plus-bas-historique_AD-202207080401.html"
"False","True","Vente de billets de train: la SNCF veut continuer à s'appuyer sur les buralistes","https://www.bfmtv.com/economie/consommation/vente-de-billets-de-train-la-sncf-veut-continuer-a-s-appuyer-sur-les-buralistes_AV-202207080380.html"
"False","True","Hauts-de-France: les billets de TER à un euro de retour cet été","https://www.bfmtv.com/grand-lille/hauts-de-france-les-billets-de-ter-a-un-euro-de-retour-cet-ete_AN-202207080379.html"
"False","True","La SNCF s'attend à un été record, 1,3 million de voyageurs dans les gares ce week-end","https://www.bfmtv.com/economie/entreprises/transports/la-sncf-s-attend-a-un-ete-record-1-3-million-de-voyageurs-dans-les-gares-ce-week-end_AV-202207080353.html"
"False","True","Travail dissimulé: la cour d'appel condamne à son tour Deliveroo","https://www.bfmtv.com/economie/entreprises/travail-dissimule-la-cour-d-appel-condamne-a-son-tour-deliveroo_AD-202207080299.html"
"False","True","EN DIRECT - Tour de France (7e étape): cinq hommes à l'avant, les coéquipiers de Pogacar contrôlent","https://rmcsport.bfmtv.com/cyclisme/tour-de-france/tour-de-france-en-direct-les-leaders-ont-rendez-vous-avec-la-super-planche-des-belles-filles_LN-202207080191.html"
"False","True","FIFA: Platini et Blatter acquittés par la justice suisse","https://rmcsport.bfmtv.com/football/fifa-platini-et-blatter-acquittes-par-la-justice-suisse_AV-202207080234.html"
"False","True","Euro 2022: quelles ambitions pour les Bleues?","https://rmcsport.bfmtv.com/football/feminin/euro-2022-quelles-ambitions-pour-les-bleues_AV-202207080023.html"
"False","True","Le grand dossier RMC Sport (partie 1) - A la découverte du Mister Luis Campos, le nouvel homme fort du PSG","https://rmcsport.bfmtv.com/football/ligue-1/le-grand-dossier-rmc-sport-sommaire-et-partie-1-a-la-decouverte-du-mister-luis-campos-le-nouvel-homme-fort-du-psg_AV-202207080024.html"
"False","True","Wimbledon: pourquoi Fritz ne sera pas repêché malgré le forfait de Nadal","https://rmcsport.bfmtv.com/tennis/wimbledon/wimbledon-pourquoi-fritz-ne-sera-pas-repeche-malgre-le-forfait-de-nadal_AV-202207080247.html"
"False","True","""J'ai pleuré tous les soirs pendants un an"" : fausses couches, vraies souffrances","https://www.bfmtv.com/societe/j-ai-pleure-tous-les-soirs-pendant-un-an-fausse-couche-vraies-souffrances_AN-202206230011.html"
"False","True","Carte. Résultats élections législatives 2022 : La France du vote RN au premier tour","https://www.bfmtv.com/politique/elections/legislatives/carte-resultats-elections-legislatives-2022-la-france-du-vote-rn-au-premier-tour_GN-202206130020.html"
"False","True","Lascaux, Chauvet, Cosquer...Le nouvel eldorado touristique des grottes préhistoriques","https://www.bfmtv.com/economie/lascaux-chauvet-cosquer-le-nouvel-eldorado-touristique-des-grottes-prehistoriques_GN-202206040051.html"
"False","True","Guerre en Ukraine : 100 jours de conflit racontés en images satellite","https://www.bfmtv.com/international/guerre-en-ukraine-100-jours-de-conflits-racontes-en-images-satellite_AN-202206030031.html"
"False","True","Entre l'Ukraine et la Russie, une histoire contrariée","https://www.bfmtv.com/international/entre-l-ukraine-et-la-russie-une-histoire-contrariee_GN-202205090013.html"
"False","True","PMA pour toutes : 9 mois après, l'attente se prolonge pour les femmes","https://www.bfmtv.com/societe/pma-pour-toutes-9-mois-apres-l-attente-se-prolonge-pour-les-femmes_GN-202205020004.html"
"False","True","Le parc à thème du film ""Nope"" de Jordan Peele va ouvrir ses portes aux Studios Universal à Hollywood","https://www.bfmtv.com/people/cinema/le-parc-a-theme-du-film-nope-de-jordan-peele-va-ouvrir-ses-portes-aux-studios-universal-a-hollywood_AN-202207080463.html"
"False","True","Céline Dion, Carla Bruni et Patricia Kaas vont participer à un album-hommage à Jean-Jacques Goldman","https://www.bfmtv.com/people/musique/celine-dion-carla-bruni-et-patricia-kaas-vont-participer-a-un-album-hommage-a-jean-jacques-goldman_AN-202207080443.html"
"False","True","Comment Drake et Beyoncé ont remis la house au goût du jour","https://www.bfmtv.com/people/musique/comment-drake-et-beyonce-ont-remis-la-house-au-gout-du-jour_AD-202207080398.html"
"False","True","Johnny Depp fait don de 800.000 dollars à diverses associations caritatives grâce à une vente de NFT","https://www.bfmtv.com/people/johnny-depp-fait-don-de-800-000-dollars-a-diverses-associations-caritatives-grace-a-une-vente-de-nft_AN-202207080396.html"
