"premium","picture","title","url"
"True","True","La nomination d’Éric Coquerel suscite une polémique parmi les féministes","https://www.mediapart.fr/journal/france/020722/la-nomination-d-eric-coquerel-suscite-une-polemique-parmi-les-feministes"
"True","True","Face au RN, gauche et droite se divisent sur la pertinence du « cordon sanitaire »","https://www.mediapart.fr/journal/france/020722/face-au-rn-gauche-et-droite-se-divisent-sur-la-pertinence-du-cordon-sanitaire"
"True","False","Extrême droite : la semaine de toutes les compromissions","https://www.mediapart.fr/journal/france/010722/extreme-droite-la-semaine-de-toutes-les-compromissions"
"True","True","L’historienne Malika Rahal : « La France n’a jamais fait son tournant anticolonialiste »","https://www.mediapart.fr/journal/culture-idees/020722/l-historienne-malika-rahal-la-france-n-jamais-fait-son-tournant-anticolonialiste"
"True","True","Paris abandonne en Syrie trois orphelins de parents djihadistes","https://www.mediapart.fr/journal/international/020722/paris-abandonne-en-syrie-trois-orphelins-de-parents-membres-de-daech"
"True","False","Pétrole, gaz : un rideau de fer s’abat sur le secteur de l’énergie","https://www.mediapart.fr/journal/economie/020722/petrole-gaz-un-rideau-de-fer-s-abat-sur-le-secteur-de-l-energie"
"True","False","Inde : le sombre avenir des habitants de l’Assam après une mousson précoce","https://www.mediapart.fr/journal/international/020722/inde-le-sombre-avenir-des-habitants-de-l-assam-apres-une-mousson-precoce"
"True","False","Le ministère de l’intérieur a tenté de bloquer l’asile d’un dissident camerounais","https://www.mediapart.fr/journal/international/020722/le-ministere-de-l-interieur-tente-de-bloquer-l-asile-d-un-dissident-camerounais"
"True","False","Garrido-Corbière : « Le Point », un journal accro aux fausses infos","https://www.mediapart.fr/journal/france/010722/garrido-corbiere-le-point-un-journal-accro-aux-fausses-infos"
"True","True","Covid : la septième vague s’intensifie, la Guadeloupe retient son souffle","https://www.mediapart.fr/journal/france/020722/covid-la-septieme-vague-s-intensifie-la-guadeloupe-retient-son-souffle"
"True","False","Covid : les sept questions qui fâchent","https://www.mediapart.fr/journal/france/300622/covid-face-la-septieme-vague-les-7-questions-qui-fachent"
"True","True","« La Cité de l’ordre », dans la citadelle assiégée de la police","https://www.mediapart.fr/studio/documentaires/france/la-cite-de-l-ordre-dans-la-citadelle-assiegee-de-la-police"
"True","True","Viktor Orbán est-il de plus en plus isolé en Europe ?","https://www.mediapart.fr/journal/international/010722/viktor-orban-est-il-de-plus-en-plus-isole-en-europe"
"True","True","« La Cour suprême des États-Unis a un agenda : celui de l’extrême droite »","https://www.mediapart.fr/journal/international/300622/la-cour-supreme-des-etats-unis-un-agenda-celui-de-l-extreme-droite"
"True","True","Brésil : les descendants d’esclaves, premières victimes du chaos climatique","https://www.mediapart.fr/journal/international/250622/bresil-les-descendants-d-esclaves-premieres-victimes-du-chaos-climatique"
"True","True","Guerre en Ukraine : le grand bond en arrière climatique","https://www.mediapart.fr/journal/international/010722/guerre-en-ukraine-le-grand-bond-en-arriere-climatique"
"True","True","L’Otan, le Prado et les « Ménines » de Velázquez","https://www.mediapart.fr/journal/international/010722/l-otan-le-prado-et-les-menines-de-velazquez"
"True","False","En Équateur, victoire en demi-teinte pour les autochtones après 18 jours de lutte","https://www.mediapart.fr/journal/international/010722/en-equateur-victoire-en-demi-teinte-pour-les-autochtones-apres-18-jours-de-lutte"
"True","False","« Années de plomb » : avis défavorable à l’extradition de dix anciens militants d’extrême gauche italiens","https://www.mediapart.fr/journal/international/290622/annees-de-plomb-avis-defavorable-l-extradition-de-dix-anciens-militants-d-extreme-gauche-italiens"
"True","False","Attaque du Capitole : Donald Trump plombé par un témoignage dévastateur","https://www.mediapart.fr/journal/international/290622/attaque-du-capitole-donald-trump-plombe-par-un-temoignage-devastateur"
"True","False","La crise politique de 2019 secoue encore la Bolivie","https://www.mediapart.fr/journal/international/290622/la-crise-politique-de-2019-secoue-encore-la-bolivie"
"True","True","En appel à Toulouse, des activistes handicapés plaident « l’état de nécessité »","https://www.mediapart.fr/journal/france/010722/en-appel-toulouse-des-activistes-handicapes-plaident-l-etat-de-necessite"
"True","False","Des élus veulent continuer de bétonner en paix","https://www.mediapart.fr/journal/france/300622/des-elus-veulent-continuer-de-betonner-en-paix"
"True","False","La première ministre annonce des solutions immédiates pour sauver les urgences cet été","https://www.mediapart.fr/journal/france/010722/la-premiere-ministre-annonce-des-solutions-immediates-pour-sauver-les-urgences-cet-ete"
"True","True","Épisode 2 Le docteur est-il encore en vie ?","https://www.mediapart.fr/journal/culture-idees/010722/j-ai-pu-apercevoir-le-docteur-asselah"
"True","True","Éric Coquerel : « Je veux travailler davantage sur l’évasion fiscale »","https://www.mediapart.fr/journal/france/300622/eric-coquerel-je-veux-travailler-davantage-sur-l-evasion-fiscale"
"True","False","Yaël Braun-Pivet, première femme au perchoir","https://www.mediapart.fr/journal/france/280622/yael-braun-pivet-premiere-femme-au-perchoir"
"True","False","Au PCF, un problème nommé Roussel","https://www.mediapart.fr/journal/france/280622/au-pcf-un-probleme-nomme-roussel"
"True","False","Détournement de frais de mandat : la justice rejette le « plaider-coupable » de Cambadélis","https://www.mediapart.fr/journal/france/280622/detournement-de-frais-de-mandat-la-justice-rejette-le-plaider-coupable-de-cambadelis"
"True","True","Le RN s’installe, LFI perd la partie","https://www.mediapart.fr/journal/france/290622/l-assemblee-le-rn-s-installe-et-lfi-perd-la-partie"
"True","False","Dans l’Eure, la déroute du front républicain","https://www.mediapart.fr/journal/france/290622/dans-l-eure-la-deroute-du-front-republicain"
"True","False","Au sein de l’UE, les réponses des parlements face à l’extrême droite","https://www.mediapart.fr/journal/international/290622/au-sein-de-l-ue-les-parlements-ne-repondent-pas-de-la-meme-maniere-la-poussee-de-l-extreme-droite"
"True","False","Quand l’extrême droite invoquait la démocratie pour la saper à l’Assemblée","https://www.mediapart.fr/journal/france/290622/quand-l-extreme-droite-invoquait-la-democratie-pour-la-saper-l-assemblee"
"True","True","Le « paquet pouvoir d’achat » ne pèse pas lourd","https://www.mediapart.fr/journal/economie/300622/le-paquet-pouvoir-d-achat-ne-pese-pas-lourd"
"True","False","Assurances : les résultats s’envolent, pas les salaires","https://www.mediapart.fr/journal/economie/300622/assurances-les-resultats-s-envolent-les-salaires-ne-decollent-pas"
"True","False","Inflation : en France, grèves partout, augmentations nulle part","https://www.mediapart.fr/journal/economie/290622/inflation-greves-partout-augmentations-nulle-part"
"True","False","Le risque d’une crise systémique de l’économie","https://www.mediapart.fr/journal/economie/290622/l-inflation-alimente-le-risque-d-une-crise-systemique-de-l-economie"
"True","True","À la fac de Rennes 2, un prof mis en examen pour viols pourrait retrouver son poste","https://www.mediapart.fr/journal/france/300622/la-fac-de-rennes-2-un-prof-mis-en-examen-pour-viols-pourrait-retrouver-son-poste"
"True","False","Symbole de #MeToo, la star R. Kelly condamnée à 30 ans de prison","https://www.mediapart.fr/journal/international/300622/symbole-de-metoo-la-star-r-kelly-condamnee-30-ans-de-prison"
"True","False","Les contradictions de la défense de Damien Abad","https://www.mediapart.fr/journal/france/290622/les-contradictions-de-la-defense-de-damien-abad"
"True","False","Gynécologues accusés de viols : le dialogue est rompu entre médecins et patientes","https://www.mediapart.fr/journal/france/290622/gynecologues-accuses-de-viols-le-dialogue-est-rompu-entre-medecins-et-patientes"
"True","False","Au tribunal, un professeur jugé pour « harcèlement sexuel environnemental »","https://www.mediapart.fr/journal/france/290622/au-tribunal-un-professeur-juge-pour-harcelement-sexuel-environnemental"
"True","True","Pourquoi Salah Abdeslam n’a pas convaincu la cour d’assises","https://www.mediapart.fr/journal/france/300622/pourquoi-salah-abdeslam-n-pas-convaincu-la-cour-d-assises"
"True","False","13-Novembre : perpétuité incompressible pour Salah Abdeslam","https://www.mediapart.fr/journal/france/290622/13-novembre-perpetuite-incompressible-pour-salah-abdeslam"
"True","False","Georges Salines : « Impossible de ne pas me sentir concerné par le sort des accusés »","https://www.mediapart.fr/journal/france/290622/georges-salines-impossible-de-ne-pas-me-sentir-concerne-par-le-sort-des-accuses"
"True","False","Emmanuel Domenach : « Suis-je une mauvaise partie civile ? »","https://www.mediapart.fr/journal/france/290622/emmanuel-domenach-suis-je-une-mauvaise-partie-civile"
"True","True","Le généreux ami ukrainien de Michel Platini","https://www.mediapart.fr/journal/international/290622/le-genereux-ami-ukrainien-de-michel-platini"
"True","False","En Alsace, un quart des cours d’eau sont très pollués par les pesticides","https://www.mediapart.fr/journal/france/290622/en-alsace-un-quart-des-cours-d-eau-sont-tres-pollues-par-les-pesticides"
"True","False","Ultradroite : deux ans de prison ferme pour Loïk Le Priol, ancien du GUD","https://www.mediapart.fr/journal/france/290622/ultradroite-deux-ans-de-prison-ferme-pour-loik-le-priol-ancien-du-gud"
"True","True","Le conflit russo-ukrainien divise la gauche anti-guerre","https://www.mediapart.fr/journal/international/280622/le-conflit-russo-ukrainien-divise-la-gauche-anti-guerre"
