"premium","picture","title","url"
"False","True","Écoles : Jean-Michel Blanquer a dévoilé le protocole sanitaire depuis Ibiza","https://www.lefigaro.fr/politique/jean-michel-blanquer-a-devoile-le-protocole-sanitaire-depuis-ibiza-revele-mediapart-20220117"
"True","True","Bras de fer entre Emmanuel Macron et Édouard Philippe à l’orée de la campagne","https://www.lefigaro.fr/elections/presidentielles/bras-de-fer-entre-emmanuel-macron-et-edouard-philippe-a-l-oree-de-la-campagne-20220117"
"False","False","Accrocs en série entre Emmanuel Macron et Édouard Philippe","https://www.lefigaro.fr/politique/accrocs-en-serie-entre-emmanuel-macron-et-edouard-philippe-20220117"
"True","True","Notre palmarès 2022 des villes de plus de 100.000 habitants où prendre sa retraite","https://www.lefigaro.fr/retraite/notre-palmares-2022-des-villes-de-plus-de-100-000-habitants-ou-prendre-sa-retraite-20220118"
"True","True","Boris Johnson bataille pour sa survie politique","https://www.lefigaro.fr/international/boris-johnson-bataille-pour-sa-survie-politique-20220117"
"False","False","DÉCRYPTAGE - Royaume-Uni : ces prétendants à la succession de Boris Johnson en embuscade…","https://www.lefigaro.fr/international/royaume-uni-ces-pretendants-a-la-succession-de-boris-johnson-en-embuscade-20220117"
"False","True","À Bobigny, 23 personnes en garde à vue pour avoir voulu déloger des squatteurs","https://www.lefigaro.fr/a-bobigny-23-personnes-en-garde-a-vue-pour-avoir-voulu-deloger-des-squatteurs-20220117"
"True","True","Entre mariage refusé et accusation de tentative de meurtre, la famille Guerlain continue de s'entre-déchirer","https://www.lefigaro.fr/faits-divers/entre-mariage-refuse-et-accusation-de-tentative-de-meurtre-la-famille-guerlain-continue-de-s-entre-dechirer-20220117"
"False","True","Covid-19 : baisse des contaminations en France, feu vert pour la pilule anti-Covid au Canada","https://www.lefigaro.fr/sciences/covid-19-baisse-des-contaminations-retour-du-masque-obligatoire-en-ile-de-france-20220118"
"False","False","Le rappel annuel Covid-grippe de Moderna «pas avant l'automne» 2023","https://www.lefigaro.fr/societes/le-rappel-annuel-covid-grippe-de-moderna-pas-avant-l-automne-2023-20220117"
"False","False","Covid-19 : vers un élargissement des aides aux cafés et restaurants ?","https://www.lefigaro.fr/social/covid-19-vers-un-elargissement-des-aides-aux-cafes-et-restaurants-20220117"
"False","False","Pourquoi n'y a-t-il pas de photo sur le passe sanitaire ?","https://www.lefigaro.fr/conjoncture/pourquoi-n-y-a-t-il-pas-de-photo-sur-le-passe-sanitaire-20220117"
"True","True","Après l’échec du CFCM, l’État veut réorganiser l’islam de France","https://www.lefigaro.fr/actualite-france/apres-l-echec-du-cfcm-l-etat-veut-reorganiser-l-islam-de-france-20220117"
"False","True","Pétrole : le Brent au plus haut depuis 2014, dopé par des tensions sur l'offre","https://www.lefigaro.fr/conjoncture/petrole-le-brent-au-plus-haut-depuis-2014-dope-par-des-tensions-sur-l-offre-20220118"
"False","False","Carburants: les prix à la pompe atteignent des records","https://www.lefigaro.fr/conso/carburants-les-prix-a-la-pompe-atteignent-des-records-20220117"
"True","True","La grande razzia des gangs de l’Est sur les moteurs de bateaux","https://www.lefigaro.fr/actualite-france/la-grande-razzia-des-gangs-de-l-est-sur-les-moteurs-de-bateaux-20220117"
"False","True","Des «dégâts considérables» dans les îles Tonga après l'éruption sous-marine","https://www.lefigaro.fr/international/des-degats-considerables-dans-les-iles-tonga-apres-l-eruption-sous-marine-20220118"
"True","True","Cyrille Dalmont: «Le passe vaccinal et l’engrenage d’une notation des citoyens»","https://www.lefigaro.fr/vox/monde/cyrille-dalmont-le-passe-vaccinal-et-l-engrenage-d-une-notation-des-citoyens-20220117"
"False","True","Covid-19 : ce qu'il faut savoir sur Paxlovid, la pilule de Pfizer bientôt distribuée en France","https://www.lefigaro.fr/sciences/covid-19-ce-qu-il-faut-savoir-sur-paxlovid-la-pilule-de-pfizer-bientot-distribuee-en-france-20220117"
"False","False","EXCLUSIF - Le patron de Pfizer au Figaro : «Nous allons bientôt reprendre une vie normale»","https://www.lefigaro.fr/societes/le-patron-de-pfizer-au-figaro-nous-allons-bientot-reprendre-une-vie-normale-20220116"
"False","True","Les salariés du médico-social appelés à la grève pour des hausses de salaire","https://www.lefigaro.fr/social/les-salaries-du-medico-social-appeles-a-la-greve-pour-des-hausses-de-salaire-20220118"
"True","True","Vous avez été placardisé ? Voici comment trouver les clefs de la sortie","https://www.lefigaro.fr/decideurs/vie-bureau/vous-avez-ete-placardise-voici-comment-trouver-les-clefs-de-sortie-20220117"
"False","True","«Ce gosse est un fantôme!» : à Bobigny, une mère jugée pour la mort en 2019 de son bébé de 4 mois","https://www.lefigaro.fr/faits-divers/ce-gosse-est-un-fantome-a-bobigny-une-mere-jugee-pour-la-mort-en-2019-de-son-bebe-de-4-mois-20220118"
"True","True","Non, il n'y aura pas de quartier «réservé» aux chrétiens à L'Île-Bouchard","https://www.lefigaro.fr/actualite-france/non-il-n-y-aura-pas-de-quartier-reserve-aux-chretiens-a-l-ile-bouchard-20220117"
"False","False","Open d'Australie : les organisateurs «regrettent profondément» l'impact de l'affaire Djokovic sur le tournoi","https://www.lefigaro.fr/sports/tennis/open-australie/open-d-australie-les-organisateurs-regrettent-profondement-l-impact-de-l-affaire-djokovic-sur-le-tournoi-20220118"
"False","False","Présidentielle : près de la moitié des Français pensent que Macron va être réélu","https://www.lefigaro.fr/elections/presidentielles/presidentielle-pres-de-la-moitie-des-francais-pensent-que-macron-va-etre-reelu-20220118"
"False","False","Les défaillances d'entreprises en rebond depuis fin 2021, selon Altares","https://www.lefigaro.fr/flash-eco/les-defaillances-d-entreprises-en-rebond-depuis-fin-2021-selon-altares-20220118"
"False","False","Royaume-Uni: le taux de chômage baisse à 4,1% à fin novembre","https://www.lefigaro.fr/flash-eco/royaume-uni-le-taux-de-chomage-baisse-a-4-1-a-fin-novembre-20220118"
"False","False","Des «dégâts considérables» dans les îles Tonga après l'éruption sous-marine","https://www.lefigaro.fr/international/des-degats-considerables-dans-les-iles-tonga-apres-l-eruption-sous-marine-20220118"
"False","False","Les défenseurs des migrants vent debout contre l'enfermement des étrangers","https://www.lefigaro.fr/flash-actu/les-defenseurs-des-migrants-vent-debout-contre-l-enfermement-des-etrangers-20220118"
"False","False","Pénurie de puces: les ventes européennes d'automobiles en chute libre en 2021","https://www.lefigaro.fr/societes/penurie-de-puces-les-ventes-europeennes-d-automobiles-en-chute-libre-en-2021-20220118"
"False","False","Tempête hivernale dans l'est des États-Unis et du Canada : des milliers de vols annulés","https://www.lefigaro.fr/international/tempete-hivernale-dans-l-est-des-etats-unis-et-du-canada-des-milliers-de-vols-annules-20220118"
"False","False","Covid-19 : baisse des contaminations en France, feu vert pour la pilule anti-Covid au Canada","https://www.lefigaro.fr/sciences/covid-19-baisse-des-contaminations-retour-du-masque-obligatoire-en-ile-de-france-20220118"
"False","False","«Beaucoup de jalousie», «manque de respect»: Alain Prost règle ses comptes avec le patron d'Alpine","https://www.lefigaro.fr/sports/formule-1/beaucoup-de-jalousie-manque-de-respect-prost-regle-ses-comptes-avec-le-patron-d-alpine-20220118"
"False","False","Dix ans après le carnage d'Utøya, Anders Behring Breivik demande sa libération","https://www.lefigaro.fr/international/dix-ans-apres-le-carnage-d-utoeya-anders-behring-breivik-demande-sa-liberation-20220118"
"False","False","États-Unis : la famille de Martin Luther King rejoint l'appel à réformer le système électoral","https://www.lefigaro.fr/flash-actu/etats-unis-la-famille-de-martin-luther-king-rejoint-l-appel-a-reformer-le-systeme-electoral-20220118"
"False","False","Mexique : un journaliste assassiné à Tijuana, un autre à Veracruz","https://www.lefigaro.fr/flash-actu/mexique-un-journaliste-assassine-a-tijuana-un-autre-a-veracruz-20220118"
"False","False","Le corps d'un petit garçon belge disparu retrouvé aux Pays-Bas","https://www.lefigaro.fr/flash-actu/le-corps-d-un-petit-garcon-belge-disparu-retrouve-aux-pays-bas-20220118"
"False","False","Tentative d'attentat contre une agence bancaire en Corse : le parquet antiterroriste se saisit de l'enquête","https://www.lefigaro.fr/flash-actu/tentative-d-attentat-contre-une-agence-bancaire-en-corse-le-parquet-antiterroriste-se-saisit-de-l-enquete-20220117"
"False","False","Écoles : Jean-Michel Blanquer a dévoilé le protocole sanitaire depuis Ibiza","https://www.lefigaro.fr/politique/jean-michel-blanquer-a-devoile-le-protocole-sanitaire-depuis-ibiza-revele-mediapart-20220117"
"False","False","Guadeloupe : trois codétenus en garde à vue après le décès d'un homme à la prison de Baie-Mahault","https://www.lefigaro.fr/flash-actu/guadeloupe-trois-codetenus-en-garde-a-vue-apres-le-deces-d-un-homme-a-la-prison-de-baie-mahault-20220117"
"False","False","Jean Castex promet un train de nuit Paris-Aurillac «d'ici deux ans»","https://www.lefigaro.fr/flash-eco/jean-castex-promet-un-train-de-nuit-paris-aurillac-d-ici-deux-ans-20220117"
"False","False","Ukraine : l'UE redoute l'intégration «de fait» à la Russie des régions non contrôlées par Kiev","https://www.lefigaro.fr/flash-actu/ukraine-l-ue-redoute-l-integration-de-fait-a-la-russie-des-regions-non-controlees-par-kiev-20220117"
"False","False","Finlande : l'Église va devoir «bientôt» présenter des excuses aux Samis","https://www.lefigaro.fr/flash-actu/finlande-l-eglise-va-devoir-bientot-presenter-des-excuses-aux-samis-20220117"
"False","False","Aide aux migrants : Estrosi relaxé dans une affaire de diffamation","https://www.lefigaro.fr/flash-actu/aide-aux-migrants-estrosi-relaxe-dans-une-affaire-de-diffamation-20220117"
"False","False","Marseille : un homme tué par balle dans une cité des quartiers nord","https://www.lefigaro.fr/flash-actu/marseille-un-homme-tue-par-balle-dans-une-cite-des-quartiers-nord-20220117"
"False","False","États-Unis : les compagnies aériennes s'alarment du «chaos» si la 5G n'est pas limitée près des aéroports","https://www.lefigaro.fr/flash-eco/etats-unis-les-compagnies-aeriennes-s-alarment-du-chaos-si-la-5g-n-est-pas-limitee-pres-des-aeroports-20220117"
"False","False","Twitter France et son directeur jugés pour ne pas avoir aidé la justice","https://www.lefigaro.fr/flash-eco/twitter-france-et-son-directeur-juges-pour-ne-pas-avoir-aide-la-justice-20220117"
"False","False","L'écrivain et prix Nobel Garcia Marquez avait une fille cachée, son «secret le plus sacré»","https://www.lefigaro.fr/culture/l-ecrivain-et-prix-nobel-garcia-marquez-avait-une-fille-cachee-son-secret-le-plus-sacre-20220117"
"False","False","Agriculture: Paris veut durcir les normes pour les importations de l'UE","https://www.lefigaro.fr/flash-eco/agriculture-paris-veut-durcir-les-normes-pour-les-importations-de-l-ue-20220117"
