"premium","picture","title","url"
"False","True","""On a entendu au moins 10 coups de feu"": un passager du véhicule visé par la police à Paris témoigne","https://www.bfmtv.com/police-justice/on-a-entendu-au-moins-10-coups-de-feu-un-passager-du-vehicule-vise-par-la-police-a-paris-temoigne_AV-202206070209.html"
"False","True","Refus d'obtempérer à Paris: l'avocat des policiers en garde à vue affirme qu'""il y a une vidéo""","https://www.bfmtv.com/paris/refus-d-obtemperer-a-paris-l-avocat-de-policiers-en-garde-a-vue-affirme-qu-il-y-a-une-video_AN-202206060577.html"
"False","False","Tirs mortels de policiers à Paris: quelles sont les règles face à un refus d'obtempérer?","https://www.bfmtv.com/police-justice/tirs-mortels-de-policiers-a-paris-quelles-sont-les-regles-face-a-un-refus-d-obtemperer_AN-202206060360.html"
"False","True","""C'était une question de survie"": ces infirmières qui ont raccroché leur blouse","https://www.bfmtv.com/sante/c-etait-une-question-de-survie-ces-infirmieres-qui-ont-raccroche-leur-blouse_AN-202206070007.html"
"False","True","Hôpital: nouvelle mobilisation des soignants, des dizaines de rassemblements partout en France","https://www.bfmtv.com/sante/hopital-nouvelle-mobilisation-des-soignants-des-dizaines-de-rassemblements-partout-en-france_AD-202206070017.html"
"False","True","EN DIRECT - Après les propos de Mélenchon sur la police, Estrosi veut le ""mettre hors d'état de nuire""","https://www.bfmtv.com/politique/elections/legislatives/en-direct-legislatives-la-macronie-et-la-nupes-se-battent-pour-obtenir-la-majorite-a-l-assemblee_LN-202206070054.html"
"False","True","""Le président sera raisonnable"": Mélenchon se voit toujours Premier ministre à l'issue des législatives","https://www.bfmtv.com/politique/le-president-sera-raisonnable-melenchon-se-voit-toujours-premier-ministre-a-l-issue-des-legislatives_AN-202206070218.html"
"False","True","Législatives: Macron peut-il ne pas nommer Mélenchon Premier ministre en cas de victoire de la Nupes?","https://www.bfmtv.com/politique/elections/legislatives/nomination-du-premier-ministre-que-prevoit-la-loi-en-cas-de-cohabitation_AN-202206060348.html"
"False","True","Hollande juge le programme de la Nupes ""infaisable"", mais ""aucune"" de ses mesures ne le ""gêne""","https://www.bfmtv.com/politique/elections/legislatives/hollande-juge-le-programme-de-la-nupes-infaisable-mais-aucune-de-ses-mesures-ne-le-gene_AN-202206070088.html"
"False","True","Législatives: dans le Rhône, un candidat Reconquête invite la presse à un atelier de tir","https://www.bfmtv.com/politique/legislatives-dans-le-rhone-un-candidat-reconquete-invite-la-presse-a-un-atelier-de-tir_AN-202206070188.html"
"False","True","Blanquer aspergé de chantilly: les professeurs se défendent et dénoncent une Éducation nationale ""en chute libre""","https://www.bfmtv.com/politique/elections/legislatives/blanquer-asperge-de-chantilly-les-professeurs-se-defendent-et-denoncent-une-education-nationale-en-chute-libre_AD-202206060596.html"
"False","True","Covid-19: la crainte d'une 7e vague en France à cause des nouveaux variants BA.4 et BA.5","https://www.bfmtv.com/sante/covid-19-la-crainte-d-une-7e-vague-en-france-a-cause-des-nouveaux-variants-ba-4-et-ba-5_AN-202206070013.html"
"False","True","Il faut mettre Jean-Luc Mélenchon hors d'état de nuire. Christian Estrosi, après les propos du leader insoumis sur la police qui ""tue""","https://www.bfmtv.com/politique/apres-les-propos-de-melenchon-sur-la-police-qui-tue-estrosi-appelle-a-le-mettre-hors-d-etat-de-nuire_AV-202206070213.html"
"False","True","""Avant chaque appel, il se fait prendre en photo"": Emmanuel Macron moqué à la télévision…","https://www.bfmtv.com/international/avant-chaque-appel-il-se-fait-prendre-en-photo-emmanuel-macron-moque-a-la-television-russe_AV-202206070019.html"
"False","True","Un soldat ukrainien blessé épouse sa fiancée à l'hôpital Percy de Clamart","https://www.bfmtv.com/international/un-soldat-ukrainien-blesse-epouse-sa-fiancee-a-l-hopital-percy-de-clamart_AV-202206070097.html"
"False","True","EN DIRECT - Guerre en Ukraine: combats acharnés à Severodonetsk, nouvelle mise en garde…","https://www.bfmtv.com/international/en-direct-guerre-en-ukraine-combats-acharnes-a-severodonetsk-nouvelle-mise-en-garde-de-moscou_LN-202206070016.html"
"False","True","Croatie-France: les Bleus passent encore à côté de la victoire, la Ligue des nations…","https://rmcsport.bfmtv.com/football/equipe-de-france/croatie-france-les-bleus-passent-encore-a-cote-de-la-victoire-la-ligue-des-nations-debute-mal_AV-202206060574.html"
"False","True","Royaume-Uni: avant l'interdiction de la vente d'ivoire d'éléphant, les ventes aux…","https://www.bfmtv.com/animaux/royaume-uni-avant-l-interdiction-de-la-vente-d-ivoire-d-elephant-les-ventes-aux-encheres-ont-battu-des-records_AN-202206070091.html"
"False","True","LIGNE ROUGE - Pizzas Buitoni, enquête sur un scandale","https://www.bfmtv.com/economie/entreprises/ligne-rouge-pizzas-buitoni-enquete-sur-un-scandale_AN-202206060536.html"
"False","True","La Maison Blanche défend le projet de Biden de se rendre en Arabie saoudite","https://www.bfmtv.com/international/amerique-nord/etats-unis/etats-unis-la-maison-blanche-defend-le-projet-de-biden-de-se-rendre-en-arabie-saoudite_AD-202206070012.html"
"False","True","Scandale du ""Partygate"": Boris Johnson survit à un vote de défiance de son Parti…","https://www.bfmtv.com/international/europe/angleterre/scandale-du-partygate-boris-johnson-survit-a-un-vote-de-defiance-de-son-parti-conservateur_AD-202206060557.html"
"False","True","Frédéric Leclerc-Imhoff: l'hommage de Maxime Brandstaetter et Oksana Leuta, de retour…","https://www.bfmtv.com/international/asie/russie/frederic-leclerc-imhoff-l-hommage-de-maxime-brandstaetter-et-oksana-leuta-de-retour-d-ukraine-a-notre-collegue_AN-202206050287.html"
"False","True","Ce que l'on sait des suspicions de piqûres lors du concert de ""La Chanson de l'année"" à…","https://www.bfmtv.com/var/ce-que-l-on-sait-des-suspicions-de-piqures-lors-du-concert-de-la-chanson-de-l-annee-a-toulon_AV-202206060224.html"
"False","True","Borne, Abad, Zemmour, Rousseau, Le Pen... Les circonscriptions à suivre aux législatives","https://www.bfmtv.com/politique/elections/legislatives/borne-abad-zemmour-rousseau-le-pen-les-circonscriptions-a-suivre-aux-legislatives_AN-202206050016.html"
"False","True","Absence d'Elizabeth, pitreries de Louis, retour de Meghan et Harry... les moments forts…","https://www.bfmtv.com/people/tetes-couronnees/absence-d-elizabeth-pitreries-de-louis-retour-de-meghan-et-harry-les-moments-forts-du-jubile_AN-202206050264.html"
"False","True","TOUT COMPRENDRE - Qu'est-ce que la 3-MMC, cette drogue présentée comme la ""nouvelle…","https://www.bfmtv.com/sante/tout-comprendre-qu-est-ce-que-la-3-mmc-cette-drogue-presentee-comme-la-nouvelle-cocaine_AN-202206020349.html"
"False","True","Les géants des VTC ouvrent leurs plateformes aux taxis","https://www.bfmtv.com/economie/entreprises/transports/les-geants-des-vtc-ouvrent-leurs-plateformes-aux-taxis_AV-202206070210.html"
"False","True","Le Puy du Fou lancera son spectacle aux Etats-Unis en 2024 avec les indiens Cherokee","https://www.bfmtv.com/economie/entreprises/le-puy-du-fou-lancera-son-spectacle-aux-etats-unis-en-2024-avec-les-indiens-cherokee_AV-202206070149.html"
"False","True","Airbus met aux enchères 500 pièces d'A380","https://www.bfmtv.com/economie/entreprises/industries/airbus-met-aux-encheres-500-pieces-d-a380_AV-202206070101.html"
"False","True","Une étude dessine l'entreprise de 2030, une entreprise ""Full RSE""","https://www.bfmtv.com/economie/economie-social/une-etude-dessine-l-entreprise-de-2030-une-entreprise-full-rse_AN-202206070036.html"
"False","True","Pouvoir d'achat: les propositions de la CPME face à l'inflation","https://www.bfmtv.com/economie/economie-social/france/pouvoir-d-achat-les-propositions-de-la-cpme-face-a-l-inflation_AD-202206070032.html"
"False","False","Candidats","https://www.bfmtv.com/politique/elections/presidentielle/election-presidentielle-2022-qui-sont-les-candidats-declares_GN-202201100009.html"
"False","False","Sondages","https://www.bfmtv.com/politique/elections/presidentielle/tous-les-sondages-de-l-election-presidentielle-2022_GN-202110220314.html"
"False","True","Pour Le Pen, les propos de Mélenchon sur la police sont ""une diffamation extrêmement lourde""","https://www.bfmtv.com/politique/front-national/pour-le-pen-les-propos-de-melenchon-sur-la-police-sont-une-diffamation-extremement-lourde_AN-202206070224.html"
"False","True","""Le président sera raisonnable"": Mélenchon se voit toujours Premier ministre à l'issue des législatives","https://www.bfmtv.com/politique/le-president-sera-raisonnable-melenchon-se-voit-toujours-premier-ministre-a-l-issue-des-legislatives_AN-202206070218.html"
"False","True","Christian Estrosi face à Apolline de Malherbe en direct - 07/06","https://www.bfmtv.com/replay-emissions/l-interview/christian-estrosi-face-a-apolline-de-malherbe-en-direct-07-06_VN-202206070197.html"
"False","True","Législatives: dans le Rhône, un candidat Reconquête invite la presse à un atelier de tir","https://www.bfmtv.com/politique/legislatives-dans-le-rhone-un-candidat-reconquete-invite-la-presse-a-un-atelier-de-tir_AN-202206070188.html"
"False","True","Hollande juge le programme de la Nupes ""infaisable"", mais ""aucune"" de ses mesures ne le ""gêne""","https://www.bfmtv.com/politique/elections/legislatives/hollande-juge-le-programme-de-la-nupes-infaisable-mais-aucune-de-ses-mesures-ne-le-gene_AN-202206070088.html"
"False","True","Croatie-France: les Bleus passent encore à côté de la victoire, la Ligue des nations débute mal","https://rmcsport.bfmtv.com/football/equipe-de-france/croatie-france-les-bleus-passent-encore-a-cote-de-la-victoire-la-ligue-des-nations-debute-mal_AV-202206060574.html"
"False","True","Mercato: ""Chaque semaine on me vire"", Pochettino ironise sur sa situation au PSG","https://rmcsport.bfmtv.com/football/transferts/mercato-chaque-semaine-on-me-vire-pochettino-ironise-sur-sa-situation-au-psg_AV-202206060592.html"
"False","True","Mercato: Galtier veut rejoindre le PSG, son départ de Nice à l'étude","https://rmcsport.bfmtv.com/football/transferts/mercato-galtier-veut-rejoindre-le-psg-son-depart-de-nice-a-l-etude_AV-202206060519.html"
"False","True","""Il progresse de jour en jour"": Alaphilippe fait tout pour pouvoir disputer le Tour de France... sans garantie pour l'instant","https://rmcsport.bfmtv.com/cyclisme/il-progresse-de-jour-en-jour-alaphilippe-fait-tout-pour-pouvoir-disputer-le-tour-de-france-sans-garantie-pour-l-instant_AV-202206060523.html"
"False","True","Roland-Garros: ""Un anesthésiant, c’est discutable mais on peut le faire"", un médecin comprend les injections de Nadal","https://rmcsport.bfmtv.com/tennis/roland-garros/roland-garros-un-anesthesiant-c-est-discutable-mais-on-peut-le-faire-un-medecin-comprend-les-injections-de-nadal_AV-202206060521.html"
"False","True","PMA pour toutes : 9 mois après, l'attente se prolonge pour les femmes","https://www.bfmtv.com/societe/pma-pour-toutes-9-mois-apres-l-attente-se-prolonge-pour-les-femmes_GN-202205020004.html"
"False","True","Carte Présidentielle : Pour qui ont voté les communes où Mélenchon était arrivé en tête au premier…","https://www.bfmtv.com/politique/elections/presidentielle/carte-presidentielle-pour-qui-ont-vote-les-communes-ou-melenchon-etait-arrive-en-tete-au-premier-tour_GN-202204240478.html"
"False","True","Carte Résultats Présidentielle : La France de l'abstention au second tour","https://www.bfmtv.com/politique/elections/presidentielle/presidentielle-la-france-de-l-abstention-au-second-tour_GN-202204240424.html"
"False","True","Carte Résultats Présidentielle 2022 : La France du vote Le Pen au second tour","https://www.bfmtv.com/politique/elections/presidentielle/carte-resultats-presidentielle-2022-la-france-du-vote-le-pen-au-second-tour_GN-202204240422.html"
"False","True","Carte Résultats Présidentielle 2022 : La France du vote Macron au second tour","https://www.bfmtv.com/politique/elections/presidentielle/carte-resultats-presidentielle-2022-la-france-du-vote-macron-au-second-tour_GN-202204240398.html"
"False","True","Carte Résultats Présidentielle 2022 : Qui de Macron ou Le Pen arrive en tête au second tour dans…","https://www.bfmtv.com/politique/elections/presidentielle/carte-resultats-presidentielle-2022-qui-de-macron-ou-le-pen-arrive-en-tete-au-second-tour-dans-votre-commune_GN-202204240336.html"
"False","True","Le Turkménistan, une dictature officiellement sans covid où les morts s'accumulent","https://www.bfmtv.com/international/le-turkmenistan-une-dictature-officiellement-sans-covid-ou-les-morts-s-accumulent_GN-202204230008.html"
