"premium","picture","title","url"
"False","True","Motion de censure: pourquoi le calcul de la Nupes est un coup de bluff","https://www.bfmtv.com/politique/motion-de-censure-pourquoi-le-calcul-de-la-nupes-est-un-coup-de-bluff_AN-202207060133.html"
"False","True","Motion de censure, discours d'Élisabeth Borne... Journée chargée ce mercredi à l'Assemblée","https://www.bfmtv.com/politique/parlement/motion-de-censure-discours-d-elisabeth-borne-journee-chargee-ce-mercredi-a-l-assemblee_AN-202207060138.html"
"False","True","Discours de politique générale: comment Élisabeth Borne s'est préparée à ce délicat exercice","https://www.bfmtv.com/politique/gouvernement/discours-de-politique-generale-comment-elisabeth-borne-s-est-preparee-a-ce-delicat-exercice_AV-202207060040.html"
"False","True","EN DIRECT - Élisabeth Borne à l'épreuve du discours de politique générale, suivez l'actualité politique de ce…","https://www.bfmtv.com/politique/en-direct-elisabeth-borne-a-l-epreuve-du-discours-de-politique-generale-suivez-l-actualite-politique-de-ce-mercredi_LN-202207060081.html"
"False","True","Métropole de Nice: Christian Estrosi annonce le retour du port du masque obligatoire dans les transports dès lundi","https://www.bfmtv.com/cote-d-azur/metropole-de-nice-christian-estrosi-annonce-le-retour-du-port-du-masque-obligatoire-des-lundi_AN-202207060155.html"
"False","True","TGV, TER, Ouigo, RER: le point sur la journée de grève à la SNCF","https://www.bfmtv.com/economie/entreprises/transports/tgv-ter-ouigo-rer-le-point-sur-la-journee-de-greve-a-la-sncf_AD-202207060038.html"
"False","True","Variole du singe: les règles à suivre si vous êtes malade ou cas contact","https://www.bfmtv.com/sante/variole-du-singe-les-regles-a-suivre-si-vous-etes-malade-ou-cas-contact_AN-202207060104.html"
"False","True","""Elle doit avoir une deuxième chance"": la mère d'Emilie König ""soulagée"" du retour de sa fille en France","https://www.bfmtv.com/international/moyen-orient/syrie/elle-doit-avoir-une-deuxieme-chance-la-mere-d-emilie-konig-soulagee-du-retour-de-sa-fille-en-france_AD-202207060248.html"
"False","True","""On a beaucoup de doutes"": l'objectif d'un professeur devant chaque classe en septembre est-il tenable?","https://www.bfmtv.com/societe/education/on-a-beaucoup-de-doutes-l-objectif-d-un-professeur-devant-chaque-classe-en-septembre-est-il-tenable_AV-202207060111.html"
"False","True","86% de taux de réussite au baccalauréat, en nette baisse par rapport à 2021","https://www.bfmtv.com/societe/education/86-de-taux-de-reussite-au-baccalaureat-en-nette-baisse-par-rapport-a-2021_AD-202207050610.html"
"False","True","Classes vides, jeux de société... À quoi sert la dernière semaine d'école avant les vacances d'été?","https://www.bfmtv.com/societe/education/classes-vides-jeux-de-societe-a-quoi-sert-la-derniere-semaine-d-ecole-avant-les-vacances-d-ete_AN-202207050433.html"
"False","True","Double meurtre à Pouyastruc: le père des enfants de l'une des victimes au cœur des…","https://www.bfmtv.com/police-justice/double-meurtre-a-pouyastruc-le-pere-des-enfants-de-l-une-des-victimes-au-coeur-des-soupcons_AV-202207060170.html"
"False","True","Ce que l'on sait du meurtre de deux enseignants à Pouyastruc, dans les Hautes-Pyrénées","https://www.bfmtv.com/police-justice/ce-que-l-on-sait-du-meurtre-de-deux-enseignants-a-pouyastruc-dans-les-hautes-pyrenees_AN-202207050644.html"
"False","True","EN DIRECT - Guerre en Ukraine: les Russes avancent dans le Donbass, bombardement massif…","https://www.bfmtv.com/international/en-direct-guerre-en-ukraine-les-russes-avancent-dans-le-donbass-bombardement-massif-sur-sloviansk_LN-202207060024.html"
"False","True","La libération de Brittney Griner, prisonnière en Russie, est une ""priorité"" pour Joe Biden","https://www.bfmtv.com/international/la-liberation-de-brittney-griner-prisonniere-en-russie-est-une-priorite-pour-joe-biden_AD-202207060022.html"
"False","True","Danemark: des milliers de personnes ont rendu hommage aux victimes de la fusillade de…","https://www.bfmtv.com/international/europe/danemark-des-milliers-de-personnes-ont-rendu-hommage-aux-victimes-de-la-fusillade-de-copenhague_AD-202207050774.html"
"False","True","Fusillade dans un défilé du 4-Juillet près de Chicago: le suspect inculpé de sept meurtres","https://www.bfmtv.com/international/amerique-nord/etats-unis/fusillade-dans-un-defile-du-4-juillet-pres-de-chicago-le-suspect-inculpe-de-sept-meurtres_AD-202207050776.html"
"False","True","Météo: les températures vont grimper cette semaine en France","https://www.bfmtv.com/meteo/meteo-les-temperatures-vont-grimper-cette-semaine-en-france_AD-202207050740.html"
"False","True","Grèves, vols annulés: les voyagistes ""craignent le pire"" cet été dans les aéroports","https://www.bfmtv.com/economie/economie-social/france/greves-vols-annules-les-voyagistes-craignent-le-pire-cet-ete-dans-les-aeroports_AD-202206300700.html"
"False","True","""Ce n'est plus raisonnable"": face à la sécheresse, les douches de plage sont-elles vouées…","https://www.bfmtv.com/environnement/ce-n-est-plus-raisonnable-face-a-la-secheresse-les-douches-de-plage-sont-elles-vouees-a-disparaitre_AV-202207010301.html"
"False","True","Covid-19: quand le pic de la 7e vague sera-t-il atteint?","https://www.bfmtv.com/sante/covid-19-quand-le-pic-de-la-7e-vague-sera-t-il-atteint_AN-202206300425.html"
"False","True","Jouets: La Foir'fouille critiqué pour un ""kit petite influenceuse"" à partir de trois ans","https://www.bfmtv.com/tech/jouets-la-foir-fouille-critique-pour-un-kit-petite-influenceuse-a-partir-de-trois-ans_AN-202207010309.html"
"False","True","""Le métier devient compliqué à exercer"": des gynécologues ""dépassés"" par la mise en cause…","https://www.bfmtv.com/sante/le-metier-devient-complique-a-exercer-des-gyneco-depasses-par-la-mise-en-cause-de-leurs-pratiques_AN-202206280682.html"
"False","True","Retraites: selon le Medef, le patronat doit faire ""de gros efforts"" sur l'emploi des seniors","https://www.bfmtv.com/economie/economie-social/retraites-selon-le-medef-le-patronat-doit-faire-de-gros-efforts-sur-l-emploi-des-seniors_AV-202207060244.html"
"False","True","Les grèves à la SNCF et dans l'aérien boostent les réservations des compagnies de cars et covoiturages","https://www.bfmtv.com/economie/entreprises/transports/les-greves-a-la-sncf-et-dans-l-aerien-boostent-les-reservations-des-compagnies-de-cars-et-covoiturages_AV-202207060228.html"
"False","True","Alstom va fournir des métros à Bhopal et Indore en Inde pour presque 400 millions d'euros","https://www.bfmtv.com/economie/entreprises/industries/alstom-va-fournir-des-metros-a-bhopal-et-indore-en-inde-pour-presque-400-millions-d-euros_AV-202207060218.html"
"False","True","Dépression, anxiété, stress… Alerte sur la santé mentale des jeunes salariés","https://www.bfmtv.com/economie/economie-social/social/depression-anxiete-stress-alerte-sur-la-sante-mentale-des-jeunes-salaries_AN-202207060186.html"
"False","True","Grève SNCF: le détail des perturbations sur le RER et le Transilien","https://www.bfmtv.com/paris/greve-sncf-le-detail-des-perturbations-sur-le-rer-et-le-transilien_AV-202207060182.html"
"False","True","Jour de pavés sur le Tour de France, pourquoi il ne faut surtout pas manquer l'étape du jour","https://rmcsport.bfmtv.com/cyclisme/tour-de-france/jour-de-paves-sur-le-tour-de-france-pourquoi-il-ne-faut-surtout-pas-manquer-l-etape-du-jour_AV-202207060190.html"
"False","True","Tour de France en direct: une cinquième étape de tous les dangers sur les pavés","https://rmcsport.bfmtv.com/cyclisme/tour-de-france/tour-de-france-en-direct-une-cinquieme-etape-de-tous-les-dangers-sur-les-paves_LN-202207060203.html"
"False","True","Euro 2022: dates, tableau, stades, tout ce qu'il faut savoir avant la 13e édition","https://rmcsport.bfmtv.com/football/feminin/euro/euro-2022-dates-tableau-stades-tout-ce-qu-il-faut-savoir-avant-la-13e-edition_AV-202207060026.html"
"False","True","Hegerberg, Rapinoe, Putellas… la malédiction du Ballon d’or féminin","https://rmcsport.bfmtv.com/football/feminin/euro/hegerberg-rapinoe-putellas-la-malediction-du-ballon-d-or-feminin_AV-202207060214.html"
"False","True","Bordeaux: la rétrogradation des Girondins en National 1 confirmée en appel par la DNCG","https://rmcsport.bfmtv.com/football/national/bordeaux-la-retrogradation-des-girondins-en-national-1-confirmee-en-appel-par-la-dncg_AV-202207050590.html"
"False","True","""J'ai pleuré tous les soirs pendants un an"" : fausses couches, vraies souffrances","https://www.bfmtv.com/societe/j-ai-pleure-tous-les-soirs-pendant-un-an-fausse-couche-vraies-souffrances_AN-202206230011.html"
"False","True","Carte. Résultats élections législatives 2022 : La France du vote RN au premier tour","https://www.bfmtv.com/politique/elections/legislatives/carte-resultats-elections-legislatives-2022-la-france-du-vote-rn-au-premier-tour_GN-202206130020.html"
"False","True","Lascaux, Chauvet, Cosquer...Le nouvel eldorado touristique des grottes préhistoriques","https://www.bfmtv.com/economie/lascaux-chauvet-cosquer-le-nouvel-eldorado-touristique-des-grottes-prehistoriques_GN-202206040051.html"
"False","True","Guerre en Ukraine : 100 jours de conflit racontés en images satellite","https://www.bfmtv.com/international/guerre-en-ukraine-100-jours-de-conflits-racontes-en-images-satellite_AN-202206030031.html"
"False","True","Entre l'Ukraine et la Russie, une histoire contrariée","https://www.bfmtv.com/international/entre-l-ukraine-et-la-russie-une-histoire-contrariee_GN-202205090013.html"
"False","True","PMA pour toutes : 9 mois après, l'attente se prolonge pour les femmes","https://www.bfmtv.com/societe/pma-pour-toutes-9-mois-apres-l-attente-se-prolonge-pour-les-femmes_GN-202205020004.html"
"False","True","""Stranger Things 4"" devient le deuxième contenu Netflix à totaliser le milliard d'heures vues","https://www.bfmtv.com/people/series/stranger-things-4-devient-le-deuxieme-contenu-netflix-a-totaliser-le-milliard-d-heures-vues_AN-202207060250.html"
"False","True","""Au début, ils avaient des formes un peu bizarres"": comment les Minions ont été créés","https://www.bfmtv.com/people/cinema/au-debut-ils-avaient-des-formes-un-peu-bizarres-comment-les-minions-ont-ete-crees_AN-202207060242.html"
"False","True","Les Minions, de retour au cinéma ce mercredi, s'invitent sur le plateau de BFMTV","https://www.bfmtv.com/people/cinema/les-minions-de-retour-au-cinema-ce-mercredi-s-invitent-sur-le-plateau-de-bfmtv_AN-202207060233.html"
"False","True","S'habiller en costume cravate pour aller voir le film les Minions 2","https://www.bfmtv.com/culture/s-habiller-en-costume-cravate-pour-aller-voir-le-film-les-minions-2_VN-202207060232.html"
"False","True","Le bouleversant témoignage de l'actrice Judith Chemla, victime de violences conjugales","https://www.bfmtv.com/people/cinema/le-bouleversant-temoignage-de-l-actrice-judith-chemla-victime-de-violences-conjugales_AN-202207060223.html"
"False","True","LADD : l’enseigne spécialisée pour vos projets de design et d’architecture d’Intérieur","https://www.bfmtv.com/pratique/entreprises-d-avenir/ladd-l-enseigne-specialisee-pour-vos-projets-de-design-et-d-architecture-d-interieur_AB-202207060005.html"
"False","True","AVISUN : le solaire à la portée de tous","https://www.bfmtv.com/economie/entreprises/avisun-le-solaire-a-la-portee-de-tous_AO-202207040002.html"
"False","True","TILKEO Rénovation : La rénovation énergétique en confiance","https://www.bfmtv.com/economie/entreprises/tilkeo-renovation-la-renovation-energetique-en-confiance_AO-202206290015.html"
"False","True","Black Friday 2020 : tout ce qu’il faut savoir","https://www.bfmtv.com/pratique/tech/black-friday-2020-tout-ce-qu-il-faut-savoir_AN-202009230270.html"
"False","True","Vienne: fermeture définitive de la Fonderie du Poitou Alu","https://www.bfmtv.com/economie/entreprises/industries/vienne-fermeture-definitive-de-la-fonderie-du-poitou-alu_AD-202207060047.html"
"False","True","Bientôt des comptes à rebours sur les feux piétons en France","https://www.bfmtv.com/auto/bientot-des-compte-a-rebours-sur-les-feux-pietons-en-france_AN-202207050629.html"
