"premium","picture","title","url"
"True","True","Dans le Donbass, des soldats ukrainiens épuisés racontent leur «enfer»: le récit de l’envoyé spécial du Figaro","https://www.lefigaro.fr/international/dans-le-donbass-des-soldats-epuises-racontent-leur-enfer-le-recit-de-l-envoye-special-du-figaro-20220821"
"False","False","Guerre en Ukraine : où en est le conflit six mois après le début de l'invasion russe ?","https://www.lefigaro.fr/international/guerre-en-ukraine-ou-en-est-on-six-mois-apres-l-invasion-russe-20220822"
"False","False","Centrale nucléaire en Ukraine : Biden, Macron, Scholz et Johnson appellent à la «retenue»","https://www.lefigaro.fr/international/centrale-nucleaire-en-ukraine-biden-macron-scholz-et-johnson-appellent-a-la-retenue-20220821"
"False","False","Guerre en Ukraine: un haut responsable du service de sécurité retrouvé mort chez lui","https://www.lefigaro.fr/international/guerre-en-ukraine-un-haut-responsable-du-service-de-securite-retrouve-mort-chez-lui-20220821"
"True","True","Qui était Daria Douguina, fille d’un «idéologue» proche du Kremlin, tuée dans la banlieue de Moscou?","https://www.lefigaro.fr/international/qui-etait-daria-douguina-fille-d-un-ideologue-proche-du-kremlin-tuee-dans-la-banlieue-de-moscou-20220821"
"True","True","Six mois de conflit en Ukraine : et Poutine rendit à la menace nucléaire sa pleine signification","https://www.lefigaro.fr/international/six-mois-de-conflit-en-ukraine-et-poutine-rendit-a-la-menace-nucleaire-sa-pleine-signification-20220822"
"False","False","La publicité pour les énergies fossiles désormais interdite","https://www.lefigaro.fr/medias/la-publicite-pour-les-energies-fossiles-desormais-interdite-20220822"
"True","True","Pour Emmanuel Macron, l’automne de tous les dangers","https://www.lefigaro.fr/politique/pour-emmanuel-macron-l-automne-de-tous-les-dangers-20220821"
"False","False","DÉCRYPTAGE - Rentrée: les dossiers chauds qui attendent l’exécutif","https://www.lefigaro.fr/politique/rentree-les-dossiers-chauds-qui-attendent-l-executif-20220821"
"False","False","ÉDITORIAL - Rentrée: «L’heure de vérité»","https://www.lefigaro.fr/vox/politique/rentree-l-heure-de-verite-20220821"
"False","False","Élisabeth Borne désormais plus populaire qu'Emmanuel Macron, selon un sondage","https://www.lefigaro.fr/politique/elisabeth-borne-desormais-plus-populaire-qu-emmanuel-macron-selon-un-sondage-20220821"
"True","True","Tests HPI: cette étrange épidémie d’enfants «surdoués»","https://www.lefigaro.fr/actualite-france/tests-hpi-cette-etrange-epidemie-d-enfants-surdoues-20220821"
"False","False","Doctolib accusé de promouvoir des médecines parallèles","https://www.lefigaro.fr/societes/doctolib-accuse-de-promouvoir-des-medecines-paralleles-20220822"
"False","True","Darmanin révèle que 55 % des délinquants interpellés à Marseille sont étrangers","https://www.lefigaro.fr/politique/darmanin-revele-que-55-des-delinquants-interpelles-a-marseille-sont-etrangers-20220821"
"False","False","LA CONTROVERSE - Y a-t-il (vraiment) un lien entre immigration et délinquance ?","https://www.lefigaro.fr/actualite-france/y-a-t-il-vraiment-un-lien-entre-immigration-et-delinquance-20220727"
"False","False","Contre les pyromanes, Darmanin veut créer 3000 postes de «gendarmes verts»","https://www.lefigaro.fr/politique/atteintes-a-l-environnement-darmanin-va-creer-3000-postes-de-gendarmes-verts-20220821"
"False","False","Immigration : Darmanin appelle à «lutter contre l'attractivité sociale» de Mayotte","https://www.lefigaro.fr/politique/immigration-darmanin-appelle-a-lutter-contre-l-attractivite-sociale-de-mayotte-20220821"
"False","True","Course de karts à la prison de Fresnes : Dupond-Moretti ouvre une enquête","https://www.lefigaro.fr/actualite-france/course-de-karting-a-la-prison-de-fresnes-dupond-moretti-ouvre-une-enquete-20220820"
"True","True","La hausse des prix à la cantine inquiète maires et parents d’élèves","https://www.lefigaro.fr/conjoncture/la-hausse-des-prix-a-la-cantine-inquiete-maires-et-parents-d-eleves-20220821"
"False","True","Tops/Flops Lille-PSG : l'incroyable machine parisienne, la déroute des Dogues","https://www.lefigaro.fr/sports/football/ligue-1/tops-flops-lille-psg-l-incroyable-machine-parisienne-la-deroute-des-dogues-20220821"
"False","False","PSG : la combinaison géniale qui a permis à Mbappé de marquer après 8 secondes de jeu (vidéo)","https://www.lefigaro.fr/sports/football/ligue-1/psg-la-combinaison-geniale-qui-a-permis-a-mbappe-de-marquer-apres-8-secondes-de-jeu-video-20220822"
"False","False","Ligue 1 : l'impressionnante démonstration du Paris SG contre Lille","https://www.lefigaro.fr/sports/football/ligue-1/ligue-1-le-paris-sg-en-demonstration-contre-lille-20220821"
"True","True","L'édifiante histoire de la fratrie Malo ou comment s'en sortir sans parents ni argent","https://www.lefigaro.fr/actualite-france/l-edifiante-histoire-de-la-fratrie-malo-ou-comment-s-en-sortir-sans-parents-ni-argent-20220818"
"False","True","Gynécologie en danger : «De moins en moins de médecins et de plus en plus de patientes»","https://madame.lefigaro.fr/societe/actu/gynecologie-en-danger-de-moins-en-moins-de-medecins-et-de-plus-en-plus-de-patientes-20220822"
"True","True","Six clés pour une meilleure estime de soi","https://www.lefigaro.fr/sciences/6-cles-pour-une-meilleure-estime-de-soi-20220816"
"False","False","Début de manœuvres conjointes entre Washington et Séoul, les plus importantes depuis 2018","https://www.lefigaro.fr/international/debut-de-manoeuvres-conjointes-entre-washington-et-seoul-les-plus-importantes-depuis-2018-20220822"
"True","True","Ces dix sites archéologiques qui racontent l'histoire de la France","https://www.lefigaro.fr/culture/patrimoine/ces-dix-sites-archeologiques-qui-racontent-l-histoire-de-la-france-20220822"
"False","False","Pakistan: arrêter Imran Khan serait franchir une «ligne rouge», prévient l'opposition","https://www.lefigaro.fr/flash-actu/pakistan-arreter-imran-khan-serait-franchir-une-ligne-rouge-previent-l-opposition-20220822"
"False","False","La publicité pour les énergies fossiles désormais interdite","https://www.lefigaro.fr/medias/la-publicite-pour-les-energies-fossiles-desormais-interdite-20220822"
"False","False","Un gouverneur américain en visite à Taïwan","https://www.lefigaro.fr/international/un-gouverneur-americain-en-visite-a-taiwan-20220822"
"False","False","Décès du rabbin Shalom Cohen, dirigeant spirituel du parti orthodoxe Shass","https://www.lefigaro.fr/flash-actu/deces-du-rabbin-shalom-cohen-dirigeant-spirituel-du-parti-orthodoxe-shass-20220822"
"False","False","Guerre en Ukraine : où en est le conflit six mois après le début de l'invasion russe ?","https://www.lefigaro.fr/international/guerre-en-ukraine-ou-en-est-on-six-mois-apres-l-invasion-russe-20220822"
"False","False","Doctolib accusé de promouvoir des médecines parallèles","https://www.lefigaro.fr/societes/doctolib-accuse-de-promouvoir-des-medecines-paralleles-20220822"
"False","False","Corée du Sud : la police localise une parente des enfants retrouvés morts dans des valises","https://www.lefigaro.fr/flash-actu/coree-du-sud-la-police-localise-une-parente-des-enfants-retrouves-morts-dans-des-valises-20220822"
"False","False","PSG : la combinaison géniale qui a permis à Mbappé de marquer après 8 secondes de jeu (vidéo)","https://www.lefigaro.fr/sports/football/ligue-1/psg-la-combinaison-geniale-qui-a-permis-a-mbappe-de-marquer-apres-8-secondes-de-jeu-video-20220822"
"False","False","Pour relancer la croissance, Pékin réduit à nouveau plusieurs taux","https://www.lefigaro.fr/conjoncture/pour-relancer-la-croissance-pekin-reduit-a-nouveau-plusieurs-taux-20220822"
"False","False","Début de manœuvres conjointes entre Washington et Séoul, les plus importantes depuis 2018","https://www.lefigaro.fr/international/debut-de-manoeuvres-conjointes-entre-washington-et-seoul-les-plus-importantes-depuis-2018-20220822"
"False","False","Mali : la junte désigne un ministre et colonel premier ministre par intérim","https://www.lefigaro.fr/flash-actu/mali-la-junte-designe-un-ministre-et-colonel-premier-ministre-par-interim-20220821"
"False","False","La SDJ de Paris Match vote une motion de défiance après le départ de Bruno Jeudy","https://www.lefigaro.fr/medias/la-sdj-de-paris-match-vote-une-motion-de-defiance-apres-le-depart-de-bruno-jeudy-20220821"
"False","False","Ligue 1 : l'impressionnante démonstration du Paris SG contre Lille","https://www.lefigaro.fr/sports/football/ligue-1/ligue-1-le-paris-sg-en-demonstration-contre-lille-20220821"
"False","False","Tennis : issue des qualifications, Caroline Garcia remporte le tournoi WTA 1000 de Cincinnati","https://www.lefigaro.fr/sports/tennis/tennis-issue-des-qualifications-caroline-garcia-remporte-le-tournoi-wta-1000-de-cincinnati-20220821"
"False","False","Nouveaux incendies en Egypte après un feu meurtrier dans une église","https://www.lefigaro.fr/flash-actu/nouveaux-incendies-en-egypte-apres-un-feu-meurtrier-dans-une-eglise-20220821"
"False","False","Orages meurtriers : le conseil exécutif de Corse appelle à tirer «d'indispensables leçons»","https://www.lefigaro.fr/actualite-france/orages-meurtriers-le-conseil-executif-de-corse-appelle-a-tirer-d-indispensables-lecons-20220821"
"False","False","Euro d'athlétisme : les Bleus du relais 4x100 m médaillés d'argent à Munich","https://www.lefigaro.fr/sports/athletisme/euro-d-athletisme-les-bleus-du-relais-4x100-m-medailles-d-argent-a-munich-20220821"
"False","False","Foot : Mbappé marque au bout de 9 secondes et frôle le record du but le plus rapide en Ligue 1","https://www.lefigaro.fr/sports/football/ligue-1/foot-mbappe-marque-au-bout-de-8-secondes-et-egale-le-record-du-but-le-plus-rapide-en-ligue-1-20220821"
"False","False","Immigration : Darmanin appelle à «lutter contre l'attractivité sociale» de Mayotte","https://www.lefigaro.fr/politique/immigration-darmanin-appelle-a-lutter-contre-l-attractivite-sociale-de-mayotte-20220821"
"False","False","Ligue 1 : record de cartons rouges lors de la troisième journée","https://www.lefigaro.fr/sports/football/ligue-1/ligue-1-record-de-cartons-rouges-lors-de-la-troisieme-journee-20220821"
"False","False","Darmanin révèle que 55 % des délinquants interpellés à Marseille sont étrangers","https://www.lefigaro.fr/politique/darmanin-revele-que-55-des-delinquants-interpelles-a-marseille-sont-etrangers-20220821"
"False","False","Centrale nucléaire en Ukraine : Biden, Macron, Scholz et Johnson appellent à la «retenue»","https://www.lefigaro.fr/international/centrale-nucleaire-en-ukraine-biden-macron-scholz-et-johnson-appellent-a-la-retenue-20220821"
"False","False","Les Émirats envoient un ambassadeur à Téhéran après six ans d'absence","https://www.lefigaro.fr/flash-actu/les-emirats-envoient-un-ambassadeur-a-teheran-apres-six-ans-d-absence-20220821"
