"premium","picture","title","url"
"False","True","Cinq cargos chargés de céréales au départ d’Ukraine aujourd'hui…","https://www.20minutes.fr/monde/3334723-20220807-guerre-ukraine-direct-cinq-nouveaux-cargos-charges-cereales-depart-ukraine-dimanche"
"False","True","Le chanteur Daniel Lévi est décédé à l’âge de 60 ans","https://www.20minutes.fr/arts-stars/culture/3334631-20220806-daniel-levi-star-comedie-musicale-dix-commandements-decede-age-60-ans"
"False","True","Gain de temps, de clarté ou de sécurité... Pourquoi revenir aux 90 km/h ?","https://www.20minutes.fr/societe/3333527-20220807-gain-temps-clarte-securite-pourquoi-revenir-90-kmh"
"False","True","Pourquoi la prise de position de Mélenchon sème la discorde au sein de la Nupes ?","https://www.20minutes.fr/politique/3334731-20220807-tensions-taiwan-prise-position-melenchon-seme-discorde-sein-nupes"
"False","True","La ville de Jérusalem visée par des tirs de roquette du Djihad islamique","https://www.20minutes.fr/monde/3334727-20220807-violences-gaza-ville-jerusalem-visee-tirs-roquette-djihad-islamique"
"False","True","Une assistante maternelle incarcérée après le décès d’un bébé « secoué »","https://www.20minutes.fr/faits_divers/3334639-20220806-loire-nourrice-incarceree-apres-deces-bebe-secoue"
"False","True","Au moins un mort et 17 disparus dans un incendie d’un dépôt pétrolier","https://www.20minutes.fr/monde/3334707-20220807-cuba-moins-mort-17-disparus-gigantesque-incendie-depot-petrolier"
"False","True","Visée par des frappes, la centrale nucléaire de Zaporijjia inquiète l’AIEA","https://www.20minutes.fr/monde/3334719-20220807-guerre-ukraine-visee-frappes-centrale-nucleaire-zaporijjia-inquiete-plus-plus-aiea"
"False","True","Guerre en Ukraine EN DIRECT : Cinq nouveaux cargos chargés de céréales au départ d’Ukraine ce dimanche…","https://www.20minutes.fr/monde/3334723-20220807-guerre-ukraine-direct-cinq-nouveaux-cargos-charges-cereales-depart-ukraine-dimanche"
"False","True","Visée par des frappes, la centrale nucléaire de Zaporijjia inquiète l’AIEA","https://www.20minutes.fr/monde/3334719-20220807-guerre-ukraine-visee-frappes-centrale-nucleaire-zaporijjia-inquiete-plus-plus-aiea"
"False","True","Guerre en Ukraine : Arrivée d’un premier cargo pour charger des céréales à Tchernomorsk","https://www.20minutes.fr/monde/3334551-20220806-guerre-ukraine-direct-hiroshima-antonio-guterres-alerte-risque-attaque-nucleaire"
"False","True","Rapprochement entre Erdogan et Poutine sur fond de guerre en Ukraine","https://www.20minutes.fr/monde/3334463-20220805-guerre-ukraine-erdogan-poutine-copains-comme-jamais-pendant-livraisons-cereales-poursuivent"
"False","True","La Russie propose un échange de prisonniers pour la basketteuse Griner","https://www.20minutes.fr/sport/3334303-20220805-russie-russie-souhaite-discuter-echange-prisonniers-basketteuse-americaine-brittney-griner"
"False","True","Avions et navires de guerre chinois s’approchent encore plus près de Taïwan","https://www.20minutes.fr/monde/3334215-20220805-taiwan-navires-guerre-chinois-franchi-ligne-mediane-separe-ile-chine"
"False","True","Le monde du sport demande la libération de Brittney Griner","https://www.20minutes.fr/monde/3334191-20220805-condamnation-brittney-griner-russie-freebg-monde-sport-demande-liberation-basketteuse"
"False","True","24 heures","https://www.20minutes.fr/diaporama/diaporama-15366-images-jonas-vingegaard-remporte-tour-france-incendies-fixes-gironde-kevin-mayer-nouveau-champion-monde-decathlon"
"False","True","« Bennifer » in Paris","https://www.20minutes.fr/diaporama/diaporama-15369-images-jennifer-lopez-ben-affleck-lune-miel-paris"
"False","True","Comment le moustique tigre s’est-il installé en France ?","https://www.20minutes.fr/podcast/3332531-20220804-animal-comment-moustique-tigre-installe-france"
"False","True","Pourquoi les moineaux ont-ils disparu de la ville ?","https://www.20minutes.fr/podcast/3331555-20220801-animal-pourquoi-moineaux-disparu-ville"
"False","True","Qui étaient les douze fées de la Planche des Belles Filles ?","https://www.20minutes.fr/podcast/3324471-20220730-mysteres-secret-douze-fees-planche-belles-filles"
"False","True","Un doublé de Messi, un Neymar génial, Paris impressionne en Auvergne","https://www.20minutes.fr/sport/3333019-20220806-clermont-psg-direct-paris-galtier-remet-titre-jeu-ca-commence-auvergne-suivez-ligue-1"
"False","True","Snickers s’excuse pour une publicité présentant Taïwan comme un « pays »","https://www.20minutes.fr/monde/3334715-20220807-taiwan-snickers-excuse-publicite-presentant-ile-comme-pays"
"False","True","Après des échanges de tirs meurtriers, Israël envisage « une semaine » de raids sur Gaza","https://www.20minutes.fr/monde/3334583-20220806-gaza-apres-echanges-tirs-meurtriers-israel-envisage-semaine-raids"
"False","True","Oui, le directeur de l’OMS est bel et bien vacciné contre le Covid-19","https://www.20minutes.fr/sante/3334271-20220806-covid-19-oui-directeur-oms-bel-bien-vaccine"
"False","True","Prudence en interprétant ces images satellites de la France en 2021 et 2022","https://www.20minutes.fr/planete/3334439-20220805-prudence-interpretant-images-satellites-comparent-france-entre-2021-2022"
"False","True","Non, un sanglier n’a pas dormi sur un matelas à Aubervilliers","https://www.20minutes.fr/societe/3334459-20220805-aubervilliers-non-sanglier-dormi-matelas-ville"
"False","True","Comment Curiosity a changé notre regard sur la planète Mars","https://www.20minutes.fr/sciences/3331027-20220806-comment-curiosity-revolutionne-connaissances-planete-mars"
"False","True","Un ex-pompier volontaire écroué pour incendies volontaires","https://www.20minutes.fr/societe/3334651-20220806-herault-ex-pompier-volontaire-ecroue-incendies-volontaires"
"False","True","Alassane Ouattara accorde la grâce présidentielle à son ancien rival Laurent Gbagbo","https://www.20minutes.fr/monde/3334711-20220807-cote-ivoire-alassane-ouattara-accorde-grace-presidentielle-ancien-rival-laurent-gbagbo"
"False","True","Biarritz surfe aussi sur la vague des NFT","https://www.20minutes.fr/20-mint/3333887-20220804-avant-faire-surfer-amoureux-bitcoin-biarritz-accueille-grand-messe-nft"
"False","True","Amateurs de crypto-monnaies, dévoilez-vous!","https://www.20minutes.fr/20-mint/3331783-20220729-cryptocheck-besoin-amateurs-cryptomonnaies-consentants-tirer-portrait"
"False","True","A Biarritz, le grand public a rendez-vous avec le bitcoin","https://www.20minutes.fr/20-mint/3325235-20220713-biarritz-grand-public-rendez-bitcoin-25-aout"
"False","True","Le chanteur Daniel Lévi est décédé à l’âge de 60 ans","https://www.20minutes.fr/arts-stars/culture/3334631-20220806-daniel-levi-star-comedie-musicale-dix-commandements-decede-age-60-ans"
"False","True","Visée par des frappes, la centrale nucléaire de Zaporijjia inquiète l’AIEA","https://www.20minutes.fr/monde/3334719-20220807-guerre-ukraine-visee-frappes-centrale-nucleaire-zaporijjia-inquiete-plus-plus-aiea"
"False","True","Prudence en interprétant ces images satellites de la France en 2021 et 2022","https://www.20minutes.fr/planete/3334439-20220805-prudence-interpretant-images-satellites-comparent-france-entre-2021-2022"
"False","True","Comment le général Zaloujny est devenu la nouvelle icône de l’Ukraine ?","https://www.20minutes.fr/monde/3334399-20220805-guerre-ukraine-general-zaloujny-chef-armee-ukrainienne-nouvelle-icone-resistance"
"False","True","L'actrice Anne Heche dans un état grave après un accident de voiture","https://www.20minutes.fr/arts-stars/people/3334559-20220806-los-angeles-actrice-americaine-anne-heche-etat-grave-apres-accident-voiture"
"False","True","Archie Battersbee, au coeur d'une bataille sur l'arrêt des soins, est mort","https://www.20minutes.fr/monde/3334587-20220806-jeune-britannique-coeur-bataille-judiciaire-arret-soins-mort"
"False","True","Guerre en Ukraine : Arrivée d’un premier cargo pour charger des céréales à…","https://www.20minutes.fr/monde/3334551-20220806-guerre-ukraine-direct-hiroshima-antonio-guterres-alerte-risque-attaque-nucleaire"
"False","True","Deux enfants percutés lors d’un rodéo urbain dans le Val-d’Oise","https://www.20minutes.fr/paris/3334619-20220806-val-oise-deux-enfants-grievement-blesses-apres-avoir-percutes-lors-rodeo-urbain-pontoise"
"False","True","Des « empreintes de pas fantômes » d'au moins 10.000 ans retrouvées en Utah","https://www.20minutes.fr/sciences/3333891-20220804-etats-unis-archeologues-decouvrent-empreintes-fantomes-moins-10000-ans"
"False","True","Alors que la récession menace, BoJo se la coule douce en Slovénie","https://www.20minutes.fr/monde/3334427-20220805-royaume-uni-boris-johnson-disparait-lune-miel-slovenie-pleine-menace-recession"
"False","True","Arrivée d’un premier cargo pour charger des céréales à Tchernomorsk","https://www.20minutes.fr/monde/3334551-20220806-guerre-ukraine-direct-hiroshima-antonio-guterres-alerte-risque-attaque-nucleaire"
"False","True","Elon Musk met au défi Twitter de prouver la part de faux comptes","https://www.20minutes.fr/high-tech/3334647-20220806-elon-musk-met-defi-twitter-prouver-part-faux-comptes"
"False","True","Pourquoi Pékin et Washington s'embrouillent-ils à propos de Taïwan ?","https://www.20minutes.fr/monde/3332979-20220802-pourquoi-pekin-washington-embrouillent-propos-taiwan"
"False","True","Deux enfants percutés lors d’un rodéo urbain à Pontoise","https://www.20minutes.fr/paris/3334619-20220806-val-oise-deux-enfants-grievement-blesses-apres-avoir-percutes-lors-rodeo-urbain-pontoise"
"False","True","Joe Biden a finalement été testé négatif au Covid-19","https://www.20minutes.fr/monde/3334635-20220806-covid-19-etats-unis-joe-biden-teste-negatif"
"False","True","Dans « Alerte aux astéroïdes », Arte se penche sur cette menace venue du ciel","https://www.20minutes.fr/arts-stars/television/3334595-20220806-alerte-asteroides-arte-penche-menace-programmes-lances-contrer"
"False","True","Le jeune Archie, maintenu en état de mort cérébrale, est décédé","https://www.20minutes.fr/monde/3334587-20220806-jeune-britannique-coeur-bataille-judiciaire-arret-soins-mort"
"False","True","Monaco a eu chaud, mais repart avec trois puntos dans la pocket","https://www.20minutes.fr/sport/3333011-20220806-rc-strasbourg-monaco-direct-monegasques-reprennent-fournaise-meinau-suivez-ligue-1"
