"premium","picture","title","url"
"False","True","CARTE. Guerre en Ukraine : pertes russes, explosions en Crimée… Le point au 167e jour","https://www.ouest-france.fr/monde/guerre-en-ukraine/carte-guerre-en-ukraine-pertes-russes-explosions-en-crimee-le-point-au-167e-jour-c94fcede-1800-11ed-b983-aa206fd41485"
"False","True","Gironde. L’incendie reprend à Landiras, 320 hectares brûlés","https://www.ouest-france.fr/faits-divers/incendie/gironde-l-incendie-reprend-a-landiras-320-hectares-brules-e2ac4e72-1808-11ed-b983-aa206fd41485"
"True","True","Béluga dans la Seine. L'opération d'extraction a débuté","https://www.ouest-france.fr/normandie/ouistreham-14150/beluga-dans-la-seine-l-operation-d-extraction-a-debute-9d4decc8-5c6c-47d7-9513-85b1d4a07d67"
"False","True","Vague de chaleur. Températures, durée… À quoi faut-il s’attendre pour cette fin de semaine ?","https://www.ouest-france.fr/meteo/canicule/vague-de-chaleur-temperatures-duree-a-quoi-faut-il-s-attendre-pour-cette-fin-de-semaine-6c7ef94e-17e4-11ed-b983-aa206fd41485"
"False","True","Biélorussie. Svetlana Tikhanovskaïa : « Soutenir l’Ukraine et protéger l’indépendance biélorusse »","https://www.ouest-france.fr/europe/bielorussie/bielorussie-svetlana-tikhanovskaia-soutenir-l-ukraine-et-proteger-l-independance-bielorusse-83b9aca0-1729-11ed-9e7d-f63aa2d492e8"
"False","True","Trafic de drogue : neuf membres présumés du réseau « Caliweed » mis en examen à Paris","https://www.ouest-france.fr/societe/drogue/trafic-de-drogue-neuf-membres-presumes-du-reseau-caliweed-mis-en-examen-a-paris-69c8e9b0-180e-11ed-92be-d940840fee51"
"False","True","VIDEO. Un deuxième incendie important s’est déclaré à Beaulieu-sur-Layon, dans le Maine-et-Loire","https://www.ouest-france.fr/pays-de-la-loire/beaulieu-sur-layon-49750/un-deuxieme-incendie-important-s-est-declare-a-beaulieu-sur-layon-dans-le-maine-et-loire-6520ae94-17f4-11ed-92be-d940840fee51"
"False","True","République dominicaine. Deux mineurs sauvés après avoir passé 10 jours coincés sous terre","https://www.ouest-france.fr/monde/republique-dominicaine/republique-dominicaine-sauvetage-de-deux-mineurs-prisonniers-sous-terre-depuis-10-jours-97de5d24-1815-11ed-92be-d940840fee51"
"False","False","Caraboo, fausse princesse d’un royaume exotique, était née en Angleterre","https://www.ouest-france.fr/leditiondusoir/2022-08-09/caraboo-fausse-princesse-d-un-royaume-exotique-etait-nee-en-angleterre-9f2c141f-380b-4aea-a273-d86a3d9ed029"
"True","False","Avec le réchauffement climatique, la venue de la Patrouille de France fait polémique à Perros-Guirec","https://www.ouest-france.fr/bretagne/perros-guirec-22700/perros-guirec-avec-le-rechauffement-climatique-la-venue-de-la-patrouille-de-france-fait-polemique-cb4a7366-17dc-11ed-b983-aa206fd41485"
"False","False","Les allergies dues aux pollens d’ambroisie vont arriver plus tôt à cause des fortes chaleurs","https://www.ouest-france.fr/sante/les-allergies-dues-aux-pollens-d-ambroisie-vont-arriver-plus-tot-a-cause-des-fortes-chaleurs-dc826e4a-17cd-11ed-92be-d940840fee51"
"False","False","Tennis. Serena Williams prendra sa retraite avant la fin de l’année","https://www.ouest-france.fr/sport/tennis/serena-williams/tennis-serena-williams-prendra-sa-retraite-avant-la-fin-de-l-annee-5c39e73e-17e8-11ed-92be-d940840fee51"
"False","False","Ils refusent de rembourser leurs prêts immobiliers, le système financier chinois va-t-il vaciller ?","https://www.ouest-france.fr/leditiondusoir/2022-08-09/ils-refusent-de-rembourser-leurs-emprunts-immobiliers-le-systeme-financier-chinois-va-t-il-vaciller-46f6c809-5c22-4bfd-ac15-c266963abe37"
"False","False","DIRECT. Mercato : Ronaldo, OM, Sanchez, PSG, Rabiot… Infos et rumeurs transferts du mardi 9 août","https://www.ouest-france.fr/sport/football/transferts/direct-mercato-ronaldo-om-sanchez-psg-rabiot-infos-et-rumeurs-transferts-du-mardi-9-aout-15051188-1755-11ed-9e7d-f63aa2d492e8"
"False","True","EN IMAGES. Triple départ de feu à Rostrenen : « De l’inquiétude et de la fatigue »","https://www.ouest-france.fr/bretagne/rostrenen-22110/en-images-triple-depart-de-feu-a-rostrenen-de-l-inquietude-et-de-la-fatigue-21daf0cc-1812-11ed-92be-d940840fee51"
"False","True","Qu’est-ce que ce « double jet-stream » qui serait responsable de la canicule en France ?","https://www.ouest-france.fr/leditiondusoir/2022-08-09/qu-est-ce-que-ce-double-jet-stream-qui-serait-responsable-de-la-canicule-en-france-c8a77a28-085c-4e6d-a9bd-0fade646b78c"
"False","True","Aveyron, Maine-et-Loire, Gironde… Le point sur les incendies ce mardi soir","https://www.ouest-france.fr/faits-divers/incendie/aveyron-maine-et-loire-charente-le-point-sur-les-incendies-ce-mardi-en-fin-de-journee-eff0e082-17ec-11ed-92be-d940840fee51"
"False","True","La sécheresse s’est aggravée en juillet : voici trois éléments qui le montrent","https://www.ouest-france.fr/meteo/secheresse/la-secheresse-s-est-aggravee-en-juillet-voici-trois-elements-qui-le-montrent-ee1a80c0-172d-11ed-9e7d-f63aa2d492e8"
"False","True","Des restrictions de consommation d’eau bientôt annoncées à Londres, sur fond de chaleur persistante","https://www.ouest-france.fr/meteo/canicule/des-restrictions-de-consommation-d-eau-bientot-annoncees-a-londres-sur-fond-de-chaleur-persistante-75b125c2-17f4-11ed-b983-aa206fd41485"
"False","True","POINT DE VUE. Au principe, une énergie créatrice ?","https://www.ouest-france.fr/reflexion/point-de-vue/point-de-vue-au-principe-une-energie-creatrice-0f5c7300-1626-11ed-8b48-075434dfb49e"
"False","True","Caraboo, fausse princesse d’un royaume exotique, était née en Angleterre","https://www.ouest-france.fr/leditiondusoir/2022-08-09/caraboo-fausse-princesse-d-un-royaume-exotique-etait-nee-en-angleterre-9f2c141f-380b-4aea-a273-d86a3d9ed029"
"True","True","À Brest, des cafards dans une résidence universitaire","https://www.ouest-france.fr/bretagne/brest-29200/a-brest-des-cafards-dans-une-residence-universitaire-e17bab94-17e3-11ed-b983-aa206fd41485"
"False","True","Vannes. Trafic SNCF interrompu après le décès d’un homme en gare","https://www.ouest-france.fr/bretagne/morbihan/vannes-trafic-sncf-interrompu-apres-un-accident-de-personne-en-gare-ab2cdbdc-1804-11ed-92be-d940840fee51"
"True","True","Près de Brest, le château se dégonfle sur son fils, elle porte plainte contre le parc d’attractions","https://www.ouest-france.fr/bretagne/milizac-29290/milizac-le-chateau-se-degonfle-sur-son-fils-elle-porte-plainte-contre-le-parc-d-attractions-1feaab62-17f0-11ed-92be-d940840fee51"
"False","True","À La Trinité-Sur-Mer, le biopic de Florence Arthaud recherche des figurants","https://www.ouest-france.fr/bretagne/auray-56400/a-la-trinite-sur-mer-le-biopic-de-florence-arthaud-recherche-des-figurants-43b56ca8-17fa-11ed-92be-d940840fee51"
"False","True","Après l’accident, le trafic des trains entre Paris et la Normandie coupé, une reprise vers 16 h","https://www.ouest-france.fr/normandie/suite-a-un-accident-aucun-train-entre-paris-et-la-normandie-avant-midi-ce-mardi-9-aout-e4d268c2-17bc-11ed-92be-d940840fee51"
"False","True","Béluga dans la Seine. Une opération « hors du commun » pour l’extraire de l’eau dès ce soir","https://www.ouest-france.fr/normandie/eure/beluga-dans-la-seine-une-operation-hors-du-commun-pour-l-extraire-de-l-eau-26529eb2-17c6-11ed-92be-d940840fee51"
"True","True","Béluga dans la Seine. L'opération d'extraction a débuté","https://www.ouest-france.fr/normandie/ouistreham-14150/beluga-dans-la-seine-l-operation-d-extraction-a-debute-9d4decc8-5c6c-47d7-9513-85b1d4a07d67"
"False","True","Béluga dans la Seine. L’animal doit être transporté par camion à Ouistreham, dans le Calvados","https://www.ouest-france.fr/normandie/ouistreham-14150/beluga-dans-la-seine-l-animal-doit-etre-transporte-par-camion-a-ouistreham-dans-le-calvados-f0e02a08-17fa-11ed-b983-aa206fd41485"
"False","True","Incendie dans le Maine-et-Loire. Un 2e avion porteur d’eau attendu, 600 ha de forêt brûlés","https://www.ouest-france.fr/pays-de-la-loire/bauge-en-anjou-49150/600-ha-de-foret-brules-a-bauge-en-anjou-un-avion-porteur-d-eau-doit-a-nouveau-intervenir-bfed69c6-17b2-11ed-92be-d940840fee51"
"False","True","Incendies en forêt près d’Angers : l’odeur du bois brûlé et un voile sombre enveloppent Nantes","https://www.ouest-france.fr/pays-de-la-loire/nantes-44000/incendies-pres-d-angers-les-odeurs-de-fumees-ressenties-jusqu-a-nantes-37974554-17c8-11ed-92be-d940840fee51"
"False","True","L’incendie en Anjou se voit même depuis l’espace, et se sent jusqu’à Nantes","https://www.ouest-france.fr/pays-de-la-loire/bauge-en-anjou-49150/l-incendie-en-anjou-se-voit-meme-depuis-l-espace-et-se-sent-jusqu-a-nantes-ae250c04-17d9-11ed-92be-d940840fee51"
"False","True","Les vacanciers réclament d’être remboursés, une émeute éclate au camping La Dive, en Vendée","https://www.ouest-france.fr/pays-de-la-loire/vendee/saint-michel-en-l-herm-une-emeute-eclate-au-camping-la-dive-88d64ca6-1739-11ed-9e7d-f63aa2d492e8"
"False","True","CARTE. Guerre en Ukraine : pertes russes, explosions en Crimée… Le point au 167e jour","https://www.ouest-france.fr/monde/guerre-en-ukraine/carte-guerre-en-ukraine-pertes-russes-explosions-en-crimee-le-point-au-167e-jour-c94fcede-1800-11ed-b983-aa206fd41485"
"False","True","Biélorussie. Svetlana Tikhanovskaïa : « Soutenir l’Ukraine et protéger l’indépendance biélorusse »","https://www.ouest-france.fr/europe/bielorussie/bielorussie-svetlana-tikhanovskaia-soutenir-l-ukraine-et-proteger-l-independance-bielorusse-83b9aca0-1729-11ed-9e7d-f63aa2d492e8"
"False","True","Les lieux touristiques dépendant du ministère des Armées restent bel et bien ouverts aux Russes","https://www.ouest-france.fr/monde/guerre-en-ukraine/les-lieux-touristiques-dependant-du-ministere-des-armees-restent-bel-et-bien-ouverts-aux-russes-01f13a8e-17de-11ed-b983-aa206fd41485"
"False","True","Guerre en Ukraine. Près de 80 000 soldats russes ont été tués ou blessés, estime le Pentagone","https://www.ouest-france.fr/monde/guerre-en-ukraine/guerre-en-ukraine-pres-de-80-000-soldats-russes-ont-ete-tues-ou-blesses-estime-le-pentagone-6c10584a-17b2-11ed-b983-aa206fd41485"
"False","True","Guerre en Ukraine. Centrale thermique endommagée, réduction du gaz russe… Le point sur la nuit","https://www.ouest-france.fr/monde/guerre-en-ukraine/guerre-en-ukraine-centrale-thermique-endommagee-reduction-du-gaz-russe-le-point-sur-la-nuit-90312217-59a8-4a93-8d73-09a12301986f"
"False","True","Toulouse. Elle quitte son appartement en laissant ses trois chats enfermés, deux d’entre eux meurent","https://www.ouest-france.fr/region-occitanie/toulouse-31000/toulouse-elle-quitte-son-appartement-en-laissant-ses-trois-chats-enfermes-deux-d-entre-eux-meurent-7886023"
"False","False","Pour éviter de se faire piquer par les méduses, il a créé un site qui les localise en temps réel","https://www.ouest-france.fr/societe/pour-eviter-de-se-faire-piquer-par-les-meduses-il-a-cree-un-site-qui-les-localise-en-temps-reel-7885980"
"False","False","VIDÉO. Incendie entre Lozère et Aveyron : 700 hectares brûlés, 3 000 personnes évacuées","https://www.ouest-france.fr/faits-divers/incendie/video-incendie-entre-lozere-et-aveyron-700-hectares-brules-3-000-personnes-evacuees-a3c843e9-3ce5-4216-8a8d-c9e81bbfdf04"
"False","True","Variole du singe. Des pharmacies vont expérimenter la vaccination dès mercredi dans trois régions","https://www.ouest-france.fr/sante/virus/variole-du-singe/variole-du-singe-des-pharmacies-vont-experimenter-la-vaccination-des-mercredi-dans-trois-regions-2d0becba-17b0-11ed-92be-d940840fee51"
"False","False","Quel temps est prévu à Toulon et ses environs le mardi 9 août 2022 ?","https://www.ouest-france.fr/meteo/provence-alpes-cote-dazur/toulon-83000/la-meteo-du-jour-a-toulon-eddee0d9-d360-52d5-8d51-f0c21ed3f7c1"
"False","False","Canicule : la Gironde et le Lot-et-Garonne placés en vigilance orange en plus du Gard et du Vaucluse","https://www.ouest-france.fr/meteo/canicule/canicule-la-gironde-et-le-lot-et-garonne-places-en-vigilance-orange-en-plus-du-gard-et-du-vaucluse-9e2794fe-1723-11ed-aab2-44eac6f1bc7c"
"False","True","Trafic de drogue : neuf membres présumés du réseau « Caliweed » mis en examen à Paris","https://www.ouest-france.fr/societe/drogue/trafic-de-drogue-neuf-membres-presumes-du-reseau-caliweed-mis-en-examen-a-paris-69c8e9b0-180e-11ed-92be-d940840fee51"
"False","False","Val-d’Oise. Un garçon de 4 ans transporté en urgence absolue à l’hôpital après un début de noyade","https://www.ouest-france.fr/ile-de-france/neuville-sur-oise-95000/val-d-oise-un-garcon-de-4-ans-transporte-en-urgence-absolue-a-l-hopital-apres-un-debut-de-noyade-7886012"
"False","False","Hauts-de-Seine. Soupçonné de deux viols dans un hôpital, un homme est recherché","https://www.ouest-france.fr/faits-divers/violence-sexuelle/viol/hauts-de-seine-soupconne-de-deux-viols-dans-un-hopital-un-homme-est-recherche-422f47a6-17ef-11ed-92be-d940840fee51"
"False","True","Trafic de drogue : neuf membres présumés du réseau « Caliweed » mis en examen à Paris","https://www.ouest-france.fr/societe/drogue/trafic-de-drogue-neuf-membres-presumes-du-reseau-caliweed-mis-en-examen-a-paris-69c8e9b0-180e-11ed-92be-d940840fee51"
"False","False","Femme enceinte tuée à Montargis. Le mari et sa deuxième compagne écroués","https://www.ouest-france.fr/societe/faits-divers/femme-enceinte-tuee-a-montargis-le-mari-et-sa-deuxieme-compagne-ecroues-7cb57f44-17d6-11ed-b983-aa206fd41485"
"False","False","Cher. Suspectées d’avoir empoisonné un homme, trois personnes placées en détention provisoire","https://www.ouest-france.fr/centre-val-de-loire/bourges-18000/cher-suspectees-d-avoir-empoisonne-un-homme-trois-personnes-placees-en-detention-provisoire-7885733"
