"premium","picture","title","url"
"False","True","Droit d’accès aux origines : un long chemin vers la transparence","https://www.ouest-france.fr/societe/famille/pma/droit-d-acces-aux-origines-un-long-chemin-vers-la-transparence-ac1cea50-2821-11ed-bbec-a21aa6a31a60"
"False","True","Miss France. Sylvie Tellier quitte la direction du concours, elle est remplacée par Cindy Fabre","https://www.ouest-france.fr/culture/people/miss-france/miss-france-sylvie-tellier-quitte-la-direction-du-concours-elle-est-remplacee-par-cindy-fabre-0cdcad38-2900-11ed-91eb-30a470f7d627"
"True","True","RÉCIT. Attentat du 14-Juillet à Nice: 86 morts, des centaines de blessés en 4 minutes et 17 secondes","https://www.ouest-france.fr/societe/faits-divers/attentat-nice/recit-attentat-du-14-juillet-a-nice-86-morts-des-centaines-de-blesses-en-4-minutes-et-17-secondes-d48199e4-2229-11ed-a185-6588d059195b"
"False","True","L’ancien président soviétique Mikhaïl Gorbatchev, homme du dégel Est-Ouest, est mort","https://www.ouest-france.fr/europe/russie/l-ancien-president-sovietique-mikhail-gorbatchev-homme-du-degel-est-ouest-est-mort-05f1a66c-bf03-11eb-a219-8f747c6d3d1b"
"False","True","Le russe Gazprom suspendra « complètement » ses livraisons de gaz au groupe français Engie dès jeudi","https://www.ouest-france.fr/economie/energie/le-russe-gazprom-suspendra-completement-ses-livraisons-de-gaz-au-groupe-francais-engie-des-jeudi-0ee35ba6-2895-11ed-9759-37dc7c5c3542"
"False","True","Présidence du RN : Jordan Bardella officialise sa candidature pour succéder à Marine Le Pen","https://www.ouest-france.fr/politique/jordan-bardella/presidence-du-rn-jordan-bardella-officialise-sa-candidature-pour-succeder-a-marine-le-pen-251fb76a-2904-11ed-91eb-30a470f7d627"
"False","True","L’inflation ralentit à 5,8 % sur un an en août, estime l’Insee","https://www.ouest-france.fr/economie/l-inflation-ralentit-a-5-8-sur-un-an-en-aout-estime-l-insee-33f2f976-28f2-11ed-91eb-30a470f7d627"
"False","True","L’imam Hassan Iquioussen, qui doit être expulsé, toujours introuvable ce mercredi","https://www.ouest-france.fr/societe/fuite-de-l-imam-hassan-iquioussen-dont-le-conseil-d-etat-a-valide-l-expulsion-vers-le-maroc-f9d63faa-8394-4511-a47d-7e6c6a9f1d34"
"False","False","Mort de Mikhaïl Gorbatchev. Biden, Poutine, Macron… Des réactions partout dans le monde","https://www.ouest-france.fr/europe/mort-de-mikhail-gorbatchev-dirigeant-de-confiance-qui-a-change-le-cours-de-l-histoire-c113a7f9-54fe-447a-ad67-7c85ae724c3c"
"False","False","STORY. Pourquoi Lady Di fascine-t-elle encore, 25 ans après sa mort dans un tragique accident ?","https://www.ouest-france.fr/europe/royaume-uni/story-pourquoi-lady-di-fascine-t-elle-encore-25-ans-apres-sa-mort-dans-un-tragique-accident-54c77966-2793-11ed-9284-3601a04f61d4"
"True","False","TÉMOIGNAGE. « Il a été jeté en pâture » : le meilleur ami du chauffeur de Lady Di défend sa mémoire","https://www.ouest-france.fr/europe/royaume-uni/temoignage-il-a-ete-jete-en-pature-le-meilleur-ami-du-chauffeur-de-lady-di-defend-sa-memoire-da49cd8c-254a-11ed-96b6-4a906a77d0cc"
"False","False","Météo. Un épisode méditerranéen est annoncé pour ce week-end : à quoi faut-il s’attendre ?​","https://www.ouest-france.fr/meteo/meteo-un-episode-mediterraneen-est-attendu-pour-ce-week-end-a-quoi-faut-il-s-attendre-ae04cc00-284b-11ed-9759-37dc7c5c3542"
"False","False","La mort de Gorbatchev survient au moment où « la démocratie a échoué en Russie », dit Olaf Scholz","https://www.ouest-france.fr/europe/allemagne/olaf-scholz/la-mort-de-gorbatchev-survient-au-moment-ou-la-democratie-a-echoue-en-russie-dit-olaf-scholz-1594505c-2900-11ed-91eb-30a470f7d627"
"False","True","Avec la forte inflation actuelle, où placer son épargne pour la faire fructifier au mieux ?","https://www.francelive.fr/article/france-live/avec-la-forte-inflation-actuelle-ou-placer-son-epargne-pour-la-faire-fructifier-au-mieux-7562924/"
"False","True","Les livraisons de gaz russe vers l’Europe via le gazoduc Nord Stream de nouveau stoppées","https://www.ouest-france.fr/economie/energie/gaz-naturel/les-livraisons-de-gaz-russe-vers-l-europe-via-le-gazoduc-nord-stream-de-nouveau-stoppees-6cac68ee-28eb-11ed-91eb-30a470f7d627"
"False","True","Grand séminaire de rentrée pour le gouvernement ce mercredi, autour de l'énergie et du climat","https://www.ouest-france.fr/politique/macron-mobilise-le-gouvernement-face-aux-casse-tete-de-la-rentree-08736912-7073-4c3c-b390-8cbe95648c6b"
"False","True","Le russe Gazprom suspendra « complètement » ses livraisons de gaz au groupe français Engie dès jeudi","https://www.ouest-france.fr/economie/energie/le-russe-gazprom-suspendra-completement-ses-livraisons-de-gaz-au-groupe-francais-engie-des-jeudi-0ee35ba6-2895-11ed-9759-37dc7c5c3542"
"False","True","« On ne va pas couper le gaz chez les ménages français en cas de pénurie », assure Élisabeth Borne","https://www.ouest-france.fr/economie/energie/gaz-les-menages-seront-ils-concernes-par-d-eventuelles-coupures-non-assure-elisabeth-borne-bd60856e-2890-11ed-9759-37dc7c5c3542"
"False","True","Guerre en Ukraine. L’AIEA rencontre Zelensky à Kiev, combats à Kherson… Le point au 188e jour","https://www.ouest-france.fr/monde/guerre-en-ukraine/guerre-en-ukraine-l-aiea-rencontre-zelensky-a-kiev-combats-a-kherson-le-point-au-188e-jour-9fe25d86-287d-11ed-aeed-4db6457d6e49"
"True","True","POINT DE VUE. Précarité alimentaire : « Le pire est à venir »","https://www.ouest-france.fr/societe/alimentatio/point-de-vue-precarite-alimentaire-le-pire-est-a-venir-176462c0-289a-11ed-9759-37dc7c5c3542"
"False","True","Dix astuces pour aider les enfants qui ont peur de la rentrée","https://www.ouest-france.fr/leditiondusoir/2022-08-26/dix-astuces-pour-aider-les-enfants-qui-ont-peur-de-la-rentree-1805429b-1eb4-4136-ad88-cef55e860ac5"
"True","True","Saint-Pierre-Quiberon. Un sexagénaire fait un malaise sur la plage, un important dispositif déployé","https://www.ouest-france.fr/bretagne/morbihan/saint-pierre-quiberon-un-sexagenaire-fait-un-malaise-sur-la-plage-un-important-dispositif-deploye-4b8867f4-2895-11ed-9759-37dc7c5c3542"
"False","True","Mort d’un ado près de Rennes. Le beau-père mis en examen pour meurtre conteste","https://www.ouest-france.fr/bretagne/mort-d-un-ado-pres-de-rennes-le-beau-pere-mis-en-examen-pour-meurtre-conteste-20edcc2e-2885-11ed-9759-37dc7c5c3542"
"True","True","Space à Rennes. Quatre bonnes raisons d’aller au salon international de l’élevage","https://www.ouest-france.fr/economie/agriculture/space/space-a-rennes-quatre-bonnes-raisons-d-aller-au-salon-international-de-l-elevage-a0795066-285e-11ed-aeed-4db6457d6e49"
"True","True","TÉMOIGNAGE. « Il a été jeté en pâture » : le meilleur ami du chauffeur de Lady Di défend sa mémoire","https://www.ouest-france.fr/europe/royaume-uni/temoignage-il-a-ete-jete-en-pature-le-meilleur-ami-du-chauffeur-de-lady-di-defend-sa-memoire-da49cd8c-254a-11ed-96b6-4a906a77d0cc"
"True","True","Cherbourg-en-Cotentin lance sa mutuelle municipale pour tous, sans conditions de revenus ni d’âge","https://www.ouest-france.fr/normandie/cherbourg-en-cotentin-50100/cherbourg-en-cotentin-lance-sa-mutuelle-municipale-pour-tous-sans-conditions-de-revenus-ni-d-age-9ecccd00-2887-11ed-9759-37dc7c5c3542"
"False","True","Miss France. Sylvie Tellier quitte la direction du concours, elle est remplacée par Cindy Fabre","https://www.ouest-france.fr/culture/people/miss-france/miss-france-sylvie-tellier-quitte-la-direction-du-concours-elle-est-remplacee-par-cindy-fabre-0cdcad38-2900-11ed-91eb-30a470f7d627"
"False","True","Barrages, manque d’eau… Ce qu’il faut savoir sur la sécheresse historique qui sévit dans la Manche","https://www.ouest-france.fr/normandie/avranches-50300/barrages-manque-d-eau-ce-qu-il-faut-savoir-sur-la-secheresse-historique-qui-sevit-dans-la-manche-671ffd10-279b-11ed-9284-3601a04f61d4"
"True","True","INFO OUEST-FRANCE. Enlèvement de Mathis à Caen : son père demande la révision de sa condamnation","https://www.ouest-france.fr/normandie/caen-14000/info-ouest-france-enlevement-de-mathis-a-caen-son-pere-demande-la-revision-de-sa-condamnation-d27ad598-285f-11ed-9759-37dc7c5c3542"
"True","True","Le ministre de l’Écologie Christophe Béchu va-t-il imprimer sa marque ?","https://www.ouest-france.fr/politique/christophe-bechu/le-ministre-de-l-ecologie-christophe-bechu-va-t-il-imprimer-sa-marque-49b55a6c-2620-11ed-9d6f-e4e04df431ef"
"False","True","DIRECT. Solitaire du Figaro (2e étape) : Tom Laperche se fait reprendre","https://www.ouest-france.fr/sport/voile/direct-solitaire-du-figaro-positions-et-classements-en-temps-reel-74b36646-1ef5-11ed-87e6-ec5e03fce8f7"
"False","True","Fraude. 20 000 piscines n’ont pas été déclarées aux impôts, voici comment elles ont été traquées","https://www.ouest-france.fr/economie/impots-fiscalite/taxe-fonciere-20-000-piscines-n-avaient-pas-ete-declarees-comment-elles-ont-ete-traquees-dfefea5a-285b-11ed-9759-37dc7c5c3542"
"True","True","La Flèche. Nouveau chef de corps du Prytanée, Hervé de Solages veut « faire grandir » les élèves","https://www.ouest-france.fr/pays-de-la-loire/la-fleche-72200/la-fleche-nouveau-chef-de-corps-du-prytanee-herve-de-solages-veut-faire-grandir-les-eleves-0e86c3f2-279e-11ed-b25d-f776a3f367e3"
"False","True","La mort de Gorbatchev survient au moment où « la démocratie a échoué en Russie », dit Olaf Scholz","https://www.ouest-france.fr/europe/allemagne/olaf-scholz/la-mort-de-gorbatchev-survient-au-moment-ou-la-democratie-a-echoue-en-russie-dit-olaf-scholz-1594505c-2900-11ed-91eb-30a470f7d627"
"False","True","Guerre en Ukraine. Combats dans le Sud, centrale de Zaporijjia… Le point sur la nuit","https://www.ouest-france.fr/monde/guerre-en-ukraine/guerre-en-ukraine-combats-dans-le-sud-centrale-de-zaporijia-le-point-sur-la-nuit-a14a9f62-b620-456c-a690-fa1a750f7b36"
"False","True","Guerre en Ukraine: l'UE divisée sur des restrictions de voyages pour les Russes","https://www.ouest-france.fr/monde/guerre-en-ukraine/guerre-en-ukraine-l-ue-divisee-sur-des-restrictions-de-voyages-pour-les-russes-849deabe-cf73-40df-a6d9-e19595796207"
"False","True","Le russe Gazprom suspendra « complètement » ses livraisons de gaz au groupe français Engie dès jeudi","https://www.ouest-france.fr/economie/energie/le-russe-gazprom-suspendra-completement-ses-livraisons-de-gaz-au-groupe-francais-engie-des-jeudi-0ee35ba6-2895-11ed-9759-37dc7c5c3542"
"False","True","« On ne va pas couper le gaz chez les ménages français en cas de pénurie », assure Élisabeth Borne","https://www.ouest-france.fr/economie/energie/gaz-les-menages-seront-ils-concernes-par-d-eventuelles-coupures-non-assure-elisabeth-borne-bd60856e-2890-11ed-9759-37dc7c5c3542"
"False","True","Narbonne. Deux corps en décomposition découverts dans un appartement","https://www.ouest-france.fr/region-occitanie/narbonne-11100/narbonne-deux-corps-en-decomposition-decouverts-dans-un-appartement-7906170"
"False","False","Il roulait ivre, sans permis et avec un bébé dans sa voiture, un automobiliste interpellé dans le Tarn","https://www.ouest-france.fr/region-occitanie/castres-81100/il-roulait-ivre-sans-permis-et-avec-un-bebe-dans-sa-voiture-un-automobiliste-interpelle-dans-le-tarn-7906059"
"False","False","Vélos, échelles, pneus… L’impressionnante cargaison d’un véhicule intercepté par les gendarmes sur l'A9","https://www.ouest-france.fr/region-occitanie/herault/velos-echelles-pneus-l-impressionnante-cargaison-d-un-vehicule-intercepte-par-les-gendarmes-sur-l-a9-7906020"
"False","True","Quel temps fera-t-il à Toulon et ses environs le mercredi 31 août 2022 ?","https://www.ouest-france.fr/meteo/provence-alpes-cote-dazur/toulon-83000/la-meteo-du-jour-a-toulon-8d0d5cab-9501-53fa-aa28-1a3c6e4eb36b"
"False","False","Nice. Il avait frappé sa femme en pleine rue et menacé de mort des témoins, un homme condamné","https://www.ouest-france.fr/provence-alpes-cote-dazur/nice-06000/nice-il-avait-frappe-sa-femme-en-pleine-rue-et-menace-de-mort-des-temoins-un-homme-condamne-7906253"
"False","False","La municipalité d’Antibes crée la polémique en décidant de vidanger les bassins de sa piscine municipale","https://www.ouest-france.fr/provence-alpes-cote-dazur/antibes-06600/antibes-la-municipalite-cree-la-polemique-en-decidant-de-vidanger-les-bassins-de-sa-piscine-7906104"
"True","True","RÉCIT. Attentat du 14-Juillet à Nice: 86 morts, des centaines de blessés en 4 minutes et 17 secondes","https://www.ouest-france.fr/societe/faits-divers/attentat-nice/recit-attentat-du-14-juillet-a-nice-86-morts-des-centaines-de-blesses-en-4-minutes-et-17-secondes-d48199e4-2229-11ed-a185-6588d059195b"
"False","False","Les prévisions météorologiques du mercredi 31 août 2022 à Paris et ses environs","https://www.ouest-france.fr/meteo/ile-de-france/paris-75000/la-meteo-du-jour-a-paris-39950cb7-d65b-5e0c-8803-d5d634b7e9b6"
"False","False","Maria Adela Kuhfeldt Rivera, fausse bijoutière mais vraie espionne qui a infiltré l’Otan","https://www.ouest-france.fr/leditiondusoir/2022-08-30/maria-adela-kuhfeldt-rivera-fausse-bijoutiere-mais-vraie-espionne-qui-a-infiltre-l-otan-43b3e945-221b-4fe2-8d5b-900ab51431d7"
"True","True","Pontivy. En recherche de location, Valérie et ses 4 enfants vivent au camping depuis quatre mois","https://www.ouest-france.fr/bretagne/pontivy-56300/pontivy-en-recherche-de-location-elle-vit-au-camping-depuis-quatre-mois-ea5b745e-287f-11ed-9759-37dc7c5c3542"
"False","False","Sur la route des ruines de France : l’éphémère destin du château de La Ferté-Vidame","https://www.ouest-france.fr/leditiondusoir/2022-08-30/sur-la-route-des-ruines-de-france-l-ephemere-destin-du-chateau-de-la-ferte-vidame-4d88e2ea-cec1-4e59-9001-ec2b8ba8c2f9"
"False","False","Plus de 300 élèves du Centre-Val de Loire pourraient être privés de ramassage scolaire à la rentrée","https://www.ouest-france.fr/centre-val-de-loire/indre-et-loire/plus-de-300-eleves-du-centre-val-de-loire-pourraient-etre-prives-de-ramassage-scolaire-a-la-rentree-7906301"
