"premium","picture","title","url"
"True","True","Ukraine : les quatre erreurs fatales de Poutine","https://www.mediapart.fr/journal/international/280322/ukraine-les-quatre-erreurs-fatales-de-poutine"
"True","False","« Pourquoi la Russie a déjà perdu cette guerre »","https://www.mediapart.fr/journal/international/280322/chroniques-de-kyiv-11-volodymyr-yermolenko-pourquoi-la-russie-deja-perdu-cette-guerre"
"True","True","En Picardie, une famille divisée entre Zemmour et Le Pen","https://www.mediapart.fr/journal/france/280322/en-picardie-une-famille-divisee-entre-zemmour-et-le-pen"
"True","False","Cinq ans après Fillon, l’extrême « droite Trocadéro » vient applaudir Zemmour","https://www.mediapart.fr/journal/france/270322/cinq-ans-apres-fillon-l-extreme-droite-trocadero-vient-applaudir-zemmour"
"True","False","À Marseille, Mélenchon fait vibrer la corde sociale","https://www.mediapart.fr/journal/france/270322/marseille-jean-luc-melenchon-fait-vibrer-la-corde-sociale"
"True","False","Au meeting de Jadot, ses soutiens défendent un « vote de conviction »","https://www.mediapart.fr/journal/france/270322/au-meeting-de-yannick-jadot-ses-soutiens-defendent-un-vote-de-conviction"
"True","False","Une élue LR de la région Grand Est bientôt jugée pour prise illégale d’intérêts","https://www.mediapart.fr/journal/france/280322/une-elue-lr-de-la-region-grand-est-bientot-jugee-pour-prise-illegale-d-interets"
"True","True","Battre la campagne","https://www.mediapart.fr/studio/portfolios/battre-la-campagne"
"True","True","La « planification » fait un retour en force, au service de programmes antagoniques","https://www.mediapart.fr/journal/france/280322/la-planification-fait-un-retour-en-force-au-service-de-programmes-antagoniques"
"True","False","Grand âge : les promesses pleuvent, le courage manque pour les financer","https://www.mediapart.fr/journal/france/270322/grand-age-les-promesses-pleuvent-le-courage-manque-pour-les-financer"
"True","False","Prisons : les candidats s’engagent sur cinq ans ferme","https://www.mediapart.fr/journal/france/260322/prisons-les-candidats-s-engagent-sur-cinq-ans-ferme"
"True","False","L’élevage industriel, révélateur des clivages en matière d’écologie","https://www.mediapart.fr/journal/economie/250322/l-elevage-industriel-revelateur-des-clivages-en-matiere-d-ecologie"
"True","True","En Algérie, la résistance d’un peuple « livré à lui-même » face au Covid-19","https://www.mediapart.fr/journal/international/280322/en-algerie-la-resistance-d-un-peuple-livre-lui-meme-face-au-covid-19"
"True","True","En Russie, les journalistes sur le front de l’information","https://www.mediapart.fr/journal/international/270322/en-russie-les-journalistes-sur-le-front-de-l-information"
"True","False","Le brief du 27 mars : Kyiv craint une séparation à la coréenne","https://www.mediapart.fr/journal/international/270322/le-brief-ukraine-du-27-mars-kyiv-craint-une-separation-la-coreenne"
"True","False","Edward : « Ils ne mettront pas un pied dans notre ville »","https://www.mediapart.fr/journal/international/270322/edward-kyiv-ils-ne-mettront-pas-un-pied-dans-notre-ville"
"True","False","150 Français participent au conflit","https://www.mediapart.fr/journal/international/260322/150-francais-participent-la-guerre-en-ukraine"
"True","True","L’imam Bassam Ayachi, jugé dans une affaire de terrorisme, renseignait les services secrets","https://www.mediapart.fr/journal/international/270322/l-imam-bassam-ayachi-juge-dans-une-affaire-de-terrorisme-renseignait-les-services-secrets"
"True","False","13-Novembre : « On a beaucoup parlé de l’horreur, pourquoi ne pas la montrer ? »","https://www.mediapart.fr/journal/france/270322/christophe-naudin-beaucoup-parle-de-l-horreur-pourquoi-ne-pas-la-montrer"
"True","True","À Steenvoorde, les paysans flamands sont percutés jusque dans leur vote par la guerre en Ukraine","https://www.mediapart.fr/journal/france/260322/steenvoorde-les-paysans-flamands-sont-percutes-jusque-dans-leur-vote-par-la-guerre-en-ukraine"
"True","False","Des militants de Reconquête lèvent le voile sur les dérives autoritaires et radicales du parti","https://www.mediapart.fr/journal/france/260322/des-militants-de-reconquete-levent-le-voile-sur-les-derives-autoritaires-et-radicales-du-parti"
"True","True","Scandale des pensionnats : les autochtones canadiens attendent des excuses de l’Église","https://www.mediapart.fr/journal/international/270322/scandale-des-pensionnats-les-autochtones-canadiens-attendent-des-excuses-de-l-eglise-catholique"
"True","False","Mali : la dérive autoritaire du régime des putschistes","https://www.mediapart.fr/journal/international/260322/mali-la-derive-autoritaire-du-regime-des-putschistes"
"True","False","Numérique : les chercheurs du principal institut public se dressent contre leur patron « startupeur »","https://www.mediapart.fr/journal/france/260322/numerique-les-chercheurs-du-principal-institut-public-se-dressent-contre-leur-patron-startupeur"
"True","True","Autour des expositions « Pionnières », « Morozov » et « Charles Ray »","https://www.mediapart.fr/journal/culture-idees/270322/l-esprit-critique-autour-des-expositions-pionnieres-morozov-et-charles-ray"
"True","True","Extrait de « Media Crash » : comment Hanouna a fait la campagne de Zemmour","https://www.mediapart.fr/journal/france/280322/extrait-de-media-crash-comment-hanouna-fait-la-campagne-de-zemmour"
"True","True","Usul. Pas de débat, pas de mandat ?","https://www.mediapart.fr/journal/france/210322/usul-pas-de-debat-pas-de-mandat"
"True","True","Cabinets de conseil : « On veut transformer l'administration sans elle, contre elle »","https://www.mediapart.fr/journal/france/240322/cabinets-de-conseil-veut-transformer-ladministration-sans-elle-contre-elle"
"True","True","Lutte contre le « séparatisme » : ultimes manœuvres de l’exécutif et feu « d’artifices »","https://www.mediapart.fr/journal/france/260322/lutte-contre-le-separatisme-ultimes-manoeuvres-de-l-executif-et-feu-d-artifices"
"True","False","Le gouvernement veut dissoudre un groupe antifasciste lyonnais","https://www.mediapart.fr/journal/france/260322/le-gouvernement-veut-dissoudre-un-groupe-antifasciste-lyonnais"
"True","False","À Paris, une grève pour le climat entre colère et solidarité internationaliste","https://www.mediapart.fr/journal/france/260322/paris-une-greve-pour-le-climat-entre-colere-et-solidarite-internationaliste"
"True","False","« Liberté, égalité, fraternité, ça n’a plus de sens pour nous »","https://www.mediapart.fr/journal/france/250322/liberte-egalite-fraternite-ca-n-plus-de-sens-pour-nous"
"True","False","Conditionner le RSA à une activité ? « Il faudrait que Macron vive la pauvreté pour savoir ce que c’est »","https://www.mediapart.fr/journal/france/230322/conditionner-le-rsa-une-activite-il-faudrait-que-macron-vive-la-pauvrete-pour-savoir-ce-que-c-est"
"True","True","Droits et devoirs : la rupture Macron","https://www.mediapart.fr/journal/france/250322/droits-et-devoirs-la-rupture-macron"
"True","False","Yannick Jadot : « Macron, c’est la République confisquée par les lobbies »","https://www.mediapart.fr/journal/france/250322/yannick-jadot-macron-c-est-la-republique-confisquee-par-les-lobbies"
"True","False","À Angers, la démocratie chrétienne se rapproche du vote Macron","https://www.mediapart.fr/journal/france/240322/angers-la-democratie-chretienne-se-rapproche-du-vote-macron"
"True","False","Le vrai-faux sérieux budgétaire de Marine Le Pen","https://www.mediapart.fr/journal/france/240322/le-vrai-faux-serieux-budgetaire-de-marine-le-pen"
"True","False","Lutte ouvrière tient sa ligne, en attendant la révolution","https://www.mediapart.fr/journal/france/240322/lutte-ouvriere-tient-sa-ligne-en-attendant-la-revolution"
"True","True","2017-2022 : le bilan Macron au scanner de Mediapart","https://www.mediapart.fr/studio/panoramique/2017-2022-le-bilan-macron-au-scanner-de-mediapart"
"True","True","Les quatre questions que l’on ne voudrait plus se poser","https://www.mediapart.fr/journal/france/250322/covid-les-quatre-questions-que-l-ne-voudrait-plus-se-poser"
"True","False","L’Afrique du Sud, réservoir à variants préoccupants ?","https://www.mediapart.fr/journal/international/250322/l-afrique-du-sud-reservoir-variants-preoccupants"
"True","True","Contre le chômage, Emmanuel Macron a arraché une victoire, à tout prix","https://www.mediapart.fr/journal/economie/260322/contre-le-chomage-emmanuel-macron-arrache-une-victoire-tout-prix"
"True","False","La Samaritaine visée par une plainte pour « complicité de harcèlement moral au travail »","https://www.mediapart.fr/journal/economie/240322/la-samaritaine-visee-par-une-plainte-pour-complicite-de-harcelement-moral-au-travail"
"True","False","Yves Rocher poursuivi pour non-respect des droits syndicaux en Turquie","https://www.mediapart.fr/journal/economie/240322/yves-rocher-poursuivi-pour-non-respect-des-droits-syndicaux-en-turquie"
"True","False","En Ouganda, « Total viole les droits humains et environnementaux »","https://www.mediapart.fr/journal/international/240322/en-ouganda-total-viole-les-droits-humains-et-environnementaux"
"True","True","À Clermont, la justice a échoué à protéger Isabelle, gravement blessée par son ex","https://www.mediapart.fr/journal/france/250322/clermont-la-justice-n-pas-protege-isabelle-gravement-blessee-par-son-ex"
"True","False","« La société reflétée par les médias n’est pas du tout paritaire »","https://www.mediapart.fr/journal/france/250322/la-societe-refletee-par-les-medias-n-est-pas-du-tout-paritaire"
"True","False","Au procès du député Simian, le parquet blâme une « attitude déplorable »","https://www.mediapart.fr/journal/france/250322/au-proces-du-depute-simian-le-parquet-blame-une-attitude-deplorable"
"True","True","Assassinat d’Aramburu : la fascination pour les armes des deux suspects arrêtés","https://www.mediapart.fr/journal/france/230322/assassinat-d-aramburu-au-coeur-de-l-enquete-des-militants-d-extreme-droite-fascines-par-les-armes"
"True","False","Le très curieux rendement offert par une banque publique aux riches investisseurs","https://www.mediapart.fr/journal/economie/240322/le-tres-curieux-rendement-offert-par-une-banque-publique-aux-riches-investisseurs"
