"premium","picture","title","url"
"False","True","Covid-19 : port du masque, pass sanitaire... Voici les règles qui ne s'appliquent plus à partir de ce lundi","https://mobile.francetvinfo.fr/sante/maladie/coronavirus/pass-vaccinal/covid-19-port-du-masque-pass-sanitaire-voici-les-regles-qui-ne-s-appliquent-plus-a-partir-de-lundi_5006611.html"
"False","True","TÉMOIGNAGES. Covid-19 : en réunion, par précaution... ils expliquent pourquoi ils vont garder le masque malgré la levée de l'obligation","https://mobile.francetvinfo.fr/sante/maladie/coronavirus/masques-sanitaires/covid-19-en-reunion-par-precaution-ils-expliquent-pourquoi-ils-vont-garder-le-masque-malgre-la-levee-de-l-obligation_5006856.html"
"False","True","Levée des restrictions : Arnaud Fontanet appelle à ""protéger les plus fragiles"" en prévision d'un pic de ""100 000 à 150 000"" cas par jour fin mars","https://mobile.francetvinfo.fr/sante/maladie/coronavirus/masques-sanitaires/levee-des-restrictions-arnaud-fontanet-appelle-a-proteger-les-plus-fragiles-en-prevision-d-un-pic-de-100-000-a-150-000-cas-par-jour-fin-mars_5007171.html"
"False","True","Covid-19 : le professeur Bruno Mégarbane appelle à ""rester vigilant"", malgré la levée des restrictions","https://mobile.francetvinfo.fr/sante/maladie/coronavirus/vaccin/covid-19-le-professeur-bruno-megarbane-appelle-a-rester-vigilant-malgre-la-levee-des-restrictions_5006421.html"
"False","True","DIRECT. Guerre en Ukraine : un immeuble bombardé à Kiev alors que les pourparlers doivent reprendre lundi matin","https://mobile.francetvinfo.fr/monde/europe/manifestations-en-ukraine/direct-guerre-les-pourparlers-entre-responsables-russes-et-ukrainiens-reprennent-lundi-matin_5007101.html"
"False","True","Présidentielle : cinq candidats présentent leurs solutions pour le climat sur la plateforme Twitch","https://mobile.francetvinfo.fr/elections/presidentielle/presidentielle-cinq-candidats-presentent-leurs-solutions-pour-le-climat-sur-la-plateforme-twitch_5007111.html"
"False","True","Corse : Gérald Darmanin se rendra sur l'île mercredi et jeudi","https://mobile.francetvinfo.fr/politique/affaire/agression-d-yvan-colonna-en-prison/corse-gerald-darmanin-sur-l-ile-mercredi-et-jeudi-pour-ouvrir-un-cycle-de-discussions-avec-les-elus_5007126.html"
"False","True","Mali : l'otage français Olivier Dubois apparaît vivant dans une vidéo non-authentifiée","https://mobile.francetvinfo.fr/monde/afrique/mali/mali-un-possible-signe-de-vie-de-l-otage-francais-olivier-dubois_5007106.html"
"False","True","Hausse des prix des carburants : trois questions sur la remise de 15 centimes par litre annoncée par le gouvernement","https://mobile.francetvinfo.fr/economie/automobile/essence/hausse-des-prix-des-carburants-trois-questions-sur-la-remise-de-15-centimes-par-litre-annoncee-par-le-gouvernement_5006781.html"
"False","True","Cinéma : l'acteur américain William Hurt, oscarisé pour ""Le Baiser de la femme araignée"", est mort à l'âge de 71 ans","https://mobile.francetvinfo.fr/culture/cinema/cinema-l-acteur-americain-william-hurt-oscarise-pour-le-baiser-de-la-femme-araignee-est-mort-a-l-age-de-71-ans_5007166.html"
"False","True","Guerre en Ukraine : les écoliers du pays invités à reprendre les cours, à distance, pour garder une vie ""quasi normale""","https://mobile.francetvinfo.fr/monde/europe/manifestations-en-ukraine/guerre-en-ukraine-les-ecoliers-du-pays-invites-a-reprendre-les-cours-a-distance-pour-garder-une-vie-quasi-normale_5006786.html"
"False","True","Guerre en Ukraine : selon le ""New York Times"", Moscou a demandé une aide militaire et économique à la Chine, Pékin dément","https://mobile.francetvinfo.fr/monde/europe/manifestations-en-ukraine/guerre-en-ukraine-selon-le-new-york-times-moscou-a-demande-une-aide-militaire-et-economique-a-la-chine-pekin-dement_5007186.html"
"False","True","L'article à lire pour comprendre pourquoi le ""grand remplacement"" est une idée raciste et complotiste","https://mobile.francetvinfo.fr/elections/presidentielle/l-article-a-lire-pour-comprendre-pourquoi-le-grand-remplacement-est-une-idee-raciste-et-complotiste_4965228.html"
"False","True","REPORTAGE. ""Il y avait des explosions énormes et j'ai bien cru que c'était la fin"" : dans l'enfer d'Irpin sous les bombes","https://mobile.francetvinfo.fr/monde/europe/manifestations-en-ukraine/reportage-il-y-avait-des-explosions-enormes-et-j-ai-bien-cru-que-c-etait-la-fin-dans-l-enfer-d-irpin-sous-les-bombes_5007136.html"
"False","True","TÉMOIGNAGE. Guerre en Ukraine : l'appel à l'aide d'un Français dont la famille est bloquée près de Tchernobyl","https://mobile.francetvinfo.fr/monde/europe/manifestations-en-ukraine/guerre-en-ukraine-l-appel-a-l-aide-d-un-francais-dont-la-famille-est-bloquee-pres-de-tchernobyl_5006826.html"
"False","True","NFL : la légende Tom Brady sort de sa retraite et jouera la prochaine saison avec Tampa Bay","https://mobile.francetvinfo.fr/sports/nfl/nfl-la-legende-tom-brady-sort-de-sa-retraite-et-jouera-la-prochaine-saison-avec-tampa-bay_5007116.html"
"False","True","Le XV de France peut rêver grand, Fillon Maillet ne s'arrête plus, les stars du PSG huées par leur public... Ce qu'il faut retenir du week-end de sport","https://mobile.francetvinfo.fr/sports/le-xv-de-france-peut-rever-grand-fillon-maillet-ne-s-arrete-plus-les-stars-du-psg-huees-par-leur-public-ce-qu-il-faut-retenir-du-week-end-de-sport_5006806.html"
"False","True","Brest-Marseille : l'OM s'impose largement en Bretagne et s'accroche au podium","https://mobile.francetvinfo.fr/sports/foot/ligue-1/direct-brest-marseille-l-om-va-t-il-se-relancer-suivez-le-dernier-match-de-la-28e-journee-de-ligue-1_5005641.html"
"False","True","Guerre en Ukraine : la détresse des faubourgs de Kiev, encerclés par les Russes","https://mobile.francetvinfo.fr/monde/europe/manifestations-en-ukraine/guerre-en-ukraine-la-detresse-des-faubourgs-de-kiev-encercles-par-les-russes_5006821.html"
"False","True","Présidentielle 2022 : Exemplarité des élus, santé, salaires... Voici les 12 priorités des Français, selon une consultation citoyenne","https://mobile.francetvinfo.fr/elections/presidentielle/presidentielle-2022-exemplarite-des-elus-sante-salaires-voici-les-12-priorites-des-francais-selon-une-consultation-citoyenne_5006666.html"
"False","True","Guerre en Ukraine : ""Il y a un risque énorme à travailler sur le terrain"", souligne Reporters sans frontières après la mort d'un journaliste américain","https://mobile.francetvinfo.fr/monde/europe/manifestations-en-ukraine/guerre-en-ukraine-il-y-a-un-risque-enorme-a-travailler-sur-le-terrain-souligne-reporters-sans-frontieres-apres-la-mort-d-un-journaliste-americain_5006776.html"
"False","True","Présidentielle 2022 : qu'attendent les jeunes des candidats aux élections ?","https://mobile.francetvinfo.fr/elections/presidentielle/presidentielle-2022-qu-attendent-les-jeunes-des-candidats-aux-elections_5006901.html"
"False","True","Lyon-Rennes : les Bretons infligent une correction à l'OL et reprennent la troisième place de Ligue 1","https://mobile.francetvinfo.fr/sports/foot/ligue-1/lyon-rennes-les-bretons-infligent-une-correction-a-l-ol-et-reprennent-la-troisieme-place-de-ligue-1_5006791.html"
"False","True","Paralympiques 2022 : la Chine au sommet, le statu quo français, la légende McKeever, l'Ukraine brille en ski nordique... Le bilan des Jeux de Pékin","https://mobile.francetvinfo.fr/jeux-paralympiques/biathlon/paralympiques-2022-la-chine-au-sommet-le-statu-quo-francais-la-legende-mckeever-l-ukraine-brille-en-ski-nordique-le-bilan-des-jeux-de-pekin_5006471.html"
"False","True","Pastilles d'iode, abris anti-atomiques... La France est-elle prête en cas de crise nucléaire majeure ?","https://mobile.francetvinfo.fr/monde/europe/manifestations-en-ukraine/pastilles-d-iode-abris-anti-atomiques-la-france-est-elle-prete-en-cas-de-crise-nucleaire-majeure_5003150.html"
"False","True","Au premier meeting d'Emmanuel Macron, les militants font sans lui : ""A l'église, les gens ne voient pas Jésus, mais ils y vont""","https://mobile.francetvinfo.fr/elections/presidentielle/au-premier-meeting-d-emmanuel-macron-les-miliitants-font-sans-lui-a-l-eglise-les-gens-ne-voient-pas-jesus-mais-ils-y-vont_5006416.html"
"False","True","REPORTAGE. ""Nous sommes ici parce qu'il y a un abri"" : à Kiev, le zoo devenu un refuge pour les soigneurs et leurs familles","https://mobile.francetvinfo.fr/monde/europe/manifestations-en-ukraine/reportage-nous-sommes-ici-parce-qu-il-y-a-un-abri-a-kiev-le-zoo-devenu-un-refuge-pour-les-soigneurs-et-leurs-familles_5004956.html"
"False","True","Protoxyde d'azote : le gaz hilarant attire toujours plus de jeunes et fait les affaires des réseaux criminels","https://mobile.francetvinfo.fr/societe/drogue/protoxyde-d-azote-le-gaz-hilarant-attire-toujours-plus-de-jeunes-et-fait-les-affaires-des-reseaux-criminels_5006651.html"
"False","True","Huit évènements à ne pas manquer dans le programme du Festival international de la bande dessinée d'Angoulême 2022","https://mobile.francetvinfo.fr/culture/bd/festival-de-bd-d-angouleme/huit-evenements-a-ne-pas-manquer-dans-le-programme-du-festival-international-de-la-bande-dessinee-d-angouleme-2022_5003126.html"
"False","True","Roselyne Bachelot annonce un fonds d'un million d'euros pour les artistes ukrainiens et ""russes dissidents""","https://mobile.francetvinfo.fr/monde/europe/manifestations-en-ukraine/roselyne-bachelot-annonce-un-fonds-d-un-million-d-euros-pour-les-artistes-ukrainiens-et-russes-dissidents_5006446.html"
"False","True","Dans l'Aisne, une borne de recharge gratuite pour les véhicules électriques de la commune","https://mobile.francetvinfo.fr/france/ilsontlasolution/dans-l-aisne-une-borne-de-recharge-gratuite-pour-les-vehicules-electriques-de-la-commune_5003264.html"
"False","True","Dans un restaurant de la Drôme, des robots-serveurs donnent un coup de main aux employés","https://mobile.francetvinfo.fr/france/ilsontlasolution/dans-un-restaurant-de-la-drome-des-robots-serveurs-donnent-un-coup-de-main-aux-employes_5003120.html"
"False","True","Vrai ou Fake : les expatriés africains qui fuient l'Ukraine sont-ils traités différemment des autres réfugiés ?","https://mobile.francetvinfo.fr/monde/europe/manifestations-en-ukraine/vrai-ou-fake-les-expatries-africains-qui-fuient-l-ukraine-sont-ils-traites-differemment-des-autres-refugies_5000457.html"
"False","True","À Lyon, un scanner haute résolution pour améliorer le diagnostic des patients","https://mobile.francetvinfo.fr/sante/cancer/a-lyon-un-scanner-haute-resolution-pour-ameliorer-le-diagnostic-des-patients_4999791.html"
"False","True","Dans le Cotentin, un train à 1 euro pour limiter la circulation automobile","https://mobile.francetvinfo.fr/france/ilsontlasolution/dans-le-cotentin-un-train-a-1-euro-pour-limiter-la-circulation-automobile_4999833.html"
"False","True","""Portraits du cœur"", une journée mise en beauté et séance photo pour booster l'estime de soi","https://mobile.francetvinfo.fr/france/ilsontlasolution/portraits-du-coeur-une-journee-mise-en-beaute-et-seance-photo-pour-booster-l-estime-de-soi_4997847.html"
"False","True","À Rochefort, on donne un prix aux arbres pour mieux les protéger","https://mobile.francetvinfo.fr/monde/environnement/a-rochefort-on-donne-un-prix-aux-arbres-pour-mieux-les-proteger_4997949.html"
"False","True","À Quimper, des toits de commerces produisent une énergie verte et locale","https://mobile.francetvinfo.fr/france/ilsontlasolution/a-quimper-des-toits-de-commerces-produisent-une-energie-verte-et-locale_4998291.html"
"False","True","En Alsace, un stage de body-karaté pour parer aux violences physiques et morales","https://mobile.francetvinfo.fr/france/ilsontlasolution/en-alsace-un-stage-de-body-karate-pour-parer-aux-violences-physiques-et-morales_4997781.html"
"False","True","Des paniers de légumes moches à petit prix pour lutter contre le gaspillage alimentaire","https://mobile.francetvinfo.fr/france/ilsontlasolution/des-paniers-de-legumes-moches-pour-lutter-contre-le-gaspillage-alimentaire_4990640.html"
"False","True","Une combinaison pour mieux comprendre les besoins des personnes en situation d'obésité","https://mobile.francetvinfo.fr/france/ilsontlasolution/une-combinaison-pour-mieux-comprendre-les-besoins-des-personnes-en-situation-d-obesite_4995870.html"
"False","True","Guerre en Ukraine : des étudiants dijonnais lancent un QR code pour faciliter les dons","https://mobile.francetvinfo.fr/economie/emploi/carriere/entreprendre/aides/guerre-en-ukraine-des-etudiants-dijonnais-lancent-un-qr-code-pour-faciliter-les-dons_4995531.html"
"False","True","Au PS, la réflexion sur l'après-présidentielle est engagée","https://mobile.francetvinfo.fr/replay-radio/le-brief-politique/au-ps-la-reflexion-sur-l-apres-presidentielle-est-engagee_4985532.html"
"False","False","Présidentielle : cinq candidats présentent leurs solutions pour le climat sur la plateforme Twitch","https://mobile.francetvinfo.fr/elections/presidentielle/presidentielle-cinq-candidats-presentent-leurs-solutions-pour-le-climat-sur-la-plateforme-twitch_5007111.html"
"False","False","Présidentielle 2022 : qu'attendent les jeunes des candidats aux élections ?","https://mobile.francetvinfo.fr/elections/presidentielle/presidentielle-2022-qu-attendent-les-jeunes-des-candidats-aux-elections_5006901.html"
"False","False","Présidentielle 2022 : le prix du carburant au cœur des propositions des candidats","https://mobile.francetvinfo.fr/economie/automobile/essence/presidentielle-2022-le-prix-du-carburant-au-coeur-des-propositions-des-candidats_5006916.html"
"False","False","Présidentielle 2022 : Exemplarité des élus, santé, salaires... Voici les 12 priorités des Français, selon une consultation citoyenne","https://mobile.francetvinfo.fr/elections/presidentielle/presidentielle-2022-exemplarite-des-elus-sante-salaires-voici-les-12-priorites-des-francais-selon-une-consultation-citoyenne_5006666.html"
"False","True","Covid-19 : port du masque, pass sanitaire... Voici les règles qui ne s'appliquent plus à partir de ce lundi","https://mobile.francetvinfo.fr/sante/maladie/coronavirus/pass-vaccinal/covid-19-port-du-masque-pass-sanitaire-voici-les-regles-qui-ne-s-appliquent-plus-a-partir-de-lundi_5006611.html"
"False","True","""Il y avait des explosions énormes et j'ai bien cru que c'était la fin"" : dans l'enfer d'Irpin sous les bombes","https://mobile.francetvinfo.fr/monde/europe/manifestations-en-ukraine/reportage-il-y-avait-des-explosions-enormes-et-j-ai-bien-cru-que-c-etait-la-fin-dans-l-enfer-d-irpin-sous-les-bombes_5007136.html"
"False","True","Pastilles d'iode, abris anti-atomiques... La France est-elle prête en cas de crise nucléaire majeure ?","https://mobile.francetvinfo.fr/monde/europe/manifestations-en-ukraine/pastilles-d-iode-abris-anti-atomiques-la-france-est-elle-prete-en-cas-de-crise-nucleaire-majeure_5003150.html"
