"premium","picture","title","url"
"False","True","Prise d’otages en cours dans la Vienne : quatre personnes retenues, le GIGN sur place","https://www.ouest-france.fr/societe/faits-divers/prise-dotages-en-cours-dans-la-vienne-quatre-personnes-retenues-le-gign-sur-place-996bba98-e2a3-11ed-814e-527b887752e5"
"False","True","Carburants : le prix du gazole est au plus bas depuis début 2023, l’essence également en baisse","https://www.ouest-france.fr/economie/transports/carburants-essence-diesel/carburants-le-prix-du-gazole-est-au-plus-bas-depuis-debut-2023-lessence-egalement-en-baisse-40b17e10-e280-11ed-814e-527b887752e5"
"False","True","Nouveau déplacement pour Emmanuel Macron, il sera mardi dans le Loir-et-Cher","https://www.ouest-france.fr/politique/emmanuel-macron/nouveau-deplacement-pour-emmanuel-macron-il-sera-mardi-dans-le-loir-et-cher-52db2458-e2a1-11ed-814e-527b887752e5"
"True","True","Ruiné, le fondateur d’une réserve privée vend ses 2 200 rhinocéros aux enchères en Afrique du Sud","https://www.ouest-france.fr/monde/afrique-du-sud/afrique-du-sud-il-vend-ses-2-200-rhinoceros-aux-encheres-6889962a-e280-11ed-b514-8dd13d8be671"
"False","True","VIDEO. Stopover, les coulisses de The Ocean Race (4/8) : pas si reposantes, les vacances au Brésil","https://www.ouest-france.fr/sport/voile/volvo-ocean-race/video-stopover-les-coulisses-de-the-ocean-race-4-8-pas-si-reposantes-les-vacances-au-bresil-3198d204-e297-11ed-b514-8dd13d8be671"
"False","True","« Un si grand soleil ». Résumés en avance des épisodes du 24 au 28 avril 2023","https://programmetv.ouest-france.fr/feuilleton/policier/un-si-grand-soleil-m136353979/un-si-grand-soleil-resumes-en-avance-des-episodes-du-24-au-28-avril-2023-55815154-e289-11ed-b514-8dd13d8be671"
"False","True","Deux militants d’extrême droite de retour d’Ukraine arrêtés à Paris avec du matériel militaire","https://www.ouest-france.fr/europe/ukraine/deux-militants-dextreme-droite-de-retour-dukraine-arretes-a-paris-avec-du-materiel-militaire-1b5babf6-e29c-11ed-b514-8dd13d8be671"
"True","True","Homicide en boîte de nuit près d’Angers : « Rien ne laissait présager que ça finirait comme ça »","https://www.ouest-france.fr/pays-de-la-loire/angers-49000/homicide-en-boite-de-nuit-pres-dangers-rien-ne-laissait-presager-que-ca-finirait-comme-ca-f07e7ad4-e292-11ed-b514-8dd13d8be671"
"False","False","Éolien en mer : où en est vraiment la France ?","https://www.ouest-france.fr/economie/energie/energie-eolienne/eolien-en-mer-ou-en-est-vraiment-la-france-5de5e0e8-e294-11ed-b514-8dd13d8be671"
"False","False","Réforme des retraites : poursuivi par des manifestants, ce député veut porter plainte","https://www.ouest-france.fr/economie/retraites/reforme-des-retraites-poursuivi-par-des-manifestants-ce-depute-veut-porter-plainte-b7f26094-e298-11ed-b514-8dd13d8be671"
"False","False","Guerre en Ukraine : le patron de Wagner, Evguéni Prigojine, ordonne de ne plus faire de prisonniers","https://www.ouest-france.fr/europe/ukraine/guerre-en-ukraine-le-patron-de-wagner-evgueni-prigojine-ordonne-de-ne-plus-faire-de-prisonniers-4be587c0-e287-11ed-b514-8dd13d8be671"
"False","False","Soudan. La France ferme son ambassade à Khartoum, qui n’est « plus un point de regroupement »","https://www.ouest-france.fr/monde/soudan/soudan-la-france-ferme-son-ambassade-qui-nest-plus-un-point-de-regroupement-6b93c8e2-e292-11ed-b514-8dd13d8be671"
"False","False","Lilas, anémone, tulipes : voici comment composer un magnifique bouquet de printemps étape par étape","https://www.ouest-france.fr/le-mag/jardin/lilas-anemone-tulipes-voici-comment-composer-un-magnifique-bouquet-de-printemps-etape-par-etape-7a66316a-dabe-11ed-b1ec-c97a4aa9228c"
"False","False","Déclaration d’impôts : voici ce qu’il faut déduire de vos revenus","https://www.ouest-france.fr/economie/impots-fiscalite/impots/declaration-dimpots-voici-ce-quil-faut-deduire-de-vos-revenus-bf9aa3e6-de6b-11ed-8876-51122d90141b"
"False","True","Réforme des retraites : poursuivi par des manifestants, ce député veut porter plainte","https://www.ouest-france.fr/economie/retraites/reforme-des-retraites-poursuivi-par-des-manifestants-ce-depute-veut-porter-plainte-b7f26094-e298-11ed-b514-8dd13d8be671"
"False","True","Le dessin de Chaunu : Emmanuel Macron a été réélu il y a un an","https://www.ouest-france.fr/medias/ouest-france/chaunu/le-dessin-de-chaunu-emmanuel-macron-a-ete-reelu-il-y-a-un-an-421e82a6-e204-11ed-a413-0a476515e57d"
"False","True","Réforme des retraites. Quatre choses à savoir sur ces casseroles qui font du bruit","https://www.ouest-france.fr/economie/retraites/reforme-des-retraites-quatre-choses-a-savoir-sur-ces-casseroles-qui-font-du-bruit-ffb91dd2-e1ee-11ed-87f3-f6e218170d12"
"False","True","EN IMAGES. La première année du deuxième quinquennat d’Emmanuel Macron résumée en dix photos","https://www.ouest-france.fr/politique/emmanuel-macron/en-images-la-premiere-annee-du-deuxieme-quinquennat-demmanuel-macron-resumee-en-dix-photos-87dc0700-e1c3-11ed-908e-9b680907ca67"
"True","True","ENTRETIEN. Sophie Binet, à la tête de la CGT: « On peut perdre des batailles sans perdre la guerre »","https://www.ouest-france.fr/economie/syndicats/cgt/sophie-binet/entretien-sophie-binet-on-nest-pas-dans-la-logique-du-grand-soir-2f5015fa-e041-11ed-926f-b54c0e75f85a"
"False","True","POINT DE VUE. La politique étrangère d’Emmanuel Macron : où est la ligne ?","https://www.ouest-france.fr/reflexion/point-de-vue/point-de-vue-la-politique-etrangere-demmanuel-macron-ou-est-la-ligne-802f75e0-e124-11ed-ac2b-5fe553293d95"
"False","True","Envie d’ailleurs ? Voici dix destinations dépaysantes où la vie est moins chère","https://www.ouest-france.fr/leditiondusoir/2023-04-21/envie-d-ailleurs-voici-dix-destinations-depaysantes-ou-la-vie-est-moins-chere-dde6f967-2b1b-40a3-b3a6-76339766b829"
"False","True","VIDEO. Stopover, les coulisses de The Ocean Race (4/8) : pas si reposantes, les vacances au Brésil","https://www.ouest-france.fr/sport/voile/volvo-ocean-race/video-stopover-les-coulisses-de-the-ocean-race-4-8-pas-si-reposantes-les-vacances-au-bresil-3198d204-e297-11ed-b514-8dd13d8be671"
"True","True","Pourquoi l’utilisation de sang d’huîtres pourrait réduire l’usage d’antibiotiques en aquaculture","https://www.ouest-france.fr/mer/peche/aquaculture-pourquoi-lutilisation-de-sang-dhuitres-pourrait-reduire-lusage-dantibiotiques-bd6c229a-dd1a-11ed-b05e-feb93315b60b"
"False","True","Un homme porté disparu dans les Côtes-d’Armor, la gendarmerie lance un avis de recherche","https://www.ouest-france.fr/faits-divers/disparition/un-homme-porte-disparu-a-pledran-la-gendarmerie-des-cotes-darmor-lance-un-avis-de-recherche-d70e943e-e27a-11ed-b514-8dd13d8be671"
"False","True","Quels sont vos plus beaux souvenirs d’été en Finistère ? Votre témoignage nous intéresse","https://www.ouest-france.fr/bretagne/finistere/quels-sont-vos-plus-beaux-souvenirs-dete-en-finistere-f19268da-dfa0-11ed-903a-9f7cc194f75b"
"False","True","Normandie. Pourquoi beaucoup de noms de communes finissent par «-ville » ? On vous répond","https://www.ouest-france.fr/normandie/normandie-pourquoi-beaucoup-de-noms-de-communes-finissent-par-ville-on-vous-repond-952bc6b8-df82-11ed-84ca-8427bd315c16"
"False","True","VIDEO. Dans le Calvados, un cracher de bigorneaux pour financer les actions de la SNSM","https://www.ouest-france.fr/insolite/video-dans-le-calvados-un-cracher-de-bigorneaux-pour-financer-les-actions-de-la-snsm-0651fee7-4abb-496c-a1a9-8166ad62154b"
"False","True","Un incendie se déclare dans un appartement à Cherbourg : le voisin sort les deux occupants","https://www.ouest-france.fr/faits-divers/incendie/a-cherbourg-un-incendie-se-declare-au-rez-de-chaussee-dun-immeuble-de-cinq-etages-18afb376-e1ec-11ed-87f3-f6e218170d12"
"False","True","« On en a ras le bol » : encore une rave party organisée près d’Argentan, la maire va porter plainte","https://www.ouest-france.fr/normandie/saint-brice-sous-ranes-61150/on-est-juste-la-pour-samuser-une-rave-party-reunit-plus-de-cent-fetards-dans-lorne-27e5e09e-e1b6-11ed-908e-9b680907ca67"
"True","True","Homicide en boîte de nuit près d’Angers : « Rien ne laissait présager que ça finirait comme ça »","https://www.ouest-france.fr/pays-de-la-loire/angers-49000/homicide-en-boite-de-nuit-pres-dangers-rien-ne-laissait-presager-que-ca-finirait-comme-ca-f07e7ad4-e292-11ed-b514-8dd13d8be671"
"False","True","EN IMAGES. Des aurores boréales observées dans le ciel de la France la nuit dernière","https://www.ouest-france.fr/meteo/en-images-des-aurores-boreales-observees-dans-le-ciel-de-la-france-la-nuit-derniere-26fcfd7a-e274-11ed-b514-8dd13d8be671"
"False","True","Deuxième coupure d’internet à Fontenay-le-Comte en une semaine : « 10 000 » personnes touchées","https://www.ouest-france.fr/high-tech/orange/deuxieme-coupure-dinternet-a-fontenay-le-comte-en-une-semaine-10-000-personnes-touchees-c1bead2a-e1f9-11ed-87f3-f6e218170d12"
"False","True","Un homme tué par un tir d’arme à feu dans une discothèque, près d’Angers","https://www.ouest-france.fr/societe/faits-divers/un-homme-tue-par-un-tir-darme-a-feu-dans-une-discotheque-pres-dangers-f0c33220-e1c3-11ed-908e-9b680907ca67"
"False","True","Deux militants d’extrême droite de retour d’Ukraine arrêtés à Paris avec du matériel militaire","https://www.ouest-france.fr/europe/ukraine/deux-militants-dextreme-droite-de-retour-dukraine-arretes-a-paris-avec-du-materiel-militaire-1b5babf6-e29c-11ed-b514-8dd13d8be671"
"False","True","Guerre en Ukraine : le patron de Wagner, Evguéni Prigojine, ordonne de ne plus faire de prisonniers","https://www.ouest-france.fr/europe/ukraine/guerre-en-ukraine-le-patron-de-wagner-evgueni-prigojine-ordonne-de-ne-plus-faire-de-prisonniers-4be587c0-e287-11ed-b514-8dd13d8be671"
"True","True","La femme d’un ministre russe divorce pour éviter les sanctions françaises liées la guerre en Ukraine","https://www.ouest-france.fr/monde/guerre-en-ukraine/un-divorce-pour-eviter-les-sanctions-francaises-796d9f1a-e1cf-11ed-908e-9b680907ca67"
"False","True","Guerre en Ukraine. Explosions à Zaporijia, bilan des dépenses militaires… Le point sur la nuit","https://www.ouest-france.fr/monde/guerre-en-ukraine/guerre-en-ukraine-explosions-a-zaporijia-bilan-des-depenses-militaires-le-point-sur-la-nuit-4fe2d851-c48a-4826-8f10-3add85af514d"
"False","True","Pendant la Seconde Guerre mondiale, l’Île-aux-Moines a été le refuge de plusieurs familles juives","https://www.ouest-france.fr/bretagne/ile-aux-moines-56780/pendant-la-seconde-guerre-mondiale-lile-aux-moines-a-ete-le-refuge-de-plusieurs-familles-juives-16e200c8-a3d8-11ed-a69f-2485525f016c"
"False","True","Haute-Garonne : il abat froidement le chat de son voisin parce qu’il « excitait ses chiens »","https://www.ouest-france.fr/region-occitanie/haute-garonne/haute-garonne-il-abat-froidement-le-chat-de-son-voisin-parce-quil-excitait-ses-chiens-4257c482-e2a2-11ed-8fba-d043309999eb"
"False","False","SNCF. Plusieurs lignes interrompues au départ de Toulouse à cause d’un incendie","https://www.ouest-france.fr/region-occitanie/toulouse-31000/sncf-plusieurs-lignes-interrompues-au-depart-de-toulouse-a-cause-dun-incendie-82ae8224-e2a1-11ed-8fba-d043309999eb"
"False","False","Aveyron : un adolescent condamné à 14 ans de réclusion pour avoir poignardé à mort sa belle-mère","https://www.ouest-france.fr/region-occitanie/millau-12100/aveyron-un-adolescent-condamne-a-14-ans-de-reclusion-pour-avoir-poignarde-a-mort-sa-belle-mere-ad308eee-e287-11ed-8fba-d043309999eb"
"False","True","Paris. Un suspect de 24 ans interpellé cinq ans après un viol commis sur une nonagénaire","https://www.ouest-france.fr/ile-de-france/paris-75000/paris-un-suspect-de-24-ans-interpelle-cinq-ans-apres-un-viol-commis-sur-une-nonagenaire-bacdaeba-e2a5-11ed-8fba-d043309999eb"
"False","False","Deux militants d’extrême droite de retour d’Ukraine arrêtés à Paris avec du matériel militaire","https://www.ouest-france.fr/europe/ukraine/deux-militants-dextreme-droite-de-retour-dukraine-arretes-a-paris-avec-du-materiel-militaire-1b5babf6-e29c-11ed-b514-8dd13d8be671"
"False","False","Versailles : il découvre un serpent de plusieurs dizaines de centimètres dans son salon","https://www.ouest-france.fr/ile-de-france/versailles-78000/versailles-il-decouvre-un-serpent-de-plusieurs-dizaines-de-centimetres-dans-son-salon-0dad43dc-e29e-11ed-8fba-d043309999eb"
"False","True","Cannes : un enfant de 2 ans meurt après être tombé dans une piscine privée","https://www.ouest-france.fr/provence-alpes-cote-dazur/cannes-06400/cannes-un-enfant-de-2-ans-meurt-apres-etre-tombe-dans-une-piscine-privee-0e039d34-e2a5-11ed-8fba-d043309999eb"
"False","False","Réforme des retraites : poursuivi par des manifestants, ce député veut porter plainte","https://www.ouest-france.fr/economie/retraites/reforme-des-retraites-poursuivi-par-des-manifestants-ce-depute-veut-porter-plainte-b7f26094-e298-11ed-b514-8dd13d8be671"
"False","False","Mort d’Yvan Colonna : devant la commission d’enquête, la surveillante se défend de tout manquement","https://www.ouest-france.fr/societe/justice/mort-de-colonna-devant-la-commission-denquete-la-surveillante-se-defend-de-tout-manquement-229a20ae-e29d-11ed-814e-527b887752e5"
"False","True","Vienne. Victime d’un malaise après 18 km d’effort, un coureur décède sur la ligne d’arrivée","https://www.ouest-france.fr/nouvelle-aquitaine/vouneuil-sur-vienne-86210/vienne-victime-dun-malaise-apres-18-km-deffort-un-coureur-decede-sur-la-ligne-darrivee-2407a4b6-e2a7-11ed-8fba-d043309999eb"
"False","False","Brive-la-Gaillarde. Un homme de 38 ans tué à coups de couteau, une enquête ouverte","https://www.ouest-france.fr/nouvelle-aquitaine/brive-la-gaillarde-19100/brive-la-gaillarde-un-homme-de-38-ans-tue-a-coups-de-couteau-une-enquete-ouverte-0715ffda-e287-11ed-8fba-d043309999eb"
"False","False","Plus de 3000 manifestants à Bayonne pour réclamer des moyens pour la langue basque","https://www.ouest-france.fr/nouvelle-aquitaine/pyrenees-atlantiques/plus-de-3000-manifestants-a-bayonne-pour-reclamer-des-moyens-pour-la-langue-basque-2e99bfd4-2e32-45c4-b8db-15b29b3b6ead"
