"premium","picture","title","url"
"False","True","France - Ecosse : « Le 10 ne maîtrise pas le jeu », la prise d’initiatives, nouveau mal français","https://www.20minutes.fr/sport/6_nations/4025237-20230224-france-ecosse-10-maitrise-jeu-prise-initiatives-nouveau-mal-francais"
"False","True","Avec sa maison passive, Bernard Giraudeau a voulu « mettre en conformité » ses valeurs avec sa vie","https://www.20minutes.fr/planete/4025287-20230226-maison-passive-bernard-giraudeau-voulu-mettre-conformite-valeurs-vie"
"False","True","Poutine estime que l'Otan participe au conflit","https://www.20minutes.fr/monde/ukraine/4025412-20230226-guerre-ukraine-direct-g20-finances-echoue-accorder-communique-ukraine"
"False","True","Marseille : Une unité spécialisée dans les violences urbaines, déployée par Gérald Darmanin","https://www.20minutes.fr/societe/4025439-20230226-marseille-unite-specialisee-violences-urbaines-deployee-gerald-darmanin"
"False","True","7.000 soldats pour le plus grand exercice militaire mené en France depuis des années","https://www.20minutes.fr/societe/4025417-20230226-occitanie-7-000-soldats-plus-grand-exercice-militaire-mene-depuis-annees"
"False","True","Réforme des retraites : le gouvernement veut l'« améliorer » pour les femmes, dit Dussopt","https://www.20minutes.fr/politique/4025441-20230226-reforme-retraites-gouvernement-veut-ameliorer-femmes-dit-dussopt"
"False","True","Lyon : Un homme recherché après avoir poignardé une femme","https://www.20minutes.fr/faits_divers/faits-divers-lyon/4025428-20230226-lyon-homme-recherche-apres-avoir-poignarde-femme"
"False","True","Ces Ukrainiennes qui combattent sur le front numérique","https://www.20minutes.fr/monde/ukraine/4024949-20230226-guerre-ukraine-elles-choisi-battre-front-numerique"
"False","True","Rentrée en Ukraine avec son bébé né en France, Liliia est « reconnaissante »","https://www.20minutes.fr/monde/ukraine/4025258-20230226-guerre-ukraine-apres-huit-mois-france-arrivee-bebe-liliia-repartie-pleine-gratitude"
"False","True","Kalush Orchestra participe à l’effort de guerre avec ses concerts","https://www.20minutes.fr/monde/4025298-20230225-guerre-ukraine-vainqueur-eurovision-kalush-orchestra-participe-effort-guerre-concerts"
"False","True","A Marseille, une association aide les Ukrainiens à remplir leur panier","https://www.20minutes.fr/societe/4025127-20230225-marseille-association-aide-chaque-semaine-refugies-ukrainiens-remplir-panier"
"False","True","Les Tupamaros : La milice qui fait la loi au Venezuela","https://www.20minutes.fr/videos/4025327-20230225-tupamaros-milice-fait-loi-venezuela-doc-2-minutes-samedi"
"False","True","Face à l'inflation, la high-tech reconditionnée sent la bonne occasion","https://www.20minutes.fr/high-tech/4021319-20230225-seconde-main-reconditionne-ouvre-ensemble-electromenager-occasion-garantie"
"False","True","Les États-Unis sont-ils à l’origine des séismes en Turquie ?","https://www.20minutes.fr/videos/oh-my-fake/4025314-20230225-etats-unis-origine-seismes-turquie"
"False","True","24 heures","https://www.20minutes.fr/diaporama/diaporama-4024561-images-visite-surprise-joe-biden-ukraine-reforme-retraites-france-carnaval-rio-bresil"
"False","True","Ukraine, un an après","https://www.20minutes.fr/diaporama/diaporama-4024759-guerre-ukraine-images-an-conflit-meurtrier-europe"
"False","True","La libération de la parole raciste dans les tribunes du sport amateur","https://www.20minutes.fr/sport/handball/4025221-20230224-zone-mixte-hand-basket-rugby-liberation-parole-raciste-tribunes-sport-amateur"
"False","True","« Crèmes », « bonbons » pour vulves, laissez le sexe féminin tranquille !","https://www.20minutes.fr/podcast/4025156-20230224-tout-sexplique-bonbons-vulves-cremes-laissez-sexe-feminin-paix"
"False","True","Comment les écoles françaises accueillent-elles les enfants ukrainiens ?","https://www.20minutes.fr/podcast/4024874-20230223-guerre-ukraine-comment-ecoles-francaises-accueillent-elles-enfants-ukrainiens"
"False","True","Pas-de-Calais : Une randonneuse meurt percutée par un arbre","https://www.20minutes.fr/faits_divers/4025419-20230226-calais-randonneuse-meurt-percutee-arbre-abattu-terrain-voisin"
"False","True","Guerre en Ukraine : Comment les profs abordent le conflit en classe au collège et au lycée","https://www.20minutes.fr/societe/3252499-20220317-guerre-ukraine-comment-profs-abordent-conflit-classe-college-lycee"
"False","True","Ski de bosses : Perrine Laffont championne du monde pour la cinquième fois","https://www.20minutes.fr/sport/ski/4025438-20230226-ski-bosses-perrine-laffont-championne-monde-cinquieme-fois"
"False","True","Un quinquagénaire tué par balle dans un quartier tranquille de Besançon","https://www.20minutes.fr/faits_divers/4025440-20230226-besancon-quinquagenaire-tue-arme-feu-quartier-tranquille"
"False","True","Un homme recherché après avoir poignardé une femme à Lyon","https://www.20minutes.fr/faits_divers/faits-divers-lyon/4025428-20230226-lyon-homme-recherche-apres-avoir-poignarde-femme"
"False","True","Le concert de métal néonazi n’a pas eu lieu dans les Vosges","https://www.20minutes.fr/faits_divers/4025424-20230226-vosges-interdit-darmanin-concert-metal-neonazi-lieu"
"False","True","Corse : Nouveaux incendies criminels, des tags de l’organisation clandestine « GGC » retrouvés","https://www.20minutes.fr/societe/4025430-20230226-corse-nouveaux-incendies-criminels-tags-organisation-clandestine-ggc-retrouves"
"False","True","Jordanie : Rencontre entre Israël et Palestine pour « mettre un terme à l’effusion de sang »","https://www.20minutes.fr/monde/4025434-20230226-jordanie-rencontre-entre-israel-palestine-mettre-terme-effusion-sang"
"False","True","Pour fêter son 100e épisode, le podcast Sixième Science vous lance un défi","https://www.20minutes.fr/20-mint/4024301-20230223-feter-100e-episode-podcast-sixieme-science-lance-defi-auditeurs"
"False","True","Palmiers 3D, avatar d’Estrosi… Nice débarque dans le métavers","https://www.20minutes.fr/20-mint/4023769-20230221-palmiers-3d-avatar-christian-estrosi-pourquoi-nice-debarque-metavers"
"False","True","Meta a joué de malchance avec le métavers, selon l’économiste Julien Pillot","https://www.20minutes.fr/20-mint/4024593-20230220-meta-joue-malchance-metavers-selon-economiste-julien-pillot"
"False","True","Selon plusieurs médias, Pierre Palmade a été victime samedi d’un AVC","https://www.20minutes.fr/justice/4025409-20230226-affaire-pierre-palmade-selon-plusieurs-medias-humoriste-victime-samedi-avc"
"False","True","Le Français Nicolas Philibert remporte l’Ours d’Or avec « Sur l’Adamant »","https://www.20minutes.fr/cinema/4025387-20230225-berlinale-2023-francais-philippe-garrel-sacre-meilleur-realisateur-ours-or-francais-nicolas-philipert"
"False","True","Attention à ce médicament « pouvant conduire au décès » en cas d’abus","https://www.20minutes.fr/sante/4025248-20230224-attention-medicament-pouvant-conduire-deces-cas-abus-dependance"
"False","True","Rentrée en Ukraine avec son bébé né en France, Liliia est « reconnaissante »","https://www.20minutes.fr/monde/ukraine/4025258-20230226-guerre-ukraine-apres-huit-mois-france-arrivee-bebe-liliia-repartie-pleine-gratitude"
"False","True","Guerre en Ukraine EN DIRECT : Poutine estime que l'Otan participe au…","https://www.20minutes.fr/monde/ukraine/4025412-20230226-guerre-ukraine-direct-g20-finances-echoue-accorder-communique-ukraine"
"False","True","Les États-Unis sont-ils à l’origine des séismes en Turquie ?","https://www.20minutes.fr/videos/oh-my-fake/4025314-20230225-etats-unis-origine-seismes-turquie"
"False","True","« J’avais 14 ans et demi »… Une basketteuse accuse son ex-coach de viol","https://www.20minutes.fr/justice/4025084-20230225-viol-disait-femme-vie-14-ans-demi-basketteuse-accuse-ancien-coach"
"False","True","Un manifestant plaqué au sol lors de la visite de Macron aux agriculteurs","https://www.20minutes.fr/societe/salon_de_l_agriculture/4025392-20230225-salon-agriculture-2023-manifestant-ecolo-plaque-sol-lors-visite-macron"
"False","True","France - Écosse : À quelle heure et sur quelle chaîne suivre le match ?","https://www.20minutes.fr/sport/6_nations/4025405-20230226-france-ecosse-heure-chaine-voir-ie-match-tournoi-6-nations"
"False","True","Comment le skyr est devenu le boss des yaourts","https://www.20minutes.fr/economie/4024265-20230225-fashion-conso-comment-skyr-devenu-roi-venu-froid-yaourts"
"False","True","Tournoi de Dubaï : Djokovic de retour un mois après son triomphe à Melbourne","https://www.20minutes.fr/sport/tennis/4025427-20230226-tournoi-dubai-djokovic-retour-mois-apres-triomphe-melbourne"
"False","True","Vosges : Interdit par Darmanin, le concert de métal néonazi n’a pas eu lieu","https://www.20minutes.fr/faits_divers/4025424-20230226-vosges-interdit-darmanin-concert-metal-neonazi-lieu"
"False","True","Crise à la FFF : Noël Le Graët serait au bord de la démission","https://www.20minutes.fr/sport/football/4025421-20230226-crise-fff-noel-graet-bord-demission"
"False","True","Equipe de France : Les Lyonnaises Mbock et Morroni s’associent à Renard contre le management en sélection","https://www.20minutes.fr/sport/football/4025420-20230226-equipe-france-lyonnaises-mbock-morroni-associent-renard-contre-management-selection"
"False","True","France Inter : « Affaires sensibles » dévoile les secrets autour de l’affaire Mia","https://www.20minutes.fr/medias/4025145-20230226-france-inter-affaires-sensibles-devoile-secrets-autour-affaire-mia"
"False","True","Italie : Tragédie près des côtes avec la mort d’une quarantaine de réfugiés dont un nouveau-né","https://www.20minutes.fr/monde/4025418-20230226-italie-tragedie-pres-cotes-mort-quarantaine-refugies-dont-nouveau"
"False","True","OM-PSG : Idole du Parc, leader et (futur ?) capitaine… Et si Mbappé restait toute sa carrière au PSG ?","https://www.20minutes.fr/sport/football/4025246-20230226-om-psg-idole-parc-leader-futur-capitaine-si-mbappe-restait-toute-carriere-psg"
"False","True","Toi, le jeune, «20 Minutes» a besoin de toi","https://www.20minutes.fr/societe/1814119-20160326-moijeune-jeune-20-minutes-besoin"
"False","True","Le mystère de ce crâne de 7 millions d'années enfin résolu","https://podcasts.20minutes.fr/20-minutes-sixieme-science/202211120500-il-y-7-millions-dannees-toumai-se-tenait-deja-debout"
"False","True","Pour fêter son 100e épisode, le podcast Sixième Science lance un défi à ses auditeurs","https://www.20minutes.fr/20-mint/4024301-20230223-feter-100e-episode-podcast-sixieme-science-lance-defi-auditeurs"
