"premium","picture","title","url"
"False","False","La justice se prononce ce mardi sur la liberté de Pierre Palmade","https://www.lefigaro.fr/faits-divers/la-justice-se-prononce-mardi-sur-la-liberte-de-pierre-palmade-20230314"
"False","False","Emmanuel Macron enclenche le compte à rebours vers les Jeux olympiques 2024","https://www.lefigaro.fr/actualite-france/macron-enclenche-le-compte-a-rebours-vers-les-jeux-olympiques-20230313"
"True","False","INFO LE FIGARO - Sécurité des JO 2024: le ministère de l’Intérieur va lever une armada hors norme","https://www.lefigaro.fr/actualite-france/securite-des-jo-2024-beauvau-va-lever-une-armada-hors-norme-20230313"
"True","False","ÉDITORIAL DU FIGARO - JO 2024: «Le compte à rebours est lancé»","https://www.lefigaro.fr/vox/jo-2024-le-compte-a-rebours-est-lance-20230313"
"False","False","Coup de tabac sur les marchés après la faillite de Silicon Valley Bank","https://www.lefigaro.fr/conjoncture/coup-de-tabac-sur-les-marches-apres-la-faillite-de-silicon-valley-bank-20230313"
"True","False","DÉCRYPTAGE - SVB: six questions sur une faillite et ses risques de conséquences en cascade","https://www.lefigaro.fr/conjoncture/svb-six-questions-sur-une-faillite-et-ses-risques-de-consequences-en-cascade-20230313"
"True","False","«Je n'ai pas dit mon dernier mot» : les extraits exclusifs du livre-choc d'Éric Zemmour","https://www.lefigaro.fr/lefigaromagazine/je-n-ai-pas-dit-mon-dernier-mot-les-extraits-exclusifs-du-livre-choc-d-eric-zemmour-20230314"
"False","False","Grève du 15 mars : transports, écoles, raffineries... À quoi faut-il s'attendre ?","https://www.lefigaro.fr/conjoncture/greve-du-15-mars-le-trafic-sera-quasi-normal-a-la-ratp-sauf-pour-le-rer-20230313"
"False","False","Grève dans les transports : trafic normal ce mardi 14 mars à la RATP, des perturbations attendues à la SNCF","https://www.lefigaro.fr/social/greve-dans-les-transports-le-trafic-proche-d-un-retour-a-la-normale-a-la-ratp-lundi-20230312"
"True","False","Et si, finalement, la Chine ne dépassait pas les États-Unis?","https://www.lefigaro.fr/conjoncture/et-si-finalement-la-chine-ne-depassait-pas-les-etats-unis-20230313"
"False","False","La Chine va relancer ses délivrances de visas, très restreintes depuis la pandémie","https://www.lefigaro.fr/international/la-chine-va-relancer-ses-delivrances-de-visas-tres-restreintes-depuis-la-pandemie-20230313"
"False","False","Dordogne : un détenu condamné pour assassinat s'évade d'une prison semi-ouverte","https://www.lefigaro.fr/faits-divers/dordogne-un-detenu-condamne-pour-assassinat-s-evade-d-une-prison-semi-ouverte-20230314"
"True","False","Grève des éboueurs à Paris: Rachida Dati demande la mise en place d’«un service minimum»","https://www.lefigaro.fr/politique/poubelles-rachida-dati-demande-la-mise-en-place-d-un-service-minimum-20230313"
"False","False","Grève des éboueurs : «C'est Anne Hidalgo qui fait grève : elle ne fait rien», fustige Clément Beaune","https://www.lefigaro.fr/politique/greve-des-eboueurs-c-est-anne-hidalgo-qui-fait-greve-elle-ne-fait-rien-fustige-clement-beaune-20230314"
"False","False","PODCAST - «Paris qui croule sous les poubelles accueille les JO dans 500 jours» par Yves Thréard","https://podcasts.lefigaro.fr/le-figaro-ledito-du-figaro/202303140600-jo-2024-le-compte-rebours-est-lance"
"False","False","Sous-marins australiens: Joe Biden dévoile les contours de l’Aukus","https://www.lefigaro.fr/international/sous-marins-australiens-joe-biden-devoile-les-contours-de-l-aukus-20230313"
"True","False","La schizophrénie, une maladie à envisager dès l’enfance","https://www.lefigaro.fr/sciences/la-schizophrenie-une-maladie-a-envisager-des-l-enfance-20230312"
"False","False","Le pique-nique sanglant de Témoins de Jéhovah de retour aux assises","https://www.lefigaro.fr/faits-divers/le-pique-nique-sanglant-de-temoins-de-jehovah-de-retour-aux-assises-20230314"
"False","False","États-Unis : une fillette de 3 ans tue accidentellement par balle sa sœur de 4 ans","https://www.lefigaro.fr/international/etats-unis-une-fillette-de-3-ans-tue-accidentellement-par-balle-sa-soeur-de-4-ans-20230313"
"False","True","«Une machine à détruire des vies» : l'ouverture d'une boutique éphémère Shein fait des remous à Lyon","https://www.lefigaro.fr/lyon/une-machine-a-detruire-des-vies-l-ouverture-d-une-boutique-ephemere-shein-fait-des-remous-a-lyon-20230313"
"False","True","À Lyon, la Métropole va rehausser plusieurs digues pour protéger 80.000 habitants des crues du Rhône","https://www.lefigaro.fr/lyon/a-lyon-la-metropole-va-rehausser-plusieurs-digues-pour-proteger-80-000-habitants-des-crues-du-rhone-20230313"
"False","True","Bordeaux : un jeune mis en examen pour l'agression de deux policiers","https://www.lefigaro.fr/bordeaux/bordeaux-un-jeune-mis-en-examen-pour-l-agression-de-deux-policiers-20230313"
"False","True","Les Alpes-Maritimes passent en alerte sécheresse avec des premières restrictions","https://www.lefigaro.fr/nice/les-alpes-maritimes-vont-passer-en-alerte-secheresse-avec-des-premieres-restrictions-20230309"
"False","False","Casino cède 12,9% de son enseigne brésilienne Assai","https://www.lefigaro.fr/societes/casino-cede-12-9-de-son-enseigne-bresilienne-assai-20230314"
"False","False","Vivendi en négociations exclusives avec Daniel Kretinsky pour vendre 100% d'Editis","https://www.lefigaro.fr/medias/vivendi-en-negociations-exclusives-avec-daniel-kretinsky-pour-vendre-100-d-editis-20230314"
"False","False","La saison de la floraison des cerisiers à Tokyo est officiellement ouverte","https://www.lefigaro.fr/flash-actu/la-saison-de-la-floraison-des-cerisiers-a-tokyo-est-officiellement-ouverte-20230314"
"False","False","Tennis: l'Ukrainienne Tsurenko explique son forfait contre la Bélarusse Sabalenka à Indian Wells par une «crise de panique»","https://www.lefigaro.fr/sports/tennis/tennis-l-ukrainienne-tsurenko-explique-son-forfait-contre-la-sabalenka-a-indian-wells-par-une-crise-de-panique-20230314"
"False","False","Grève des éboueurs : «C'est Anne Hidalgo qui fait grève : elle ne fait rien», fustige Clément Beaune","https://www.lefigaro.fr/politique/greve-des-eboueurs-c-est-anne-hidalgo-qui-fait-greve-elle-ne-fait-rien-fustige-clement-beaune-20230314"
"False","False","Équateur : une ex-ministre condamnée pour corruption a pris la fuite","https://www.lefigaro.fr/flash-actu/equateur-une-ex-ministre-condamnee-pour-corruption-a-pris-la-fuite-20230314"
"False","False","L'éphéméride de ce mardi 14 mars 2023","https://www.lefigaro.fr/flash-actu/l-ephemeride-de-ce-mardi-14-mars-2023-20230314"
"False","False","Tennis : Garcia poursuit sa marche en avant à Indian Wells, pas Mannarino","https://www.lefigaro.fr/sports/tennis/tennis-garcia-poursuit-sa-marche-en-avant-a-indian-wells-pas-mannarino-20230314"
"False","False","«Elle a été démolie, fracassée, jusqu'à ce que mort s'ensuive»: le compagnon de Sandra jugé aux assises de Douai","https://www.lefigaro.fr/faits-divers/elle-a-ete-demolie-fracassee-jusqu-a-ce-que-mort-s-ensuive-le-compagnon-de-sandra-juge-aux-assises-de-douai-20230314"
"False","False","Créteil: deux hommes jugés en appel pour le meurtre de Vanesa Campos","https://www.lefigaro.fr/faits-divers/creteil-deux-hommes-juges-en-appel-pour-le-meurtre-de-vanesa-campos-20230314"
"False","False","Une centaine d'eurodéputés réclament un impôt sur les «ultra-riches»","https://www.lefigaro.fr/flash-eco/une-centaine-d-eurodeputes-reclament-un-impot-sur-les-ultra-riches-20230314"
"False","False","Le pique-nique sanglant de Témoins de Jéhovah de retour aux assises","https://www.lefigaro.fr/faits-divers/le-pique-nique-sanglant-de-temoins-de-jehovah-de-retour-aux-assises-20230314"
"False","False","La justice se prononce ce mardi sur la liberté de Pierre Palmade","https://www.lefigaro.fr/faits-divers/la-justice-se-prononce-mardi-sur-la-liberte-de-pierre-palmade-20230314"
"False","False","Biden invite Sunak à Washington en juin","https://www.lefigaro.fr/flash-actu/biden-invite-sunak-a-washington-en-juin-20230314"
"False","False","Un tribunal californien entérine la loi sur le statut indépendant des chauffeurs Uber","https://www.lefigaro.fr/flash-eco/un-tribunal-californien-enterine-la-loi-sur-le-statut-independant-des-chauffeurs-uber-20230314"
"False","False","Canada: deux piétons morts après avoir été fauchés par un pick-up, neuf blessés","https://www.lefigaro.fr/flash-actu/canada-deux-pietons-morts-apres-avoir-ete-fauches-par-un-pick-up-neuf-blesses-20230314"
"False","False","La Corée du Nord a tiré deux missiles balistiques de courte portée, selon Séoul","https://www.lefigaro.fr/flash-actu/la-coree-du-nord-tire-un-missile-balistique-non-identifie-20230314"
"False","False","L'audience des Oscars en légère hausse pour le triomphe d'«Everything Everywhere All At Once»","https://www.lefigaro.fr/flash-actu/l-audience-des-oscars-en-legere-hausse-pour-le-triomphe-d-everything-everywhere-all-at-once-20230314"
"False","False","Retraites : plusieurs députés Nupes réclament à Yaël Braun-Pivet une commission mixte paritaire publique","https://www.lefigaro.fr/politique/retraites-plusieurs-deputes-nupes-reclament-a-yael-braun-pivet-une-commission-paritaire-mixte-publique-20230313"
"False","False","Biden va se rendre en Irlande et en Irlande du Nord","https://www.lefigaro.fr/flash-actu/biden-dit-envisager-un-voyage-prochain-en-irlande-et-en-irlande-du-nord-20230313"
"False","False","Dans l'est de la RDC, «lueur ardente» au sommet d'un volcan et appel au calme","https://www.lefigaro.fr/flash-actu/dans-l-est-de-la-rdc-lueur-ardente-au-sommet-d-un-volcan-et-appel-au-calme-20230313"
"False","False","Prison à vie pour l'auteur d'une attaque à New York au nom du groupe État Islamique","https://www.lefigaro.fr/flash-actu/prison-a-vie-pour-l-auteur-d-une-attaque-a-new-york-au-nom-du-groupe-etat-islamique-20230313"
"False","False","La Californie se débat entre deux tempêtes","https://www.lefigaro.fr/international/la-californie-se-debat-entre-deux-tempetes-20230313"
"False","False","La Chine va relancer ses délivrances de visas, très restreintes depuis la pandémie","https://www.lefigaro.fr/international/la-chine-va-relancer-ses-delivrances-de-visas-tres-restreintes-depuis-la-pandemie-20230313"
"False","False","Nucléaire : l'Assemblée nationale vote la suppression du plafond de production à 50%","https://www.lefigaro.fr/conjoncture/nucleaire-l-assemblee-nationale-vote-la-suppression-du-plafond-de-production-a-50-20230313"
"False","False","Royaume-Uni: réincarcération d'un ex-chanteur condamné pour pédocriminalité","https://www.lefigaro.fr/flash-actu/royaume-uni-reincarceration-d-un-ex-chanteur-condamne-pour-pedocriminalite-20230313"
"False","False","Soupçon d'agressions sexuelles: 4 ans de prison requis contre un ancien élu socialiste","https://www.lefigaro.fr/flash-actu/soupcon-d-agressions-sexuelles-4-ans-de-prison-requis-contre-un-ancien-elu-socialiste-20230313"
