"premium","picture","title","url"
"False","True","Gérald Darmanin ordonne d’interdire toutes les manifestations d’ultradroite","https://www.20minutes.fr/politique/4036135-20230509-gerald-darmanin-ordonne-prefets-interdire-toutes-manifestations-ultradroite"
"False","True","Stromae a besoin de « repos » et annonce l’arrêt total de sa tournée","https://www.20minutes.fr/culture/4036147-20230509-musique-stromae-annonce-arret-total-tournee"
"False","True","Les Etats-Unis annoncent une nouvelle aide d'1,2 milliard de dollars...","https://www.20minutes.fr/monde/ukraine/4036021-20230509-guerre-ukraine-direct-ombre-revers-ukraine-russie-commemore-victoire-allemagne-nazie"
"False","True","« Il n'y a rien avec aucun club »… Le père de Lionel Messi réagit","https://www.20minutes.fr/sport/football/4036148-20230509-psg-rien-aucun-club-pere-lionel-messi-sort-sulfateuse-contre-menteurs"
"False","True","Elisabeth Borne « choquée » par les images de la manifestation","https://www.20minutes.fr/societe/4036118-20230509-ultradroite-elisabeth-borne-choquee-images-manifestation"
"False","True","Des drones déployés pour surveiller une manif à Bordeaux, les syndicats révoltés","https://www.20minutes.fr/bordeaux/4036124-20230509-bordeaux-drones-deployes-surveiller-manif-contre-violences-etat-syndicats-revoltes"
"False","True","Avec la hausse des prix, les abandons d'animaux explosent","https://www.20minutes.fr/societe/4036108-20230509-inflation-face-flambee-prix-veto-croquettes-abandons-animaux-explosent-30-40"
"False","True","Avec la fin des restrictions anti Covid-19, les Etats-Unis craignent un appel d’air migratoire","https://www.20minutes.fr/monde/etats-unis/4036111-20230509-etats-unis-fin-restrictions-anticovid-19-crainte-appel-air-migratoire"
"False","True","L’annonce des éliminations de l'Eurovision fait scandale","https://www.20minutes.fr/culture/eurovision/4036086-20230509-eurovision-2023-annonce-eliminations-fait-scandale-alors-bbc-fait-marche-arriere"
"False","True","Scotland Yard « regrette » l’arrestation de manifestants anti-monarchie","https://www.20minutes.fr/monde/4036077-20230509-couronnement-charles-iii-police-regrette-arrestation-manifestants-anti-monarchie"
"False","True","Le portrait officiel du roi Charles III dévoilé","https://www.20minutes.fr/monde/4036066-20230509-couronnement-charles-iii-portrait-officiel-roi-devoile"
"False","True","Quels sont les nouveaux mots qui entrent dans le Petit Robert ?","https://www.20minutes.fr/livres/4036036-20230509-ghoster-complosphere-charles-iii-mots-font-entree-dictionnaire"
"False","True","La Zarra et le prince Andrew sont dans le Fil des Stars","https://www.20minutes.fr/people/4035984-20230508-zarra-fait-passer-fille-avant-tout-sarah-ferguson-1-prince-andrew-concert-couronnement"
"False","True","Le combat de Yannick Alléno un an après la mort brutale de son fils","https://www.20minutes.fr/videos/4035755-20230508-yannick-alleno-mort-fils-face-monde-souhaite-personne"
"False","True","Le smartphone Xiaomi 12T Pro fait peser la photo de tout son poids pour séduire","https://www.20minutes.fr/high-tech/4035565-20230508-xiaomi-12t-pro-qualites-photo-prix-contenu-arguments-suffisants-ecraser-concurrents"
"False","True","L’histoire vraie… du film à succès « Le discours d’un roi »","https://www.20minutes.fr/videos/4035774-20230507-discours-roi-histoire-vraie-roi-angleterre-begue"
"False","True","Le « Baiser de Marseille »","https://www.20minutes.fr/diaporama/diaporama-4033719-mariage-tous-images-baiser-marseille-symbole-soutien-indefectible"
"False","True","24 heures","https://www.20minutes.fr/diaporama/diaporama-4035143-images-manifestation-1er-mai-met-gala-2023-foire-paris"
"False","True","Eurovision, quels enjeux géopolitiques ?","https://www.20minutes.fr/podcast/4035769-20230509-minute-papillon-eurovision-enjeux-geopolitiques"
"False","True","Comment « 20 Minutes » a couvert la mort d’Elisabeth II ?","https://www.20minutes.fr/podcast/4035603-20230505-minute-papillon-comment-20-minutes-couvert-mort-elizabeth-ii"
"False","True","Comment pensent les génies ?","https://www.20minutes.fr/podcast/4035468-20230504-minute-papillon-comment-pensent-genies"
"False","True","L’Etat veut dégager 7 milliards d’euros pour la transition écologique","https://www.20minutes.fr/planete/4036085-20230509-transition-ecologique-enveloppe-7-milliards-degagee-2024"
"False","True","Emprisonné depuis 44 ans, un Belge fait condamner son pays","https://www.20minutes.fr/justice/4036103-20230509-cedh-emprisonne-depuis-44-ans-detenu-belge-fait-condamner-pays"
"False","True","Manifestations au Pakistan après l’arrestation de l’ex-Premier ministre","https://www.20minutes.fr/monde/4036123-20230509-pakistan-manifestations-secouent-pays-apres-arrestation-ancien-premier-ministre"
"False","True","Il sort de prison, agresse son voisin bruyant… et retourne en prison","https://www.20minutes.fr/faits_divers/4036115-20230509-drome-peine-sorti-prison-agresse-voisin-fait-trop-bruit-retourne-derriere-barreaux"
"False","True","A Pau, pendant la pause pipi de son bienfaiteur, il lui vole sa voiture","https://www.20minutes.fr/faits_divers/4036113-20230509-pau-profite-pause-pipi-auto-stoppeur-voler-voiture"
"False","True","Contrôlé en Alsace à 216 km/h, sans permis et sous stupéfiants","https://www.20minutes.fr/faits_divers/4036105-20230509-bas-rhin-controle-216-km-h-permis-sous-stupefiants-finit-gendarmerie"
"False","True","Adil Rami profite de l’affaire Messi pour régler ses comptes","https://www.20minutes.fr/sport/football/4036116-20230509-om-adil-rami-profite-affaire-messi-regler-comptes"
"False","True","Manu Payet ne fait pas le rigolo pendant ses vacances à « Hawaï »","https://www.20minutes.fr/cinema/4035819-20230509-hawai-manu-payet-rigole-plus-quand-amitie-mise-rude-epreuve"
"False","True","Un projet de réhabilitation de quartier disputé à Roubaix","https://www.20minutes.fr/societe/4036073-20230509-roubaix-projet-rehabilitation-quartier-heurte-opposition-certains-habitants"
"False","True","A bas le discriminateur… Discord fait une pseudo-révolution","https://www.20minutes.fr/20-mint/4035770-20230505-discord-utilisateurs-vont-tous-devoir-changer-pseudonyme-reseau-social"
"False","True","Retour sur Cross The Ages, le jeu qui est bien plus qu'un jeu","https://www.20minutes.fr/20-mint/4035517-20230504-cross-the-ages-sami-chlagou-construit-projet-vie"
"False","True","Dans le web3, pour les pionniers, « il faut trier le bon et le mauvais »","https://www.20minutes.fr/20-mint/4034843-20230428-bornes-nft-supermarches-cartographie-crypto-web3-inspire-marketing"
"False","True","Dans sa lutte pour son maintien en Ligue 1, Nantes se sépare de Kombouaré","https://www.20minutes.fr/sport/football/4036016-20230509-fc-nantes-engages-lutte-maintien-ligue-1-canaris-separent-kombouare"
"False","True","Le combat de Yannick Alléno un an après la mort brutale de son fils","https://www.20minutes.fr/videos/4035755-20230508-yannick-alleno-mort-fils-face-monde-souhaite-personne"
"False","True","Pourquoi le coq gaulois est-il l’emblème de la France ?","https://www.20minutes.fr/loisirs/4035695-20230508-pourquoi-coq-gaulois-embleme-france"
"False","True","Dimitri Payet risque gros pour avoir giflé le Lensois Yannick Cahuzac","https://www.20minutes.fr/sport/football/4036027-20230509-om-dimitri-payet-risque-lourde-sanction-apres-gifle-lensois-yannick-cahuzac"
"False","True","L’actualité de la semaine à travers le regard des photojournalistes","https://www.20minutes.fr/diaporama/diaporama-4035143-images-manifestation-1er-mai-met-gala-2023-foire-paris"
"False","True","Lionel Messi en Arabie saoudite ? « Une affaire conclue »","https://www.20minutes.fr/sport/football/4036067-20230509-psg-lionel-messi-arabie-saoudite-affaire-conclue-contrat-exceptionnel"
"False","True","Mais d’où vient cette fascination de tous les joueurs pour le Real Madrid ?","https://www.20minutes.fr/sport/football/4036033-20230509-real-madrid-manchester-city-vient-fascination-tous-joueurs-real"
"False","True","Le patron d’Alpine hausse le ton (mais épargne Gasly et Ocon)","https://www.20minutes.fr/sport/f1/4036045-20230509-f1-patron-alpine-hausse-cause-mauvais-resultats-epargne-gasly-ocon"
"False","True","Nestlé Waters suspend deux forages de son eau dans les Vosges","https://www.20minutes.fr/planete/environnement/4035959-20230508-secheresse-vosges-nestle-waters-suspend-deux-forages-eau-hepar"
"False","True","Comment les boulangeries font désormais monter la sauce sur Instagram","https://www.20minutes.fr/economie/consommation/4035674-20230508-produits-sexy-esthetique-fond-boulangeries-fievre-instagram"
"False","True","Mobilisation pour le maintien du service des urgences à la clinique Bonnefon","https://www.20minutes.fr/sante/4036106-20230509-ales-mobilisation-maintien-service-urgences-clinique-bonnefon"
"False","True","Posez une question à Aymeric Caron, député Nupes","https://www.20minutes.fr/politique/4036042-20230509-posez-question-aymeric-caron-depute-nupes"
"False","True","« Sakra, la légende des demi-dieux », Yen ne fait pas les choses à moitié","https://www.20minutes.fr/cinema/4035821-20230509-sakra-legende-demi-dieux-acteur-realisateur-donnie-yen-fait-choses-moitie"
"False","True","Eurovision, quels enjeux géopolitiques ?","https://www.20minutes.fr/podcast/4035769-20230509-minute-papillon-eurovision-enjeux-geopolitiques"
"False","True","La « malédiction » de Pep Guardiola en Ligue des champions est « levée »","https://www.20minutes.fr/sport/football/4036099-20230509-real-madrid-city-malediction-pep-guardiola-ligue-champions-levee-madrid-peut-trembler"
"False","True","Il invente un van sans permis pour vadrouiller sur les routes dès 14 ans","https://www.20minutes.fr/societe/4035694-20230507-maine-loire-invente-van-amenage-permis-vadrouiller-routes-14-ans"
"False","True","Lionel Messi en Arabie saoudite, « une affaire conclue » ?","https://www.20minutes.fr/sport/football/4036067-20230509-psg-lionel-messi-arabie-saoudite-affaire-conclue-contrat-exceptionnel"
