"premium","picture","title","url"
"False","False","Réforme des retraites","https://www.bfmtv.com/economie/economie-social/reforme-des-retraites_DN-202108310622.html"
"False","False","Affrontements à Sainte-Soline","https://www.bfmtv.com/environnement/projet-de-mega-bassines-a-sainte-soline-dans-les-deux-sevres_DN-202303280553.html"
"False","False","Charles III","https://www.bfmtv.com/people/prince-charles_DN-202108310686.html"
"False","False","Guerre en Ukraine","https://www.bfmtv.com/international/europe/ukraine-russie-le-bras-de-fer-mondial_DN-201904150203.html"
"False","True","Pourquoi le plan d'eau d'Emmanuel Macron est très attendu","https://www.bfmtv.com/politique/elysee/pourquoi-le-plan-d-eau-d-emmanuel-macron-est-tres-attendu_AN-202303300122.html"
"False","True","""Plan eau"": le programme d'Emmanuel Macron pour son déplacement dans les Hautes-Alpes","https://www.bfmtv.com/bfm-dici/plan-eau-le-programme-d-emmanuel-macron-pour-son-deplacement-dans-les-hautes-alpes_AN-202303290773.html"
"False","True","""On devrait déjà avoir les jambes dans l'eau"": au cœur d'une nappe phréatique touchée par la sécheresse","https://www.bfmtv.com/environnement/on-devrait-deja-avoir-les-jambes-dans-l-eau-au-coeur-d-une-nappe-phreatique-touchee-par-la-secheresse_AV-202303300108.html"
"False","True","""Prenons de quoi faire du bruit"": la CGT prévoit un ""accueil"" à Emmanuel Macron à Savines-le-Lac ce jeudi","https://www.bfmtv.com/bfm-dici/prenons-de-quoi-faire-du-bruit-la-cgt-prevoit-un-accueil-a-emmanuel-macron-a-savines-le-lac_AN-202303290753.html"
"False","False","Hautes-Alpes: pourquoi Emmanuel Macron a-t-il choisi Savines-le-Lac pour présenter le…","https://www.bfmtv.com/bfm-dici/hautes-alpes-pourquoi-emmanuel-macron-a-t-il-choisi-savines-le-lac-pour-presenter-le-plan-eau_AN-202303290737.html"
"False","True","""Si ça continue, ça lâche"": pourquoi les figures de la lutte contre le CPE croient au retrait de la réforme des…","https://www.bfmtv.com/economie/economie-social/social/reforme-des-retraites-pourquoi-les-anciennes-figures-de-la-lutte-contre-le-cpe-croient-au-retrait_AN-202303300020.html"
"False","True","EN DIRECT - Réforme des retraites: les syndicats attendus le mercredi 5 avril à Matignon","https://www.bfmtv.com/economie/economie-social/social/en-direct-reforme-des-retraites-les-syndicats-attendus-le-mercredi-5-avril-a-matignon-l-avis-du-conseil-constitutionnel-le-14-avril-nette-amelioration-du-trafic-sncf-ce-jeudi_LN-202303300025.html"
"False","True","Retraites: pour 3 Français sur 4, le gouvernement doit retirer sa réforme pour mettre fin aux grèves et blocages","https://www.bfmtv.com/economie/economie-social/retraites-pour-3-francais-sur-4-le-gouvernement-doit-retirer-sa-reforme-pour-mettre-fin-aux-greves-et-blocages_AN-202303290518.html"
"False","False","""La France est furieuse"": la presse étrangère estime que la réforme des retraites est…","https://www.bfmtv.com/international/la-france-est-furieuse-la-presse-etrangere-estime-que-la-reforme-des-retraites-est-dans-une-impasse_AN-202303290707.html"
"False","True","Pizzas contaminées: l'usine Buitoni de Caudry va fermer définitivement","https://www.bfmtv.com/economie/entreprises/industries/pizzas-contaminees-l-usine-buitoni-de-caudry-va-fermer-definitivement_AN-202303300260.html"
"False","True","Hospitalisé pour une infection respiratoire, le pape François a passé ""une bonne nuit""","https://www.bfmtv.com/societe/religions/hospitalise-le-pape-francois-a-passe-une-bonne-nuit_AD-202303300226.html"
"False","True","L'inquiétude grandit autour de la santé du pape, hospitalisé pour une infection respiratoire","https://www.bfmtv.com/societe/religions/l-inquietude-grandit-autour-de-la-sante-du-pape-hospitalise-pour-une-infection-respiratoire_AV-202303300207.html"
"False","False","Le pape François souffre d'une infection respiratoire et va rester hospitalisé ""quelques…","https://www.bfmtv.com/societe/religions/le-pape-francois-souffre-d-une-infection-respiratoire-et-va-rester-hospitalise-quelques-jours_AD-202303290719.html"
"False","True","""Il était super gentil"": vers une extradition d'Edgardo Greco, le mafieux italien devenu pizzaïolo à Saint-Étienne?","https://www.bfmtv.com/police-justice/il-etait-super-gentil-vers-une-extradition-d-edgardo-greco-le-mafieux-italien-devenu-pizzaiolo-a-saint-etienne_AV-202303300115.html"
"False","True","Je veux tout faire pour que ça ne soit pas le choix entre la peste et le choléra. Gérald Darmanin, sur un éventuel second tour de présidentielle entre Marine Le Pen et Jean-Luc Mélenchon","https://www.bfmtv.com/politique/gouvernement/gerald-darmanin-estime-qu-un-duel-le-pen-melenchon-equivaut-a-choisir-entre-la-peste-ou-le-cholera_AN-202303290465.html"
"False","True","Ligue 1: avec Mbappé en tête, le PSG écrase les salaires du championnat","https://rmcsport.bfmtv.com/football/ligue-1/ligue-1-avec-mbappe-en-tete-le-psg-ecrase-les-salaires-du-championnat_AV-202303300234.html"
"False","True","Guerre en Ukraine: à Berlin, Charles III défend la solidarité avec Kiev face à la Russie","https://www.bfmtv.com/international/europe/ukraine/guerre-en-ukraine-a-berlin-charles-iii-defend-la-solidarite-avec-kiev-face-a-la-russie_AD-202303290779.html"
"False","True","Sainte-Soline: un opérateur du Samu dit avoir eu ordre de ne pas envoyer des secours, la préfète s'explique","https://www.bfmtv.com/police-justice/sainte-soline-un-operateur-du-samu-dit-avoir-eu-ordre-de-ne-pas-envoyer-des-secours-la-prefete-s-explique_AN-202303290087.html"
"False","True","""Son but, c'est de détruire la République"": Éric Dupond-Moretti charge Jean-Luc Mélenchon","https://www.bfmtv.com/politique/gouvernement/son-but-est-de-detruire-la-republique-eric-dupond-moretti-charge-jean-luc-melenchon_AN-202303290775.html"
"False","True","Stromae: inquiétude autour de son état de santé, après six concerts annulés","https://www.bfmtv.com/people/musique/stromae-inquietude-autour-de-son-etat-de-sante-apres-six-concerts-annules_AV-202303300250.html"
"False","True","Le remboursement de la télésurveillance médicale généralisé dès cet été","https://www.bfmtv.com/sante/le-remboursement-de-la-telesurveillance-medicale-generalise-des-cet-ete_AN-202303300186.html"
"False","True","""Redonner du sens à leur vie"": ils quittent leur smartphone pour un téléphone basique","https://www.bfmtv.com/tech/smartphone/redonner-du-sens-a-leur-vie-ils-quittent-leur-smartphone-pour-un-telephone-basique_AD-202303300125.html"
"False","True","Régulation des influenceurs: en quoi consiste la proposition de loi examinée ce jeudi?","https://www.bfmtv.com/tech/actualites/reseaux-sociaux/regulation-des-influenceurs-en-quoi-consiste-la-proposition-de-loi-examinee-cette-semaine_AN-202303270226.html"
"False","True","Sainte-Soline: la famille du deuxième manifestant gravement blessé porte plainte pour…","https://www.bfmtv.com/police-justice/sainte-soline-la-famille-du-deuxieme-manifestant-gravement-blesse-porte-plainte-pour-tentative-de-meurtre_AN-202303290471.html"
"False","True","Sainte-Soline: ce que l'on sait sur les blessés graves après la manifestation de samedi","https://www.bfmtv.com/police-justice/sainte-soline-ce-que-l-on-sait-sur-les-blesses-graves-apres-la-manifestation-de-samedi_AV-202303270723.html"
"False","True","BFMTV a suivi des unités des Brav, ces policiers qui interviennent en marge des…","https://www.bfmtv.com/police-justice/bfmtv-a-suivi-des-unites-des-brav-ces-policiers-qui-interviennent-en-marge-des-manifestations_AV-202303290260.html"
"False","True","""C'est ma façon de participer"": ils contribuent aux caisses de grève faute de pouvoir…","https://www.bfmtv.com/economie/economie-social/social/c-est-ma-facon-de-participer-ils-contribuent-aux-caisses-de-greve-faute-de-pouvoir-debrayer_AV-202303280029.html"
"False","True","Pourquoi la loi sur les influenceurs évite d'interdire la publicité pour l'alcool?","https://www.bfmtv.com/tech/pourquoi-la-loi-sur-les-influenceurs-n-interdit-pas-la-publicite-pour-l-alcool_AV-202303290444.html"
"False","True","Casino renforce son partenariat avec Smart Good Things, la société de Tony Parker","https://www.tradingsat.com/smart-good-things-FR001400CDB7/actualites/smart-good-things-casino-renforce-son-partenariat-avec-smart-good-things-la-societe-de-tony-parker-1062971.html"
"False","True","Plan eau: les entreprises de l'eau réclament 15 milliards d'euros sur cinq ans","https://www.bfmtv.com/economie/entreprises/industries/plan-eau-les-entreprises-de-l-eau-reclament-15-milliards-d-euros-sur-cinq-ans_AD-202303300264.html"
"False","True","Pizzas contaminées: l'usine Buitoni de Caudry va fermer définitivement","https://www.bfmtv.com/economie/entreprises/industries/pizzas-contaminees-l-usine-buitoni-de-caudry-va-fermer-definitivement_AN-202303300260.html"
"False","True","L'inflation ralentit à 3,3% en Espagne, son niveau le plus bas depuis 19 mois","https://www.bfmtv.com/economie/l-inflation-ralentit-a-3-3-en-espagne-son-niveau-le-plus-bas-depuis-19-mois_AD-202303300258.html"
"False","True","Inflation: pour Dominique Schelcher (Système U), le consommateur est passé des ""arbitrages aux restrictions""","https://www.bfmtv.com/economie/consommation/inflation-pour-dominique-schelcher-systeme-u-le-consommateur-est-passe-des-arbitrages-aux-restrictions_AV-202303300256.html"
"False","True","Equipe de France féminine: un Comex exceptionnel de la FFF jeudi pour officialiser Renard","https://rmcsport.bfmtv.com/football/equipe-de-france/equipe-de-france-un-comex-exceptionnel-de-la-fff-jeudi-pour-officialiser-renard_AV-202303290744.html"
"False","True","PSG: Neymar a perdu un million d'euros dans un casino en ligne","https://rmcsport.bfmtv.com/football/ligue-1/psg-neymar-a-perdu-un-million-d-euros-dans-un-casino-en-ligne_AV-202303290710.html"
"False","True","Ligue 1: ""On avance"", le foot français satisfait du décret sur les fumigènes malgré les contraintes","https://rmcsport.bfmtv.com/football/ligue-1/ligue-1-on-avance-le-foot-francais-satisfait-du-decret-sur-les-fumigenes-malgre-les-contraintes_AV-202303290694.html"
"False","True","Rugby: le concours d'affiches pour la Coupe du monde 2023 a tourné au fiasco","https://rmcsport.bfmtv.com/rugby/rugby-le-concours-d-affiches-pour-la-coupe-du-monde-2023-a-tourne-au-fiasco_AV-202303290650.html"
"False","True","Menacé de report par le mouvement social contre la réforme des retraites, le marathon de Paris aura bien lieu dimanche","https://rmcsport.bfmtv.com/athletisme/menace-de-report-par-le-mouvement-social-contre-la-reforme-des-retraites-le-marathon-de-paris-aura-bien-lieu-dimanche_AV-202303290419.html"
"False","True","25 ans de ""Harry Potter"" : l'histoire des illustrations d'origine, qui reparaissent en librairie","https://www.bfmtv.com/culture/harry-potter-l-histoire-des-illustrations-d-origine-qui-reparaissent-en-librairie_GN-202301190278.html"
"False","True","Ligne rouge - Bac Nord, ils parlent enfin","https://www.bfmtv.com/police-justice/ligne-rouge-bac-nord-ils-parlent-enfin_GN-202301160707.html"
"False","True","Les intelligences artificielles vont-elles remplacer les artistes ?","https://www.bfmtv.com/tech/les-intelligences-artificielles-vont-elles-remplacer-les-artistes_GN-202301120101.html"
"False","True","100 ans de la fondation de l'URSS : comment Poutine mobile le passé soviétique contre l'Ukraine","https://www.bfmtv.com/international/asie/russie/100-ans-de-la-fondation-de-l-urss-comment-poutine-mobilise-le-passe-sovietique-contre-l-ukraine_GN-202212300003.html"
"False","True","Une demande en hausse mais une production en baisse : le café survivra-t-il à sa popularité ?","https://www.bfmtv.com/economie/une-demande-en-hausse-mais-une-production-en-baisse-le-cafe-survivra-t-il-a-sa-popularite_GN-202212270016.html"
"False","True","Affaires Jubillar, Daval, le Tan...la reconstitution ""moment clé"" d'une enquête criminelle","https://www.bfmtv.com/police-justice/affaires-jubillar-daval-le-tan-la-reconstitution-moment-cle-d-une-enquete-criminelle_GN-202212130035.html"
"False","True","Madonna ajoute une date à sa tournée, dans le Tennessee, en soutien à la communauté LGBTQ+","https://www.bfmtv.com/people/musique/madonna-ajoute-une-date-a-sa-tournee-dans-le-tennessee-en-soutien-a-la-communaute-lgbtq_AN-202303300269.html"
"False","True","Des photos inédites des Beatles prises par Paul McCartney publiées avant une exposition à Londres","https://www.bfmtv.com/people/musique/des-photos-inedites-des-beatles-prises-par-paul-mc-cartney-publiees-avant-une-exposition-a-londres_AD-202303300268.html"
