"premium","picture","title","url"
"False","True","DIRECT. Retraites : « Le vote du Sénat sur l’âge de départ ne change rien », pour Philippe Martinez","https://www.ouest-france.fr/economie/retraites/direct-reforme-des-retraites-manifestations-de-lyceens-et-detudiants-greves-debat-au-senat-55368a7a-bdd1-11ed-b928-590434b4ed14"
"False","True","Guerre en Ukraine : Kharkiv, Kiev, Odessa, Zaporijjia… Des frappes massives russes dans tout le pays","https://www.ouest-france.fr/monde/guerre-en-ukraine/guerre-en-ukraine-kharkiv-kiev-odessa-des-frappes-massives-russes-recensees-dans-tout-le-pays-7d89434b-7fcc-44c0-82ea-668ad83ba1c0"
"False","True","Géorgie. Le gouvernement retire le projet de loi ayant provoqué des manifestations","https://www.ouest-france.fr/europe/georgie/georgie-le-projet-de-loi-ayant-provoque-des-manifestations-est-retire-par-le-gouvernement-ab1dd34a-be48-11ed-9958-ce650855cbcb"
"False","True","Équipe de France féminine. Qu’attendre du Comex de la FFF concernant l’avenir de Corinne Diacre","https://www.ouest-france.fr/sport/football/equipe-de-france-feminine/equipe-de-france-feminine-quattendre-du-comex-de-la-fff-concernant-lavenir-de-corinne-diacre-3137326a-bdb7-11ed-b928-590434b4ed14"
"False","True","Sécurité routière : stationner sur un trottoir, est-ce systématiquement interdit ? On vous répond","https://www.ouest-france.fr/societe/securite-routiere/securite-routiere-stationner-sur-un-trottoir-est-ce-systematiquement-interdit-on-vous-repond-469909dc-bcf2-11ed-95d7-ae0463183236"
"True","True","RÉCIT. Baptiste et Théo ont sauvé deux fois la vie d’un homme, ils racontent","https://www.ouest-france.fr/pays-de-la-loire/loire-atlantique/recit-baptiste-et-theo-ont-sauve-deux-fois-la-vie-dun-homme-ils-racontent-0196403e-bd0b-11ed-95d7-ae0463183236"
"False","True","Réforme des retraites : le Sénat adopte l’article 7 reportant l’âge de départ à 64 ans","https://www.ouest-france.fr/economie/retraites/reforme-des-retraites-le-senat-adopte-larticle-7-reportant-lage-de-depart-a-64-ans-c204095c-bdb8-11ed-b928-590434b4ed14"
"False","True","Le chanteur Marcel Amont est décédé à l’âge de 93 ans","https://www.ouest-france.fr/necrologie/le-chanteur-marcel-amont-est-decede-a-l-age-de-93-ans-c8432d32-3398-4b8c-8ed8-0cb5033d2354"
"False","False","Bayern – PSG. « Notre maximum, c’est ça… » : Mbappé pointe les manques, l’avenir reste à écrire","https://www.ouest-france.fr/sport/football/paris-sg/bayern-psg-notre-maximum-cest-ca-mbappe-pointe-les-manques-lavenir-reste-a-ecrire-9c771de4-be46-11ed-9958-ce650855cbcb"
"False","False","Trois mois après, le « Qatargate » continue de faire vaciller le Parlement européen","https://www.ouest-france.fr/europe/ue/trois-mois-apres-le-qatargate-continue-de-faire-vaciller-le-parlement-europeen-6d73cac0-b9d1-11ed-b868-af5e53e878b5"
"False","False","Grève du 9 mars. Fortes perturbations sur le réseau SNCF : voici les dernières prévisions","https://www.ouest-france.fr/economie/retraites/greve-du-9-mars-fortes-perturbations-sur-le-reseau-sncf-voici-les-dernieres-previsions-a0968c44-bdd7-11ed-9686-95dc855e99ea"
"False","True","La cambrioleuse tente d'entrer par la cheminée, elle se retrouve bloquée dans le conduit","https://www.francelive.fr/article/france-live/la-cambrioleuse-tente-d-entrer-par-la-cheminee-elle-se-retrouve-bloquee-dans-le-conduit-7909894/"
"False","False","Trois Palestiniens tués par les forces israéliennes en Cisjordanie","https://www.ouest-france.fr/monde/palestine/trois-palestiniens-tues-par-les-forces-israeliennes-en-cisjordanie-08fd7a9c-be4e-11ed-9958-ce650855cbcb"
"False","False","Fausse couche : les députés votent à l'unanimité pour une meilleure prise en charge des femmes","https://www.ouest-france.fr/sante/grossesse/fausse-couche-les-deputes-votent-a-l-unanimite-pour-une-meilleure-prise-en-charge-des-femmes-83db41af-8579-457a-97c7-fda2a68e0c9b"
"False","True","DIRECT. Retraites : « Le vote du Sénat sur l’âge de départ ne change rien », pour Philippe Martinez","https://www.ouest-france.fr/economie/retraites/direct-reforme-des-retraites-manifestations-de-lyceens-et-detudiants-greves-debat-au-senat-55368a7a-bdd1-11ed-b928-590434b4ed14"
"False","True","Réforme des retraites : le Sénat adopte l’article 7 reportant l’âge de départ à 64 ans","https://www.ouest-france.fr/economie/retraites/reforme-des-retraites-le-senat-adopte-larticle-7-reportant-lage-de-depart-a-64-ans-c204095c-bdb8-11ed-b928-590434b4ed14"
"False","True","Retraites : le Sénat examine l’article 7 sur le recul de l’âge légal de départ à 64 ans","https://www.ouest-france.fr/economie/retraites/direct-reforme-des-retraites-greve-du-8-mars-suivez-la-nouvelle-journee-de-mobilisation-en-france-033fe5a2-bd6f-11ed-9686-95dc855e99ea"
"False","True","EN IMAGES. Droit des femmes : un 8-Mars sous le signe de la lutte contre la réforme des retraites","https://www.ouest-france.fr/economie/retraites/en-images-droit-des-femmes-un-8-mars-sous-le-signe-de-la-lutte-contre-la-reforme-des-retraites-3e89b9a4-bddc-11ed-b928-590434b4ed14"
"False","True","CARTE. Réforme des retraites : à chaque manifestation, le grand écart entre police et syndicats","https://www.ouest-france.fr/economie/retraites/carte-reforme-des-retraites-a-chaque-manifestation-le-grand-ecart-entre-police-et-syndicats-7f688b16-bdd3-11ed-b928-590434b4ed14"
"False","True","ÉDITORIAL. Internet à la Cour suprême","https://www.ouest-france.fr/high-tech/internet/editorial-internet-a-la-cour-supreme-5930b9ec-bdbe-11ed-b928-590434b4ed14"
"False","True","Combien de m² peut-on acheter dans le monde avec près d’un million d’euros ?","https://www.ouest-france.fr/leditiondusoir/2023-03-08/combien-de-m-peut-on-acheter-dans-le-monde-avec-pres-d-un-million-d-euros-ba34db0c-d2b2-42a0-bbad-79a996389fa0"
"True","True","« Maman elle est méchante » : un enfant dénonce les violences de sa mère, elle est condamnée","https://www.ouest-france.fr/faits-divers/violences/maman-elle-est-mechante-un-enfant-denonce-les-violences-de-sa-mere-elle-est-condamnee-852898ce-bdd9-11ed-a169-71a0918e8282"
"False","True","Paul Anselin, maire de Ploërmel de 1977 à 2008, est décédé à l’âge de 91 ans","https://www.ouest-france.fr/bretagne/ploermel-56800/paul-anselin-maire-de-ploermel-de-1977-a-2008-est-decede-a-lage-de-91-ans-fe8ad0cc-8c4e-11ed-9fb2-0b86ee40425f"
"True","True","REPORTAGE. Comment le label Agriculture biologique (AB) est-il contrôlé ?","https://www.ouest-france.fr/economie/agriculture/agriculture-biologique/reportage-comment-le-label-agriculture-biologique-ab-est-il-controle-182e4704-b39e-11ed-84bc-d9a7b26c7afb"
"True","True","« À part la rage, je ne me souviens pas » : il est jugé pour le meurtre de son revendeur d’héroïne","https://www.ouest-france.fr/bretagne/loudeac-22600/meurtre-de-loudeac-en-2020-un-revendeur-dheroine-tue-de-55-coups-de-couteau-pour-des-insultes-266d34a4-bdd7-11ed-b928-590434b4ed14"
"False","True","À 81 ans, DJ Gérard est le roi du dancefloor en Normandie","https://www.ouest-france.fr/leditiondusoir/2023-03-08/a-81-ans-dj-gerard-est-le-roi-du-dancefloor-en-normandie-d5114833-e156-4051-98ba-d1e1134e3374"
"False","True","Accident du travail. Un couvreur de 60 ans décède dans le Calvados après une chute de 6 mètres","https://www.ouest-france.fr/societe/faits-divers/accident-du-travail-un-couvreur-de-60-ans-decede-a-lisieux-apres-une-chute-de-6-metres-f2154c30-bdd3-11ed-b928-590434b4ed14"
"True","True","Dans le Calvados, un patron force un piquet de grève et s’asperge d’essence","https://www.ouest-france.fr/economie/greve/greve-du-8-mars-dans-le-calvados-un-patron-force-un-barrage-et-asperge-son-entreprise-dessence-85016d8e-bd8f-11ed-b928-590434b4ed14"
"True","True","10 ans de la tempête de neige dans le Calvados. Naufragés, pompiers et climatologue se souviennent","https://www.ouest-france.fr/meteo/neige/10-ans-de-la-tempete-de-neige-dans-le-calvados-naufrages-pompiers-et-climatologue-se-souviennent-7d6b01d6-bda6-11ed-b928-590434b4ed14"
"True","True","Verbalisée pour stationnement non payé à Paris, elle faisait ce jour-là de la broderie en Sarthe","https://www.ouest-france.fr/pays-de-la-loire/le-mans-72000/verbalisee-pour-stationnement-non-paye-a-paris-elle-faisait-ce-jour-la-de-la-broderie-en-sarthe-b39d9226-b28b-11ed-9424-745bc29e29f2"
"True","True","« La situation s’aplanit » : après le boom, Neomouv note un ralentissement de la demande de vélos","https://www.ouest-france.fr/economie/la-situation-saplanit-apres-le-boom-neomouv-note-un-ralentissement-de-la-demande-de-velos-89a19430-bd9f-11ed-b928-590434b4ed14"
"True","True","«On a cru que la télé implosait» : près de Nantes, la maison de Danielle et Raymond a pris la foudre","https://www.ouest-france.fr/pays-de-la-loire/nantes-44000/coueron-on-a-cru-que-la-tele-implosait-la-maison-de-danielle-et-raymond-a-pris-la-foudre-f266c3d0-bdd3-11ed-b928-590434b4ed14"
"True","True","TÉMOIGNAGE. « Notre fils Raphaël est atteint de troubles du comportement, on n’y arrive plus »","https://www.ouest-france.fr/pays-de-la-loire/le-mans-72000/temoignage-souffrant-de-troubles-severes-du-comportement-notre-fils-raphael-a-besoin-daide-10c91552-ae17-11ed-a7fa-81e9d82a996b"
"False","True","Guerre en Ukraine : Kharkiv, Kiev, Odessa, Zaporijjia… Des frappes massives russes dans tout le pays","https://www.ouest-france.fr/monde/guerre-en-ukraine/guerre-en-ukraine-kharkiv-kiev-odessa-des-frappes-massives-russes-recensees-dans-tout-le-pays-7d89434b-7fcc-44c0-82ea-668ad83ba1c0"
"False","True","Guerre en Ukraine. Frappes massives sur le pays, hommages aux combattantes... Le point sur la nuit","https://www.ouest-france.fr/monde/guerre-en-ukraine/guerre-en-ukraine-frappes-massives-sur-le-pays-hommages-aux-combattantes-le-point-sur-la-nuit-e946b4ec-dd22-432d-9c33-f7e90721145c"
"False","True","CARTE. Guerre en Ukraine : Bakhmout un peu plus sous pression russe, Nord Stream… Le point du jour","https://www.ouest-france.fr/monde/guerre-en-ukraine/carte-guerre-en-ukraine-bakhmout-un-peu-plus-sous-pression-russe-nord-stream-le-point-du-jour-8375ea4e-bdd5-11ed-b928-590434b4ed14"
"False","True","En Géorgie, les pro-Européens voient rouge face à la « loi russe » sur les « agents de l’étranger »","https://www.ouest-france.fr/europe/georgie/georgie-face-a-la-loi-russe-les-opposants-voient-rouge-df13820a-bdc9-11ed-b928-590434b4ed14"
"False","True","Guerre en Ukraine : la justice annule les sanctions de Bruxelles contre la mère du chef de Wagner","https://www.ouest-france.fr/monde/guerre-en-ukraine/guerre-en-ukraine-la-justice-annule-les-sanctions-de-bruxelles-contre-la-mere-du-chef-de-wagner-4ea2ce8a-bdd1-11ed-b928-590434b4ed14"
"False","True","Handball. Fin de saison pour Hugo Descat, victime d’une rupture des ligaments croisés","https://www.ouest-france.fr/sport/handball/handball-fin-de-saison-pour-hugo-descat-victime-dune-rupture-des-ligaments-croises-f2fda416-be47-11ed-9958-ce650855cbcb"
"False","False","La CGT et Enedis s’accusent mutuellement après une coupure de courant dans une clinique d’Albi","https://www.ouest-france.fr/region-occitanie/albi-81000/la-cgt-et-enedis-saccusent-mutuellement-apres-une-coupure-de-courant-dans-une-clinique-dalbi-02aacef6-bdcc-11ed-a169-71a0918e8282"
"False","False","Envie de vous régaler gratuitement ? Cette biscuiterie vous propose de tester ses nouveaux gâteaux","https://www.ouest-france.fr/region-occitanie/lunel-34400/envie-de-vous-regaler-gratuitement-cette-biscuiterie-vous-propose-de-tester-ses-nouveaux-gateaux-5e5a880a-bdc6-11ed-a169-71a0918e8282"
"False","True","À la découverte des plus vieux métros du monde","https://www.ouest-france.fr/economie/tourisme/a-la-decouverte-des-plus-vieux-metros-du-monde-c13923a0-bdcb-11ed-a169-71a0918e8282"
"False","False","Quel temps est prévu à Paris et ses environs le jeudi 9 mars 2023 ?","https://www.ouest-france.fr/meteo/ile-de-france/paris-75000/la-meteo-du-jour-a-paris-83d9cde9-a6ac-599d-9c33-525443f2e20f"
"True","False","Verbalisée pour stationnement non payé à Paris, elle faisait ce jour-là de la broderie en Sarthe","https://www.ouest-france.fr/pays-de-la-loire/le-mans-72000/verbalisee-pour-stationnement-non-paye-a-paris-elle-faisait-ce-jour-la-de-la-broderie-en-sarthe-b39d9226-b28b-11ed-9424-745bc29e29f2"
"False","True","La météo du jeudi 9 mars 2023 à Toulon et ses environs","https://www.ouest-france.fr/meteo/provence-alpes-cote-dazur/toulon-83000/la-meteo-du-jour-a-toulon-394fa7ef-f21e-5575-94d5-3413996e6a3d"
"False","False","Meurtre de Salomé à Cagnes-sur-Mer : la perpétuité réclamée contre l’accusé aux assises","https://www.ouest-france.fr/faits-divers/feminicide/meurtre-de-salome-a-cagnes-sur-mer-la-perpetuite-reclamee-contre-laccuse-aux-assises-9e8531a6-bde8-11ed-b928-590434b4ed14"
"False","False","Deux capitaines de bateau condamnés lourdement pour avoir pollué la mer Méditerranée","https://www.ouest-france.fr/provence-alpes-cote-dazur/marseille-13000/deux-capitaines-de-bateau-condamnes-lourdement-pour-avoir-pollue-la-mer-mediterranee-85b9cf32-bdcb-11ed-a169-71a0918e8282"
"False","True","Meurtres de Leslie et Kevin : le procureur de Poitiers confirme le décès du couple","https://www.ouest-france.fr/faits-divers/disparition/direct-disparition-de-leslie-et-kevin-suivez-la-conference-de-presse-du-procureur-de-poitiers-92f212e6-bce4-11ed-95d7-ae0463183236"
"False","False","Disparition dans les Deux-Sèvres : les corps retrouvés sont bien ceux de Leslie et de Kevin","https://www.ouest-france.fr/societe/faits-divers/disparition-dans-les-deux-sevres-les-corps-retrouves-sont-bien-ceux-de-leslie-et-de-kevin-23822592-bbfc-11ed-93e6-c3ff03e7738c"
"False","False","Gironde. Deux cyclistes percutent un tracteur, l’un d’eux meurt sur le coup","https://www.ouest-france.fr/nouvelle-aquitaine/pauillac-33250/gironde-deux-cyclistes-percutent-un-tracteur-lun-deux-meurt-sur-le-coup-a187e4c6-bcd4-11ed-86f0-113d84cb2dd2"
