"premium","picture","title","url"
"False","False","Guerre en Ukraine","https://www.bfmtv.com/international/europe/ukraine-russie-le-bras-de-fer-mondial_DN-201904150203.html"
"False","False","Mort de Tina Turner","https://www.bfmtv.com/people/musique/mort-de-tina-turner_DN-202305240926.html"
"False","False","Festival de Cannes","https://www.bfmtv.com/people/festival-de-cannes_DN-202108310628.html"
"False","False","Réforme des retraites","https://www.bfmtv.com/economie/economie-social/reforme-des-retraites_DN-202108310622.html"
"False","True","Ce que l'on sait après la découverte du corps dénudé d'une femme dans le Morbihan","https://www.bfmtv.com/police-justice/ce-que-l-on-sait-apres-la-decouverte-du-corps-denude-d-une-femme-dans-le-morbihan_AV-202305280383.html"
"False","False","Morbihan: une personne en garde à vue après la découverte du corps dénudé d'une femme","https://www.bfmtv.com/police-justice/morbihan-une-personne-en-garde-a-vue-apres-la-decouverte-du-corps-sans-vie-d-une-femme_AN-202305280353.html"
"False","True","Retraites: une semaine à enjeux pour l'abrogation de la réforme","https://www.bfmtv.com/politique/parlement/retraites-une-semaine-a-enjeux-pour-l-abrogation-de-la-reforme_AN-202305290282.html"
"False","True","Chômé, travaillé, payé? Le casse-tête des salariés autour du lundi de Pentecôte","https://www.bfmtv.com/economie/emploi/chome-travaille-paye-le-casse-tete-des-salaries-autour-du-lundi-de-pentecote_AV-202305290202.html"
"False","True","""Ce n'est pas la vie que je veux"": pourquoi le CDI n'est plus le Graal de la génération Z","https://www.bfmtv.com/economie/emploi/ce-n-est-pas-la-vie-que-je-veux-pourquoi-le-cdi-n-est-plus-le-graal-de-la-generation-z_AN-202305290027.html"
"False","True","Après Parcoursup, pourquoi la course aux logements étudiants s'annonce tendue cet été","https://www.bfmtv.com/immobilier/apres-parcoursup-pourquoi-la-course-aux-logements-etudiants-s-annonce-tendue-cet-ete_AN-202305290032.html"
"False","True","Hôtellerie-restauration: Thierry Marx lance la plateforme ""monCVnum'"" pour faciliter le recrutement","https://www.bfmtv.com/economie/entreprises/hotellerie-restauration-thierry-marx-lance-la-plateforme-mon-cvnum-pour-faciliter-le-recrutement_AN-202305290034.html"
"False","True","Une adolescente de 12 ans meurt noyée entre l'Isère et la Savoie, aspirée par des tourbillons","https://www.bfmtv.com/police-justice/une-adolescente-de-12-ans-meurt-noyee-entre-l-isere-et-la-savoie-aspiree-par-des-tourbillons_AN-202305290033.html"
"False","True","Réélu président, Recep Tayyip Erdogan appelle la Turquie ""à l'unité et à la solidarité""","https://www.bfmtv.com/international/moyen-orient/turquie/reelu-president-recep-tayyip-erdogan-appelle-la-turquie-a-l-unite-et-a-la-solidarite_AD-202305280407.html"
"False","False","Erdogan réélu en Turquie: Vladimir Poutine le félicite pour sa victoire, Volodymyr…","https://www.bfmtv.com/international/moyen-orient/turquie/erdogan-reelu-en-turquie-vladimir-poutine-le-felicite-pour-sa-victoire-volodymyr-zelensky-aussi_AD-202305280393.html"
"False","True","Guerre en Ukraine: Kiev de nouveau frappée par des drones et des missiles cette nuit","https://www.bfmtv.com/international/europe/ukraine/guerre-en-ukraine-kiev-de-nouveau-frappee-par-des-drones-et-des-missiles-cette-nuit_AD-202305290031.html"
"False","True","Le pèlerinage de Chartres enregistre une affluence record pour la Pentecôte","https://www.bfmtv.com/societe/religions/le-pelerinage-de-chartres-enregistre-une-affluence-record-pour-la-pentecote_AV-202305290267.html"
"False","True","Triple homicide à Dreux: la garde à vue de l'ex-conjoint prolongée, le suspect se dit ""étranger"" aux faits","https://www.bfmtv.com/police-justice/triple-homicide-a-dreux-la-garde-a-vue-de-l-ex-conjoint-prolongee-le-suspect-se-dit-etranger-aux-faits_AN-202305280285.html"
"False","True","Ce gouvernement finira par être renversé. Charles de Courson","https://www.bfmtv.com/politique/ce-gouvernement-finira-par-etre-renverse-met-en-garde-charles-de-courson_AN-202305280309.html"
"False","True","Plus de 1,6 tonne de déchets plastiques découverts sur l'Himalaya lors d'une expédition","https://www.bfmtv.com/environnement/plus-de-1-6-tonne-de-dechets-plastiques-decouverts-sur-l-himalaya-lors-d-une-expedition_AD-202305290089.html"
"False","True","Traité contre la pollution du plastique: les négociateurs entrent dans le vif du sujet","https://www.bfmtv.com/economie/economie-social/france/traite-contre-la-pollution-du-plastique-les-negociateurs-entrent-dans-le-vif-du-sujet_AD-202305290042.html"
"False","True","Mercato: ""Je vais honorer mon contrat"", Mbappé assure qu’il sera au PSG la saison prochaine","https://rmcsport.bfmtv.com/football/clubs/paris-saint-germain/mercato-je-vais-honorer-mon-contrat-mbappe-assure-qu-il-sera-au-psg-la-saison-prochaine_AV-202305280404.html"
"False","True","Roland-Garros: Marseillaise, communion avec le public... Pouille savoure après des ""moments de craquage""","https://rmcsport.bfmtv.com/tennis/roland-garros/roland-garros-marseillaise-communion-avec-le-public-pouille-savoure-apres-des-moments-de-craquage_AV-202305290219.html"
"False","True","Mariés, invités, politiques... 10 ans après le premier mariage pour tous, ils racontent les coulisses","https://www.bfmtv.com/societe/maries-invites-politiques-10-ans-apres-le-premier-mariage-pour-tous-ils-racontent-les-coulisses_GN-202305260040.html"
"False","True","Covid: des scientifiques dénoncent la prescription d'hydroxychloroquine et visent Didier Raoult","https://www.bfmtv.com/sante/covid-des-scientifiques-denoncent-la-prescription-d-hydroxychloroquine-a-plus-de-30-000-patients-et-visent-didier-raoult_AN-202305280213.html"
"False","True","Élections municipales et régionales en Espagne: net recul des socialistes, la droite progresse","https://www.bfmtv.com/international/europe/espagne/elections-municipales-et-regionales-en-espagne-net-recul-des-socialistes-la-droite-progresse_AD-202305280416.html"
"False","True","Italie: trois morts et une personne encore recherchée après le naufrage d'un bateau sur le lac Majeur","https://www.bfmtv.com/international/europe/italie/italie-trois-morts-et-une-personne-encore-recherchee-apres-le-naufrage-d-un-bateau-sur-le-lac-majeur_AN-202305290233.html"
"False","True","Mariés, invités, politiques... 10 ans après le premier mariage pour tous, ils racontent…","https://www.bfmtv.com/societe/maries-invites-politiques-10-ans-apres-le-premier-mariage-pour-tous-ils-racontent-les-coulisses_GN-202305260040.html"
"False","True","""Ce n'est pas la vie que je veux"": pourquoi le CDI n'est plus le Graal de la génération Z","https://www.bfmtv.com/economie/emploi/ce-n-est-pas-la-vie-que-je-veux-pourquoi-le-cdi-n-est-plus-le-graal-de-la-generation-z_AN-202305290027.html"
"False","True","Qui est Justine Triet, troisième femme à décrocher une Palme d'or à Cannes?","https://www.bfmtv.com/people/cinema/qui-est-justine-triet-troisieme-femme-a-decrocher-une-palme-d-or-a-cannes_AD-202305270429.html"
"False","True","Accès des mineurs à la pornographie: comment aborder le sujet avec son enfant?","https://www.bfmtv.com/societe/acces-des-mineurs-a-la-pornographie-comment-aborder-le-sujet-avec-son-enfant_AN-202305270040.html"
"False","True","Netflix met fin au partage de compte: les réponses aux questions que vous vous posez","https://www.bfmtv.com/tech/netflix/netflix-met-fin-au-partage-de-compte-les-reponses-aux-questions-que-vous-vous-posez_AV-202305270038.html"
"False","True","Aérien: le C919 du chinois Comac représente-t-il une menace pour Airbus et Boeing?","https://www.bfmtv.com/economie/entreprises/transports/aerien-le-c919-du-chinois-comac-represente-t-il-une-menace-pour-airbus-et-boeing_AV-202305290264.html"
"False","True","Chine: premier vol commercial du C919","https://www.bfmtv.com/economie/chine-premier-vol-commercial-du-c919_VN-202305290254.html"
"False","True","Le secteur de la restauration et de l'hôtellerie toujours en manque de bras","https://www.bfmtv.com/economie/le-secteur-de-la-restauration-et-de-l-hotellerie-toujours-en-manque-de-bras_VN-202305290238.html"
"False","True","Inflation, monnaie, emploi: quelle situation économique en Turquie?","https://www.bfmtv.com/economie/inflation-monnaie-emploi-quelle-situation-economique-en-turquie_VN-202305290226.html"
"False","True","7 MINUTES POUR COMPRENDRE - Les chiffres inquiétants de la crise immobilière","https://www.bfmtv.com/replay-emissions/focus-premiere/7-minutes-pour-comprendre-les-chiffres-inquietants-de-la-crise-immobiliere_VN-202305290220.html"
"False","True","EN DIRECT - Roland-Garros: suivez la deuxième journée en live, avec Djokovic, Alcaraz et Garcia","https://rmcsport.bfmtv.com/tennis/roland-garros/en-direct-roland-garros-suivez-la-deuxieme-journee-en-live-avec-djokovic-alcaraz-et-garcia_LN-202305290157.html"
"False","True","Mercato: ""Je vais honorer mon contrat"", Mbappé assure qu’il sera au PSG la saison prochaine","https://rmcsport.bfmtv.com/football/clubs/paris-saint-germain/mercato-je-vais-honorer-mon-contrat-mbappe-assure-qu-il-sera-au-psg-la-saison-prochaine_AV-202305280404.html"
"False","True","Lens: la réponse évasive de Franck Haise sur son avenir","https://rmcsport.bfmtv.com/football/transferts/lens-la-reponse-evasive-de-franck-haise-sur-son-avenir_AV-202305290094.html"
"False","True","F1 : le retour d’un Grand Prix de France à l’étude","https://rmcsport.bfmtv.com/auto-moto/f1/f1-le-retour-d-un-grand-prix-de-france-a-l-etude_AV-202305280418.html"
"False","True","PSG: ce que l’on sait de l'état préoccupant de Sergio Rico et des circonstances de son grave accident","https://rmcsport.bfmtv.com/football/ligue-1/psg-ce-que-l-on-sait-de-l-etat-preoccupant-de-sergio-rico-et-des-circonstances-de-son-grave-accident_AV-202305280384.html"
"False","True","25 ans de ""Harry Potter"" : l'histoire des illustrations d'origine, qui reparaissent en librairie","https://www.bfmtv.com/culture/harry-potter-l-histoire-des-illustrations-d-origine-qui-reparaissent-en-librairie_GN-202301190278.html"
"False","True","Ligne rouge - Bac Nord, ils parlent enfin","https://www.bfmtv.com/police-justice/ligne-rouge-bac-nord-ils-parlent-enfin_GN-202301160707.html"
"False","True","Les intelligences artificielles vont-elles remplacer les artistes ?","https://www.bfmtv.com/tech/les-intelligences-artificielles-vont-elles-remplacer-les-artistes_GN-202301120101.html"
"False","True","100 ans de la fondation de l'URSS : comment Poutine mobile le passé soviétique contre l'Ukraine","https://www.bfmtv.com/international/asie/russie/100-ans-de-la-fondation-de-l-urss-comment-poutine-mobilise-le-passe-sovietique-contre-l-ukraine_GN-202212300003.html"
"False","True","Une demande en hausse mais une production en baisse : le café survivra-t-il à sa popularité ?","https://www.bfmtv.com/economie/une-demande-en-hausse-mais-une-production-en-baisse-le-cafe-survivra-t-il-a-sa-popularite_GN-202212270016.html"
"False","True","Affaires Jubillar, Daval, le Tan...la reconstitution ""moment clé"" d'une enquête criminelle","https://www.bfmtv.com/police-justice/affaires-jubillar-daval-le-tan-la-reconstitution-moment-cle-d-une-enquete-criminelle_GN-202212130035.html"
"False","True","Aya Nakamura invite SDM et Damso sur scène pour clôturer ses trois concerts à l'Accor Arena","https://www.bfmtv.com/people/musique/aya-nakamura-invite-sdm-et-damso-sur-scene-pour-cloturer-ses-trois-concerts-a-l-accor-arena_AN-202305290269.html"
"False","True","Au Chili, Dark Vador ""condamné"" à l'issue d'un procès pédagogique","https://www.bfmtv.com/people/cinema/au-chili-dark-vador-condamne-a-l-issue-d-un-proces-pedagogique_AD-202305290175.html"
"False","True","À Paris, un week-end de show entre Beyonce et Aya Nakamura","https://www.bfmtv.com/people/a-paris-un-week-end-de-show-entre-beyonce-et-aya-nakamura_VN-202305290111.html"
