"premium","picture","title","url"
"True","True","Dans les services des urgences, une crise qui s’éternise et des soignants qui s’épuisent","https://www.lemonde.fr/societe/article/2023/05/07/dans-les-services-des-urgences-une-crise-qui-s-eternise-et-des-soignants-qui-s-epuisent_6172399_3224.html"
"True","False","Aux urgences de Rennes engorgées : « Un tiers des patients étaient déjà là hier quand j’ai fini ma journée »","https://www.lemonde.fr/societe/article/2023/05/07/aux-urgences-de-rennes-engorgees-un-tiers-des-patients-etaient-deja-la-hier-quand-j-ai-fini-ma-journee_6172402_3224.html"
"False","False","Temps de travail des internes en médecine : François Braun reconnaît un « problème ancien »","https://www.lemonde.fr/societe/article/2023/05/03/temps-de-travail-des-internes-en-medecine-francois-braun-reconnait-un-probleme-ancien_6171907_3224.html"
"False","True","Aux Etats-Unis, un tireur tue 8 personnes et en blesse 7 dans un centre commercial du Texas","https://www.lemonde.fr/international/article/2023/05/07/etats-unis-une-fusillade-dans-un-centre-commercial-au-texas-fait-au-moins-9-morts-et-7-blesses_6172381_3210.html"
"True","True","Thomas Piketty : « Les économistes commencent à prendre conscience du caractère insoutenable du modèle social et fiscal actuel »","https://www.lemonde.fr/idees/article/2023/05/07/thomas-piketty-les-economistes-commencent-a-prendre-conscience-du-caractere-insoutenable-du-modele-social-et-fiscal-actuel_6172385_3232.html"
"True","True","Le retour du Liban sous l’emprise des Assad","https://www.lemonde.fr/un-si-proche-orient/article/2023/05/07/le-retour-du-liban-sous-l-emprise-des-assad_6172400_6116995.html"
"False","True","Pour protéger les mineurs de la pornographie en ligne, le gouvernement veut renforcer les pouvoirs de l’Arcom","https://www.lemonde.fr/pixels/article/2023/05/07/pornographie-en-ligne-le-gouvernement-veut-renforcer-les-pouvoirs-de-l-arcom-pour-proteger-les-mineurs_6172411_4408996.html"
"True","True","Le point de vue masculin sur la sexualité fait sa loi, bonjour les dégâts !","https://www.lemonde.fr/m-perso/article/2023/05/07/le-point-de-vue-masculin-sur-la-sexualite-fait-sa-loi-bonjour-les-degats_6172380_4497916.html"
"True","True","François Bayrou, l’allié d’Emmanuel Macron qui se rêve en héritier","https://www.lemonde.fr/politique/article/2023/05/07/francois-bayrou-l-allie-d-emmanuel-macron-qui-se-reve-en-heritier_6172395_823448.html"
"True","True","Guerre en Ukraine : à la suite des évacuations à Zaporijia, l’AIEA appelle à « empêcher un grave accident nucléaire »","https://www.lemonde.fr/international/live/2023/05/07/guerre-en-ukraine-en-direct-a-la-suite-des-evacuations-a-zaporijia-l-aiea-appelle-a-empecher-un-grave-accident-nucleaire_6172391_3210.html"
"True","True","Charles III : récit d’un couronnement historique sous une pluie britannique, entre grand spectacle et manifestants vite escamotés","https://www.lemonde.fr/international/article/2023/05/07/couronnement-de-charles-iii-recit-d-une-journee-historique-sous-une-pluie-parfaitement-britannique-entre-grand-spectacle-et-manifestants-vite-escamotes_6172376_3210.html"
"True","True","« Le racisme anti-asiatique était très présent à l’école, on me disait que j’étais chinois et que je devais être fort en arts martiaux »","https://www.lemonde.fr/campus/article/2023/05/07/le-racisme-anti-asiatique-etait-tres-present-a-l-ecole-on-me-disait-que-j-etais-chinois-et-que-je-devais-etre-fort-en-arts-martiaux_6172384_4401467.html"
"False","True","Au Canada, une centaine de feux de forêt dans l’Alberta conduisent à l’évacuation de 25 000 personnes","https://www.lemonde.fr/international/article/2023/05/07/au-canada-une-centaine-de-feux-de-foret-dans-l-alberta-conduisent-a-l-evacuation-de-25-000-personnes_6172405_3210.html"
"True","False","JO 2024 : deuxième phase de vente des billets, « le rêve olympique au coin de la rue »","https://www.lemonde.fr/sport/article/2023/05/07/jo-2024-deuxieme-phase-de-vente-des-billets-le-reve-olympique-au-coin-de-la-rue_6172398_3242.html"
"False","False","Le Vietnam enregistre une température record de 44,1 °C","https://www.lemonde.fr/climat/article/2023/05/07/vietnam-une-temperature-record-de-44-1-c-enregistree-dans-le-pays_6172413_1652612.html"
"False","False","Sur l’immigration, les députés LR Aurélien Pradié et Pierre Henri-Dumont appellent à un référendum d’initiative partagée","https://www.lemonde.fr/politique/article/2023/05/07/des-deputes-lr-appellent-a-un-referendum-d-initiative-partagee-sur-l-immigration_6172375_823448.html"
"True","False","« Dans les outre-mer, la colonisation française a laissé une empreinte durable et des séquelles profondes »","https://www.lemonde.fr/idees/article/2023/05/07/dans-les-outre-mer-la-colonisation-francaise-a-laisse-une-empreinte-durable-et-des-sequelles-profondes_6172388_3232.html"
"True","False","Matières premières : « La fraise ramène sa framboise »","https://www.lemonde.fr/economie/article/2023/05/07/matieres-premieres-la-fraise-ramene-sa-framboise_6172409_3234.html"
"False","False","Impôt sur la fortune immobilière : le PER compte-t-il ?","https://www.lemonde.fr/argent/article/2023/05/07/impot-sur-la-fortune-immobiliere-le-per-compte-t-il_6172379_1657007.html"
"False","False","« La formule 1 peut devenir numéro un aux Etats-Unis d’ici cinq ans », assure Günther Steiner","https://www.lemonde.fr/sport/article/2023/05/07/la-formule-1-peut-devenir-numero-un-aux-etats-unis-d-ici-cinq-ans-assure-gunther-steiner_6172408_3242.html"
"True","False","Le khatchapouri, galette star de la gastronomie géorgienne","https://www.lemonde.fr/le-monde-passe-a-table/article/2023/05/07/le-khatchapouri-galette-star-de-la-gastronomie-georgienne_6172382_6082232.html"
"True","True","L’Ukraine plonge la Russie dans le « brouillard de guerre » pour réussir sa contre-offensive","https://www.lemonde.fr/international/article/2023/05/06/l-ukraine-mise-sur-le-brouillard-pour-reussir-sa-contre-offensive_6172284_3210.html"
"True","True","Turquie : le vague à l’âme des ultranationalistes menace un peu plus les chances de réélection du président Erdogan","https://www.lemonde.fr/international/article/2023/05/06/turquie-le-vague-a-l-ame-des-ultranationalistes-menace-un-peu-plus-les-chances-de-reelection-du-president-erdogan_6172282_3210.html"
"True","True","Comment je me suis disputé : « Sans explication, je perds mon meilleur ami »","https://www.lemonde.fr/m-perso/article/2023/05/06/comment-je-me-suis-dispute-sans-explication-je-perds-mon-meilleur-ami_6172321_4497916.html"
"False","False","Covid-19 : un immense chantier de santé publique","https://www.lemonde.fr/idees/article/2023/05/06/covid-19-un-immense-chantier-de-sante-publique_6172311_3232.html"
"True","False","En Allemagne, l’angoisse monte face à la vague d’investissements industriels aux Etats-Unis et en Chine","https://www.lemonde.fr/economie/article/2023/05/05/en-allemagne-l-angoisse-monte-face-a-la-vague-d-investissements-industriels-aux-etats-unis-et-en-chine_6172179_3234.html"
"True","False","Retraite des artistes : « Il faut en finir avec les fantasmes de richesse qui collent à ce milieu »","https://www.lemonde.fr/idees/article/2023/05/05/retraite-des-artistes-il-faut-en-finir-avec-les-fantasmes-de-richesse-qui-collent-a-ce-milieu_6172187_3232.html"
