"premium","picture","title","url"
"False","True","Au tour de Griezmann de toucher le poteau... Les Bleus ronronnent...","https://www.20minutes.fr/sport/football/4041452-20230616-gibraltar-france-direct-bleus-veulent-tomber-facilite-suivez-match-partir-20h30"
"False","True","Moscou envoie des armes nucléaires en Biélorussie et recule sur le front sud","https://www.20minutes.fr/monde/ukraine/4041647-20230616-guerre-ukraine-moscou-envoie-armes-nucleaires-bielorussie-recule-front-sud"
"False","True","Pyramides, civilisation disparue… Pourquoi des théories farfelues séduisent toujours","https://www.20minutes.fr/societe/4041616-20230616-pyramides-civilisation-disparue-pourquoi-theories-farfelues-seduisent-toujours"
"False","True","La maison mère de Casino annonce un accord avec des créanciers","https://www.20minutes.fr/economie/4041691-20230616-casino-maison-mere-rallye-annonce-accord-certains-creanciers"
"False","True","De Bordeaux à Saint-Malo, un tremblement de terre secoue l’ouest de la France","https://www.20minutes.fr/societe/4041684-20230616-fille-crie-bordeaux-saint-malo-tremblement-terre-secoue-ouest-france"
"False","True","Lanceur d’alerte des « Pentagon Papers », Daniel Ellsberg est mort à 92 ans","https://www.20minutes.fr/societe/4041692-20230616-lanceur-alerte-pentagon-papers-daniel-ellsberg-mort-92-ans"
"False","True","Les coureurs entre tristesse et colère après le décès de Gino Mäder","https://www.20minutes.fr/sport/cyclisme/4041674-20230616-tour-suisse-coureurs-entre-tristesse-colere-apres-deces-gino-mader"
"False","True","Décès d’un salarié sur le chantier du bassin d’Austerlitz","https://www.20minutes.fr/paris/4041695-20230616-paris-deces-salarie-chantier-bassin-austerlitz"
"False","True","L'auteur de la pire attaque antisémite aux Etats-Unis risque la peine de mort","https://www.20minutes.fr/monde/4041688-20230616-etats-unis-coupable-meurtres-auteur-pire-attaque-antisemite-risque-peine-mort"
"False","True","Moscou envoie des armes nucléaires en Biélorussie au 478e jour de guerre","https://www.20minutes.fr/monde/ukraine/4041647-20230616-guerre-ukraine-moscou-envoie-armes-nucleaires-bielorussie-recule-front-sud"
"False","True","Moscou prépare des élections dans les zones occupées au 477e jour de guerre","https://www.20minutes.fr/monde/ukraine/4041484-20230615-guerre-ukraine-elections-vue-zones-occupees-situation-grave-centrale-zaporojie"
"False","True","Le joueur d’Arsenal Zinchenko, prêt à aller combattre pour l’Ukraine","https://www.20minutes.fr/sport/football/4041380-20230615-guerre-ukraine-joueur-arsenal-zinchenko-pret-aller-combat"
"False","True","Moscou bombarde à vue au 476e jour de guerre en Ukraine","https://www.20minutes.fr/monde/ukraine/4041290-20230614-guerre-ukraine-moscou-bombarde-vue-pays-recouvre-mines"
"False","True","20 Minutes TV : Shany’z présente ses deux émissions","https://www.20minutes.fr/videos/4041289-20230616-20-minutes-tv-shany-z-presente-region-fete-duplex-shany-z"
"False","True","Faut-il une interdiction de la corrida en France ?","https://www.20minutes.fr/planete/animaux/4041610-20230616-animaux-2-0-faut-interdiction-corrida-france"
"False","True","Donald Trump pourrait-il devenir président depuis une cellule de prison ?","https://www.20minutes.fr/monde/etats-unis/4041540-20230616-donald-trump-pourrait-devenir-president-condamne-prison"
"False","True","24 heures","https://www.20minutes.fr/diaporama/diaporama-4040857-images-miracle-colombie-mort-silvio-berlusconi-fin-tournoi-roland-garros"
"False","True","Ciao Silvio","https://www.20minutes.fr/diaporama/diaporama-4040836-images-ciao-silvio"
"False","True","En quoi la langue française est-elle sexiste ?","https://www.20minutes.fr/podcast/4041506-20230616-tout-sexplique-quoi-langue-francaise-sexiste"
"False","True","Comment se libérer du syndrome de l’imposteur ?","https://www.20minutes.fr/podcast/4041318-20230615-minute-papillon-comment-liberer-syndrome-imposteur"
"False","True","Dans les coulisses du service vidéo de « 20 Minutes »","https://www.20minutes.fr/podcast/4040917-20230613-minute-papillon-coulisses-service-video-20-minutes"
"False","True","Bonne Mère et Vélodrome, le programme du pape se précise","https://www.20minutes.fr/societe/4041653-20230616-marseille-bonne-mere-velodrome-programme-pape-francois-precise"
"False","True","Pour son centenaire, Disney fait du nouveau avec de l’ancien","https://www.20minutes.fr/cinema/4041654-20230616-festival-annecy-centenaire-disney-fait-nouveau-ancien"
"False","True","Plus de 10 % des 18-30 ans se disent « insomniaques », selon notre étude #MoiJeune","https://www.20minutes.fr/sante/4038475-20230616-12-18-30-ans-disent-insomniaques-selon-etude-moijeune"
"False","True","""On vous en dit plus"" par Noham Huclin","https://www.20minutes.tv/emission/on-vous-en-dit-plus-ile-de-france/"
"False","True","""Viens je t’emmène !"" par Nathalie Dartois","https://www.20minutes.tv/emission/viens-je-t-emmene/"
"False","True","""Salut l'Île-de-France"" par Olivier Quéméner","https://www.20minutes.tv/emission/salut-ile-de-france/"
"False","True","Le terrible dénouement de la disparition de Karine Esquivillon","https://www.20minutes.fr/faits_divers/4041676-20230616-meurtre-karine-escouvillon-terrible-denouement-disparition-mysterieuse"
"False","True","L’ancien chef de la police des polices anglaises inculpé pour viols sur mineure","https://www.20minutes.fr/monde/royaume-uni/4041682-20230616-royaume-uni-ancien-chef-police-polices-inculpe-viols-mineure"
"False","True","Le monde de la bouvine fait front contre les animalistes","https://www.20minutes.fr/planete/animaux/4041683-20230616-montpellier-monde-bouvine-fait-nouveau-front-contre-animalistes"
"False","True","A Nantes, 22 vols de colliers à l’arraché en un mois, deux interpellations","https://www.20minutes.fr/faits_divers/4041686-20230616-nantes-deux-interpellations-apres-vingtaine-vols-colliers-arrache-mois"
"False","True","Le terrible dénouement de la disparition mystérieuse de Karine Escouvillon","https://www.20minutes.fr/faits_divers/4041676-20230616-meurtre-karine-escouvillon-terrible-denouement-disparition-mysterieuse"
"False","True","A Marseille, un homme tué par arme à blanche à son domicile","https://www.20minutes.fr/faits_divers/faits-divers-marseille/4041671-20230616-marseille-homme-tue-arme-blanche-domicile"
"False","True","Localisé près de Niort, un tremblement de terre secoue la France","https://www.20minutes.fr/societe/4041684-20230616-fille-crie-bordeaux-saint-malo-tremblement-terre-secoue-ouest-france"
"False","True","Une lionne tue ses deux lionceaux après leur vaccin dans un zoo belge","https://www.20minutes.fr/faits_divers/4041519-20230615-belgique-lionne-tue-deux-lionceaux-apres-vaccin"
"False","True","Le mari de Karine Esquivillon mis en examen après ses aveux","https://www.20minutes.fr/faits_divers/4041542-20230616-disparition-karine-esquivillon-corps-retrouve-bois-gendarmes"
"False","True","Guerre en Ukraine : La Russie a livré de premières ogives nucléaires à la…","https://www.20minutes.fr/monde/ukraine/4041544-20230616-guerre-ukraine-direct-quatre-chefs-etat-africains-kiev-mediation-paix"
"False","True","Au moins 15 morts au Canada dans un accident de la route « horrifique »","https://www.20minutes.fr/monde/4041527-20230616-canada-moins-15-morts-accident-route-horrifique"
"False","True","Le tableau de Monet aspergé de peinture en Suède n’est pas endommagé","https://www.20minutes.fr/planete/4041500-20230615-tableau-monet-asperge-peinture-militantes-ecologistes-suede-endommage"
"False","True","Ce que l’on sait du naufrage d’un bateau de migrants au large de la Grèce","https://www.20minutes.fr/monde/grece/4041478-20230615-grece-sait-naufrage-bateau-migrants-fait-78-morts"
"False","True","Le cycliste Gino Mäder décède après sa chute sur le tour de Suisse","https://www.20minutes.fr/sport/cyclisme/4041609-20230616-cyclisme-equipe-bahrein-victorious-annonce-deces-gino-mader-apres-chute-tour-suisse"
"False","True","Karine Esquivillon retrouvée morte, naufrage en Grèce et Elon Musk à Paris","https://www.20minutes.fr/societe/4041543-20230616-heure-bim-karine-esquivillon-retrouvee-morte-naufrage-migrants-grece-elon-musk-paris"
"False","True","Sept millions en cocaïne saisis chez un plaisancier, en Bretagne","https://www.20minutes.fr/faits_divers/faits-divers-rennes/4041482-20230615-trafic-drogue-sept-millions-cocaine-saisis-chez-plaisancier-bretagne"
"False","True","Identifier les corps des soldats de la Première Guerre mondiale devient une priorité","https://www.20minutes.fr/societe/4041109-20230616-journees-archeologie-identifier-corps-soldats-premiere-guerre-mondiale-devient-priorite"
"False","True","Quand passer la nuit au camping du Hellfest devient rock'n'roll","https://www.20minutes.fr/societe/4041509-20230616-hellfest-2023-gars-tronconneuse-faudra-etre-bourre-trouver-sommeil-enfer-camping"
"False","True","Prison ferme pour le cyberharceleur de Tariq Ramadan","https://www.20minutes.fr/justice/4041677-20230616-bretagne-prison-ferme-interdiction-twitter-cyberharceleur-tariq-ramadan"
"False","True","Le suspect d’un cold case vieux de 19 ans mis en examen","https://www.20minutes.fr/faits_divers/4041665-20230616-finistere-suspect-cold-case-vieux-19-ans-mis-examen"
"False","True","L’accord sur l’écologie n’est que du « blabla » selon Sophie Binet","https://www.20minutes.fr/planete/environnement/4041672-20230616-accord-ecologie-negocie-patronat-blabla-selon-sophie-binet"
"False","True","Y a-t-il vraiment de plus en plus d’arrêts de travail courts et près du week-end ?","https://www.20minutes.fr/emploi/4041645-20230616-plus-plus-arrets-travail-courts-pres-week-end-comme-affirme-president-medef"
"False","True","Shany’z présente « Région en fête » et « Les duplex de Shany’z »","https://www.20minutes.fr/videos/4041289-20230616-20-minutes-tv-shany-z-presente-region-fete-duplex-shany-z"
