"premium","picture","title","url"
"False","False","Guerre en Ukraine","https://www.bfmtv.com/international/europe/ukraine-russie-le-bras-de-fer-mondial_DN-201904150203.html"
"False","False","Eurovision 2023","https://www.bfmtv.com/people/musique/concours-eurovision-de-la-chanson_DN-201803010303.html"
"False","False","Réforme des retraites","https://www.bfmtv.com/economie/economie-social/reforme-des-retraites_DN-202108310622.html"
"False","False","Festival de Cannes","https://www.bfmtv.com/people/festival-de-cannes_DN-202108310628.html"
"False","True","""Avancer, c'est la seule chose qui m'importe"": Borne veut ""continuer à relever"" les ""défis"" du pays","https://www.bfmtv.com/politique/avancer-c-est-la-seule-chose-qui-m-importe-borne-veut-continuer-a-relever-les-defis-du-pays_AN-202305130449.html"
"False","True","Elisabeth Borne recevra mercredi Yannick Morez, le maire de Saint-Brevin qui a démissionné","https://www.bfmtv.com/politique/elisabeth-borne-recevra-mercredi-yannick-morez-le-maire-de-saint-brevin-qui-a-demissionne_AD-202305140043.html"
"False","False","Yannick Morez, le maire de Saint-Brevin, estime que l'Etat ne s'est pas tenu à ses côtés","https://www.bfmtv.com/politique/yannick-morez-le-maire-de-saint-brevin-estime-que-l-etat-ne-s-est-pas-tenu-a-ses-cotes_AD-202305140057.html"
"False","True","Ultradroite: la justice suspend l'interdiction de la manifestation de l'Action française prévue dimanche à Paris","https://www.bfmtv.com/police-justice/ultradroite-le-tribunal-administratif-suspend-l-interdiction-de-la-manifestation-de-l-action-francaise_AN-202305130384.html"
"False","False","Ultradroite: le tribunal administratif suspend l'interdiction d'un colloque de l'Action…","https://www.bfmtv.com/police-justice/ultradroite-le-tribunal-administratif-suspend-l-interdiction-d-un-colloque-de-l-action-francaise_AN-202305130216.html"
"False","True","Eurovision 2023: la Suédoise Loreen remporte le concours pour la 2e fois, la France termine 16e","https://www.bfmtv.com/people/musique/eurovision-2023-la-suedoise-loreen-remporte-le-concours-pour-la-2e-fois-la-france-termine-16e_AN-202305130469.html"
"False","True","""Absolument pas"" un doigt d'honneur: La Zarra explique son geste polémique à l'Eurovision 2023","https://www.bfmtv.com/people/musique/absolument-pas-un-doigt-d-honneur-la-zarra-explique-son-geste-polemique-a-l-eurovision-2023_AV-202305140038.html"
"False","True","Eurovision 2023: la ville ukrainienne de Ternopil, d'où vient le duo Tvorchi, visée par une frappe russe","https://www.bfmtv.com/international/europe/ukraine/eurovision-2023-la-ville-ukrainienne-de-ternopil-d-ou-vient-le-duo-tvorchi-visee-par-une-frappe-russe_AP-202305130457.html"
"False","True","Le gouvernement publie le décret permettant le retour des soignants non-vaccinés","https://www.bfmtv.com/politique/le-gouvernement-publie-le-decret-permettant-le-retour-des-soignants-non-vaccines_AD-202305140044.html"
"False","True","Un siècle après la fondation de sa République, la Turquie, divisée, choisit son président","https://www.bfmtv.com/international/moyen-orient/turquie/un-siecle-apres-la-fondation-de-sa-republique-la-turquie-divisee-choisit-son-president_AD-202305140067.html"
"False","True","LA VÉRIF - Gérald Darmanin peut-il faire interdire toutes les manifestations d'ultradroite?","https://www.bfmtv.com/police-justice/la-verif-gerald-darmanin-peut-il-faire-interdire-toutes-les-manifestations-d-ultradroite_AV-202305130347.html"
"False","True","PSG-Ajaccio: festival de buts au Parc, doublé de Mbappé, le titre se rapproche pour Paris","https://rmcsport.bfmtv.com/football/ligue-1/psg-ajaccio-festival-de-buts-au-parc-double-de-mbappe-le-titre-se-rapproche-pour-paris_AV-202305130436.html"
"False","False","Ligue 1: balayé par le PSG, Ajaccio est officiellement relégué en Ligue 2","https://rmcsport.bfmtv.com/football/ligue-1/ligue-1-balaye-par-le-psg-ajaccio-est-officiellement-relegue-en-ligue-2_AV-202305130432.html"
"False","True","Mondiaux de judo: ""Je n'ai gagné qu'au mental"", Teddy Riner sacré champion du monde pour la 11e fois","https://rmcsport.bfmtv.com/judo/mondiaux-de-judo-il-faut-s-arracher-les-couilles-pour-gagner-riner-sacre-champion-du-monde-pour-la-11e-fois_AV-202305130351.html"
"False","False","Mondiaux de judo: ""Ça va me servir pour les JO de Paris"", Riner savoure son 11e titre…","https://rmcsport.bfmtv.com/judo/mondiaux-de-judo-ca-va-me-servir-pour-les-jo-de-paris-riner-savoure-son-11e-titre-mondial_AV-202305130421.html"
"False","True","""Ce n'est pas du tout le rôle d'un élu"". Julien Bayou condamne le slogan d'un élu LFI comparant Emmanuel Macron à Louis XVI","https://www.bfmtv.com/politique/europe-ecologie-les-verts/pas-du-tout-le-role-d-un-elu-bayou-condamne-le-slogan-d-un-elu-lfi-comparant-macron-a-louis-xvi_AV-202305090326.html"
"False","True","OL-PSG: les Lyonnaises remportent leur 10e Coupe de France, le 35e trophée de l'ère Aulas","https://rmcsport.bfmtv.com/football/coupe-de-france/ol-psg-les-lyonnaises-remportent-leur-10e-coupe-de-france-le-35e-trophee-de-l-ere-aulas_AV-202305130325.html"
"False","True","Guerre en Ukraine: Zelensky annonce être arrivé en Allemagne, une première depuis l'invasion russe","https://www.bfmtv.com/international/europe/ukraine/guerre-en-ukraine-zelensky-annonce-etre-arrive-en-allemagne-une-premiere-depuis-l-invasion-russe_AN-202305140104.html"
"False","True","Au Vatican, Volodymyr Zelensky remercie le pape pour son ""attention"" à la ""tragédie de millions d'Ukrainiens""","https://www.bfmtv.com/international/europe/ukraine/le-president-ukrainien-volodymyr-zelensky-recu-au-vatican-par-le-pape-francois_AD-202305130304.html"
"False","True","Alpes-Maritimes: la préfecture interdit les manifestations pendant le festival de Cannes","https://www.bfmtv.com/cote-d-azur/alpes-maritimes-la-prefecture-interdit-les-manifestations-pendant-le-festival-de-cannes_AN-202305130131.html"
"False","True","Fortes pluies dans les Pyrénées-Atlantiques: les images impressionnantes de la crue de la Nivelle","https://www.bfmtv.com/meteo/fortes-pluies-dans-les-pyrenees-atlantiques-les-images-impressionnantes-de-la-crue-de-la-nivelle_AV-202305130310.html"
"False","True","""Ça m'a fait un choc"": la maire de Plougrescant, qui a porté plainte après le sabotage de sa voiture, témoigne","https://www.bfmtv.com/police-justice/ca-m-a-fait-un-choc-la-maire-de-plougrescant-qui-a-porte-plainte-apres-le-sabotage-de-sa-voiture-temoigne_AV-202305130426.html"
"False","True","Paris: un homme abattu à proximité des Champs-Elysées, le suspect en fuite","https://www.bfmtv.com/paris/paris-un-homme-abattu-a-proximite-des-champs-elysees-le-suspect-en-fuite_AN-202305140120.html"
"False","True","Démission du maire de Saint-Brévin: d'autres élus menacés pour des projets d'accueil de migrants","https://www.bfmtv.com/politique/demission-du-maire-de-saint-brevin-d-autres-elus-menaces-pour-des-projets-d-accueil-de-migrants_AN-202305120842.html"
"False","True","Loire-Atlantique: un maire démissionne après l'incendie criminel de son domicile","https://www.bfmtv.com/politique/loire-atlantique-un-maire-demissionne-apres-l-incendie-criminel-de-son-domicile_AN-202305100954.html"
"False","True","Une ""évolution inquiétante"": les appels des moins de 14 ans à SOS Amitié ont augmenté de…","https://www.bfmtv.com/societe/une-evolution-inquietante-les-appels-des-moins-de-14-ans-a-sos-amitie-ont-augmente-de-40_AN-202305120267.html"
"False","True","Près de la moitié des Français ont déjà espionné le smartphone de leur conjoint(e)","https://www.bfmtv.com/tech/vie-numerique/pres-de-la-moitie-des-francais-ont-deja-espionne-le-smartphone-de-leur-conjoint-e_AV-202305110180.html"
"False","True","Les Flammes: le triomphe de Tiakola et Gazo, Aya Nakamura, artiste féminine de l'année,…","https://www.bfmtv.com/people/musique/les-flammes-le-triomphe-de-tiakola-et-gazo-aya-nakamura-artiste-feminine-de-l-annee-decouvrez-le-palmares-complet_AN-202305111035.html"
"False","True","""Comme un fou"": après six ans d'attente, le nouveau Zelda est disponible","https://www.bfmtv.com/tech/gaming/comme-un-fou-apres-six-ans-d-attente-le-nouveau-zelda-est-disponible_AD-202305120162.html"
"False","True","700 millions d'euros investis dans une usine de panneaux solaires en Moselle","https://www.bfmtv.com/economie/entreprises/industries/700-millions-d-euros-investis-dans-une-usine-de-panneaux-solaires-en-moselle_AD-202305140141.html"
"False","True","Sanctions: comment la Russie importe des marchandises françaises et européennes sans trop de difficultés","https://www.bfmtv.com/economie/international/sanctions-comment-la-russie-importe-des-marchandises-francaises-et-europeennes-sans-trop-de-difficultes_AV-202305140094.html"
"False","True","Île-de-France: une manifestation contre la future ligne 18 du métro sur le plateau de Saclay","https://www.bfmtv.com/paris/ile-de-france-une-manifestation-contre-la-future-ligne-18-du-metro-sur-le-plateau-de-saclay_AN-202305130408.html"
"False","True","RSA: Élisabeth Borne confirme que le projet de loi France Travail prévoira des sanctions","https://www.bfmtv.com/economie/economie-social/social/rsa-elisabeth-borne-confirme-que-le-projet-de-loi-france-travail-prevoira-des-sanctions_AD-202305130255.html"
"False","True","LA VÉRIF' - Inflation: retrouvera-t-on les prix d’avant crise?","https://www.bfmtv.com/replay-emissions/2022-a-l-epreuve-des-faits/la-verif-inflation-retrouvera-t-on-les-prix-d-avant-crise_VN-202305130246.html"
"False","True","PSG-Ajaccio: festival de buts au Parc, doublé de Mbappé, le titre se rapproche pour Paris","https://rmcsport.bfmtv.com/football/ligue-1/psg-ajaccio-festival-de-buts-au-parc-double-de-mbappe-le-titre-se-rapproche-pour-paris_AV-202305130436.html"
"False","True","PSG-Ajaccio: ""C'est ça la France"", la phrase d'Hakimi après son carton rouge, qui rappelle celle de Zlatan","https://rmcsport.bfmtv.com/football/ligue-1/psg-ajaccio-c-est-ca-la-france-la-phrase-d-hakimi-apres-son-carton-rouge-qui-rappelle-celle-de-zlatan_AV-202305130448.html"
"False","True","Ligue 1: plusieurs joueurs de Toulouse refuseraient de porter le maillot contre l'homophobie","https://rmcsport.bfmtv.com/football/ligue-1/ligue-1-cinq-joueurs-toulousains-auraient-refuse-de-porter-le-maillot-contre-l-homophobie_AV-202305130451.html"
"False","True","Mondiaux de judo: ""Je n'ai gagné qu'au mental"", Teddy Riner sacré champion du monde pour la 11e fois","https://rmcsport.bfmtv.com/judo/mondiaux-de-judo-il-faut-s-arracher-les-couilles-pour-gagner-riner-sacre-champion-du-monde-pour-la-11e-fois_AV-202305130351.html"
"False","True","OL-PSG: ""S'il n'y avait eu que moi, je ne l'aurais pas fait aussi vite"", le regret d'Aulas sur le timing de son départ","https://rmcsport.bfmtv.com/football/feminin/ol-psg-s-il-n-y-avait-eu-que-moi-je-ne-l-aurais-pas-fait-aussi-vite-le-regret-d-aulas-sur-le-timing-de-son-depart_AP-202305130387.html"
"False","True","25 ans de ""Harry Potter"" : l'histoire des illustrations d'origine, qui reparaissent en librairie","https://www.bfmtv.com/culture/harry-potter-l-histoire-des-illustrations-d-origine-qui-reparaissent-en-librairie_GN-202301190278.html"
"False","True","Ligne rouge - Bac Nord, ils parlent enfin","https://www.bfmtv.com/police-justice/ligne-rouge-bac-nord-ils-parlent-enfin_GN-202301160707.html"
"False","True","Les intelligences artificielles vont-elles remplacer les artistes ?","https://www.bfmtv.com/tech/les-intelligences-artificielles-vont-elles-remplacer-les-artistes_GN-202301120101.html"
"False","True","100 ans de la fondation de l'URSS : comment Poutine mobile le passé soviétique contre l'Ukraine","https://www.bfmtv.com/international/asie/russie/100-ans-de-la-fondation-de-l-urss-comment-poutine-mobilise-le-passe-sovietique-contre-l-ukraine_GN-202212300003.html"
"False","True","Une demande en hausse mais une production en baisse : le café survivra-t-il à sa popularité ?","https://www.bfmtv.com/economie/une-demande-en-hausse-mais-une-production-en-baisse-le-cafe-survivra-t-il-a-sa-popularite_GN-202212270016.html"
"False","True","Affaires Jubillar, Daval, le Tan...la reconstitution ""moment clé"" d'une enquête criminelle","https://www.bfmtv.com/police-justice/affaires-jubillar-daval-le-tan-la-reconstitution-moment-cle-d-une-enquete-criminelle_GN-202212130035.html"
"False","True","""Un geste de déception"": La Zarra revient sur sa réaction polémique à l'issue de l'Eurovision","https://www.bfmtv.com/people/un-geste-de-deception-la-zarra-revient-sur-sa-reaction-polemique-a-l-issue-de-l-eurovision_VN-202305140054.html"
