"premium","picture","title","url"
"False","True","Donald Trump inculpé au cours d’une comparution historique devant le tribunal aux États-Unis","https://www.ouest-france.fr/monde/etats-unis/donald-trump/donald-trump-inculpe-au-cours-dune-comparution-historique-devant-le-tribunal-aux-etats-unis-c6ddb1a6-d30e-11ed-9078-c96e51806d43"
"False","True","Emmanuel Macron s’envole pour la Chine, voici le programme de sa visite","https://www.ouest-france.fr/politique/emmanuel-macron/emmanuel-macron-senvole-pour-la-chine-ce-mardi-soir-voici-le-programme-de-sa-visite-2bc4f776-d2e9-11ed-9078-c96e51806d43"
"False","True","À quoi ressembleront les voyages en 2070 ? Voici ce que des experts ont imaginé","https://www.ouest-france.fr/leditiondusoir/2023-04-04/a-quoi-ressembleront-les-voyages-en-2070-voici-ce-que-des-experts-ont-imagine-638ecdba-9d5f-4c5e-9c94-d0f7fa395440"
"False","True","Réforme des retraites : Élisabeth Borne consulte… pour pas grand-chose","https://www.ouest-france.fr/economie/retraites/reforme-des-retraites-elisabeth-borne-consulte-pour-pas-grand-chose-70792716-d2ee-11ed-9078-c96e51806d43"
"False","True","350 ans après sa mort, d’Artagnan fascine toujours autant, voici pourquoi","https://www.ouest-france.fr/leditiondusoir/2023-04-04/350-ans-apres-sa-mort-d-artagnan-fascine-toujours-autant-voici-pourquoi-0e90b94a-56a0-4ea3-ae89-5680d73f1195"
"False","True","Guerre en Ukraine : Emmanuel Macron se rend en Chine, la Finlande rejoint l’Otan… Le point du jour","https://www.ouest-france.fr/monde/guerre-en-ukraine/guerre-en-ukraine-emmanuel-macron-se-rend-en-chine-la-finlande-rejoint-lotan-le-point-du-jour-152e8c68-d2fb-11ed-9078-c96e51806d43"
"True","True","« Stop à la violence » : à Rennes, des parents se mobilisent pour leur quartier","https://www.ouest-france.fr/bretagne/rennes-35000/la-violence-est-entree-dans-lecole-a-rennes-des-parents-se-mobilisent-pour-leur-quartier-73fefd4e-d2c5-11ed-8286-f025829e4b1d"
"False","True","Donald Trump inculpé : l’ancien président des États-Unis plaide non coupable devant le tribunal","https://www.ouest-france.fr/monde/etats-unis/donald-trump/donald-trump-inculpe-lancien-president-des-etats-unis-vient-darriver-au-tribunal-a-new-york-c8a0a020-d2ff-11ed-9078-c96e51806d43"
"False","False","Quatre conseils simples pour se prémunir des allergies aux pollens","https://www.ouest-france.fr/leditiondusoir/2023-04-04/quatre-conseils-simples-pour-se-premunir-des-allergies-aux-pollens-7fa89a58-cd3e-46ec-bdd5-9beba8a7c4a2"
"False","False","En Belgique, un concours invite les habitants à… casser le béton des villes","https://www.ouest-france.fr/leditiondusoir/2023-04-04/en-belgique-un-concours-invite-les-habitants-a-casser-le-beton-des-villes-671d0ed4-1858-406d-9a62-5fdcdd3c7aee"
"False","False","Stromae, malade, annule tous ses concerts jusqu’à fin mai","https://www.ouest-france.fr/culture/musiques/stromae/stromae-malade-annule-tous-ses-concerts-jusqua-fin-mai-488dc254-d305-11ed-9078-c96e51806d43"
"True","False","Qui est François Ferreira, l’homme disparu en Bretagne au cœur d’une enquête pour enlèvement ?","https://www.ouest-france.fr/societe/faits-divers/qui-est-francois-ferreira-lhomme-disparu-en-bretagne-au-cur-dune-enquete-pour-enlevement-93ab77ac-cec5-11ed-bfa8-ac96e5e331e1"
"False","False","Dix actions que tous les sportifs peuvent réaliser pour rendre leur pratique plus écolo","https://www.ouest-france.fr/leditiondusoir/2023-04-04/dix-actions-que-tous-les-sportifs-peuvent-realiser-pour-rendre-leur-pratique-plus-ecolo-1e8367b8-0e90-4575-9af9-71c0adaed785"
"False","False","Retraites : Pierre Hurmic va consulter les Bordelais sur la porte incendiée de la mairie","https://www.ouest-france.fr/economie/retraites/retraites-pierre-hurmic-va-consulter-les-bordelais-sur-la-porte-incendiee-de-la-mairie-e49d6444-d308-11ed-9078-c96e51806d43"
"False","True","Réforme des retraites : Élisabeth Borne consulte… pour pas grand-chose","https://www.ouest-france.fr/economie/retraites/reforme-des-retraites-elisabeth-borne-consulte-pour-pas-grand-chose-70792716-d2ee-11ed-9078-c96e51806d43"
"False","True","Retraites : Pierre Hurmic va consulter les Bordelais sur la porte incendiée de la mairie","https://www.ouest-france.fr/economie/retraites/retraites-pierre-hurmic-va-consulter-les-bordelais-sur-la-porte-incendiee-de-la-mairie-e49d6444-d308-11ed-9078-c96e51806d43"
"True","True","En Normandie, nouvelles réquisitions chez TotalEnergies et reprise de la production chez ExxonMobil","https://www.ouest-france.fr/economie/retraites/au-havre-reprise-des-expeditions-de-petrole-et-de-nouvelles-requisitions-chez-totalenergies-e656b2a0-d2f8-11ed-a66f-105c87b78a9d"
"False","True","Réforme des retraites : ce que Marine Tondelier et Olivier Faure ont dit à Élisabeth Borne","https://www.ouest-france.fr/economie/retraites/reforme-des-retraites-ce-que-marine-tondelier-et-olivier-faure-ont-dit-a-elisabeth-borne-a8486500-d30a-11ed-8286-f025829e4b1d"
"False","True","Opposés aux blocages de Sciences Po Lille, des étudiants sont affichés sur « un mur de la honte »","https://www.ouest-france.fr/economie/retraites/opposes-aux-blocages-de-leur-ecole-des-etudiants-de-lille-sont-affiches-sur-un-mur-de-la-honte-8ffacc2e-d2fe-11ed-9078-c96e51806d43"
"True","True","POINT DE VUE. Emmanuel Macron en Chine : la porte étroite de l’Europe","https://www.ouest-france.fr/monde/chine/point-de-vue-emmanuel-macron-en-chine-la-porte-etroite-de-leurope-d2c0a014-d200-11ed-9a9a-51eac6843105"
"False","True","À quoi ressembleront les voyages en 2070 ? Voici ce que des experts ont imaginé","https://www.ouest-france.fr/leditiondusoir/2023-04-04/a-quoi-ressembleront-les-voyages-en-2070-voici-ce-que-des-experts-ont-imagine-638ecdba-9d5f-4c5e-9c94-d0f7fa395440"
"True","True","Deux hommes tués par balles à Rennes : un jeune suspect interpellé à Mayotte","https://www.ouest-france.fr/bretagne/rennes-35000/deux-hommes-tues-par-balles-a-rennes-un-jeune-suspect-interpelle-a-mayotte-2382c7f2-d2e7-11ed-9078-c96e51806d43"
"True","True","« Stop à la violence » : à Rennes, des parents se mobilisent pour leur quartier","https://www.ouest-france.fr/bretagne/rennes-35000/la-violence-est-entree-dans-lecole-a-rennes-des-parents-se-mobilisent-pour-leur-quartier-73fefd4e-d2c5-11ed-8286-f025829e4b1d"
"False","True","Après plus de trois ans d’invincibilité à domicile, cette équipe de foot bretonne a fini par perdre","https://www.ouest-france.fr/sport/football/foot-amateur/apres-plus-de-trois-ans-dinvincibilite-a-domicile-cette-equipe-de-foot-bretonne-a-fini-par-perdre-a3c39dcc-d2ee-11ed-a2c6-d4c21ce8cb76"
"True","True","Qui est François Ferreira, l’homme disparu en Bretagne au cœur d’une enquête pour enlèvement ?","https://www.ouest-france.fr/societe/faits-divers/qui-est-francois-ferreira-lhomme-disparu-en-bretagne-au-cur-dune-enquete-pour-enlevement-93ab77ac-cec5-11ed-bfa8-ac96e5e331e1"
"True","True","En Normandie, nouvelles réquisitions chez TotalEnergies et reprise de la production chez ExxonMobil","https://www.ouest-france.fr/economie/retraites/au-havre-reprise-des-expeditions-de-petrole-et-de-nouvelles-requisitions-chez-totalenergies-e656b2a0-d2f8-11ed-a66f-105c87b78a9d"
"False","True","Au Mont-Saint-Michel, « une année exceptionnelle » pour le millénaire de l’abbaye","https://www.ouest-france.fr/culture/patrimoine/mont-saint-michel/au-mont-saint-michel-une-annee-exceptionnelle-pour-le-millenaire-de-labbaye-7584f1be-d301-11ed-8286-f025829e4b1d"
"False","True","Dans cette commune de Normandie, le dos-d’âne est dérobé… puis retrouvé dans un village voisin","https://www.ouest-france.fr/normandie/bernieres-sur-mer-14990/dans-cette-commune-de-normandie-le-dos-dane-est-derobe-puis-retrouve-dans-un-village-voisin-a2f779be-d306-11ed-8286-f025829e4b1d"
"True","True","Corps repêché à Évreux : l’homme a été identifié et la piste accidentelle privilégiée","https://www.ouest-france.fr/normandie/corps-repeche-a-evreux-lhomme-a-ete-identifie-et-la-piste-accidentelle-privilegiee-bf62cb80-d2f7-11ed-9078-c96e51806d43"
"True","True","Maine-et-Loire : un couple d’assistants familiaux condamné pour des violences sur des enfants placés","https://www.ouest-france.fr/pays-de-la-loire/cholet-49300/un-couple-choletais-dassistants-familiaux-condamne-pour-des-violences-sur-des-enfants-places-4ed2d9a6-d2c4-11ed-9078-c96e51806d43"
"True","True","Angers-SCO. Saïd Chabane en garde à vue : une enquête pour blanchiment d’argent en bande organisée","https://www.ouest-france.fr/sport/football/angers-sco/angers-sco-said-chabane-en-garde-a-vue-une-enquete-pour-blanchiment-dargent-en-bande-organisee-9bc4b114-d2fe-11ed-9078-c96e51806d43"
"False","True","Cyclisme. Pays de la Loire Tour : Bryan Coquard s’impose au sprint et prend les commandes du général","https://www.ouest-france.fr/sport/cyclisme/direct/direct-region-pays-de-la-loire-tour-demare-coquard-vauquelin-suivez-la-premiere-etape-en-live-9ed72574-d265-11ed-9a9a-51eac6843105"
"False","True","Où s’arrêtera l’Angevin Michaël Pankar, désormais champion d’Europe du sushi ?","https://www.ouest-france.fr/pays-de-la-loire/angers-49000/ou-sarretera-langevin-michael-pankar-desormais-champion-deurope-du-sushi-7dcb658c-d2f3-11ed-8286-f025829e4b1d"
"False","True","Guerre en Ukraine : Emmanuel Macron se rend en Chine, la Finlande rejoint l’Otan… Le point du jour","https://www.ouest-france.fr/monde/guerre-en-ukraine/guerre-en-ukraine-emmanuel-macron-se-rend-en-chine-la-finlande-rejoint-lotan-le-point-du-jour-152e8c68-d2fb-11ed-9078-c96e51806d43"
"False","True","Emmanuel Macron s’envole pour la Chine, voici le programme de sa visite","https://www.ouest-france.fr/politique/emmanuel-macron/emmanuel-macron-senvole-pour-la-chine-ce-mardi-soir-voici-le-programme-de-sa-visite-2bc4f776-d2e9-11ed-9078-c96e51806d43"
"False","True","Tennis. Svitolina battue dès son entrée à Charleston mais heureuse pour son retour à la compétition","https://www.ouest-france.fr/sport/tennis/elina-svitolina/tennis-svitolina-battue-des-son-entree-a-charleston-mais-heureuse-pour-son-retour-a-la-competition-1bb43798-d2e4-11ed-9078-c96e51806d43"
"False","True","Guerre en Ukraine. Drones sur Odessa, médiation brésilienne… Le point sur la nuit","https://www.ouest-france.fr/monde/guerre-en-ukraine/guerre-en-ukraine-drones-sur-odessa-mediation-bresilienne-le-point-sur-la-nuit-fba09ae8-5d13-4c7a-bca6-d59776a1a187"
"False","True","Jeanne Morel donne un toit aux danseuses venues d’Ukraine","https://www.ouest-france.fr/culture/arts/danse/jeanne-morel-donne-un-toit-aux-danseuses-venues-dukraine-1e612a8e-c658-11ed-9011-281f907f658d"
"False","True","Vous avez encore envie de skier ? Voici les dates de fermeture des stations françaises","https://www.ouest-france.fr/economie/tourisme/vous-avez-encore-envie-de-skier-voici-les-dates-de-fermeture-des-stations-francaises-32e89074-d2e6-11ed-a2c6-d4c21ce8cb76"
"False","False","Arnaque à la location saisonnière : une cinquantaine de victimes d’annonces détournées dans le Var","https://www.ouest-france.fr/provence-alpes-cote-dazur/var/arnaque-a-la-location-saisonniere-une-cinquantaine-de-victimes-dannonces-detournees-dans-le-var-54cd8de0-d2f3-11ed-a2c6-d4c21ce8cb76"
"False","False","Un maillot du TFC aux couleurs du Stade Toulousain : le poisson d’avril qui n’en est plus un","https://www.ouest-france.fr/sport/football/toulouse-fc/un-maillot-du-tfc-aux-couleurs-du-stade-toulousain-le-poisson-davril-qui-nen-est-plus-un-3e9c44d2-d2f1-11ed-a2c6-d4c21ce8cb76"
"False","True","Diffusion d’un photomontage sexuel : amende requise contre les Balkany","https://www.ouest-france.fr/politique/patrick-balkany/diffusion-dun-photomontage-sexuel-amende-requise-contre-les-balkany-fb00f42a-d2c8-11ed-8286-f025829e4b1d"
"False","False","Des interprètes payés avec retard : « Le ministère de la Justice doit à certains jusqu’à 14 000 € »","https://www.ouest-france.fr/societe/justice/justice-des-interpretes-payes-avec-retard-certains-le-ministere-leur-doit-10-000-a-14-000-euros-774b0acc-d2ef-11ed-9078-c96e51806d43"
"False","False","Val-de-Marne. Une femme soupçonnée d’avoir tenté d’enlever une fillette dans une crèche","https://www.ouest-france.fr/ile-de-france/alfortville-94140/val-de-marne-une-femme-soupconnee-davoir-tente-denlever-une-fillette-dans-une-creche-b615474a-d2f4-11ed-a2c6-d4c21ce8cb76"
"False","True","Arnaque à la location saisonnière : une cinquantaine de victimes d’annonces détournées dans le Var","https://www.ouest-france.fr/provence-alpes-cote-dazur/var/arnaque-a-la-location-saisonniere-une-cinquantaine-de-victimes-dannonces-detournees-dans-le-var-54cd8de0-d2f3-11ed-a2c6-d4c21ce8cb76"
"False","False","Le député RN Joris Hébrard quitte l’Assemblée nationale pour redevenir maire du Pontet","https://www.ouest-france.fr/politique/rassemblement-national/le-depute-rn-joris-hebrard-demissionne-apres-avoir-recu-un-blame-de-son-parti-f906e378-d2cd-11ed-8286-f025829e4b1d"
"False","False","Un serpent des blés découvert dans un immeuble du Var, les habitants évacués par la police","https://www.ouest-france.fr/provence-alpes-cote-dazur/vidauban-83550/un-serpent-des-bles-decouvert-dans-un-immeuble-du-var-les-habitants-evacues-par-la-police-5c889070-d2d0-11ed-a2c6-d4c21ce8cb76"
"False","True","Retraites : Pierre Hurmic va consulter les Bordelais sur la porte incendiée de la mairie","https://www.ouest-france.fr/economie/retraites/retraites-pierre-hurmic-va-consulter-les-bordelais-sur-la-porte-incendiee-de-la-mairie-e49d6444-d308-11ed-9078-c96e51806d43"
"False","False","Manifestants blessés à Sainte-Soline : enquêtes, nouvelles plaintes… Ce qu’a dit le procureur","https://www.ouest-france.fr/environnement/eau/manifestants-blesses-a-sainte-soline-enquetes-nouvelles-plaintes-ce-qua-dit-le-procureur-37c3393a-d2fc-11ed-9078-c96e51806d43"
"False","False","Manifestants blessés à Sainte-Soline : quatre procédures ouvertes par le parquet","https://www.ouest-france.fr/environnement/eau/direct-manifestants-blesses-a-sainte-soline-suivez-la-conference-de-presse-du-procureur-b63af96a-d2e3-11ed-9078-c96e51806d43"
