"premium","picture","title","url"
"False","True","Nucléaire : ce que contient le projet de loi dont l’examen débute ce lundi à l’Assemblée nationale","https://www.ouest-france.fr/environnement/nucleaire/nucleaire-ce-que-contient-le-projet-de-loi-dont-lexamen-debute-ce-lundi-a-lassemblee-nationale-53b323f4-c17b-11ed-b322-7b4ba54e1a37"
"False","True","« C’est parti, ça décolle, faites des usines » : Enedis va investir comme jamais","https://www.ouest-france.fr/economie/entreprises/enedis/cest-parti-ca-decolle-faites-des-usines-enedis-va-investir-comme-jamais-14eef210-c1a3-11ed-aad2-778331a86007"
"False","True","DIRECT. Réforme des retraites : les discussions commencent avant la commission mixte paritaire","https://www.ouest-france.fr/economie/retraites/direct-reforme-des-retraites-debut-dune-semaine-decisive-pour-le-projet-de-loi-4d0cba40-c0dd-11ed-91c1-24bf6e5edc0a"
"False","True","Le Livret A est-il un bon placement pour préparer sa retraite ?","https://www.ouest-france.fr/economie/banques-finance/le-livret-a-est-il-un-bon-placement-pour-preparer-sa-retraite-c8461cca-c1a4-11ed-aad2-778331a86007"
"False","True","« Ça a duré 40 minutes » : la frayeur des passagers vol Paris-Nice pris en pleine tempête","https://www.ouest-france.fr/societe/faits-divers/ca-a-dure-40-minutes-la-frayeur-des-passagers-vol-paris-nice-pris-en-pleine-tempete-b196eb4a-c1a3-11ed-b322-7b4ba54e1a37"
"False","True","Réchauffement climatique : comment France Télévisions fait évoluer ses bulletins météo dès ce lundi","https://www.ouest-france.fr/meteo/rechauffement-climatique-france-televisions-fait-evoluer-ses-bulletins-meteo-77189c16-c19e-11ed-aad2-778331a86007"
"False","True","Orages : 28 départements désormais en vigilance orange","https://www.ouest-france.fr/meteo/orage/orages-28-departements-desormais-en-vigilance-orange-5df5cdd6-c18e-11ed-aad2-778331a86007"
"False","True","Des orages des Pyrénées à l’Alsace : un épisode « assez inédit » pour un mois de mars","https://www.ouest-france.fr/meteo/orage/des-orages-des-pyrenees-a-lalsace-un-episode-assez-inedit-pour-un-mois-de-mars-8ef7c372-c1a1-11ed-aad2-778331a86007"
"False","False","Pourquoi la réforme des retraites risque d’impacter le crédit immobilier de certains emprunteurs","https://www.ouest-france.fr/economie/retraites/pourquoi-la-reforme-des-retraites-risque-dimpacter-le-credit-immobilier-de-certains-emprunteurs-b28f3582-c1a5-11ed-b405-e8b9e5319b6d"
"True","False","TÉMOIGNAGE. Actrice, elle vit de la pornographie : « Ce n’est pas de l’argent facile »","https://www.ouest-france.fr/nouvelle-aquitaine/deux-sevres/temoignage-actrice-elle-vit-de-la-pornographie-ce-nest-pas-de-largent-facile-98be489a-c020-11ed-aa33-59ea232e8c60"
"False","False","SNCF. Pourquoi les prix des billets de train pourraient encore augmenter dans les prochains mois","https://www.ouest-france.fr/economie/transports/sncf/sncf-pourquoi-les-prix-des-billets-de-train-pourraient-encore-augmenter-dans-les-prochains-mois-bda36fa0-c18d-11ed-b405-e8b9e5319b6d"
"False","False","PODCAST. Qui a vraiment inventé la frite : la France ou la Belgique ?","https://www.ouest-france.fr/culture/histoire/podcast-qui-a-vraiment-invente-la-frite-la-france-ou-la-belgique-8203df80-c18c-11ed-aad2-778331a86007"
"False","False","Les influenceurs seront soumis aux mêmes règles publicitaires que les médias traditionnels","https://www.ouest-france.fr/high-tech/internet/les-influenceurs-seront-soumis-aux-memes-regles-publicitaires-que-les-medias-traditionnels-eec8eff6-c197-11ed-aad2-778331a86007"
"False","False","Faillite de la banque SVB : le système américain est « solide », assure le président Joe Biden","https://www.ouest-france.fr/economie/banques-finance/faillite-de-svb-le-systeme-bancaire-americain-est-solide-assure-le-president-joe-biden-6fc2c02a-c1a0-11ed-aad2-778331a86007"
"False","True","DIRECT. Réforme des retraites : les discussions commencent avant la commission mixte paritaire","https://www.ouest-france.fr/economie/retraites/direct-reforme-des-retraites-debut-dune-semaine-decisive-pour-le-projet-de-loi-4d0cba40-c0dd-11ed-91c1-24bf6e5edc0a"
"False","True","Pourquoi la réforme des retraites risque d’impacter le crédit immobilier de certains emprunteurs","https://www.ouest-france.fr/economie/retraites/pourquoi-la-reforme-des-retraites-risque-dimpacter-le-credit-immobilier-de-certains-emprunteurs-b28f3582-c1a5-11ed-b405-e8b9e5319b6d"
"False","True","Gaullisme, référendum, démission : le carnet politique de ce lundi","https://www.ouest-france.fr/economie/retraites/gaullisme-referendum-demission-le-carnet-politique-de-ce-lundi-b8799e04-c17a-11ed-aad2-778331a86007"
"False","True","Réforme des retraites. Opération escargot sur l’axe Nantes – Rennes, circulation fortement ralentie","https://www.ouest-france.fr/economie/retraites/reforme-des-retraites-operation-escargot-sur-laxe-nantes-rennes-circulation-fortement-ralentie-d043b64a-c180-11ed-aad2-778331a86007"
"False","True","Réforme des retraites. Un député écologiste dépose une proposition de loi pour supprimer le 49.3","https://www.ouest-france.fr/economie/retraites/reforme-des-retraites-un-depute-ecologiste-depose-une-proposition-de-loi-pour-supprimer-le-49-3-4f31b1e6-c17c-11ed-aad2-778331a86007"
"False","True","POINT DE VUE. Retraite : la résistance du rêve","https://www.ouest-france.fr/economie/retraites/point-de-vue-retraite-la-resistance-du-reve-1b71e460-c04c-11ed-aa33-59ea232e8c60"
"False","True","Paris, Bayonne, Versailles… À quoi ressemblent ces villes américaines aux accents français ?","https://www.ouest-france.fr/leditiondusoir/2023-03-10/paris-bayonne-versailles-a-quoi-ressemblent-ces-villes-americaines-aux-accents-francais-bfdd011f-6599-4534-8309-e1f6ef7f89cc"
"True","True","Meurtre conjugal dans le Finistère : 20 ans de réclusion criminelle requis contre l’accusée","https://www.ouest-france.fr/bretagne/quimper-29000/assises-du-finistere-meurtre-conjugal-de-pont-labbe-20-ans-de-reclusion-criminelle-requis-d99e79e6-c18a-11ed-aad2-778331a86007"
"False","True","Femme tuée à Dinan : sa compagne placée en détention provisoire","https://www.ouest-france.fr/societe/faits-divers/femme-tuee-a-dinan-sa-compagne-placee-en-detention-provisoire-f366534c-c178-11ed-b322-7b4ba54e1a37"
"False","True","Un nouveau coup de vent attendu ce lundi en Finistère","https://www.ouest-france.fr/bretagne/finistere/un-nouveau-coup-de-vent-attendu-ce-lundi-en-finistere-249979c4-c18f-11ed-aad2-778331a86007"
"False","True","VIDÉO. L'ancien cinéma Arvor évacué à Rennes, 62 militants emmenés au commissariat","https://www.ouest-france.fr/bretagne/rennes-35000/video-l-ancien-cinema-arvor-evacue-a-rennes-les-militants-emmenes-au-commissariat-73e0b0dc-b7c3-3ef4-a7b7-1f75bbecbb7b"
"True","True","Une tortue d’une espèce menacée d’extinction s’échoue sur une plage de la Manche","https://www.ouest-france.fr/environnement/biodiversite/une-tortue-dune-espece-menacee-dextinction-sechoue-sur-une-plage-de-la-manche-5cff5bde-bf29-11ed-b397-b1fbc9f24a88"
"False","True","Un mégot jeté dans la poubelle de la cuisine : la maison s’embrase près de Caen","https://www.ouest-france.fr/normandie/putot-en-bessin-14740/megot-dans-la-poubelle-la-maison-sembrase-pres-de-caen-cc065864-c17e-11ed-aad2-778331a86007"
"False","True","Réforme des retraites. Circulation tendue sur le périphérique de Caen, le rond-point bleu bloqué","https://www.ouest-france.fr/economie/retraites/reforme-des-retraites-circulation-tendue-sur-le-peripherique-de-caen-le-rond-point-bleu-bloque-0c171ef0-c16d-11ed-aad2-778331a86007"
"True","True","REPORTAGE. « Ça soulage notre budget courses » : au loto, ils misent sur la chance pour économiser","https://www.ouest-france.fr/normandie/lonrai-61250/reportage-ca-soulage-notre-budget-courses-ils-misent-sur-la-chance-du-loto-pour-economiser-fe125442-c0da-11ed-91c1-24bf6e5edc0a"
"True","True","VIDEO. Une femme percutée par un train à la gare de Laval : le trafic est interrompu","https://www.ouest-france.fr/societe/faits-divers/en-mayenne-intervention-en-cours-en-gare-de-laval-apres-un-accident-de-personne-959dc572-c1a2-11ed-aad2-778331a86007"
"False","True","La vente d’une espèce protégée de requin sur un marché d’Angers dénoncée par le site d’Hugo Clément","https://www.ouest-france.fr/environnement/biodiversite/la-vente-dune-espece-protegee-de-requin-sur-un-marche-dangers-denoncee-par-le-site-dhugo-clement-6a11ede4-c17e-11ed-b322-7b4ba54e1a37"
"True","True","Une femme récupérée dans la Loire par les pompiers à Nantes","https://www.ouest-france.fr/pays-de-la-loire/nantes-44000/une-femme-recuperee-dans-la-loire-par-les-pompiers-a-nantes-5d957c74-c198-11ed-aad2-778331a86007"
"False","True","Réforme des retraites. Opération escargot sur l’axe Nantes – Rennes, circulation fortement ralentie","https://www.ouest-france.fr/economie/retraites/reforme-des-retraites-operation-escargot-sur-laxe-nantes-rennes-circulation-fortement-ralentie-d043b64a-c180-11ed-aad2-778331a86007"
"False","True","Guerre en Ukraine. De « violents combats » pour prendre le contrôle du centre de Bakhmout","https://www.ouest-france.fr/monde/guerre-en-ukraine/guerre-en-ukraine-de-violents-combats-pour-prendre-le-controle-du-centre-de-bakhmout-d3ba378a-c172-11ed-aad2-778331a86007"
"True","True","REPORTAGE. Guerre en Ukraine : à Bakhmout, ils veulent tenir à tout prix face aux Russes","https://www.ouest-france.fr/monde/guerre-en-ukraine/reportage-en-ukraine-tchassiv-iar-le-cordon-ombilical-de-bakhmout-sous-les-tirs-russes-6a7e1282-c0c3-11ed-b9a2-55b548d61541"
"False","True","Les importations d’armes ont doublé en 2022 en Europe","https://www.ouest-france.fr/monde/guerre-en-ukraine/les-importations-d-armes-ont-double-en-2022-en-europe-0898f83e-512a-47ab-acfd-44a934b5db6a"
"False","True","Il s’appelait Oleksandre Igorovitch Matsievskiï : l’identité du soldat ukrainien exécuté confirmée","https://www.ouest-france.fr/monde/guerre-en-ukraine/il-sappelait-oleksandre-igorovitch-matsievskii-lidentite-du-soldat-ukrainien-execute-confirmee-2c407c18-c112-11ed-91c1-24bf6e5edc0a"
"False","True","CARTE. Guerre en Ukraine : Bakhmout, Prigojine, Moldavie... Le point du jour","https://www.ouest-france.fr/monde/guerre-en-ukraine/carte-guerre-en-ukraine-bakhmout-prigojine-moldavie-le-point-du-jour-f50cfcae-c101-11ed-b9a2-55b548d61541"
"False","True","Orages : 28 départements désormais en vigilance orange","https://www.ouest-france.fr/meteo/orage/orages-28-departements-desormais-en-vigilance-orange-5df5cdd6-c18e-11ed-aad2-778331a86007"
"False","False","Le rappeur Laylow remis en libéré, les analyses ont écarté la consommation de cocaïne","https://www.ouest-france.fr/culture/musiques/le-rappeur-laylow-remis-en-libere-les-analyses-ont-ecarte-la-consommation-de-cocaine-6936e702-c18e-11ed-b405-e8b9e5319b6d"
"False","False","Ce que l’on sait sur l’empoisonnement de chiens lors d’une compétition de canicross dans le Gard","https://www.ouest-france.fr/societe/faits-divers/ce-que-lon-sait-sur-lempoisonnement-de-chiens-lors-dune-competition-de-canicross-dans-le-gard-80ef7982-c17e-11ed-aad2-778331a86007"
"False","True","« Ça a duré 40 minutes » : la frayeur des passagers vol Paris-Nice pris en pleine tempête","https://www.ouest-france.fr/societe/faits-divers/ca-a-dure-40-minutes-la-frayeur-des-passagers-vol-paris-nice-pris-en-pleine-tempete-b196eb4a-c1a3-11ed-b322-7b4ba54e1a37"
"False","False","Atacadão, l’enseigne discount de Carrefour, n’ouvrira pas son premier magasin à Sevran","https://www.ouest-france.fr/ile-de-france/sevran-93270/atacadao-lenseigne-discount-de-carrefour-nouvrira-pas-son-premier-magasin-a-sevran-81adb1fa-c1a5-11ed-b405-e8b9e5319b6d"
"False","False","JO 2024. Pas de métro en continu mais des moyens supplémentaires, on en sait plus sur les transports","https://www.ouest-france.fr/jeux-olympiques/jo-2024-pas-de-metro-en-continu-mais-des-moyens-supplementaires-on-en-sait-plus-sur-les-transports-99ba4e62-c186-11ed-aad2-778331a86007"
"False","True","Un homme meurt poignardé dans un appartement à Antibes, un couple en garde à vue","https://www.ouest-france.fr/provence-alpes-cote-dazur/antibes-06600/un-homme-meurt-poignarde-dans-un-appartement-a-antibes-un-couple-en-garde-a-vue-90912410-c199-11ed-b405-e8b9e5319b6d"
"False","False","Aix en Provence. 250 étudiants sans école après la fermeture de la Campus Academy en milieu d’année","https://www.ouest-france.fr/provence-alpes-cote-dazur/aix-en-provence-13080/aix-en-provence-250-etudiants-sans-ecole-apres-la-fermeture-de-la-campus-academy-en-milieu-dannee-129a82e8-c196-11ed-b405-e8b9e5319b6d"
"False","False","Tour de France 2024. Col de la Couillole, chrono pour grimpeurs… Le profil des deux dernières étapes","https://www.ouest-france.fr/tour-de-france/tour-de-france-2024-col-de-la-couillole-chrono-pour-grimpeurs-le-profil-des-deux-dernieres-etapes-501ad834-c18c-11ed-aad2-778331a86007"
"False","True","Orages : 28 départements désormais en vigilance orange","https://www.ouest-france.fr/meteo/orage/orages-28-departements-desormais-en-vigilance-orange-5df5cdd6-c18e-11ed-aad2-778331a86007"
"False","False","Le romancier historique Michel Peyramaure est décédé à 101 ans","https://www.ouest-france.fr/culture/livres/le-romancier-historique-michel-peyramaure-est-decede-a-101-ans-85e00a24-c002-11ed-aa33-59ea232e8c60"
"False","False","Star du « crudivorisme » sur YouTube, Thierry Casasnovas mis en examen","https://www.ouest-france.fr/societe/justice/star-du-crudivorisme-sur-youtube-thierry-casasnovas-mis-en-examen-7dfbbb36-bf72-11ed-8b0a-102ab124256a"
