"premium","picture","title","url"
"False","False","Réforme des retraites","https://www.bfmtv.com/economie/economie-social/reforme-des-retraites_DN-202108310622.html"
"False","False","Impôts 2023","https://www.bfmtv.com/economie/campagne-de-declaration-de-revenus_DN-202304130437.html"
"False","False","Incendies en France","https://www.bfmtv.com/environnement/climat/incendies-en-france_DN-202207110713.html"
"False","False","Guerre en Ukraine","https://www.bfmtv.com/international/europe/ukraine-russie-le-bras-de-fer-mondial_DN-201904150203.html"
"False","True","EN DIRECT - Chelsea-Real Madrid: Rodrygo et le Real punissent les Blues, la qualif est proche","https://rmcsport.bfmtv.com/football/ligue-des-champions/en-direct-ligue-des-champions-suivez-l-affiche-chelsea-real-madrid-en-live_LS-202304180525.html"
"False","True","CHE01RMA61'| CUM. : 0 - 3","https://rmcsport.bfmtv.com/football/ligue-des-champions/en-direct-ligue-des-champions-suivez-l-affiche-chelsea-real-madrid-en-live_LS-202304180525.html"
"False","True","EN DIRECT - Naples-AC Milan: Giroud se rattrape, les Rossoneri font un pas vers le dernier carré","https://rmcsport.bfmtv.com/football/ligue-des-champions/en-direct-ligue-des-champions-suivez-l-affiche-naples-ac-milan-en-live_LS-202304180521.html"
"False","True","NAP01ACM58'| CUM. : 0 - 2","https://rmcsport.bfmtv.com/football/ligue-des-champions/en-direct-ligue-des-champions-suivez-l-affiche-naples-ac-milan-en-live_LS-202304180521.html"
"False","True","Huiles, biscuits, café... Ces produits alimentaires dont le prix devrait prochainement baisser","https://www.bfmtv.com/economie/consommation/produits-alimentaires-une-inflation-qui-ne-se-justifie-plus_AV-202304180544.html"
"False","False","Gel des prix, TVA à 0%... La Hongrie et l'Espagne ont-elles réussi à endiguer l'inflation…","https://www.bfmtv.com/economie/gel-des-prix-tva-a-0-la-hongrie-et-l-espagne-ont-elles-reussi-a-endiguer-l-inflation-alimentaire_AN-202304180316.html"
"False","True","Journée de la ""colère cheminote"": la SNCF annonce un trafic ""en partie perturbé"" jeudi 20 avril","https://www.bfmtv.com/economie/entreprises/transports/journee-de-la-colere-cheminote-la-sncf-annonce-un-trafic-en-partie-perturbe-jeudi-20-avril_AV-202304180620.html"
"False","False","""Colère cheminote"": quelles actions dans les gares jeudi 20 avril ?","https://www.bfmtv.com/economie/entreprises/transports/colere-cheminote-quelles-actions-dans-les-gares-jeudi-20-avril_AD-202304180444.html"
"False","True","Emmanuel Macron filmé après son allocution en train de chanter dans les rues de Paris","https://www.bfmtv.com/politique/elysee/emmanuel-macron-filme-apres-son-allocution-en-train-de-chanter-dans-les-rues-de-paris_AN-202304180577.html"
"False","True","Emmanuel Macron cherche un nouveau départ avec son cap des ""100 jours""","https://www.bfmtv.com/politique/elysee/emmanuel-macron-cherche-un-nouveau-depart-avec-son-cap-des-100-jours_AV-202304180335.html"
"False","False","Retraites, travail, sécurité... Ce qu'il faut retenir de l'allocution d'Emmanuel Macron","https://www.bfmtv.com/politique/elysee/retraites-travail-securite-ce-qu-il-faut-retenir-de-l-allocution-d-emmanuel-macron_AN-202304170649.html"
"False","True","Macron dans le Bas-Rhin: l'intersyndicale appelle à un rassemblement ""avec des casseroles"" pour sa venue","https://www.bfmtv.com/alsace/bas-rhin-l-intersyndicale-appelle-a-un-rassemblement-pour-la-venue-d-emmanuel-macron-a-muttersholtz_AN-202304180513.html"
"False","True","""Quelle honte"": Le Maire dénonce les aides sociales envoyées au Maghreb et suscite la colère à gauche","https://www.bfmtv.com/politique/gouvernement/quelle-honte-le-maire-denonce-les-aides-sociales-envoyees-au-maghreb-et-suscite-la-colere-a-gauche_AV-202304180487.html"
"False","False","Fraude fiscale: le gouvernement veut doubler les effectifs de controle","https://www.bfmtv.com/economie/economie-social/fraude-fiscale-le-gouvernement-veut-doubler-les-effectifs-de-controle_AV-202304180206.html"
"False","True","Quels sont les derniers chiffres en date de la fraude fiscale et sociale?","https://www.bfmtv.com/economie/economie-social/quels-sont-les-derniers-chiffres-en-date-de-la-fraude-fiscale-et-sociale_AV-202304180553.html"
"False","True","Jusqu'à 15°C d'écart: les températures vont chuter dans la moitié nord du pays en fin de semaine","https://www.bfmtv.com/meteo/jusqu-a-15deg-c-d-ecart-les-temperatures-vont-chuter-dans-la-moitie-nord-du-pays-en-fin-de-semaine_AN-202304180545.html"
"False","True","Paris est la ville européenne où le risque de mourir de chaud est le plus élevé","https://www.bfmtv.com/paris/paris-est-la-ville-europeenne-ou-le-risque-de-mourir-de-chaud-est-le-plus-eleve_AN-202304180694.html"
"False","True","Bien sûr que la légalité, ce n'est pas la démocratie. Clémentine Autain sur la promulgation de la réforme des retraites","https://www.bfmtv.com/politique/la-france-insoumise/reforme-des-retraites-clementine-autain-juge-que-la-legalite-ce-n-est-pas-la-democratie_AV-202304170259.html"
"False","True","Abandon de poste: la présomption de démission devient la règle","https://www.bfmtv.com/economie/emploi/abandon-de-poste-la-presomption-de-demission-devient-la-regle_AV-202304180262.html"
"False","True","Pilules abortives: des tensions d'approvisionnement ""en voie d'être résolues"" à Lille et en région parisienne","https://www.bfmtv.com/sante/pilules-abortives-des-tensions-d-approvisionnement-en-voie-d-etre-resolues-a-lille-et-en-region-parisienne_AN-202304180682.html"
"False","True","Inflation : les vacanciers boycottent le mois d'août","https://www.bfmtv.com/economie/inflation-les-vacanciers-boycottent-le-mois-d-aout_AV-202304180018.html"
"False","True","La flambée des prix des billets d'avion depuis la France ne faiblit pas","https://www.bfmtv.com/economie/entreprises/transports/la-flambee-des-prix-des-billets-d-avion-depuis-la-france-ne-faiblit-pas_AV-202304180319.html"
"False","True","Russie: François Fillon sera auditionné par la commission d'enquête sur les ingérences étrangères","https://www.bfmtv.com/politique/parlement/russie-francois-fillon-sera-auditionne-par-la-commission-d-enquete-sur-les-ingerences-etrangeres_AN-202304180432.html"
"False","True","Yvelines: un professeur de piano placé en détention provisoire pour viols sur mineurs","https://www.bfmtv.com/paris/yvelines-un-professeur-de-piano-place-en-detention-provisoire-pour-viols-sur-mineurs_AN-202304180427.html"
"False","True","TOUT COMPRENDRE - Combats de rue, explosions, près de 200 morts... Que se passe-t-il au Soudan?","https://www.bfmtv.com/international/afrique/tout-comprendre-au-moins-97-civils-tues-combats-de-rue-a-khartoum-que-se-passe-t-il-au-soudan_AV-202304170600.html"
"False","True","""J’ai hurlé à la mort"": bloquée plusieurs jours en haute montagne, une randonneuse raconte son calvaire","https://www.bfmtv.com/societe/j-ai-hurle-a-la-mort-bloquee-plusieurs-jours-en-haute-montagne-une-randonneuse-raconte-son-calvaire_AN-202304180369.html"
"False","True","Retraites, travail, sécurité... Ce qu'il faut retenir de l'allocution d'Emmanuel Macron","https://www.bfmtv.com/politique/elysee/retraites-travail-securite-ce-qu-il-faut-retenir-de-l-allocution-d-emmanuel-macron_AN-202304170649.html"
"False","True","Avant la grande journée de mobilisation du 1er mai, à quoi faut-il s'attendre?","https://www.bfmtv.com/economie/economie-social/social/avant-la-grande-journee-de-mobilisation-du-1er-mai-a-quoi-faut-il-s-attendre_AV-202304170353.html"
"False","True","À 101 ans, ce médecin du Val-de-Marne continue d'accueillir ses patients","https://www.bfmtv.com/societe/a-101-ans-ce-medecin-du-val-de-marne-continue-d-accueillir-ses-patients_AV-202304180176.html"
"False","True","Le mémorial d'Auschwitz rappelle à l'ordre les visiteurs qui se mettent en scène pour les…","https://www.bfmtv.com/tech/twitter/le-memorial-d-auschwitz-rappelle-a-l-ordre-les-visiteurs-qui-prennent-la-pose-et-publient-leurs-photos-en-ligne_AV-202304170350.html"
"False","True","""Ça incitait à des choses stupides"": un supermarché de Moselle renonce à vendre les chips…","https://www.bfmtv.com/economie/consommation/ca-incitait-a-des-choses-stupides-un-supermarche-de-moselle-renonce-a-vendre-les-chips-les-plus-piquantes-du-monde_AN-202304180013.html"
"False","True","L'interview de Dominique Schelcher, directeur général de Système U, en intégrale","https://www.bfmtv.com/economie/l-interview-de-dominique-schelcher-directeur-general-de-systeme-u-en-integrale_VN-202304180718.html"
"False","True","Dominique Schelcher, PDG de Système U, souhaite ""remettre en cause radicalement"" le code du Commerce","https://www.bfmtv.com/economie/dominique-schelcher-pdg-de-systeme-u-souhaite-remettre-en-cause-radicalement-le-code-du-commerce_VN-202304180714.html"
"False","True","Dominique Schelcher (Système U): ""Mes confrères allemands ont supprimé radicalement des marques entières de leurs rayons (...) s'il le faut, on le fera""","https://www.bfmtv.com/economie/dominique-schelcher-systeme-u-mes-confreres-allemands-ont-supprime-radicalement-des-marques-entieres-de-leurs-rayons-s-il-le-faut-on-le-fera_VN-202304180712.html"
"False","True","Pour Dominique Schelcher (Système U), ""la colère gronde"" par rapport à l'inflation","https://www.bfmtv.com/economie/pour-dominique-schelcher-systeme-u-la-colere-gronde-par-rapport-a-l-inflation_VN-202304180708.html"
"False","True","Dominique Schelcher (Système U): ""Combien de temps les Français vont-ils accepter cette situation?""","https://www.bfmtv.com/economie/dominique-schelcher-systeme-u-combien-de-temps-les-francais-vont-ils-accepter-cette-situation_VN-202304180705.html"
"False","True","EN DIRECT - Chelsea-Real Madrid: Rodrygo et le Real punissent les Blues, la qualif est proche","https://rmcsport.bfmtv.com/football/ligue-des-champions/en-direct-ligue-des-champions-suivez-l-affiche-chelsea-real-madrid-en-live_LS-202304180525.html"
"False","True","EN DIRECT - Naples-AC Milan: Giroud se rattrape, les Rossoneri font un pas vers le dernier carré","https://rmcsport.bfmtv.com/football/ligue-des-champions/en-direct-ligue-des-champions-suivez-l-affiche-naples-ac-milan-en-live_LS-202304180521.html"
"False","True","Mercato: le PSG a un œil sur José Mourinho qui n’est pas insensible","https://rmcsport.bfmtv.com/football/transferts/mercato-le-psg-a-un-oeil-sur-jose-mourinho-qui-n-est-pas-insensible_AV-202304180559.html"
"False","True","Nice-Bâle: retournement de situation, les supporters suisses finalement interdits de déplacement","https://rmcsport.bfmtv.com/football/europa-conference-league/nice-bale-retournement-de-situation-les-supporters-suisses-finalement-interdits-de-deplacement_AV-202304180732.html"
"False","True","PSG: Neymar est au Brésil pour poursuivre sa rééducation","https://rmcsport.bfmtv.com/football/ligue-1/psg-neymar-est-au-bresil-pour-poursuivre-sa-reeducation_AP-202304180359.html"
"False","True","25 ans de ""Harry Potter"" : l'histoire des illustrations d'origine, qui reparaissent en librairie","https://www.bfmtv.com/culture/harry-potter-l-histoire-des-illustrations-d-origine-qui-reparaissent-en-librairie_GN-202301190278.html"
"False","True","Ligne rouge - Bac Nord, ils parlent enfin","https://www.bfmtv.com/police-justice/ligne-rouge-bac-nord-ils-parlent-enfin_GN-202301160707.html"
"False","True","Les intelligences artificielles vont-elles remplacer les artistes ?","https://www.bfmtv.com/tech/les-intelligences-artificielles-vont-elles-remplacer-les-artistes_GN-202301120101.html"
"False","True","100 ans de la fondation de l'URSS : comment Poutine mobile le passé soviétique contre l'Ukraine","https://www.bfmtv.com/international/asie/russie/100-ans-de-la-fondation-de-l-urss-comment-poutine-mobilise-le-passe-sovietique-contre-l-ukraine_GN-202212300003.html"
"False","True","Une demande en hausse mais une production en baisse : le café survivra-t-il à sa popularité ?","https://www.bfmtv.com/economie/une-demande-en-hausse-mais-une-production-en-baisse-le-cafe-survivra-t-il-a-sa-popularite_GN-202212270016.html"
