"premium","picture","title","url"
"False","True","Un volontaire français tué en Ukraine...","https://www.20minutes.fr/monde/ukraine/4030746-20230402-guerre-ukraine-direct-furieux-place-faite-russie-zelensky-veut-reforme-institutions-mondiales"
"False","True","Des influenceurs payés pour influencer le vote sur les trottinettes","https://www.20minutes.fr/paris/4030227-20230329-paris-influenceurs-payes-operateurs-influencer-vote-trottinettes"
"False","True","Verstappen s'impose, Leclerc et Alpine au tapis...","https://www.20minutes.fr/sport/f1/4030464-20230401-gp-f1-australie-direct-retour-force-mercedes-suivez-course-plus-tot-saison-partir-6h45"
"False","True","« On a vécu des débats animés et une expérience unique »","https://www.20minutes.fr/sante/4030631-20230402-convention-citoyenne-fin-vie-vecu-debats-animes-experience-unique"
"False","True","« Un dixième des bâtiments de Strasbourg pourrait être surélevé »","https://www.20minutes.fr/societe/4030527-20230402-dixieme-batiments-strasbourg-pourrait-etre-sureleve-ecologique"
"False","True","Comment la Jumbo-Visma est devenue la reine de la stratégie","https://www.20minutes.fr/sport/4030294-20230402-tour-flandres-mettent-partout-comment-jumbo-visma-devenue-reine-strategie"
"False","True","Oui, le fact checking sert à quelque chose","https://www.20minutes.fr/medias/4030654-20230402-democratie-nouvelles-technologies-crise-confiance-oui-fact-checking-sert-quelque-chose"
"False","True","Marc Fesneau veut empêcher l’interdiction du S-métolachlore","https://www.20minutes.fr/planete/4030745-20230402-herbicide-marc-fesneau-veut-empecher-interdiction-metolachlore"
"False","True","Gerald Darmanin annonce la création d’une « cellule anti-ZAD »","https://www.20minutes.fr/societe/4030740-20230402-ministere-interieur-gerald-darmanin-annonce-creation-cellule-anti-zad"
"False","True","La justice suspend un arrêté interdisant des rassemblements la nuit à Paris","https://www.20minutes.fr/societe/reforme_des_retraites/4030743-20230402-reforme-retraites-justice-suspend-arrete-interdisant-rassemblements-nocturnes-paris"
"False","True","Marine Le Pen « envisage d’être présidente de la République » en 2027","https://www.20minutes.fr/politique/4030741-20230402-rassemblement-national-marine-pen-envisage-etre-presidente-republique-2027"
"False","True","Élisabeth Borne désapprouve l’interview de Marlène Schiappa dans Playboy","https://www.20minutes.fr/politique/4030721-20230401-marlene-schiappa-playboy-tout-approprie-gronde-elisabeth-borne-gauche-etrangle"
"False","True","Des milliers de manifestants à Vire, le fief d’Elisabeth Borne","https://www.20minutes.fr/politique/4030720-20230401-reforme-retraites-plusieurs-milliers-manifestants-vire-terre-elisabeth-borne"
"False","True","Gérald Darmanin annonce la création d’une « cellule anti-ZAD »","https://www.20minutes.fr/societe/4030740-20230402-ministere-interieur-gerald-darmanin-annonce-creation-cellule-anti-zad"
"False","True","Cancer, ADN, des vaccins à l'origine de notre mal ?","https://www.20minutes.fr/videos/4030489-20230401-vaccins-dangereux-sante"
"False","True","Des panneaux solaires « pas plus dur à monter qu’un meuble Ikea »","https://www.20minutes.fr/high-tech/4030466-20230401-panneaux-solaires-kit-plus-dur-monter-meuble-ikea-vante-beem-energy"
"False","True","Guerre de l'eau","https://www.20minutes.fr/diaporama/diaporama-4029844-images-scenes-guerre-autour-megabassine-sainte-soline-deux-sevres"
"False","True","24 heures","https://www.20minutes.fr/diaporama/diaporama-4029761-images-tornades-etats-unis-manifestation-contre-megabassines-sainte-soline-greve-france"
"False","True","Les vaginismes, les comprendre pour les soigner","https://www.20minutes.fr/podcast/4030486-20230331-tout-sexplique-vaginismes-comprendre-mieux-soigner"
"False","True","Comment guérir de blessures d’enfance ?","https://www.20minutes.fr/podcast/4030274-20230330-minute-papillon-comment-guerir-blessures-enfance"
"False","True","Linkee, l’association d’aide alimentaire qui lutte contre le gaspillage","https://www.20minutes.fr/podcast/4029753-20230327-minute-papillon-linkee-association-aide-alimentaire-lutte-contre-gaspillage"
"False","True","Elisabeth Borne désapprouve l’interview de Marlène Schiappa dans Playboy","https://www.20minutes.fr/politique/4030721-20230401-marlene-schiappa-playboy-tout-approprie-gronde-elisabeth-borne-gauche-etrangle"
"False","True","Une simple élection partielle dans les Pyrénées peut-elle faire sauter la Nupes ?","https://www.20minutes.fr/politique/4029867-20230330-ariege-simple-election-partielle-pyrenees-peut-faire-sauter-nupes"
"False","True","Un homme décède après avoir chuté d’une télécabine aux Deux Alpes","https://www.20minutes.fr/faits_divers/4030723-20230401-deux-alpes-homme-decede-apres-avoir-chute-accidentellement-telecabine"
"False","True","Un homme tué par balle après une course-poursuite près d’Orléans","https://www.20minutes.fr/faits_divers/4030715-20230401-orleans-homme-tue-balle-apres-course-poursuite"
"False","True","Un homme et une femme retrouvés morts dans un incendie près de Rouen","https://www.20minutes.fr/faits_divers/4030712-20230401-incendie-pres-rouen-homme-femme-retrouves-morts"
"False","True","Un rein et une partie de poumon en moins, Josélito court contre son cancer","https://www.20minutes.fr/sport/4029357-20230327-marathon-paris-rein-partie-poumon-moins-joselito-court-contre-cancer"
"False","True","Un homme décède après avoir chuté d’une télécabine","https://www.20minutes.fr/faits_divers/4030723-20230401-deux-alpes-homme-decede-apres-avoir-chute-accidentellement-telecabine"
"False","True","Marine Le Pen « envisage d’être présidente de la République » en 2027","https://www.20minutes.fr/politique/4030741-20230402-rassemblement-national-marine-pen-envisage-etre-presidente-republique-2027"
"False","True","La blockchain, un terreau fertile pour l’agroalimentaire","https://www.20minutes.fr/20-mint/4029273-20230323-blockchain-terreau-fertile-agroalimentaire-inversement"
"False","True","Kryptosphère, l’asso étudiante qui règne sur le Web3","https://www.20minutes.fr/20-mint/4029027-20230322-kryptosphere-asso-etudiante-regne-web3"
"False","True","On connaît désormais l’homme le plus éloquent du Web3","https://www.20minutes.fr/20-mint/4028834-20230321-blockchain-concours-designer-femme-homme-plus-eloquent-web3"
"False","True","Élisabeth Borne désapprouve l’interview de Marlène Schiappa dans Playboy","https://www.20minutes.fr/politique/4030721-20230401-marlene-schiappa-playboy-tout-approprie-gronde-elisabeth-borne-gauche-etrangle"
"False","True","Gérald Darmanin annonce la création d’une « cellule anti-ZAD »","https://www.20minutes.fr/societe/4030740-20230402-ministere-interieur-gerald-darmanin-annonce-creation-cellule-anti-zad"
"False","True","Un homme décède après avoir chuté d’une télécabine aux Deux Alpes","https://www.20minutes.fr/faits_divers/4030723-20230401-deux-alpes-homme-decede-apres-avoir-chute-accidentellement-telecabine"
"False","True","Après le passage de BRAV-M sur TPMP, le préfet de police ouvre une enquête","https://www.20minutes.fr/medias/4030692-20230401-tpmp-apres-passage-brav-plateau-hanouna-prefet-police-ouvre-enquete-saisit-justice"
"False","True","Guerre en Ukraine : Volodymyr Zelensky dénonce « la faillite » de l'ONU…","https://www.20minutes.fr/monde/ukraine/4030679-20230401-guerre-ukraine-direct-volodymyr-zelensky-promet-mal-russe-nouveau-nuremberg"
"False","True","Marathon de Paris 2023 : Le parcours complet de la course","https://www.20minutes.fr/sport/4030095-20230331-marathon-paris-2023-parcours-complet-course"
"False","True","Une retraitée, qui paye ses loyers, menacée d’expulsion près de Bordeaux","https://www.20minutes.fr/societe/4030397-20230331-gironde-si-expulsee-rue-lance-retraitee-62-ans-paye-loyers-pres-bordeaux"
"False","True","Après Sainte-Soline, « la guerre de l’eau » fait étape près de Grenoble","https://www.20minutes.fr/planete/environnement/4030581-20230401-videra-megabassine-sainte-soline-22-jours-pres-grenoble-extension-usine-fait-reagir"
"False","True","GP F1 d'Australie : Verstappen s'impose dans un Grand Prix de folie,…","https://www.20minutes.fr/sport/f1/4030464-20230401-gp-f1-australie-direct-retour-force-mercedes-suivez-course-plus-tot-saison-partir-6h45"
"False","True","Les oiseaux rejettent-ils leurs petits si un humain les touche ?","https://www.20minutes.fr/loisirs/4028436-20230328-oiseaux-rejettent-petits-si-humain-touche-vrai-faux"
"False","True","Plusieurs milliers de manifestants à Vire, terre d’Elisabeth Borne","https://www.20minutes.fr/politique/4030720-20230401-reforme-retraites-plusieurs-milliers-manifestants-vire-terre-elisabeth-borne"
"False","True","Zelensky dénonce la faillite de l'ONU","https://www.20minutes.fr/monde/ukraine/4030679-20230401-guerre-ukraine-direct-volodymyr-zelensky-promet-mal-russe-nouveau-nuremberg"
"False","True","Un nouveau volontaire français tué","https://www.20minutes.fr/monde/4030722-20230401-guerre-ukraine-nouveau-volontaire-francais-tue"
"False","True","Les capteurs de glycémie détournés par des influenceuses pour mincir","https://www.20minutes.fr/by-the-web/4030709-20230401-capteurs-glycemie-dedies-diabetiques-detournes-influenceuses-mincir"
"False","True","Orléans : Un homme tué par balle après une course-poursuite","https://www.20minutes.fr/faits_divers/4030715-20230401-orleans-homme-tue-balle-apres-course-poursuite"
"False","True","Mandat d’arrêt contre deux femmes non voilées agressées","https://www.20minutes.fr/monde/4030719-20230401-iran-mandat-arret-contre-deux-femmes-non-voilees-agressees-homme"
"False","True","La France se rassure et déroule en Irlande (3-53)","https://www.20minutes.fr/sport/4030713-20230401-tournoi-six-nations-feminin-france-rassure-deroule-irlande"
"False","True","Les écologistes disent non à un rendez-vous avec Élisabeth Borne","https://www.20minutes.fr/politique/4030716-20230401-ecologistes-disent-non-rendez-elisabeth-borne-apres-retraites"
