"premium","picture","title","url"
"False","False","Mort de Benoît XVI","https://www.bfmtv.com/societe/religions/mort-du-pape-benoit-xvi_DN-202301010055.html"
"False","False","Guerre en Ukraine","https://www.bfmtv.com/international/europe/ukraine-russie-le-bras-de-fer-mondial_DN-201904150203.html"
"False","False","Covid-19, la 9e vague","https://www.bfmtv.com/sante/coronavirus-vigilance-accrue-en-france_DN-202006100226.html"
"False","False","Mort de Pelé","https://rmcsport.bfmtv.com/football/pele_DN-202212290143.html"
"False","True","Avec la hausse des températures, la consommation d’électricité baisse de 8,5%","https://www.bfmtv.com/economie/entreprises/energie/avec-la-hausse-des-temperatures-la-consommation-d-electricite-baisse-de-8-5_AN-202301040033.html"
"False","True","L'inflation ralentit à 5,9% sur un an en décembre","https://www.bfmtv.com/economie/economie-social/france/l-inflation-ralentit-a-5-9-sur-un-an-en-decembre_AD-202301040170.html"
"False","True","""Ça peut faire péter les campagnes"": pourquoi le gouvernement accélère pour aider les boulangers","https://www.bfmtv.com/politique/gouvernement/ca-peut-faire-peter-les-campagnes-pourquoi-le-gouvernement-accelere-pour-aider-les-boulangers_AN-202301030584.html"
"False","True","Factures d'énergie: ces entreprises qui préfèrent stopper la production","https://www.bfmtv.com/economie/entreprises/factures-d-energie-ces-entreprises-qui-preferent-stopper-la-production_AN-202301040016.html"
"False","True","Retraites: Roland Lescure affirme qu'il ""y aura sans doute deux ou trois ans à travailler en plus""","https://www.bfmtv.com/politique/retraites-roland-lescure-affirme-qu-il-y-aura-sans-doute-deux-ou-trois-ans-a-travailler-en-plus_AV-202301030662.html"
"False","False","Recul de l'âge de départ à la retraite: la CFDT dénonce une ""mesure extrêmement brutale""","https://www.bfmtv.com/economie/economie-social/recul-de-l-age-de-depart-a-la-retraite-la-cfdt-denonce-une-mesure-extremement-brutale_AV-202301030612.html"
"False","True","Mobilisation, revendications: qu'attendre de l'appel au rassemblement des gilets jaunes le 7 janvier?","https://www.bfmtv.com/politique/mobilisation-revendications-qu-attendre-de-l-appel-au-rassemblement-des-gilets-jaunes-le-7-janvier_AN-202301030379.html"
"False","False","Retraites, immigration, inflation, énergie... Le calendrier de la rentrée explosive du…","https://www.bfmtv.com/politique/gouvernement/retraites-immigration-inflation-energie-le-calendrier-de-la-rentree-explosive-du-gouvernement_AN-202301030319.html"
"False","True","Les soldats russes tués par la frappe ukrainienne à Makiivka trahis par leurs portables?","https://www.bfmtv.com/international/asie/russie/les-soldats-russes-tues-par-la-frappe-ukrainienne-a-makiivka-trahis-par-leurs-portables_AV-202301040063.html"
"False","False","Ukraine: le bilan grimpe à 89 morts à Makiivka après une frappe sur une base occupée par…","https://www.bfmtv.com/international/guerre-en-ukraine-le-bilan-de-la-frappe-sur-makiivka-grimpe-a-89-morts_AD-202301030679.html"
"False","True","Soldats russes tués en Ukraine: à quelle réplique s'attendre de la part de Moscou?","https://www.bfmtv.com/international/asie/russie/au-moins-63-russes-tues-en-ukraine-a-quelle-replique-s-attendre-de-la-part-de-moscou_AN-202301030444.html"
"False","True","""Je suis trop amoché pour écrire"": Jeremy Renner s'exprime pour la première fois depuis son accident","https://www.bfmtv.com/people/je-vous-envoie-de-l-amour-a-tous-jeremy-renner-s-exprime-pour-la-premiere-fois-depuis-son-hospitalisation_AN-202301040004.html"
"False","True","Athlétisme: triple médaillé olympique, Mekhissi annonce sa retraite","https://rmcsport.bfmtv.com/athletisme/athletisme-triple-medaille-olympique-mekhissi-annonce-sa-retraite_AD-202301030645.html"
"False","True","Pénuries de médicaments: Brigitte Autran, présidente du Covars, affirme qu'""il y a un problème avec le paracétamol""","https://www.bfmtv.com/sante/penuries-de-medicaments-brigitte-autran-presidente-du-covars-affirme-qu-il-y-a-un-probleme-avec-le-paracetamol_AV-202301030671.html"
"False","False","Covid-19 en Chine: Brigitte Autran, présidente du Covars, estime que Pékin à ""ouvert la…","https://www.bfmtv.com/sante/covid-19-en-chine-brigitte-autran-presidente-du-covars-estime-que-pekin-a-ouvert-la-boite-de-pandore_AV-202301030658.html"
"False","True","Il n'y a pas de chef à La France insoumise. Manuel Bompard","https://www.bfmtv.com/politique/la-france-insoumise/pour-manuel-bompard-il-n-y-a-pas-de-chef-a-la-france-insoumise_AV-202301030260.html"
"False","True","Covid-19: ce que l'on sait du sous-variant XBB.1.5 qui circule activement aux États-Unis","https://www.bfmtv.com/sante/covid-19-ce-que-l-on-sait-du-sous-variant-xbb-1-5-qui-circule-activement-aux-etats-unis_AN-202301030593.html"
"False","True","Variole du singe: les autorités sanitaires recommandent de stocker des vaccins","https://www.bfmtv.com/sante/variole-du-singe-les-autorites-sanitaires-recommandent-de-stocker-des-vaccins_AD-202301040141.html"
"False","True","""Ce n'est pas ce que je dis qu'on attaque, c'est moi"": Omar Sy revient sur son interview ""polémique""","https://www.bfmtv.com/people/cinema/ce-n-est-pas-ce-que-je-dis-qu-on-attaque-c-est-moi-omar-sy-revient-sur-son-interview-polemique_AN-202301030665.html"
"False","True","Plusieurs établissements scolaires évacués après des menaces d'attentat à la bombe","https://www.bfmtv.com/grand-lille/plusieurs-etablissements-scolaires-evacues-apres-des-menaces-d-attentat-a-la-bombe_AN-202301030448.html"
"False","True","Incertitude au Congrès américain, où les Républicains sont incapables de choisir le nouveau ""speaker""","https://www.bfmtv.com/international/amerique-nord/etats-unis/incertitude-au-congres-americain-ou-les-republicains-sont-incapables-de-choisir-le-nouveau-speaker_AD-202301040009.html"
"False","True","Vaucluse: un maire RN supprime les menus de substitution des cantines pour faire des ""économies""","https://www.bfmtv.com/societe/vaucluse-un-maire-rn-supprime-les-menus-de-substitution-des-cantines-pour-faire-des-economies_AN-202301040036.html"
"False","True","La ville de Pantin rebaptisée ""Pantine"" en 2023, pour soutenir l'égalité femmes-hommes","https://www.bfmtv.com/paris/la-ville-de-pantin-rebaptisee-pantine-en-2023-pour-soutenir-l-egalite-femmes-hommes_AN-202301030393.html"
"False","True","Soldes d'hiver 2023: quelles sont les dates dans votre région?","https://www.bfmtv.com/economie/consommation/soldes-d-hiver-2023-quelles-sont-les-dates-dans-votre-region_AV-202301030375.html"
"False","True","Vous pouvez désormais repérer les numéros de démarchage téléphonique, voici comment faire","https://www.bfmtv.com/tech/actualites/telecoms/vous-pouvez-desormais-reperer-les-numeros-de-demarchage-telephonique-voici-comment-faire_AV-202301030194.html"
"False","True","Sécheresse, électricité: pourquoi le prix de l'eau va augmenter en 2023","https://www.bfmtv.com/economie/entreprises/energie/secheresse-electricite-pourquoi-le-prix-de-l-eau-va-augmenter-en-2023_AV-202301030267.html"
"False","True","""Je suis trop amoché pour écrire"": Jeremy Renner s'exprime pour la première fois depuis…","https://www.bfmtv.com/people/je-vous-envoie-de-l-amour-a-tous-jeremy-renner-s-exprime-pour-la-premiere-fois-depuis-son-hospitalisation_AN-202301040004.html"
"False","True","Les Français boivent moins de vin et inquiètent les vignerons","https://www.bfmtv.com/societe/les-francais-boivent-moins-de-vin-et-inquietent-les-vignerons_AN-202301030276.html"
"False","True","Tisane, compost, décorations... Que faire de son sapin de Noël après les fêtes?","https://www.bfmtv.com/societe/tisane-compost-decorations-que-faire-de-son-sapin-de-noel-apres-les-fetes_AN-202301030398.html"
"False","True","L'inflation ralentit à 5,9% sur un an en décembre","https://www.bfmtv.com/economie/economie-social/france/l-inflation-ralentit-a-5-9-sur-un-an-en-decembre_AD-202301040170.html"
"False","True","Entreprises en difficulté: à quoi sert le Ciri ?","https://www.bfmtv.com/economie/entreprises/entreprises-en-difficulte-a-quoi-sert-le-ciri_AN-202301040017.html"
"False","True","Factures d'énergie: ces entreprises qui préfèrent stopper la production","https://www.bfmtv.com/economie/entreprises/factures-d-energie-ces-entreprises-qui-preferent-stopper-la-production_AN-202301040016.html"
"False","True","""Ça peut faire péter les campagnes"": pourquoi le gouvernement accélère pour aider les boulangers","https://www.bfmtv.com/politique/gouvernement/ca-peut-faire-peter-les-campagnes-pourquoi-le-gouvernement-accelere-pour-aider-les-boulangers_AN-202301030584.html"
"False","True","Paris 2024: Île-de-France Mobilités peine à trouver des transporteurs pour les accrédités","https://www.bfmtv.com/paris/paris-2024-ile-de-france-mobilites-peine-a-trouver-des-transporteurs-pour-les-accredites_AD-202301030625.html"
"False","True","Rennes-Nice: ""On est tristes pour lui"", Genesio touché par la grosse blessure de Terrier","https://rmcsport.bfmtv.com/football/ligue-1/rennes-nice-on-est-tristes-pour-lui-genesio-touche-par-la-grosse-blessure-de-terrier_AV-202301020653.html"
"False","True","Montpellier-OM: Marseille joue à se faire peur mais conforte sa place sur le podium","https://rmcsport.bfmtv.com/football/ligue-1/montpellier-om-marseille-joue-a-se-faire-peur-mais-conforte-sa-place-sur-le-podium_AV-202301020611.html"
"False","True","Mort de Pelé: l'absence de Neymar fait beaucoup parler au Brésil","https://rmcsport.bfmtv.com/football/mort-de-pele-l-absence-de-neymar-fait-beaucoup-parler-au-bresil_AP-202301020658.html"
"False","True","EN DIRECT - Mort de Pelé: la dépouille de la légende brésilienne est arrivée au cimetière","https://rmcsport.bfmtv.com/football/en-direct-mort-de-pele-toutes-les-reactions-et-les-infos-apres-le-deces-de-la-legende-du-foot-bresilien-a-82-ans_LN-202212290429.html"
"False","True","Tennis: l'ancienne N°1 mondiale Martina Navratilova atteinte d'un cancer du sein et de la gorge","https://rmcsport.bfmtv.com/tennis/wta/tennis-l-ancienne-ndeg1-mondiale-martina-navratilova-atteinte-d-un-cancer-du-sein-et-de-la-gorge_AV-202301020502.html"
"False","True","L'Ukraine confronté au fléau des mines, ces armes qui ""prolongent la guerre après la guerre""","https://www.bfmtv.com/international/europe/l-ukraine-confrontee-au-fleau-des-mines-ces-armes-qui-prolongent-la-guerre-apres-la-guerre_GN-202211200040.html"
"False","True","""C'est une cage dorée"" : la difficile reconversion des acteurs de ""Plus belle la vie""","https://www.bfmtv.com/people/series/c-est-une-cage-doree-la-difficile-reconversion-des-acteurs-de-plus-belle-la-vie_AN-202211180059.html"
"False","True","""2050, ouvrons les yeux"" : Comment le réchauffement climatique va bouleverser nos vies","https://www.bfmtv.com/environnement/climat/2050-le-grand-defi-climatique-le-docu-d-anticipation-de-bfmtv-sur-le-rechauffement_GN-202211070001.html"
"False","True","Réchauffement climatique : à quoi ressemblera la France avec la montée des eaux ?","https://www.bfmtv.com/environnement/climat/rechauffement-climatique-a-quoi-ressemblera-la-france-avec-la-montee-des-eaux_GN-202211140026.html"
"False","True","Dall-e, Midjourney...Comment nous avons généré des oeuvres d'art grâce à l'intelligence artificielle","https://www.bfmtv.com/tech/dall-e-midjourney-comment-vous-pouvez-devenir-un-artiste-grace-a-l-intelligence-artificielle_GN-202211100026.html"
"False","True","""On n'a plus le choix"" : Pourquoi les militants pour le climat changent de méthode","https://www.bfmtv.com/environnement/climat/on-n-a-plus-le-choix-pourquoi-les-militants-pour-le-climat-changent-de-methode_GN-202211060030.html"
"False","True","Emmanuel Macron interviewé par des journalistes autistes dans ""les rencontres du Papotin""","https://www.bfmtv.com/people/emmanuel-macron-interviewe-par-des-journalistes-autistes-dans-les-rencontres-du-papotin_VN-202301040135.html"
