"premium","picture","title","url"
"False","True","« On m’a pris pour un fou »… Erwan Simon, le premier à surfer au Kazakhstan ?","https://www.20minutes.fr/sport/4020413-20230126-surf-pris-fou-erwan-simon-peut-etre-premier-homme-dompter-vagues-kazakhstan"
"False","True","L’ex-garde des Sceaux Michel Mercier condamné pour des emplois fictifs","https://www.20minutes.fr/justice/4020690-20230126-emplois-fictifs-senat-ex-garde-sceaux-michel-mercier-condamne-trois-ans-prison-sursis"
"False","True","« L’homme pénétré », la BD qui s'attaque aux tabous autour de la pénétration anale masculine","https://www.20minutes.fr/culture/4020430-20230126-homme-penetre-bd-penetration-anale-masculine-eviter-insere-violence"
"False","True","Tout savoir sur les mystérieux incendies dans trois églises à Paris","https://www.20minutes.fr/faits_divers/4020664-20230126-paris-tout-savoir-mysterieux-incendies-volontaires-declenches-trois-eglises"
"False","True","Des associations révoltées par des coupes d’arbres au bois de Vincennes","https://www.20minutes.fr/paris/4020542-20230126-coupes-arbres-bois-vincennes-bien-etre-foret-associations-protestent"
"False","True","Près de 66.000 déplacés ukrainiens ont trouvé refuge en France l'an dernier...","https://www.20minutes.fr/monde/ukraine/4020593-20230126-guerre-ukraine-direct-apres-semaines-hesitations-berlin-washington-vont-livrer-chars-lourds-kiev"
"False","True","Après le « non » à Buisson, Florian Grill réclame des élections à la FFR","https://www.20minutes.fr/sport/rugby/4020682-20230126-ffr-volonte-forte-tourner-page-reagit-florian-grill-principal-opposant-bernard-laporte"
"False","True","Des années 1970 à l'ère MeToo, retour sur la figure de la journaliste dans les séries","https://www.20minutes.fr/serie/4020615-20230126-profession-reporter-journaliste-figure-emancipation-feminine-series"
"False","True","Voici les communes les plus prisées en Loire-Atlantique","https://www.20minutes.fr/nantes/4020672-20230126-immobilier-nantes-communes-plus-attractives"
"False","True","La Nupes adapte sa stratégie en vue de la bataille sur les retraites","https://www.20minutes.fr/politique/4020443-20230126-reforme-retraites-nupes-adapte-strategie-parlementaire"
"False","True","A Toulouse, entre deux manifestations, les syndicats ne « lâchent rien »","https://www.20minutes.fr/societe/4020549-20230126-reforme-retraites-toulouse-entre-deux-manifestations-syndicats-lachent-rien"
"False","True","Attaque mortelle en Espagne, grève dans l’énergie et crise avec le Burkina","https://www.20minutes.fr/societe/4020597-20230126-heure-bim-terrorisme-presume-espagne-greve-energie-depart-burkina-soldats-francais"
"False","True","Dockers, raffineurs et électriciens en grève ce jeudi","https://www.20minutes.fr/societe/4020596-20230126-reforme-retraites-dockers-raffineurs-electriciens-greve-jeudi"
"False","True","« Interdit aux chiens et aux Italiens » mais ni à la cruauté ni à l’émotion","https://www.20minutes.fr/cinema/4019928-20230125-interdit-chiens-italiens-alain-ughetto-lance-marionnettes-traces-famille-disparue"
"False","True","Le trafic interrompu à gare de l’Est à cause d’un « acte de malveillance »","https://www.20minutes.fr/societe/4020215-20230124-paris-trafic-totalement-interrompu-gare-cause-panne-reprise-esperee-10-heures"
"False","True","Michaël Youn est toujours aussi jeune dans sa tête","https://www.20minutes.fr/cinema/4019920-20230121-festival-alpe-huez-michael-youn-toujours-aussi-jeune-tete"
"False","True","24 heures","https://www.20minutes.fr/diaporama/diaporama-15471-images-mobilisation-contre-reforme-retraites-amitie-franco-allemande-fusillade-californie"
"False","True","Carnage à Dnipro","https://www.20minutes.fr/diaporama/diaporama-15467-guerre-ukraine-images-missile-russe-detruit-immeuble-dnipro"
"False","True","La réhydratation du côlon, pratique à risques ?","https://www.20minutes.fr/podcast/4020614-20230126-minute-papillon-rehydratation-colon-pratique-risques"
"False","True","Envoyé spécial au Qatar, les coulisses, par notre journaliste","https://www.20minutes.fr/podcast/4020143-20230125-minute-papillon-envoye-special-qatar-cotes-coupe-monde"
"False","True","Les Françaises sont-elles adeptes du « fast-fucking » ?","https://www.20minutes.fr/podcast/4019782-20230120-tout-sexplique-rapport-francaises-entretiennent-elles-fast-fucking"
"False","True","Du rêve au cauchemar, ils se souviendront longtemps de leur passage à la douane","https://www.20minutes.fr/societe/4020495-20230126-reve-cauchemar-souviendront-longtemps-passage-douane"
"False","True","La colère contre Bastien Vivès est « légitime » selon Rima Abdul Malak","https://www.20minutes.fr/culture/4020681-20230126-affaire-bastien-vives-colere-contre-dessinateur-legitime-dit-ministre-culture-angouleme"
"False","True","Des tests de dépistage ont-ils vraiment été brevetés dès 2015 ?","https://www.20minutes.fr/sante/4020261-20230126-covid-19-tests-depistage-vraiment-brevetes-2015"
"False","True","De mystérieux incendies volontaires touchent trois églises parisiennes","https://www.20minutes.fr/faits_divers/4020664-20230126-paris-tout-savoir-mysterieux-incendies-volontaires-declenches-trois-eglises"
"False","True","Des mineurs rusent en trottinette et volent la voiture d’une infirmière","https://www.20minutes.fr/faits_divers/4020649-20230126-besancon-mineurs-feignent-chute-trottinette-violentent-infirmiere-avant-voler-voiture"
"False","True","Une voiture fauche une jeune piétonne avant de prendre la fuite, à Bordeaux","https://www.20minutes.fr/faits_divers/4020637-20230126-bordeaux-voiture-percute-jeune-fille-18-ans-avant-prendre-fuite"
"False","True","Leopard, Abram, Challenger… Qui envoie quels chars à Kiev ?","https://www.20minutes.fr/monde/ukraine/4020619-20230126-guerre-ukraine-leopard-abram-challenger-envoie-chars-kiev"
"False","True","Que sait-on de l’attaque à la machette dans deux églises en Espagne ?","https://www.20minutes.fr/monde/4020600-20230126-espagne-sait-attaque-machette-deux-eglises"
"False","True","Le « non » à Buisson l’emporte, Laporte encore plus fragilisé","https://www.20minutes.fr/sport/rugby/4020659-20230126-ffr-non-patrick-buisson-emporte-bernard-laporte-encore-plus-fragilise"
"False","True","La crypto-licorne Ledger présente sa vision du futur","https://www.20minutes.fr/20-mint/4020566-20230125-crypto-licorne-ledger-presente-vision-futur"
"False","True","Cryptocademia se voit comme le Poudlard du Web3","https://www.20minutes.fr/20-mint/4020433-20230125-cryptocademia-voit-comme-poudlard-web3"
"False","True","Avec « NBA All-World », Niantic part à la chasse aux basketteurs","https://www.20minutes.fr/20-mint/4019974-20230122-nba-all-world-createur-pokemon-go-pousse-vision-sociale-metavers-smartphone"
"False","True","Guerre en Ukraine EN DIRECT : Près de 66.000 déplacés ukrainiens ont…","https://www.20minutes.fr/monde/ukraine/4020593-20230126-guerre-ukraine-direct-apres-semaines-hesitations-berlin-washington-vont-livrer-chars-lourds-kiev"
"False","True","« On a eu chaud ! »… Les mésaventures aux frontières de nos lecteurs","https://www.20minutes.fr/societe/4020495-20230126-reve-cauchemar-souviendront-longtemps-passage-douane"
"False","True","L’horloge de l’apocalypse alerte sur « l’imminence du danger »","https://www.20minutes.fr/sciences/4020453-20230125-horloge-apocalypse-fait-prendre-conscience-imminence-danger"
"False","True","« Après des mois de combats difficiles », l’Ukraine a cédé Soledar","https://www.20minutes.fr/monde/ukraine/4020586-20230126-guerre-ukraine-apres-mois-combats-difficiles-armee-ukrainienne-reconnait-avoir-cede-soledar"
"False","True","Un bébé positif à la cocaïne, la nounou en garde à vue","https://www.20minutes.fr/faits_divers/4020587-20230126-nimes-bebe-teste-positif-cocaine-nounou-garde-vue"
"False","True","De Miss à mème, la folle histoire d’Eva Colas","https://www.20minutes.fr/by-the-web/4020489-20230125-miss-universe-scream-comment-ex-miss-francaise-devenue-international"
"False","True","Il égorge « Pantoufle », le chien reçu en cadeau pour combler sa solitude","https://www.20minutes.fr/faits_divers/4020503-20230125-belgique-egorge-pantoufle-petit-chien-recu-cadeau-combler-solitude"
"False","True","Nikola Karabatic et les Bleus « sous le choc » face à l’affaire Martini","https://www.20minutes.fr/sport/4020594-20230126-affaire-bruno-martini-nikola-karabatic-equipe-france-handball-tous-sous-choc"
"False","True","Riad Sattouf décroche le Grand Prix du Festival d’Angoulême","https://www.20minutes.fr/culture/4020550-20230125-bd-riad-sattouf-decroche-grand-prix-festival-angouleme"
"False","True","Comment rédiger un testament sans devoir payer un notaire ?","https://www.20minutes.fr/economie/4018961-20230125-succession-comment-rediger-testament-devoir-payer-notaire"
"False","True","Une ex-collègue de Le Graët le voit comme un « malade du zigouigoui »","https://www.20minutes.fr/sport/4020604-20230126-fff-ancienne-collaboratrice-decrit-noel-graet-comme-chasseur-malade-zigouigoui"
"False","True","Irez-vous encore en vacances à la montagne en 2023 ?","https://www.20minutes.fr/societe/4018377-20230111-entre-rechauffement-hausse-prix-irez-encore-montagne-2023-racontez"
"False","True","La réhydratation du côlon, une pratique à risques ?","https://www.20minutes.fr/podcast/4020614-20230126-minute-papillon-rehydratation-colon-pratique-risques"
"False","True","TotalEnergies visé par une enquête pour « pratiques trompeuses »","https://www.20minutes.fr/planete/4020674-20230126-greenwashing-totalenergies-vise-enquete-pratiques-commerciales-trompeuses-nanterre-depuis-fin-2021"
"False","True","Un passionné de Lego recrée la station Pasteur et c’est bluffant","https://www.20minutes.fr/paris/4020617-20230126-metro-passionne-lego-recree-station-pasteur"
"False","True","« Il y a parfois une forme de paresse, un manque de conviction, chez les juges »","https://www.20minutes.fr/justice/4020476-20230126-cold-cases-parfois-forme-paresse-manque-conviction-chez-juges-instruction"
"False","True","Toujours sans nouvelles de Leslie et Kevin deux mois après leur disparition","https://www.20minutes.fr/societe/4020608-20230126-deux-sevres-mysterieuse-disparition-couple-campagne-niortaise"
