"premium","picture","title","url"
"False","True","Retraites, immigration… Ce qu’il faut retenir de l’interview d’Emmanuel Macron dans « Le Parisien »","https://www.ouest-france.fr/politique/emmanuel-macron/retraites-emmanuel-macron-estime-quil-doit-se-reengager-dans-le-debat-public-d6a10c78-e1f0-11ed-87f3-f6e218170d12"
"False","True","Réforme des retraites. Quatre choses à savoir sur ces casseroles qui font du bruit","https://www.ouest-france.fr/economie/retraites/reforme-des-retraites-quatre-choses-a-savoir-sur-ces-casseroles-qui-font-du-bruit-ffb91dd2-e1ee-11ed-87f3-f6e218170d12"
"True","True","ENTRETIEN. Sophie Binet, à la tête de la CGT: « On peut perdre des batailles sans perdre la guerre »","https://www.ouest-france.fr/economie/syndicats/cgt/sophie-binet/entretien-sophie-binet-on-nest-pas-dans-la-logique-du-grand-soir-2f5015fa-e041-11ed-926f-b54c0e75f85a"
"False","True","EN IMAGES. La première année du deuxième quinquennat d’Emmanuel Macron résumée en dix photos","https://www.ouest-france.fr/politique/emmanuel-macron/en-images-la-premiere-annee-du-deuxieme-quinquennat-demmanuel-macron-resumee-en-dix-photos-87dc0700-e1c3-11ed-908e-9b680907ca67"
"False","True","DIRECT. OL – OM : les Lyonnais égalisent dans le choc des Olympiques","https://www.ouest-france.fr/sport/football/ligue-1/direct/direct-lyon-marseille-suivez-la-rencontre-de-la-32e-journee-de-ligue-en-direct-ef6e2bc6-e08a-11ed-85f8-8628b3aa7259"
"False","True","EN IMAGES. Le pas de tir de SpaceX ébranlé par la puissance du décollage de Starship","https://www.ouest-france.fr/sciences/espace/en-images-le-pas-de-tir-de-spacex-ebranle-par-la-puissance-du-decollage-de-starship-a5ae7232-e20d-11ed-87f3-f6e218170d12"
"False","True","Au Soudan, l’opération d’évacuation des étrangers en cours","https://www.ouest-france.fr/monde/soudan/loperation-devacuation-des-etrangers-en-cours-au-soudan-266d58ec-e1ec-11ed-908e-9b680907ca67"
"False","True","CARTE. Guerre en Ukraine : manifestation à Paris, visite de Clément Beaune… Le point du jour","https://www.ouest-france.fr/europe/ukraine/carte-guerre-en-ukraine-manifestation-a-paris-visite-de-clement-beaune-le-point-du-jour-290368f2-e201-11ed-87f3-f6e218170d12"
"False","False","Destructions de bidonvilles, expulsions… Mayotte se prépare à une semaine tendue","https://www.ouest-france.fr/mayotte/destructions-de-bidonvilles-expulsions-mayotte-se-prepare-a-une-semaine-tendue-6059af90-e1f8-11ed-87f3-f6e218170d12"
"False","False","Ligue 1. Grosse désillusion pour le Stade Rennais, en supériorité numérique et battu à Montpellier","https://www.ouest-france.fr/sport/football/ligue-1/direct/direct-montpellier-rennes-suivez-la-rencontre-de-la-32e-journee-de-ligue-1-en-live-3d9c310a-e0e8-11ed-ac2b-5fe553293d95"
"False","False","Projet de loi immigration : Emmanuel Macron veut « un seul texte » de loi","https://www.ouest-france.fr/politique/emmanuel-macron/projet-de-loi-immigration-emmanuel-macron-veut-un-seul-texte-de-loi-d328f352-e1f6-11ed-87f3-f6e218170d12"
"False","False","Russie. Un divorce pour éviter les sanctions françaises liées la guerre en Ukraine","https://www.ouest-france.fr/monde/guerre-en-ukraine/un-divorce-pour-eviter-les-sanctions-francaises-796d9f1a-e1cf-11ed-908e-9b680907ca67"
"False","False","6 Nations féminin. La France domine le pays de Galles et jouera le Grand Chelem face à l’Angleterre","https://www.ouest-france.fr/sport/rugby/6-nations/direct/direct-france-pays-de-galles-suivez-le-match-du-tournoi-des-6-nations-feminin-2023-en-live-40fb979a-e11b-11ed-88d5-e9de6c339278"
"False","False","Un incendie se déclare dans un appartement à Cherbourg : le voisin sort les deux occupants","https://www.ouest-france.fr/faits-divers/incendie/a-cherbourg-un-incendie-se-declare-au-rez-de-chaussee-dun-immeuble-de-cinq-etages-18afb376-e1ec-11ed-87f3-f6e218170d12"
"False","True","Réforme des retraites. Quatre choses à savoir sur ces casseroles qui font du bruit","https://www.ouest-france.fr/economie/retraites/reforme-des-retraites-quatre-choses-a-savoir-sur-ces-casseroles-qui-font-du-bruit-ffb91dd2-e1ee-11ed-87f3-f6e218170d12"
"False","True","EN IMAGES. La première année du deuxième quinquennat d’Emmanuel Macron résumée en dix photos","https://www.ouest-france.fr/politique/emmanuel-macron/en-images-la-premiere-annee-du-deuxieme-quinquennat-demmanuel-macron-resumee-en-dix-photos-87dc0700-e1c3-11ed-908e-9b680907ca67"
"True","True","ENTRETIEN. Sophie Binet, à la tête de la CGT: « On peut perdre des batailles sans perdre la guerre »","https://www.ouest-france.fr/economie/syndicats/cgt/sophie-binet/entretien-sophie-binet-on-nest-pas-dans-la-logique-du-grand-soir-2f5015fa-e041-11ed-926f-b54c0e75f85a"
"False","True","Retraites, immigration… Ce qu’il faut retenir de l’interview d’Emmanuel Macron dans « Le Parisien »","https://www.ouest-france.fr/politique/emmanuel-macron/retraites-emmanuel-macron-estime-quil-doit-se-reengager-dans-le-debat-public-d6a10c78-e1f0-11ed-87f3-f6e218170d12"
"False","True","«On fabrique de plus en plus de casseroles en France mais pas assez» pour le ministre de l’Industrie","https://www.ouest-france.fr/politique/gouvernement/on-fabrique-de-plus-en-plus-de-casseroles-en-france-mais-pas-assez-pour-le-ministre-de-lindustrie-3eb1baca-e1c8-11ed-87f3-f6e218170d12"
"False","True","ÉDITORIAL. Arméniens, d’un génocide à l’autre…","https://www.ouest-france.fr/reflexion/editorial/editorial-armeniens-dun-genocide-a-lautre-6d91d122-e065-11ed-926f-b54c0e75f85a"
"False","True","Envie d’ailleurs ? Voici dix destinations dépaysantes où la vie est moins chère","https://www.ouest-france.fr/leditiondusoir/2023-04-21/envie-d-ailleurs-voici-dix-destinations-depaysantes-ou-la-vie-est-moins-chere-dde6f967-2b1b-40a3-b3a6-76339766b829"
"True","True","Disparu à Rennes depuis une semaine, le corps d’un homme retrouvé dans la Vilaine à Chavagne","https://www.ouest-france.fr/bretagne/chavagne-35310/disparu-a-rennes-depuis-une-semaine-le-corps-dun-homme-retrouve-dans-la-vilaine-a-chavagne-daa71f32-e1f1-11ed-87f3-f6e218170d12"
"True","True","Volés pendant la Guerre 39-45, deux tableaux rendus aux petits-enfants d’un couple de Bretons","https://www.ouest-france.fr/bretagne/audierne-29770/spolies-pendant-la-guerre-39-45-deux-tableaux-rendus-aux-petits-enfants-dun-couple-de-bretons-381ba130-dfb1-11ed-bde1-d2efbec1215e"
"True","True","Dans les Côtes-d’Armor, les habitants manifestent leur soutien au médecin en conflit avec la mairie","https://www.ouest-france.fr/bretagne/plougrescant-22820/dans-les-cotes-darmor-les-habitants-manifestent-leur-soutien-au-medecin-en-conflit-avec-la-mairie-155fc846-e1c9-11ed-87f3-f6e218170d12"
"False","True","Des recherches en cours pour un pêcheur emporté par une vague sur la côte sauvage, à Quiberon","https://www.ouest-france.fr/societe/faits-divers/des-recherches-en-cours-pour-un-pecheur-emporte-par-une-vague-a-la-cote-sauvage-a-quiberon-9c852588-e1dc-11ed-908e-9b680907ca67"
"False","True","Un incendie se déclare dans un appartement à Cherbourg : le voisin sort les deux occupants","https://www.ouest-france.fr/faits-divers/incendie/a-cherbourg-un-incendie-se-declare-au-rez-de-chaussee-dun-immeuble-de-cinq-etages-18afb376-e1ec-11ed-87f3-f6e218170d12"
"False","True","Saint-Brice-sous-Rânes. Une rave party réunit 200 fêtards, la maire va porter plainte","https://www.ouest-france.fr/normandie/saint-brice-sous-ranes-61150/on-est-juste-la-pour-samuser-une-rave-party-reunit-plus-de-cent-fetards-dans-lorne-27e5e09e-e1b6-11ed-908e-9b680907ca67"
"True","True","TÉMOIGNAGE. Olivia a surmonté le harcèlement grâce au karaté","https://www.ouest-france.fr/faits-divers/harcelement/temoignage-olivia-a-surmonte-le-harcelement-grace-au-karate-fac3f642-e024-11ed-b28f-3a8de8f2f6d3"
"True","True","SM Caen. Norman Bassette : « Ma famille et moi, on attendait cette première titularisation »","https://www.ouest-france.fr/sport/football/sm-caen/sm-caen-norman-bassette-ma-famille-et-moi-on-attendait-cette-premiere-titularisation-b05d4300-e160-11ed-ac2b-5fe553293d95"
"False","True","Deuxième coupure d’internet à Fontenay-le-Comte en une semaine : « 10 000 » personnes touchées","https://www.ouest-france.fr/high-tech/orange/deuxieme-coupure-dinternet-a-fontenay-le-comte-en-une-semaine-10-000-personnes-touchees-c1bead2a-e1f9-11ed-87f3-f6e218170d12"
"False","True","Un homme tué par un tir d’arme à feu dans une discothèque, près d’Angers","https://www.ouest-france.fr/societe/faits-divers/un-homme-tue-par-un-tir-darme-a-feu-dans-une-discotheque-pres-dangers-f0c33220-e1c3-11ed-908e-9b680907ca67"
"False","True","Mystère autour d’une voiture échouée sur une plage de Loire-Atlantique","https://www.ouest-france.fr/pays-de-la-loire/saint-brevin-les-pins-44250/mystere-autour-dune-voiture-echouee-sur-une-plage-de-saint-brevin-les-pins-3abc0d14-e1c1-11ed-908e-9b680907ca67"
"False","True","Frappé à coups de couteau près de Nantes, un jeune homme dans un état grave","https://www.ouest-france.fr/societe/faits-divers/frappe-a-coups-de-couteau-pres-de-nantes-un-jeune-homme-dans-un-etat-grave-81169adc-e1c5-11ed-87f3-f6e218170d12"
"False","True","CARTE. Guerre en Ukraine : manifestation à Paris, visite de Clément Beaune… Le point du jour","https://www.ouest-france.fr/europe/ukraine/carte-guerre-en-ukraine-manifestation-a-paris-visite-de-clement-beaune-le-point-du-jour-290368f2-e201-11ed-87f3-f6e218170d12"
"False","True","EN IMAGES. La première année du deuxième quinquennat d’Emmanuel Macron résumée en dix photos","https://www.ouest-france.fr/politique/emmanuel-macron/en-images-la-premiere-annee-du-deuxieme-quinquennat-demmanuel-macron-resumee-en-dix-photos-87dc0700-e1c3-11ed-908e-9b680907ca67"
"False","True","Russie. Un divorce pour éviter les sanctions françaises liées la guerre en Ukraine","https://www.ouest-france.fr/monde/guerre-en-ukraine/un-divorce-pour-eviter-les-sanctions-francaises-796d9f1a-e1cf-11ed-908e-9b680907ca67"
"False","True","La France promet des bateaux, des autobus et des rails pour soutenir l’Ukraine","https://www.ouest-france.fr/monde/guerre-en-ukraine/la-france-promet-des-bateaux-des-autobus-et-des-rails-pour-soutenir-lukraine-021ac5ae-e1df-11ed-87f3-f6e218170d12"
"False","True","REPORTAGE. Ukraine : avant la fin de la guerre, le grand chantier de la reconstruction a commencé","https://www.ouest-france.fr/monde/guerre-en-ukraine/reportage-ukraine-avant-la-fin-de-la-guerre-le-grand-chantier-de-la-reconstruction-a-commence-8684349e-df76-11ed-903a-9f7cc194f75b"
"False","True","Ligue 1. Le FC Lorient battu par un solide Toulouse au Moustoir","https://www.ouest-france.fr/sport/football/ligue-1/direct/direct-fc-lorient-toulouse-fc-suivez-en-live-le-match-de-la-32e-journee-de-ligue-1-a9b7ef48-e109-11ed-88d5-e9de6c339278"
"False","False","VIDÉO. Retour sur la journée de manifestation contre l'A69","https://www.ouest-france.fr/region-occitanie/tarn/video-retour-sur-la-journee-de-manifestation-contre-l-a69-2a7bbed2-b2b9-4a0f-8de9-af54da6a3b61"
"False","False","Stade Rennais. C’est dans la tête que ça va se jouer !","https://www.ouest-france.fr/sport/football/stade-rennais/stade-rennais-cest-dans-la-tete-que-ca-va-se-jouer-116c3a1e-e0e6-11ed-88d5-e9de6c339278"
"False","True","CARTE. Guerre en Ukraine : manifestation à Paris, visite de Clément Beaune… Le point du jour","https://www.ouest-france.fr/europe/ukraine/carte-guerre-en-ukraine-manifestation-a-paris-visite-de-clement-beaune-le-point-du-jour-290368f2-e201-11ed-87f3-f6e218170d12"
"True","False","Rugby. Fédérale 3 (32 e de finale aller) : Les Sables s’offrent la première manche","https://www.ouest-france.fr/sport/rugby/rugby-federale-3-32-e-de-finale-aller-les-sables-soffrent-la-premiere-manche-9f2bc5d6-e1f9-11ed-a413-0a476515e57d"
"False","False","Handball. Le PSG écrase Montpellier et repasse devant Nantes en tête du championnat","https://www.ouest-france.fr/sport/handball/handball-le-psg-ecrase-montpellier-et-repasse-devant-nantes-en-tete-du-championnat-c3f505dc-e1ed-11ed-908e-9b680907ca67"
"False","True","DIRECT. OL – OM : les Lyonnais égalisent dans le choc des Olympiques","https://www.ouest-france.fr/sport/football/ligue-1/direct/direct-lyon-marseille-suivez-la-rencontre-de-la-32e-journee-de-ligue-en-direct-ef6e2bc6-e08a-11ed-85f8-8628b3aa7259"
"True","False","Futsal. D1 : les Lavallois font un pas de plus vers la première place","https://www.ouest-france.fr/sport/football/etoile-lavalloise-futsal-club/futsal-d1-les-lavallois-font-un-pas-de-plus-vers-la-premiere-place-209379fa-e1e8-11ed-a413-0a476515e57d"
"False","False","Hautes-Alpes : jusqu’à 2 00 participants à une rave-party non déclarée","https://www.ouest-france.fr/societe/faits-divers/hautes-alpes-pres-de-2-000-personnes-participent-a-une-rave-party-non-declaree-f6a5728a-e1e0-11ed-87f3-f6e218170d12"
"False","True","Plus de 3000 manifestants à Bayonne pour réclamer des moyens pour la langue basque","https://www.ouest-france.fr/nouvelle-aquitaine/pyrenees-atlantiques/plus-de-3000-manifestants-a-bayonne-pour-reclamer-des-moyens-pour-la-langue-basque-2e99bfd4-2e32-45c4-b8db-15b29b3b6ead"
"False","False","Chirurgien en Creuse, il est l’un des rares « médecins des musiciens » de France","https://www.ouest-france.fr/leditiondusoir/2023-04-21/chirurgien-en-creuse-il-est-l-un-des-rares-medecins-des-musiciens-de-france-26a4daa6-e094-4066-a1fc-ae9bd5b350cb"
"False","False","Après Sainte-Soline, l’A69 ? Les opposants à l’autoroute Castres-Toulouse se mobilisent ce week-end","https://www.ouest-france.fr/nouvelle-aquitaine/sainte-soline-79120/apres-sainte-soline-la69-les-opposants-a-lautoroute-castres-toulouse-se-mobilisent-ce-week-end-7b60d754-e01e-11ed-b28f-3a8de8f2f6d3"
