"premium","picture","title","url"
"False","False","Guerre en Ukraine","https://www.bfmtv.com/international/europe/ukraine-russie-le-bras-de-fer-mondial_DN-201904150203.html"
"False","False","Festival de Cannes","https://www.bfmtv.com/people/festival-de-cannes_DN-202108310628.html"
"False","False","Réforme des retraites","https://www.bfmtv.com/economie/economie-social/reforme-des-retraites_DN-202108310622.html"
"False","True","Vers une nouvelle pénurie d'enseignants à la rentrée?","https://www.bfmtv.com/societe/education/vers-une-nouvelle-penurie-d-enseignants-a-la-rentree_AV-202305220001.html"
"False","True","Profs absents non-remplacés: des parents d'élèves attaquent à nouveau l'Etat en justice","https://www.bfmtv.com/societe/education/profs-absents-non-remplaces-des-parents-d-eleves-attaquent-a-nouveau-l-etat-en-justice_AD-202305220498.html"
"False","True","Un groupe ukrainien de ""sabotage"" signalé près de la frontière dans la région russe de Belgorod","https://www.bfmtv.com/international/asie/russie/un-groupe-ukrainien-de-sabotage-signale-pres-de-la-frontiere-dans-la-region-russe-de-belgorod_AD-202305220511.html"
"False","True","Guerre en Ukraine: Moscou met en garde les États-Unis en cas d'éventuelles frappes avec des F-16 en Crimée","https://www.bfmtv.com/international/asie/russie/guerre-en-ukraine-moscou-met-en-garde-les-etats-unis-en-cas-d-eventuelles-frappes-avec-des-f-16-en-crimee_AN-202305220128.html"
"False","True","Disparition de Karine: les zones d'ombre de l'enquête sur la disparition de la mère de famille","https://www.bfmtv.com/police-justice/disparition-de-karine-les-zones-d-ombre-de-l-enquete-sur-la-disparition-de-la-mere-de-famille_AN-202305220347.html"
"False","False","""Elle est partie volontairement, c'est certain"": le mari de Karine témoigne après sa…","https://www.bfmtv.com/police-justice/elle-est-partie-volontairement-c-est-certain-le-mari-de-karine-temoigne-apres-sa-disparition_AV-202305200283.html"
"False","True","Disparition de Karine Esquivillon: l'un de ses enfants avait également signalé sa disparition","https://www.bfmtv.com/police-justice/disparition-de-karine-esquivillon-l-un-de-ses-enfants-avait-egalement-signale-sa-disparition_AN-202305220475.html"
"False","True","Qui étaient Paul, Manon et Steven, les trois policiers tués dans un accident de la route dans le Nord?","https://www.bfmtv.com/grand-lille/qui-etaient-paul-manon-et-steven-les-trois-policiers-tues-dans-un-accident-de-la-route-dans-le-nord_AV-202305220121.html"
"False","False","Ce que l'on sait de l'accident qui a fait quatre morts dont trois policiers à…","https://www.bfmtv.com/grand-lille/ce-que-l-on-sait-de-l-accident-qui-a-fait-quatre-morts-dont-trois-policiers-a-villeneuve-d-ascq_AV-202305210258.html"
"False","True","""Un effondrement pour le Nord"": Gérald Darmanin annonce un hommage national pour les trois policiers tués dans un…","https://www.bfmtv.com/grand-lille/un-effondrement-pour-le-nord-gerald-darmanin-annonce-un-hommage-national-pour-les-trois-policiers-tues-dans-un-accident_AN-202305220435.html"
"False","False","Mort de trois policiers dans le Nord: ""À notre connaissance, il n'y a pas eu de faute…","https://www.bfmtv.com/politique/mort-de-trois-policiers-dans-le-nord-a-notre-connaissance-il-n-y-a-pas-eu-de-faute-commise-par-les-policiers-affirme-gerald-darmanin_VN-202305220431.html"
"False","True","Un ""drame atroce"": le choc et l'émotion des habitants après la mort de trois policiers à Villeneuve-d'Ascq","https://www.bfmtv.com/grand-lille/un-drame-atroce-le-choc-et-l-emotion-des-habitants-apres-la-mort-de-trois-policiers-a-villeneuve-d-ascq_AV-202305220390.html"
"False","True","Pôles spécialisés, bracelets anti-rapprochement... Dupond-Moretti annonce des mesures contre les violences…","https://www.bfmtv.com/societe/poles-specialises-bracelets-anti-rapprochement-dupond-moretti-annonce-des-mesures-contre-les-violences-intrafamiliales_AD-202305220547.html"
"False","True","La soumission chimique par un proche, un fléau méconnu qui passe souvent ""sous les radars""","https://www.bfmtv.com/sante/la-soumission-chimique-par-un-proche-un-fleau-meconnu-qui-passe-souvent-sous-les-radars_AV-202305220459.html"
"False","True","La seule violence politique qui existe dans ce pays [...] c'est une violence d'extrême gauche. Pour Marion Maréchal, la violence d'ultradroite est une menace ""dérisoire""","https://www.bfmtv.com/politique/reconquete/pour-marion-marechal-la-violence-d-ultradroite-est-une-menace-derisoire_AV-202305190299.html"
"False","True","Des orages très violents entraînent des inondations dans l'Allier","https://www.bfmtv.com/meteo/intemperies/des-orages-tres-violents-entrainent-des-inondations-dans-l-allier_AN-202305220441.html"
"False","True","Après 34 ans de service, les TGV bleus et gris vont disparaître","https://www.bfmtv.com/economie/entreprises/transports/apres-34-ans-de-service-les-tgv-bleus-et-gris-vont-disparaitre_AV-202305220576.html"
"False","True","Victime d'insultes racistes, expulsé, défendu par Mbappé... Pourquoi l'affaire Vinicius enflamme l'Espagne","https://rmcsport.bfmtv.com/football/liga/racisme-en-espagne-cinq-questions-pour-comprendre-l-affaire-vinicius-qui-explose-finalement-apres-de-longs-mois_AV-202305220360.html"
"False","True","Boxe: le principal suspect dans le meurtre de Wilfried Florentin a été mis en examen et écroué","https://rmcsport.bfmtv.com/sports-de-combat/boxe/boxe-le-principal-suspect-dans-le-meurtre-de-wilfried-florentin-a-ete-mis-en-examen-et-ecroue_AV-202305220569.html"
"False","True","E-sport: qui sont les joueurs de Vitality, vainqueurs du Major Counter-Strike de Paris?","https://www.bfmtv.com/tech/gaming/e-sport-qui-sont-les-joueurs-de-vitality-vainqueurs-du-major-counter-strike-de-paris_AV-202305220539.html"
"False","True","Facebook écope d'une amende record de 1,2 milliard d'euros pour des transferts illégaux de données","https://www.bfmtv.com/tech/facebook/facebook-ecope-d-une-amende-record-de-1-2-milliard-d-euros-pour-des-transferts-illegaux-de-donnees_AV-202305220368.html"
"False","True","""Les Recopieurs"": LR dévoile son plan immigration, le RN dénonce un ""copier-coller"" de son programme","https://www.bfmtv.com/politique/les-republicains/les-recopieurs-lr-devoile-son-plan-immigration-le-rn-denonce-un-copier-coller-de-son-programme_AN-202305220358.html"
"False","True","États-Unis: selon des scientifiques, New York s'affaisse sous le poids de ses gratte-ciels","https://www.bfmtv.com/international/amerique-nord/etats-unis/etats-unis-selon-des-scientifiques-new-york-s-affaisse-sous-le-poids-de-ses-gratte-ciels_AV-202305220562.html"
"False","True","Qui étaient Paul, Manon et Steven, les trois policiers tués dans un accident de la route…","https://www.bfmtv.com/grand-lille/qui-etaient-paul-manon-et-steven-les-trois-policiers-tues-dans-un-accident-de-la-route-dans-le-nord_AV-202305220121.html"
"False","True","""Elle est partie volontairement, c'est certain"": le mari de Karine témoigne après sa…","https://www.bfmtv.com/police-justice/elle-est-partie-volontairement-c-est-certain-le-mari-de-karine-temoigne-apres-sa-disparition_AV-202305200283.html"
"False","True","G7 au Japon: pourquoi Volodymyr Zelensky a-t-il voyagé jusqu'à Hiroshima avec un avion…","https://www.bfmtv.com/international/europe/ukraine/g7-au-japon-pourquoi-volodymyr-zelensky-a-t-il-voyage-jusqu-a-hiroshima-avec-un-avion-francais_AN-202305200277.html"
"False","True","Une hausse de 4°C en 2100: comment le gouvernement se prépare à un tel scénario climatique","https://www.bfmtv.com/environnement/climat/une-hausse-de-4deg-c-en-2100-comment-le-gouvernement-se-prepare-a-un-tel-scenario-climatique_AV-202305210185.html"
"False","True","Italie: des militants écologistes noircissent l'eau de la fontaine de Trevi à Rome","https://www.bfmtv.com/international/europe/italie/italie-des-militants-ecologistes-noircissent-l-eau-de-la-fontaine-de-trevi-a-rome_AD-202305210401.html"
"False","True","Le géant français de la volaille LDC craint d'affronter un nouvel épisode de grippe aviaire","https://www.tradingsat.com/ldc-FR0013204336/actualites/ldc-le-geant-francais-de-la-volaille-ldc-craint-d-affronter-un-nouvel-episode-de-grippe-aviaire-1069727.html"
"False","True","Roissy: encore de longues files d'attente pour passer les contrôles de police ce lundi","https://www.bfmtv.com/economie/entreprises/transports/roissy-encore-de-longues-files-d-attente-pour-passer-les-controles-de-police-ce-lundi_AN-202305220577.html"
"False","True","Après 34 ans de service, les TGV bleus et gris vont disparaître","https://www.bfmtv.com/economie/entreprises/transports/apres-34-ans-de-service-les-tgv-bleus-et-gris-vont-disparaitre_AV-202305220576.html"
"False","True","Guerre des étoiles: la France va accélérer le développement des satellites 🛰️","https://www.bfmtv.com/economie/guerre-des-etoiles-la-france-va-accelerer-le-developpement-des-satellites_VN-202305220571.html"
"False","True","Face au nombre de vols annulés, une proposition de loi vise à restreindre le droit de grève des contrôleurs aériens","https://www.bfmtv.com/replay-emissions/la-chronique-eco-nicolas-doze/face-au-nombre-de-vols-annules-une-proposition-de-loi-vise-a-restreindre-le-droit-de-greve-des-controleurs-aeriens_VN-202305220542.html"
"False","True","Victime d'insultes racistes, expulsé, défendu par Mbappé... Pourquoi l'affaire Vinicius enflamme l'Espagne","https://rmcsport.bfmtv.com/football/liga/racisme-en-espagne-cinq-questions-pour-comprendre-l-affaire-vinicius-qui-explose-finalement-apres-de-longs-mois_AV-202305220360.html"
"False","True","Roland-Garros: les joueurs à suivre, les Français, le public… Tout savoir sur les qualifications","https://rmcsport.bfmtv.com/tennis/roland-garros/roland-garros-les-joueurs-a-suivre-les-francais-le-public-tout-savoir-sur-les-qualifications_AV-202305220382.html"
"False","True","Tennis: l’énorme amende de Gaston pour un acte d’antijeu","https://rmcsport.bfmtv.com/tennis/tennis-l-enorme-amende-de-gaston-pour-un-acte-d-antijeu_AV-202305220414.html"
"False","True","Giro: critiquée, la bataille pour le général va prendre une autre tournure en dernière semaine","https://rmcsport.bfmtv.com/cyclisme/tour-d-italie/giro-critiquee-la-bataille-pour-le-general-va-prendre-une-autre-tournure-en-derniere-semaine_AV-202305220413.html"
"False","True","Auxerre-PSG: porté par un doublé de Mbappé, Paris a ""une main sur le trophée""","https://rmcsport.bfmtv.com/football/ligue-1/auxerre-psg-porte-par-un-double-de-mbappe-paris-a-une-main-sur-le-trophee_AV-202305210413.html"
"False","True","25 ans de ""Harry Potter"" : l'histoire des illustrations d'origine, qui reparaissent en librairie","https://www.bfmtv.com/culture/harry-potter-l-histoire-des-illustrations-d-origine-qui-reparaissent-en-librairie_GN-202301190278.html"
"False","True","Ligne rouge - Bac Nord, ils parlent enfin","https://www.bfmtv.com/police-justice/ligne-rouge-bac-nord-ils-parlent-enfin_GN-202301160707.html"
"False","True","Les intelligences artificielles vont-elles remplacer les artistes ?","https://www.bfmtv.com/tech/les-intelligences-artificielles-vont-elles-remplacer-les-artistes_GN-202301120101.html"
"False","True","100 ans de la fondation de l'URSS : comment Poutine mobile le passé soviétique contre l'Ukraine","https://www.bfmtv.com/international/asie/russie/100-ans-de-la-fondation-de-l-urss-comment-poutine-mobilise-le-passe-sovietique-contre-l-ukraine_GN-202212300003.html"
"False","True","Une demande en hausse mais une production en baisse : le café survivra-t-il à sa popularité ?","https://www.bfmtv.com/economie/une-demande-en-hausse-mais-une-production-en-baisse-le-cafe-survivra-t-il-a-sa-popularite_GN-202212270016.html"
"False","True","Affaires Jubillar, Daval, le Tan...la reconstitution ""moment clé"" d'une enquête criminelle","https://www.bfmtv.com/police-justice/affaires-jubillar-daval-le-tan-la-reconstitution-moment-cle-d-une-enquete-criminelle_GN-202212130035.html"
"False","True","Le Labyrinthe de Tim Burton ouvre ses portes à Paris","https://www.bfmtv.com/culture/le-labyrinthe-de-tim-burton-ouvre-ses-portes-a-paris_VN-202305220549.html"
"False","True","Apple va proposer des produits dérivés de la série Ted Lasso sur son magasin en ligne","https://www.bfmtv.com/tech/apple/apple-va-proposer-des-produits-derives-de-ted-lasso-sur-son-magasin-en-ligne_AV-202305220531.html"
"False","True","L'entreprise des parents de Kate Middleton revendue après avoir été plombée par la crise sanitaire","https://www.bfmtv.com/economie/entreprises/l-entreprise-des-parents-de-kate-middleton-revendue-apres-avoir-ete-plombee-par-la-crise-sanitaire_AV-202305220470.html"
