"premium","picture","title","url"
"False","True","Les manifestations parisiennes sont-elles moins tendues qu’avant ?","https://www.20minutes.fr/societe/4022940-20230211-reforme-retraites-pourquoi-manifestations-parisiennes-elles-moins-tendues-avant"
"False","True","« Sublime », « magnifique »… Et si cette affiche était la plus excitante de l’histoire du Tournoi ?","https://www.20minutes.fr/sport/6_nations/4022961-20230211-irlande-france-sublime-magnifique-si-affiche-plus-excitante-histoire-tournoi"
"False","True","Stromae et Angèle artistes de l'année, triplé pour Orelsan, qui dépasse Johnny","https://www.20minutes.fr/culture/4023026-20230210-victoires-musique-2023-stromae-sacre-artiste-masculin"
"False","True","Pierre Palmade grièvement blessé dans un accident de la route, son pronostic vital engagé","https://www.20minutes.fr/culture/4023025-20230210-pierre-palmade-gravement-blesse-accident-route-pronostic-vital-engage"
"False","True","Comment se constituer dès maintenant un complément de revenus ?","https://www.20minutes.fr/economie/4021555-20230211-reforme-retraites-comment-constituer-maintenant-complement-revenus"
"False","True","Que pensez-vous d'un retour à l'ancien découpage de la Nouvelle-Aquitaine ?","https://www.20minutes.fr/societe/4022719-20230210-nouvelle-aquitaine-pensez-retour-ancien-decoupage-region"
"False","True","Rennes garde ses terrains pour éviter la spéculation","https://www.20minutes.fr/societe/4022913-20230211-rennes-vend-plus-metropole-garde-terrains-eviter-speculation"
"False","True","Le parcours du cortège de la manifestation du jour à Paris","https://www.20minutes.fr/societe/reforme_des_retraites/4022876-20230210-manifestation-11-fevrier-parcours-cortege-paris"
"False","True","« On utilise l'intelligence artificielle pour protéger la population, pas pour la surveiller »","https://www.20minutes.fr/societe/4022676-20230209-intelligence-artificielle-utilise-gendarmerie-proteger-population-surveiller"
"False","True","Comment se constituer des revenus en complément de sa retraite ?","https://www.20minutes.fr/economie/4021555-20230211-reforme-retraites-comment-constituer-maintenant-complement-revenus"
"False","True","Une grève reconductible au retour des vacances ? La CGT-Cheminots y songe","https://www.20minutes.fr/societe/reforme_des_retraites/4023012-20230210-reforme-retraites-greve-reconductible-retour-vacances-cgt-cheminots-songe"
"False","True","L’Assemblée nationale adopte la suppression des régimes spéciaux","https://www.20minutes.fr/societe/reforme_des_retraites/4022949-20230210-reforme-retraites-assemblee-nationale-adopte-suppression-regimes-speciaux"
"False","True","Huit interpellations après la manifestation des lycéens à Béziers","https://www.20minutes.fr/societe/reforme_des_retraites/4022947-20230210-reforme-retraites-huit-interpellations-apres-manifestation-lyceens-beziers"
"False","True","La tablette Honor Pad 8 parvient à se distinguer sans nous ruiner","https://www.20minutes.fr/high-tech/4022686-20230210-honor-pad-8-tablette-trouve-bonne-recette-divertir-ruiner"
"False","True","Un père syrien et son fils enfin réunis après le séisme","https://www.20minutes.fr/monde/syrie/4022994-20230210-seismes-turquie-syrie-pere-fils-reunis-trois-jours-apres-catastrophe"
"False","True","Faut-il interdire l’élevage du Cavalier King Charles ou du carlin ?","https://www.20minutes.fr/planete/4021821-20230210-animaux-2-0-faut-interdire-elevage-cavalier-king-charles-bouledogue-francais"
"False","True","L'Afrique queer","https://www.20minutes.fr/diaporama/diaporama-15483-images-zanele-muholi-photographe-activiste-sud-africain-e-mep"
"False","True","Larmes et colère","https://www.20minutes.fr/diaporama/diaporama-15479-images-funerailles-tyre-nichols-memphis"
"False","True","Les seniors globalement plus intéressés par le sexe que les jeunes","https://www.20minutes.fr/podcast/4022510-20230210-tout-sexplique-seniors-globalement-plus-interesses-sexe-jeunes"
"False","True","Et si c’était la crise de la quarantaine ?","https://www.20minutes.fr/podcast/4022210-20230209-minute-papillon-crise-quarantaine-grave"
"False","True","Marc Dutroux sur TikTok, comment est-ce possible ?","https://www.20minutes.fr/podcast/4022178-20230207-minute-papillon-criminel-marc-dutroux-tiktok-comment-possible"
"False","True","Le rappeur Hatik, coincé dans le brouillard avec ses voisins","https://www.20minutes.fr/cinema/4022001-20230207-tour-rappeur-hatik-coince-brouillard-voisins-depuis-trop-longtemps"
"False","True","Les Etats-Unis abattent un « engin volant à haute altitude »","https://www.20minutes.fr/monde/4023020-20230210-etats-unis-viennent-abattre-engin-volant-haute-altitude-dessus-alaska"
"False","True","Que pensez-vous de redécouper l'Auvergne-Rhône-Alpes?","https://www.20minutes.fr/societe/4022948-20230210-auvergne-rhone-alpes-pensez-redecouper-region"
"False","True","Le pronostic vital de Pierre Palmade engagé après un accident de la route","https://www.20minutes.fr/culture/4023025-20230210-pierre-palmade-gravement-blesse-accident-route-pronostic-vital-engage"
"False","True","Un important point de deal démantelé dans un quartier sensible de Nice","https://www.20minutes.fr/faits_divers/faits-divers-nice/4022995-20230210-nice-important-point-deal-chiffre-affaires-quotidien-15-000-euros-demantele"
"False","True","Percuté par un cycliste ivre, un jeune à trottinette finit à l’hôpital","https://www.20minutes.fr/faits_divers/faits-divers-toulouse/4022987-20230210-toulouse-apres-avoir-percute-cycliste-ivre-homme-trottinette-finit-hopital"
"False","True","La tablette Honor Pad 8 a-t-elle trouvé la bonne recette pour nous divertir sans nous ruiner ?","https://www.20minutes.fr/high-tech/4022686-20230210-honor-pad-8-tablette-trouve-bonne-recette-divertir-ruiner"
"False","True","La chercheuse franco-iranienne Fariba Adelkhah sortie de prison","https://www.20minutes.fr/monde/4023040-20230211-iran-chercheuse-franco-iranienne-fariba-adelkhah-sortie-prison"
"False","True","Karim Leklou, alter égo du réalisateur dont le film rend hommage au frère mort à Saint-Cyr","https://www.20minutes.fr/cinema/4022005-20230206-france-rachid-hami-met-cote-colere-rendre-hommage-frere-victime-bahutage"
"False","True","Avec Kryptview, l’univers des cryptos devient plus clair","https://www.20minutes.fr/20-mint/4022543-20230208-kryptview-univers-cryptos-devient-moins-opaque"
"False","True","Peut-on innover et avoir de l’impact grâce au Web3 ?","https://www.20minutes.fr/20-mint/4021584-20230201-peut-innover-avoir-impact-grace-web3"
"False","True","RoverX vient au secours des collectionneurs de NFT","https://www.20minutes.fr/20-mint/4021545-20230201-roverx-vient-secours-collectionneurs-nft"
"False","True","Le pronostic vital de Pierre Palmade engagé après un accident de la route","https://www.20minutes.fr/culture/4023025-20230210-pierre-palmade-gravement-blesse-accident-route-pronostic-vital-engage"
"False","True","Le ballon chinois était équipé d’antennes de surveillance, selon Washington","https://www.20minutes.fr/monde/4022838-20230209-ballon-chinois-appareil-equipe-antennes-surveillance-faisait-partie-flotte-selon-washington"
"False","True","Stromae et Angèle artistes de l'année aux Victoires, triplé pour Orelsan","https://www.20minutes.fr/culture/4023026-20230210-victoires-musique-2023-stromae-sacre-artiste-masculin"
"False","True","L'enseigne de chaussures San Marina a l'espoir dans les chaussettes","https://www.20minutes.fr/societe/4022922-20230210-va-vers-liquidation-san-marina-enseigne-chaussures-espoir-chaussettes"
"False","True","Faut-il interdire l’élevage du Cavalier King Charles ou du carlin ?","https://www.20minutes.fr/planete/4021821-20230210-animaux-2-0-faut-interdire-elevage-cavalier-king-charles-bouledogue-francais"
"False","True","Ce chien a passé des mois dans un désert américain au milieu des coyotes","https://www.20minutes.fr/monde/4022929-20230210-chien-passe-mois-desert-americain-milieu-coyotes-avant-etre-secouru"
"False","True","Les Etats-Unis viennent d’abattre un « engin volant à haute altitude »","https://www.20minutes.fr/monde/4023020-20230210-etats-unis-viennent-abattre-engin-volant-haute-altitude-dessus-alaska"
"False","True","Les prix de l’immobilier chutent en Seine-Saint-Denis","https://www.20minutes.fr/economie/immobilier/4022938-20230210-seine-saint-denis-chute-colossale-prix-immobilier-trois-derniers-mois"
"False","True","Dix-neuf ans de prison pour l’influenceur qui a tué un internaute en direct","https://www.20minutes.fr/justice/4023015-20230210-seine-saint-denis-influenceur-condamne-19-ans-prison-avoir-tue-internaute-direct"
"False","True","Le corps sans visage découvert en mer au Havre a été identifié","https://www.20minutes.fr/faits_divers/4022928-20230210-havre-corps-visage-decouvert-mer-identifie"
"False","True","Un eurodéputé italien arrêté dans l'affaire de corruption","https://www.20minutes.fr/monde/4023022-20230210-corruption-parlement-europeen-eurodepute-italien-arrete-naples"
"False","True","Le député LFI Thomas Portes exclu 15 jours de l’Assemblée","https://www.20minutes.fr/politique/4023017-20230210-lfi-depute-thomas-portes-exclut-15-jours-assemblee-nationale-apres-tweet-controverse"
"False","True","« Grease », « Clueless »… Découvrez les meilleures pubs du Super Bowl","https://www.20minutes.fr/culture/4023041-20230211-super-bowl-2023-breaking-bad-grease-clueless-decouvrez-meilleures-pubs"
"False","True","Un influenceur condamné à dix-neuf ans de prison pour avoir tué un internaute en direct","https://www.20minutes.fr/justice/4023015-20230210-seine-saint-denis-influenceur-condamne-19-ans-prison-avoir-tue-internaute-direct"
"False","True","Les engins traînants, très efficaces mais à quel prix pour les fonds marins ?","https://www.20minutes.fr/planete/4022688-20230210-peche-engins-trainants-tres-efficaces-prix-fonds-marins"
"False","True","Poutine s'exprimera avant l'anniversaire du conflit","https://www.20minutes.fr/monde/russie/4023021-20230210-guerre-ukraine-vladimir-poutine-exprimera-quelques-jours-avant-anniversaire-conflit"
"False","True","L’affaire Adrien Quatennens n’en finit plus de diviser les insoumis","https://www.20minutes.fr/politique/4023002-20230210-affaire-adrien-quatennens-finit-plus-diviser-insoumis"
